,user_input,retrieved_contexts,reference_contexts,response,reference,context_recall,factual_correctness,faithfulness,semantic_similarity,llm_context_precision_without_reference,llm_context_precision_with_reference,non_llm_context_recall,context_entity_recall,noise_sensitivity_relevant,answer_relevancy
0,What are some notable Byzantine monuments in Thessaloniki?,"['10\n1st walk: \nUNESCO BYZANTINE MONUMENTS\nThessaloniki has been  \none of the first towns to \nknow the Christian religion by \nthe Apostle Paul; during the \nByzantine period it used to be \nthe second most important \ncity of the empire (co-reigning \ncity) after Constantinople. \nAt that time (4th – 15th c.), \nChristian monuments and \nchurches were constructed in \nthe town, and these make up \na diachronic typology with a \ndecisive influence on the entire \nByzantine world. The following \nearly-Christian and Byzantine \nmonuments of the town are \nconsidered to be excellent \nspecimens of the Byzantine \nchurch-building and art, and \nfor this reason UNESCO \ndeclared them to be World \nHeritage Monuments, in 1988. \nA tour across this unique \nopen-air Byzantine museum  \nis truly a special experience.\n1 \t\x07HOLY TWELVE  \nAPOSTLES CHURCH\nOne of the town’s oldest \nchurches was built in 1310 – \n1314 under the sponsorship  \nof Patriarch Nephon I. It used \nto be a katholicon [main church] \nof a monastery dedicated to \nTheotokos [Mother of God] as \nshown by the mural depicting \nTheotokos and the Founder, \nas well as by the iconography \non the aisle with images of \nthe Holy Virgin’s life.', 'The place was fully \nrenovated in 1995 and in \n2003. It is considered one \nof the top luxury hotels in \nGreece. It is also the regular \nchoice of stay for the prime \nminister and ministers while \nattending the Thessaloniki \nInternational Trade Fair; among \nits clientele are also many \nGreek and foreign personalities \n(politicians, artists etc). \n1.3  Umbrellas.\nThis emblematic sculpture \n(height: 13 m.) created by the \nsignificant Greek visual artist \nGeorge Zongolopoulos, was \nfitted in place in 1997; another \nof his sculptures by the same \ntitle is decorating the entrance \nto the Macedonian Museum \nof Contemporary Art, (see p. \n31). In 1993 this piece of art \nrepresented Greece in the \nVenice Biennale. It is one of the \nnewest and most photographed \nmonuments of the city.\n1.4  Agioi Kyrillos and \nMethodios [Saints Cyril and \nMethodius] Church.\nThis imposing church (on \nMegalou Alexandrou Ave.) is \namong the city’s newest and is \ndedicated to the two brothers \nwho contributed decisively in \nbringing Christianity to the \nSlavs in the 9th c. and devised \na new type of writing in the \nSlavic language. A well-tended \ngarden surrounds the church. \n55\n56']","[""UNESCO BYZANTINE MONUMENTS Thessaloniki has been one of the first towns to know the Christian religion by the Apostle Paul; during the Byzantine period it used to be the second most important city of the empire (co-reigning city) after Constantinople. At that time (4th – 15th c.), Christian monuments and churches were constructed in the town, and these make up a diachronic typology with a decisive influence on the entire Byzantine world. The following early-Christian and Byzantine monuments of the town are considered to be excellent specimens of the Byzantine church-building and art, and for this reason UNESCO declared them to be World Heritage Monuments, in 1988. A tour across this unique open-air Byzantine museum is truly a special experience. 1 \x07HOLY TWELVE APOSTLES CHURCH One of the town’s oldest churches was built in 1310 – 1314 under the sponsorship of Patriarch Nephon I. It used to be a katholicon [main church] of a monastery dedicated to Theotokos [Mother of God] as shown by the mural depicting Theotokos and the Founder, as well as by the iconography on the aisle with images of the Holy Virgin’s life. Out of the original monastery complex, -apart from the katholicon – there remain the NIKIS NIKIS GERMANOU SVOLOU IASONIDOU TSIMISKI VAS. IRAKLEIOU FILIPPOU AKROPOLEOS THEOTOKOPOULOU AKROPOLEOS OCHI AVENUE EPTAPYRGIOU SOFOKLEOUS OLYMPOU MONASTIRIOU KAZANTZAKI A N A G E NN I S E OS DAMONOS KALOU DRAGOUMANOU POLYTECHNIOU MITROPOLEOS ARISTOTELOUS DODEKANISOU LANGADA SALAMINOS ERMOU ANGELAKI ETHNIKIS AMYNAS AG. ANTONIOS AGIA THEODORA AG. ATHANASIOS AG. KONSTANTINOU YPAPANTI AGIOS STYLIANOS LAODI GITRIA TAXIARCHES AGIOS PAVLOS FANEROMENI AG. THEODOROI KALARI TSOPELA ISAVRON DELIOU IOANNI VELLIDI MAKRYGIANNI MITR. GENADIOU MODI PETROPOULAKIDON ARIANOU ARIANOU KLEISTHENOUS VIZYINOU KASTRON PANORMOU KES AMPATZOGLOU SKOPELOU PETRAS VASILIKO IRAKLEIAS SK SK KAVAFI ADRIANOUPOLEOS AIANT AGATHOUPOLEOS NG ROAD REDAISTO VYZOUKIDI VIZYINO THETIDOS AFXENTIOU MOUDANION PANEPISTIMIOU KALELPIDOS KONSTANTINOUPOLEOS SMYRNIS PYRGOU VRYANDOU KITROUS MELENIKOU PATR. IOAKEIM PALAION PATRON GERMANOU MICHAIL IO. ARMENOPOULOU IKTINOU KOMNINON SOLOMOU VLALI BALANOU ASKITOU VOGATSIKOU PLOUTARCHOU LASSANI MORKENTAOU TATI DRAGOUMI KYRIAKOU IOULIANOU SOKRATOUS EVRIPIDOU GYZI VLACHAVA AISCHYLOU ATHINAS MOREAS GKRATZIOU ATHONOS THEOFILOU PILEOS ANTIOCHOU VLATADON KASTOROS IGOUMENOU PERIANDROU POLYDOROU KLAFTHMONOS DRAGATSANIOU ACHTARI KARADIMOU DIONYSIOU EPIMENIDOU EVRYMEDONTOS AREOS ARTIS IRAKLIOU SYRAKOUSON PYDNAS KARAVANGELI TSAKALOF KIMONOS FLORINAS PLASTIRA FILIPPOU KLISTHENOUS FERON EVROU GKRATZIOU RAKTIVAN LAMPOUSIDI PASTER MAK KAMENIATOU PROFITI ILIA ATHINAS IFIKRATOUS PRASAKAKI STAVROU DIMOSTHENOUS KASTRITSIOU MENELAOU AMYNTA PELOPONNISOU PLATONOS DELMOUZOU AVDELA OUGKO KARATASOU KOUNTOURIOTI MIONIS CH. IATROU PAPANASTASIOU KLEISOURAS LAMPRAKI OLYMPIOU FEIDIOU FINTIA DAIDALOU VOULGAR THASO FREIDERIK NIKITARA IATRIDON THYRON KOZANIS KILKIS PONTOU NAFPLIOU VALTETSIOU KALPAKIOU LORDOU ELEFSINAS DELTA KONITSIS PLATONOS IPPOKRATOUS AGIOU DIMITRIOU VERMIOU SOUFLIOU BIZANIOU LECHO VOREIOU IPEIROU ARAP BOUBOUL KANARI KA AKI SOLOMOU LACHANA AGRAFON PSARON MIAOULI KAVALAS KRITIS LEVENTI KANARI GRAVIAS KYPROU FILIATRON ARACHTHOU TSACHILA AGRAFON KARVOUNIDI ERASMOU ELENIS KAPETAN NIKOLAOU PELOPONNISOU AGIOU PAVLOU MAKEDONOMACHON KONITSIS IKARON EL. VENIZELOU OMIROU IPEIROU KONTOSOGLOU PAPANIKOLI TEPELENIOU MEGARON VITSI KASTORIAS ARGYROKASTROU DIMITRIOU THASSOU FOKA PAPAFLESSA KOMNINON KONDYLI PANGKALOU KRITIS KRITIS EPIDAVROU LAMPRAKI CHORTIATI ELLIS ELPIDOS MAVROKORDATOU EPTAPYRGIOU EPTAPYRGIOU EPTAPYRGIOU EPTAPYRGIOU ANTHEON ATHANASIOU DIAKOU YPATROU GIALOUROU OU DODEKANISOU VAS. KONSTANTINOU MARKOU BOTSARI ANATOLIKIS ROMYLIAS U OI M R E V RIOU OPOS AISTOU DERMETZI APOLLONIADOS TYROLOIS BOROU PRIAMOU VORONOF OREIOU IPEIROU LATOMEION KATSONI ZALONGOU PAPANASTASIOU KAFKASOU METEORON KASSANDROU OLYMPIADOS A L. P A P A D O P O U L OU KASSANDROU OLYMPIADOS OLYMPOU POLYZOIDI AGIOU DIMITRIOU AGIOU DIMITRIOU AVRILIANIS ARKADIOUPOLEOS IFAISTIONOS ELPIDOS EL. VE NI ZE L O U NAVARINOU TYRNAVOU KOLOKOTRONI ARISTARCHOU KARAOLI PAPAGOU KASTAMONIS KARAVANGELI MATROZOU EVDOKIOU KESANIS KALLIKRATIAS VOULGAROKTONOU THEMISTOKLEOUS A R O G A X A N A KYPROU 28 OKTOVRIOU M. ASIAS ELLISPONTOU IT OIR U O T N U O K PARASKEVA NIGDIS ARAVYSSOU ALEXIOU TRANOU MOUSCHOUNTI KALAMPAKAS ROUZVELT ONOS SIOU OUMAN THOUKYDIDI ZARIFI SACHTOURI AKRITA KLIOS PERSEOS PYTHEOS RAKTIVAN ODYSSEOS SARAFI ETHN. ANTISTASEOS U O TIR K O M ID PARASKEVA PANIDOU OINOIS KARAOLI OLYMPOU ROMANIDI ARISTEIDOU SOULINI KRITIS DEXAMENI DIOS KALVOU EIRINIS PAPARIGOPOULOU PALAMA ZEFYRON MAVILI PINIOU GLADSTONOS THALIAS PRONOIAS SACHINI KRATEROU FILOTA SOURI ANTON SOUTSOU SYNGROU PTOLEMAION IOUSTINIANOU KARBOLA TOSITSA ZALIKI CHALKEON AMVROSIOU KRYSTALI ANTIGONIDON S T O U R N A R A MAKEDON O MACHON ELLISPONTOU LEFKOSIAS THER M OPYLON RIG A FE RAI O U KAFKASOU PANAGIAS FANEROMENIS EOS KAVAKION KORYDALLOU HMOU VOUTYRA YRILLOU PATR. FINTIA SANTAROZA SAPFOUS KARIOFYLLI AVEROF PANGAIOU AXIOU VAIOU PINDOU DOXIS VOTSI KALAPOTHAKI KATOUNI AIGYPTOU FRANGON DANAIDON AISOPOU ENOTIKON AFRODITIS NTEKA PAPATHANASIOU PAPADIMA GALANAKI IVANOF KAPATOU GDON HOUNTI CHATZITSIROU VAKCHOU STEFANAKI FARMAKI ODYSSEOS ODYSSEOS TANTALOU PROMITHEOS SAPFOUS NAVM. CHAPSA LIMNOU VALAORITI ORPHANIDI TANTALIDI OLYMPIOU DIAMANTI LOUI IPPODROMIOU NIKIFOROU DESPERE GOUNARI DIALETI DANGLI FILIKIS ETAIRIAS CHR. SMYRNIS MITR. IOSIF FOKA PANAGIA KARATZA KREMASTIS POLIORKITI SYNGROU VYRONOS AGIOS DIMITRIOS RIGA FERAIOU A R C H A I O T I T O N S E L E F K I D O N M E L E N I K O U PROX. KOROMILA PARASCHOU EPTAPYRGIO ANO POLI 40 EKKLISIES EVANGELISTRIA RIGAS FERAIOS KALLITHEA AXIOS MUNICIPAL PARK RODOCHORI EVANGELISTRIA'S CEMETERY KOLOKOTRONI TYROLOI VARNAS SQ. MOUSHOUNTI SQ. FANARIOTON SQ. ELEFTHERIAS SQ. EMPORIOU SQ. DIMOKRATIAS VARDARI SQ. KYPRION AGONISTON SQ. ARCHAIAS AG. SOFIAS AGORAS SQ. DIMITRION SQ. TERPSITHEA SQ. ROMFEI SQ. RAILWAY STATION SQ. RAILWAY ATION SQ. GALANOPOULOU SQ. SYNTRIVANIOU SQ. NAVARINOU SQ. SQ. SYKIES EAPOLI CHNI ZIDROU SQ. LYSSIATREIO AGIOS DIMITRIOS HOSPITAL GENERAL HOSPITAL OF THESSALONIKI G. GENNIMATAS U G O A 1 2 3 4 5 7 6 8 9 12 15 15 15 15 13 14 10 11 2. Southern view of Panagia Chalkeon Church. 3. Agia Sofia Church surrounded by a small garden.""]","Thessaloniki is rich in Byzantine heritage, making it an ideal destination for sightseeing, especially for a first-time visitor. Here are some notable Byzantine monuments you should consider exploring:

1. **Holy Twelve Apostles Church**: Built between 1310 and 1314 under the sponsorship of Patriarch Nephon I, this church is one of the oldest in Thessaloniki. It served as the main church of a monastery dedicated to Theotokos (Mother of God). The church features beautiful murals and iconography depicting the life of the Holy Virgin, offering a glimpse into Byzantine art and architecture.

2. **Hagia Sophia**: This iconic church, modeled after its namesake in Constantinople, is a UNESCO World Heritage site. Its impressive dome and intricate mosaics reflect the grandeur of Byzantine architecture. The church has been a significant religious site throughout history and is a must-visit for its historical and artistic value.

3. **Church of Saint Demetrius**: Dedicated to the patron saint of Thessaloniki, this church is renowned for its stunning mosaics and rich history. It was built on the site of the martyrdom of Saint Demetrius and has undergone several renovations over the centuries. The crypt beneath the church is particularly noteworthy.

4. **Church of the Acheiropoietos**: This church, dating back to the 5th century, is one of the oldest in the city. It features a unique architectural style and beautiful frescoes. The name ""Acheiropoietos"" means ""made without hands,"" referring to the miraculous icon of the Virgin Mary housed within.

5. **Rotunda**: Originally built as a mausoleum for Emperor Galerius, this massive structure has served various purposes throughout history, including a church and a mosque. Its impressive size and stunning mosaics make it a significant landmark in Thessaloniki.

These monuments not only showcase the city's Byzantine heritage but also provide excellent opportunities for photography and local interaction, enhancing your travel experience.","Thessaloniki is home to several notable Byzantine monuments, including the Holy Twelve Apostles Church, which was built between 1310 and 1314 and served as the main church of a monastery dedicated to Theotokos. These monuments are recognized for their architectural significance and were declared UNESCO World Heritage Monuments in 1988.",1.0,0.2,0.2682926829268293,0.7566635789067855,0.9999999999,0.9999999999,0.0,0.6249999992187499,,0.9759403641592762
1,What is Byzantine church-building and why is it important in Thessaloniki?,"['10\n1st walk: \nUNESCO BYZANTINE MONUMENTS\nThessaloniki has been  \none of the first towns to \nknow the Christian religion by \nthe Apostle Paul; during the \nByzantine period it used to be \nthe second most important \ncity of the empire (co-reigning \ncity) after Constantinople. \nAt that time (4th – 15th c.), \nChristian monuments and \nchurches were constructed in \nthe town, and these make up \na diachronic typology with a \ndecisive influence on the entire \nByzantine world. The following \nearly-Christian and Byzantine \nmonuments of the town are \nconsidered to be excellent \nspecimens of the Byzantine \nchurch-building and art, and \nfor this reason UNESCO \ndeclared them to be World \nHeritage Monuments, in 1988. \nA tour across this unique \nopen-air Byzantine museum  \nis truly a special experience.\n1 \t\x07HOLY TWELVE  \nAPOSTLES CHURCH\nOne of the town’s oldest \nchurches was built in 1310 – \n1314 under the sponsorship  \nof Patriarch Nephon I. It used \nto be a katholicon [main church] \nof a monastery dedicated to \nTheotokos [Mother of God] as \nshown by the mural depicting \nTheotokos and the Founder, \nas well as by the iconography \non the aisle with images of \nthe Holy Virgin’s life.', '13\n1st walk: \nUNESCO BYZANTINE MONUMENTS\nother name; there are also \nmany cafés and bars. In the \nadjoining Melenikou st. you will \nsee segments of the town’s \neastern walls.\n7 \t\x07AGIOS PANTELEIMONAS \nCHURCH\nIt is on Iasonidou st., pretty \nclose to Rotunda. According \nto certain scholars, this \nwas the main church of \nthe Monastery of Kyr Isaac \nor Theotokos Perivleptos, \nfounded by Jacob, the \nMetropolitan Bishop of \nThessaloniki (1295-1314). \nIt is a tetrastyle cross-in-\nsquare domed church with a \nsurrounding portico ending \nto the east in two chapels. \nDuring the Turkish Occupation \nit was changed into a mosque \nunder the name Ishakiye \nCamii (the mosque of Isaac). \nRemaining murals date to \nthe 13th – 14th c. and depict \nsaints and prelates as well  \nthe Virgin Mary.\n8 \t\x07\nAGIOS DIMITRIOS \nCHURCH\nIt is the best known Byzantine \nchurch of the town as Agios \nDimitrios [St. Demetrius] is \nThessaloniki’s patron saint. It \nwas built during the 7th c. on \nthe ruins of a 5th c. Basilica and \nin 1493 it was converted into \na mosque.']","[""UNESCO BYZANTINE MONUMENTS Thessaloniki has been one of the first towns to know the Christian religion by the Apostle Paul; during the Byzantine period it used to be the second most important city of the empire (co-reigning city) after Constantinople. At that time (4th – 15th c.), Christian monuments and churches were constructed in the town, and these make up a diachronic typology with a decisive influence on the entire Byzantine world. The following early-Christian and Byzantine monuments of the town are considered to be excellent specimens of the Byzantine church-building and art, and for this reason UNESCO declared them to be World Heritage Monuments, in 1988. A tour across this unique open-air Byzantine museum is truly a special experience. 1 \x07HOLY TWELVE APOSTLES CHURCH One of the town’s oldest churches was built in 1310 – 1314 under the sponsorship of Patriarch Nephon I. It used to be a katholicon [main church] of a monastery dedicated to Theotokos [Mother of God] as shown by the mural depicting Theotokos and the Founder, as well as by the iconography on the aisle with images of the Holy Virgin’s life. Out of the original monastery complex, -apart from the katholicon – there remain the NIKIS NIKIS GERMANOU SVOLOU IASONIDOU TSIMISKI VAS. IRAKLEIOU FILIPPOU AKROPOLEOS THEOTOKOPOULOU AKROPOLEOS OCHI AVENUE EPTAPYRGIOU SOFOKLEOUS OLYMPOU MONASTIRIOU KAZANTZAKI A N A G E NN I S E OS DAMONOS KALOU DRAGOUMANOU POLYTECHNIOU MITROPOLEOS ARISTOTELOUS DODEKANISOU LANGADA SALAMINOS ERMOU ANGELAKI ETHNIKIS AMYNAS AG. ANTONIOS AGIA THEODORA AG. ATHANASIOS AG. KONSTANTINOU YPAPANTI AGIOS STYLIANOS LAODI GITRIA TAXIARCHES AGIOS PAVLOS FANEROMENI AG. THEODOROI KALARI TSOPELA ISAVRON DELIOU IOANNI VELLIDI MAKRYGIANNI MITR. GENADIOU MODI PETROPOULAKIDON ARIANOU ARIANOU KLEISTHENOUS VIZYINOU KASTRON PANORMOU KES AMPATZOGLOU SKOPELOU PETRAS VASILIKO IRAKLEIAS SK SK KAVAFI ADRIANOUPOLEOS AIANT AGATHOUPOLEOS NG ROAD REDAISTO VYZOUKIDI VIZYINO THETIDOS AFXENTIOU MOUDANION PANEPISTIMIOU KALELPIDOS KONSTANTINOUPOLEOS SMYRNIS PYRGOU VRYANDOU KITROUS MELENIKOU PATR. IOAKEIM PALAION PATRON GERMANOU MICHAIL IO. ARMENOPOULOU IKTINOU KOMNINON SOLOMOU VLALI BALANOU ASKITOU VOGATSIKOU PLOUTARCHOU LASSANI MORKENTAOU TATI DRAGOUMI KYRIAKOU IOULIANOU SOKRATOUS EVRIPIDOU GYZI VLACHAVA AISCHYLOU ATHINAS MOREAS GKRATZIOU ATHONOS THEOFILOU PILEOS ANTIOCHOU VLATADON KASTOROS IGOUMENOU PERIANDROU POLYDOROU KLAFTHMONOS DRAGATSANIOU ACHTARI KARADIMOU DIONYSIOU EPIMENIDOU EVRYMEDONTOS AREOS ARTIS IRAKLIOU SYRAKOUSON PYDNAS KARAVANGELI TSAKALOF KIMONOS FLORINAS PLASTIRA FILIPPOU KLISTHENOUS FERON EVROU GKRATZIOU RAKTIVAN LAMPOUSIDI PASTER MAK KAMENIATOU PROFITI ILIA ATHINAS IFIKRATOUS PRASAKAKI STAVROU DIMOSTHENOUS KASTRITSIOU MENELAOU AMYNTA PELOPONNISOU PLATONOS DELMOUZOU AVDELA OUGKO KARATASOU KOUNTOURIOTI MIONIS CH. IATROU PAPANASTASIOU KLEISOURAS LAMPRAKI OLYMPIOU FEIDIOU FINTIA DAIDALOU VOULGAR THASO FREIDERIK NIKITARA IATRIDON THYRON KOZANIS KILKIS PONTOU NAFPLIOU VALTETSIOU KALPAKIOU LORDOU ELEFSINAS DELTA KONITSIS PLATONOS IPPOKRATOUS AGIOU DIMITRIOU VERMIOU SOUFLIOU BIZANIOU LECHO VOREIOU IPEIROU ARAP BOUBOUL KANARI KA AKI SOLOMOU LACHANA AGRAFON PSARON MIAOULI KAVALAS KRITIS LEVENTI KANARI GRAVIAS KYPROU FILIATRON ARACHTHOU TSACHILA AGRAFON KARVOUNIDI ERASMOU ELENIS KAPETAN NIKOLAOU PELOPONNISOU AGIOU PAVLOU MAKEDONOMACHON KONITSIS IKARON EL. VENIZELOU OMIROU IPEIROU KONTOSOGLOU PAPANIKOLI TEPELENIOU MEGARON VITSI KASTORIAS ARGYROKASTROU DIMITRIOU THASSOU FOKA PAPAFLESSA KOMNINON KONDYLI PANGKALOU KRITIS KRITIS EPIDAVROU LAMPRAKI CHORTIATI ELLIS ELPIDOS MAVROKORDATOU EPTAPYRGIOU EPTAPYRGIOU EPTAPYRGIOU EPTAPYRGIOU ANTHEON ATHANASIOU DIAKOU YPATROU GIALOUROU OU DODEKANISOU VAS. KONSTANTINOU MARKOU BOTSARI ANATOLIKIS ROMYLIAS U OI M R E V RIOU OPOS AISTOU DERMETZI APOLLONIADOS TYROLOIS BOROU PRIAMOU VORONOF OREIOU IPEIROU LATOMEION KATSONI ZALONGOU PAPANASTASIOU KAFKASOU METEORON KASSANDROU OLYMPIADOS A L. P A P A D O P O U L OU KASSANDROU OLYMPIADOS OLYMPOU POLYZOIDI AGIOU DIMITRIOU AGIOU DIMITRIOU AVRILIANIS ARKADIOUPOLEOS IFAISTIONOS ELPIDOS EL. VE NI ZE L O U NAVARINOU TYRNAVOU KOLOKOTRONI ARISTARCHOU KARAOLI PAPAGOU KASTAMONIS KARAVANGELI MATROZOU EVDOKIOU KESANIS KALLIKRATIAS VOULGAROKTONOU THEMISTOKLEOUS A R O G A X A N A KYPROU 28 OKTOVRIOU M. ASIAS ELLISPONTOU IT OIR U O T N U O K PARASKEVA NIGDIS ARAVYSSOU ALEXIOU TRANOU MOUSCHOUNTI KALAMPAKAS ROUZVELT ONOS SIOU OUMAN THOUKYDIDI ZARIFI SACHTOURI AKRITA KLIOS PERSEOS PYTHEOS RAKTIVAN ODYSSEOS SARAFI ETHN. ANTISTASEOS U O TIR K O M ID PARASKEVA PANIDOU OINOIS KARAOLI OLYMPOU ROMANIDI ARISTEIDOU SOULINI KRITIS DEXAMENI DIOS KALVOU EIRINIS PAPARIGOPOULOU PALAMA ZEFYRON MAVILI PINIOU GLADSTONOS THALIAS PRONOIAS SACHINI KRATEROU FILOTA SOURI ANTON SOUTSOU SYNGROU PTOLEMAION IOUSTINIANOU KARBOLA TOSITSA ZALIKI CHALKEON AMVROSIOU KRYSTALI ANTIGONIDON S T O U R N A R A MAKEDON O MACHON ELLISPONTOU LEFKOSIAS THER M OPYLON RIG A FE RAI O U KAFKASOU PANAGIAS FANEROMENIS EOS KAVAKION KORYDALLOU HMOU VOUTYRA YRILLOU PATR. FINTIA SANTAROZA SAPFOUS KARIOFYLLI AVEROF PANGAIOU AXIOU VAIOU PINDOU DOXIS VOTSI KALAPOTHAKI KATOUNI AIGYPTOU FRANGON DANAIDON AISOPOU ENOTIKON AFRODITIS NTEKA PAPATHANASIOU PAPADIMA GALANAKI IVANOF KAPATOU GDON HOUNTI CHATZITSIROU VAKCHOU STEFANAKI FARMAKI ODYSSEOS ODYSSEOS TANTALOU PROMITHEOS SAPFOUS NAVM. CHAPSA LIMNOU VALAORITI ORPHANIDI TANTALIDI OLYMPIOU DIAMANTI LOUI IPPODROMIOU NIKIFOROU DESPERE GOUNARI DIALETI DANGLI FILIKIS ETAIRIAS CHR. SMYRNIS MITR. IOSIF FOKA PANAGIA KARATZA KREMASTIS POLIORKITI SYNGROU VYRONOS AGIOS DIMITRIOS RIGA FERAIOU A R C H A I O T I T O N S E L E F K I D O N M E L E N I K O U PROX. KOROMILA PARASCHOU EPTAPYRGIO ANO POLI 40 EKKLISIES EVANGELISTRIA RIGAS FERAIOS KALLITHEA AXIOS MUNICIPAL PARK RODOCHORI EVANGELISTRIA'S CEMETERY KOLOKOTRONI TYROLOI VARNAS SQ. MOUSHOUNTI SQ. FANARIOTON SQ. ELEFTHERIAS SQ. EMPORIOU SQ. DIMOKRATIAS VARDARI SQ. KYPRION AGONISTON SQ. ARCHAIAS AG. SOFIAS AGORAS SQ. DIMITRION SQ. TERPSITHEA SQ. ROMFEI SQ. RAILWAY STATION SQ. RAILWAY ATION SQ. GALANOPOULOU SQ. SYNTRIVANIOU SQ. NAVARINOU SQ. SQ. SYKIES EAPOLI CHNI ZIDROU SQ. LYSSIATREIO AGIOS DIMITRIOS HOSPITAL GENERAL HOSPITAL OF THESSALONIKI G. GENNIMATAS U G O A 1 2 3 4 5 7 6 8 9 12 15 15 15 15 13 14 10 11 2. Southern view of Panagia Chalkeon Church. 3. Agia Sofia Church surrounded by a small garden.""]","Byzantine church-building refers to the architectural and artistic practices that developed during the Byzantine Empire, particularly from the 4th to the 15th centuries. This style is characterized by its grand domes, intricate mosaics, and the use of light to create a spiritual atmosphere. In Thessaloniki, Byzantine church-building holds significant historical and cultural importance, as the city was a major center of Christianity and art during this period.

Thessaloniki is home to several UNESCO World Heritage Monuments, which are exemplary of Byzantine architecture. These churches not only served as places of worship but also as symbols of the city’s religious and cultural identity. The construction of these monuments began shortly after the city embraced Christianity, with many churches built on the foundations of earlier basilicas, reflecting the continuity of faith and tradition.

One notable example is the Agios Dimitrios Church, dedicated to the patron saint of Thessaloniki. Built in the 7th century, it showcases the evolution of Byzantine architecture and has been a focal point for both locals and visitors. Another significant site is the Holy Twelve Apostles Church, constructed in the early 14th century, which highlights the artistic achievements of the time, including stunning murals and iconography.

The importance of Byzantine church-building in Thessaloniki extends beyond its architectural beauty; it represents the city’s historical role as a crossroads of cultures and religions. These monuments are not only vital for understanding the city’s past but also serve as a testament to the enduring legacy of Byzantine art and architecture. For visitors, exploring these sites offers a unique opportunity to connect with the rich history and spiritual heritage of Thessaloniki, making it a rewarding experience for those interested in sightseeing and cultural immersion.","Byzantine church-building refers to the construction of Christian monuments and churches during the Byzantine period, particularly in Thessaloniki, which was the second most important city of the empire after Constantinople. This period, spanning from the 4th to the 15th century, saw the creation of significant Christian monuments that have a decisive influence on the entire Byzantine world. These monuments are recognized for their architectural and artistic value, leading UNESCO to declare them World Heritage Monuments in 1988.",1.0,0.48,0.8974358974358975,0.8383498052232119,0.99999999995,0.99999999995,0.0,0.5555555549382716,,0.9300421430489294
2,What was Constantinople's role in the Byzantine Empire?,"['• Middle Byzantine \nperiod (8th – 12th c.). It \nincludes the chapters: i) From \nIconomachy to the splendour \nof the Macedonian and the \nKomnenian Dynasties (room 4) \nwhere the art and culture of \nthe middle Byzantine period \nis shown, ii) Dynasties of the \nByzantine emperors (room \n5) where visitors can use \nlearning resources to explore \nthe imperial dynasties from \nemperor Heraclius (610 – 641) \nuntil the Palaiologan Dynasty \n(1261 – 1453) and iii) The \nByzantine Castle (room 6) \ndealing with the creation and \nstructuring of a castle in those \ntimes.\n• Late Byzantine period \n(1204-1453). The chapter \nThe twilight of Byzantium \n(room 7) describes the last \ncenturies of the empire i.e.  \nthe period between 1204 \nwhen Constantinople was \nseized by the Crusaders and \n1453 when it was conquered \nby the Ottoman Turks.\n• Post Byzantine period \n(1453 – 19th c.). A chapter \ntitled Byzantium after \nByzantium –Byzantine legacy \nin the years that followed the \nConquest unfolds in room 10.\n• Private collections.', '6\nEver since the 4th c. BC when it was founded, \nThessaloniki has kept its urban character and has \nremained a civic centre and the hub of that region. \nThe city’s centuries-old multicultural history has been \nassociated with great empires, as it has known the \nRoman, Byzantine and Ottoman Rule. The town was also \ngreatly influenced by many ethnic and religious groups \n(Jews, Latins, Armenians and others) as well as Greeks \nfrom Constantinople, Pontus [modern-day northeastern \nTurkey] and Asia Minor [a.k.a. Anatolia]. The numerous \nmonuments, dating to many historical periods, coexist in \na singular and charming way and manifest Thessaloniki’s \nhistorical multicultural and cosmopolitan nature.\n1. \nThe White Tower \narea is one of the \nbusiest parts of \nthe city, where \nthe old seafront \n(Nikis Ave.) meets \nthe new (eastern) \nwaterfront area \nof Thessaloniki.\nDION – VERGINA – ANCIENT PELLA\nPETRALONA CAVE – LAKES AREA\nTHESSALONIKI']","[""UNESCO BYZANTINE MONUMENTS Thessaloniki has been one of the first towns to know the Christian religion by the Apostle Paul; during the Byzantine period it used to be the second most important city of the empire (co-reigning city) after Constantinople. At that time (4th – 15th c.), Christian monuments and churches were constructed in the town, and these make up a diachronic typology with a decisive influence on the entire Byzantine world. The following early-Christian and Byzantine monuments of the town are considered to be excellent specimens of the Byzantine church-building and art, and for this reason UNESCO declared them to be World Heritage Monuments, in 1988. A tour across this unique open-air Byzantine museum is truly a special experience. 1 \x07HOLY TWELVE APOSTLES CHURCH One of the town’s oldest churches was built in 1310 – 1314 under the sponsorship of Patriarch Nephon I. It used to be a katholicon [main church] of a monastery dedicated to Theotokos [Mother of God] as shown by the mural depicting Theotokos and the Founder, as well as by the iconography on the aisle with images of the Holy Virgin’s life. Out of the original monastery complex, -apart from the katholicon – there remain the NIKIS NIKIS GERMANOU SVOLOU IASONIDOU TSIMISKI VAS. IRAKLEIOU FILIPPOU AKROPOLEOS THEOTOKOPOULOU AKROPOLEOS OCHI AVENUE EPTAPYRGIOU SOFOKLEOUS OLYMPOU MONASTIRIOU KAZANTZAKI A N A G E NN I S E OS DAMONOS KALOU DRAGOUMANOU POLYTECHNIOU MITROPOLEOS ARISTOTELOUS DODEKANISOU LANGADA SALAMINOS ERMOU ANGELAKI ETHNIKIS AMYNAS AG. ANTONIOS AGIA THEODORA AG. ATHANASIOS AG. KONSTANTINOU YPAPANTI AGIOS STYLIANOS LAODI GITRIA TAXIARCHES AGIOS PAVLOS FANEROMENI AG. THEODOROI KALARI TSOPELA ISAVRON DELIOU IOANNI VELLIDI MAKRYGIANNI MITR. GENADIOU MODI PETROPOULAKIDON ARIANOU ARIANOU KLEISTHENOUS VIZYINOU KASTRON PANORMOU KES AMPATZOGLOU SKOPELOU PETRAS VASILIKO IRAKLEIAS SK SK KAVAFI ADRIANOUPOLEOS AIANT AGATHOUPOLEOS NG ROAD REDAISTO VYZOUKIDI VIZYINO THETIDOS AFXENTIOU MOUDANION PANEPISTIMIOU KALELPIDOS KONSTANTINOUPOLEOS SMYRNIS PYRGOU VRYANDOU KITROUS MELENIKOU PATR. IOAKEIM PALAION PATRON GERMANOU MICHAIL IO. ARMENOPOULOU IKTINOU KOMNINON SOLOMOU VLALI BALANOU ASKITOU VOGATSIKOU PLOUTARCHOU LASSANI MORKENTAOU TATI DRAGOUMI KYRIAKOU IOULIANOU SOKRATOUS EVRIPIDOU GYZI VLACHAVA AISCHYLOU ATHINAS MOREAS GKRATZIOU ATHONOS THEOFILOU PILEOS ANTIOCHOU VLATADON KASTOROS IGOUMENOU PERIANDROU POLYDOROU KLAFTHMONOS DRAGATSANIOU ACHTARI KARADIMOU DIONYSIOU EPIMENIDOU EVRYMEDONTOS AREOS ARTIS IRAKLIOU SYRAKOUSON PYDNAS KARAVANGELI TSAKALOF KIMONOS FLORINAS PLASTIRA FILIPPOU KLISTHENOUS FERON EVROU GKRATZIOU RAKTIVAN LAMPOUSIDI PASTER MAK KAMENIATOU PROFITI ILIA ATHINAS IFIKRATOUS PRASAKAKI STAVROU DIMOSTHENOUS KASTRITSIOU MENELAOU AMYNTA PELOPONNISOU PLATONOS DELMOUZOU AVDELA OUGKO KARATASOU KOUNTOURIOTI MIONIS CH. IATROU PAPANASTASIOU KLEISOURAS LAMPRAKI OLYMPIOU FEIDIOU FINTIA DAIDALOU VOULGAR THASO FREIDERIK NIKITARA IATRIDON THYRON KOZANIS KILKIS PONTOU NAFPLIOU VALTETSIOU KALPAKIOU LORDOU ELEFSINAS DELTA KONITSIS PLATONOS IPPOKRATOUS AGIOU DIMITRIOU VERMIOU SOUFLIOU BIZANIOU LECHO VOREIOU IPEIROU ARAP BOUBOUL KANARI KA AKI SOLOMOU LACHANA AGRAFON PSARON MIAOULI KAVALAS KRITIS LEVENTI KANARI GRAVIAS KYPROU FILIATRON ARACHTHOU TSACHILA AGRAFON KARVOUNIDI ERASMOU ELENIS KAPETAN NIKOLAOU PELOPONNISOU AGIOU PAVLOU MAKEDONOMACHON KONITSIS IKARON EL. VENIZELOU OMIROU IPEIROU KONTOSOGLOU PAPANIKOLI TEPELENIOU MEGARON VITSI KASTORIAS ARGYROKASTROU DIMITRIOU THASSOU FOKA PAPAFLESSA KOMNINON KONDYLI PANGKALOU KRITIS KRITIS EPIDAVROU LAMPRAKI CHORTIATI ELLIS ELPIDOS MAVROKORDATOU EPTAPYRGIOU EPTAPYRGIOU EPTAPYRGIOU EPTAPYRGIOU ANTHEON ATHANASIOU DIAKOU YPATROU GIALOUROU OU DODEKANISOU VAS. KONSTANTINOU MARKOU BOTSARI ANATOLIKIS ROMYLIAS U OI M R E V RIOU OPOS AISTOU DERMETZI APOLLONIADOS TYROLOIS BOROU PRIAMOU VORONOF OREIOU IPEIROU LATOMEION KATSONI ZALONGOU PAPANASTASIOU KAFKASOU METEORON KASSANDROU OLYMPIADOS A L. P A P A D O P O U L OU KASSANDROU OLYMPIADOS OLYMPOU POLYZOIDI AGIOU DIMITRIOU AGIOU DIMITRIOU AVRILIANIS ARKADIOUPOLEOS IFAISTIONOS ELPIDOS EL. VE NI ZE L O U NAVARINOU TYRNAVOU KOLOKOTRONI ARISTARCHOU KARAOLI PAPAGOU KASTAMONIS KARAVANGELI MATROZOU EVDOKIOU KESANIS KALLIKRATIAS VOULGAROKTONOU THEMISTOKLEOUS A R O G A X A N A KYPROU 28 OKTOVRIOU M. ASIAS ELLISPONTOU IT OIR U O T N U O K PARASKEVA NIGDIS ARAVYSSOU ALEXIOU TRANOU MOUSCHOUNTI KALAMPAKAS ROUZVELT ONOS SIOU OUMAN THOUKYDIDI ZARIFI SACHTOURI AKRITA KLIOS PERSEOS PYTHEOS RAKTIVAN ODYSSEOS SARAFI ETHN. ANTISTASEOS U O TIR K O M ID PARASKEVA PANIDOU OINOIS KARAOLI OLYMPOU ROMANIDI ARISTEIDOU SOULINI KRITIS DEXAMENI DIOS KALVOU EIRINIS PAPARIGOPOULOU PALAMA ZEFYRON MAVILI PINIOU GLADSTONOS THALIAS PRONOIAS SACHINI KRATEROU FILOTA SOURI ANTON SOUTSOU SYNGROU PTOLEMAION IOUSTINIANOU KARBOLA TOSITSA ZALIKI CHALKEON AMVROSIOU KRYSTALI ANTIGONIDON S T O U R N A R A MAKEDON O MACHON ELLISPONTOU LEFKOSIAS THER M OPYLON RIG A FE RAI O U KAFKASOU PANAGIAS FANEROMENIS EOS KAVAKION KORYDALLOU HMOU VOUTYRA YRILLOU PATR. FINTIA SANTAROZA SAPFOUS KARIOFYLLI AVEROF PANGAIOU AXIOU VAIOU PINDOU DOXIS VOTSI KALAPOTHAKI KATOUNI AIGYPTOU FRANGON DANAIDON AISOPOU ENOTIKON AFRODITIS NTEKA PAPATHANASIOU PAPADIMA GALANAKI IVANOF KAPATOU GDON HOUNTI CHATZITSIROU VAKCHOU STEFANAKI FARMAKI ODYSSEOS ODYSSEOS TANTALOU PROMITHEOS SAPFOUS NAVM. CHAPSA LIMNOU VALAORITI ORPHANIDI TANTALIDI OLYMPIOU DIAMANTI LOUI IPPODROMIOU NIKIFOROU DESPERE GOUNARI DIALETI DANGLI FILIKIS ETAIRIAS CHR. SMYRNIS MITR. IOSIF FOKA PANAGIA KARATZA KREMASTIS POLIORKITI SYNGROU VYRONOS AGIOS DIMITRIOS RIGA FERAIOU A R C H A I O T I T O N S E L E F K I D O N M E L E N I K O U PROX. KOROMILA PARASCHOU EPTAPYRGIO ANO POLI 40 EKKLISIES EVANGELISTRIA RIGAS FERAIOS KALLITHEA AXIOS MUNICIPAL PARK RODOCHORI EVANGELISTRIA'S CEMETERY KOLOKOTRONI TYROLOI VARNAS SQ. MOUSHOUNTI SQ. FANARIOTON SQ. ELEFTHERIAS SQ. EMPORIOU SQ. DIMOKRATIAS VARDARI SQ. KYPRION AGONISTON SQ. ARCHAIAS AG. SOFIAS AGORAS SQ. DIMITRION SQ. TERPSITHEA SQ. ROMFEI SQ. RAILWAY STATION SQ. RAILWAY ATION SQ. GALANOPOULOU SQ. SYNTRIVANIOU SQ. NAVARINOU SQ. SQ. SYKIES EAPOLI CHNI ZIDROU SQ. LYSSIATREIO AGIOS DIMITRIOS HOSPITAL GENERAL HOSPITAL OF THESSALONIKI G. GENNIMATAS U G O A 1 2 3 4 5 7 6 8 9 12 15 15 15 15 13 14 10 11 2. Southern view of Panagia Chalkeon Church. 3. Agia Sofia Church surrounded by a small garden.""]","Constantinople, originally known as Byzantium, played a pivotal role in the Byzantine Empire as its capital and cultural heart. Founded by the Roman Emperor Constantine the Great in 330 AD, the city was strategically located at the crossroads of Europe and Asia, making it a vital hub for trade, military, and cultural exchange. Its position allowed the Byzantine Empire to control key trade routes, enhancing its economic power and influence.

As the capital, Constantinople was the center of political authority and governance. It housed the imperial court, where emperors ruled and made crucial decisions that shaped the empire's destiny. The city was also a bastion of Christianity, with the construction of monumental churches, such as the Hagia Sophia, symbolizing the empire's religious significance and architectural prowess.

Throughout the Middle and Late Byzantine periods, Constantinople witnessed significant cultural and artistic developments. The city became a melting pot of diverse influences, reflecting the empire's multicultural nature. It was a center for learning, where scholars preserved and advanced classical knowledge, contributing to the intellectual legacy of the Byzantine Empire.

The city's fortifications, including the famous Theodosian Walls, protected it from numerous sieges and invasions, allowing it to thrive for over a millennium. However, the fall of Constantinople to the Ottoman Turks in 1453 marked the end of the Byzantine Empire, signifying a dramatic shift in power and culture in the region.

In summary, Constantinople was not only the political and economic capital of the Byzantine Empire but also a cultural and religious center that played a crucial role in shaping the empire's identity and legacy. Its rich history continues to influence the cultural landscape of modern-day Turkey and beyond.","Constantinople was the most important city of the Byzantine Empire, serving as its capital and co-reigning city during the Byzantine period.",0.0,0.16,0.35135135135135137,0.7516929366339178,0.9999999999,0.0,0.0,0.249999999375,,0.8348228692997571
3,"Can you provide detailed information about the Holy Twelve Apostles Church in Thessaloniki, including its history and significance?","['10\n1st walk: \nUNESCO BYZANTINE MONUMENTS\nThessaloniki has been  \none of the first towns to \nknow the Christian religion by \nthe Apostle Paul; during the \nByzantine period it used to be \nthe second most important \ncity of the empire (co-reigning \ncity) after Constantinople. \nAt that time (4th – 15th c.), \nChristian monuments and \nchurches were constructed in \nthe town, and these make up \na diachronic typology with a \ndecisive influence on the entire \nByzantine world. The following \nearly-Christian and Byzantine \nmonuments of the town are \nconsidered to be excellent \nspecimens of the Byzantine \nchurch-building and art, and \nfor this reason UNESCO \ndeclared them to be World \nHeritage Monuments, in 1988. \nA tour across this unique \nopen-air Byzantine museum  \nis truly a special experience.\n1 \t\x07HOLY TWELVE  \nAPOSTLES CHURCH\nOne of the town’s oldest \nchurches was built in 1310 – \n1314 under the sponsorship  \nof Patriarch Nephon I. It used \nto be a katholicon [main church] \nof a monastery dedicated to \nTheotokos [Mother of God] as \nshown by the mural depicting \nTheotokos and the Founder, \nas well as by the iconography \non the aisle with images of \nthe Holy Virgin’s life.', '60\n7th walk: \nWEST OF THE CENTRE-STAVROUPOLI\n2.6  Holy Twelve Apostles \nChurch\n(see p. 8).\n2.7  West City Walls.\nSections of the city’s west walls  \nremain along Arkadioupoleos and \nEirinis Streets and finds related \nto Litaia Gate have recently \nbeen located at the corner \nof Agiou Dimitriou and Agiou \nNestoros Streets. This gate \nused to be one of the seven \ngreat gates of the fortified city \nand formed part of the Early \nChristian period walls; it was \nnamed after Liti, a Byzantine \ntown to which the gate led. \nThe Golden Gate was also \nlocated on the Egnatia  \nStreet level.\n2.8  Pasha Hamam  \n[Paşa Hamami] (Phoenix  \nBath house).\nIt was built during the \n1520s by Cezeri Kasim Paşa. \nAlso known as Phoenix Bath \nhouse, this used to be the \nlast ottoman bath house open \nin town, as it closed down in \nas late as 1981. It is located \nat the corner of Kalvou and \nPineiou Streets, near the west \nwalls and the church of the \nHoly Twelve Apostles, and the \nstructure of the building was \nplanned with great care.']","[""UNESCO BYZANTINE MONUMENTS Thessaloniki has been one of the first towns to know the Christian religion by the Apostle Paul; during the Byzantine period it used to be the second most important city of the empire (co-reigning city) after Constantinople. At that time (4th – 15th c.), Christian monuments and churches were constructed in the town, and these make up a diachronic typology with a decisive influence on the entire Byzantine world. The following early-Christian and Byzantine monuments of the town are considered to be excellent specimens of the Byzantine church-building and art, and for this reason UNESCO declared them to be World Heritage Monuments, in 1988. A tour across this unique open-air Byzantine museum is truly a special experience. 1 \x07HOLY TWELVE APOSTLES CHURCH One of the town’s oldest churches was built in 1310 – 1314 under the sponsorship of Patriarch Nephon I. It used to be a katholicon [main church] of a monastery dedicated to Theotokos [Mother of God] as shown by the mural depicting Theotokos and the Founder, as well as by the iconography on the aisle with images of the Holy Virgin’s life. Out of the original monastery complex, -apart from the katholicon – there remain the NIKIS NIKIS GERMANOU SVOLOU IASONIDOU TSIMISKI VAS. IRAKLEIOU FILIPPOU AKROPOLEOS THEOTOKOPOULOU AKROPOLEOS OCHI AVENUE EPTAPYRGIOU SOFOKLEOUS OLYMPOU MONASTIRIOU KAZANTZAKI A N A G E NN I S E OS DAMONOS KALOU DRAGOUMANOU POLYTECHNIOU MITROPOLEOS ARISTOTELOUS DODEKANISOU LANGADA SALAMINOS ERMOU ANGELAKI ETHNIKIS AMYNAS AG. ANTONIOS AGIA THEODORA AG. ATHANASIOS AG. KONSTANTINOU YPAPANTI AGIOS STYLIANOS LAODI GITRIA TAXIARCHES AGIOS PAVLOS FANEROMENI AG. THEODOROI KALARI TSOPELA ISAVRON DELIOU IOANNI VELLIDI MAKRYGIANNI MITR. GENADIOU MODI PETROPOULAKIDON ARIANOU ARIANOU KLEISTHENOUS VIZYINOU KASTRON PANORMOU KES AMPATZOGLOU SKOPELOU PETRAS VASILIKO IRAKLEIAS SK SK KAVAFI ADRIANOUPOLEOS AIANT AGATHOUPOLEOS NG ROAD REDAISTO VYZOUKIDI VIZYINO THETIDOS AFXENTIOU MOUDANION PANEPISTIMIOU KALELPIDOS KONSTANTINOUPOLEOS SMYRNIS PYRGOU VRYANDOU KITROUS MELENIKOU PATR. IOAKEIM PALAION PATRON GERMANOU MICHAIL IO. ARMENOPOULOU IKTINOU KOMNINON SOLOMOU VLALI BALANOU ASKITOU VOGATSIKOU PLOUTARCHOU LASSANI MORKENTAOU TATI DRAGOUMI KYRIAKOU IOULIANOU SOKRATOUS EVRIPIDOU GYZI VLACHAVA AISCHYLOU ATHINAS MOREAS GKRATZIOU ATHONOS THEOFILOU PILEOS ANTIOCHOU VLATADON KASTOROS IGOUMENOU PERIANDROU POLYDOROU KLAFTHMONOS DRAGATSANIOU ACHTARI KARADIMOU DIONYSIOU EPIMENIDOU EVRYMEDONTOS AREOS ARTIS IRAKLIOU SYRAKOUSON PYDNAS KARAVANGELI TSAKALOF KIMONOS FLORINAS PLASTIRA FILIPPOU KLISTHENOUS FERON EVROU GKRATZIOU RAKTIVAN LAMPOUSIDI PASTER MAK KAMENIATOU PROFITI ILIA ATHINAS IFIKRATOUS PRASAKAKI STAVROU DIMOSTHENOUS KASTRITSIOU MENELAOU AMYNTA PELOPONNISOU PLATONOS DELMOUZOU AVDELA OUGKO KARATASOU KOUNTOURIOTI MIONIS CH. IATROU PAPANASTASIOU KLEISOURAS LAMPRAKI OLYMPIOU FEIDIOU FINTIA DAIDALOU VOULGAR THASO FREIDERIK NIKITARA IATRIDON THYRON KOZANIS KILKIS PONTOU NAFPLIOU VALTETSIOU KALPAKIOU LORDOU ELEFSINAS DELTA KONITSIS PLATONOS IPPOKRATOUS AGIOU DIMITRIOU VERMIOU SOUFLIOU BIZANIOU LECHO VOREIOU IPEIROU ARAP BOUBOUL KANARI KA AKI SOLOMOU LACHANA AGRAFON PSARON MIAOULI KAVALAS KRITIS LEVENTI KANARI GRAVIAS KYPROU FILIATRON ARACHTHOU TSACHILA AGRAFON KARVOUNIDI ERASMOU ELENIS KAPETAN NIKOLAOU PELOPONNISOU AGIOU PAVLOU MAKEDONOMACHON KONITSIS IKARON EL. VENIZELOU OMIROU IPEIROU KONTOSOGLOU PAPANIKOLI TEPELENIOU MEGARON VITSI KASTORIAS ARGYROKASTROU DIMITRIOU THASSOU FOKA PAPAFLESSA KOMNINON KONDYLI PANGKALOU KRITIS KRITIS EPIDAVROU LAMPRAKI CHORTIATI ELLIS ELPIDOS MAVROKORDATOU EPTAPYRGIOU EPTAPYRGIOU EPTAPYRGIOU EPTAPYRGIOU ANTHEON ATHANASIOU DIAKOU YPATROU GIALOUROU OU DODEKANISOU VAS. KONSTANTINOU MARKOU BOTSARI ANATOLIKIS ROMYLIAS U OI M R E V RIOU OPOS AISTOU DERMETZI APOLLONIADOS TYROLOIS BOROU PRIAMOU VORONOF OREIOU IPEIROU LATOMEION KATSONI ZALONGOU PAPANASTASIOU KAFKASOU METEORON KASSANDROU OLYMPIADOS A L. P A P A D O P O U L OU KASSANDROU OLYMPIADOS OLYMPOU POLYZOIDI AGIOU DIMITRIOU AGIOU DIMITRIOU AVRILIANIS ARKADIOUPOLEOS IFAISTIONOS ELPIDOS EL. VE NI ZE L O U NAVARINOU TYRNAVOU KOLOKOTRONI ARISTARCHOU KARAOLI PAPAGOU KASTAMONIS KARAVANGELI MATROZOU EVDOKIOU KESANIS KALLIKRATIAS VOULGAROKTONOU THEMISTOKLEOUS A R O G A X A N A KYPROU 28 OKTOVRIOU M. ASIAS ELLISPONTOU IT OIR U O T N U O K PARASKEVA NIGDIS ARAVYSSOU ALEXIOU TRANOU MOUSCHOUNTI KALAMPAKAS ROUZVELT ONOS SIOU OUMAN THOUKYDIDI ZARIFI SACHTOURI AKRITA KLIOS PERSEOS PYTHEOS RAKTIVAN ODYSSEOS SARAFI ETHN. ANTISTASEOS U O TIR K O M ID PARASKEVA PANIDOU OINOIS KARAOLI OLYMPOU ROMANIDI ARISTEIDOU SOULINI KRITIS DEXAMENI DIOS KALVOU EIRINIS PAPARIGOPOULOU PALAMA ZEFYRON MAVILI PINIOU GLADSTONOS THALIAS PRONOIAS SACHINI KRATEROU FILOTA SOURI ANTON SOUTSOU SYNGROU PTOLEMAION IOUSTINIANOU KARBOLA TOSITSA ZALIKI CHALKEON AMVROSIOU KRYSTALI ANTIGONIDON S T O U R N A R A MAKEDON O MACHON ELLISPONTOU LEFKOSIAS THER M OPYLON RIG A FE RAI O U KAFKASOU PANAGIAS FANEROMENIS EOS KAVAKION KORYDALLOU HMOU VOUTYRA YRILLOU PATR. FINTIA SANTAROZA SAPFOUS KARIOFYLLI AVEROF PANGAIOU AXIOU VAIOU PINDOU DOXIS VOTSI KALAPOTHAKI KATOUNI AIGYPTOU FRANGON DANAIDON AISOPOU ENOTIKON AFRODITIS NTEKA PAPATHANASIOU PAPADIMA GALANAKI IVANOF KAPATOU GDON HOUNTI CHATZITSIROU VAKCHOU STEFANAKI FARMAKI ODYSSEOS ODYSSEOS TANTALOU PROMITHEOS SAPFOUS NAVM. CHAPSA LIMNOU VALAORITI ORPHANIDI TANTALIDI OLYMPIOU DIAMANTI LOUI IPPODROMIOU NIKIFOROU DESPERE GOUNARI DIALETI DANGLI FILIKIS ETAIRIAS CHR. SMYRNIS MITR. IOSIF FOKA PANAGIA KARATZA KREMASTIS POLIORKITI SYNGROU VYRONOS AGIOS DIMITRIOS RIGA FERAIOU A R C H A I O T I T O N S E L E F K I D O N M E L E N I K O U PROX. KOROMILA PARASCHOU EPTAPYRGIO ANO POLI 40 EKKLISIES EVANGELISTRIA RIGAS FERAIOS KALLITHEA AXIOS MUNICIPAL PARK RODOCHORI EVANGELISTRIA'S CEMETERY KOLOKOTRONI TYROLOI VARNAS SQ. MOUSHOUNTI SQ. FANARIOTON SQ. ELEFTHERIAS SQ. EMPORIOU SQ. DIMOKRATIAS VARDARI SQ. KYPRION AGONISTON SQ. ARCHAIAS AG. SOFIAS AGORAS SQ. DIMITRION SQ. TERPSITHEA SQ. ROMFEI SQ. RAILWAY STATION SQ. RAILWAY ATION SQ. GALANOPOULOU SQ. SYNTRIVANIOU SQ. NAVARINOU SQ. SQ. SYKIES EAPOLI CHNI ZIDROU SQ. LYSSIATREIO AGIOS DIMITRIOS HOSPITAL GENERAL HOSPITAL OF THESSALONIKI G. GENNIMATAS U G O A 1 2 3 4 5 7 6 8 9 12 15 15 15 15 13 14 10 11 2. Southern view of Panagia Chalkeon Church. 3. Agia Sofia Church surrounded by a small garden.""]","The Holy Twelve Apostles Church, located in Thessaloniki, is one of the city's oldest and most significant Byzantine monuments. Built between 1310 and 1314 under the sponsorship of Patriarch Nephon I, this church originally served as the katholicon (main church) of a monastery dedicated to Theotokos, or the Mother of God. Its historical and architectural importance is underscored by its designation as a UNESCO World Heritage Monument in 1988, recognizing its role in the rich tapestry of Byzantine art and architecture.

The church is renowned for its exquisite murals and iconography, particularly the depiction of Theotokos and the Founder, which reflect the artistic styles of the Byzantine period. The interior features intricate images illustrating the life of the Holy Virgin, showcasing the church's spiritual significance and its connection to early Christian traditions.

Situated near the West City Walls, the Holy Twelve Apostles Church is easily accessible for visitors exploring the historical heart of Thessaloniki. Its location allows for a seamless integration into a sightseeing itinerary, making it an ideal stop for those interested in the city's Byzantine heritage. The surrounding area is rich with history, including remnants of the ancient city walls and other significant landmarks.

Visiting the Holy Twelve Apostles Church offers a unique opportunity to experience the serene atmosphere of a Byzantine church while appreciating its architectural beauty. The church stands as a testament to Thessaloniki's historical importance during the Byzantine Empire, serving as a reminder of the city's role as a center of Christianity and culture.

For those seeking Instagrammable spots, the church's stunning exterior and intricate details provide excellent photo opportunities, making it a perfect addition to your travel experience in Thessaloniki.","The Holy Twelve Apostles Church is one of the oldest churches in Thessaloniki, built between 1310 and 1314 under the sponsorship of Patriarch Nephon I. It served as the main church of a monastery dedicated to Theotokos (Mother of God), which is evident from the mural depicting Theotokos and the Founder, as well as the iconography on the aisle illustrating the life of the Holy Virgin. The church is part of the early-Christian and Byzantine monuments in Thessaloniki, which were recognized by UNESCO as World Heritage Monuments in 1988 due to their exceptional representation of Byzantine church-building and art. This makes a visit to the Holy Twelve Apostles Church a significant experience for those interested in the history and architecture of the Byzantine period.",0.75,0.51,1.0,0.9132569328962816,0.9999999999,0.9999999999,0.0,0.7857142851530612,,0.8879470136519941
4,What is the historical significance of Albania in relation to Egnatia Street?,"['34\n1 \tEGNATIA STREET\nThis central avenue has \nbeen there practically since \nThessaloniki’s founding,  \nas it is a section of the road \nconstructed by the Romans  \nin the 2nd c. BC, and connected \nDyrrhachium (Durrës, in \nmodern day Albania) with \nConstantinople. It starts at \nDimokratia square (see p. 58) \nand ends at the TIF grounds \n(see p. 31) and the Aristotle \nUniversity of Thessaloniki, \nsplitting in two the town’s \nhistoric centre. It is a busy \nshopping area with numerous \nremarkable buildings of \neclectic and art deco style \ndating to the early 20th c. \n(mostly old hotels) that are \nabsolutely worth observing,  \nas well as some of the city’s \nmost important monuments.\nMUST SEE:\n1.1  Kolomvou Square.\nThe crossroads where \nEgnatia Street meets \nAntigonidon Street is indeed \na bustling one! It was named \nafter G. Colombo, an Italian \nwho opened a hotel there  \nin the early 20th century. This \nis the location of Kolomvou \nArchway (31, Egnatia St.) \nwhich has become a leisure \nhub with cafés, bars and \nrestaurants inside.\n1.2  Hamza Bey Mosque.\nIt was built in 1467 by the \ndaughter of Hamza Bey, the \nmilitary commander of Sultan \nMurad II.', 'The monumental style of \narchitecture is shown in the \nbuildings’ facades, colonnades, \narcades and porticos, which \ncombine elements from the \ncity’s Byzantine tradition \nwith European interwar \nperiod motifs. The square is \nlandmarked by two identical \nconcave buildings: Electra \nPalace hotel (late sixties) - \nbuilt by GNTO architects -  \non the west side, and Olympion \non the east side, which was \nprogressively erected and \ncompleted by the late fifties \n(designed by J. Moshé) \nand is now the seat of the \nThessaloniki Film Festival  \n(see p. 108).\nMUST SEE:\n1.1  Aristotelous Street.\nPedestrianised historic \nboulevard, that ends in Egnatia \nStreet (see p. 34). According \nto the Hébrard plans, it would \n2nd walk: \nHISTORIC CENTRE (1) \nTRADITIONAL COMMERCIAL CENTRE\n4.1\n6.1\n6.3\n6.2\n6.5\n6.6\n6.7\n1.1\n1.2\n6.8\n7.5\n7.3\n7.2\n7.2\n7.1\n7.4\n6.4\n3.1\n1\n2\n3\n4\n5\n7']","['34 1 EGNATIA STREET This central avenue has been there practically since Thessaloniki’s founding, as it is a section of the road constructed by the Romans in the 2nd c. BC, and connected Dyrrhachium (Durrës, in modern day Albania) with Constantinople. It starts at Dimokratia square (see p. 58) and ends at the TIF grounds (see p. 31) and the Aristotle University of Thessaloniki, splitting in two the town’s historic centre. It is a busy shopping area with numerous remarkable buildings of eclectic and art deco style dating to the early 20th c. (mostly old hotels) that are absolutely worth observing, as well as some of the city’s most important monuments. MUST SEE: 1.1 Kolomvou Square. The crossroads where Egnatia Street meets Antigonidon Street is indeed a bustling one! It was named after G. Colombo, an Italian who opened a hotel there in the early 20th century. This is the location of Kolomvou Archway (31, Egnatia St.) which has become a leisure hub with cafés, bars and restaurants inside. 1.2 Hamza Bey Mosque. It was built in 1467 by the daughter of Hamza Bey, the military commander of Sultan Murad II. It is the only mosque in Greece with a peristyle (a colonnaded yard). For many decades it housed a cinema named Alkazar. Currently there are renovation works under way. Once they are finished, it will house an exhibition of finds unearthed during the metro excavations. Right behind it you will see the City Manor which housed the Town Hall until recently. It is known at Karavan Serai as there used to be an ottoman inn here. (early 16th c.). 4th walk:']","Egnatia Street holds historical significance as it is a remnant of the ancient Roman road that connected Dyrrhachium (modern-day Durrës, Albania) to Constantinople. This route was crucial for trade and military movements during the Roman Empire, facilitating cultural and economic exchanges between the regions. The street has been a central artery in Thessaloniki since its founding, reflecting the city’s long-standing role as a hub of commerce and interaction between different cultures.

The connection to Albania is particularly noteworthy, as Dyrrhachium was one of the key ports on the Adriatic Sea, serving as a gateway for goods and travelers moving between the East and West. The historical ties between Thessaloniki and Albania are evident in the architectural styles and cultural influences that have permeated the region over centuries. Egnatia Street, with its eclectic and art deco buildings from the early 20th century, showcases this blend of influences, making it a vibrant area for exploration.

For a first-time visitor, Egnatia Street offers a unique opportunity to experience the historical layers of Thessaloniki while enjoying its modern-day amenities. The street is lined with shops, cafes, and significant monuments, making it an ideal spot for sightseeing. Notable landmarks such as Kolomvou Square and the Hamza Bey Mosque further enrich the historical narrative of the area, providing insights into the city’s diverse past.

In summary, Egnatia Street is not just a thoroughfare but a historical corridor that links Thessaloniki to its Albanian roots, embodying the city’s rich heritage and its evolution over time. Exploring this street allows visitors to appreciate the interconnectedness of cultures and the historical significance of trade routes that shaped the region.","Egnatia Street is historically significant as it was part of the road constructed by the Romans in the 2nd century BC, connecting Dyrrhachium (modern-day Durrës in Albania) with Constantinople.",1.0,0.25,0.7105263157894737,0.7820820466439712,0.99999999995,0.9999999999,1.0,0.8571428559183674,,0.7950272227152836
5,Can you tell me more about the TIF grounds and what is around it in Thessaloniki?,"['Moreover, the TIF grounds \nhouse two modern convention \ncentres, namely Ioannis \nVellidis offering seating for \n2,100 and Nikolaos Germanos \nwith seating for 400. You  \ncan enter through the gate  \non the YMCA square, the one  \non Angelaki street or through \nthe two gates on Egnatia \nstreet (for TIF, see p. 108).\nMUST SEE:\n10.1 Macedonian Museum \nof Contemporary Art.\nIt was established in 1979 \nand it is the first museum of \nmodern art in Greece. Since \n2001, it has been housed in a \nbuilding that covers a 4,000m2 \narea. In the courtyard there \nare modern sculptures, such \nas “Umbrellas”, a construction \nof moveable parts with water. \n(1995, G. Zongolopoulos, \nsee also p. 51); there are also \nroman graves and a road on \ndisplay dating to the 2nd – 3rd \nc. AD (for museum collections \n29\n30', '110\nThessaloniki State \nSymphony Orchestra \n(T.S.S.O.). \nIt was established in 1959 \nas the Symphony Orchestra \nof Northern Greece; in 1969 \nit acquired its present name \nand was brought under state \ncontrol. It is considered as one \nof the best of its kind in Greece \nand its musicians (approx. 100) \nhave performed in some of the \nbest known Festivals and music \nstages in Greece and abroad. \nConcerts take place in the \nThessaloniki Concert Hall. \nInformation: 73, Nikis Ave.\ntel.: 2310 257.900\nwebsite: www.tsso.gr\nSummer (open-air) cinemas. \nThis is yet another attraction \nfor visitors. Screenings take \nplace in gardens, and you can \nwatch a film while sipping your \ndrink or having a snack, against \na backdrop of trees and flowers. \nFilms are not dubbed; Greek \nsubtitles are used instead.\nSPORTS \nThessaloniki has a long \ntradition in sports. In recent \ndecades, major sports events \nhave taken place in the city \n(finals of european football and \nbasketball games, international \ntrack and  field events, a \nmarathon race, the 2004 \nOlympic Games, international \nbeach volleyball tournaments \netc). A variety of modern and \nwell equipped facilities are open \nto those who wish to practice \ntheir favourite sport or relax \nduring their stay in town. Here \nis a list of sports facilities:\nKaftanzogleio National \nStadium:  \nAgiou Dimitriou St.']","['34 1 EGNATIA STREET This central avenue has been there practically since Thessaloniki’s founding, as it is a section of the road constructed by the Romans in the 2nd c. BC, and connected Dyrrhachium (Durrës, in modern day Albania) with Constantinople. It starts at Dimokratia square (see p. 58) and ends at the TIF grounds (see p. 31) and the Aristotle University of Thessaloniki, splitting in two the town’s historic centre. It is a busy shopping area with numerous remarkable buildings of eclectic and art deco style dating to the early 20th c. (mostly old hotels) that are absolutely worth observing, as well as some of the city’s most important monuments. MUST SEE: 1.1 Kolomvou Square. The crossroads where Egnatia Street meets Antigonidon Street is indeed a bustling one! It was named after G. Colombo, an Italian who opened a hotel there in the early 20th century. This is the location of Kolomvou Archway (31, Egnatia St.) which has become a leisure hub with cafés, bars and restaurants inside. 1.2 Hamza Bey Mosque. It was built in 1467 by the daughter of Hamza Bey, the military commander of Sultan Murad II. It is the only mosque in Greece with a peristyle (a colonnaded yard). For many decades it housed a cinema named Alkazar. Currently there are renovation works under way. Once they are finished, it will house an exhibition of finds unearthed during the metro excavations. Right behind it you will see the City Manor which housed the Town Hall until recently. It is known at Karavan Serai as there used to be an ottoman inn here. (early 16th c.). 4th walk:']","The TIF (Thessaloniki International Fair) grounds are a vibrant hub located in the heart of Thessaloniki, known for hosting various events, exhibitions, and conventions. The grounds feature two modern convention centers: the Ioannis Vellidis Center, which accommodates up to 2,100 people, and the Nikolaos Germanos Center, with a capacity of 400. These venues are easily accessible through multiple entrances, including those on YMCA Square, Angelaki Street, and Egnatia Street.

Surrounding the TIF grounds, you’ll find several attractions that enhance your visit. One must-see is the Macedonian Museum of Contemporary Art, established in 1979 as Greece's first modern art museum. It is located nearby and showcases a diverse collection of contemporary artworks, including notable sculptures like “Umbrellas” by G. Zongolopoulos. The museum's courtyard also features Roman graves and ancient roads, providing a glimpse into the city's rich history.

Additionally, the area is home to the Thessaloniki Concert Hall, where the Thessaloniki State Symphony Orchestra performs. This venue is renowned for its acoustics and hosts a variety of concerts, making it a great spot for music lovers.

For leisure activities, the TIF grounds are surrounded by parks and gardens, perfect for a relaxing stroll or enjoying a coffee. In the summer, you can also find open-air cinemas nearby, where you can watch films under the stars, adding to the local cultural experience.

Overall, the TIF grounds and its surroundings offer a blend of modern attractions and cultural experiences, making it an ideal starting point for your exploration of Thessaloniki. Whether you're interested in art, music, or simply enjoying the local atmosphere, this area has something to offer every visitor.","The TIF grounds are located at the end of Egnatia Street, which is a central avenue in Thessaloniki that has been there since the city's founding. This area is part of a busy shopping district filled with remarkable buildings of eclectic and art deco style from the early 20th century. Nearby, you can find Kolomvou Square, a bustling crossroads with cafés, bars, and restaurants, as well as the Hamza Bey Mosque, built in 1467, which is notable for its peristyle. The mosque is currently undergoing renovations and will soon house an exhibition of finds from metro excavations.",0.0,0.0,0.3333333333333333,0.7720951109422434,0.9999999999,0.0,0.0,0.2857142853061225,,0.942369655711091
6,"Wut r sum of the most intresting places to visit in Thessaloniki, and can u tell me about their history?","['7\n«…There is a homeland for everyone,  \nwhile there is Thessaloniki»\nNikiforos Choumnos, \n14thc. Byzantine dignitary and a scholar.\nNowadays, the historic capital -by right- of Macedonia, \nthe land of Alexander the Great, has evolved into a modern \nand particularly charming metropolis. A multitide of \nmonuments and cultural assets and the town’s traditional \nways exist in harmony with the modern aspects and the \nhigh standard infrastructure, the carefree mood, the spirit \nof hospitality, the vitality of the locals – particularly the \nyoung – setting the pace of town life, the diversity of \nartistic events, the long list of choices for entertainment, \nthe exceptional culinary tradition, and the fresh feel in \nthe atmosphere, coming from the seafront, as well as the \ncoolness of the northwest wind called Vardaris.   \nThessaloniki’s location is at the centre of a greater area \nwith incomparable historical monuments and natural assets \nas it offers the opportunity for a visit to archaeological \nsites known the world over (Ancient Pella, Vergina, Dion, \nPetralona Cave), to areas of exquisite nature (river deltas, \nlakes, Mt Olympus), to the monastic state of Agion Oros \n[the Holy Mountain] as well as to Halkidiki, a famous tourist \ndestination. And there is always an opportunity to practice \nsports (swimming, skiing, playing golf etc) or to indulge in \nwellness tourism (hot springs, spas)!\nIn short, Thessaloniki is a city that can cater for even the \nmost demanding needs, any time of the year.', '6\nEver since the 4th c. BC when it was founded, \nThessaloniki has kept its urban character and has \nremained a civic centre and the hub of that region. \nThe city’s centuries-old multicultural history has been \nassociated with great empires, as it has known the \nRoman, Byzantine and Ottoman Rule. The town was also \ngreatly influenced by many ethnic and religious groups \n(Jews, Latins, Armenians and others) as well as Greeks \nfrom Constantinople, Pontus [modern-day northeastern \nTurkey] and Asia Minor [a.k.a. Anatolia]. The numerous \nmonuments, dating to many historical periods, coexist in \na singular and charming way and manifest Thessaloniki’s \nhistorical multicultural and cosmopolitan nature.\n1. \nThe White Tower \narea is one of the \nbusiest parts of \nthe city, where \nthe old seafront \n(Nikis Ave.) meets \nthe new (eastern) \nwaterfront area \nof Thessaloniki.\nDION – VERGINA – ANCIENT PELLA\nPETRALONA CAVE – LAKES AREA\nTHESSALONIKI']","['34 1 EGNATIA STREET This central avenue has been there practically since Thessaloniki’s founding, as it is a section of the road constructed by the Romans in the 2nd c. BC, and connected Dyrrhachium (Durrës, in modern day Albania) with Constantinople. It starts at Dimokratia square (see p. 58) and ends at the TIF grounds (see p. 31) and the Aristotle University of Thessaloniki, splitting in two the town’s historic centre. It is a busy shopping area with numerous remarkable buildings of eclectic and art deco style dating to the early 20th c. (mostly old hotels) that are absolutely worth observing, as well as some of the city’s most important monuments. MUST SEE: 1.1 Kolomvou Square. The crossroads where Egnatia Street meets Antigonidon Street is indeed a bustling one! It was named after G. Colombo, an Italian who opened a hotel there in the early 20th century. This is the location of Kolomvou Archway (31, Egnatia St.) which has become a leisure hub with cafés, bars and restaurants inside. 1.2 Hamza Bey Mosque. It was built in 1467 by the daughter of Hamza Bey, the military commander of Sultan Murad II. It is the only mosque in Greece with a peristyle (a colonnaded yard). For many decades it housed a cinema named Alkazar. Currently there are renovation works under way. Once they are finished, it will house an exhibition of finds unearthed during the metro excavations. Right behind it you will see the City Manor which housed the Town Hall until recently. It is known at Karavan Serai as there used to be an ottoman inn here. (early 16th c.). 4th walk:']","Thessaloniki is a vibrant city rich in history and culture, making it an ideal destination for a weekend getaway. Here are some must-visit places:

1. **The White Tower**: This iconic landmark is a symbol of Thessaloniki and dates back to the 15th century. Originally built as a fortification, it later served as a prison. Today, it houses a museum showcasing the city's history and offers stunning views of the waterfront.

2. **Aristotelous Square**: This bustling square is the heart of the city, surrounded by beautiful neoclassical buildings. It’s a great spot for people-watching and enjoying local cafes. The square has been a central meeting point since its establishment in the early 20th century.

3. **Rotunda**: Originally built as a mausoleum for Emperor Galerius in the 4th century, the Rotunda has served various purposes over the centuries, including a church and a mosque. Its impressive dome and intricate mosaics make it a fascinating site to explore.

4. **The Byzantine Walls**: These ancient walls date back to the 4th century and offer a glimpse into the city’s past. Walking along the walls provides panoramic views of Thessaloniki and the sea, making it a perfect spot for photography.

5. **Ano Poli (Upper Town)**: This historic neighborhood is known for its traditional architecture and narrow streets. It’s one of the few areas that survived the Great Fire of 1917, preserving its unique charm. Explore the local tavernas and enjoy the authentic atmosphere.

6. **Agios Dimitrios Church**: Dedicated to the patron saint of Thessaloniki, this church is a UNESCO World Heritage site. It features stunning mosaics and a rich history dating back to the 4th century.

These sites not only offer a glimpse into Thessaloniki's multicultural past but also provide numerous opportunities for memorable photos and local interactions. Enjoy your exploration of this captivating city!","In Thessaloniki, one must visit Egnatia Street, a central avenue that has existed since the city's founding, originally constructed by the Romans in the 2nd century BC. It connects Dyrrhachium with Constantinople and is a busy shopping area featuring remarkable buildings of eclectic and art deco style from the early 20th century. Another highlight is Kolomvou Square, a bustling crossroads named after G. Colombo, where you can find the Kolomvou Archway, a leisure hub with cafés and restaurants. Additionally, the Hamza Bey Mosque, built in 1467, is notable for being the only mosque in Greece with a peristyle and is currently undergoing renovations to house an exhibition of archaeological finds. Nearby is the City Manor, known as Karavan Serai, which served as the Town Hall until recently.",0.0,0.18,0.0425531914893617,0.6769894143344266,0.99999999995,0.9999999999,0.0,0.124999999921875,,0.6549510670972531
7,What is the historical significance of Constantinople in relation to Egnatia Street?,"['34\n1 \tEGNATIA STREET\nThis central avenue has \nbeen there practically since \nThessaloniki’s founding,  \nas it is a section of the road \nconstructed by the Romans  \nin the 2nd c. BC, and connected \nDyrrhachium (Durrës, in \nmodern day Albania) with \nConstantinople. It starts at \nDimokratia square (see p. 58) \nand ends at the TIF grounds \n(see p. 31) and the Aristotle \nUniversity of Thessaloniki, \nsplitting in two the town’s \nhistoric centre. It is a busy \nshopping area with numerous \nremarkable buildings of \neclectic and art deco style \ndating to the early 20th c. \n(mostly old hotels) that are \nabsolutely worth observing,  \nas well as some of the city’s \nmost important monuments.\nMUST SEE:\n1.1  Kolomvou Square.\nThe crossroads where \nEgnatia Street meets \nAntigonidon Street is indeed \na bustling one! It was named \nafter G. Colombo, an Italian \nwho opened a hotel there  \nin the early 20th century. This \nis the location of Kolomvou \nArchway (31, Egnatia St.) \nwhich has become a leisure \nhub with cafés, bars and \nrestaurants inside.\n1.2  Hamza Bey Mosque.\nIt was built in 1467 by the \ndaughter of Hamza Bey, the \nmilitary commander of Sultan \nMurad II.', '28\n3rd walk: \nHISTORIC CENTRE (2)\nMUSEUM AREA\nicons, church heritage items \nand relics are on display.\n5 \tTSIMISKI STREET\n(see p. 19)\n6 \t\x07AGIA SOFIA SQUARE\nThis beautiful square, adorned \nwith greenery, has been \nshaped after the 1890 fire  \nand encompasses the grounds \nof Agia Sofia church (see p. 9) \nand sections of Ermou Street \n(up to Kar. Dil Street) as well \nas Agias Sofias Street (up to \nEgnatia Street). Agias Sofias \nSt. is pedestrianised up to \nTsimiski Street. Halfway the \nstreet there is a monument \nin memory of the Genocide of \nPontic Greeks (2006, El. Valvi); \nseveral buildings around it \nare also very interesting, such \nas the 1925 Longos Building \n(the Red House) located at \nthe corner of Ermou and Agias \nSofias streets, and the 1924 \nChatzidimitriou Building (at the \npoint where Ermou and Kar. Dil \nStreets meet). The square is \nalso the location where Pavlou \nMela and Iktinou (pedestrian \nzone) Streets begin; along \nwith the adjacent Zefxidos \nStreet they are a hot spot area \nfor buys, or a coffee, a drink or \na meal.']","['34 1 EGNATIA STREET This central avenue has been there practically since Thessaloniki’s founding, as it is a section of the road constructed by the Romans in the 2nd c. BC, and connected Dyrrhachium (Durrës, in modern day Albania) with Constantinople. It starts at Dimokratia square (see p. 58) and ends at the TIF grounds (see p. 31) and the Aristotle University of Thessaloniki, splitting in two the town’s historic centre. It is a busy shopping area with numerous remarkable buildings of eclectic and art deco style dating to the early 20th c. (mostly old hotels) that are absolutely worth observing, as well as some of the city’s most important monuments. MUST SEE: 1.1 Kolomvou Square. The crossroads where Egnatia Street meets Antigonidon Street is indeed a bustling one! It was named after G. Colombo, an Italian who opened a hotel there in the early 20th century. This is the location of Kolomvou Archway (31, Egnatia St.) which has become a leisure hub with cafés, bars and restaurants inside. 1.2 Hamza Bey Mosque. It was built in 1467 by the daughter of Hamza Bey, the military commander of Sultan Murad II. It is the only mosque in Greece with a peristyle (a colonnaded yard). For many decades it housed a cinema named Alkazar. Currently there are renovation works under way. Once they are finished, it will house an exhibition of finds unearthed during the metro excavations. Right behind it you will see the City Manor which housed the Town Hall until recently. It is known at Karavan Serai as there used to be an ottoman inn here. (early 16th c.). 4th walk:']","Egnatia Street holds significant historical importance as it was originally part of a Roman road constructed in the 2nd century BC, connecting Dyrrhachium (modern-day Durrës in Albania) to Constantinople (now Istanbul, Turkey). This route facilitated trade and cultural exchange between the East and West, making it a vital artery for the Roman Empire.

As a central avenue in Thessaloniki, Egnatia Street has been integral to the city’s development and urban landscape. It has served as a bustling commercial hub, reflecting the city’s historical role as a crossroads of various cultures and civilizations. The street splits the historic center of Thessaloniki, showcasing a blend of architectural styles, including eclectic and art deco buildings from the early 20th century, which are remnants of the city’s rich past.

The connection to Constantinople is particularly noteworthy, as it underscores Thessaloniki's strategic importance in the Byzantine Empire. The road facilitated not only the movement of goods but also the flow of ideas and cultural influences, contributing to the city's diverse heritage. Egnatia Street, therefore, is not just a thoroughfare; it is a living testament to the historical interactions between these two significant cities.

Today, visitors can explore Egnatia Street and its surroundings, where they can observe historical monuments and vibrant local life. The area around Kolomvou Square and the Hamza Bey Mosque offers a glimpse into the city’s layered history, making it an ideal spot for sightseeing and experiencing the local culture. For those interested in photography and Instagrammable spots, the eclectic architecture and lively atmosphere provide ample opportunities to capture the essence of Thessaloniki’s historical significance and its connection to Constantinople.","Egnatia Street is a section of the road constructed by the Romans in the 2nd century BC, which connected Dyrrhachium (modern-day Durrës, Albania) with Constantinople, highlighting its historical significance as a vital route in ancient times.",0.5,0.17,0.6571428571428571,0.7425213125300352,0.9999999999,0.9999999999,1.0,0.8571428559183674,,0.8101081293057453
8,Can you provide detailed information about the Ancient Roman Forum and its historical significance as discovered in the excavations at Plateia Dikastirion?,"['It is divided in \nthree sections (cold, tepid \nand hot areas) and there is \nalso a vaulted tank for heating \nwater. It is widely known as the \nParadise Baths and it went by \nthat name until 1968. Right next \nto it there is a roman platform \nthat is indicative of the ground \nlevel 2000 years ago.\n1.6  Roman (Ancient) Forum\nDuring the roman period, \nthis 2-hectare area used to be \nthe social and religious centre \nof the city. Construction was \ncompleted in two phases  \n(in the mid-2nd and mid-  \n3rd centuries AD) and it was \ngradually abandoned after the \n7th century. The NW section \nof the archaeological site is \ncovered by a large rectangular \nsquare [Α] with traces of \nmarble paving. In the S section \nof the square lies the largest \npart of the double underground \nCryptoporticus [covered \npassageway] [Β] which was \nmost probably used as a public \nstorehouse.', '36\n4th walk: \nHISTORIC CENTRE (3)\nthat the place had been used \nby Christians as well, during \nthe late Roman period. South \nof the passageway there \nwere shops dating from the \n1st until the 13th century; the \nunderground Museum of the \nRoman Forum (see p. 71) was \nbuilt there as an extension. \nA 2nd - 4th c. AD Odeon [C] \nwas found behind the well-\npreserved eastern stoa. It  \nhas been restored and it is now \nused as a venue for cultural \nevents. A mint and an archive \noffice are right next to it. In the \nSE side, a round bath house \n[D] was unearthed which has \nbeen in use since the 1st c. BC. \nParts of a colonnade, mosaic \nfloors, marble stairs, a section \nof a stone-paved street, sewer \npipes, silver coins, stone and \nmarble sculptures were all \nfound in this archaeological \nsite. The forum is also where \nthe “Enchanted Ones” (las \nIncantadas) were discovered, \na two-storeyed colonnaded \narchway with Corinthian-order \ncolumns and pillars four of \nwhich have survived. They are \ndecorated with figures in relief \nin their interior as well as their \nexterior side (“Stoa of the \nStatuettes”).']","['35 4th walk: HISTORIC CENTRE (3) 1.3 Plateia Dikastirion [Court house square]. A spacious green square situated towards the end of Aristotelous Street. The Hébrard plans placed construction of the Court House as well as of other state buildings on this location (to create a civic centre); in 1966, however, excavations on the spot revealed the Ancient Roman Forum and the process was halted. In the centre of the square stands the imposing bust of Eleftherios Venizelos (1977, G. Pappas), who remained a prime minister of Greece for more than 12 years during the period 1910 – 1932. There are small copper workshops in the adjacent Chalkeon and Kleisouras Streets, and their business has been an ongoing tradition since the byzantine period. 1.4 Panagia [Virgin Mary] Chalkeon. (see p. 9) 1.5 Bey Hamami. It lies on the SE side of Plateia Dikastirion. This impressive edifice was built in 1444 and it is the country’s largest ottoman bath house, a multi- domed construction with separate rooms for males and females, structured along two parallel ways. It is divided in three sections (cold, tepid and hot areas) and there is also a vaulted tank for heating water. It is widely known as the Paradise Baths and it went by that name until 1968. Right next to it there is a roman platform that is indicative of the ground level 2000 years ago. 1.6']","The Ancient Roman Forum, located at Plateia Dikastirion, served as the social and religious heart of Thessaloniki during the Roman period. Spanning approximately 2 hectares, its construction occurred in two main phases during the mid-2nd and mid-3rd centuries AD. The forum was gradually abandoned after the 7th century, but its archaeological significance remains profound.

Excavations have revealed a large rectangular square in the northwest section, featuring traces of marble paving that hint at its former grandeur. The southern part of the square houses the double underground Cryptoporticus, a covered passageway likely used as a public storehouse. This structure showcases the advanced engineering of the time and provides insight into the daily life and commerce of ancient Thessaloniki.

Adjacent to the Cryptoporticus, the underground Museum of the Roman Forum was established, preserving artifacts and remnants from the site. Notable discoveries include a well-preserved Odeon from the 2nd to 4th centuries AD, which has been restored for cultural events, and a round bathhouse dating back to the 1st century BC. These findings illustrate the forum's role as a center for both social interaction and public entertainment.

The archaeological site has also yielded a wealth of artifacts, including parts of a colonnade, mosaic floors, marble stairs, and even silver coins. Among the most intriguing discoveries are the “Enchanted Ones” (las Incantadas), a two-storeyed colonnaded archway adorned with Corinthian columns, showcasing intricate relief figures.

Visiting the Ancient Roman Forum offers a unique opportunity to connect with Thessaloniki's rich history, making it an ideal spot for sightseeing. The blend of ancient architecture and cultural heritage provides numerous Instagrammable moments, perfect for capturing the essence of this historic city.","The Ancient Roman Forum was revealed during excavations at Plateia Dikastirion in 1966, which halted the construction of the Court House and other state buildings intended to create a civic center. This discovery highlights the historical significance of the site, as it reflects the urban planning and architectural practices of ancient Rome. The forum served as a central public space in Roman cities, where various activities, including political, social, and commercial events, took place.",0.0,0.54,0.6296296296296297,0.739249931789478,0.99999999995,0.99999999995,0.0,0.0,,0.6983439326269645
9,Who is Eleftherios Venizelos and why is he important?,"['35\n4th walk: \nHISTORIC CENTRE (3)\n1.3  Plateia Dikastirion \n[Court house square]. \nA spacious green square \nsituated towards the end \nof Aristotelous Street. \nThe Hébrard plans placed \nconstruction of the Court \nHouse as well as of other  \nstate buildings on this location \n(to create a civic centre);  \nin 1966, however, excavations \non the spot revealed the \nAncient Roman Forum and  \nthe process was halted. In  \nthe centre of the square stands \nthe imposing bust of Eleftherios \nVenizelos (1977, G. Pappas), \nwho remained a prime minister \nof Greece for more than 12 \nyears during the period 1910 – \n1932. There are small copper \nworkshops in the adjacent \nChalkeon and Kleisouras \nStreets, and their business has \nbeen an ongoing tradition since \nthe byzantine period.\n1.4  Panagia [Virgin Mary] \nChalkeon.\n(see p. 9)\n1.5  Bey Hamami.\nIt lies on the SE side of  \nPlateia Dikastirion. This impressive \nedifice was built in 1444 and  \nit is the country’s largest \nottoman bath house, a multi-\ndomed construction with \nseparate rooms for males and \nfemales, structured along two \nparallel ways. It is divided in \nthree sections (cold, tepid \nand hot areas) and there is \nalso a vaulted tank for heating \nwater.', 'Following the central \nEuropean architectural trend of \nthe time, the main building is  \na three storey construction with \nelaborate interior decoration \nand has access to a tower. \nPrince Nicholas, the city’s first \nGreek military commander, was \naccommodated here in 1912; \nin 1916-1917 E. Venizelos \nstayed in the villa as head of \nthe temporary revolutionary \nGovernment of National Defence. \nIn 1928 the building was bought \nby the National Bank of Greece \nand during the years 1938 – \n1961 it housed some of the city’s \nhighschools. Since 1989, this  \nis the location of the Thessaloniki  \nCultural Centre of the National \nBank of Greece Cultural \nFoundation (MIET, see p. 77). \nNext to it there is a red brick \ncastle, known as Chateau mon \nbonheur, dating to 1890.\n3.6  Ahmet Kapanci Villa \n(105, Vas. Olgas Ave.).\nIt was built in 1905 by P. \nArrigoni, as a country (seaside) \nresidence for Ahmet Kapanci,  \na Jewish merchant and Mayor \nof the City. The architectural \nstyle is a mixed one as the \neclectic features combine \nneoclassical, renaissance, art \nnouveau and gothic motifs.  \nIn 1926, the Greek State took \nownership and since then \nthe premises housed the Red \nCross, the Gestapo, and NATO \nservices until 1973.']","['35 4th walk: HISTORIC CENTRE (3) 1.3 Plateia Dikastirion [Court house square]. A spacious green square situated towards the end of Aristotelous Street. The Hébrard plans placed construction of the Court House as well as of other state buildings on this location (to create a civic centre); in 1966, however, excavations on the spot revealed the Ancient Roman Forum and the process was halted. In the centre of the square stands the imposing bust of Eleftherios Venizelos (1977, G. Pappas), who remained a prime minister of Greece for more than 12 years during the period 1910 – 1932. There are small copper workshops in the adjacent Chalkeon and Kleisouras Streets, and their business has been an ongoing tradition since the byzantine period. 1.4 Panagia [Virgin Mary] Chalkeon. (see p. 9) 1.5 Bey Hamami. It lies on the SE side of Plateia Dikastirion. This impressive edifice was built in 1444 and it is the country’s largest ottoman bath house, a multi- domed construction with separate rooms for males and females, structured along two parallel ways. It is divided in three sections (cold, tepid and hot areas) and there is also a vaulted tank for heating water. It is widely known as the Paradise Baths and it went by that name until 1968. Right next to it there is a roman platform that is indicative of the ground level 2000 years ago. 1.6']","Eleftherios Venizelos was a prominent Greek statesman and politician, serving as Prime Minister of Greece multiple times between 1910 and 1932. He is widely regarded as one of the most significant figures in modern Greek history due to his influential role in shaping the country's political landscape and his contributions to its territorial expansion.

Born in 1864 on the island of Crete, Venizelos initially pursued a career in law before entering politics. His leadership during the Balkan Wars (1912-1913) was crucial in securing significant territorial gains for Greece, including parts of Macedonia and Epirus. Venizelos was a key advocate for the unification of all Greek-speaking territories, which resonated deeply with national aspirations.

His tenure was marked by progressive reforms aimed at modernizing Greece, including advancements in education, infrastructure, and the economy. Venizelos was also instrumental in establishing Greece as a republic and played a vital role in the country's involvement in World War I, aligning with the Allies against the Central Powers.

The bust of Eleftherios Venizelos located in Plateia Dikastirion in Thessaloniki serves as a tribute to his legacy. This square, situated at the end of Aristotelous Street, is a significant civic center that reflects his vision for a modern Greece. Venizelos's impact on Greek identity and politics is profound, making him a celebrated figure in the nation's history.

For visitors interested in Greek culture and history, learning about Venizelos provides valuable insight into the country's past and its journey towards modernization. His contributions continue to influence contemporary Greece, making him an essential figure to understand during your travels.","Eleftherios Venizelos was a prime minister of Greece for more than 12 years during the period 1910 – 1932. His bust stands in the centre of Plateia Dikastirion, which is a spacious green square in the historic centre.",1.0,0.51,0.41379310344827586,0.8693046163077631,0.9999999999,0.9999999999,1.0,0.9999999980000001,,0.887958754598203
10,What is Paradise Baths?,"['It is divided in \nthree sections (cold, tepid \nand hot areas) and there is \nalso a vaulted tank for heating \nwater. It is widely known as the \nParadise Baths and it went by \nthat name until 1968. Right next \nto it there is a roman platform \nthat is indicative of the ground \nlevel 2000 years ago.\n1.6  Roman (Ancient) Forum\nDuring the roman period, \nthis 2-hectare area used to be \nthe social and religious centre \nof the city. Construction was \ncompleted in two phases  \n(in the mid-2nd and mid-  \n3rd centuries AD) and it was \ngradually abandoned after the \n7th century. The NW section \nof the archaeological site is \ncovered by a large rectangular \nsquare [Α] with traces of \nmarble paving. In the S section \nof the square lies the largest \npart of the double underground \nCryptoporticus [covered \npassageway] [Β] which was \nmost probably used as a public \nstorehouse.', '60\n7th walk: \nWEST OF THE CENTRE-STAVROUPOLI\n2.6  Holy Twelve Apostles \nChurch\n(see p. 8).\n2.7  West City Walls.\nSections of the city’s west walls  \nremain along Arkadioupoleos and \nEirinis Streets and finds related \nto Litaia Gate have recently \nbeen located at the corner \nof Agiou Dimitriou and Agiou \nNestoros Streets. This gate \nused to be one of the seven \ngreat gates of the fortified city \nand formed part of the Early \nChristian period walls; it was \nnamed after Liti, a Byzantine \ntown to which the gate led. \nThe Golden Gate was also \nlocated on the Egnatia  \nStreet level.\n2.8  Pasha Hamam  \n[Paşa Hamami] (Phoenix  \nBath house).\nIt was built during the \n1520s by Cezeri Kasim Paşa. \nAlso known as Phoenix Bath \nhouse, this used to be the \nlast ottoman bath house open \nin town, as it closed down in \nas late as 1981. It is located \nat the corner of Kalvou and \nPineiou Streets, near the west \nwalls and the church of the \nHoly Twelve Apostles, and the \nstructure of the building was \nplanned with great care.']","['35 4th walk: HISTORIC CENTRE (3) 1.3 Plateia Dikastirion [Court house square]. A spacious green square situated towards the end of Aristotelous Street. The Hébrard plans placed construction of the Court House as well as of other state buildings on this location (to create a civic centre); in 1966, however, excavations on the spot revealed the Ancient Roman Forum and the process was halted. In the centre of the square stands the imposing bust of Eleftherios Venizelos (1977, G. Pappas), who remained a prime minister of Greece for more than 12 years during the period 1910 – 1932. There are small copper workshops in the adjacent Chalkeon and Kleisouras Streets, and their business has been an ongoing tradition since the byzantine period. 1.4 Panagia [Virgin Mary] Chalkeon. (see p. 9) 1.5 Bey Hamami. It lies on the SE side of Plateia Dikastirion. This impressive edifice was built in 1444 and it is the country’s largest ottoman bath house, a multi- domed construction with separate rooms for males and females, structured along two parallel ways. It is divided in three sections (cold, tepid and hot areas) and there is also a vaulted tank for heating water. It is widely known as the Paradise Baths and it went by that name until 1968. Right next to it there is a roman platform that is indicative of the ground level 2000 years ago. 1.6']","Paradise Baths, known historically by this name until 1968, is a significant archaeological site located in Thessaloniki. This ancient bath complex is divided into three sections: cold, tepid, and hot areas, which were typical features of Roman baths. It also includes a vaulted tank designed for heating water, showcasing the advanced engineering of the time.

Adjacent to the Paradise Baths is a Roman platform that provides insight into the ground level of the city approximately 2000 years ago. This site reflects the social and cultural practices of the Roman period, where baths served not only as places for bathing but also as social hubs for the community.

Visiting Paradise Baths offers a unique opportunity to explore the remnants of ancient Roman architecture and understand the historical significance of public baths in Roman society. The site is an excellent spot for photography, with its intriguing structures and historical context, making it ideal for capturing Instagrammable moments.

As a first-time visitor, you can appreciate the blend of history and culture that Paradise Baths represents. It is a place where you can connect with the past while enjoying the leisure of sightseeing. The site is accessible and can be easily included in a weekend itinerary, especially during the summer when the weather is pleasant for outdoor exploration.

Overall, Paradise Baths is a must-visit for anyone interested in the rich history of Thessaloniki, providing a glimpse into the daily life of ancient Romans and the architectural prowess of that era.","Paradise Baths, also known as Bey Hamami, is the country’s largest Ottoman bath house, built in 1444. It features a multi-domed construction with separate rooms for males and females, divided into cold, tepid, and hot areas, and includes a vaulted tank for heating water.",0.5,0.14,0.3076923076923077,0.5806398230478456,0.99999999995,0.9999999999,0.0,0.249999999375,,0.7246094409099261
11,What can you tell me about Kleisouras Streets and its significance in the historic center?,"['The monumental style of \narchitecture is shown in the \nbuildings’ facades, colonnades, \narcades and porticos, which \ncombine elements from the \ncity’s Byzantine tradition \nwith European interwar \nperiod motifs. The square is \nlandmarked by two identical \nconcave buildings: Electra \nPalace hotel (late sixties) - \nbuilt by GNTO architects -  \non the west side, and Olympion \non the east side, which was \nprogressively erected and \ncompleted by the late fifties \n(designed by J. Moshé) \nand is now the seat of the \nThessaloniki Film Festival  \n(see p. 108).\nMUST SEE:\n1.1  Aristotelous Street.\nPedestrianised historic \nboulevard, that ends in Egnatia \nStreet (see p. 34). According \nto the Hébrard plans, it would \n2nd walk: \nHISTORIC CENTRE (1) \nTRADITIONAL COMMERCIAL CENTRE\n4.1\n6.1\n6.3\n6.2\n6.5\n6.6\n6.7\n1.1\n1.2\n6.8\n7.5\n7.3\n7.2\n7.2\n7.1\n7.4\n6.4\n3.1\n1\n2\n3\n4\n5\n7', '23\n2nd walk: \nHISTORIC CENTRE (1)\nTRADITIONAL COMMERCIAL CENTRE\nwarehouses in Thessaloniki see \nalso p. 62). To change it into \na shopping mall (Plateia) in \n1995-1997, it was completely \nreshaped with only the exterior \nremaining unchanged. Today it \nhouses shops, cinemas, cafés \nand restaurants, all of which \nsurround the central atrium.\n6.8  Buildings on Karolou \nDil [Charles Diehl] street.\nAt the junction of Tsimiski \nand Karolou Dil Streets lie \nimpressive buildings that \ndate to the early 20th c., now \nhousing shops and offices; \nthey are absolutely worth your \nattention. \n7 \t\x07TRADITIONAL \nMARKETS\nThe area west of Aristotelous \nstreet and south of Egnatia \nStreet encompasses the \ntown’s traditional market; it \nis dotted with small shops, \nmalls and arcades, most of \nwhich date back to the time \nof the Turkish Occupation. \nToday, in these much visited \nmarketplaces, you can find all \nkinds of products – food and \nspices, fabrics, jewellery, small \nboutiques and also tavernas, \nouzo restaurants and coffee \nshops.\nMUST SEE:\n7.1  Modiano Market.\nIt was built in 1922 by \nengineer E. Modiano, and it is \nknown as Modiano Market. It \nis a glass-roofed rectangular \nedifice containing 140 food \nshops inside its three arcades.']","['35 4th walk: HISTORIC CENTRE (3) 1.3 Plateia Dikastirion [Court house square]. A spacious green square situated towards the end of Aristotelous Street. The Hébrard plans placed construction of the Court House as well as of other state buildings on this location (to create a civic centre); in 1966, however, excavations on the spot revealed the Ancient Roman Forum and the process was halted. In the centre of the square stands the imposing bust of Eleftherios Venizelos (1977, G. Pappas), who remained a prime minister of Greece for more than 12 years during the period 1910 – 1932. There are small copper workshops in the adjacent Chalkeon and Kleisouras Streets, and their business has been an ongoing tradition since the byzantine period. 1.4 Panagia [Virgin Mary] Chalkeon. (see p. 9) 1.5 Bey Hamami. It lies on the SE side of Plateia Dikastirion. This impressive edifice was built in 1444 and it is the country’s largest ottoman bath house, a multi- domed construction with separate rooms for males and females, structured along two parallel ways. It is divided in three sections (cold, tepid and hot areas) and there is also a vaulted tank for heating water. It is widely known as the Paradise Baths and it went by that name until 1968. Right next to it there is a roman platform that is indicative of the ground level 2000 years ago. 1.6']","Kleisouras Street is not specifically mentioned in the provided excerpts, but it is likely part of the broader historic center of Thessaloniki, which is rich in cultural and architectural significance. The historic center is characterized by its pedestrian-friendly streets, vibrant markets, and a blend of Byzantine and European architectural styles.

In this area, you can explore notable streets like Aristotelous Street, which is a bustling boulevard that connects to Egnatia Street. This pedestrianized street is perfect for leisurely strolls, offering a variety of shops, cafés, and restaurants, making it an ideal spot for budget travelers seeking local experiences. The architecture along these streets showcases impressive buildings from the early 20th century, reflecting the city's rich history.

Nearby, the traditional markets, particularly the Modiano Market, are a must-visit. Built in 1922, this market features a glass-roofed structure housing numerous food shops, allowing you to immerse yourself in local flavors and products. The surrounding area is dotted with small shops and arcades that date back to the time of the Turkish Occupation, providing a glimpse into the city's past.

For those interested in photography and Instagrammable spots, the historic center offers numerous picturesque locations, including the iconic facades of the Electra Palace and Olympion buildings. These landmarks not only serve as architectural highlights but also as venues for cultural events, such as the Thessaloniki Film Festival.

Overall, while Kleisouras Street may not be highlighted, the historic center of Thessaloniki is a vibrant area filled with sights, sounds, and experiences that cater to a variety of interests, making it an excellent choice for a weekend visit.","Kleisouras Streets is located adjacent to the Court House square, known as Plateia Dikastirion, in the historic center. This area features small copper workshops that have been part of the local tradition since the Byzantine period, highlighting the street's historical significance and ongoing craftsmanship.",0.0,0.21,0.9090909090909091,0.6238152988795693,0.99999999995,0.0,0.0,0.0,,0.0
12,What was the Roman Forum in Thessaloniki used for during ancient times?,"['It is divided in \nthree sections (cold, tepid \nand hot areas) and there is \nalso a vaulted tank for heating \nwater. It is widely known as the \nParadise Baths and it went by \nthat name until 1968. Right next \nto it there is a roman platform \nthat is indicative of the ground \nlevel 2000 years ago.\n1.6  Roman (Ancient) Forum\nDuring the roman period, \nthis 2-hectare area used to be \nthe social and religious centre \nof the city. Construction was \ncompleted in two phases  \n(in the mid-2nd and mid-  \n3rd centuries AD) and it was \ngradually abandoned after the \n7th century. The NW section \nof the archaeological site is \ncovered by a large rectangular \nsquare [Α] with traces of \nmarble paving. In the S section \nof the square lies the largest \npart of the double underground \nCryptoporticus [covered \npassageway] [Β] which was \nmost probably used as a public \nstorehouse.', '36\n4th walk: \nHISTORIC CENTRE (3)\nthat the place had been used \nby Christians as well, during \nthe late Roman period. South \nof the passageway there \nwere shops dating from the \n1st until the 13th century; the \nunderground Museum of the \nRoman Forum (see p. 71) was \nbuilt there as an extension. \nA 2nd - 4th c. AD Odeon [C] \nwas found behind the well-\npreserved eastern stoa. It  \nhas been restored and it is now \nused as a venue for cultural \nevents. A mint and an archive \noffice are right next to it. In the \nSE side, a round bath house \n[D] was unearthed which has \nbeen in use since the 1st c. BC. \nParts of a colonnade, mosaic \nfloors, marble stairs, a section \nof a stone-paved street, sewer \npipes, silver coins, stone and \nmarble sculptures were all \nfound in this archaeological \nsite. The forum is also where \nthe “Enchanted Ones” (las \nIncantadas) were discovered, \na two-storeyed colonnaded \narchway with Corinthian-order \ncolumns and pillars four of \nwhich have survived. They are \ndecorated with figures in relief \nin their interior as well as their \nexterior side (“Stoa of the \nStatuettes”).']","['Roman (Ancient) Forum During the roman period, this 2-hectare area used to be the social and religious centre of the city. Construction was completed in two phases (in the mid-2nd and mid- 3rd centuries AD) and it was gradually abandoned after the 7th century. The NW section of the archaeological site is covered by a large rectangular square [Α] with traces of marble paving. In the S section of the square lies the largest part of the double underground Cryptoporticus [covered passageway] [Β] which was most probably used as a public storehouse. On one of its walls a valuable early Christian mural was uncovered and this shows 9 10 11 12 PARASKEVOPOULOU KONSTANTINOUPOLEOS DELFO KAFTANTZOGLOU PAPAFI PAPAFI PAPAFI KLEANTHOUS MARKOU BOTSARI PAPANASTASIOU PAPANASTASIOU ANATOLIKIS THRAKIS KANARI KANARI KARAKA MARATHONOS GRIGORIOU LAMPRAKI KONSTANTINOU KARAMANLI STRATOU AVE. PAPANASTASIOU AGIOS IOANNIS CHRYSOSTOMOS AGIA FOTEINI SARANTAPOROU BIZANIOU AGIAS TRIADAS BIZANIOU CHATZI FILOPOIMENOS LYTRA EDISON S NOTARA KAIRI SKOUFA XANTHOU TSAKALOF PATMOU PIGIS KYRIAKIDI ELEFTHERON ONA INIDI MATSI U OIT N E X F A PLITHONOS GEMISTOU GKYZI RIADI VYZANTIOU VELISSARIOU AETORACHIS EFZONON CHARISI CHARISI ILIADOS ZAIMI U DOUSMA ALKMINIS SINA ADIOU MITR. PLATAION DANIOLOU AGIOU VASILEIOU GENNADIOU MITR. THINEAS DELIGI PRAXITELOUS PAPAF FLEMING ARCHAIOLOGIKOU MOUSEIOU NASIOU DIAKOU CHIRS DIONOS GAMVETA DELIGIANNI IAKOVOU GALIVALDI MIAOULI XENOFONTOS KYVELIS CHARISI PERDIKA PASALIDI KIMONOS OSTROVOU PESTON PESTON ANDROU ALONNISOU MYKONOU AMOLIANIS SKYROU PARNITHAS SKALTSOUNI LYDIAS NIOVIS YMMITOU ASKLIPIOU PELIS PINDAROU LAMIAS IPEIROU PERDIKA IOANNINON EVVOIAS LITOCHOROU KRESNAS NEVROKOPIOU LITOCHOROU KORYTSAS TROIAS SERRON OMIROU PSAROU KRITONOS YDRAS EVRYVIADOU VALTETSIOU PELIAS ARGENTI KILKISSIOU LACHANA U O D AIT LI M ARCHIMIDOUS ELEFTHEROTON DOIRANIS DOIRANIS KARPATHOU TZOVAROPOULOU KERKYRAS RODIOU RIGOPOULOU NAOUSSIS AMYNTAIOU KATSIMIDI DANGLI KOUNTOURIOTI ELEFTHERIAS ELEFTHERIAS THRAKIS YPSILANTOU KOLOKOTRONI KANARI MIAOULI MIAOULI FILOTHEIS RODODAFNIS YAKINTHOU FILOMILAS OLYNTHOU LOTOU IVYSKOU ELEAS DRIOS EVAGORA PAPAILIAKI KLEANTHOUS MARONIAS CHOLOMONTOS ISIDOROU IPATIAS KISSOU KARIATIDAS KAVIRON AGAMEMNONOS ARIONOS STOVAIOU FILONOS ARGAIOU FOINIKOS EFESSOU KAISAREIAS KALLIPOLEOS VRYOULON KYZIKOU NIKOMIDEIAS NEAPOLEOS MIDEIAS PROUSIS IKONIOU KROMNIS PYRGOU MALAKOPIS KAPADDOKIAS LYKAONIAS SINIOSOGLOU NIKAIAS KAROLIDOU SARANTI CHEIMARRAS PSARON PRIAMOU MITSAKI MITROPOULOU IONIAS SANTAS PAPOULA YPARCHOU FOKYLIDOU KERAMIKOU EPIDAVROU TSELIOU PRAXAGORA OLYMPIAS VOSPOROU AMFIPOLEOS MIKRAS ASIAS PONTOU VITHYNIAS PAPAGEORGIOU IOANNOU KAISAREIAS METRON IMVROU AGRIANON CHIOU CHOURMOUZI APOLLONOS SYROU FAIAKON LARNAKOS AMMOCHOSTOU NAFPLIOU NAFPLIOU DERKON KORDELIOU VIZYIS DORYLAIOU TINOU TENEDOU DARDANELLION DIMITSANAS EPIDAVROU EFSTATHIOU MITROPOLITOU CHANDR KARANIVA ATLANTID SVOL VOSPO ZACH ZIRIN ZONARA ANAXIME ANATOLIKIS ROMYLIAS ISO TOUSSA SPEFSIPOU MYSTAKID DYSTOMOU MIKROU ANTISTHENOUS STEFANOU DIMOCHAROUS MISIRLI PILEAS AEROPOU PAFSILYPOU TRIANTAFYLLOPOULOU GRIGORIOU LAMPRAKI (KONIT SLI OSIAS XENIS TSELEPI TSIAPANOU TSAMI STRATIGI VISTA ANGELOPOULOU DIVOLI GKOURA GRIGORIOU STEFANOU ATHINA ANTHEMOUNTOS LEFAKI PAFSANIA SEMELIS AETIONOS PANTAZIDI PERRAIVOU PERRAIVOU SPANOU IPPO ARTAKIS PONTOU EPTALOFOU PARMENIDI ANAVRYTON FILIMONOS TPIKALON AGIAS MARINAS TIROLOIS TIROLOIS TRITONOS TRIPTOLEMOU POLYGNOTOU IPPODROMIOU POLIVIOU PROTOGENOUS DIAGORA LISSIPOU ANTIFANOS MEGAKLEOUS POLYKLEITOU EMPEDOKLEOUS ANDRIOTI VIANDROU VARNALI ADAMIDOU ZAIMI ORTANSIAS IRIDOS MAKEDONIAS ANAFIS SAMOU POROU AIGINIS KYTHIRON LACHANA MIKRAS ASIAS TRIKOUPI GYMNASTIRIOU ANAPAFSEOS ELEFTHERIAS AMORGOU SERIFOU MILOU MESOLONGIOU AG. SPYRIDONA SERRON SERRON KASTORIAS GRIGORIOU LAMPRAKI KATSIMDIDI SIDIROKASTROU SPARTIS KONSTANTINIDI AMALIAS ZERVA AGIOS FANOURIOS AGIA MARINA AGIA VARVARA AGIOS THERAPON AGIOS SPYRIDONAS K Y K L A M I N O N DOXA ANO TOUMPA MALAKOPI CHA KATO TOUMPA TOUMPA CEMETERY MAKEDONIA GOVATZIDAKI SQ. TRIANDRIA PAPAFIO U) THEAGENEIO CANCER HOSPITAL IPPOKRATEIO GENERAL HOSPITAL OF THESSALONIKI Y LONIKI INFECTIOUS DISEASES HOSPITAL RETIREMENT HOME 3 3.9 A B Γ Δ 33']","The Roman Forum in Thessaloniki served as the social and religious center of the city during the Roman period. Spanning an area of 2 hectares, its construction occurred in two main phases during the mid-2nd and mid-3rd centuries AD. The forum was a bustling hub where citizens gathered for various activities, including socializing, commerce, and religious ceremonies.

Key features of the forum included a large rectangular square, which showcased traces of marble paving, indicating its significance and grandeur. The site also housed shops that operated from the 1st to the 13th century, highlighting its long-standing importance as a commercial area. 

One of the notable structures within the forum was the double underground Cryptoporticus, likely used as a public storehouse. This covered passageway provided access to different parts of the forum and facilitated trade and movement within the area. Additionally, the forum contained an Odeon, a theater-like structure used for performances and cultural events, which has been restored for contemporary use.

The archaeological site revealed various artifacts, including parts of a colonnade, mosaic floors, marble stairs, and even remnants of sewer pipes, showcasing the advanced infrastructure of the time. Among the significant discoveries were the “Enchanted Ones” (las Incantadas), a two-storeyed colonnaded archway adorned with Corinthian columns, which further emphasized the artistic and architectural achievements of the era.

Overall, the Roman Forum was a vital center for social interaction, commerce, and cultural activities, reflecting the vibrant life of Thessaloniki during ancient times.","During the Roman period, the Roman Forum was the social and religious centre of the city. It was constructed in two phases, completed in the mid-2nd and mid-3rd centuries AD, and was gradually abandoned after the 7th century.",1.0,0.07,0.5666666666666667,0.7124596217536038,0.99999999995,0.9999999999,0.0,0.7999999984,,0.887139902652998
13,What historical significance does Macedonia hold in relation to the Roman Forum?,"['71\ncourtyard). Antiquities dating to \nthe 2nd – 4th c. AD are divided in \ntwo sections: in the first one a \nreconstruction is attempted of \na cemetery segment containing \nfinds, sarcophagi and altars; \nthe second one involves the \nre-creation of a Greco-roman \nhouse with mosaic floors on \ndisplay and items of daily use.\n• Prehistoric Macedonia. \n(basement, room 11). The \nitems exhibited refer to Man’s \nfirst productive stages in \nMacedonia (with activities such \nas hunting, fishing, agriculture, \nstock farming, weaving, \nmetallurgy). There are also \ncasts of skulls belonging to \nOuranopithecus Macedoniensis, \nan early hominid primate, as \nwell as of the Man found in \nPetralona cave (see p. 92).\n• Temporary exhibitions. \nThe museum organises each \nyear a major thematic exhibition \nand 2-5 minor ones, where \nparticular aspects of every day \nlife in Macedonia are treated in \nconnection with the Greek and \nthe Mediterranean area.\nTHE ROMAN FORUM \nMUSEUM\nSmall yet very interesting, \nthis museum was inaugurated \nin 2010. A narrative of local \nexcavations and information \non the museum’s building \nstages is on display in the \nvestibule; in the main hall, \nvisitors will see a depiction \nof the area’s history from the \nHellenistic years until the 4th \nc. AD.', '36\n4th walk: \nHISTORIC CENTRE (3)\nthat the place had been used \nby Christians as well, during \nthe late Roman period. South \nof the passageway there \nwere shops dating from the \n1st until the 13th century; the \nunderground Museum of the \nRoman Forum (see p. 71) was \nbuilt there as an extension. \nA 2nd - 4th c. AD Odeon [C] \nwas found behind the well-\npreserved eastern stoa. It  \nhas been restored and it is now \nused as a venue for cultural \nevents. A mint and an archive \noffice are right next to it. In the \nSE side, a round bath house \n[D] was unearthed which has \nbeen in use since the 1st c. BC. \nParts of a colonnade, mosaic \nfloors, marble stairs, a section \nof a stone-paved street, sewer \npipes, silver coins, stone and \nmarble sculptures were all \nfound in this archaeological \nsite. The forum is also where \nthe “Enchanted Ones” (las \nIncantadas) were discovered, \na two-storeyed colonnaded \narchway with Corinthian-order \ncolumns and pillars four of \nwhich have survived. They are \ndecorated with figures in relief \nin their interior as well as their \nexterior side (“Stoa of the \nStatuettes”).']","['Roman (Ancient) Forum During the roman period, this 2-hectare area used to be the social and religious centre of the city. Construction was completed in two phases (in the mid-2nd and mid- 3rd centuries AD) and it was gradually abandoned after the 7th century. The NW section of the archaeological site is covered by a large rectangular square [Α] with traces of marble paving. In the S section of the square lies the largest part of the double underground Cryptoporticus [covered passageway] [Β] which was most probably used as a public storehouse. On one of its walls a valuable early Christian mural was uncovered and this shows 9 10 11 12 PARASKEVOPOULOU KONSTANTINOUPOLEOS DELFO KAFTANTZOGLOU PAPAFI PAPAFI PAPAFI KLEANTHOUS MARKOU BOTSARI PAPANASTASIOU PAPANASTASIOU ANATOLIKIS THRAKIS KANARI KANARI KARAKA MARATHONOS GRIGORIOU LAMPRAKI KONSTANTINOU KARAMANLI STRATOU AVE. PAPANASTASIOU AGIOS IOANNIS CHRYSOSTOMOS AGIA FOTEINI SARANTAPOROU BIZANIOU AGIAS TRIADAS BIZANIOU CHATZI FILOPOIMENOS LYTRA EDISON S NOTARA KAIRI SKOUFA XANTHOU TSAKALOF PATMOU PIGIS KYRIAKIDI ELEFTHERON ONA INIDI MATSI U OIT N E X F A PLITHONOS GEMISTOU GKYZI RIADI VYZANTIOU VELISSARIOU AETORACHIS EFZONON CHARISI CHARISI ILIADOS ZAIMI U DOUSMA ALKMINIS SINA ADIOU MITR. PLATAION DANIOLOU AGIOU VASILEIOU GENNADIOU MITR. THINEAS DELIGI PRAXITELOUS PAPAF FLEMING ARCHAIOLOGIKOU MOUSEIOU NASIOU DIAKOU CHIRS DIONOS GAMVETA DELIGIANNI IAKOVOU GALIVALDI MIAOULI XENOFONTOS KYVELIS CHARISI PERDIKA PASALIDI KIMONOS OSTROVOU PESTON PESTON ANDROU ALONNISOU MYKONOU AMOLIANIS SKYROU PARNITHAS SKALTSOUNI LYDIAS NIOVIS YMMITOU ASKLIPIOU PELIS PINDAROU LAMIAS IPEIROU PERDIKA IOANNINON EVVOIAS LITOCHOROU KRESNAS NEVROKOPIOU LITOCHOROU KORYTSAS TROIAS SERRON OMIROU PSAROU KRITONOS YDRAS EVRYVIADOU VALTETSIOU PELIAS ARGENTI KILKISSIOU LACHANA U O D AIT LI M ARCHIMIDOUS ELEFTHEROTON DOIRANIS DOIRANIS KARPATHOU TZOVAROPOULOU KERKYRAS RODIOU RIGOPOULOU NAOUSSIS AMYNTAIOU KATSIMIDI DANGLI KOUNTOURIOTI ELEFTHERIAS ELEFTHERIAS THRAKIS YPSILANTOU KOLOKOTRONI KANARI MIAOULI MIAOULI FILOTHEIS RODODAFNIS YAKINTHOU FILOMILAS OLYNTHOU LOTOU IVYSKOU ELEAS DRIOS EVAGORA PAPAILIAKI KLEANTHOUS MARONIAS CHOLOMONTOS ISIDOROU IPATIAS KISSOU KARIATIDAS KAVIRON AGAMEMNONOS ARIONOS STOVAIOU FILONOS ARGAIOU FOINIKOS EFESSOU KAISAREIAS KALLIPOLEOS VRYOULON KYZIKOU NIKOMIDEIAS NEAPOLEOS MIDEIAS PROUSIS IKONIOU KROMNIS PYRGOU MALAKOPIS KAPADDOKIAS LYKAONIAS SINIOSOGLOU NIKAIAS KAROLIDOU SARANTI CHEIMARRAS PSARON PRIAMOU MITSAKI MITROPOULOU IONIAS SANTAS PAPOULA YPARCHOU FOKYLIDOU KERAMIKOU EPIDAVROU TSELIOU PRAXAGORA OLYMPIAS VOSPOROU AMFIPOLEOS MIKRAS ASIAS PONTOU VITHYNIAS PAPAGEORGIOU IOANNOU KAISAREIAS METRON IMVROU AGRIANON CHIOU CHOURMOUZI APOLLONOS SYROU FAIAKON LARNAKOS AMMOCHOSTOU NAFPLIOU NAFPLIOU DERKON KORDELIOU VIZYIS DORYLAIOU TINOU TENEDOU DARDANELLION DIMITSANAS EPIDAVROU EFSTATHIOU MITROPOLITOU CHANDR KARANIVA ATLANTID SVOL VOSPO ZACH ZIRIN ZONARA ANAXIME ANATOLIKIS ROMYLIAS ISO TOUSSA SPEFSIPOU MYSTAKID DYSTOMOU MIKROU ANTISTHENOUS STEFANOU DIMOCHAROUS MISIRLI PILEAS AEROPOU PAFSILYPOU TRIANTAFYLLOPOULOU GRIGORIOU LAMPRAKI (KONIT SLI OSIAS XENIS TSELEPI TSIAPANOU TSAMI STRATIGI VISTA ANGELOPOULOU DIVOLI GKOURA GRIGORIOU STEFANOU ATHINA ANTHEMOUNTOS LEFAKI PAFSANIA SEMELIS AETIONOS PANTAZIDI PERRAIVOU PERRAIVOU SPANOU IPPO ARTAKIS PONTOU EPTALOFOU PARMENIDI ANAVRYTON FILIMONOS TPIKALON AGIAS MARINAS TIROLOIS TIROLOIS TRITONOS TRIPTOLEMOU POLYGNOTOU IPPODROMIOU POLIVIOU PROTOGENOUS DIAGORA LISSIPOU ANTIFANOS MEGAKLEOUS POLYKLEITOU EMPEDOKLEOUS ANDRIOTI VIANDROU VARNALI ADAMIDOU ZAIMI ORTANSIAS IRIDOS MAKEDONIAS ANAFIS SAMOU POROU AIGINIS KYTHIRON LACHANA MIKRAS ASIAS TRIKOUPI GYMNASTIRIOU ANAPAFSEOS ELEFTHERIAS AMORGOU SERIFOU MILOU MESOLONGIOU AG. SPYRIDONA SERRON SERRON KASTORIAS GRIGORIOU LAMPRAKI KATSIMDIDI SIDIROKASTROU SPARTIS KONSTANTINIDI AMALIAS ZERVA AGIOS FANOURIOS AGIA MARINA AGIA VARVARA AGIOS THERAPON AGIOS SPYRIDONAS K Y K L A M I N O N DOXA ANO TOUMPA MALAKOPI CHA KATO TOUMPA TOUMPA CEMETERY MAKEDONIA GOVATZIDAKI SQ. TRIANDRIA PAPAFIO U) THEAGENEIO CANCER HOSPITAL IPPOKRATEIO GENERAL HOSPITAL OF THESSALONIKI Y LONIKI INFECTIOUS DISEASES HOSPITAL RETIREMENT HOME 3 3.9 A B Γ Δ 33']","Macedonia holds significant historical importance, particularly in relation to the Roman Forum, which serves as a testament to the region's rich cultural and architectural heritage. The Roman Forum in Thessaloniki, built on the site of earlier structures, showcases the evolution of the area from the Hellenistic period through to the late Roman era. This archaeological site reveals layers of history, including shops that operated from the 1st to the 13th century, indicating the area's continuous use and economic activity over centuries.

Key features of the Roman Forum include a well-preserved Odeon, dating from the 2nd to the 4th century AD, which has been restored for cultural events, highlighting the ongoing relevance of this historical site. The discovery of a round bathhouse from the 1st century BC further emphasizes the sophistication of Roman urban life in Macedonia, showcasing advanced engineering and social customs of the time.

Additionally, the forum is notable for the ""Enchanted Ones"" (las Incantadas), a two-storeyed colonnaded archway adorned with Corinthian columns and relief sculptures. This architectural marvel not only reflects the artistic achievements of the period but also serves as a focal point for understanding the cultural exchanges that occurred in Macedonia during Roman rule.

Overall, the Roman Forum encapsulates the historical narrative of Macedonia, illustrating its role as a vibrant center of commerce, culture, and social interaction in the ancient world. For visitors, exploring this site offers a unique opportunity to connect with the region's past while enjoying its modern-day cultural offerings.","During the Roman period, Macedonia was home to a 2-hectare area that served as the social and religious center of the city, known as the Roman Forum. This site was constructed in two phases during the mid-2nd and mid-3rd centuries AD and was gradually abandoned after the 7th century.",0.3333333333333333,0.08,0.6666666666666666,0.7761951577648474,0.99999999995,0.9999999999,0.0,0.16666666638888888,,0.930926752034102
14,Wht is the significance of the Christian mural found in the Roman Forum?,"['36\n4th walk: \nHISTORIC CENTRE (3)\nthat the place had been used \nby Christians as well, during \nthe late Roman period. South \nof the passageway there \nwere shops dating from the \n1st until the 13th century; the \nunderground Museum of the \nRoman Forum (see p. 71) was \nbuilt there as an extension. \nA 2nd - 4th c. AD Odeon [C] \nwas found behind the well-\npreserved eastern stoa. It  \nhas been restored and it is now \nused as a venue for cultural \nevents. A mint and an archive \noffice are right next to it. In the \nSE side, a round bath house \n[D] was unearthed which has \nbeen in use since the 1st c. BC. \nParts of a colonnade, mosaic \nfloors, marble stairs, a section \nof a stone-paved street, sewer \npipes, silver coins, stone and \nmarble sculptures were all \nfound in this archaeological \nsite. The forum is also where \nthe “Enchanted Ones” (las \nIncantadas) were discovered, \na two-storeyed colonnaded \narchway with Corinthian-order \ncolumns and pillars four of \nwhich have survived. They are \ndecorated with figures in relief \nin their interior as well as their \nexterior side (“Stoa of the \nStatuettes”).', '12\n1st walk: \nUNESCO BYZANTINE MONUMENTS\nChristian monuments in the \nOrthodox world. It is a cross-\ndomed basilica and used to \nbe the Metropolitan Church \n(Cathedral) until 1523 when it \nwas converted into a mosque; \nit was restored to Christian \nworship after 1912. The \ncapitals date to the 5th – 6th \nc. (they were part of the older \nchurch); the wonderful mosaics \nare an absolute must-see, \nparticularly the ones on the \ndome with the image of the \nAscension of Christ, as are \nthe murals crafted in different \nstages from the 8th to the \n11th c. In the church’s south \nside, amid green surroundings \nyou will find the church of \nAgios Ioannis Prodromos [St. \nJohn the Forerunner] (1940); \nfrom this point you will enter \nthe early-Christian baptistery \n(catacomb) of Agia Sofia, built \non the ruins of roman baths.\n5 \t\x07TRANSFIGURATION OF \nTHE SAVIOUR CHURCH \n[METAMORFOSI SOTIROS]\nIt is located on Egnatia Street \n(see p. 34) almost between \nKamara (see p. 37) and the \nPalace of Galerius (see p. 29). \nConstruction took place possibly \naround 1340 and it is a typical \nexample of the transitional type \nin Byzantine church-building, \nfound particularly in Macedonia.']","['Roman (Ancient) Forum During the roman period, this 2-hectare area used to be the social and religious centre of the city. Construction was completed in two phases (in the mid-2nd and mid- 3rd centuries AD) and it was gradually abandoned after the 7th century. The NW section of the archaeological site is covered by a large rectangular square [Α] with traces of marble paving. In the S section of the square lies the largest part of the double underground Cryptoporticus [covered passageway] [Β] which was most probably used as a public storehouse. On one of its walls a valuable early Christian mural was uncovered and this shows 9 10 11 12 PARASKEVOPOULOU KONSTANTINOUPOLEOS DELFO KAFTANTZOGLOU PAPAFI PAPAFI PAPAFI KLEANTHOUS MARKOU BOTSARI PAPANASTASIOU PAPANASTASIOU ANATOLIKIS THRAKIS KANARI KANARI KARAKA MARATHONOS GRIGORIOU LAMPRAKI KONSTANTINOU KARAMANLI STRATOU AVE. PAPANASTASIOU AGIOS IOANNIS CHRYSOSTOMOS AGIA FOTEINI SARANTAPOROU BIZANIOU AGIAS TRIADAS BIZANIOU CHATZI FILOPOIMENOS LYTRA EDISON S NOTARA KAIRI SKOUFA XANTHOU TSAKALOF PATMOU PIGIS KYRIAKIDI ELEFTHERON ONA INIDI MATSI U OIT N E X F A PLITHONOS GEMISTOU GKYZI RIADI VYZANTIOU VELISSARIOU AETORACHIS EFZONON CHARISI CHARISI ILIADOS ZAIMI U DOUSMA ALKMINIS SINA ADIOU MITR. PLATAION DANIOLOU AGIOU VASILEIOU GENNADIOU MITR. THINEAS DELIGI PRAXITELOUS PAPAF FLEMING ARCHAIOLOGIKOU MOUSEIOU NASIOU DIAKOU CHIRS DIONOS GAMVETA DELIGIANNI IAKOVOU GALIVALDI MIAOULI XENOFONTOS KYVELIS CHARISI PERDIKA PASALIDI KIMONOS OSTROVOU PESTON PESTON ANDROU ALONNISOU MYKONOU AMOLIANIS SKYROU PARNITHAS SKALTSOUNI LYDIAS NIOVIS YMMITOU ASKLIPIOU PELIS PINDAROU LAMIAS IPEIROU PERDIKA IOANNINON EVVOIAS LITOCHOROU KRESNAS NEVROKOPIOU LITOCHOROU KORYTSAS TROIAS SERRON OMIROU PSAROU KRITONOS YDRAS EVRYVIADOU VALTETSIOU PELIAS ARGENTI KILKISSIOU LACHANA U O D AIT LI M ARCHIMIDOUS ELEFTHEROTON DOIRANIS DOIRANIS KARPATHOU TZOVAROPOULOU KERKYRAS RODIOU RIGOPOULOU NAOUSSIS AMYNTAIOU KATSIMIDI DANGLI KOUNTOURIOTI ELEFTHERIAS ELEFTHERIAS THRAKIS YPSILANTOU KOLOKOTRONI KANARI MIAOULI MIAOULI FILOTHEIS RODODAFNIS YAKINTHOU FILOMILAS OLYNTHOU LOTOU IVYSKOU ELEAS DRIOS EVAGORA PAPAILIAKI KLEANTHOUS MARONIAS CHOLOMONTOS ISIDOROU IPATIAS KISSOU KARIATIDAS KAVIRON AGAMEMNONOS ARIONOS STOVAIOU FILONOS ARGAIOU FOINIKOS EFESSOU KAISAREIAS KALLIPOLEOS VRYOULON KYZIKOU NIKOMIDEIAS NEAPOLEOS MIDEIAS PROUSIS IKONIOU KROMNIS PYRGOU MALAKOPIS KAPADDOKIAS LYKAONIAS SINIOSOGLOU NIKAIAS KAROLIDOU SARANTI CHEIMARRAS PSARON PRIAMOU MITSAKI MITROPOULOU IONIAS SANTAS PAPOULA YPARCHOU FOKYLIDOU KERAMIKOU EPIDAVROU TSELIOU PRAXAGORA OLYMPIAS VOSPOROU AMFIPOLEOS MIKRAS ASIAS PONTOU VITHYNIAS PAPAGEORGIOU IOANNOU KAISAREIAS METRON IMVROU AGRIANON CHIOU CHOURMOUZI APOLLONOS SYROU FAIAKON LARNAKOS AMMOCHOSTOU NAFPLIOU NAFPLIOU DERKON KORDELIOU VIZYIS DORYLAIOU TINOU TENEDOU DARDANELLION DIMITSANAS EPIDAVROU EFSTATHIOU MITROPOLITOU CHANDR KARANIVA ATLANTID SVOL VOSPO ZACH ZIRIN ZONARA ANAXIME ANATOLIKIS ROMYLIAS ISO TOUSSA SPEFSIPOU MYSTAKID DYSTOMOU MIKROU ANTISTHENOUS STEFANOU DIMOCHAROUS MISIRLI PILEAS AEROPOU PAFSILYPOU TRIANTAFYLLOPOULOU GRIGORIOU LAMPRAKI (KONIT SLI OSIAS XENIS TSELEPI TSIAPANOU TSAMI STRATIGI VISTA ANGELOPOULOU DIVOLI GKOURA GRIGORIOU STEFANOU ATHINA ANTHEMOUNTOS LEFAKI PAFSANIA SEMELIS AETIONOS PANTAZIDI PERRAIVOU PERRAIVOU SPANOU IPPO ARTAKIS PONTOU EPTALOFOU PARMENIDI ANAVRYTON FILIMONOS TPIKALON AGIAS MARINAS TIROLOIS TIROLOIS TRITONOS TRIPTOLEMOU POLYGNOTOU IPPODROMIOU POLIVIOU PROTOGENOUS DIAGORA LISSIPOU ANTIFANOS MEGAKLEOUS POLYKLEITOU EMPEDOKLEOUS ANDRIOTI VIANDROU VARNALI ADAMIDOU ZAIMI ORTANSIAS IRIDOS MAKEDONIAS ANAFIS SAMOU POROU AIGINIS KYTHIRON LACHANA MIKRAS ASIAS TRIKOUPI GYMNASTIRIOU ANAPAFSEOS ELEFTHERIAS AMORGOU SERIFOU MILOU MESOLONGIOU AG. SPYRIDONA SERRON SERRON KASTORIAS GRIGORIOU LAMPRAKI KATSIMDIDI SIDIROKASTROU SPARTIS KONSTANTINIDI AMALIAS ZERVA AGIOS FANOURIOS AGIA MARINA AGIA VARVARA AGIOS THERAPON AGIOS SPYRIDONAS K Y K L A M I N O N DOXA ANO TOUMPA MALAKOPI CHA KATO TOUMPA TOUMPA CEMETERY MAKEDONIA GOVATZIDAKI SQ. TRIANDRIA PAPAFIO U) THEAGENEIO CANCER HOSPITAL IPPOKRATEIO GENERAL HOSPITAL OF THESSALONIKI Y LONIKI INFECTIOUS DISEASES HOSPITAL RETIREMENT HOME 3 3.9 A B Γ Δ 33']","The significance of the Christian mural found in the Roman Forum lies in its historical and cultural context, reflecting the transition from paganism to Christianity in Thessaloniki during the late Roman period. This mural, along with other archaeological findings in the area, illustrates the rich tapestry of religious and social life that characterized the city.

The Roman Forum itself was a central hub of civic life, and the presence of Christian elements within this space signifies the integration of Christian practices into the daily lives of the inhabitants. The mural serves as a testament to the early Christian community's resilience and adaptation in a city that was once dominated by Roman religious traditions. It highlights the evolution of architectural and artistic expressions as Christianity began to flourish, showcasing the blend of styles and influences from both Roman and Byzantine cultures.

Moreover, the mural is part of a broader narrative that includes the discovery of various artifacts, such as mosaics and sculptures, which collectively provide insight into the religious practices and artistic achievements of the time. These elements not only enhance the understanding of Thessaloniki's historical significance but also contribute to its status as a UNESCO World Heritage site.

For a first-time visitor, especially one interested in sightseeing and capturing Instagrammable moments, the mural and its surrounding context offer a unique opportunity to engage with the city's layered history. It invites exploration of the interplay between ancient and early Christian art, making it a compelling stop on a leisurely weekend trip. The mural stands as a symbol of cultural continuity and transformation, reflecting the enduring legacy of Christianity in a city that has been a crossroads of civilizations for centuries.","The Christian mural uncovered in the Roman Forum is significant as it represents an early example of Christian art, highlighting the transition of the site from a social and religious center of the Roman period to one that incorporated Christian elements. This mural was found on one of the walls of the double underground Cryptoporticus, which was likely used as a public storehouse.",0.5,0.0,0.15789473684210525,0.7675405130792373,0.49999999995,0.0,0.0,0.0,0.0,0.988794257470365
15,What was the Roman Forum in Thessaloniki used for?,"['36\n4th walk: \nHISTORIC CENTRE (3)\nthat the place had been used \nby Christians as well, during \nthe late Roman period. South \nof the passageway there \nwere shops dating from the \n1st until the 13th century; the \nunderground Museum of the \nRoman Forum (see p. 71) was \nbuilt there as an extension. \nA 2nd - 4th c. AD Odeon [C] \nwas found behind the well-\npreserved eastern stoa. It  \nhas been restored and it is now \nused as a venue for cultural \nevents. A mint and an archive \noffice are right next to it. In the \nSE side, a round bath house \n[D] was unearthed which has \nbeen in use since the 1st c. BC. \nParts of a colonnade, mosaic \nfloors, marble stairs, a section \nof a stone-paved street, sewer \npipes, silver coins, stone and \nmarble sculptures were all \nfound in this archaeological \nsite. The forum is also where \nthe “Enchanted Ones” (las \nIncantadas) were discovered, \na two-storeyed colonnaded \narchway with Corinthian-order \ncolumns and pillars four of \nwhich have survived. They are \ndecorated with figures in relief \nin their interior as well as their \nexterior side (“Stoa of the \nStatuettes”).', 'It is divided in \nthree sections (cold, tepid \nand hot areas) and there is \nalso a vaulted tank for heating \nwater. It is widely known as the \nParadise Baths and it went by \nthat name until 1968. Right next \nto it there is a roman platform \nthat is indicative of the ground \nlevel 2000 years ago.\n1.6  Roman (Ancient) Forum\nDuring the roman period, \nthis 2-hectare area used to be \nthe social and religious centre \nof the city. Construction was \ncompleted in two phases  \n(in the mid-2nd and mid-  \n3rd centuries AD) and it was \ngradually abandoned after the \n7th century. The NW section \nof the archaeological site is \ncovered by a large rectangular \nsquare [Α] with traces of \nmarble paving. In the S section \nof the square lies the largest \npart of the double underground \nCryptoporticus [covered \npassageway] [Β] which was \nmost probably used as a public \nstorehouse.']","['Roman (Ancient) Forum During the roman period, this 2-hectare area used to be the social and religious centre of the city. Construction was completed in two phases (in the mid-2nd and mid- 3rd centuries AD) and it was gradually abandoned after the 7th century. The NW section of the archaeological site is covered by a large rectangular square [Α] with traces of marble paving. In the S section of the square lies the largest part of the double underground Cryptoporticus [covered passageway] [Β] which was most probably used as a public storehouse. On one of its walls a valuable early Christian mural was uncovered and this shows 9 10 11 12 PARASKEVOPOULOU KONSTANTINOUPOLEOS DELFO KAFTANTZOGLOU PAPAFI PAPAFI PAPAFI KLEANTHOUS MARKOU BOTSARI PAPANASTASIOU PAPANASTASIOU ANATOLIKIS THRAKIS KANARI KANARI KARAKA MARATHONOS GRIGORIOU LAMPRAKI KONSTANTINOU KARAMANLI STRATOU AVE. PAPANASTASIOU AGIOS IOANNIS CHRYSOSTOMOS AGIA FOTEINI SARANTAPOROU BIZANIOU AGIAS TRIADAS BIZANIOU CHATZI FILOPOIMENOS LYTRA EDISON S NOTARA KAIRI SKOUFA XANTHOU TSAKALOF PATMOU PIGIS KYRIAKIDI ELEFTHERON ONA INIDI MATSI U OIT N E X F A PLITHONOS GEMISTOU GKYZI RIADI VYZANTIOU VELISSARIOU AETORACHIS EFZONON CHARISI CHARISI ILIADOS ZAIMI U DOUSMA ALKMINIS SINA ADIOU MITR. PLATAION DANIOLOU AGIOU VASILEIOU GENNADIOU MITR. THINEAS DELIGI PRAXITELOUS PAPAF FLEMING ARCHAIOLOGIKOU MOUSEIOU NASIOU DIAKOU CHIRS DIONOS GAMVETA DELIGIANNI IAKOVOU GALIVALDI MIAOULI XENOFONTOS KYVELIS CHARISI PERDIKA PASALIDI KIMONOS OSTROVOU PESTON PESTON ANDROU ALONNISOU MYKONOU AMOLIANIS SKYROU PARNITHAS SKALTSOUNI LYDIAS NIOVIS YMMITOU ASKLIPIOU PELIS PINDAROU LAMIAS IPEIROU PERDIKA IOANNINON EVVOIAS LITOCHOROU KRESNAS NEVROKOPIOU LITOCHOROU KORYTSAS TROIAS SERRON OMIROU PSAROU KRITONOS YDRAS EVRYVIADOU VALTETSIOU PELIAS ARGENTI KILKISSIOU LACHANA U O D AIT LI M ARCHIMIDOUS ELEFTHEROTON DOIRANIS DOIRANIS KARPATHOU TZOVAROPOULOU KERKYRAS RODIOU RIGOPOULOU NAOUSSIS AMYNTAIOU KATSIMIDI DANGLI KOUNTOURIOTI ELEFTHERIAS ELEFTHERIAS THRAKIS YPSILANTOU KOLOKOTRONI KANARI MIAOULI MIAOULI FILOTHEIS RODODAFNIS YAKINTHOU FILOMILAS OLYNTHOU LOTOU IVYSKOU ELEAS DRIOS EVAGORA PAPAILIAKI KLEANTHOUS MARONIAS CHOLOMONTOS ISIDOROU IPATIAS KISSOU KARIATIDAS KAVIRON AGAMEMNONOS ARIONOS STOVAIOU FILONOS ARGAIOU FOINIKOS EFESSOU KAISAREIAS KALLIPOLEOS VRYOULON KYZIKOU NIKOMIDEIAS NEAPOLEOS MIDEIAS PROUSIS IKONIOU KROMNIS PYRGOU MALAKOPIS KAPADDOKIAS LYKAONIAS SINIOSOGLOU NIKAIAS KAROLIDOU SARANTI CHEIMARRAS PSARON PRIAMOU MITSAKI MITROPOULOU IONIAS SANTAS PAPOULA YPARCHOU FOKYLIDOU KERAMIKOU EPIDAVROU TSELIOU PRAXAGORA OLYMPIAS VOSPOROU AMFIPOLEOS MIKRAS ASIAS PONTOU VITHYNIAS PAPAGEORGIOU IOANNOU KAISAREIAS METRON IMVROU AGRIANON CHIOU CHOURMOUZI APOLLONOS SYROU FAIAKON LARNAKOS AMMOCHOSTOU NAFPLIOU NAFPLIOU DERKON KORDELIOU VIZYIS DORYLAIOU TINOU TENEDOU DARDANELLION DIMITSANAS EPIDAVROU EFSTATHIOU MITROPOLITOU CHANDR KARANIVA ATLANTID SVOL VOSPO ZACH ZIRIN ZONARA ANAXIME ANATOLIKIS ROMYLIAS ISO TOUSSA SPEFSIPOU MYSTAKID DYSTOMOU MIKROU ANTISTHENOUS STEFANOU DIMOCHAROUS MISIRLI PILEAS AEROPOU PAFSILYPOU TRIANTAFYLLOPOULOU GRIGORIOU LAMPRAKI (KONIT SLI OSIAS XENIS TSELEPI TSIAPANOU TSAMI STRATIGI VISTA ANGELOPOULOU DIVOLI GKOURA GRIGORIOU STEFANOU ATHINA ANTHEMOUNTOS LEFAKI PAFSANIA SEMELIS AETIONOS PANTAZIDI PERRAIVOU PERRAIVOU SPANOU IPPO ARTAKIS PONTOU EPTALOFOU PARMENIDI ANAVRYTON FILIMONOS TPIKALON AGIAS MARINAS TIROLOIS TIROLOIS TRITONOS TRIPTOLEMOU POLYGNOTOU IPPODROMIOU POLIVIOU PROTOGENOUS DIAGORA LISSIPOU ANTIFANOS MEGAKLEOUS POLYKLEITOU EMPEDOKLEOUS ANDRIOTI VIANDROU VARNALI ADAMIDOU ZAIMI ORTANSIAS IRIDOS MAKEDONIAS ANAFIS SAMOU POROU AIGINIS KYTHIRON LACHANA MIKRAS ASIAS TRIKOUPI GYMNASTIRIOU ANAPAFSEOS ELEFTHERIAS AMORGOU SERIFOU MILOU MESOLONGIOU AG. SPYRIDONA SERRON SERRON KASTORIAS GRIGORIOU LAMPRAKI KATSIMDIDI SIDIROKASTROU SPARTIS KONSTANTINIDI AMALIAS ZERVA AGIOS FANOURIOS AGIA MARINA AGIA VARVARA AGIOS THERAPON AGIOS SPYRIDONAS K Y K L A M I N O N DOXA ANO TOUMPA MALAKOPI CHA KATO TOUMPA TOUMPA CEMETERY MAKEDONIA GOVATZIDAKI SQ. TRIANDRIA PAPAFIO U) THEAGENEIO CANCER HOSPITAL IPPOKRATEIO GENERAL HOSPITAL OF THESSALONIKI Y LONIKI INFECTIOUS DISEASES HOSPITAL RETIREMENT HOME 3 3.9 A B Γ Δ 33']","The Roman Forum in Thessaloniki served as the social and religious center of the city during the Roman period. This expansive area, covering approximately two hectares, was constructed in two main phases during the mid-2nd and mid-3rd centuries AD. It played a crucial role in the daily life of the city, functioning as a hub for public gatherings, religious ceremonies, and social interactions.

The forum featured a large rectangular square, which is now marked by traces of marble paving, indicating its significance and grandeur. In the southern section of this square lies the double underground Cryptoporticus, a covered passageway that likely served as a public storehouse, showcasing the architectural ingenuity of the time.

As a visitor, you can explore the remnants of this historical site, which include various structures and artifacts that reflect the life and culture of ancient Thessaloniki. The forum was gradually abandoned after the 7th century, but its archaeological significance remains, offering insights into the city's past.

Visiting the Roman Forum provides an opportunity to appreciate the rich history of Thessaloniki while enjoying the picturesque surroundings, making it an ideal spot for sightseeing and capturing Instagram-worthy moments.","During the Roman period, the Roman Forum was the social and religious centre of the city.",1.0,0.35,0.44,0.6855448140629808,0.99999999995,0.49999999995,0.0,0.0,0.4,0.8768401638795201
16,What can you tell me about AG. ATHANASIOS in Thessaloniki?,"['17\nNIKIS\nNIKIS\nSVOLOU\nASONIDOU\nTSIMISKI\nVAS. IRAKLEIOU\nFILIPPOU\nOLYMPOU\nMITROPOLEOS\nARISTOTELOUS\nDODEKANISOU\nSALAMINOS\nERMOU\nETHNIKIS A\nAG.\nANTONIOS\nAGIA\nTHEODORA\nAG.\nATHANASIOS\nAG.\nKONSTANTINOU\nYPAPANTI\nAG\nKALARI\nISAVRON\nDELIOU\nMAKRYGIANNI\nMITR. GENADIOU\nMODI\nKIDON\nNOU\nROUS\nPATR. IOAKEIM\nPALAION PATRON GERMANOU\nMICHAIL IO.', '1\n\t \x07AGIA AIKATERINI \n[SAINT CATHERINE] \nCHURCH\n(see p. 12)\nNIKIS\nNIKIS\nGERMANOU\nSVOLOU\nIASONIDOU\nTSIMISKI\nVAS. IRAKLEIOU\nFILIPPOU\nAKROPOLEOS\nTHEOTOKOPOULOU\nAKROPOLEOS\nOCHI AVENUE\nEPTAPYRGIOU\nSOFOKLEOUS\nOLYMPOU\nAZANTZAKI\nDAMONOS\nPOLYTECHNIOU\nMITROPOLEOS\nARISTOTELOUS\nDODEKANISOU\nSALAMINOS\nERMOU\nANGELAKI\nETHNIKIS AMYNAS\nAG.\nANTONIOS\nAGIA\nTHEODORA\nAG.\nATHANASIOS\nAG.\nKONSTANTINOU\nYPAPANTI\nAGIOS STYLIANOS\nLAODI\nGITRIA\nTAXIARCHES\nAGIOS PAVLOS\nFANEROMENI\nAG.\nTHEODOROI\nKALARI\nTSOPELA\nISAVRON\nDELIOU\nIOANNI VELLIDI\nMAKRYGIANNI\nMITR.']","[""42 Thessaloniki’s Old Town is full of atmosphere. It covers the area in between the city walls (to the north and east) and Olympiados Street (to the south), and has had the luck to remain untouched by the 1917 great fire. It was virtually uninhabited until the mid-15th century, when it was conquered by the Ottomans who selected it for settlement on account of its fine climate, panoramic views and strategic position. The two and three-storey houses bear mixed Macedonian and Ottoman architectural elements (sachnisia) [Şahniş in turkish]; there are also residences with neoclassical and eclectic style motifs where the Dönmeh lived, i.e. converts to Islam who secretly remained Jews. After 1922 many refugees settled in the area. Despite the construction of newer buildings and the opening up of new streets in recent decades, it has kept its original town planning, to a large extent, with narrow alleys and scant squares, as well as its original architectural features, particularly in the west and east part of the town. This particular atmosphere has lured intellects, artists and students who chose it for settlement in recent years. 1 \x07AGIA AIKATERINI [SAINT CATHERINE] CHURCH (see p. 12) NIKIS NIKIS GERMANOU SVOLOU IASONIDOU TSIMISKI VAS. IRAKLEIOU FILIPPOU AKROPOLEOS THEOTOKOPOULOU AKROPOLEOS OCHI AVENUE EPTAPYRGIOU SOFOKLEOUS OLYMPOU AZANTZAKI DAMONOS POLYTECHNIOU MITROPOLEOS ARISTOTELOUS DODEKANISOU SALAMINOS ERMOU ANGELAKI ETHNIKIS AMYNAS AG. ANTONIOS AGIA THEODORA AG. ATHANASIOS AG. KONSTANTINOU YPAPANTI AGIOS STYLIANOS LAODI GITRIA TAXIARCHES AGIOS PAVLOS FANEROMENI AG. THEODOROI KALARI TSOPELA ISAVRON DELIOU IOANNI VELLIDI MAKRYGIANNI MITR. GENADIOU MODI PETROPOULAKIDON ARIANOU ARIANOU KLEISTHENOUS VIZYINOU KASTRON PANORMOU KESANLI AMPATZOGLOU SKOPELOU PETRAS ILIADOS VASILIKOU IRAKLEIAS SKEPASTOU SKOPOU KAVAFI ADRIANOUPOLEOS AIANTOS AGATHOUPOLEOS RING ROAD KY ELEFTHERO MYLONA KONSTANTINIDI KESSANIS REDAISTOU VYZOUKIDI VIZYINOU ANAKTORIOU THETIDOS AFXENTIOU MOUDANION PANEPISTIMIOU KALELPIDOS KONSTANTINOUPOLEOS SMYRNIS PYRGOU VRYANDOU KITROUS MELENIKOU PATR. IOAKEIM PALAION PATRON GERMANOU MICHAIL IO. ARMENOPOULOU IKTINOU KOMNINON SOLOMOU VLALI BALANOU ASKITOU VOGATSIKOU PLOUTARCHOU LASSANI MORKENTAOU TATI DRAGOUMI KYRIAKOU IOULIANOU SOKRATOUS EVRIPIDOU GYZI VLACHAVA AISCHYLOU ATHINAS MOREAS GKRATZIOU ATHONOS THEOFILOU PILEOS ANTIOCHOU VLATADON KASTOROS IGOUMENOU PERIANDROU POLYDOROU KLAFTHMONOS DRAGATSANIOU ACHTARI KARADIMOU DIONYSIOU EPIMENIDOU EVRYMEDONTOS AREOS ARTIS IRAKLIOU SYRAKOUSON PYDNAS KARAVANGELI TSAKALOF KIMONOS FLORINAS PLASTIRA FILIPPOU KLISTHENOUS FERON EVROU GKRATZIOU RAKTIVAN LAMPOUSIDI PASTER MAK KAMENIATOU PROFITI ILIA ATHINAS IFIKRATOUS PRASAKAKI STAVROU DIMOSTHENOUS KASTRITSIOU MENELAOU AMYNTA PELOPONNISOU PLATONOS DELMOUZOU AVDELA OUGKO KARATASOU KOUNTOURIOTI AS U DERIKIS ZANIS LKIS PONTOU NAFPLIOU VALTETSIOU KALPAKIOU LORDOU ELEFSINAS DELTA KONITSIS PLATONOS IPPOKRATOUS AGIOU DIMITRIOU VERMIOU SOUFLIOU BIZANIOU LECHOVOU LECHOVOU VOREIOU IPEIROU ARAPITSIS BOUBOULINAS KANARI KAPODISTRIOU KARAISKAKI SOLOMOU LACHANA AGRAFON PSARON MIAOULI KAVALAS KRITIS LEVENTI KANARI GRAVIAS KYPROU FILIATRON ARACHTHOU TSACHILA AGRAFON KARVOUNIDI ERASMOU ELENIS KAPETAN NIKOLAOU PELOPONNISOU AGIOU PAVLOU MAKEDONOMACHON KONITSIS IKARON EL. VENIZELOU OMIROU IPEIROU KONTOSOGLOU PAPANIKOLI TEPELENIOU MEGARON VITSI KASTORIAS DIMITSANAS ARGYROKASTROU DIMITRIOU THASSOU FOKA PAPAFLESSA KOMNINON KRITIS RITIS EPIDAVROU CHORTIATI ELLIS IOANNINON KRYSTALI ATTALOU GRANIKOU KYRIAKOPOULOU BOUBOULINAS MARKOU BOTSARI EPTAPYRGIOU EPTAPYRGIOU EPTAPYRGIOU EPTAPYRGIOU ANTHEON ATHANASIOU DIAKOU YPATROU GIALOUROU ROU ONGOU PAPANASTASIOU KAFKASOU METEORON KASSANDROU OLYMPIADOS A L. P A P A D O P O U L OU KASSANDROU OLYMPIADOS OLYMPOU POLYZOIDI AGIOU DIMITRIOU AGIOU DIMITRIOU AVRILIANIS ARKADIOUPOLEOS IFAISTIONOS ELPIDOS EL. VE NI ZE L O U NAVARINOU TYRNAVOU ONI ARISTARCHOU VOULGAROKTONOU THEMISTOKLEOUS A R O G A X A N A KYPROU 28 OKTOVRIOU M. ASIAS PARASKEVA NIGDIS ARAVYSSOU ALEXIOU TRANOU MOUSCHOUNTI KALAMPAKAS THOUKYDIDI ZARIFI SACHTOURI AKRITA KLIOS PERSEOS PYTHEOS RAKTIVAN ODYSSEOS SARAFI ETHN. ANTISTASEOS U O TIR K O M ID PARASKEVA PANIDOU OINOIS KARAOLI OLYMPOU ROMANIDI ARISTEIDOU ULINI KRITIS DEXAMENI DIOS KALVOU EIRINIS PAPARIGOPOULOU PALAMA ZEFYRON MAVILI PINIOU GLADSTONOS THALIAS PRONOIAS SACHINI KRATEROU FILOTA SOURI ANTON SOUTSOU SYNGROU PTOLEMAION IOUSTINIANOU KARBOLA TOSITSA ZALIKI CHALKEON AMVROSIOU KRYSTALI ANTIGONIDON S T O U R N A R A MAKEDON O MACHON ON ANEROMENIS AVEROF PANGAIOU AXIOU VAIOU PINDOU DOXIS VOTSI KALAPOTHAKI KATOUNI AIGYPTOU FRANGON DANAIDON AISOPOU ENOTIKON AFRODITIS KA CHOU ANAKI MAKI ODYSSEOS ODYSSEOS TANTALOU PROMITHEOS SAPFOUS NAVM. CHAPSA LIMNOU VALAORITI ORPHANIDI TANTALIDI OLYMPIOU DIAMANTI LOUI IPPODROMIOU NIKIFOROU DESPERE GOUNARI DIALETI DANGLI FILIKIS ETAIRIAS CHR. SMYRNIS MITR. IOSIF FOKA PANAGIA KARATZA POLIORKITI SYNGROU VYRONOS AGIOS DIMITRIOS RIGA FERAIOU A R C H A I O T I T O N S E L E F K I D O N M E L E N I K O U PROX. KOROMILA PARASCHOU EPTAPYRGIO ANO POLI 40 EKKLISIES EVANGELISTRIA THEA MUNICIPAL PARK RODOCHORI EVANGELISTRIA'S CEMETERY KOTRONI VARNAS SQ. MOUSHOUNTI SQ. FANARIOTON SQ. ELEFTHERIAS SQ. EMPORIOU SQ. DIMOKRATIAS VARDARI SQ. KYPRION AGONISTON SQ. ARCHAIAS AG. SOFIAS AGORAS SQ. DIMITRION SQ. TERPSITHEA SQ. ROMFEI SQ. SYNTRIVANIOU SQ. NAVARINOU SQ. SQ. SYKIES ZIDROU SQ. LYSSIATREIO (SEICH SOU) AGIOS DIMITRIOS HOSPITAL GENERAL HOSPITAL OF THESSALONIKI G. GENNIMATAS UNIVERSITY GENERAL HOSPITAL OF THESSALONIKI AHEPA 5th walk:""]","AG. ATHANASIOS, or Agios Athanasios, is a notable church located in Thessaloniki, Greece. This church is dedicated to Saint Athanasius, a prominent figure in Christian history, known for his role in the early church and his contributions to Christian theology. 

The church is situated in a vibrant area that reflects the rich cultural heritage of Thessaloniki. Its architecture showcases traditional Byzantine elements, making it an interesting site for sightseeing. The interior often features beautiful frescoes and icons, which are significant for those interested in religious art and history. 

Visiting Agios Athanasios provides an opportunity to experience local culture and spirituality. As a first-time visitor, you may find the atmosphere welcoming, with locals often engaging in worship and community activities. This can be a great chance to interact with residents and gain insights into their traditions and daily life.

The church is conveniently located near other attractions, making it easy to include in a weekend itinerary. You can explore nearby streets filled with shops, cafes, and other historical sites, enhancing your sightseeing experience. The area is also known for its Instagrammable spots, so be sure to capture the beauty of the church and its surroundings for your social media.

In terms of accessibility, the church is generally easy to reach, and there are no specific accessibility needs mentioned, making it suitable for a budget traveler. The local language is Greek, but many locals may also speak English, allowing for comfortable interactions.

Overall, visiting AG. ATHANASIOS can enrich your travel experience in Thessaloniki, offering a blend of history, culture, and opportunities to connect with the local community.","AG. ATHANASIOS is one of the many churches located in Thessaloniki’s Old Town, an area rich in atmosphere and history. The Old Town has remained largely untouched since the 1917 great fire and features a mix of Macedonian and Ottoman architectural elements. The area has narrow alleys and scant squares, preserving its original town planning and architectural features.",0.0,0.07,0.030303030303030304,0.8111638817924645,0.99999999995,0.0,0.0,0.0,,0.9082713424485761
17,What can you tell me about Thessaloniki's Old Town and its history?,"['6\nEver since the 4th c. BC when it was founded, \nThessaloniki has kept its urban character and has \nremained a civic centre and the hub of that region. \nThe city’s centuries-old multicultural history has been \nassociated with great empires, as it has known the \nRoman, Byzantine and Ottoman Rule. The town was also \ngreatly influenced by many ethnic and religious groups \n(Jews, Latins, Armenians and others) as well as Greeks \nfrom Constantinople, Pontus [modern-day northeastern \nTurkey] and Asia Minor [a.k.a. Anatolia]. The numerous \nmonuments, dating to many historical periods, coexist in \na singular and charming way and manifest Thessaloniki’s \nhistorical multicultural and cosmopolitan nature.\n1. \nThe White Tower \narea is one of the \nbusiest parts of \nthe city, where \nthe old seafront \n(Nikis Ave.) meets \nthe new (eastern) \nwaterfront area \nof Thessaloniki.\nDION – VERGINA – ANCIENT PELLA\nPETRALONA CAVE – LAKES AREA\nTHESSALONIKI', '42\nThessaloniki’s Old Town is \nfull of atmosphere. It covers \nthe area in between the city \nwalls (to the north and east) \nand Olympiados Street (to \nthe south), and has had the \nluck to remain untouched by \nthe 1917 great fire. It was \nvirtually uninhabited until \nthe mid-15th century, when \nit was conquered by the \nOttomans who selected it for \nsettlement on account of its \nfine climate, panoramic views \nand strategic position. The \ntwo and three-storey houses \nbear mixed Macedonian \nand Ottoman architectural \nelements (sachnisia) [Şahniş \nin turkish]; there are also \nresidences with neoclassical \nand eclectic style motifs \nwhere the Dönmeh lived, i.e. \nconverts to Islam who secretly \nremained Jews. After 1922 \nmany refugees settled in the \narea. Despite the construction \nof newer buildings and the \nopening up of new streets in \nrecent decades, it has kept \nits original town planning, to \na large extent, with narrow \nalleys and scant squares, as \nwell as its original architectural \nfeatures, particularly in the \nwest and east part of the town. \nThis particular atmosphere has \nlured intellects, artists \nand students who chose it  \nfor settlement in recent years.\n1\n\t \x07AGIA AIKATERINI \n[SAINT CATHERINE] \nCHURCH\n(see p.']","[""42 Thessaloniki’s Old Town is full of atmosphere. It covers the area in between the city walls (to the north and east) and Olympiados Street (to the south), and has had the luck to remain untouched by the 1917 great fire. It was virtually uninhabited until the mid-15th century, when it was conquered by the Ottomans who selected it for settlement on account of its fine climate, panoramic views and strategic position. The two and three-storey houses bear mixed Macedonian and Ottoman architectural elements (sachnisia) [Şahniş in turkish]; there are also residences with neoclassical and eclectic style motifs where the Dönmeh lived, i.e. converts to Islam who secretly remained Jews. After 1922 many refugees settled in the area. Despite the construction of newer buildings and the opening up of new streets in recent decades, it has kept its original town planning, to a large extent, with narrow alleys and scant squares, as well as its original architectural features, particularly in the west and east part of the town. This particular atmosphere has lured intellects, artists and students who chose it for settlement in recent years. 1 \x07AGIA AIKATERINI [SAINT CATHERINE] CHURCH (see p. 12) NIKIS NIKIS GERMANOU SVOLOU IASONIDOU TSIMISKI VAS. IRAKLEIOU FILIPPOU AKROPOLEOS THEOTOKOPOULOU AKROPOLEOS OCHI AVENUE EPTAPYRGIOU SOFOKLEOUS OLYMPOU AZANTZAKI DAMONOS POLYTECHNIOU MITROPOLEOS ARISTOTELOUS DODEKANISOU SALAMINOS ERMOU ANGELAKI ETHNIKIS AMYNAS AG. ANTONIOS AGIA THEODORA AG. ATHANASIOS AG. KONSTANTINOU YPAPANTI AGIOS STYLIANOS LAODI GITRIA TAXIARCHES AGIOS PAVLOS FANEROMENI AG. THEODOROI KALARI TSOPELA ISAVRON DELIOU IOANNI VELLIDI MAKRYGIANNI MITR. GENADIOU MODI PETROPOULAKIDON ARIANOU ARIANOU KLEISTHENOUS VIZYINOU KASTRON PANORMOU KESANLI AMPATZOGLOU SKOPELOU PETRAS ILIADOS VASILIKOU IRAKLEIAS SKEPASTOU SKOPOU KAVAFI ADRIANOUPOLEOS AIANTOS AGATHOUPOLEOS RING ROAD KY ELEFTHERO MYLONA KONSTANTINIDI KESSANIS REDAISTOU VYZOUKIDI VIZYINOU ANAKTORIOU THETIDOS AFXENTIOU MOUDANION PANEPISTIMIOU KALELPIDOS KONSTANTINOUPOLEOS SMYRNIS PYRGOU VRYANDOU KITROUS MELENIKOU PATR. IOAKEIM PALAION PATRON GERMANOU MICHAIL IO. ARMENOPOULOU IKTINOU KOMNINON SOLOMOU VLALI BALANOU ASKITOU VOGATSIKOU PLOUTARCHOU LASSANI MORKENTAOU TATI DRAGOUMI KYRIAKOU IOULIANOU SOKRATOUS EVRIPIDOU GYZI VLACHAVA AISCHYLOU ATHINAS MOREAS GKRATZIOU ATHONOS THEOFILOU PILEOS ANTIOCHOU VLATADON KASTOROS IGOUMENOU PERIANDROU POLYDOROU KLAFTHMONOS DRAGATSANIOU ACHTARI KARADIMOU DIONYSIOU EPIMENIDOU EVRYMEDONTOS AREOS ARTIS IRAKLIOU SYRAKOUSON PYDNAS KARAVANGELI TSAKALOF KIMONOS FLORINAS PLASTIRA FILIPPOU KLISTHENOUS FERON EVROU GKRATZIOU RAKTIVAN LAMPOUSIDI PASTER MAK KAMENIATOU PROFITI ILIA ATHINAS IFIKRATOUS PRASAKAKI STAVROU DIMOSTHENOUS KASTRITSIOU MENELAOU AMYNTA PELOPONNISOU PLATONOS DELMOUZOU AVDELA OUGKO KARATASOU KOUNTOURIOTI AS U DERIKIS ZANIS LKIS PONTOU NAFPLIOU VALTETSIOU KALPAKIOU LORDOU ELEFSINAS DELTA KONITSIS PLATONOS IPPOKRATOUS AGIOU DIMITRIOU VERMIOU SOUFLIOU BIZANIOU LECHOVOU LECHOVOU VOREIOU IPEIROU ARAPITSIS BOUBOULINAS KANARI KAPODISTRIOU KARAISKAKI SOLOMOU LACHANA AGRAFON PSARON MIAOULI KAVALAS KRITIS LEVENTI KANARI GRAVIAS KYPROU FILIATRON ARACHTHOU TSACHILA AGRAFON KARVOUNIDI ERASMOU ELENIS KAPETAN NIKOLAOU PELOPONNISOU AGIOU PAVLOU MAKEDONOMACHON KONITSIS IKARON EL. VENIZELOU OMIROU IPEIROU KONTOSOGLOU PAPANIKOLI TEPELENIOU MEGARON VITSI KASTORIAS DIMITSANAS ARGYROKASTROU DIMITRIOU THASSOU FOKA PAPAFLESSA KOMNINON KRITIS RITIS EPIDAVROU CHORTIATI ELLIS IOANNINON KRYSTALI ATTALOU GRANIKOU KYRIAKOPOULOU BOUBOULINAS MARKOU BOTSARI EPTAPYRGIOU EPTAPYRGIOU EPTAPYRGIOU EPTAPYRGIOU ANTHEON ATHANASIOU DIAKOU YPATROU GIALOUROU ROU ONGOU PAPANASTASIOU KAFKASOU METEORON KASSANDROU OLYMPIADOS A L. P A P A D O P O U L OU KASSANDROU OLYMPIADOS OLYMPOU POLYZOIDI AGIOU DIMITRIOU AGIOU DIMITRIOU AVRILIANIS ARKADIOUPOLEOS IFAISTIONOS ELPIDOS EL. VE NI ZE L O U NAVARINOU TYRNAVOU ONI ARISTARCHOU VOULGAROKTONOU THEMISTOKLEOUS A R O G A X A N A KYPROU 28 OKTOVRIOU M. ASIAS PARASKEVA NIGDIS ARAVYSSOU ALEXIOU TRANOU MOUSCHOUNTI KALAMPAKAS THOUKYDIDI ZARIFI SACHTOURI AKRITA KLIOS PERSEOS PYTHEOS RAKTIVAN ODYSSEOS SARAFI ETHN. ANTISTASEOS U O TIR K O M ID PARASKEVA PANIDOU OINOIS KARAOLI OLYMPOU ROMANIDI ARISTEIDOU ULINI KRITIS DEXAMENI DIOS KALVOU EIRINIS PAPARIGOPOULOU PALAMA ZEFYRON MAVILI PINIOU GLADSTONOS THALIAS PRONOIAS SACHINI KRATEROU FILOTA SOURI ANTON SOUTSOU SYNGROU PTOLEMAION IOUSTINIANOU KARBOLA TOSITSA ZALIKI CHALKEON AMVROSIOU KRYSTALI ANTIGONIDON S T O U R N A R A MAKEDON O MACHON ON ANEROMENIS AVEROF PANGAIOU AXIOU VAIOU PINDOU DOXIS VOTSI KALAPOTHAKI KATOUNI AIGYPTOU FRANGON DANAIDON AISOPOU ENOTIKON AFRODITIS KA CHOU ANAKI MAKI ODYSSEOS ODYSSEOS TANTALOU PROMITHEOS SAPFOUS NAVM. CHAPSA LIMNOU VALAORITI ORPHANIDI TANTALIDI OLYMPIOU DIAMANTI LOUI IPPODROMIOU NIKIFOROU DESPERE GOUNARI DIALETI DANGLI FILIKIS ETAIRIAS CHR. SMYRNIS MITR. IOSIF FOKA PANAGIA KARATZA POLIORKITI SYNGROU VYRONOS AGIOS DIMITRIOS RIGA FERAIOU A R C H A I O T I T O N S E L E F K I D O N M E L E N I K O U PROX. KOROMILA PARASCHOU EPTAPYRGIO ANO POLI 40 EKKLISIES EVANGELISTRIA THEA MUNICIPAL PARK RODOCHORI EVANGELISTRIA'S CEMETERY KOTRONI VARNAS SQ. MOUSHOUNTI SQ. FANARIOTON SQ. ELEFTHERIAS SQ. EMPORIOU SQ. DIMOKRATIAS VARDARI SQ. KYPRION AGONISTON SQ. ARCHAIAS AG. SOFIAS AGORAS SQ. DIMITRION SQ. TERPSITHEA SQ. ROMFEI SQ. SYNTRIVANIOU SQ. NAVARINOU SQ. SQ. SYKIES ZIDROU SQ. LYSSIATREIO (SEICH SOU) AGIOS DIMITRIOS HOSPITAL GENERAL HOSPITAL OF THESSALONIKI G. GENNIMATAS UNIVERSITY GENERAL HOSPITAL OF THESSALONIKI AHEPA 5th walk:""]","Thessaloniki's Old Town is a captivating area steeped in history and atmosphere, making it an ideal destination for sightseeing. Nestled between the city walls to the north and east and Olympiados Street to the south, this part of the city has remarkably preserved its character, remaining largely untouched by the devastating fire of 1917.

Historically, the Old Town was virtually uninhabited until the mid-15th century when the Ottomans conquered Thessaloniki. They recognized the area’s fine climate, panoramic views, and strategic location, leading to its settlement. The architecture here reflects a blend of Macedonian and Ottoman influences, with two and three-storey houses featuring traditional elements known as sachnisia (Şahniş in Turkish). You can also find residences showcasing neoclassical and eclectic styles, particularly those inhabited by the Dönmeh, who were converts to Islam that secretly maintained their Jewish heritage.

After the population shifts following the 1922 Greco-Turkish War, many refugees settled in the Old Town, further enriching its cultural tapestry. Despite modern developments, the area has retained its original town planning, characterized by narrow alleys and small squares, particularly in the western and eastern parts. This preservation allows visitors to experience the authentic charm of Thessaloniki.

The Old Town has become a magnet for artists, students, and intellectuals in recent years, drawn by its unique atmosphere and historical significance. As a first-time visitor, you’ll find plenty of Instagrammable spots, from picturesque streets to stunning views of the city. Engaging with locals is also encouraged, as many are comfortable with the Greek language and eager to share their stories. Exploring Thessaloniki's Old Town offers a rich blend of history, culture, and vibrant local life, perfect for a weekend getaway.","Thessaloniki’s Old Town is full of atmosphere and covers the area between the city walls and Olympiados Street. It remained untouched by the 1917 great fire and was virtually uninhabited until the mid-15th century when the Ottomans conquered it for its fine climate and strategic position. The architecture features mixed Macedonian and Ottoman elements, with neoclassical and eclectic styles where the Dönmeh lived. After 1922, many refugees settled in the area, which has kept its original town planning with narrow alleys and scant squares, particularly in the west and east parts. This unique atmosphere has attracted artists and students in recent years.",1.0,0.64,0.696969696969697,0.8542948447677667,0.99999999995,0.99999999995,0.0,0.3333333331481481,,0.9329971352157184
18,What can you tell me about AGIA THEODORA in Thessaloniki's Old Town?,"['42\nThessaloniki’s Old Town is \nfull of atmosphere. It covers \nthe area in between the city \nwalls (to the north and east) \nand Olympiados Street (to \nthe south), and has had the \nluck to remain untouched by \nthe 1917 great fire. It was \nvirtually uninhabited until \nthe mid-15th century, when \nit was conquered by the \nOttomans who selected it for \nsettlement on account of its \nfine climate, panoramic views \nand strategic position. The \ntwo and three-storey houses \nbear mixed Macedonian \nand Ottoman architectural \nelements (sachnisia) [Şahniş \nin turkish]; there are also \nresidences with neoclassical \nand eclectic style motifs \nwhere the Dönmeh lived, i.e. \nconverts to Islam who secretly \nremained Jews. After 1922 \nmany refugees settled in the \narea. Despite the construction \nof newer buildings and the \nopening up of new streets in \nrecent decades, it has kept \nits original town planning, to \na large extent, with narrow \nalleys and scant squares, as \nwell as its original architectural \nfeatures, particularly in the \nwest and east part of the town. \nThis particular atmosphere has \nlured intellects, artists \nand students who chose it  \nfor settlement in recent years.\n1\n\t \x07AGIA AIKATERINI \n[SAINT CATHERINE] \nCHURCH\n(see p.', '18\nlink the town’s civic centre \n(Dikastirion Square, see p. 35) \nand Kassandrou Street with \nAristotelous Square and the \nseafront. All along the street \nthere are buildings the facades \nof which all follow specific \narchitectural patterns with \ncolonnades and arcades, and \nthey house offices, bookshops, \nstores, hotels, state agencies, \nresidencies etc. The junction of \nAristotelous and Ermou Streets \nis the location of the church of \nAgia [Saint] Theodora (1937) \nbuilt on an old monastery site \nnow housing a community of \nmonks; facing north you will \nsee upper Aristotelous square.\n1.2  Shopping streets\n(see p. 27)\n2 \tNIKIS AVENUE\nIt starts at the harbour from \nthe west and goes eastward \nto the White Tower (see p. 24) \nand it is known as Palia Paralia \n[Old Seafront]. The Turks \nopened it up in 1882, following \nan urban plan for modernising \nthe city, after the seafront city \nwalls were demolished. For \nmany decades, traders and \nwarships, fishing boats and \nyachts would dock along the \nwharf. Today, this is one of \nthe top places in Thessaloniki, \ncrossed daily by thousands of \nlocals and visitors.']","[""42 Thessaloniki’s Old Town is full of atmosphere. It covers the area in between the city walls (to the north and east) and Olympiados Street (to the south), and has had the luck to remain untouched by the 1917 great fire. It was virtually uninhabited until the mid-15th century, when it was conquered by the Ottomans who selected it for settlement on account of its fine climate, panoramic views and strategic position. The two and three-storey houses bear mixed Macedonian and Ottoman architectural elements (sachnisia) [Şahniş in turkish]; there are also residences with neoclassical and eclectic style motifs where the Dönmeh lived, i.e. converts to Islam who secretly remained Jews. After 1922 many refugees settled in the area. Despite the construction of newer buildings and the opening up of new streets in recent decades, it has kept its original town planning, to a large extent, with narrow alleys and scant squares, as well as its original architectural features, particularly in the west and east part of the town. This particular atmosphere has lured intellects, artists and students who chose it for settlement in recent years. 1 \x07AGIA AIKATERINI [SAINT CATHERINE] CHURCH (see p. 12) NIKIS NIKIS GERMANOU SVOLOU IASONIDOU TSIMISKI VAS. IRAKLEIOU FILIPPOU AKROPOLEOS THEOTOKOPOULOU AKROPOLEOS OCHI AVENUE EPTAPYRGIOU SOFOKLEOUS OLYMPOU AZANTZAKI DAMONOS POLYTECHNIOU MITROPOLEOS ARISTOTELOUS DODEKANISOU SALAMINOS ERMOU ANGELAKI ETHNIKIS AMYNAS AG. ANTONIOS AGIA THEODORA AG. ATHANASIOS AG. KONSTANTINOU YPAPANTI AGIOS STYLIANOS LAODI GITRIA TAXIARCHES AGIOS PAVLOS FANEROMENI AG. THEODOROI KALARI TSOPELA ISAVRON DELIOU IOANNI VELLIDI MAKRYGIANNI MITR. GENADIOU MODI PETROPOULAKIDON ARIANOU ARIANOU KLEISTHENOUS VIZYINOU KASTRON PANORMOU KESANLI AMPATZOGLOU SKOPELOU PETRAS ILIADOS VASILIKOU IRAKLEIAS SKEPASTOU SKOPOU KAVAFI ADRIANOUPOLEOS AIANTOS AGATHOUPOLEOS RING ROAD KY ELEFTHERO MYLONA KONSTANTINIDI KESSANIS REDAISTOU VYZOUKIDI VIZYINOU ANAKTORIOU THETIDOS AFXENTIOU MOUDANION PANEPISTIMIOU KALELPIDOS KONSTANTINOUPOLEOS SMYRNIS PYRGOU VRYANDOU KITROUS MELENIKOU PATR. IOAKEIM PALAION PATRON GERMANOU MICHAIL IO. ARMENOPOULOU IKTINOU KOMNINON SOLOMOU VLALI BALANOU ASKITOU VOGATSIKOU PLOUTARCHOU LASSANI MORKENTAOU TATI DRAGOUMI KYRIAKOU IOULIANOU SOKRATOUS EVRIPIDOU GYZI VLACHAVA AISCHYLOU ATHINAS MOREAS GKRATZIOU ATHONOS THEOFILOU PILEOS ANTIOCHOU VLATADON KASTOROS IGOUMENOU PERIANDROU POLYDOROU KLAFTHMONOS DRAGATSANIOU ACHTARI KARADIMOU DIONYSIOU EPIMENIDOU EVRYMEDONTOS AREOS ARTIS IRAKLIOU SYRAKOUSON PYDNAS KARAVANGELI TSAKALOF KIMONOS FLORINAS PLASTIRA FILIPPOU KLISTHENOUS FERON EVROU GKRATZIOU RAKTIVAN LAMPOUSIDI PASTER MAK KAMENIATOU PROFITI ILIA ATHINAS IFIKRATOUS PRASAKAKI STAVROU DIMOSTHENOUS KASTRITSIOU MENELAOU AMYNTA PELOPONNISOU PLATONOS DELMOUZOU AVDELA OUGKO KARATASOU KOUNTOURIOTI AS U DERIKIS ZANIS LKIS PONTOU NAFPLIOU VALTETSIOU KALPAKIOU LORDOU ELEFSINAS DELTA KONITSIS PLATONOS IPPOKRATOUS AGIOU DIMITRIOU VERMIOU SOUFLIOU BIZANIOU LECHOVOU LECHOVOU VOREIOU IPEIROU ARAPITSIS BOUBOULINAS KANARI KAPODISTRIOU KARAISKAKI SOLOMOU LACHANA AGRAFON PSARON MIAOULI KAVALAS KRITIS LEVENTI KANARI GRAVIAS KYPROU FILIATRON ARACHTHOU TSACHILA AGRAFON KARVOUNIDI ERASMOU ELENIS KAPETAN NIKOLAOU PELOPONNISOU AGIOU PAVLOU MAKEDONOMACHON KONITSIS IKARON EL. VENIZELOU OMIROU IPEIROU KONTOSOGLOU PAPANIKOLI TEPELENIOU MEGARON VITSI KASTORIAS DIMITSANAS ARGYROKASTROU DIMITRIOU THASSOU FOKA PAPAFLESSA KOMNINON KRITIS RITIS EPIDAVROU CHORTIATI ELLIS IOANNINON KRYSTALI ATTALOU GRANIKOU KYRIAKOPOULOU BOUBOULINAS MARKOU BOTSARI EPTAPYRGIOU EPTAPYRGIOU EPTAPYRGIOU EPTAPYRGIOU ANTHEON ATHANASIOU DIAKOU YPATROU GIALOUROU ROU ONGOU PAPANASTASIOU KAFKASOU METEORON KASSANDROU OLYMPIADOS A L. P A P A D O P O U L OU KASSANDROU OLYMPIADOS OLYMPOU POLYZOIDI AGIOU DIMITRIOU AGIOU DIMITRIOU AVRILIANIS ARKADIOUPOLEOS IFAISTIONOS ELPIDOS EL. VE NI ZE L O U NAVARINOU TYRNAVOU ONI ARISTARCHOU VOULGAROKTONOU THEMISTOKLEOUS A R O G A X A N A KYPROU 28 OKTOVRIOU M. ASIAS PARASKEVA NIGDIS ARAVYSSOU ALEXIOU TRANOU MOUSCHOUNTI KALAMPAKAS THOUKYDIDI ZARIFI SACHTOURI AKRITA KLIOS PERSEOS PYTHEOS RAKTIVAN ODYSSEOS SARAFI ETHN. ANTISTASEOS U O TIR K O M ID PARASKEVA PANIDOU OINOIS KARAOLI OLYMPOU ROMANIDI ARISTEIDOU ULINI KRITIS DEXAMENI DIOS KALVOU EIRINIS PAPARIGOPOULOU PALAMA ZEFYRON MAVILI PINIOU GLADSTONOS THALIAS PRONOIAS SACHINI KRATEROU FILOTA SOURI ANTON SOUTSOU SYNGROU PTOLEMAION IOUSTINIANOU KARBOLA TOSITSA ZALIKI CHALKEON AMVROSIOU KRYSTALI ANTIGONIDON S T O U R N A R A MAKEDON O MACHON ON ANEROMENIS AVEROF PANGAIOU AXIOU VAIOU PINDOU DOXIS VOTSI KALAPOTHAKI KATOUNI AIGYPTOU FRANGON DANAIDON AISOPOU ENOTIKON AFRODITIS KA CHOU ANAKI MAKI ODYSSEOS ODYSSEOS TANTALOU PROMITHEOS SAPFOUS NAVM. CHAPSA LIMNOU VALAORITI ORPHANIDI TANTALIDI OLYMPIOU DIAMANTI LOUI IPPODROMIOU NIKIFOROU DESPERE GOUNARI DIALETI DANGLI FILIKIS ETAIRIAS CHR. SMYRNIS MITR. IOSIF FOKA PANAGIA KARATZA POLIORKITI SYNGROU VYRONOS AGIOS DIMITRIOS RIGA FERAIOU A R C H A I O T I T O N S E L E F K I D O N M E L E N I K O U PROX. KOROMILA PARASCHOU EPTAPYRGIO ANO POLI 40 EKKLISIES EVANGELISTRIA THEA MUNICIPAL PARK RODOCHORI EVANGELISTRIA'S CEMETERY KOTRONI VARNAS SQ. MOUSHOUNTI SQ. FANARIOTON SQ. ELEFTHERIAS SQ. EMPORIOU SQ. DIMOKRATIAS VARDARI SQ. KYPRION AGONISTON SQ. ARCHAIAS AG. SOFIAS AGORAS SQ. DIMITRION SQ. TERPSITHEA SQ. ROMFEI SQ. SYNTRIVANIOU SQ. NAVARINOU SQ. SQ. SYKIES ZIDROU SQ. LYSSIATREIO (SEICH SOU) AGIOS DIMITRIOS HOSPITAL GENERAL HOSPITAL OF THESSALONIKI G. GENNIMATAS UNIVERSITY GENERAL HOSPITAL OF THESSALONIKI AHEPA 5th walk:""]","Agia Theodora, located in Thessaloniki's vibrant Old Town, is a charming church that offers a glimpse into the city's rich history and architectural diversity. Built in 1937 on the site of an older monastery, it stands at the junction of Aristotelous and Ermou Streets, making it easily accessible for visitors exploring the area.

The church is dedicated to Saint Theodora, a revered figure in Orthodox Christianity, and is known for its serene atmosphere and beautiful interior. The architecture reflects a blend of traditional styles, showcasing the cultural influences that have shaped Thessaloniki over the centuries. The surrounding area is lively, with narrow alleys and quaint squares that invite leisurely exploration.

Visiting Agia Theodora provides an opportunity to appreciate the local culture and engage with the community. The church is situated near various shops and cafes, where you can enjoy a coffee or snack while soaking in the atmosphere. The nearby Aristotelous Square and the bustling streets of Kassandrou and Ermou offer additional sightseeing opportunities, with their unique architectural features and vibrant street life.

For photography enthusiasts, the church and its surroundings present numerous Instagrammable spots, from the charming facades of nearby buildings to the picturesque streets of the Old Town. The area retains its historical charm, making it a perfect backdrop for capturing memorable moments during your visit.

As a first-time visitor, exploring Agia Theodora and its vicinity will enrich your experience in Thessaloniki, allowing you to connect with the local culture and history while enjoying the beauty of this captivating city.","AGIA THEODORA is one of the streets located in Thessaloniki’s Old Town, an area rich in atmosphere and history. The Old Town has remained largely untouched by the 1917 great fire and features a mix of Macedonian and Ottoman architectural elements. This area has attracted many artists and students in recent years due to its unique charm and historical significance.",0.6666666666666666,0.4,0.17857142857142858,0.764991026343481,0.49999999995,0.9999999999,0.0,0.8333333319444445,,0.8678490092441634
19,Who were the Dönmeh and where did they live in Thessaloniki?,"['42\nThessaloniki’s Old Town is \nfull of atmosphere. It covers \nthe area in between the city \nwalls (to the north and east) \nand Olympiados Street (to \nthe south), and has had the \nluck to remain untouched by \nthe 1917 great fire. It was \nvirtually uninhabited until \nthe mid-15th century, when \nit was conquered by the \nOttomans who selected it for \nsettlement on account of its \nfine climate, panoramic views \nand strategic position. The \ntwo and three-storey houses \nbear mixed Macedonian \nand Ottoman architectural \nelements (sachnisia) [Şahniş \nin turkish]; there are also \nresidences with neoclassical \nand eclectic style motifs \nwhere the Dönmeh lived, i.e. \nconverts to Islam who secretly \nremained Jews. After 1922 \nmany refugees settled in the \narea. Despite the construction \nof newer buildings and the \nopening up of new streets in \nrecent decades, it has kept \nits original town planning, to \na large extent, with narrow \nalleys and scant squares, as \nwell as its original architectural \nfeatures, particularly in the \nwest and east part of the town. \nThis particular atmosphere has \nlured intellects, artists \nand students who chose it  \nfor settlement in recent years.\n1\n\t \x07AGIA AIKATERINI \n[SAINT CATHERINE] \nCHURCH\n(see p.', '5th - 12th c.:\t\nRaids by Goths, Persians, \nArabs, Turks and Bulgarians. \nThe town is spared destruction \nthanks to its massive walls. \n 1185:\t\nThe Norsemen occupy \nThessaloniki.\n 1224:\t\nAfter the 20-year Frankish \ndomination of Thessaloniki, \nthe town is taken by Theodore \nKomnenos Doukas and is \ndeclared the capital of the \nDespotate of Epirus.\n 1300-1430:\t\nThe golden age of the \ntown involves great financial, \nsocial and intellectual growth. \nSome of the most significant \nmonuments, built at that time, \nstill stand today.\n 1342-1349:\t\nThe Zealot Movement \nprevails as a reaction to \nmedieval hegemonism  \nand the reign “by the grace  \nof God”.\n 1423:\t\nThe town surrenders to the \nVenetians.\n 1430:\t\nThe Ottoman Turks seize \nThessaloniki.\n 15th c.:\t\nA large Jewish population  \nTHE HISTORY OF']","[""42 Thessaloniki’s Old Town is full of atmosphere. It covers the area in between the city walls (to the north and east) and Olympiados Street (to the south), and has had the luck to remain untouched by the 1917 great fire. It was virtually uninhabited until the mid-15th century, when it was conquered by the Ottomans who selected it for settlement on account of its fine climate, panoramic views and strategic position. The two and three-storey houses bear mixed Macedonian and Ottoman architectural elements (sachnisia) [Şahniş in turkish]; there are also residences with neoclassical and eclectic style motifs where the Dönmeh lived, i.e. converts to Islam who secretly remained Jews. After 1922 many refugees settled in the area. Despite the construction of newer buildings and the opening up of new streets in recent decades, it has kept its original town planning, to a large extent, with narrow alleys and scant squares, as well as its original architectural features, particularly in the west and east part of the town. This particular atmosphere has lured intellects, artists and students who chose it for settlement in recent years. 1 \x07AGIA AIKATERINI [SAINT CATHERINE] CHURCH (see p. 12) NIKIS NIKIS GERMANOU SVOLOU IASONIDOU TSIMISKI VAS. IRAKLEIOU FILIPPOU AKROPOLEOS THEOTOKOPOULOU AKROPOLEOS OCHI AVENUE EPTAPYRGIOU SOFOKLEOUS OLYMPOU AZANTZAKI DAMONOS POLYTECHNIOU MITROPOLEOS ARISTOTELOUS DODEKANISOU SALAMINOS ERMOU ANGELAKI ETHNIKIS AMYNAS AG. ANTONIOS AGIA THEODORA AG. ATHANASIOS AG. KONSTANTINOU YPAPANTI AGIOS STYLIANOS LAODI GITRIA TAXIARCHES AGIOS PAVLOS FANEROMENI AG. THEODOROI KALARI TSOPELA ISAVRON DELIOU IOANNI VELLIDI MAKRYGIANNI MITR. GENADIOU MODI PETROPOULAKIDON ARIANOU ARIANOU KLEISTHENOUS VIZYINOU KASTRON PANORMOU KESANLI AMPATZOGLOU SKOPELOU PETRAS ILIADOS VASILIKOU IRAKLEIAS SKEPASTOU SKOPOU KAVAFI ADRIANOUPOLEOS AIANTOS AGATHOUPOLEOS RING ROAD KY ELEFTHERO MYLONA KONSTANTINIDI KESSANIS REDAISTOU VYZOUKIDI VIZYINOU ANAKTORIOU THETIDOS AFXENTIOU MOUDANION PANEPISTIMIOU KALELPIDOS KONSTANTINOUPOLEOS SMYRNIS PYRGOU VRYANDOU KITROUS MELENIKOU PATR. IOAKEIM PALAION PATRON GERMANOU MICHAIL IO. ARMENOPOULOU IKTINOU KOMNINON SOLOMOU VLALI BALANOU ASKITOU VOGATSIKOU PLOUTARCHOU LASSANI MORKENTAOU TATI DRAGOUMI KYRIAKOU IOULIANOU SOKRATOUS EVRIPIDOU GYZI VLACHAVA AISCHYLOU ATHINAS MOREAS GKRATZIOU ATHONOS THEOFILOU PILEOS ANTIOCHOU VLATADON KASTOROS IGOUMENOU PERIANDROU POLYDOROU KLAFTHMONOS DRAGATSANIOU ACHTARI KARADIMOU DIONYSIOU EPIMENIDOU EVRYMEDONTOS AREOS ARTIS IRAKLIOU SYRAKOUSON PYDNAS KARAVANGELI TSAKALOF KIMONOS FLORINAS PLASTIRA FILIPPOU KLISTHENOUS FERON EVROU GKRATZIOU RAKTIVAN LAMPOUSIDI PASTER MAK KAMENIATOU PROFITI ILIA ATHINAS IFIKRATOUS PRASAKAKI STAVROU DIMOSTHENOUS KASTRITSIOU MENELAOU AMYNTA PELOPONNISOU PLATONOS DELMOUZOU AVDELA OUGKO KARATASOU KOUNTOURIOTI AS U DERIKIS ZANIS LKIS PONTOU NAFPLIOU VALTETSIOU KALPAKIOU LORDOU ELEFSINAS DELTA KONITSIS PLATONOS IPPOKRATOUS AGIOU DIMITRIOU VERMIOU SOUFLIOU BIZANIOU LECHOVOU LECHOVOU VOREIOU IPEIROU ARAPITSIS BOUBOULINAS KANARI KAPODISTRIOU KARAISKAKI SOLOMOU LACHANA AGRAFON PSARON MIAOULI KAVALAS KRITIS LEVENTI KANARI GRAVIAS KYPROU FILIATRON ARACHTHOU TSACHILA AGRAFON KARVOUNIDI ERASMOU ELENIS KAPETAN NIKOLAOU PELOPONNISOU AGIOU PAVLOU MAKEDONOMACHON KONITSIS IKARON EL. VENIZELOU OMIROU IPEIROU KONTOSOGLOU PAPANIKOLI TEPELENIOU MEGARON VITSI KASTORIAS DIMITSANAS ARGYROKASTROU DIMITRIOU THASSOU FOKA PAPAFLESSA KOMNINON KRITIS RITIS EPIDAVROU CHORTIATI ELLIS IOANNINON KRYSTALI ATTALOU GRANIKOU KYRIAKOPOULOU BOUBOULINAS MARKOU BOTSARI EPTAPYRGIOU EPTAPYRGIOU EPTAPYRGIOU EPTAPYRGIOU ANTHEON ATHANASIOU DIAKOU YPATROU GIALOUROU ROU ONGOU PAPANASTASIOU KAFKASOU METEORON KASSANDROU OLYMPIADOS A L. P A P A D O P O U L OU KASSANDROU OLYMPIADOS OLYMPOU POLYZOIDI AGIOU DIMITRIOU AGIOU DIMITRIOU AVRILIANIS ARKADIOUPOLEOS IFAISTIONOS ELPIDOS EL. VE NI ZE L O U NAVARINOU TYRNAVOU ONI ARISTARCHOU VOULGAROKTONOU THEMISTOKLEOUS A R O G A X A N A KYPROU 28 OKTOVRIOU M. ASIAS PARASKEVA NIGDIS ARAVYSSOU ALEXIOU TRANOU MOUSCHOUNTI KALAMPAKAS THOUKYDIDI ZARIFI SACHTOURI AKRITA KLIOS PERSEOS PYTHEOS RAKTIVAN ODYSSEOS SARAFI ETHN. ANTISTASEOS U O TIR K O M ID PARASKEVA PANIDOU OINOIS KARAOLI OLYMPOU ROMANIDI ARISTEIDOU ULINI KRITIS DEXAMENI DIOS KALVOU EIRINIS PAPARIGOPOULOU PALAMA ZEFYRON MAVILI PINIOU GLADSTONOS THALIAS PRONOIAS SACHINI KRATEROU FILOTA SOURI ANTON SOUTSOU SYNGROU PTOLEMAION IOUSTINIANOU KARBOLA TOSITSA ZALIKI CHALKEON AMVROSIOU KRYSTALI ANTIGONIDON S T O U R N A R A MAKEDON O MACHON ON ANEROMENIS AVEROF PANGAIOU AXIOU VAIOU PINDOU DOXIS VOTSI KALAPOTHAKI KATOUNI AIGYPTOU FRANGON DANAIDON AISOPOU ENOTIKON AFRODITIS KA CHOU ANAKI MAKI ODYSSEOS ODYSSEOS TANTALOU PROMITHEOS SAPFOUS NAVM. CHAPSA LIMNOU VALAORITI ORPHANIDI TANTALIDI OLYMPIOU DIAMANTI LOUI IPPODROMIOU NIKIFOROU DESPERE GOUNARI DIALETI DANGLI FILIKIS ETAIRIAS CHR. SMYRNIS MITR. IOSIF FOKA PANAGIA KARATZA POLIORKITI SYNGROU VYRONOS AGIOS DIMITRIOS RIGA FERAIOU A R C H A I O T I T O N S E L E F K I D O N M E L E N I K O U PROX. KOROMILA PARASCHOU EPTAPYRGIO ANO POLI 40 EKKLISIES EVANGELISTRIA THEA MUNICIPAL PARK RODOCHORI EVANGELISTRIA'S CEMETERY KOTRONI VARNAS SQ. MOUSHOUNTI SQ. FANARIOTON SQ. ELEFTHERIAS SQ. EMPORIOU SQ. DIMOKRATIAS VARDARI SQ. KYPRION AGONISTON SQ. ARCHAIAS AG. SOFIAS AGORAS SQ. DIMITRION SQ. TERPSITHEA SQ. ROMFEI SQ. SYNTRIVANIOU SQ. NAVARINOU SQ. SQ. SYKIES ZIDROU SQ. LYSSIATREIO (SEICH SOU) AGIOS DIMITRIOS HOSPITAL GENERAL HOSPITAL OF THESSALONIKI G. GENNIMATAS UNIVERSITY GENERAL HOSPITAL OF THESSALONIKI AHEPA 5th walk:""]","The Dönmeh were a group of converts to Islam who originally practiced Judaism but continued to secretly maintain their Jewish identity and traditions. This community emerged in the late 17th century, primarily in the Ottoman Empire, and they played a significant role in the cultural and social fabric of the regions where they settled.

In Thessaloniki, the Dönmeh lived in residences that featured a mix of architectural styles, including neoclassical and eclectic motifs. Their presence in the city is particularly noted in the Old Town area, which has retained much of its original character and charm. The Old Town, located between the city walls and Olympiados Street, is known for its narrow alleys and historical buildings, making it an intriguing place for visitors interested in the city's diverse heritage.

Despite the changes brought about by the passage of time, including the influx of refugees after 1922 and the construction of newer buildings, the Old Town has preserved its unique atmosphere. This area has attracted various intellectuals, artists, and students in recent years, drawn by its rich history and cultural significance. For a solo traveler interested in sightseeing and local interactions, exploring the Old Town of Thessaloniki offers a glimpse into the city's layered past, including the legacy of the Dönmeh and their contributions to the community.",The Dönmeh were converts to Islam who secretly remained Jews. They lived in residences with neoclassical and eclectic style motifs in Thessaloniki's Old Town.,1.0,0.43,0.7727272727272727,0.8573100244163611,0.9999999999,0.9999999999,0.0,0.9999999980000001,0.4090909090909091,0.8645850693847037
20,Can you provide details about the significance of Vasilis Tsitsanis in Ano Poli and where I might find a tribute to him?,"['44\n5th walk: \nANO POLI (OLD TOWN)\n6 \tTSITSANI SQUARE\nThis small square with beautiful,  \nwell-tended houses is located \nin between Moni Vlatadon and \nHosios David where you can go \nif you take Timotheou Street \n(notice the ottoman fountain) \nand Dimitriou Poliorkitou Street. \nIn the square centre you will see \nthe bust of V. Tsitsanis (1915 – \n1984) a leading Greek popular \ncomposer who lived and worked \nin the town during World War II.\n7 \tEPTAPYRGIOU STREET\nThis is one of the most \ninteresting roads of Ano Poli \nquarter. It follows the interior \nline of the northern city walls \nwhich used to be the ramparts \nof the Acropolis (see also p. – \nfor the city walls). It is worth \ntaking a walk from the corner \nof Eptapyrgiou and Palamidiou \nStreets (to the west) where \nthe 3rd Gate is - also known \nas “Eski Delik” – and head \nfor the main Gate. Besides the \ninteresting traditional buildings \nand the deserted Zihne Camii \n[Mosque] (1902) you will pass \nby the old refugee houses called \n“kastroplikta”; these were built \nalong the line of the city walls or \nadjoining them – as far back as \nthe early 1920’s. Similar houses \ncan be seen also on the eastern \nand western walls.', 'DIMOKRATIAS\nVARDARI\nSQ.\nKYPRION\nAGONISTON\nSQ.\nARCHAIAS\nAG. SOFIAS\nAGORAS\nSQ.\nDIMITRION\nSQ.\nTERPSITHEA\nSQ.\nROMFEI\nSQ.\nSYNTRIVANIOU\nSQ.\nNAVARINOU\nSQ.\nSQ.\nSYKIES\nZIDROU\nSQ.\nLYSSIATREIO\n(SEICH SOU)\nAGIOS\nDIMITRIOS\nHOSPITAL\nGENERAL\nHOSPITAL\nOF THESSALONIKI\nG. GENNIMATAS\nUNIVERSITY\nGENERAL\nHOSPITAL\nOF THESSALONIKI\nAHEPA\n5th walk: \nANO POLI (OLD TOWN)\n9\n7\n7\n1\n2\n3\n8\n6\n5\n4\n10\n11 12\n13\n14\n15\n16\n17\n18\n19\n20\n19.2\n19.1\n19.3\n44.  \nThe bust \nof Vasilis \nTsitsanis has \nbeen placed \nin the square \nnamed after \nthe composer, \nin Ano Poli.\n45.  \nOne of the \nrefugee \nhouses built \nalong the line \nof the city walls \n(Ano Poli).']","['ANO POLI (OLD TOWN) 9 7 7 1 2 3 8 6 5 4 10 11 12 13 14 15 16 17 18 19 20 19.2 19.1 19.3 44. The bust of Vasilis Tsitsanis has been placed in the square named after the composer, in Ano Poli. 45. One of the refugee houses built along the line of the city walls (Ano Poli).']","Vasilis Tsitsanis is a celebrated figure in Greek music, known for his contributions as a popular composer and musician during the mid-20th century. His work significantly influenced the rebetiko genre, which reflects the struggles and experiences of the Greek people, particularly during challenging times such as World War II. Tsitsanis was born in 1915 and spent a considerable part of his life in Thessaloniki, where he became a prominent cultural icon.

In Ano Poli, the Old Town of Thessaloniki, you can find a tribute to Tsitsanis in Tsitsani Square. This small, picturesque square is located between Moni Vlatadon and Hosios David, accessible via Timotheou Street and Dimitriou Poliorkitou Street. At the center of the square stands a bust of Vasilis Tsitsanis, commemorating his legacy and connection to the city. The square is not only a tribute to the composer but also a charming spot to relax and soak in the local atmosphere, making it an ideal location for sightseeing.

Visiting Tsitsani Square offers a unique opportunity to appreciate both the historical significance of the area and the cultural impact of Tsitsanis. The surrounding streets are lined with beautiful, well-maintained houses, and the presence of the Ottoman fountain adds to the charm of the neighborhood. This area is perfect for photography, providing Instagrammable spots that capture the essence of Thessaloniki's rich history and vibrant culture.

As a first-time visitor, exploring Ano Poli and visiting the bust of Vasilis Tsitsanis will enhance your understanding of local culture and history, while also allowing you to engage with the community and enjoy the scenic beauty of this historic district.","In Ano Poli, the bust of Vasilis Tsitsanis has been placed in the square named after the composer, serving as a tribute to his significance.",1.0,0.39,0.8888888888888888,0.7806723948027865,0.99999999995,0.99999999995,0.0,0.3333333322222222,0.2692307692307692,0.6355592720004094
21,What notable features can be found in Ano Poli?,"['43\n5th walk: \nANO POLI (OLD TOWN)\n2 \tTSINARI\nThis area was named after \nthe plane tree which was \nplanted there in the early 20th \nc. (çınar is turkish for plane \ntree). You can reach it through \nAl. Papadopoulou Street, one \nof Ano Poli’s hallmark areas \nas are Tsamadou, Sachtouri \nand Isminis Streets. In Isminis \nStreet you will find the House \nof Pontian Greeks. This is  \nAno Poli’s downtown spot \nand people who want to reach \nthe neighbouring Sykies \narea go through here. In the \ncentre, there is an ottoman \nfountain with a marble Roman \nsarcophagus; this is also \nwhere you will find the oldest \nrestaurant in town (open since \n1885), a café and small shops.\n3 \tTERPSITHEA SQUARE\nTake a good look at the \nremarkable listed buildings and \nthe more recent ones as you \nwalk along Pileos Street and \nhead for Terpsithea Square. \nThe buildings surrounding \nthe square are amazing and \noffer a wonderful view of the \ntown and the seafront; in the \ncentre there is a playground \nand a small open-air theatre. \nAnother impressive monument \nis the Tϋrbe (Tomb) of Musha  \nBaba (1543), one of the late  \nottoman monuments  \nof Thessaloniki, shaped  \nas an octagon with decorative \npointed frames on windows \nand a once lead-covered dome.', '4 \tROMFEI SQUARE\nThis is Ano Poli’s central \nsquare. To reach it, take \nTheofilou Street where \nthe neoclassical building \nhousing the Vice-Mayor’s \noffice for Culture is located. \nIn the square, you will see a \nByzantine bath-house known \nas Koule Kafe (see p. 12); the \nentire area has been named \nafter it. On the NE side of the \nsquare (7, Krispou st.) you \nwill notice the architectural \nmasterpiece of a 19th c. \nneoclassical building which \nhouses the municipal Library of \nAno Poli. On Theotokopoulou \nStreet, near the square lies \nthe 14th c. Byzantine church \nof the Taxiarchs [Archangels] \nwhich used to be a monastery \nkatholikon [main church] and \nhas undergone later changes.\n5 \t\x07HOSIOS [VENERABLE] \nDAVID Church\n(Moni Latomou, see p. 13)\n44\n45']","['ANO POLI (OLD TOWN) 9 7 7 1 2 3 8 6 5 4 10 11 12 13 14 15 16 17 18 19 20 19.2 19.1 19.3 44. The bust of Vasilis Tsitsanis has been placed in the square named after the composer, in Ano Poli. 45. One of the refugee houses built along the line of the city walls (Ano Poli).']","Ano Poli, the Old Town of Thessaloniki, is rich in history and offers several notable features that are perfect for sightseeing. Here are some highlights:

1. **Historic Streets**: Wander through the charming streets of Ano Poli, including Al. Papadopoulou, Tsamadou, Sachtouri, and Isminis Streets. These areas are known for their traditional architecture and vibrant atmosphere.

2. **House of Pontian Greeks**: Located on Isminis Street, this cultural landmark showcases the heritage of the Pontian Greeks, making it a meaningful stop for those interested in local history.

3. **Ottoman Fountain and Roman Sarcophagus**: In the heart of Ano Poli, you’ll find an Ottoman fountain alongside a marble Roman sarcophagus, offering a glimpse into the area's diverse historical influences.

4. **Oldest Restaurant**: Experience local cuisine at the oldest restaurant in Thessaloniki, which has been serving patrons since 1885. It’s a great spot to enjoy traditional dishes and soak in the local ambiance.

5. **Terpsithea Square**: This picturesque square features remarkable listed buildings and a playground, making it a lovely place to relax. The small open-air theatre adds to its charm, and the views of the town and seafront are stunning.

6. **Tϋrbe of Musha Baba**: An impressive octagonal Ottoman monument dating back to 1543, this site is adorned with decorative frames and a once lead-covered dome, reflecting the architectural beauty of the era.

7. **Romfei Square**: The central square of Ano Poli, featuring the Byzantine bath-house known as Koule Kafe and the municipal Library of Ano Poli, housed in a beautiful 19th-century neoclassical building.

8. **Taxiarchs Church**: Near Romfei Square, this 14th-century Byzantine church, originally a monastery, showcases stunning architecture and historical significance.

These features not only highlight the rich cultural tapestry of Ano Poli but also provide numerous opportunities for photography and local interaction, making it an ideal destination for a weekend visit.","In Ano Poli, one can find the bust of Vasilis Tsitsanis placed in the square named after the composer, as well as one of the refugee houses built along the line of the city walls.",0.0,0.22,0.9090909090909091,0.5861135975576423,0.99999999995,0.0,0.0,0.249999999375,,0.8187000383593753
22,Can you tell me more about the bust of Vasilis Tsitsanis and its significance in Ano Poli?,"['DIMOKRATIAS\nVARDARI\nSQ.\nKYPRION\nAGONISTON\nSQ.\nARCHAIAS\nAG. SOFIAS\nAGORAS\nSQ.\nDIMITRION\nSQ.\nTERPSITHEA\nSQ.\nROMFEI\nSQ.\nSYNTRIVANIOU\nSQ.\nNAVARINOU\nSQ.\nSQ.\nSYKIES\nZIDROU\nSQ.\nLYSSIATREIO\n(SEICH SOU)\nAGIOS\nDIMITRIOS\nHOSPITAL\nGENERAL\nHOSPITAL\nOF THESSALONIKI\nG. GENNIMATAS\nUNIVERSITY\nGENERAL\nHOSPITAL\nOF THESSALONIKI\nAHEPA\n5th walk: \nANO POLI (OLD TOWN)\n9\n7\n7\n1\n2\n3\n8\n6\n5\n4\n10\n11 12\n13\n14\n15\n16\n17\n18\n19\n20\n19.2\n19.1\n19.3\n44.  \nThe bust \nof Vasilis \nTsitsanis has \nbeen placed \nin the square \nnamed after \nthe composer, \nin Ano Poli.\n45.  \nOne of the \nrefugee \nhouses built \nalong the line \nof the city walls \n(Ano Poli).', '43\n5th walk: \nANO POLI (OLD TOWN)\n2 \tTSINARI\nThis area was named after \nthe plane tree which was \nplanted there in the early 20th \nc. (çınar is turkish for plane \ntree). You can reach it through \nAl. Papadopoulou Street, one \nof Ano Poli’s hallmark areas \nas are Tsamadou, Sachtouri \nand Isminis Streets. In Isminis \nStreet you will find the House \nof Pontian Greeks. This is  \nAno Poli’s downtown spot \nand people who want to reach \nthe neighbouring Sykies \narea go through here. In the \ncentre, there is an ottoman \nfountain with a marble Roman \nsarcophagus; this is also \nwhere you will find the oldest \nrestaurant in town (open since \n1885), a café and small shops.\n3 \tTERPSITHEA SQUARE\nTake a good look at the \nremarkable listed buildings and \nthe more recent ones as you \nwalk along Pileos Street and \nhead for Terpsithea Square. \nThe buildings surrounding \nthe square are amazing and \noffer a wonderful view of the \ntown and the seafront; in the \ncentre there is a playground \nand a small open-air theatre. \nAnother impressive monument \nis the Tϋrbe (Tomb) of Musha  \nBaba (1543), one of the late  \nottoman monuments  \nof Thessaloniki, shaped  \nas an octagon with decorative \npointed frames on windows \nand a once lead-covered dome.']","['ANO POLI (OLD TOWN) 9 7 7 1 2 3 8 6 5 4 10 11 12 13 14 15 16 17 18 19 20 19.2 19.1 19.3 44. The bust of Vasilis Tsitsanis has been placed in the square named after the composer, in Ano Poli. 45. One of the refugee houses built along the line of the city walls (Ano Poli).']","The bust of Vasilis Tsitsanis is a significant cultural landmark located in Ano Poli, the Old Town of Thessaloniki. Tsitsanis, a renowned Greek composer and musician, is celebrated for his contributions to the rebetiko genre, which reflects the struggles and experiences of the Greek people, particularly during the early 20th century. His music resonates deeply within the local culture, making the bust a symbol of pride for many Thessalonians.

Situated in a square named after him, the bust serves not only as a tribute to Tsitsanis's artistic legacy but also as a gathering point for locals and visitors alike. The square itself is a charming area that captures the essence of Ano Poli, characterized by its narrow streets, traditional architecture, and vibrant atmosphere. This makes it an ideal spot for sightseeing and photography, especially for those looking to capture Instagrammable moments.

Visiting the bust provides an opportunity to engage with the local culture, as it is often surrounded by residents who share stories about Tsitsanis and his impact on Greek music. The area around the bust is lively, with cafes and shops that reflect the neighborhood's historical significance. As a first-time visitor, you can immerse yourself in the local scene, enjoying the ambiance while appreciating the artistic heritage represented by Tsitsanis.

In summary, the bust of Vasilis Tsitsanis in Ano Poli is not just a monument; it is a cultural landmark that embodies the spirit of Thessaloniki. It invites visitors to explore the rich musical history of Greece while enjoying the picturesque surroundings of the Old Town. This makes it a must-visit spot for anyone interested in local culture and history.","The bust of Vasilis Tsitsanis is located in the square named after the composer in Ano Poli. This placement highlights the cultural significance of Tsitsanis in the area, as he is a notable figure in Greek music history.",0.5,0.35,0.5,0.870007593599879,0.9999999999,0.9999999999,0.0,0.0,,0.8829614373344383
23,Who is Vasilis Tsitsanis?,"['DIMOKRATIAS\nVARDARI\nSQ.\nKYPRION\nAGONISTON\nSQ.\nARCHAIAS\nAG. SOFIAS\nAGORAS\nSQ.\nDIMITRION\nSQ.\nTERPSITHEA\nSQ.\nROMFEI\nSQ.\nSYNTRIVANIOU\nSQ.\nNAVARINOU\nSQ.\nSQ.\nSYKIES\nZIDROU\nSQ.\nLYSSIATREIO\n(SEICH SOU)\nAGIOS\nDIMITRIOS\nHOSPITAL\nGENERAL\nHOSPITAL\nOF THESSALONIKI\nG. GENNIMATAS\nUNIVERSITY\nGENERAL\nHOSPITAL\nOF THESSALONIKI\nAHEPA\n5th walk: \nANO POLI (OLD TOWN)\n9\n7\n7\n1\n2\n3\n8\n6\n5\n4\n10\n11 12\n13\n14\n15\n16\n17\n18\n19\n20\n19.2\n19.1\n19.3\n44.  \nThe bust \nof Vasilis \nTsitsanis has \nbeen placed \nin the square \nnamed after \nthe composer, \nin Ano Poli.\n45.  \nOne of the \nrefugee \nhouses built \nalong the line \nof the city walls \n(Ano Poli).', '44\n5th walk: \nANO POLI (OLD TOWN)\n6 \tTSITSANI SQUARE\nThis small square with beautiful,  \nwell-tended houses is located \nin between Moni Vlatadon and \nHosios David where you can go \nif you take Timotheou Street \n(notice the ottoman fountain) \nand Dimitriou Poliorkitou Street. \nIn the square centre you will see \nthe bust of V. Tsitsanis (1915 – \n1984) a leading Greek popular \ncomposer who lived and worked \nin the town during World War II.\n7 \tEPTAPYRGIOU STREET\nThis is one of the most \ninteresting roads of Ano Poli \nquarter. It follows the interior \nline of the northern city walls \nwhich used to be the ramparts \nof the Acropolis (see also p. – \nfor the city walls). It is worth \ntaking a walk from the corner \nof Eptapyrgiou and Palamidiou \nStreets (to the west) where \nthe 3rd Gate is - also known \nas “Eski Delik” – and head \nfor the main Gate. Besides the \ninteresting traditional buildings \nand the deserted Zihne Camii \n[Mosque] (1902) you will pass \nby the old refugee houses called \n“kastroplikta”; these were built \nalong the line of the city walls or \nadjoining them – as far back as \nthe early 1920’s. Similar houses \ncan be seen also on the eastern \nand western walls.']","['ANO POLI (OLD TOWN) 9 7 7 1 2 3 8 6 5 4 10 11 12 13 14 15 16 17 18 19 20 19.2 19.1 19.3 44. The bust of Vasilis Tsitsanis has been placed in the square named after the composer, in Ano Poli. 45. One of the refugee houses built along the line of the city walls (Ano Poli).']","Vasilis Tsitsanis was a prominent Greek composer and musician, widely regarded as one of the most influential figures in the development of modern Greek music. Born in 1915 in the town of Trikala, he became a leading figure in the rebetiko genre, which is often described as the Greek equivalent of the blues, reflecting the struggles and experiences of the urban working class.

Tsitsanis's music is characterized by its emotional depth and lyrical storytelling, often addressing themes of love, loss, and social issues. He played a significant role in popularizing rebetiko music during the mid-20th century, particularly during World War II, a tumultuous period in Greece's history. His compositions and performances helped to elevate the genre from its underground roots to mainstream acceptance.

In Thessaloniki, a bust of Vasilis Tsitsanis is located in Tsitsani Square, situated in the historic district of Ano Poli (Old Town). This area is known for its charming streets and traditional architecture, making it a popular spot for visitors interested in exploring the city's cultural heritage. The square serves as a tribute to Tsitsanis's contributions to Greek music and culture, and it is a place where locals and tourists alike can appreciate his legacy.

For those interested in local culture and history, visiting Tsitsani Square offers a chance to connect with the spirit of Thessaloniki and its musical heritage. The square is not only an Instagrammable spot but also a meaningful location that reflects the city's artistic roots. Engaging with the local culture through music and history can enhance your travel experience, making it more memorable and enriching.","Vasilis Tsitsanis is a composer, and a bust of him has been placed in the square named after him in Ano Poli.",1.0,0.36,0.6875,0.7725049153836607,0.99999999995,0.99999999995,0.0,0.4999999975,,0.7794158632117946
24,Wha is the Vardariou Tower and where can I find it?,"['This is \nthe location of the double gate \nof Anna Palaiologina (the one \nlying west is also called Gate of \nAgioi Anargyroi), constructed by \nthe Byzantine empress in 1355, \nduring her stay in the city.\n12 \tTRIGONIOU TOWER\nAlso known as Alyseos [Chain] \nTower, this building stands \non the spot where the north \nand east walls meet. It was \nbuilt in the 16th c. possibly in \nthe place of an earlier tower \ndating to the Venetian period; \nthe White Tower (see p. 24), \nVardariou Tower (see p. 59) \nand Trigoniou Tower formed \npart of the construction works \ncompleted by the Turks for the \nfortification of Thessaloniki. \nKnown as Kastra [meaning \nTowers], this is a popular \nsightseeing area for locals and \nvisitors alike since the view of \nthe eastern walls as well as of \nthe entire city is breathtaking \nfrom this location.\n13 \t\x07MAIANDROUPOLEOS  \nSTREET\nCentral Maiandroupoleos \nStreet and El. Zografou Street \n48', '44). During the Venetian Rule \n(1st half of the 15th c.) there \nwere efforts to boost it in the \nlight of the Turkish threat; this \nis why certain scholars support \nthat the Trigoniou Tower (see p. \n45) and the White Tower (see p. \n24) were built during that period. \nIn the following centuries, the \nTurks completed reinforcement \nworks in various places. The \nwall inscriptions describe the \ninterventions and restorations \nthat took place over time. The \nwalls followed the shape of an \nirregular trapezium and ended \nto the west in Vardariou Tower \n(see p. 59) and to the east in \nthe White Tower (see p. 24), \nreaching a total length of 7 km. \nAfter 1870, demolition of the \nseafront walls as well as of parts \nof the western and eastern walls \nbegan, in order to sanitise the \nplains and also to expand the \ncity. Today there are 3 remaining \nkm of city walls (mainly on Ano \nPoli, see p. 42); their height \nranges from 8.30 to 10.50 m. \nand their width may measure \nup to 4.50 m, making them \nan impressive monument and \none of great archaeological and \ncultural value.\n\t Note: To get a complete \npicture of the town’s Byzantine art \nmonuments make sure you visit  \nthe Museum of Byzantine Culture  \n(see p. 26 and p. 71).\n9.']","['MUST SEE: 2.1 Railway Station. It is on Monastiriou Street which is renamed at some point Egnatia Street (see p. 34). Construction began in 1939 and it became fully operational in 1951, but it was officially 66. Vardariou Tower (Top Hane). 67. Old steam engine fronting Thessaloniki’s Railway Station.']","Vardariou Tower is one of the historical towers that form part of the fortifications of Thessaloniki, Greece. It is located at the western end of the city's ancient walls, which were constructed to protect the city from various threats throughout its history. The tower is significant for its architectural and historical value, as it showcases the city's rich Byzantine and Ottoman heritage.

You can find Vardariou Tower in the Ano Poli area, which is known for its charming streets and stunning views of Thessaloniki. This area is often referred to as the ""Upper Town"" and is a popular destination for both locals and visitors. The tower is situated along the remaining sections of the city walls, which stretch for about 3 kilometers and offer a glimpse into the city's past.

Visiting Vardariou Tower provides an excellent opportunity for sightseeing, as it not only allows you to explore the historical architecture but also offers picturesque views of the surrounding landscape and the city below. The area is also known for its quaint neighborhoods, making it a great spot for photography, especially if you're looking for Instagrammable moments.

To reach Vardariou Tower, you can take a leisurely walk through the streets of Ano Poli, where you can immerse yourself in the local culture and enjoy the vibrant atmosphere. The tower is easily accessible and is a must-see for anyone interested in the history and beauty of Thessaloniki. Make sure to bring your camera to capture the stunning views and the unique charm of this historic site.","Vardariou Tower, also known as Top Hane, is located near Thessaloniki’s Railway Station. It is a notable landmark that is part of the area surrounding the station.",0.0,0.49,0.4230769230769231,0.7016666764980777,0.99999999995,0.0,0.0,0.49999999875,,0.7959700747465014
25,What important thing happen in 1939 for Railway Station?,"['The road \ndistances (in km) where \nThessaloniki is the starting \npoint get calculated from  \nthis square.\n2 \t\n\x07AROUND DIMOKRATIAS \nSQUARE\nThere are mostly faceless \nbuildings in the area – \namong them you will find \nsmall manufactures or old \nindustries. However there are \nalso historic sites, as there \nare sections of the city’s west \nwalls here, Byzantine and \nottoman monuments and other \narchaeological sites (temple  \nof Aphrodite, 6th c. BC).\nMUST SEE:\n2.1  Railway Station.\nIt is on Monastiriou Street \nwhich is renamed at some \npoint Egnatia Street (see p. 34). \nConstruction began in 1939 \nand it became fully operational \nin 1951, but it was officially \n66.  \nVardariou \nTower (Top \nHane).\n67.  \nOld steam \nengine \nfronting \nThessaloniki’s \nRailway \nStation.', '59\n7th walk: \nWEST OF THE CENTRE-STAVROUPOLI\ninaugurated in 1962 (S. Molfesis, \nTh. Papagiannis). Its exterior \nside combines modern and \nclassical elements with wings \nadded on the sides. It connects \nThessaloniki with the rest of \nGreece, the Balkans and Istanbul; \nit is also the bus terminus \ntowards most of the city areas. \nThis will be the location of the \nwest metro line terminus under \nconstruction in Thessaloniki.\n2.2  Old Railway Station.\nIt was built in 1894 near the \nharbour (Old Station Street) \nin the neoclassical style, \nand it gradually connected \nThessaloniki with Skopje, \nBelgrade, Monastir and \nConstantinople (modern-day \nIstanbul). Today it is exclusively \nused as a cargo train station. \nThis is where the German \noccupation forces mustered \nabout 50,000 Jewish residents, \nfrom March until August 1943, \nin order to send them by train \noff to concentration camps.\n2.3  Top Hane (Vardariou \nTower).\nSituated where the west \nand seafront city walls used \nto meet, this Tower was built \nby the Ottomans in 1546 and \nit was known as the Armoury \nTower. It is a six-sided, three-\nstorey and 10-metre high tower \nwhich used to be the main city \nstronghold.']","['MUST SEE: 2.1 Railway Station. It is on Monastiriou Street which is renamed at some point Egnatia Street (see p. 34). Construction began in 1939 and it became fully operational in 1951, but it was officially 66. Vardariou Tower (Top Hane). 67. Old steam engine fronting Thessaloniki’s Railway Station.']","In 1939, the construction of Thessaloniki's Railway Station began. This station, located on Monastiriou Street, was a significant infrastructure project aimed at enhancing the city's connectivity with the rest of Greece and the Balkans. The station was designed to accommodate both passenger and cargo services, reflecting the growing importance of rail transport in the region.

Although the station was not fully operational until 1951, its construction marked a pivotal moment in Thessaloniki's development, as it laid the groundwork for improved transportation links. The station eventually became a crucial hub for travelers, facilitating connections to major cities such as Skopje, Belgrade, and Istanbul (formerly Constantinople). 

The architectural design of the station combined modern and classical elements, making it an interesting sight for visitors. Its historical significance is further underscored by its role during World War II, when it was used by German occupation forces to gather Jewish residents for deportation to concentration camps.

For a first-time visitor interested in sightseeing, the Railway Station offers a glimpse into Thessaloniki's rich history and architectural heritage. It serves as a reminder of the city's past while also being a functional part of its present-day transport network. The station's location near the harbor and its neoclassical style make it an Instagrammable spot, appealing to those looking to capture memorable moments during their travels.",Construction of the Railway Station began in 1939.,1.0,0.1,0.35,0.5148609599502955,0.9999999999,0.9999999999,0.0,0.999999995,0.1,0.5018391246140071
26,What significant event related to the Railway Station occurred in 1939?,"['The road \ndistances (in km) where \nThessaloniki is the starting \npoint get calculated from  \nthis square.\n2 \t\n\x07AROUND DIMOKRATIAS \nSQUARE\nThere are mostly faceless \nbuildings in the area – \namong them you will find \nsmall manufactures or old \nindustries. However there are \nalso historic sites, as there \nare sections of the city’s west \nwalls here, Byzantine and \nottoman monuments and other \narchaeological sites (temple  \nof Aphrodite, 6th c. BC).\nMUST SEE:\n2.1  Railway Station.\nIt is on Monastiriou Street \nwhich is renamed at some \npoint Egnatia Street (see p. 34). \nConstruction began in 1939 \nand it became fully operational \nin 1951, but it was officially \n66.  \nVardariou \nTower (Top \nHane).\n67.  \nOld steam \nengine \nfronting \nThessaloniki’s \nRailway \nStation.', '59\n7th walk: \nWEST OF THE CENTRE-STAVROUPOLI\ninaugurated in 1962 (S. Molfesis, \nTh. Papagiannis). Its exterior \nside combines modern and \nclassical elements with wings \nadded on the sides. It connects \nThessaloniki with the rest of \nGreece, the Balkans and Istanbul; \nit is also the bus terminus \ntowards most of the city areas. \nThis will be the location of the \nwest metro line terminus under \nconstruction in Thessaloniki.\n2.2  Old Railway Station.\nIt was built in 1894 near the \nharbour (Old Station Street) \nin the neoclassical style, \nand it gradually connected \nThessaloniki with Skopje, \nBelgrade, Monastir and \nConstantinople (modern-day \nIstanbul). Today it is exclusively \nused as a cargo train station. \nThis is where the German \noccupation forces mustered \nabout 50,000 Jewish residents, \nfrom March until August 1943, \nin order to send them by train \noff to concentration camps.\n2.3  Top Hane (Vardariou \nTower).\nSituated where the west \nand seafront city walls used \nto meet, this Tower was built \nby the Ottomans in 1546 and \nit was known as the Armoury \nTower. It is a six-sided, three-\nstorey and 10-metre high tower \nwhich used to be the main city \nstronghold.']","['MUST SEE: 2.1 Railway Station. It is on Monastiriou Street which is renamed at some point Egnatia Street (see p. 34). Construction began in 1939 and it became fully operational in 1951, but it was officially 66. Vardariou Tower (Top Hane). 67. Old steam engine fronting Thessaloniki’s Railway Station.']","The significant event related to the Railway Station in Thessaloniki that occurred in 1939 was the beginning of its construction. The station, located on Monastiriou Street, was designed to serve as a crucial transportation hub connecting Thessaloniki with various regions in Greece and the Balkans. Although it became fully operational in 1951, the initiation of its construction marked an important development in the city's infrastructure, reflecting the growing need for improved transportation links during that period.

The Old Railway Station, built in 1894, had already established connections to cities like Skopje, Belgrade, and Constantinople (modern-day Istanbul). However, the new station aimed to enhance these connections and accommodate the increasing flow of passengers and goods. The architectural design of the station combined modern and classical elements, making it a notable landmark in Thessaloniki.

Additionally, the station holds historical significance beyond its architectural value. During World War II, it was a site of tragedy, as it was used by German occupation forces to gather approximately 50,000 Jewish residents from March to August 1943 before deporting them to concentration camps. This dark chapter in history adds depth to the significance of the Railway Station, making it not only a point of transit but also a reminder of the city's complex past.

For a first-time visitor interested in sightseeing, the Railway Station offers a glimpse into Thessaloniki's historical and cultural narrative, making it a worthwhile stop during your exploration of the city.","Construction of the Railway Station began in 1939, and it became fully operational in 1951.",1.0,0.19,0.6666666666666666,0.5395847142842518,0.9999999999,0.9999999999,0.0,0.9999999966666667,0.047619047619047616,0.820379902722009
27,What are some notable features of the Railway Station in Thessaloniki?,"['59\n7th walk: \nWEST OF THE CENTRE-STAVROUPOLI\ninaugurated in 1962 (S. Molfesis, \nTh. Papagiannis). Its exterior \nside combines modern and \nclassical elements with wings \nadded on the sides. It connects \nThessaloniki with the rest of \nGreece, the Balkans and Istanbul; \nit is also the bus terminus \ntowards most of the city areas. \nThis will be the location of the \nwest metro line terminus under \nconstruction in Thessaloniki.\n2.2  Old Railway Station.\nIt was built in 1894 near the \nharbour (Old Station Street) \nin the neoclassical style, \nand it gradually connected \nThessaloniki with Skopje, \nBelgrade, Monastir and \nConstantinople (modern-day \nIstanbul). Today it is exclusively \nused as a cargo train station. \nThis is where the German \noccupation forces mustered \nabout 50,000 Jewish residents, \nfrom March until August 1943, \nin order to send them by train \noff to concentration camps.\n2.3  Top Hane (Vardariou \nTower).\nSituated where the west \nand seafront city walls used \nto meet, this Tower was built \nby the Ottomans in 1546 and \nit was known as the Armoury \nTower. It is a six-sided, three-\nstorey and 10-metre high tower \nwhich used to be the main city \nstronghold.', 'The road \ndistances (in km) where \nThessaloniki is the starting \npoint get calculated from  \nthis square.\n2 \t\n\x07AROUND DIMOKRATIAS \nSQUARE\nThere are mostly faceless \nbuildings in the area – \namong them you will find \nsmall manufactures or old \nindustries. However there are \nalso historic sites, as there \nare sections of the city’s west \nwalls here, Byzantine and \nottoman monuments and other \narchaeological sites (temple  \nof Aphrodite, 6th c. BC).\nMUST SEE:\n2.1  Railway Station.\nIt is on Monastiriou Street \nwhich is renamed at some \npoint Egnatia Street (see p. 34). \nConstruction began in 1939 \nand it became fully operational \nin 1951, but it was officially \n66.  \nVardariou \nTower (Top \nHane).\n67.  \nOld steam \nengine \nfronting \nThessaloniki’s \nRailway \nStation.']","['MUST SEE: 2.1 Railway Station. It is on Monastiriou Street which is renamed at some point Egnatia Street (see p. 34). Construction began in 1939 and it became fully operational in 1951, but it was officially 66. Vardariou Tower (Top Hane). 67. Old steam engine fronting Thessaloniki’s Railway Station.']","The Railway Station in Thessaloniki, located on Monastiriou Street, is a significant historical and architectural landmark worth visiting. Here are some notable features:

1. **Architectural Style**: The station was constructed in the neoclassical style, which is characterized by its grand and elegant design. This architectural choice reflects the historical significance of the station as a key transportation hub.

2. **Historical Importance**: Opened in 1951, the Railway Station has played a crucial role in connecting Thessaloniki with other major cities in the Balkans, including Skopje, Belgrade, and Istanbul (formerly Constantinople). This makes it a vital part of the region's transportation history.

3. **Cultural Significance**: The station is not just a transit point; it has historical weight as it was used during World War II when German occupation forces mustered around 50,000 Jewish residents here before deporting them to concentration camps. This aspect adds a layer of somber historical context to your visit.

4. **Accessibility**: The station serves as a bus terminus for various city areas, making it easy to access other parts of Thessaloniki. This is particularly beneficial for travelers looking to explore the city on a budget.

5. **Instagrammable Spots**: The exterior and interior of the Railway Station provide excellent opportunities for photography, with its classic design and historical elements making for striking images. 

6. **Nearby Attractions**: The station is in proximity to other notable sites, including sections of the city’s west walls and various Byzantine and Ottoman monuments, allowing for a rich sightseeing experience in the area.

Visiting the Railway Station offers a blend of historical insight, architectural beauty, and convenient access to other attractions, making it a must-see for anyone exploring Thessaloniki.","The Railway Station in Thessaloniki, located on Monastiriou Street (which was renamed Egnatia Street), began construction in 1939 and became fully operational in 1951. Notable features include the old steam engine that is situated in front of the station and the Vardariou Tower, also known as Top Hane.",0.5,0.27,0.8076923076923077,0.774306101378881,0.99999999995,0.49999999995,0.0,0.8888888879012344,,0.99502773993793
28,Can you tell me how to get to the central square from the seafront using I. Passalidis Street?,"['65\nSUBURBS AND CITY OUTSKIRTS\n2.4  Aretsou – Krini.\nThese two most popular \nareas of Kalamaria stretch \nalong the seafront. The \nfacilities of the local marine \nsports club are here, next to \nAretsou-Krini beach; there is \nalso an open air cinema and a \nmarina (the only one in town) \nwith a 242-berth capacity \n(there are power, water and \ntelephone services). The \nwaterfront N. Plastira Street  \nis lined with café-bars and \nfish tavernas which get filled \nto capacity all year round.\n2.5  Komninon Street.\nThe longest part of the \ntown’s main street is for \npedestrian use only and you \nwill find shops, cafés, small \nbars and restaurants along \nthe way. This is also where \nyou will find the area’s central \nsquare where the Town \nHall and the church of the \nTransfiguration of Christ are. \nFrom the direction of the \nseafront, you can reach the \narea via I. Passalidis Street. \nHow to get there. Bus \nlines 5 and 5A leave from \nEleftherias square. Get off at \nNaftikos Omilos [Marine Club] \nstop or at Chamodrakas stop \nin Aretsou area.', '18\nlink the town’s civic centre \n(Dikastirion Square, see p. 35) \nand Kassandrou Street with \nAristotelous Square and the \nseafront. All along the street \nthere are buildings the facades \nof which all follow specific \narchitectural patterns with \ncolonnades and arcades, and \nthey house offices, bookshops, \nstores, hotels, state agencies, \nresidencies etc. The junction of \nAristotelous and Ermou Streets \nis the location of the church of \nAgia [Saint] Theodora (1937) \nbuilt on an old monastery site \nnow housing a community of \nmonks; facing north you will \nsee upper Aristotelous square.\n1.2  Shopping streets\n(see p. 27)\n2 \tNIKIS AVENUE\nIt starts at the harbour from \nthe west and goes eastward \nto the White Tower (see p. 24) \nand it is known as Palia Paralia \n[Old Seafront]. The Turks \nopened it up in 1882, following \nan urban plan for modernising \nthe city, after the seafront city \nwalls were demolished. For \nmany decades, traders and \nwarships, fishing boats and \nyachts would dock along the \nwharf. Today, this is one of \nthe top places in Thessaloniki, \ncrossed daily by thousands of \nlocals and visitors.']","['65 SUBURBS AND CITY OUTSKIRTS 2.4 Aretsou – Krini. These two most popular areas of Kalamaria stretch along the seafront. The facilities of the local marine sports club are here, next to Aretsou-Krini beach; there is also an open air cinema and a marina (the only one in town) with a 242-berth capacity (there are power, water and telephone services). The waterfront N. Plastira Street is lined with café-bars and fish tavernas which get filled to capacity all year round. 2.5 Komninon Street. The longest part of the town’s main street is for pedestrian use only and you will find shops, cafés, small bars and restaurants along the way. This is also where you will find the area’s central square where the Town Hall and the church of the Transfiguration of Christ are. From the direction of the seafront, you can reach the area via I. Passalidis Street. How to get there. Bus lines 5 and 5A leave from Eleftherias square. Get off at Naftikos Omilos [Marine Club] stop or at Chamodrakas stop in Aretsou area. 3']","To reach the central square from the seafront using I. Passalidis Street, follow these simple directions:

1. **Start at the Seafront**: Begin your journey at the waterfront area, specifically along N. Plastira Street, where you can enjoy the vibrant café-bars and fish tavernas.

2. **Locate I. Passalidis Street**: Head inland towards I. Passalidis Street. This street is accessible from the seafront and will lead you towards the central area of Kalamaria.

3. **Walk Along I. Passalidis Street**: Continue walking along I. Passalidis Street. This street will take you through a pleasant urban environment, allowing you to soak in the local atmosphere.

4. **Arrive at Komninon Street**: As you proceed, you will eventually reach Komninon Street. This street is pedestrian-friendly and features shops, cafés, and small bars, making it a great place to explore.

5. **Reach the Central Square**: Follow Komninon Street until you arrive at the central square of Kalamaria. Here, you will find the Town Hall and the church of the Transfiguration of Christ, which are key landmarks in the area.

6. **Public Transport Option**: If you prefer not to walk, you can also take bus lines 5 or 5A from Eleftherias Square. Get off at the Naftikos Omilos (Marine Club) stop or at the Chamodrakas stop in the Aretsou area, which is close to your destination.

This route not only provides a direct path to the central square but also allows you to experience the local culture and sights along the way. Enjoy your time exploring Kalamaria!","To reach the central square from the seafront via I. Passalidis Street, you can take bus lines 5 and 5A that leave from Eleftherias square. You should get off at either the Naftikos Omilos [Marine Club] stop or at the Chamodrakas stop in the Aretsou area.",1.0,0.35,0.43478260869565216,0.7549857173529284,0.9999999999,0.9999999999,1.0,0.49999999937499995,,0.94052734429689
29,How I can go to the central square from Eleftherias square?,"['ARC\nAG\nDIMIT\nTERPSITHEA\nSQ.\nRAILWAY STATION\nSQ.\nOLD RAILWAY\nSTATION SQ.\nGALANOPOULOU\nSQ.\nSYKIES\nNEAPOLI\nAMPELOKIPOI\nMENEMENI\nMAKEDONOMACHON\nSQ.\nKARAOLI-DIMITRIOU SQ.\nELEFTHERIAS\nSQ.\nDROPOTAMOS\n7th walk: \nWEST OF THE CENTRE-STAVROUPOLI\n2\n3\n1\n4\n3.2\n2.2\n2.1\n4.1\n4.2\n4.3\n4.3\n4.4\n2.3\n2.4\n2.5\n2.8\n2.7 2.6\n3.1\n3.3\n1 \t\x07DIMOKRATIAS SQUARE \n(VARDARI)\nSince ancient times, this  \nhas been the most important \nentry point to Thessaloniki. \nThis relatively disadvantaged \narea is a transportation hub \nconnecting the west and \nnorthwest suburbs with the \ncity centre; there are also \nseveral hotels, small shops, \ntavernas and cafés in the \narea. In the centre of the \nsquare you will see the statue \nof King Constantine (1868-\n1923), who entered the \ncity in 1912 in his capacity \nas commander-in-chief of \nthe Greek Army. The road \ndistances (in km) where \nThessaloniki is the starting \npoint get calculated from  \nthis square.', 'SMYRNIS\nMITR. IOSIF\nFOKA\nPANAGIA\nS\nE\nL\nE\nF\nK\nI\nD\nO\nN\nPROX.\nKOROMILA\nI\nFANARIOTON\nSQ.\nELEFTHERIAS\nSQ.\nEMPORIOU\nSQ.\nKYPRION\nAGONISTON\nSQ.\nARCHAIAS\nAG. SOFIAS\nAGORAS\nSQ.\nSYNTRIVAN\nSQ.\nNAVARINOU\nSQ.\nSQ.\n1\n\t\n\x07ARISTOTELOUS \nSQUARE\nThessaloniki’s central square \nis one of the largest and most \nimpressive in Greece, and  \na bustling place twenty four \nhours a day. It is one of the \nfew sections of the Hébrard \nCommittee urban plan, which \ncame to be realised after the \n1917 fire, although it became \nfully shaped in as late as the \nearly 1960s. It is a square \non the seafront, with a 100 \nm. opening, that affords an \namazing view of the Thermaic \nGulf and the Olympus massif. \nThe monumental style of \narchitecture is shown in the \nbuildings’ facades, colonnades, \narcades and porticos, which \ncombine elements from the \ncity’s Byzantine tradition \nwith European interwar \nperiod motifs.']","['65 SUBURBS AND CITY OUTSKIRTS 2.4 Aretsou – Krini. These two most popular areas of Kalamaria stretch along the seafront. The facilities of the local marine sports club are here, next to Aretsou-Krini beach; there is also an open air cinema and a marina (the only one in town) with a 242-berth capacity (there are power, water and telephone services). The waterfront N. Plastira Street is lined with café-bars and fish tavernas which get filled to capacity all year round. 2.5 Komninon Street. The longest part of the town’s main street is for pedestrian use only and you will find shops, cafés, small bars and restaurants along the way. This is also where you will find the area’s central square where the Town Hall and the church of the Transfiguration of Christ are. From the direction of the seafront, you can reach the area via I. Passalidis Street. How to get there. Bus lines 5 and 5A leave from Eleftherias square. Get off at Naftikos Omilos [Marine Club] stop or at Chamodrakas stop in Aretsou area. 3']","To get to Aristotelous Square from Eleftherias Square, you have a few convenient options:

1. **Walking**: The distance between Eleftherias Square and Aristotelous Square is approximately 1 kilometer, making it a pleasant walk. Head northwest from Eleftherias Square along Egnatia Street. This route will take you through the heart of Thessaloniki, allowing you to enjoy the local atmosphere, shops, and cafes along the way. The walk should take around 15-20 minutes.

2. **Public Transport**: If you prefer not to walk, you can take a bus. Look for local buses that run along Egnatia Street. Check the bus schedules and routes at the nearby bus stop. The ride will be quick, typically around 5-10 minutes, depending on traffic.

3. **Taxi or Ride-Sharing**: Taxis are readily available in Thessaloniki. You can easily hail one from Eleftherias Square or use a ride-sharing app. The taxi ride will take about 5-10 minutes, depending on traffic conditions.

4. **Bicycle**: If you're feeling adventurous, consider renting a bicycle. Thessaloniki has bike rental services, and cycling can be a fun way to explore the city while getting to your destination. The ride should take around 10-15 minutes.

Regardless of the option you choose, both squares are vibrant and full of life, making your journey enjoyable. Once you arrive at Aristotelous Square, take some time to soak in the views of the Thermaic Gulf and the impressive architecture that surrounds you. Enjoy your visit!",You can take bus lines 5 and 5A from Eleftherias square. Get off at Naftikos Omilos [Marine Club] stop or at Chamodrakas stop in Aretsou area to reach the central square.,0.0,0.08,0.11538461538461539,0.6214454656663445,0.0,0.0,0.0,0.0,0.0,0.8023742021110047
30,What can you tell me about the Naftikos Omilos area in Kalamaria?,"['65\nSUBURBS AND CITY OUTSKIRTS\n2.4  Aretsou – Krini.\nThese two most popular \nareas of Kalamaria stretch \nalong the seafront. The \nfacilities of the local marine \nsports club are here, next to \nAretsou-Krini beach; there is \nalso an open air cinema and a \nmarina (the only one in town) \nwith a 242-berth capacity \n(there are power, water and \ntelephone services). The \nwaterfront N. Plastira Street  \nis lined with café-bars and \nfish tavernas which get filled \nto capacity all year round.\n2.5  Komninon Street.\nThe longest part of the \ntown’s main street is for \npedestrian use only and you \nwill find shops, cafés, small \nbars and restaurants along \nthe way. This is also where \nyou will find the area’s central \nsquare where the Town \nHall and the church of the \nTransfiguration of Christ are. \nFrom the direction of the \nseafront, you can reach the \narea via I. Passalidis Street. \nHow to get there. Bus \nlines 5 and 5A leave from \nEleftherias square. Get off at \nNaftikos Omilos [Marine Club] \nstop or at Chamodrakas stop \nin Aretsou area.', 'Get off at \nNaftikos Omilos [Marine Club] \nstop or at Chamodrakas stop \nin Aretsou area.\n3 \tPANORAMA\nOne of the best suburbs of \nThessaloniki is situated at  \na 12 km distance S of the \ncity centre and was built on \nthe slope of Mt Chortiatis, \noffering a panoramic city view. \nIt was uninhabited until the \nearly 20th c., although traces \nof a prehistoric settlement \nhave been located on the area. \nThe first inhabitants were \nrefugees from Asia Minor and \nPontus. Today its largest part \nis covered by luxury villas and \nimpressive detached homes; \nthere is a small shopping \narea in the centre. Trigona \nPanoramatos [a cream puff \npastry] – one of the city’s best \nknown sweet delicacies – were \ncreated at a local confectionery \nin the 1950’s.\nMUST SEE:\nPlatanakia.\nIt is a nice place for relaxing, \nin a wooded ravine, with a \nsmall Zoo and a café. A 6 km \npath begins here and leads \nup to the artificial lake (dam) \nof Thermi. Along the way you \nwill come across spots for a \nbrief rest, short waterfalls and \nfragments of eight Byzantine \nwatermills.']","['65 SUBURBS AND CITY OUTSKIRTS 2.4 Aretsou – Krini. These two most popular areas of Kalamaria stretch along the seafront. The facilities of the local marine sports club are here, next to Aretsou-Krini beach; there is also an open air cinema and a marina (the only one in town) with a 242-berth capacity (there are power, water and telephone services). The waterfront N. Plastira Street is lined with café-bars and fish tavernas which get filled to capacity all year round. 2.5 Komninon Street. The longest part of the town’s main street is for pedestrian use only and you will find shops, cafés, small bars and restaurants along the way. This is also where you will find the area’s central square where the Town Hall and the church of the Transfiguration of Christ are. From the direction of the seafront, you can reach the area via I. Passalidis Street. How to get there. Bus lines 5 and 5A leave from Eleftherias square. Get off at Naftikos Omilos [Marine Club] stop or at Chamodrakas stop in Aretsou area. 3']","Naftikos Omilos, located in the Kalamaria suburb of Thessaloniki, is a vibrant area that offers a delightful blend of leisure and local culture. This waterfront locale is known for its picturesque seafront, making it an ideal spot for a weekend getaway, especially during the summer months.

The area features the local marine sports club and the only marina in town, which has a 242-berth capacity, providing various amenities such as power, water, and telephone services. The nearby Aretsou-Krini beach is perfect for relaxation and enjoying the sun. Along N. Plastira Street, you’ll find a lively atmosphere filled with café-bars and fish tavernas that are popular year-round, offering a taste of local cuisine and a chance to mingle with residents.

For those interested in exploring, the pedestrian-only Komninon Street is a must-visit. This street is lined with shops, cafés, and small bars, leading to the central square where the Town Hall and the church of the Transfiguration of Christ are located. It’s a great place to soak in the local culture and architecture.

Accessing Naftikos Omilos is convenient, with bus lines 5 and 5A departing from Eleftherias Square. You can get off at the Naftikos Omilos stop or the Chamodrakas stop, both of which are in close proximity to the beach and local attractions.

As a first-time visitor, you’ll find plenty of Instagrammable spots along the waterfront and in the bustling streets, perfect for capturing the essence of Thessaloniki. The friendly locals and the familiar atmosphere will make it easy for you to engage and interact, enhancing your overall experience in this charming area.","Naftikos Omilos is a stop in the Aretsou area of Kalamaria, which is known for its local marine sports club located next to Aretsou-Krini beach. This area features a marina with a 242-berth capacity and offers power, water, and telephone services. The waterfront N. Plastira Street is lined with café-bars and fish tavernas, making it a popular spot throughout the year.",1.0,0.45,0.5,0.7823673123608685,0.99999999995,0.9999999999,1.0,0.4444444439506172,,0.8072048136170031
31,Where is the Town Hall located in Kalamaria?,"['65\nSUBURBS AND CITY OUTSKIRTS\n2.4  Aretsou – Krini.\nThese two most popular \nareas of Kalamaria stretch \nalong the seafront. The \nfacilities of the local marine \nsports club are here, next to \nAretsou-Krini beach; there is \nalso an open air cinema and a \nmarina (the only one in town) \nwith a 242-berth capacity \n(there are power, water and \ntelephone services). The \nwaterfront N. Plastira Street  \nis lined with café-bars and \nfish tavernas which get filled \nto capacity all year round.\n2.5  Komninon Street.\nThe longest part of the \ntown’s main street is for \npedestrian use only and you \nwill find shops, cafés, small \nbars and restaurants along \nthe way. This is also where \nyou will find the area’s central \nsquare where the Town \nHall and the church of the \nTransfiguration of Christ are. \nFrom the direction of the \nseafront, you can reach the \narea via I. Passalidis Street. \nHow to get there. Bus \nlines 5 and 5A leave from \nEleftherias square. Get off at \nNaftikos Omilos [Marine Club] \nstop or at Chamodrakas stop \nin Aretsou area.', 'MUST SEΕ: \n2.1  Sofouli Street\n(see p. 53).\n2.2  Kyverneio [Government \nHouse] (Little Palace).\nSituated on cape Mikro \nEmvolo or Karampournaki, \nLittle Palace was built in the \n1950’s and used to be the \ncountry residence of the greek \nroyal family; today the minister \nof Macedonia-Thrace and \nthe President of the Hellenic \nRepublic stay here when \nvisiting the city. The ground \nfloor includes the lounges,  \na dance hall and an atrium;  \nthe first floor includes two \nsuites and secondary rooms. \nIt is surrounded by a garden \nand it affords an amazing \nview of the city as well as Mts \nChortiatis and Olympus.\n2.3  Kodra former military \ncamp.\nBuilding works are under way \nto change it into a park. The \nMunicipality of Kalamaria often \nhosts cultural events and visual \nart exhibitions there. On-site \nexcavations brought to light a \nsettlement dating to the archaic \nand classical times (9th – 5th \nc. BC), which some scientists \nbelieve it is identified as the \nlocation of Ancient Thermi.\n71.  \nKyverneio \n(Palataki) \noverlooks cape \nKarampournaki \n(Kalamaria).\n72.  \nPanorama \narea offers a \nfine view of \nthe city and its \nenvirons.\n71']","['65 SUBURBS AND CITY OUTSKIRTS 2.4 Aretsou – Krini. These two most popular areas of Kalamaria stretch along the seafront. The facilities of the local marine sports club are here, next to Aretsou-Krini beach; there is also an open air cinema and a marina (the only one in town) with a 242-berth capacity (there are power, water and telephone services). The waterfront N. Plastira Street is lined with café-bars and fish tavernas which get filled to capacity all year round. 2.5 Komninon Street. The longest part of the town’s main street is for pedestrian use only and you will find shops, cafés, small bars and restaurants along the way. This is also where you will find the area’s central square where the Town Hall and the church of the Transfiguration of Christ are. From the direction of the seafront, you can reach the area via I. Passalidis Street. How to get there. Bus lines 5 and 5A leave from Eleftherias square. Get off at Naftikos Omilos [Marine Club] stop or at Chamodrakas stop in Aretsou area. 3']","The Town Hall in Kalamaria is located on Komninon Street, which is the longest part of the town’s main street designated for pedestrian use. This area is vibrant, featuring a variety of shops, cafés, small bars, and restaurants. The Town Hall is situated near the central square, alongside the church of the Transfiguration of Christ. 

To reach the Town Hall from the seafront, you can take I. Passalidis Street. If you are using public transportation, bus lines 5 and 5A depart from Eleftherias Square. You can get off at either the Naftikos Omilos (Marine Club) stop or the Chamodrakas stop in the Aretsou area, which will bring you close to Komninon Street.

This location is ideal for sightseeing, as it is surrounded by local amenities and offers a glimpse into the everyday life of Kalamaria. The pedestrian-friendly street allows for a leisurely exploration of the area, making it a great spot for photography and enjoying the local culture.","The Town Hall is located in the central square of Kalamaria, along Komninon Street, which is the longest part of the town’s main street designated for pedestrian use.",1.0,0.29,0.5882352941176471,0.892539865352572,0.9999999999,0.9999999999,1.0,0.6666666644444444,0.47058823529411764,0.8763756730132662
32,"What historical significance does Pontus have in relation to the early inhabitants of Panorama, Thessaloniki?","['6\nEver since the 4th c. BC when it was founded, \nThessaloniki has kept its urban character and has \nremained a civic centre and the hub of that region. \nThe city’s centuries-old multicultural history has been \nassociated with great empires, as it has known the \nRoman, Byzantine and Ottoman Rule. The town was also \ngreatly influenced by many ethnic and religious groups \n(Jews, Latins, Armenians and others) as well as Greeks \nfrom Constantinople, Pontus [modern-day northeastern \nTurkey] and Asia Minor [a.k.a. Anatolia]. The numerous \nmonuments, dating to many historical periods, coexist in \na singular and charming way and manifest Thessaloniki’s \nhistorical multicultural and cosmopolitan nature.\n1. \nThe White Tower \narea is one of the \nbusiest parts of \nthe city, where \nthe old seafront \n(Nikis Ave.) meets \nthe new (eastern) \nwaterfront area \nof Thessaloniki.\nDION – VERGINA – ANCIENT PELLA\nPETRALONA CAVE – LAKES AREA\nTHESSALONIKI', '82\nThessaloniki lies in the \ncentre of a wide area that is \nextremely interesting from  \nan archaeological, historical \nand natural point of view; \nthere are countless options for \noutdoor activities, relaxing and \nentertainment. For instance, \nyou can combine your stay \nin town with a day excursion \nto renowned archaeological \nsites and places of historical \ninterest, to fascinating towns \nand great natural reserves  \nor to areas offering recreation \nor relaxation.\n1\n\t\nANCIENT PELLA\nInhabited since the Late \nHelladic period, the area \nflourished when Archelaos,  \nthe Macedon king, moved  \nthe capital of the Macedonian \nstate from Aiges (Vergina) to \nPella (late 5th – early 4th c. BC). \nThe then seaside town grew \nlarger during the reign of King \nPhilip II (his son, Alexander \nthe Great, was born here) \nand grew even larger later \nduring the rule of Cassander. \nBy the mid-2nd century BC it \nhad evolved into the greatest \npolitical, financial and cultural \ncentre among the Hellenic City \nStates. In 168 BC when the \nMacedonians were defeated in \nthe battle of Pydna, Pella was \nconquered by the Romans. \nIt gradually declined and got \neventually deserted in the 1st \ncentury BC. Among the finds \nof the greatest value are the \nexquisite mosaic floors in the \nbuildings, which manifest the \nhigh standard of living enjoyed \nby the residents.\nMUST SEE:\nHouses.']","['PANORAMA One of the best suburbs of Thessaloniki is situated at a 12 km distance S of the city centre and was built on the slope of Mt Chortiatis, offering a panoramic city view. It was uninhabited until the early 20th c., although traces of a prehistoric settlement have been located on the area. The first inhabitants were refugees from Asia Minor and Pontus. Today its largest part is covered by luxury villas and impressive detached homes; there is a small shopping area in the centre. Trigona Panoramatos [a cream puff pastry] – one of the city’s best known sweet delicacies – were created at a local confectionery in the 1950’s. MUST SEE: Platanakia. It is a nice place for relaxing, in a wooded ravine, with a small Zoo and a café. A 6 km path begins here and leads up to the artificial lake (dam) of Thermi. Along the way you will come across spots for a brief rest, short waterfalls and fragments of eight Byzantine watermills. 11 12 13 14 KONSTANTINOUPOLEOS SSIS OLGAS GIOU PAPANDREOU ROSIDI ROSIDI GEORGIOU PAPANDREOU APAFI MARKOU BOTSARI PAPANASTASIOU ANATOLIKIS THRAKIS PAPANASTASIOU VOULGARI KANARI KANARI KARAKASI KARAKASI DELFON GAVRIILIDI TH. SAKELLARIDI GAVRIILIDI KARAOLI VOULGARI KOURTIDI YPSILANTOU PLASTIRA KORAI SMYRNIS MIAOULI PLASTIRA PLASTIRA KERASOUNTOS THEMISTOKLI SOFOULI KALYVA METAMORFOSEOS KOMNINON PONTOU PONTOU AIGAIOU AIGAIOU ADRIANOUPOLEOS EL. VENIZELOU ETHNIKIS ANTISTASIS KOLOTOUROU THICHIS PAPAFLESSA MERKOURIOU KIFISIAS KIFISIAS PSELOU SOLONOS MANTINEIAS GAMVETA METAMORFOSI AGIOS NIKOLAOS NATHANAIL MALAKASI POLYLA PARASCHOU TYPALDOU GRYPARI ROIDI GAMVETA MAKEDONIAS STROMNITSIS MELENIKOU MOUSOURI PAPANTONIOU CHRISTOVASILI PORFYRA SKIATHOU ANINOU KRITIS CHAIRONEIAS PARNASSOU KOUSKOURA PAPADIMITRIOU TAKI OIKONOMIDI DODEKANISOU MITROPOLITI AMVROSIOU MITROPOLITI KALIDI MITROPOLITI GRIGORIOU KYDONION MOSCHONISION THEMISTOKLI SOFOULI KROMNIS PLOUTONOS KASSOMOULI SANGARIOU VISSARIONOS KAPETANIDI NAVARINOU KOLCHIDAS PAPAGOU KIOU POULANTZAKI KALIDOU KAVASITON XENOFONTOS IL E TIR G A NIKOMIDEIAS TRIPOLEOS CHILIS MARMARA CHALKIS VITHYNIAS MIKROULEA KONITSIS SARATSI THERAPEION NIKAIAS AGIAS ELENIS AGIOU IOANNOU VOSPOROU ELLISPONTOU MAKROCHORIOU KARAMAOUNA KARATASOU PAPANASTASIOU LEVANTI KAZIKA IRAKLEIAS IOAKEIM G’ CHRYSOSTOMOU SMYRNIS ADRAMITIOU METRON ANDROUTSOU EFESOU PASALIDI TAXIARCHON MYSTAKIDI MOUDANION EVELPIDOU AGIOU NIKOLAOU PROUSAS DALIPI BALA PAPAPETROU AVDELA KOMNINON KOTYORON ARGYROUPOLEOS SANTAS MYRION AKRITIDI EPANOMIS PAPAKYRITSI AMISSOU LEROU KYPROU PATMOU YPSILANTOU KYMIS MAKRYRACHIS SOUMELA PARANIKA VAZELONOS IASONIDI KYRIAKIDI FOKAIAS DAVAKI AGIOU VASILEIOU DIOGENOUS LEFKOSIAS ARISTOFANOUS FANARIOU PALAMA PANORMOU GRIGORIADI KALANTIDI ANATOLIKIS THRAKIS SOULIOU OMIROU ZALONGOU IONIAS PARIDOS FILADELFEIAS KAPADDOKIAS PROMITHEOS XENOPOULOU IKONIOU IPPOKRATOUS RANGAVI DIOS SOKRATOUS SOLOMOU PLOUTARCHOU EVRIPIDOU SOURI PAPANTONIOU THOUKYDIDI IOUSTINIANOU ALKIONOS ZIRGANOU IRAS LOUI SEVASTEIAS KARAVANGELI ERYTHROU STAVROU MEGALOU ALEXANDROU KAZAZI KAISAREIAS LAODIKIAS IEROSOLYMON AIANTOS AIVATZIDI AGIOU PANTELEIMONOS ANEMONAS PASTER FILELLINON KERAMOPOULOU KALAVRYTON PAPADIAMANTI FILIPPOU V. IPEIROU KOLOKOTRONI VLACHERNON KORYTSAS RODOU IRODOTOU LASANI ARISTOTELOUS ARISTEIDOU PERIKLEOUS TATAOULON DORILEOU POKIOUPTSIDI KYZIKOU KAFKASOU TSINGIRIDI AGIOU ZACHARIA CHERIANON CHALDEIAS KAROLIDI CHEIMONIDI AIMILIANOU MITR. ARTAKIS ERATYRAS ANTIGONIS VOULGAROKTONOU PARASKEVOPOULOU APOSTOLOU PAVLOU FLEMING KONSTANTINOUPOLEOS KYFONIDI S A R E M I CHRYSOULIDI THERMAIKOU PAPANIKOLA NIKOPOLEOS TRAPEZOUNTAS VASILEIADOU SIFILINON SOURMENON ARGYROPOULOU NEAPOLEOS STRAVONOS ARGONAFTON KYDONION PAPADAKI SIGALA AKTAIOU ANDRONIKOU POLEMI PAPADAKI PANSELINOU ADMITOU KASSANDREOS TSOUNTA POULIOU KORNAROU NALTSA FRANTZI KRYSTALI AINOU SIK A R H T O M A S LOGOTHETOU NIKOLAIDI THEMELI SPETSON LASKARATOU TYPA YPSILANTOU DROSINI CHALKIDIKIS THERMOPYLON THALITOS PITTAKOU GRAVIAS GRAVIAS FILELLINON OROMILA KRITIS PAPADIAMANTI NASTOU ALKMINIS NATSINA GENNADIOU MITR. NEMEAS PLATAION DANIOLOU AGIOU VASILEIOU GENNADIOU MITR. PAPAKYRIAZI KARKAVITSA AVROKORDATOU VOGA US IPATIAS KISSOU KARIATIDAS KAVIRON AGAMEMNONOS U S ARGAIOU FOINIKOS EFESSOU KAISAREIAS KALLIPOLEOS VRYOULON KYZIKOU NIKOMIDEIAS NEAPOLEOS MIDEIAS APADDOKIAS KAONIAS INIOSOGLOU NIKAIAS KAROLIDOU RANTI AS KI NIAS SANTAS POULA YPARCHOU FOKYLIDOU KERAMIKOU EPIDAVROU TSELIOU TSELIOU PRAXAGORA OLYMPIAS VOSPOROU AMFIPOLEOS MIKRAS ASIAS PONTOU VITHYNIAS PAPAGEORGIOU IOANNOU KAISAREIAS METRON IMVROU AGRIANON CHIOU CHOURMOUZI APOLLONOS SYROU FAIAKON LARNAKOS AMMOCHOSTOU NAFPLIOU NAFPLIOU DERKON KORDELIOU VIZYIS DORYLAIOU TINOU TENEDOU DARDANELLION DIMITSANAS EPIDAVROU EFSTATHIOU MITROPOLITOU PILEAS CHANDRINOU FILINTA DORYLAIOU KARANIVALOU ATLANTIDAS SVOLOU VOSPOROU ZACHOU ZIRINI ZONARA ANAXIMENOUS ANATOLIKIS ROMYLIAS ISOKRATOUS TOUSSA SPEFSIPOU MYSTAKIDI DYSTOMOU MIKROU ANTISTHENOUS STEFANOU DIMOCHAROUS MISIRLI PILEAS AEROPOU PAFSILYPOU TRIANTAFYLLOPOULOU AGALIANOU PRAIDI STAMATELOU FILI STAGIRITI STADIOU IPEIROU KYPROU KARAVANGELI MARATHONOS MAKEDONIAS ETHNIKIS CHRΥSOSTOMOU AGRA NEARCHOU IFAISTIONOS OLYMPOU KORYTSAS PTOLEMAIOU PERDIKA OLYMPIADOS OLYMPIADOS THER MOPYLON KENEDY PLASTIRA PLASTIRA PROFITI ILIA MEGALOU ALEXANDROU VAS. KONSTANTINOU GRIGORIOU LAMPRAKI (KONITSIS) FLEMING NIKIS AMFOTEROU ETEOKLI DIGKA ETEOKLI IGILOCHOU NIKANOROS EVMENOUS VASIKYROU KARATHEODORI GAZI ANAKREONTOS ANTAIOU NOUKA SEFERI POSEIDONOS MELEAGROU ANGELOU ALKAMENOUS ANAXIMANDROU ANAXIMANDROU LEONIDOU KARDITSIS IRAKLEOUS KORAI MELENIKOU ALKMINIS PARALI GLYNOU TZAVELA TZAVELA RIGA FERAIOU CHORN ZOUMETIKOU MARASLI MARSLI XENOU MAVROMICHALI ADRIANOUPOLEOS ATREIDON XYNGOPOULOU ARKADIOU OSIAS XENIS STROMNITSIS OKEANIDON DEINOKRATOUS VAMVA AGISILAOU NEOPTOLEMOU PAPA PAVLOU MELA VENIZELOU ARISTOTELOUS EIRINIS FILIKIS ETAIRIAS FILIPPOU PRASSAKAKI SCHOLEION OMIROU KOLOKOTRONI PALAIOLOGOU LAOGR. MOUSEIOU DAVAKI SELEFKOU TSELEPI TSIAPANOU TSAMI STRATIGI STRATIGI VISTA ANGELOPOULOU DIVOLI GKOURA GRIGORIOU STEFANOU ATHINA ANTHEMOUNTOS LEFAKI PAFSANIA SEMELIS AETIONOS PANTAZIDI PERRAIVOU PERRAIVOU SPANOU IPPOKRATOUS IPPOKRATOUS DIMOKRITOU VOSPOROU GLYNOU GLYNOU THEOFILOU PAPANASTASIOU VYZANTIOU PAPAFLESSA ANOIXIS VARNALI SPYROU LOUI KALVOU SYMEONIDI PROTOMAGIAS PALAMA DIMOKRATIAS VISVIZI ARTAKIS U EPTALOFOU PARMENIDI TIROLOIS EMOU POLYGNOTOU DROMIOU LISSIPOU ANTIFANOS MEGAKLEOUS EMMANOUIL EFTALIOTI EFTALIOTI DOMPOLI DOUKA ANAXIMENOUS NEARCHOU RIGA FERAIOU SEFERI MENANDROU PAPANIKOLAOU ANAPAFSEOS ZORBA ANAPAFSEOS KAFANTARI POSEIDONOS ALATSATON ANTISTASEOS AGIOS THERAPON PROFITIS ILIAS AGIOS ELEFTHERIOS TREIS IERARCHES OSIA XENI MALAKOPI CHARILAOU ARETSOU TROCHIODROMIKON DEPO ALATINI CHEN KOURI VOTSI KIFISIA VYZANTIO KATIRLI DERKON KARAMPOURNAKI EXOCHES KONSTANTINOUPOLITON KATO TOUMPA TOUMPA CEMETERY ENGLISH CEMETERY KALAMARIA CEMETERY PILEA CEMETERY THERMI - CHALKIDIKI MIKRA CHALKIDIKI PANORAMA GOVATZIDAKI SQ. AINOU SQ. KAOUDI SQ. PATRIKIOU AILIDI SQ. SQ. SKRA SQ. PILEA KALAMARIA THESSALONIKI KERAMEIA ALATINI ARISTOTELIS AGIOU ELEFTHERIOU SQ. RETIREMENT HOME 2.2 2.3 2.4 2.5 2.1 2.4 72']","Pontus, located in modern-day northeastern Turkey, holds historical significance as a region that contributed to the multicultural tapestry of Thessaloniki. The early inhabitants of Panorama, a suburb of Thessaloniki, were influenced by various ethnic and cultural groups, including those from Pontus. This area was historically inhabited by Greeks who migrated from Pontus, bringing with them their traditions, language, and customs.

During the Hellenistic period, particularly under the influence of the Macedonian Empire, the connections between Thessaloniki and regions like Pontus were strengthened. The city served as a vital hub for trade and cultural exchange, facilitating interactions among diverse populations. The Greeks from Pontus were part of the broader migration patterns that shaped Thessaloniki's demographic landscape, contributing to its rich history of coexistence among different ethnicities, including Jews, Latins, and Armenians.

The legacy of Pontus is evident in the cultural practices and community structures that developed in Thessaloniki. The Pontic Greeks maintained their unique identity while integrating into the urban fabric of Thessaloniki, influencing local cuisine, music, and festivals. This blend of cultures is a hallmark of Thessaloniki's historical narrative, showcasing its role as a melting pot of civilizations.

For a visitor interested in exploring the historical significance of Pontus in relation to Thessaloniki, sites such as the White Tower and the archaeological areas around the city provide insights into this multicultural heritage. Engaging with local communities and experiencing the vibrant cultural scene can further illuminate the connections between Thessaloniki and its historical ties to Pontus, enriching the travel experience.","The first inhabitants of Panorama were refugees from Asia Minor and Pontus, indicating the historical significance of Pontus in the region's early settlement.",1.0,0.23,0.6153846153846154,0.6255329804605461,0.9999999999,0.9999999999,0.0,0.6666666644444444,,0.8820182371394735
33,What historical significance does Kalamaria hold in relation to its early inhabitants?,"['64\nSUBURBS AND CITY OUTSKIRTS\nsituated nearby. The small \nmounds in the field are ancient \ntombs; a Neolithic settlement \nwas excavated in one of them \nwith a cemetery dating to the \nGeometric and Archaic period. \nAn impressive Macedonian \ntomb was also unearthed in \nAgios Athanasios area.\nHow to get there. Bus \nlines 40, 40A and 40K leave \nfor Kalochori from the Railway \nStation Stop. If you travel by \ncar, take the Athens direction \non the national road and turn \ntowards Kalochori.\n2 \tKALAMARIA\nThis is practically an eastward \n‘extension’ of Thessaloniki and \nthe city’s best known suburb, \nstretching along the waterfront, \nwith many green spaces and \na self-contained shopping \ncentre. The first inhabitants are \nrecorded in the early 20th c. and \nduring the 1920’s significant \nnumbers of Greek refugee \npopulations settled here and \nbuilt their small houses. They \ncame from Caucasus, Minor \nAsia and Pontus [modern- \nday northeast Turkey]. Today,  \ndespite the rising building trend  \nin the area, several refugee \nhouses remain, still keeping  \na flavour of times goneby.\nMUST SEΕ: \n2.1  Sofouli Street\n(see p. 53).\n2.2  Kyverneio [Government \nHouse] (Little Palace).', '82\nThessaloniki lies in the \ncentre of a wide area that is \nextremely interesting from  \nan archaeological, historical \nand natural point of view; \nthere are countless options for \noutdoor activities, relaxing and \nentertainment. For instance, \nyou can combine your stay \nin town with a day excursion \nto renowned archaeological \nsites and places of historical \ninterest, to fascinating towns \nand great natural reserves  \nor to areas offering recreation \nor relaxation.\n1\n\t\nANCIENT PELLA\nInhabited since the Late \nHelladic period, the area \nflourished when Archelaos,  \nthe Macedon king, moved  \nthe capital of the Macedonian \nstate from Aiges (Vergina) to \nPella (late 5th – early 4th c. BC). \nThe then seaside town grew \nlarger during the reign of King \nPhilip II (his son, Alexander \nthe Great, was born here) \nand grew even larger later \nduring the rule of Cassander. \nBy the mid-2nd century BC it \nhad evolved into the greatest \npolitical, financial and cultural \ncentre among the Hellenic City \nStates. In 168 BC when the \nMacedonians were defeated in \nthe battle of Pydna, Pella was \nconquered by the Romans. \nIt gradually declined and got \neventually deserted in the 1st \ncentury BC. Among the finds \nof the greatest value are the \nexquisite mosaic floors in the \nbuildings, which manifest the \nhigh standard of living enjoyed \nby the residents.\nMUST SEE:\nHouses.']","['PANORAMA One of the best suburbs of Thessaloniki is situated at a 12 km distance S of the city centre and was built on the slope of Mt Chortiatis, offering a panoramic city view. It was uninhabited until the early 20th c., although traces of a prehistoric settlement have been located on the area. The first inhabitants were refugees from Asia Minor and Pontus. Today its largest part is covered by luxury villas and impressive detached homes; there is a small shopping area in the centre. Trigona Panoramatos [a cream puff pastry] – one of the city’s best known sweet delicacies – were created at a local confectionery in the 1950’s. MUST SEE: Platanakia. It is a nice place for relaxing, in a wooded ravine, with a small Zoo and a café. A 6 km path begins here and leads up to the artificial lake (dam) of Thermi. Along the way you will come across spots for a brief rest, short waterfalls and fragments of eight Byzantine watermills. 11 12 13 14 KONSTANTINOUPOLEOS SSIS OLGAS GIOU PAPANDREOU ROSIDI ROSIDI GEORGIOU PAPANDREOU APAFI MARKOU BOTSARI PAPANASTASIOU ANATOLIKIS THRAKIS PAPANASTASIOU VOULGARI KANARI KANARI KARAKASI KARAKASI DELFON GAVRIILIDI TH. SAKELLARIDI GAVRIILIDI KARAOLI VOULGARI KOURTIDI YPSILANTOU PLASTIRA KORAI SMYRNIS MIAOULI PLASTIRA PLASTIRA KERASOUNTOS THEMISTOKLI SOFOULI KALYVA METAMORFOSEOS KOMNINON PONTOU PONTOU AIGAIOU AIGAIOU ADRIANOUPOLEOS EL. VENIZELOU ETHNIKIS ANTISTASIS KOLOTOUROU THICHIS PAPAFLESSA MERKOURIOU KIFISIAS KIFISIAS PSELOU SOLONOS MANTINEIAS GAMVETA METAMORFOSI AGIOS NIKOLAOS NATHANAIL MALAKASI POLYLA PARASCHOU TYPALDOU GRYPARI ROIDI GAMVETA MAKEDONIAS STROMNITSIS MELENIKOU MOUSOURI PAPANTONIOU CHRISTOVASILI PORFYRA SKIATHOU ANINOU KRITIS CHAIRONEIAS PARNASSOU KOUSKOURA PAPADIMITRIOU TAKI OIKONOMIDI DODEKANISOU MITROPOLITI AMVROSIOU MITROPOLITI KALIDI MITROPOLITI GRIGORIOU KYDONION MOSCHONISION THEMISTOKLI SOFOULI KROMNIS PLOUTONOS KASSOMOULI SANGARIOU VISSARIONOS KAPETANIDI NAVARINOU KOLCHIDAS PAPAGOU KIOU POULANTZAKI KALIDOU KAVASITON XENOFONTOS IL E TIR G A NIKOMIDEIAS TRIPOLEOS CHILIS MARMARA CHALKIS VITHYNIAS MIKROULEA KONITSIS SARATSI THERAPEION NIKAIAS AGIAS ELENIS AGIOU IOANNOU VOSPOROU ELLISPONTOU MAKROCHORIOU KARAMAOUNA KARATASOU PAPANASTASIOU LEVANTI KAZIKA IRAKLEIAS IOAKEIM G’ CHRYSOSTOMOU SMYRNIS ADRAMITIOU METRON ANDROUTSOU EFESOU PASALIDI TAXIARCHON MYSTAKIDI MOUDANION EVELPIDOU AGIOU NIKOLAOU PROUSAS DALIPI BALA PAPAPETROU AVDELA KOMNINON KOTYORON ARGYROUPOLEOS SANTAS MYRION AKRITIDI EPANOMIS PAPAKYRITSI AMISSOU LEROU KYPROU PATMOU YPSILANTOU KYMIS MAKRYRACHIS SOUMELA PARANIKA VAZELONOS IASONIDI KYRIAKIDI FOKAIAS DAVAKI AGIOU VASILEIOU DIOGENOUS LEFKOSIAS ARISTOFANOUS FANARIOU PALAMA PANORMOU GRIGORIADI KALANTIDI ANATOLIKIS THRAKIS SOULIOU OMIROU ZALONGOU IONIAS PARIDOS FILADELFEIAS KAPADDOKIAS PROMITHEOS XENOPOULOU IKONIOU IPPOKRATOUS RANGAVI DIOS SOKRATOUS SOLOMOU PLOUTARCHOU EVRIPIDOU SOURI PAPANTONIOU THOUKYDIDI IOUSTINIANOU ALKIONOS ZIRGANOU IRAS LOUI SEVASTEIAS KARAVANGELI ERYTHROU STAVROU MEGALOU ALEXANDROU KAZAZI KAISAREIAS LAODIKIAS IEROSOLYMON AIANTOS AIVATZIDI AGIOU PANTELEIMONOS ANEMONAS PASTER FILELLINON KERAMOPOULOU KALAVRYTON PAPADIAMANTI FILIPPOU V. IPEIROU KOLOKOTRONI VLACHERNON KORYTSAS RODOU IRODOTOU LASANI ARISTOTELOUS ARISTEIDOU PERIKLEOUS TATAOULON DORILEOU POKIOUPTSIDI KYZIKOU KAFKASOU TSINGIRIDI AGIOU ZACHARIA CHERIANON CHALDEIAS KAROLIDI CHEIMONIDI AIMILIANOU MITR. ARTAKIS ERATYRAS ANTIGONIS VOULGAROKTONOU PARASKEVOPOULOU APOSTOLOU PAVLOU FLEMING KONSTANTINOUPOLEOS KYFONIDI S A R E M I CHRYSOULIDI THERMAIKOU PAPANIKOLA NIKOPOLEOS TRAPEZOUNTAS VASILEIADOU SIFILINON SOURMENON ARGYROPOULOU NEAPOLEOS STRAVONOS ARGONAFTON KYDONION PAPADAKI SIGALA AKTAIOU ANDRONIKOU POLEMI PAPADAKI PANSELINOU ADMITOU KASSANDREOS TSOUNTA POULIOU KORNAROU NALTSA FRANTZI KRYSTALI AINOU SIK A R H T O M A S LOGOTHETOU NIKOLAIDI THEMELI SPETSON LASKARATOU TYPA YPSILANTOU DROSINI CHALKIDIKIS THERMOPYLON THALITOS PITTAKOU GRAVIAS GRAVIAS FILELLINON OROMILA KRITIS PAPADIAMANTI NASTOU ALKMINIS NATSINA GENNADIOU MITR. NEMEAS PLATAION DANIOLOU AGIOU VASILEIOU GENNADIOU MITR. PAPAKYRIAZI KARKAVITSA AVROKORDATOU VOGA US IPATIAS KISSOU KARIATIDAS KAVIRON AGAMEMNONOS U S ARGAIOU FOINIKOS EFESSOU KAISAREIAS KALLIPOLEOS VRYOULON KYZIKOU NIKOMIDEIAS NEAPOLEOS MIDEIAS APADDOKIAS KAONIAS INIOSOGLOU NIKAIAS KAROLIDOU RANTI AS KI NIAS SANTAS POULA YPARCHOU FOKYLIDOU KERAMIKOU EPIDAVROU TSELIOU TSELIOU PRAXAGORA OLYMPIAS VOSPOROU AMFIPOLEOS MIKRAS ASIAS PONTOU VITHYNIAS PAPAGEORGIOU IOANNOU KAISAREIAS METRON IMVROU AGRIANON CHIOU CHOURMOUZI APOLLONOS SYROU FAIAKON LARNAKOS AMMOCHOSTOU NAFPLIOU NAFPLIOU DERKON KORDELIOU VIZYIS DORYLAIOU TINOU TENEDOU DARDANELLION DIMITSANAS EPIDAVROU EFSTATHIOU MITROPOLITOU PILEAS CHANDRINOU FILINTA DORYLAIOU KARANIVALOU ATLANTIDAS SVOLOU VOSPOROU ZACHOU ZIRINI ZONARA ANAXIMENOUS ANATOLIKIS ROMYLIAS ISOKRATOUS TOUSSA SPEFSIPOU MYSTAKIDI DYSTOMOU MIKROU ANTISTHENOUS STEFANOU DIMOCHAROUS MISIRLI PILEAS AEROPOU PAFSILYPOU TRIANTAFYLLOPOULOU AGALIANOU PRAIDI STAMATELOU FILI STAGIRITI STADIOU IPEIROU KYPROU KARAVANGELI MARATHONOS MAKEDONIAS ETHNIKIS CHRΥSOSTOMOU AGRA NEARCHOU IFAISTIONOS OLYMPOU KORYTSAS PTOLEMAIOU PERDIKA OLYMPIADOS OLYMPIADOS THER MOPYLON KENEDY PLASTIRA PLASTIRA PROFITI ILIA MEGALOU ALEXANDROU VAS. KONSTANTINOU GRIGORIOU LAMPRAKI (KONITSIS) FLEMING NIKIS AMFOTEROU ETEOKLI DIGKA ETEOKLI IGILOCHOU NIKANOROS EVMENOUS VASIKYROU KARATHEODORI GAZI ANAKREONTOS ANTAIOU NOUKA SEFERI POSEIDONOS MELEAGROU ANGELOU ALKAMENOUS ANAXIMANDROU ANAXIMANDROU LEONIDOU KARDITSIS IRAKLEOUS KORAI MELENIKOU ALKMINIS PARALI GLYNOU TZAVELA TZAVELA RIGA FERAIOU CHORN ZOUMETIKOU MARASLI MARSLI XENOU MAVROMICHALI ADRIANOUPOLEOS ATREIDON XYNGOPOULOU ARKADIOU OSIAS XENIS STROMNITSIS OKEANIDON DEINOKRATOUS VAMVA AGISILAOU NEOPTOLEMOU PAPA PAVLOU MELA VENIZELOU ARISTOTELOUS EIRINIS FILIKIS ETAIRIAS FILIPPOU PRASSAKAKI SCHOLEION OMIROU KOLOKOTRONI PALAIOLOGOU LAOGR. MOUSEIOU DAVAKI SELEFKOU TSELEPI TSIAPANOU TSAMI STRATIGI STRATIGI VISTA ANGELOPOULOU DIVOLI GKOURA GRIGORIOU STEFANOU ATHINA ANTHEMOUNTOS LEFAKI PAFSANIA SEMELIS AETIONOS PANTAZIDI PERRAIVOU PERRAIVOU SPANOU IPPOKRATOUS IPPOKRATOUS DIMOKRITOU VOSPOROU GLYNOU GLYNOU THEOFILOU PAPANASTASIOU VYZANTIOU PAPAFLESSA ANOIXIS VARNALI SPYROU LOUI KALVOU SYMEONIDI PROTOMAGIAS PALAMA DIMOKRATIAS VISVIZI ARTAKIS U EPTALOFOU PARMENIDI TIROLOIS EMOU POLYGNOTOU DROMIOU LISSIPOU ANTIFANOS MEGAKLEOUS EMMANOUIL EFTALIOTI EFTALIOTI DOMPOLI DOUKA ANAXIMENOUS NEARCHOU RIGA FERAIOU SEFERI MENANDROU PAPANIKOLAOU ANAPAFSEOS ZORBA ANAPAFSEOS KAFANTARI POSEIDONOS ALATSATON ANTISTASEOS AGIOS THERAPON PROFITIS ILIAS AGIOS ELEFTHERIOS TREIS IERARCHES OSIA XENI MALAKOPI CHARILAOU ARETSOU TROCHIODROMIKON DEPO ALATINI CHEN KOURI VOTSI KIFISIA VYZANTIO KATIRLI DERKON KARAMPOURNAKI EXOCHES KONSTANTINOUPOLITON KATO TOUMPA TOUMPA CEMETERY ENGLISH CEMETERY KALAMARIA CEMETERY PILEA CEMETERY THERMI - CHALKIDIKI MIKRA CHALKIDIKI PANORAMA GOVATZIDAKI SQ. AINOU SQ. KAOUDI SQ. PATRIKIOU AILIDI SQ. SQ. SKRA SQ. PILEA KALAMARIA THESSALONIKI KERAMEIA ALATINI ARISTOTELIS AGIOU ELEFTHERIOU SQ. RETIREMENT HOME 2.2 2.3 2.4 2.5 2.1 2.4 72']","Kalamaria, a suburb of Thessaloniki, holds historical significance primarily due to its early 20th-century development and the influx of Greek refugees during the 1920s. This area is noted for its transformation from a relatively undeveloped region to a vibrant community as these refugees settled here, bringing with them diverse cultural influences from regions such as the Caucasus, Minor Asia, and Pontus (modern-day northeast Turkey).

The early inhabitants of Kalamaria were primarily these refugees who built small houses, contributing to the suburb's unique architectural landscape. Despite the ongoing urban development, several of these original refugee houses remain, preserving a glimpse into the past and reflecting the resilience and adaptability of the community. This blend of history and culture makes Kalamaria an interesting destination for visitors seeking to understand the local heritage.

Additionally, Kalamaria's location along the waterfront and its green spaces enhance its appeal, providing a picturesque setting for leisure activities. The suburb's self-contained shopping center and vibrant atmosphere further enrich the experience for those exploring the area. 

For a first-time visitor, Kalamaria offers an opportunity to engage with local history while enjoying the modern amenities of a bustling suburb. The remnants of the past, combined with the lively present, create an Instagrammable backdrop that captures the essence of Thessaloniki's evolving identity. Exploring Kalamaria allows travelers to appreciate the historical significance of its early inhabitants while enjoying the charm of a contemporary Greek suburb.","Kalamaria was uninhabited until the early 20th century, although traces of a prehistoric settlement have been located in the area. The first inhabitants were refugees from Asia Minor and Pontus.",0.5,0.16,0.875,0.6828011632600701,0.9999999999,0.9999999999,0.0,0.3999999992,0.2916666666666667,0.9042180044775413
34,What is Mt Chortiatis?,"['66\nSUBURBS AND CITY OUTSKIRTS\n3.1  Chortiatis.\nNamed after the mountain, \nthis small suburb on Mt \nChortiatis (elev.: 1,201 m.), \nstretches approx. 10 km NE  \nof Panorama. Since the Roman \ntimes, Thessaloniki’s water \nsupply came from this place \nvia Vlatadon Monastery (see \np. 44); this is why you will \nsee fragments of a Byzantine \naqueduct at the suburb’s \nborder. The mountain is covered \nwith chestnut, oak, beech and \nfir trees, there is a mountain \nrefuge (Kissos location, elev. \n1,201 m.) and it is the ideal \nplace for hiking (there are 32 \ncharted paths), for mountain \nbiking and off-roading.\nHow to get there. Board \nthe 58 bus on Egnatia Street \nand get off at Dimarchio \n[Town Hall], Astynomia [Police \nStation] or at Platanakia stop.\n4 \tTHERMI\nThis suburb is located a bit \nfurther away from town (15 km \nSE of the city centre) and more \nor less still keeps a countryside \nair about it. On-site excavations \nhave shown that this was the \nlocation of the harbour of \nancient Thermi, a major one  \nin antiquity. The place was also \nknown for its hot springs – \nthermae – hence the name  \nof the gulf (Thermaikos).', 'Get off at \nNaftikos Omilos [Marine Club] \nstop or at Chamodrakas stop \nin Aretsou area.\n3 \tPANORAMA\nOne of the best suburbs of \nThessaloniki is situated at  \na 12 km distance S of the \ncity centre and was built on \nthe slope of Mt Chortiatis, \noffering a panoramic city view. \nIt was uninhabited until the \nearly 20th c., although traces \nof a prehistoric settlement \nhave been located on the area. \nThe first inhabitants were \nrefugees from Asia Minor and \nPontus. Today its largest part \nis covered by luxury villas and \nimpressive detached homes; \nthere is a small shopping \narea in the centre. Trigona \nPanoramatos [a cream puff \npastry] – one of the city’s best \nknown sweet delicacies – were \ncreated at a local confectionery \nin the 1950’s.\nMUST SEE:\nPlatanakia.\nIt is a nice place for relaxing, \nin a wooded ravine, with a \nsmall Zoo and a café. A 6 km \npath begins here and leads \nup to the artificial lake (dam) \nof Thermi. Along the way you \nwill come across spots for a \nbrief rest, short waterfalls and \nfragments of eight Byzantine \nwatermills.']","['PANORAMA One of the best suburbs of Thessaloniki is situated at a 12 km distance S of the city centre and was built on the slope of Mt Chortiatis, offering a panoramic city view. It was uninhabited until the early 20th c., although traces of a prehistoric settlement have been located on the area. The first inhabitants were refugees from Asia Minor and Pontus. Today its largest part is covered by luxury villas and impressive detached homes; there is a small shopping area in the centre. Trigona Panoramatos [a cream puff pastry] – one of the city’s best known sweet delicacies – were created at a local confectionery in the 1950’s. MUST SEE: Platanakia. It is a nice place for relaxing, in a wooded ravine, with a small Zoo and a café. A 6 km path begins here and leads up to the artificial lake (dam) of Thermi. Along the way you will come across spots for a brief rest, short waterfalls and fragments of eight Byzantine watermills. 11 12 13 14 KONSTANTINOUPOLEOS SSIS OLGAS GIOU PAPANDREOU ROSIDI ROSIDI GEORGIOU PAPANDREOU APAFI MARKOU BOTSARI PAPANASTASIOU ANATOLIKIS THRAKIS PAPANASTASIOU VOULGARI KANARI KANARI KARAKASI KARAKASI DELFON GAVRIILIDI TH. SAKELLARIDI GAVRIILIDI KARAOLI VOULGARI KOURTIDI YPSILANTOU PLASTIRA KORAI SMYRNIS MIAOULI PLASTIRA PLASTIRA KERASOUNTOS THEMISTOKLI SOFOULI KALYVA METAMORFOSEOS KOMNINON PONTOU PONTOU AIGAIOU AIGAIOU ADRIANOUPOLEOS EL. VENIZELOU ETHNIKIS ANTISTASIS KOLOTOUROU THICHIS PAPAFLESSA MERKOURIOU KIFISIAS KIFISIAS PSELOU SOLONOS MANTINEIAS GAMVETA METAMORFOSI AGIOS NIKOLAOS NATHANAIL MALAKASI POLYLA PARASCHOU TYPALDOU GRYPARI ROIDI GAMVETA MAKEDONIAS STROMNITSIS MELENIKOU MOUSOURI PAPANTONIOU CHRISTOVASILI PORFYRA SKIATHOU ANINOU KRITIS CHAIRONEIAS PARNASSOU KOUSKOURA PAPADIMITRIOU TAKI OIKONOMIDI DODEKANISOU MITROPOLITI AMVROSIOU MITROPOLITI KALIDI MITROPOLITI GRIGORIOU KYDONION MOSCHONISION THEMISTOKLI SOFOULI KROMNIS PLOUTONOS KASSOMOULI SANGARIOU VISSARIONOS KAPETANIDI NAVARINOU KOLCHIDAS PAPAGOU KIOU POULANTZAKI KALIDOU KAVASITON XENOFONTOS IL E TIR G A NIKOMIDEIAS TRIPOLEOS CHILIS MARMARA CHALKIS VITHYNIAS MIKROULEA KONITSIS SARATSI THERAPEION NIKAIAS AGIAS ELENIS AGIOU IOANNOU VOSPOROU ELLISPONTOU MAKROCHORIOU KARAMAOUNA KARATASOU PAPANASTASIOU LEVANTI KAZIKA IRAKLEIAS IOAKEIM G’ CHRYSOSTOMOU SMYRNIS ADRAMITIOU METRON ANDROUTSOU EFESOU PASALIDI TAXIARCHON MYSTAKIDI MOUDANION EVELPIDOU AGIOU NIKOLAOU PROUSAS DALIPI BALA PAPAPETROU AVDELA KOMNINON KOTYORON ARGYROUPOLEOS SANTAS MYRION AKRITIDI EPANOMIS PAPAKYRITSI AMISSOU LEROU KYPROU PATMOU YPSILANTOU KYMIS MAKRYRACHIS SOUMELA PARANIKA VAZELONOS IASONIDI KYRIAKIDI FOKAIAS DAVAKI AGIOU VASILEIOU DIOGENOUS LEFKOSIAS ARISTOFANOUS FANARIOU PALAMA PANORMOU GRIGORIADI KALANTIDI ANATOLIKIS THRAKIS SOULIOU OMIROU ZALONGOU IONIAS PARIDOS FILADELFEIAS KAPADDOKIAS PROMITHEOS XENOPOULOU IKONIOU IPPOKRATOUS RANGAVI DIOS SOKRATOUS SOLOMOU PLOUTARCHOU EVRIPIDOU SOURI PAPANTONIOU THOUKYDIDI IOUSTINIANOU ALKIONOS ZIRGANOU IRAS LOUI SEVASTEIAS KARAVANGELI ERYTHROU STAVROU MEGALOU ALEXANDROU KAZAZI KAISAREIAS LAODIKIAS IEROSOLYMON AIANTOS AIVATZIDI AGIOU PANTELEIMONOS ANEMONAS PASTER FILELLINON KERAMOPOULOU KALAVRYTON PAPADIAMANTI FILIPPOU V. IPEIROU KOLOKOTRONI VLACHERNON KORYTSAS RODOU IRODOTOU LASANI ARISTOTELOUS ARISTEIDOU PERIKLEOUS TATAOULON DORILEOU POKIOUPTSIDI KYZIKOU KAFKASOU TSINGIRIDI AGIOU ZACHARIA CHERIANON CHALDEIAS KAROLIDI CHEIMONIDI AIMILIANOU MITR. ARTAKIS ERATYRAS ANTIGONIS VOULGAROKTONOU PARASKEVOPOULOU APOSTOLOU PAVLOU FLEMING KONSTANTINOUPOLEOS KYFONIDI S A R E M I CHRYSOULIDI THERMAIKOU PAPANIKOLA NIKOPOLEOS TRAPEZOUNTAS VASILEIADOU SIFILINON SOURMENON ARGYROPOULOU NEAPOLEOS STRAVONOS ARGONAFTON KYDONION PAPADAKI SIGALA AKTAIOU ANDRONIKOU POLEMI PAPADAKI PANSELINOU ADMITOU KASSANDREOS TSOUNTA POULIOU KORNAROU NALTSA FRANTZI KRYSTALI AINOU SIK A R H T O M A S LOGOTHETOU NIKOLAIDI THEMELI SPETSON LASKARATOU TYPA YPSILANTOU DROSINI CHALKIDIKIS THERMOPYLON THALITOS PITTAKOU GRAVIAS GRAVIAS FILELLINON OROMILA KRITIS PAPADIAMANTI NASTOU ALKMINIS NATSINA GENNADIOU MITR. NEMEAS PLATAION DANIOLOU AGIOU VASILEIOU GENNADIOU MITR. PAPAKYRIAZI KARKAVITSA AVROKORDATOU VOGA US IPATIAS KISSOU KARIATIDAS KAVIRON AGAMEMNONOS U S ARGAIOU FOINIKOS EFESSOU KAISAREIAS KALLIPOLEOS VRYOULON KYZIKOU NIKOMIDEIAS NEAPOLEOS MIDEIAS APADDOKIAS KAONIAS INIOSOGLOU NIKAIAS KAROLIDOU RANTI AS KI NIAS SANTAS POULA YPARCHOU FOKYLIDOU KERAMIKOU EPIDAVROU TSELIOU TSELIOU PRAXAGORA OLYMPIAS VOSPOROU AMFIPOLEOS MIKRAS ASIAS PONTOU VITHYNIAS PAPAGEORGIOU IOANNOU KAISAREIAS METRON IMVROU AGRIANON CHIOU CHOURMOUZI APOLLONOS SYROU FAIAKON LARNAKOS AMMOCHOSTOU NAFPLIOU NAFPLIOU DERKON KORDELIOU VIZYIS DORYLAIOU TINOU TENEDOU DARDANELLION DIMITSANAS EPIDAVROU EFSTATHIOU MITROPOLITOU PILEAS CHANDRINOU FILINTA DORYLAIOU KARANIVALOU ATLANTIDAS SVOLOU VOSPOROU ZACHOU ZIRINI ZONARA ANAXIMENOUS ANATOLIKIS ROMYLIAS ISOKRATOUS TOUSSA SPEFSIPOU MYSTAKIDI DYSTOMOU MIKROU ANTISTHENOUS STEFANOU DIMOCHAROUS MISIRLI PILEAS AEROPOU PAFSILYPOU TRIANTAFYLLOPOULOU AGALIANOU PRAIDI STAMATELOU FILI STAGIRITI STADIOU IPEIROU KYPROU KARAVANGELI MARATHONOS MAKEDONIAS ETHNIKIS CHRΥSOSTOMOU AGRA NEARCHOU IFAISTIONOS OLYMPOU KORYTSAS PTOLEMAIOU PERDIKA OLYMPIADOS OLYMPIADOS THER MOPYLON KENEDY PLASTIRA PLASTIRA PROFITI ILIA MEGALOU ALEXANDROU VAS. KONSTANTINOU GRIGORIOU LAMPRAKI (KONITSIS) FLEMING NIKIS AMFOTEROU ETEOKLI DIGKA ETEOKLI IGILOCHOU NIKANOROS EVMENOUS VASIKYROU KARATHEODORI GAZI ANAKREONTOS ANTAIOU NOUKA SEFERI POSEIDONOS MELEAGROU ANGELOU ALKAMENOUS ANAXIMANDROU ANAXIMANDROU LEONIDOU KARDITSIS IRAKLEOUS KORAI MELENIKOU ALKMINIS PARALI GLYNOU TZAVELA TZAVELA RIGA FERAIOU CHORN ZOUMETIKOU MARASLI MARSLI XENOU MAVROMICHALI ADRIANOUPOLEOS ATREIDON XYNGOPOULOU ARKADIOU OSIAS XENIS STROMNITSIS OKEANIDON DEINOKRATOUS VAMVA AGISILAOU NEOPTOLEMOU PAPA PAVLOU MELA VENIZELOU ARISTOTELOUS EIRINIS FILIKIS ETAIRIAS FILIPPOU PRASSAKAKI SCHOLEION OMIROU KOLOKOTRONI PALAIOLOGOU LAOGR. MOUSEIOU DAVAKI SELEFKOU TSELEPI TSIAPANOU TSAMI STRATIGI STRATIGI VISTA ANGELOPOULOU DIVOLI GKOURA GRIGORIOU STEFANOU ATHINA ANTHEMOUNTOS LEFAKI PAFSANIA SEMELIS AETIONOS PANTAZIDI PERRAIVOU PERRAIVOU SPANOU IPPOKRATOUS IPPOKRATOUS DIMOKRITOU VOSPOROU GLYNOU GLYNOU THEOFILOU PAPANASTASIOU VYZANTIOU PAPAFLESSA ANOIXIS VARNALI SPYROU LOUI KALVOU SYMEONIDI PROTOMAGIAS PALAMA DIMOKRATIAS VISVIZI ARTAKIS U EPTALOFOU PARMENIDI TIROLOIS EMOU POLYGNOTOU DROMIOU LISSIPOU ANTIFANOS MEGAKLEOUS EMMANOUIL EFTALIOTI EFTALIOTI DOMPOLI DOUKA ANAXIMENOUS NEARCHOU RIGA FERAIOU SEFERI MENANDROU PAPANIKOLAOU ANAPAFSEOS ZORBA ANAPAFSEOS KAFANTARI POSEIDONOS ALATSATON ANTISTASEOS AGIOS THERAPON PROFITIS ILIAS AGIOS ELEFTHERIOS TREIS IERARCHES OSIA XENI MALAKOPI CHARILAOU ARETSOU TROCHIODROMIKON DEPO ALATINI CHEN KOURI VOTSI KIFISIA VYZANTIO KATIRLI DERKON KARAMPOURNAKI EXOCHES KONSTANTINOUPOLITON KATO TOUMPA TOUMPA CEMETERY ENGLISH CEMETERY KALAMARIA CEMETERY PILEA CEMETERY THERMI - CHALKIDIKI MIKRA CHALKIDIKI PANORAMA GOVATZIDAKI SQ. AINOU SQ. KAOUDI SQ. PATRIKIOU AILIDI SQ. SQ. SKRA SQ. PILEA KALAMARIA THESSALONIKI KERAMEIA ALATINI ARISTOTELIS AGIOU ELEFTHERIOU SQ. RETIREMENT HOME 2.2 2.3 2.4 2.5 2.1 2.4 72']","Mt Chortiatis is a prominent mountain located approximately 10 km northeast of the suburb of Panorama in Thessaloniki, Greece. With an elevation of 1,201 meters, it offers stunning panoramic views of the city and surrounding areas, making it an attractive destination for leisure travelers. The mountain is rich in natural beauty, covered with diverse vegetation including chestnut, oak, beech, and fir trees, providing a serene environment for outdoor activities.

For those interested in hiking, Mt Chortiatis features 32 charted paths, catering to various skill levels. It is also a popular spot for mountain biking and off-roading, appealing to adventure seekers. A notable location on the mountain is Kissos, which serves as a mountain refuge, ideal for resting and enjoying the scenery.

Historically, Mt Chortiatis has significance dating back to Roman times, as it was a source of water for Thessaloniki, with remnants of a Byzantine aqueduct still visible at the suburb's border. This historical aspect adds an intriguing layer to your visit, allowing for exploration of both nature and history.

To reach Mt Chortiatis, you can take the 58 bus from Egnatia Street and disembark at stops such as Dimarchio (Town Hall), Astynomia (Police Station), or Platanakia. The accessibility of public transport makes it convenient for solo travelers looking to explore the area without the need for a car.

In summary, Mt Chortiatis is a perfect destination for those seeking a blend of outdoor adventure, historical exploration, and breathtaking views, all within a short distance from Thessaloniki. Whether you're hiking its trails or simply enjoying the landscape, it offers a memorable experience for first-time visitors.","Mt Chortiatis is a mountain located near Panorama, one of the best suburbs of Thessaloniki, situated 12 km south of the city center. It offers a panoramic view of the city and has traces of a prehistoric settlement.",0.6666666666666666,0.54,0.967741935483871,0.8589465516257722,0.99999999995,0.99999999995,0.0,0.49999999875,,0.8658759790577211
35,What is Mt Chortiatis and what can I see there?,"['66\nSUBURBS AND CITY OUTSKIRTS\n3.1  Chortiatis.\nNamed after the mountain, \nthis small suburb on Mt \nChortiatis (elev.: 1,201 m.), \nstretches approx. 10 km NE  \nof Panorama. Since the Roman \ntimes, Thessaloniki’s water \nsupply came from this place \nvia Vlatadon Monastery (see \np. 44); this is why you will \nsee fragments of a Byzantine \naqueduct at the suburb’s \nborder. The mountain is covered \nwith chestnut, oak, beech and \nfir trees, there is a mountain \nrefuge (Kissos location, elev. \n1,201 m.) and it is the ideal \nplace for hiking (there are 32 \ncharted paths), for mountain \nbiking and off-roading.\nHow to get there. Board \nthe 58 bus on Egnatia Street \nand get off at Dimarchio \n[Town Hall], Astynomia [Police \nStation] or at Platanakia stop.\n4 \tTHERMI\nThis suburb is located a bit \nfurther away from town (15 km \nSE of the city centre) and more \nor less still keeps a countryside \nair about it. On-site excavations \nhave shown that this was the \nlocation of the harbour of \nancient Thermi, a major one  \nin antiquity. The place was also \nknown for its hot springs – \nthermae – hence the name  \nof the gulf (Thermaikos).', 'Get off at \nNaftikos Omilos [Marine Club] \nstop or at Chamodrakas stop \nin Aretsou area.\n3 \tPANORAMA\nOne of the best suburbs of \nThessaloniki is situated at  \na 12 km distance S of the \ncity centre and was built on \nthe slope of Mt Chortiatis, \noffering a panoramic city view. \nIt was uninhabited until the \nearly 20th c., although traces \nof a prehistoric settlement \nhave been located on the area. \nThe first inhabitants were \nrefugees from Asia Minor and \nPontus. Today its largest part \nis covered by luxury villas and \nimpressive detached homes; \nthere is a small shopping \narea in the centre. Trigona \nPanoramatos [a cream puff \npastry] – one of the city’s best \nknown sweet delicacies – were \ncreated at a local confectionery \nin the 1950’s.\nMUST SEE:\nPlatanakia.\nIt is a nice place for relaxing, \nin a wooded ravine, with a \nsmall Zoo and a café. A 6 km \npath begins here and leads \nup to the artificial lake (dam) \nof Thermi. Along the way you \nwill come across spots for a \nbrief rest, short waterfalls and \nfragments of eight Byzantine \nwatermills.']","['PANORAMA One of the best suburbs of Thessaloniki is situated at a 12 km distance S of the city centre and was built on the slope of Mt Chortiatis, offering a panoramic city view. It was uninhabited until the early 20th c., although traces of a prehistoric settlement have been located on the area. The first inhabitants were refugees from Asia Minor and Pontus. Today its largest part is covered by luxury villas and impressive detached homes; there is a small shopping area in the centre. Trigona Panoramatos [a cream puff pastry] – one of the city’s best known sweet delicacies – were created at a local confectionery in the 1950’s. MUST SEE: Platanakia. It is a nice place for relaxing, in a wooded ravine, with a small Zoo and a café. A 6 km path begins here and leads up to the artificial lake (dam) of Thermi. Along the way you will come across spots for a brief rest, short waterfalls and fragments of eight Byzantine watermills. 11 12 13 14 KONSTANTINOUPOLEOS SSIS OLGAS GIOU PAPANDREOU ROSIDI ROSIDI GEORGIOU PAPANDREOU APAFI MARKOU BOTSARI PAPANASTASIOU ANATOLIKIS THRAKIS PAPANASTASIOU VOULGARI KANARI KANARI KARAKASI KARAKASI DELFON GAVRIILIDI TH. SAKELLARIDI GAVRIILIDI KARAOLI VOULGARI KOURTIDI YPSILANTOU PLASTIRA KORAI SMYRNIS MIAOULI PLASTIRA PLASTIRA KERASOUNTOS THEMISTOKLI SOFOULI KALYVA METAMORFOSEOS KOMNINON PONTOU PONTOU AIGAIOU AIGAIOU ADRIANOUPOLEOS EL. VENIZELOU ETHNIKIS ANTISTASIS KOLOTOUROU THICHIS PAPAFLESSA MERKOURIOU KIFISIAS KIFISIAS PSELOU SOLONOS MANTINEIAS GAMVETA METAMORFOSI AGIOS NIKOLAOS NATHANAIL MALAKASI POLYLA PARASCHOU TYPALDOU GRYPARI ROIDI GAMVETA MAKEDONIAS STROMNITSIS MELENIKOU MOUSOURI PAPANTONIOU CHRISTOVASILI PORFYRA SKIATHOU ANINOU KRITIS CHAIRONEIAS PARNASSOU KOUSKOURA PAPADIMITRIOU TAKI OIKONOMIDI DODEKANISOU MITROPOLITI AMVROSIOU MITROPOLITI KALIDI MITROPOLITI GRIGORIOU KYDONION MOSCHONISION THEMISTOKLI SOFOULI KROMNIS PLOUTONOS KASSOMOULI SANGARIOU VISSARIONOS KAPETANIDI NAVARINOU KOLCHIDAS PAPAGOU KIOU POULANTZAKI KALIDOU KAVASITON XENOFONTOS IL E TIR G A NIKOMIDEIAS TRIPOLEOS CHILIS MARMARA CHALKIS VITHYNIAS MIKROULEA KONITSIS SARATSI THERAPEION NIKAIAS AGIAS ELENIS AGIOU IOANNOU VOSPOROU ELLISPONTOU MAKROCHORIOU KARAMAOUNA KARATASOU PAPANASTASIOU LEVANTI KAZIKA IRAKLEIAS IOAKEIM G’ CHRYSOSTOMOU SMYRNIS ADRAMITIOU METRON ANDROUTSOU EFESOU PASALIDI TAXIARCHON MYSTAKIDI MOUDANION EVELPIDOU AGIOU NIKOLAOU PROUSAS DALIPI BALA PAPAPETROU AVDELA KOMNINON KOTYORON ARGYROUPOLEOS SANTAS MYRION AKRITIDI EPANOMIS PAPAKYRITSI AMISSOU LEROU KYPROU PATMOU YPSILANTOU KYMIS MAKRYRACHIS SOUMELA PARANIKA VAZELONOS IASONIDI KYRIAKIDI FOKAIAS DAVAKI AGIOU VASILEIOU DIOGENOUS LEFKOSIAS ARISTOFANOUS FANARIOU PALAMA PANORMOU GRIGORIADI KALANTIDI ANATOLIKIS THRAKIS SOULIOU OMIROU ZALONGOU IONIAS PARIDOS FILADELFEIAS KAPADDOKIAS PROMITHEOS XENOPOULOU IKONIOU IPPOKRATOUS RANGAVI DIOS SOKRATOUS SOLOMOU PLOUTARCHOU EVRIPIDOU SOURI PAPANTONIOU THOUKYDIDI IOUSTINIANOU ALKIONOS ZIRGANOU IRAS LOUI SEVASTEIAS KARAVANGELI ERYTHROU STAVROU MEGALOU ALEXANDROU KAZAZI KAISAREIAS LAODIKIAS IEROSOLYMON AIANTOS AIVATZIDI AGIOU PANTELEIMONOS ANEMONAS PASTER FILELLINON KERAMOPOULOU KALAVRYTON PAPADIAMANTI FILIPPOU V. IPEIROU KOLOKOTRONI VLACHERNON KORYTSAS RODOU IRODOTOU LASANI ARISTOTELOUS ARISTEIDOU PERIKLEOUS TATAOULON DORILEOU POKIOUPTSIDI KYZIKOU KAFKASOU TSINGIRIDI AGIOU ZACHARIA CHERIANON CHALDEIAS KAROLIDI CHEIMONIDI AIMILIANOU MITR. ARTAKIS ERATYRAS ANTIGONIS VOULGAROKTONOU PARASKEVOPOULOU APOSTOLOU PAVLOU FLEMING KONSTANTINOUPOLEOS KYFONIDI S A R E M I CHRYSOULIDI THERMAIKOU PAPANIKOLA NIKOPOLEOS TRAPEZOUNTAS VASILEIADOU SIFILINON SOURMENON ARGYROPOULOU NEAPOLEOS STRAVONOS ARGONAFTON KYDONION PAPADAKI SIGALA AKTAIOU ANDRONIKOU POLEMI PAPADAKI PANSELINOU ADMITOU KASSANDREOS TSOUNTA POULIOU KORNAROU NALTSA FRANTZI KRYSTALI AINOU SIK A R H T O M A S LOGOTHETOU NIKOLAIDI THEMELI SPETSON LASKARATOU TYPA YPSILANTOU DROSINI CHALKIDIKIS THERMOPYLON THALITOS PITTAKOU GRAVIAS GRAVIAS FILELLINON OROMILA KRITIS PAPADIAMANTI NASTOU ALKMINIS NATSINA GENNADIOU MITR. NEMEAS PLATAION DANIOLOU AGIOU VASILEIOU GENNADIOU MITR. PAPAKYRIAZI KARKAVITSA AVROKORDATOU VOGA US IPATIAS KISSOU KARIATIDAS KAVIRON AGAMEMNONOS U S ARGAIOU FOINIKOS EFESSOU KAISAREIAS KALLIPOLEOS VRYOULON KYZIKOU NIKOMIDEIAS NEAPOLEOS MIDEIAS APADDOKIAS KAONIAS INIOSOGLOU NIKAIAS KAROLIDOU RANTI AS KI NIAS SANTAS POULA YPARCHOU FOKYLIDOU KERAMIKOU EPIDAVROU TSELIOU TSELIOU PRAXAGORA OLYMPIAS VOSPOROU AMFIPOLEOS MIKRAS ASIAS PONTOU VITHYNIAS PAPAGEORGIOU IOANNOU KAISAREIAS METRON IMVROU AGRIANON CHIOU CHOURMOUZI APOLLONOS SYROU FAIAKON LARNAKOS AMMOCHOSTOU NAFPLIOU NAFPLIOU DERKON KORDELIOU VIZYIS DORYLAIOU TINOU TENEDOU DARDANELLION DIMITSANAS EPIDAVROU EFSTATHIOU MITROPOLITOU PILEAS CHANDRINOU FILINTA DORYLAIOU KARANIVALOU ATLANTIDAS SVOLOU VOSPOROU ZACHOU ZIRINI ZONARA ANAXIMENOUS ANATOLIKIS ROMYLIAS ISOKRATOUS TOUSSA SPEFSIPOU MYSTAKIDI DYSTOMOU MIKROU ANTISTHENOUS STEFANOU DIMOCHAROUS MISIRLI PILEAS AEROPOU PAFSILYPOU TRIANTAFYLLOPOULOU AGALIANOU PRAIDI STAMATELOU FILI STAGIRITI STADIOU IPEIROU KYPROU KARAVANGELI MARATHONOS MAKEDONIAS ETHNIKIS CHRΥSOSTOMOU AGRA NEARCHOU IFAISTIONOS OLYMPOU KORYTSAS PTOLEMAIOU PERDIKA OLYMPIADOS OLYMPIADOS THER MOPYLON KENEDY PLASTIRA PLASTIRA PROFITI ILIA MEGALOU ALEXANDROU VAS. KONSTANTINOU GRIGORIOU LAMPRAKI (KONITSIS) FLEMING NIKIS AMFOTEROU ETEOKLI DIGKA ETEOKLI IGILOCHOU NIKANOROS EVMENOUS VASIKYROU KARATHEODORI GAZI ANAKREONTOS ANTAIOU NOUKA SEFERI POSEIDONOS MELEAGROU ANGELOU ALKAMENOUS ANAXIMANDROU ANAXIMANDROU LEONIDOU KARDITSIS IRAKLEOUS KORAI MELENIKOU ALKMINIS PARALI GLYNOU TZAVELA TZAVELA RIGA FERAIOU CHORN ZOUMETIKOU MARASLI MARSLI XENOU MAVROMICHALI ADRIANOUPOLEOS ATREIDON XYNGOPOULOU ARKADIOU OSIAS XENIS STROMNITSIS OKEANIDON DEINOKRATOUS VAMVA AGISILAOU NEOPTOLEMOU PAPA PAVLOU MELA VENIZELOU ARISTOTELOUS EIRINIS FILIKIS ETAIRIAS FILIPPOU PRASSAKAKI SCHOLEION OMIROU KOLOKOTRONI PALAIOLOGOU LAOGR. MOUSEIOU DAVAKI SELEFKOU TSELEPI TSIAPANOU TSAMI STRATIGI STRATIGI VISTA ANGELOPOULOU DIVOLI GKOURA GRIGORIOU STEFANOU ATHINA ANTHEMOUNTOS LEFAKI PAFSANIA SEMELIS AETIONOS PANTAZIDI PERRAIVOU PERRAIVOU SPANOU IPPOKRATOUS IPPOKRATOUS DIMOKRITOU VOSPOROU GLYNOU GLYNOU THEOFILOU PAPANASTASIOU VYZANTIOU PAPAFLESSA ANOIXIS VARNALI SPYROU LOUI KALVOU SYMEONIDI PROTOMAGIAS PALAMA DIMOKRATIAS VISVIZI ARTAKIS U EPTALOFOU PARMENIDI TIROLOIS EMOU POLYGNOTOU DROMIOU LISSIPOU ANTIFANOS MEGAKLEOUS EMMANOUIL EFTALIOTI EFTALIOTI DOMPOLI DOUKA ANAXIMENOUS NEARCHOU RIGA FERAIOU SEFERI MENANDROU PAPANIKOLAOU ANAPAFSEOS ZORBA ANAPAFSEOS KAFANTARI POSEIDONOS ALATSATON ANTISTASEOS AGIOS THERAPON PROFITIS ILIAS AGIOS ELEFTHERIOS TREIS IERARCHES OSIA XENI MALAKOPI CHARILAOU ARETSOU TROCHIODROMIKON DEPO ALATINI CHEN KOURI VOTSI KIFISIA VYZANTIO KATIRLI DERKON KARAMPOURNAKI EXOCHES KONSTANTINOUPOLITON KATO TOUMPA TOUMPA CEMETERY ENGLISH CEMETERY KALAMARIA CEMETERY PILEA CEMETERY THERMI - CHALKIDIKI MIKRA CHALKIDIKI PANORAMA GOVATZIDAKI SQ. AINOU SQ. KAOUDI SQ. PATRIKIOU AILIDI SQ. SQ. SKRA SQ. PILEA KALAMARIA THESSALONIKI KERAMEIA ALATINI ARISTOTELIS AGIOU ELEFTHERIOU SQ. RETIREMENT HOME 2.2 2.3 2.4 2.5 2.1 2.4 72']","Mt Chortiatis is a prominent mountain located approximately 10 km northeast of the suburb of Panorama in Thessaloniki, with an elevation of 1,201 meters. It is a popular destination for outdoor enthusiasts, offering a variety of activities such as hiking, mountain biking, and off-roading. The mountain is adorned with diverse flora, including chestnut, oak, beech, and fir trees, making it a picturesque spot for nature lovers.

One of the highlights of Mt Chortiatis is the Vlatadon Monastery, which has historical significance as it was part of Thessaloniki's water supply system since Roman times. Visitors can explore the remnants of a Byzantine aqueduct near the suburb's border, adding a touch of history to your outdoor adventure.

For those looking to enjoy the scenery, there are 32 charted hiking paths that cater to different skill levels, allowing you to immerse yourself in the natural beauty of the area. The mountain refuge at Kissos, located at the same elevation, serves as a great starting point for your explorations and offers a place to rest after a day of activities.

To reach Mt Chortiatis, you can take the 58 bus from Egnatia Street and disembark at stops such as Dimarchio (Town Hall), Astynomia (Police Station), or Platanakia. The area is also known for its tranquil environment, making it an ideal spot for relaxation and enjoying the views of Thessaloniki.

In summary, Mt Chortiatis is a fantastic destination for sightseeing and outdoor activities, with opportunities to connect with nature and explore historical sites, all while being easily accessible from the city.","Mt Chortiatis is located near Panorama, a suburb of Thessaloniki, which is built on its slope. It offers a panoramic view of the city. The area has traces of prehistoric settlements and was first inhabited by refugees from Asia Minor and Pontus in the early 20th century. You can visit Platanakia, a nice place for relaxing with a small zoo and café, and a 6 km path that leads to the artificial lake of Thermi, featuring spots for rest, short waterfalls, and remnants of eight Byzantine watermills.",1.0,0.31,0.6896551724137931,0.8339422429373957,0.9999999999,0.99999999995,0.0,0.7777777769135802,,0.9045414488885712
36,"What is the historical significance of the Railway Station on Monastiriou Street in Thessaloniki, and how does it relate to the city's transportation development?","['The road \ndistances (in km) where \nThessaloniki is the starting \npoint get calculated from  \nthis square.\n2 \t\n\x07AROUND DIMOKRATIAS \nSQUARE\nThere are mostly faceless \nbuildings in the area – \namong them you will find \nsmall manufactures or old \nindustries. However there are \nalso historic sites, as there \nare sections of the city’s west \nwalls here, Byzantine and \nottoman monuments and other \narchaeological sites (temple  \nof Aphrodite, 6th c. BC).\nMUST SEE:\n2.1  Railway Station.\nIt is on Monastiriou Street \nwhich is renamed at some \npoint Egnatia Street (see p. 34). \nConstruction began in 1939 \nand it became fully operational \nin 1951, but it was officially \n66.  \nVardariou \nTower (Top \nHane).\n67.  \nOld steam \nengine \nfronting \nThessaloniki’s \nRailway \nStation.', 'ARC\nAG\nDIMIT\nTERPSITHEA\nSQ.\nRAILWAY STATION\nSQ.\nOLD RAILWAY\nSTATION SQ.\nGALANOPOULOU\nSQ.\nSYKIES\nNEAPOLI\nAMPELOKIPOI\nMENEMENI\nMAKEDONOMACHON\nSQ.\nKARAOLI-DIMITRIOU SQ.\nELEFTHERIAS\nSQ.\nDROPOTAMOS\n7th walk: \nWEST OF THE CENTRE-STAVROUPOLI\n2\n3\n1\n4\n3.2\n2.2\n2.1\n4.1\n4.2\n4.3\n4.3\n4.4\n2.3\n2.4\n2.5\n2.8\n2.7 2.6\n3.1\n3.3\n1 \t\x07DIMOKRATIAS SQUARE \n(VARDARI)\nSince ancient times, this  \nhas been the most important \nentry point to Thessaloniki. \nThis relatively disadvantaged \narea is a transportation hub \nconnecting the west and \nnorthwest suburbs with the \ncity centre; there are also \nseveral hotels, small shops, \ntavernas and cafés in the \narea. In the centre of the \nsquare you will see the statue \nof King Constantine (1868-\n1923), who entered the \ncity in 1912 in his capacity \nas commander-in-chief of \nthe Greek Army. The road \ndistances (in km) where \nThessaloniki is the starting \npoint get calculated from  \nthis square.']","['<1-hop>\n\nMUST SEE: 2.1 Railway Station. It is on Monastiriou Street which is renamed at some point Egnatia Street (see p. 34). Construction began in 1939 and it became fully operational in 1951, but it was officially 66. Vardariou Tower (Top Hane). 67. Old steam engine fronting Thessaloniki’s Railway Station.']","The Railway Station on Monastiriou Street in Thessaloniki holds significant historical importance as a key transportation hub that has shaped the city's connectivity and development. Construction of the station began in 1939 and it became fully operational in 1951, marking a pivotal moment in Thessaloniki's transportation infrastructure. The station not only facilitated the movement of people and goods but also symbolized the modernization of the city in the post-war era.

Historically, the station has served as a critical entry point for travelers, linking Thessaloniki to various regions in Greece and beyond. Its strategic location on Monastiriou Street, which later transitions into Egnatia Street, underscores its role in connecting the city center with the suburbs and facilitating access to the broader transportation network. This accessibility has been vital for both local residents and visitors, enhancing the city's economic and social interactions.

The Railway Station is also situated near significant historical sites, including sections of the city's west walls and various Byzantine and Ottoman monuments. This proximity allows travelers to easily explore Thessaloniki's rich cultural heritage while enjoying the convenience of modern transportation. The station's architectural design, reflecting the era's style, adds to its charm and makes it an Instagrammable spot for visitors interested in capturing the essence of the city.

In summary, the Railway Station on Monastiriou Street is not just a functional transport facility; it is a historical landmark that represents Thessaloniki's evolution as a transportation hub. Its significance lies in its role in connecting the past with the present, making it an essential stop for anyone looking to understand the city's development and enjoy its vibrant culture.","The Railway Station on Monastiriou Street, which was later renamed Egnatia Street, holds historical significance as its construction began in 1939 and it became fully operational in 1951. This station is a key part of Thessaloniki's transportation development, symbolizing the city's connectivity and progress in the mid-20th century. Additionally, the presence of the old steam engine in front of the station highlights the historical evolution of transportation in the area.",1.0,0.46,0.2,0.8652111786830083,0.9999999999,0.9999999999,0.0,0.7499999990624999,,0.9316067108153283
37,"What historical significance does Egnatia Street hold in Thessaloniki, and what notable landmarks can be found along this avenue?","['34\n1 \tEGNATIA STREET\nThis central avenue has \nbeen there practically since \nThessaloniki’s founding,  \nas it is a section of the road \nconstructed by the Romans  \nin the 2nd c. BC, and connected \nDyrrhachium (Durrës, in \nmodern day Albania) with \nConstantinople. It starts at \nDimokratia square (see p. 58) \nand ends at the TIF grounds \n(see p. 31) and the Aristotle \nUniversity of Thessaloniki, \nsplitting in two the town’s \nhistoric centre. It is a busy \nshopping area with numerous \nremarkable buildings of \neclectic and art deco style \ndating to the early 20th c. \n(mostly old hotels) that are \nabsolutely worth observing,  \nas well as some of the city’s \nmost important monuments.\nMUST SEE:\n1.1  Kolomvou Square.\nThe crossroads where \nEgnatia Street meets \nAntigonidon Street is indeed \na bustling one! It was named \nafter G. Colombo, an Italian \nwho opened a hotel there  \nin the early 20th century. This \nis the location of Kolomvou \nArchway (31, Egnatia St.) \nwhich has become a leisure \nhub with cafés, bars and \nrestaurants inside.\n1.2  Hamza Bey Mosque.\nIt was built in 1467 by the \ndaughter of Hamza Bey, the \nmilitary commander of Sultan \nMurad II.', '30\n3rd walk: \nHISTORIC CENTRE (2)\nMUSEUM AREA\nflats facing the adjacent \nIppodromiou square. This was \na 450 m. long and a 95 m. \nwide structure and it used to \nbe the centre of social activity \nfor citizens until 390 AD, \nwhen emperor Theodosius \nordered the massacre of \n7,000 Thessalonians there; \nthe event led to the close-\ndown of the Hippodrome. It is \nworth visiting the Thessaloniki \nHistory Centre, situated in the \nsquare’s south side as well as \nthe remarkable 18th c. Agios \nAntonios church in Margariti \nstreet nearby. \n8.7  Arched Hall.\nIt lies at the intersection  \nof Gounari and Svolou streets. \nThis was a place with heating \ninstallations for holding \nsymposia and ceremonies. \nIt had a direct access to \nthe imperial box in the \nHippodrome.\n8.8  Theatre - stadium  \nin Apellou Street.\nThe remains of a building \nhave been located at 5 & \n7 Apellou St., and they are \nconsidered to have been part \nof the theatre-stadium of the \ntown, which was in use from \nthe 1st until the 4th c. AD.  \nThere are references connecting \nthis place with the martyrdom \nof Agios Dimitrios, the city’s \npatron saint.\n9 \tTHREE CHURCHES\nOn the south side of Egnatia \nStreet, between K. Palaiologou \nSt.']","['<1-hop>\n\n34 1 EGNATIA STREET This central avenue has been there practically since Thessaloniki’s founding, as it is a section of the road constructed by the Romans in the 2nd c. BC, and connected Dyrrhachium (Durrës, in modern day Albania) with Constantinople. It starts at Dimokratia square (see p. 58) and ends at the TIF grounds (see p. 31) and the Aristotle University of Thessaloniki, splitting in two the town’s historic centre. It is a busy shopping area with numerous remarkable buildings of eclectic and art deco style dating to the early 20th c. (mostly old hotels) that are absolutely worth observing, as well as some of the city’s most important monuments. MUST SEE: 1.1 Kolomvou Square. The crossroads where Egnatia Street meets Antigonidon Street is indeed a bustling one! It was named after G. Colombo, an Italian who opened a hotel there in the early 20th century. This is the location of Kolomvou Archway (31, Egnatia St.) which has become a leisure hub with cafés, bars and restaurants inside. 1.2 Hamza Bey Mosque. It was built in 1467 by the daughter of Hamza Bey, the military commander of Sultan Murad II. It is the only mosque in Greece with a peristyle (a colonnaded yard). For many decades it housed a cinema named Alkazar. Currently there are renovation works under way. Once they are finished, it will house an exhibition of finds unearthed during the metro excavations. Right behind it you will see the City Manor which housed the Town Hall until recently. It is known at Karavan Serai as there used to be an ottoman inn here. (early 16th c.). 4th walk:']","Egnatia Street is a historically significant avenue in Thessaloniki, tracing its origins back to the Roman era in the 2nd century BC. It served as a vital connection between Dyrrhachium (modern-day Durrës, Albania) and Constantinople, making it a crucial route for trade and travel in antiquity. Today, Egnatia Street splits the city's historic center and is a bustling hub of activity, lined with eclectic and art deco buildings from the early 20th century, including notable hotels and monuments.

As a solo traveler interested in sightseeing, you will find several must-see landmarks along Egnatia Street:

1. **Kolomvou Square**: This lively crossroads where Egnatia meets Antigonidon Street is named after G. Colombo, an Italian hotelier. It features the Kolomvou Archway and is a vibrant leisure hub filled with cafés, bars, and restaurants, perfect for capturing Instagrammable moments.

2. **Hamza Bey Mosque**: Built in 1467, this mosque is a significant historical site, showcasing the city's Ottoman heritage. Its architecture and history provide a fascinating glimpse into Thessaloniki's past.

3. **Aristotle University of Thessaloniki**: Located at the end of Egnatia Street, this prominent university is not only an educational institution but also a cultural landmark, contributing to the city's vibrant atmosphere.

Exploring Egnatia Street offers a blend of history, culture, and modern-day life, making it an ideal spot for leisurely walks and local interactions. The avenue's rich historical significance and the presence of notable landmarks provide ample opportunities for sightseeing and photography, ensuring a memorable experience during your visit.","Egnatia Street is historically significant as it has been a central avenue since the founding of Thessaloniki, originally constructed by the Romans in the 2nd century BC to connect Dyrrhachium with Constantinople. Along this busy shopping area, notable landmarks include Kolomvou Square, which features the Kolomvou Archway, a leisure hub with cafés and restaurants, and the Hamza Bey Mosque, built in 1467, which is unique for its peristyle and is currently undergoing renovations to house an exhibition of archaeological finds.",0.6666666666666666,0.65,0.5384615384615384,0.8444372089608885,0.99999999995,0.9999999999,1.0,0.7272727266115702,,0.8194030766088857
38,What is the historical significance of the Railway Station in Thessaloniki and its transportation role?,"['9\nT H E S S A LO N I K I\nsettles in town, chased out  \nof European countries – \nmostly of the Iberian pninsula. \nTheir role in Thessaloniki’s \nhistory will be a significant \none until the mid-20th century.\n 16th-18th c.:\t\nThessaloniki grows,  \nand the various ethnic and \nreligious communities live  \nin harmony. In the 18th c.  \nthe town acquires the features  \nof a large trade centre.\n Late 19th c.:\t\nA railway connection is \nestablished with Europe and \nConstantinople. Infrastructure \ngets streamlined and \nThessaloniki acquires the feel \nof a cosmopolitan European \ncity. The Greeks become at \nthis point in time the largest \npart of the population.\n 1890:\t\nFire incinerates a considerable \npart of the town’s seafront \nzone.\n 1912:\t\nDuring the 1st Balkan War, \nthe Greek army seizes the \ntown on October 26th; after \nfive centuries of ottoman \noccupation, Thessaloniki \nbecomes part of Greece.\n 1916:\t\nFollowing a clash with \nKing Constantine, Eleftherios \nVenizelos forms the \ntemporary “National Defence \nGovernment” in Thessaloniki, \nwhich remained there for \nseveral months.\n 1917:\t\nThe biggest part of the \ntown is destroyed by a fire \nthat breaks out on August \n18th and lasts for 32 hours.', '59\n7th walk: \nWEST OF THE CENTRE-STAVROUPOLI\ninaugurated in 1962 (S. Molfesis, \nTh. Papagiannis). Its exterior \nside combines modern and \nclassical elements with wings \nadded on the sides. It connects \nThessaloniki with the rest of \nGreece, the Balkans and Istanbul; \nit is also the bus terminus \ntowards most of the city areas. \nThis will be the location of the \nwest metro line terminus under \nconstruction in Thessaloniki.\n2.2  Old Railway Station.\nIt was built in 1894 near the \nharbour (Old Station Street) \nin the neoclassical style, \nand it gradually connected \nThessaloniki with Skopje, \nBelgrade, Monastir and \nConstantinople (modern-day \nIstanbul). Today it is exclusively \nused as a cargo train station. \nThis is where the German \noccupation forces mustered \nabout 50,000 Jewish residents, \nfrom March until August 1943, \nin order to send them by train \noff to concentration camps.\n2.3  Top Hane (Vardariou \nTower).\nSituated where the west \nand seafront city walls used \nto meet, this Tower was built \nby the Ottomans in 1546 and \nit was known as the Armoury \nTower. It is a six-sided, three-\nstorey and 10-metre high tower \nwhich used to be the main city \nstronghold.']","['<1-hop>\n\nMUST SEE: 2.1 Railway Station. It is on Monastiriou Street which is renamed at some point Egnatia Street (see p. 34). Construction began in 1939 and it became fully operational in 1951, but it was officially 66. Vardariou Tower (Top Hane). 67. Old steam engine fronting Thessaloniki’s Railway Station.']","The Railway Station in Thessaloniki, built in 1894, holds significant historical and transportation value. Initially constructed near the harbor in a neoclassical style, it served as a vital connection point for Thessaloniki with major cities in the Balkans, including Skopje, Belgrade, and Monastir, as well as Constantinople (modern-day Istanbul). This connectivity facilitated trade and cultural exchange, contributing to Thessaloniki's development as a cosmopolitan hub in the late 19th and early 20th centuries.

The station played a crucial role during the German occupation in World War II, where it became a site of tragedy as approximately 50,000 Jewish residents were gathered here before being deported to concentration camps. This dark chapter in history adds to the station's significance, marking it as a witness to both the city's growth and its struggles.

Today, while the Old Railway Station is primarily used as a cargo train station, its historical importance remains evident. It symbolizes the city's rich past and its evolution over time. The station's architecture, combining modern and classical elements, reflects the city's diverse cultural influences.

For travelers, the Railway Station is not just a transportation hub but also a site of historical interest. It offers an opportunity to appreciate Thessaloniki's layered history while providing access to various destinations. As a first-time visitor, exploring this landmark can enhance your understanding of the city's heritage and its role in connecting different cultures. The station's location near the harbor also makes it an ideal starting point for sightseeing, allowing you to easily navigate the city's attractions and immerse yourself in the local culture.","The Railway Station in Thessaloniki, located on Monastiriou Street (renamed Egnatia Street), began construction in 1939 and became fully operational in 1951. It serves as a significant transportation hub in the city, symbolized by the old steam engine that fronts the station, reflecting its historical importance in facilitating travel and commerce.",0.0,0.54,1.0,0.7986529763880779,0.99999999995,0.0,0.0,0.14285714265306124,,0.9399803811517655
39,What is the historical significance of the Railway Station in Thessaloniki and its transportation role?,"['59\n7th walk: \nWEST OF THE CENTRE-STAVROUPOLI\ninaugurated in 1962 (S. Molfesis, \nTh. Papagiannis). Its exterior \nside combines modern and \nclassical elements with wings \nadded on the sides. It connects \nThessaloniki with the rest of \nGreece, the Balkans and Istanbul; \nit is also the bus terminus \ntowards most of the city areas. \nThis will be the location of the \nwest metro line terminus under \nconstruction in Thessaloniki.\n2.2  Old Railway Station.\nIt was built in 1894 near the \nharbour (Old Station Street) \nin the neoclassical style, \nand it gradually connected \nThessaloniki with Skopje, \nBelgrade, Monastir and \nConstantinople (modern-day \nIstanbul). Today it is exclusively \nused as a cargo train station. \nThis is where the German \noccupation forces mustered \nabout 50,000 Jewish residents, \nfrom March until August 1943, \nin order to send them by train \noff to concentration camps.\n2.3  Top Hane (Vardariou \nTower).\nSituated where the west \nand seafront city walls used \nto meet, this Tower was built \nby the Ottomans in 1546 and \nit was known as the Armoury \nTower. It is a six-sided, three-\nstorey and 10-metre high tower \nwhich used to be the main city \nstronghold.', 'ARC\nAG\nDIMIT\nTERPSITHEA\nSQ.\nRAILWAY STATION\nSQ.\nOLD RAILWAY\nSTATION SQ.\nGALANOPOULOU\nSQ.\nSYKIES\nNEAPOLI\nAMPELOKIPOI\nMENEMENI\nMAKEDONOMACHON\nSQ.\nKARAOLI-DIMITRIOU SQ.\nELEFTHERIAS\nSQ.\nDROPOTAMOS\n7th walk: \nWEST OF THE CENTRE-STAVROUPOLI\n2\n3\n1\n4\n3.2\n2.2\n2.1\n4.1\n4.2\n4.3\n4.3\n4.4\n2.3\n2.4\n2.5\n2.8\n2.7 2.6\n3.1\n3.3\n1 \t\x07DIMOKRATIAS SQUARE \n(VARDARI)\nSince ancient times, this  \nhas been the most important \nentry point to Thessaloniki. \nThis relatively disadvantaged \narea is a transportation hub \nconnecting the west and \nnorthwest suburbs with the \ncity centre; there are also \nseveral hotels, small shops, \ntavernas and cafés in the \narea. In the centre of the \nsquare you will see the statue \nof King Constantine (1868-\n1923), who entered the \ncity in 1912 in his capacity \nas commander-in-chief of \nthe Greek Army. The road \ndistances (in km) where \nThessaloniki is the starting \npoint get calculated from  \nthis square.']","['<1-hop>\n\nMUST SEE: 2.1 Railway Station. It is on Monastiriou Street which is renamed at some point Egnatia Street (see p. 34). Construction began in 1939 and it became fully operational in 1951, but it was officially 66. Vardariou Tower (Top Hane). 67. Old steam engine fronting Thessaloniki’s Railway Station.']","The Old Railway Station in Thessaloniki, built in 1894, holds significant historical and transportation value. Located near the harbor on Old Station Street, it was constructed in the neoclassical style and served as a crucial link connecting Thessaloniki with key cities in the Balkans, including Skopje, Belgrade, Monastir, and Constantinople (modern-day Istanbul). This connectivity facilitated trade, travel, and cultural exchange in the region, making it an essential hub during its operational years.

During World War II, the station gained notoriety for its tragic role in the deportation of approximately 50,000 Jewish residents by German occupation forces from March to August 1943. They were gathered at the station before being transported to concentration camps, marking a dark chapter in the city's history. This historical context adds depth to the station's significance, as it stands as a reminder of the past and the impact of war on communities.

In terms of transportation, the Old Railway Station was pivotal in establishing Thessaloniki as a central transit point in the Balkans. It facilitated the movement of goods and people, contributing to the city's economic development. Although it is now exclusively a cargo train station, its legacy as a transportation hub remains vital to understanding Thessaloniki's historical infrastructure.

For a first-time visitor, exploring the Old Railway Station offers a glimpse into the city's rich history and its evolution over time. The station's architectural features and its surrounding area provide opportunities for sightseeing and photography, making it an Instagrammable spot that reflects both the beauty and complexity of Thessaloniki's past.","The Railway Station in Thessaloniki, located on Monastiriou Street (renamed Egnatia Street), began construction in 1939 and became fully operational in 1951. It serves as a significant transportation hub in the city, reflecting the development of railway infrastructure in the region.",0.0,0.0,0.7333333333333333,0.7689610928128211,0.99999999995,0.0,0.0,0.12499999984374999,,0.8994712245193345
40,What is the historical significance of the Railway Station in Thessaloniki and its location?,"['59\n7th walk: \nWEST OF THE CENTRE-STAVROUPOLI\ninaugurated in 1962 (S. Molfesis, \nTh. Papagiannis). Its exterior \nside combines modern and \nclassical elements with wings \nadded on the sides. It connects \nThessaloniki with the rest of \nGreece, the Balkans and Istanbul; \nit is also the bus terminus \ntowards most of the city areas. \nThis will be the location of the \nwest metro line terminus under \nconstruction in Thessaloniki.\n2.2  Old Railway Station.\nIt was built in 1894 near the \nharbour (Old Station Street) \nin the neoclassical style, \nand it gradually connected \nThessaloniki with Skopje, \nBelgrade, Monastir and \nConstantinople (modern-day \nIstanbul). Today it is exclusively \nused as a cargo train station. \nThis is where the German \noccupation forces mustered \nabout 50,000 Jewish residents, \nfrom March until August 1943, \nin order to send them by train \noff to concentration camps.\n2.3  Top Hane (Vardariou \nTower).\nSituated where the west \nand seafront city walls used \nto meet, this Tower was built \nby the Ottomans in 1546 and \nit was known as the Armoury \nTower. It is a six-sided, three-\nstorey and 10-metre high tower \nwhich used to be the main city \nstronghold.', 'The road \ndistances (in km) where \nThessaloniki is the starting \npoint get calculated from  \nthis square.\n2 \t\n\x07AROUND DIMOKRATIAS \nSQUARE\nThere are mostly faceless \nbuildings in the area – \namong them you will find \nsmall manufactures or old \nindustries. However there are \nalso historic sites, as there \nare sections of the city’s west \nwalls here, Byzantine and \nottoman monuments and other \narchaeological sites (temple  \nof Aphrodite, 6th c. BC).\nMUST SEE:\n2.1  Railway Station.\nIt is on Monastiriou Street \nwhich is renamed at some \npoint Egnatia Street (see p. 34). \nConstruction began in 1939 \nand it became fully operational \nin 1951, but it was officially \n66.  \nVardariou \nTower (Top \nHane).\n67.  \nOld steam \nengine \nfronting \nThessaloniki’s \nRailway \nStation.']","['<1-hop>\n\nMUST SEE: 2.1 Railway Station. It is on Monastiriou Street which is renamed at some point Egnatia Street (see p. 34). Construction began in 1939 and it became fully operational in 1951, but it was officially 66. Vardariou Tower (Top Hane). 67. Old steam engine fronting Thessaloniki’s Railway Station.']","The Railway Station in Thessaloniki, located on Monastiriou Street, holds significant historical importance as a key transportation hub that has shaped the city’s connectivity since its construction began in 1939 and its completion in 1951. This station was pivotal in linking Thessaloniki with other major cities in the Balkans, including Skopje, Belgrade, and Istanbul (formerly Constantinople), facilitating trade and travel throughout the region.

Architecturally, the station is a representation of the neoclassical style, which reflects the historical and cultural influences of the time. Its strategic location near the harbor made it an essential point for both passenger and cargo transport, contributing to the economic development of Thessaloniki.

Moreover, the Railway Station is a site of poignant historical memory. During World War II, it served as a gathering point for approximately 50,000 Jewish residents who were deported by German occupation forces to concentration camps between March and August 1943. This dark chapter in history adds a layer of significance to the station, making it not only a transportation hub but also a memorial to the lives affected by the Holocaust.

Today, while the station primarily functions as a cargo facility, its historical context and architectural features make it a noteworthy site for visitors interested in the rich tapestry of Thessaloniki's past. The surrounding area, which includes remnants of the city’s west walls and other historical monuments, offers a glimpse into the city’s diverse heritage, making it an ideal spot for sightseeing and exploration. For a first-time visitor, the Railway Station and its vicinity provide an opportunity to engage with both the historical and cultural narratives of Thessaloniki, enriching the travel experience.","The Railway Station in Thessaloniki, located on Monastiriou Street (renamed Egnatia Street), has historical significance as its construction began in 1939 and it became fully operational in 1951. Additionally, it features the Old steam engine fronting the station, which adds to its historical charm.",1.0,0.44,0.8333333333333334,0.8054584914382442,0.99999999995,0.49999999995,0.0,0.8571428559183674,,0.969329565523226
41,What cultural heritage does the UNESCO World Heritage site of Byzantine monuments in Thessaloniki represent?,"['10\n1st walk: \nUNESCO BYZANTINE MONUMENTS\nThessaloniki has been  \none of the first towns to \nknow the Christian religion by \nthe Apostle Paul; during the \nByzantine period it used to be \nthe second most important \ncity of the empire (co-reigning \ncity) after Constantinople. \nAt that time (4th – 15th c.), \nChristian monuments and \nchurches were constructed in \nthe town, and these make up \na diachronic typology with a \ndecisive influence on the entire \nByzantine world. The following \nearly-Christian and Byzantine \nmonuments of the town are \nconsidered to be excellent \nspecimens of the Byzantine \nchurch-building and art, and \nfor this reason UNESCO \ndeclared them to be World \nHeritage Monuments, in 1988. \nA tour across this unique \nopen-air Byzantine museum  \nis truly a special experience.\n1 \t\x07HOLY TWELVE  \nAPOSTLES CHURCH\nOne of the town’s oldest \nchurches was built in 1310 – \n1314 under the sponsorship  \nof Patriarch Nephon I. It used \nto be a katholicon [main church] \nof a monastery dedicated to \nTheotokos [Mother of God] as \nshown by the mural depicting \nTheotokos and the Founder, \nas well as by the iconography \non the aisle with images of \nthe Holy Virgin’s life.', '11\n1st walk: \nUNESCO BYZANTINE MONUMENTS\nportal to the southwest and \nthe cistern to the northwest. \nIt is a complex tetrastyle \ncross-in-square church with \na narthex and a peristyle on \nthe three sides and extremely \nsymmetrical proportions. \nWhen it was converted into \na mosque, during the Turkish \nrule, the murals and mosaics – \noutstanding specimens  \nof Palaeologan art dating  \nto the 14th c. – were covered  \nby plaster and a minaret was \nadded to the southwestern side.\n2 \t\n\x07PANAGIA CHALKEON \nCHURCH\nIt is located on the SW side \nof Dikastirion Sq. [Law Courts \nSq.]. It was built in 1128 on \nthe site of an ancient temple \nof Hephaestus or Kaveiros.  \nIt is a representative specimen \nof the architecture of the \n“School of Constantinople” and \nwas thus named because of \nthe area it was built on, known \nas the district of coppersmiths \n(masters of copper – chalkos). \nThe most prominent feature \nis the level above the narthex. \nIn 1430 it was converted into \na mosque and was named \nKazancilar Camii.\n3 \t\x07\nACHEIROPOIITOS \nCHURCH\nIt was founded in the second \nhalf of the 5th c. on the site \nof the roman public baths \nand it was dedicated to \nPanagia (Virgin Mary).']","[""<1-hop>\n\nUNESCO BYZANTINE MONUMENTS Thessaloniki has been one of the first towns to know the Christian religion by the Apostle Paul; during the Byzantine period it used to be the second most important city of the empire (co-reigning city) after Constantinople. At that time (4th – 15th c.), Christian monuments and churches were constructed in the town, and these make up a diachronic typology with a decisive influence on the entire Byzantine world. The following early-Christian and Byzantine monuments of the town are considered to be excellent specimens of the Byzantine church-building and art, and for this reason UNESCO declared them to be World Heritage Monuments, in 1988. A tour across this unique open-air Byzantine museum is truly a special experience. 1 \x07HOLY TWELVE APOSTLES CHURCH One of the town’s oldest churches was built in 1310 – 1314 under the sponsorship of Patriarch Nephon I. It used to be a katholicon [main church] of a monastery dedicated to Theotokos [Mother of God] as shown by the mural depicting Theotokos and the Founder, as well as by the iconography on the aisle with images of the Holy Virgin’s life. Out of the original monastery complex, -apart from the katholicon – there remain the NIKIS NIKIS GERMANOU SVOLOU IASONIDOU TSIMISKI VAS. IRAKLEIOU FILIPPOU AKROPOLEOS THEOTOKOPOULOU AKROPOLEOS OCHI AVENUE EPTAPYRGIOU SOFOKLEOUS OLYMPOU MONASTIRIOU KAZANTZAKI A N A G E NN I S E OS DAMONOS KALOU DRAGOUMANOU POLYTECHNIOU MITROPOLEOS ARISTOTELOUS DODEKANISOU LANGADA SALAMINOS ERMOU ANGELAKI ETHNIKIS AMYNAS AG. ANTONIOS AGIA THEODORA AG. ATHANASIOS AG. KONSTANTINOU YPAPANTI AGIOS STYLIANOS LAODI GITRIA TAXIARCHES AGIOS PAVLOS FANEROMENI AG. THEODOROI KALARI TSOPELA ISAVRON DELIOU IOANNI VELLIDI MAKRYGIANNI MITR. GENADIOU MODI PETROPOULAKIDON ARIANOU ARIANOU KLEISTHENOUS VIZYINOU KASTRON PANORMOU KES AMPATZOGLOU SKOPELOU PETRAS VASILIKO IRAKLEIAS SK SK KAVAFI ADRIANOUPOLEOS AIANT AGATHOUPOLEOS NG ROAD REDAISTO VYZOUKIDI VIZYINO THETIDOS AFXENTIOU MOUDANION PANEPISTIMIOU KALELPIDOS KONSTANTINOUPOLEOS SMYRNIS PYRGOU VRYANDOU KITROUS MELENIKOU PATR. IOAKEIM PALAION PATRON GERMANOU MICHAIL IO. ARMENOPOULOU IKTINOU KOMNINON SOLOMOU VLALI BALANOU ASKITOU VOGATSIKOU PLOUTARCHOU LASSANI MORKENTAOU TATI DRAGOUMI KYRIAKOU IOULIANOU SOKRATOUS EVRIPIDOU GYZI VLACHAVA AISCHYLOU ATHINAS MOREAS GKRATZIOU ATHONOS THEOFILOU PILEOS ANTIOCHOU VLATADON KASTOROS IGOUMENOU PERIANDROU POLYDOROU KLAFTHMONOS DRAGATSANIOU ACHTARI KARADIMOU DIONYSIOU EPIMENIDOU EVRYMEDONTOS AREOS ARTIS IRAKLIOU SYRAKOUSON PYDNAS KARAVANGELI TSAKALOF KIMONOS FLORINAS PLASTIRA FILIPPOU KLISTHENOUS FERON EVROU GKRATZIOU RAKTIVAN LAMPOUSIDI PASTER MAK KAMENIATOU PROFITI ILIA ATHINAS IFIKRATOUS PRASAKAKI STAVROU DIMOSTHENOUS KASTRITSIOU MENELAOU AMYNTA PELOPONNISOU PLATONOS DELMOUZOU AVDELA OUGKO KARATASOU KOUNTOURIOTI MIONIS CH. IATROU PAPANASTASIOU KLEISOURAS LAMPRAKI OLYMPIOU FEIDIOU FINTIA DAIDALOU VOULGAR THASO FREIDERIK NIKITARA IATRIDON THYRON KOZANIS KILKIS PONTOU NAFPLIOU VALTETSIOU KALPAKIOU LORDOU ELEFSINAS DELTA KONITSIS PLATONOS IPPOKRATOUS AGIOU DIMITRIOU VERMIOU SOUFLIOU BIZANIOU LECHO VOREIOU IPEIROU ARAP BOUBOUL KANARI KA AKI SOLOMOU LACHANA AGRAFON PSARON MIAOULI KAVALAS KRITIS LEVENTI KANARI GRAVIAS KYPROU FILIATRON ARACHTHOU TSACHILA AGRAFON KARVOUNIDI ERASMOU ELENIS KAPETAN NIKOLAOU PELOPONNISOU AGIOU PAVLOU MAKEDONOMACHON KONITSIS IKARON EL. VENIZELOU OMIROU IPEIROU KONTOSOGLOU PAPANIKOLI TEPELENIOU MEGARON VITSI KASTORIAS ARGYROKASTROU DIMITRIOU THASSOU FOKA PAPAFLESSA KOMNINON KONDYLI PANGKALOU KRITIS KRITIS EPIDAVROU LAMPRAKI CHORTIATI ELLIS ELPIDOS MAVROKORDATOU EPTAPYRGIOU EPTAPYRGIOU EPTAPYRGIOU EPTAPYRGIOU ANTHEON ATHANASIOU DIAKOU YPATROU GIALOUROU OU DODEKANISOU VAS. KONSTANTINOU MARKOU BOTSARI ANATOLIKIS ROMYLIAS U OI M R E V RIOU OPOS AISTOU DERMETZI APOLLONIADOS TYROLOIS BOROU PRIAMOU VORONOF OREIOU IPEIROU LATOMEION KATSONI ZALONGOU PAPANASTASIOU KAFKASOU METEORON KASSANDROU OLYMPIADOS A L. P A P A D O P O U L OU KASSANDROU OLYMPIADOS OLYMPOU POLYZOIDI AGIOU DIMITRIOU AGIOU DIMITRIOU AVRILIANIS ARKADIOUPOLEOS IFAISTIONOS ELPIDOS EL. VE NI ZE L O U NAVARINOU TYRNAVOU KOLOKOTRONI ARISTARCHOU KARAOLI PAPAGOU KASTAMONIS KARAVANGELI MATROZOU EVDOKIOU KESANIS KALLIKRATIAS VOULGAROKTONOU THEMISTOKLEOUS A R O G A X A N A KYPROU 28 OKTOVRIOU M. ASIAS ELLISPONTOU IT OIR U O T N U O K PARASKEVA NIGDIS ARAVYSSOU ALEXIOU TRANOU MOUSCHOUNTI KALAMPAKAS ROUZVELT ONOS SIOU OUMAN THOUKYDIDI ZARIFI SACHTOURI AKRITA KLIOS PERSEOS PYTHEOS RAKTIVAN ODYSSEOS SARAFI ETHN. ANTISTASEOS U O TIR K O M ID PARASKEVA PANIDOU OINOIS KARAOLI OLYMPOU ROMANIDI ARISTEIDOU SOULINI KRITIS DEXAMENI DIOS KALVOU EIRINIS PAPARIGOPOULOU PALAMA ZEFYRON MAVILI PINIOU GLADSTONOS THALIAS PRONOIAS SACHINI KRATEROU FILOTA SOURI ANTON SOUTSOU SYNGROU PTOLEMAION IOUSTINIANOU KARBOLA TOSITSA ZALIKI CHALKEON AMVROSIOU KRYSTALI ANTIGONIDON S T O U R N A R A MAKEDON O MACHON ELLISPONTOU LEFKOSIAS THER M OPYLON RIG A FE RAI O U KAFKASOU PANAGIAS FANEROMENIS EOS KAVAKION KORYDALLOU HMOU VOUTYRA YRILLOU PATR. FINTIA SANTAROZA SAPFOUS KARIOFYLLI AVEROF PANGAIOU AXIOU VAIOU PINDOU DOXIS VOTSI KALAPOTHAKI KATOUNI AIGYPTOU FRANGON DANAIDON AISOPOU ENOTIKON AFRODITIS NTEKA PAPATHANASIOU PAPADIMA GALANAKI IVANOF KAPATOU GDON HOUNTI CHATZITSIROU VAKCHOU STEFANAKI FARMAKI ODYSSEOS ODYSSEOS TANTALOU PROMITHEOS SAPFOUS NAVM. CHAPSA LIMNOU VALAORITI ORPHANIDI TANTALIDI OLYMPIOU DIAMANTI LOUI IPPODROMIOU NIKIFOROU DESPERE GOUNARI DIALETI DANGLI FILIKIS ETAIRIAS CHR. SMYRNIS MITR. IOSIF FOKA PANAGIA KARATZA KREMASTIS POLIORKITI SYNGROU VYRONOS AGIOS DIMITRIOS RIGA FERAIOU A R C H A I O T I T O N S E L E F K I D O N M E L E N I K O U PROX. KOROMILA PARASCHOU EPTAPYRGIO ANO POLI 40 EKKLISIES EVANGELISTRIA RIGAS FERAIOS KALLITHEA AXIOS MUNICIPAL PARK RODOCHORI EVANGELISTRIA'S CEMETERY KOLOKOTRONI TYROLOI VARNAS SQ. MOUSHOUNTI SQ. FANARIOTON SQ. ELEFTHERIAS SQ. EMPORIOU SQ. DIMOKRATIAS VARDARI SQ. KYPRION AGONISTON SQ. ARCHAIAS AG. SOFIAS AGORAS SQ. DIMITRION SQ. TERPSITHEA SQ. ROMFEI SQ. RAILWAY STATION SQ. RAILWAY ATION SQ. GALANOPOULOU SQ. SYNTRIVANIOU SQ. NAVARINOU SQ. SQ. SYKIES EAPOLI CHNI ZIDROU SQ. LYSSIATREIO AGIOS DIMITRIOS HOSPITAL GENERAL HOSPITAL OF THESSALONIKI G. GENNIMATAS U G O A 1 2 3 4 5 7 6 8 9 12 15 15 15 15 13 14 10 11 2. Southern view of Panagia Chalkeon Church. 3. Agia Sofia Church surrounded by a small garden.""]","The UNESCO World Heritage site of Byzantine monuments in Thessaloniki represents a rich tapestry of early Christian and Byzantine heritage, showcasing the city's historical significance as a major center of Christianity and culture from the 4th to the 15th centuries. This collection of monuments reflects the architectural and artistic achievements of the Byzantine Empire, particularly in church-building and religious art.

Thessaloniki was one of the first cities to embrace Christianity, influenced by the Apostle Paul, and it became the second most important city in the Byzantine Empire after Constantinople. The monuments include remarkable examples of Byzantine architecture, such as the Holy Twelve Apostles Church, built between 1310 and 1314, which features exquisite murals and iconography dedicated to the Virgin Mary. This church exemplifies the city's ecclesiastical heritage and the artistic styles of the period.

Another significant site is the Panagia Chalkeon Church, constructed in 1128 on the site of an ancient temple. It represents the architectural style of the “School of Constantinople” and highlights the city's historical connection to craftsmanship, particularly in copperwork. The church's conversion into a mosque during the Ottoman period further illustrates the layered history of Thessaloniki and its cultural transformations.

The Acheiropoitos Church, founded in the 5th century, is another key monument, built on the remnants of Roman public baths and dedicated to the Virgin Mary. These sites collectively serve as an open-air museum, offering visitors a unique opportunity to explore the artistic and religious legacy of the Byzantine era.

Overall, the UNESCO World Heritage site in Thessaloniki is a testament to the city's pivotal role in the Byzantine world, showcasing its architectural grandeur and the enduring influence of its Christian heritage. Exploring these monuments provides a profound insight into the cultural and historical narrative of Thessaloniki.","The UNESCO World Heritage site of Byzantine monuments in Thessaloniki represents a significant aspect of cultural heritage, showcasing early-Christian and Byzantine monuments that were constructed during the Byzantine period (4th – 15th century). These monuments reflect the city's historical importance as a center of Christianity and its architectural achievements, influencing the entire Byzantine world.",1.0,0.48,1.0,0.8702647536512871,0.99999999995,0.99999999995,0.0,0.12499999984374999,,0.9159307359924304
42,"Whaht is the hstory of the Railway Station on Monastiriou Street, and how does it relate to transportation in Thessaloniki?","['The road \ndistances (in km) where \nThessaloniki is the starting \npoint get calculated from  \nthis square.\n2 \t\n\x07AROUND DIMOKRATIAS \nSQUARE\nThere are mostly faceless \nbuildings in the area – \namong them you will find \nsmall manufactures or old \nindustries. However there are \nalso historic sites, as there \nare sections of the city’s west \nwalls here, Byzantine and \nottoman monuments and other \narchaeological sites (temple  \nof Aphrodite, 6th c. BC).\nMUST SEE:\n2.1  Railway Station.\nIt is on Monastiriou Street \nwhich is renamed at some \npoint Egnatia Street (see p. 34). \nConstruction began in 1939 \nand it became fully operational \nin 1951, but it was officially \n66.  \nVardariou \nTower (Top \nHane).\n67.  \nOld steam \nengine \nfronting \nThessaloniki’s \nRailway \nStation.', '106\nPassenger Railway Station.\n28, Monastiriou St, information \non domestic and international \ntimetables: \ntel.: 14511 \nwebsite: www.ose.gr\nThessaloniki Central Port \nAuthority (at the harbour). \nFor info on passenger ship \ntimetables,  \ntel.: 2313 325.821-4\nStavros Port Station: \ntel.: 23970 61.280\nIntercity bus service \n(K.T.E.L.).\nThere is a coach service to \nregional areas beyond the city \nlimits, and to most areas of \ncontinental Greece as well as \nthe islands of Corfu, Zante and \nCrete; buses leave from the \nMacedonia Intercity Bus Station, \nat 244, Giannitson St. (5 km W \nof the centre) \ntel.: 2310 595.400 \nwebsite: www.ktelmacedonia.gr\nTaxi Service.\nTaxis carry taximeters which \ncalculate the fare that must be \npaid and the driver must turn \nthe meter on as soon as the \npassenger is picked up. Fare 1 \nis on from 05.00-24.00; it is \nchanged to Fare 2 from 24.00 \nto 05.00. Every taxi driver \nmust have the updated charge \nrates on display as well as any \nadditional charges.  \nRadio Taxi:  \n«Taxiway» (tel.: 18300), \n«Mercedes» (tel.: 18180), \n«Macedonia» (tel.']","['<1-hop>\n\nMUST SEE: 2.1 Railway Station. It is on Monastiriou Street which is renamed at some point Egnatia Street (see p. 34). Construction began in 1939 and it became fully operational in 1951, but it was officially 66. Vardariou Tower (Top Hane). 67. Old steam engine fronting Thessaloniki’s Railway Station.']","The Railway Station on Monastiriou Street in Thessaloniki has a significant history that reflects the city's development and its role in transportation. Construction of the station began in 1939, and it became fully operational in 1951. This timeline indicates that the station was built during a period of modernization in Greece, following the disruptions of World War II. The station serves as a crucial hub for both domestic and international rail services, connecting Thessaloniki to various regions across Greece and beyond.

Monastiriou Street, where the station is located, is a vital artery in the city, which later transitions into Egnatia Street, another major thoroughfare. This connection highlights the importance of the railway station in facilitating travel and commerce within Thessaloniki and its surroundings. The station not only provides access to the railway network but also enhances the overall transportation infrastructure of the city, making it easier for residents and visitors alike to navigate.

For a first-time visitor, the Railway Station is an essential landmark, offering insights into the city's historical and cultural evolution. It stands near other significant sites, including sections of the city's west walls and various Byzantine and Ottoman monuments, making it a convenient starting point for sightseeing. The station's historical significance, combined with its operational role in modern transportation, makes it a noteworthy destination for those interested in exploring Thessaloniki's rich heritage.

In summary, the Railway Station on Monastiriou Street is not only a functional transportation hub but also a historical landmark that reflects Thessaloniki's growth and connectivity. Its strategic location and historical context make it an integral part of the city's transportation landscape, appealing to travelers seeking to immerse themselves in local culture and history.","The Railway Station on Monastiriou Street, which was later renamed Egnatia Street, began construction in 1939 and became fully operational in 1951. It plays a significant role in transportation in Thessaloniki, serving as a key hub for travelers and connecting various modes of transport. Additionally, the old steam engine located in front of the station highlights the historical significance of railway transportation in the city.",1.0,0.49,0.43902439024390244,0.8800516834851105,0.99999999995,0.9999999999,0.0,0.8571428559183674,,0.869303122698283
43,"What historical significance does Egnatia Street have in Thessaloniki, and how is it connected to the Railway Station?","['The road \ndistances (in km) where \nThessaloniki is the starting \npoint get calculated from  \nthis square.\n2 \t\n\x07AROUND DIMOKRATIAS \nSQUARE\nThere are mostly faceless \nbuildings in the area – \namong them you will find \nsmall manufactures or old \nindustries. However there are \nalso historic sites, as there \nare sections of the city’s west \nwalls here, Byzantine and \nottoman monuments and other \narchaeological sites (temple  \nof Aphrodite, 6th c. BC).\nMUST SEE:\n2.1  Railway Station.\nIt is on Monastiriou Street \nwhich is renamed at some \npoint Egnatia Street (see p. 34). \nConstruction began in 1939 \nand it became fully operational \nin 1951, but it was officially \n66.  \nVardariou \nTower (Top \nHane).\n67.  \nOld steam \nengine \nfronting \nThessaloniki’s \nRailway \nStation.', '34\n1 \tEGNATIA STREET\nThis central avenue has \nbeen there practically since \nThessaloniki’s founding,  \nas it is a section of the road \nconstructed by the Romans  \nin the 2nd c. BC, and connected \nDyrrhachium (Durrës, in \nmodern day Albania) with \nConstantinople. It starts at \nDimokratia square (see p. 58) \nand ends at the TIF grounds \n(see p. 31) and the Aristotle \nUniversity of Thessaloniki, \nsplitting in two the town’s \nhistoric centre. It is a busy \nshopping area with numerous \nremarkable buildings of \neclectic and art deco style \ndating to the early 20th c. \n(mostly old hotels) that are \nabsolutely worth observing,  \nas well as some of the city’s \nmost important monuments.\nMUST SEE:\n1.1  Kolomvou Square.\nThe crossroads where \nEgnatia Street meets \nAntigonidon Street is indeed \na bustling one! It was named \nafter G. Colombo, an Italian \nwho opened a hotel there  \nin the early 20th century. This \nis the location of Kolomvou \nArchway (31, Egnatia St.) \nwhich has become a leisure \nhub with cafés, bars and \nrestaurants inside.\n1.2  Hamza Bey Mosque.\nIt was built in 1467 by the \ndaughter of Hamza Bey, the \nmilitary commander of Sultan \nMurad II.']","['<1-hop>\n\n34 1 EGNATIA STREET This central avenue has been there practically since Thessaloniki’s founding, as it is a section of the road constructed by the Romans in the 2nd c. BC, and connected Dyrrhachium (Durrës, in modern day Albania) with Constantinople. It starts at Dimokratia square (see p. 58) and ends at the TIF grounds (see p. 31) and the Aristotle University of Thessaloniki, splitting in two the town’s historic centre. It is a busy shopping area with numerous remarkable buildings of eclectic and art deco style dating to the early 20th c. (mostly old hotels) that are absolutely worth observing, as well as some of the city’s most important monuments. MUST SEE: 1.1 Kolomvou Square. The crossroads where Egnatia Street meets Antigonidon Street is indeed a bustling one! It was named after G. Colombo, an Italian who opened a hotel there in the early 20th century. This is the location of Kolomvou Archway (31, Egnatia St.) which has become a leisure hub with cafés, bars and restaurants inside. 1.2 Hamza Bey Mosque. It was built in 1467 by the daughter of Hamza Bey, the military commander of Sultan Murad II. It is the only mosque in Greece with a peristyle (a colonnaded yard). For many decades it housed a cinema named Alkazar. Currently there are renovation works under way. Once they are finished, it will house an exhibition of finds unearthed during the metro excavations. Right behind it you will see the City Manor which housed the Town Hall until recently. It is known at Karavan Serai as there used to be an ottoman inn here. (early 16th c.). 4th walk:', '<2-hop>\n\nMUST SEE: 2.1 Railway Station. It is on Monastiriou Street which is renamed at some point Egnatia Street (see p. 34). Construction began in 1939 and it became fully operational in 1951, but it was officially 66. Vardariou Tower (Top Hane). 67. Old steam engine fronting Thessaloniki’s Railway Station.']","Egnatia Street holds considerable historical significance in Thessaloniki as it has been a vital thoroughfare since the city’s founding. Originally constructed by the Romans in the 2nd century BC, it served as a crucial connection between Dyrrhachium (modern-day Durrës in Albania) and Constantinople. This ancient route facilitated trade and movement, making it an essential artery for the region.

Today, Egnatia Street remains a central avenue in Thessaloniki, effectively splitting the historic center of the city. It is characterized by a vibrant atmosphere, bustling with shops, cafés, and significant architectural landmarks, particularly from the early 20th century. The street is not only a commercial hub but also a showcase of eclectic and art deco styles, making it an attractive spot for sightseeing.

The Railway Station, located on Monastiriou Street, is closely linked to Egnatia Street. Monastiriou Street transitions into Egnatia Street, creating a seamless connection between the two. The Railway Station itself, which began construction in 1939 and became fully operational in 1951, serves as a key transportation hub for travelers arriving in Thessaloniki. Its proximity to Egnatia Street enhances accessibility for visitors, allowing easy exploration of the city’s attractions.

For a first-time visitor, Egnatia Street offers a blend of historical significance and modern vibrancy, making it an ideal location for sightseeing. The street's rich history, combined with its lively atmosphere, provides numerous opportunities for capturing Instagrammable moments while immersing oneself in the local culture. The nearby Railway Station further facilitates travel, ensuring that exploring Thessaloniki’s historical sites is both convenient and enjoyable.","Egnatia Street is a central avenue in Thessaloniki that has been present since the city's founding, originally constructed by the Romans in the 2nd century BC to connect Dyrrhachium with Constantinople. It is a bustling shopping area featuring important monuments and eclectic architecture. The Railway Station, located on Monastiriou Street, was renamed Egnatia Street at some point. Construction of the station began in 1939, and it became fully operational in 1951, highlighting the historical evolution of the area as a transportation hub.",1.0,0.62,0.6206896551724138,0.895266839233911,0.99999999995,0.99999999995,0.5,0.7999999992,,0.8364067286593029
44,What is Egnatia Street and what important places in Thessaloniki can be found there?,"['34\n1 \tEGNATIA STREET\nThis central avenue has \nbeen there practically since \nThessaloniki’s founding,  \nas it is a section of the road \nconstructed by the Romans  \nin the 2nd c. BC, and connected \nDyrrhachium (Durrës, in \nmodern day Albania) with \nConstantinople. It starts at \nDimokratia square (see p. 58) \nand ends at the TIF grounds \n(see p. 31) and the Aristotle \nUniversity of Thessaloniki, \nsplitting in two the town’s \nhistoric centre. It is a busy \nshopping area with numerous \nremarkable buildings of \neclectic and art deco style \ndating to the early 20th c. \n(mostly old hotels) that are \nabsolutely worth observing,  \nas well as some of the city’s \nmost important monuments.\nMUST SEE:\n1.1  Kolomvou Square.\nThe crossroads where \nEgnatia Street meets \nAntigonidon Street is indeed \na bustling one! It was named \nafter G. Colombo, an Italian \nwho opened a hotel there  \nin the early 20th century. This \nis the location of Kolomvou \nArchway (31, Egnatia St.) \nwhich has become a leisure \nhub with cafés, bars and \nrestaurants inside.\n1.2  Hamza Bey Mosque.\nIt was built in 1467 by the \ndaughter of Hamza Bey, the \nmilitary commander of Sultan \nMurad II.', 'The monumental style of \narchitecture is shown in the \nbuildings’ facades, colonnades, \narcades and porticos, which \ncombine elements from the \ncity’s Byzantine tradition \nwith European interwar \nperiod motifs. The square is \nlandmarked by two identical \nconcave buildings: Electra \nPalace hotel (late sixties) - \nbuilt by GNTO architects -  \non the west side, and Olympion \non the east side, which was \nprogressively erected and \ncompleted by the late fifties \n(designed by J. Moshé) \nand is now the seat of the \nThessaloniki Film Festival  \n(see p. 108).\nMUST SEE:\n1.1  Aristotelous Street.\nPedestrianised historic \nboulevard, that ends in Egnatia \nStreet (see p. 34). According \nto the Hébrard plans, it would \n2nd walk: \nHISTORIC CENTRE (1) \nTRADITIONAL COMMERCIAL CENTRE\n4.1\n6.1\n6.3\n6.2\n6.5\n6.6\n6.7\n1.1\n1.2\n6.8\n7.5\n7.3\n7.2\n7.2\n7.1\n7.4\n6.4\n3.1\n1\n2\n3\n4\n5\n7']","['<1-hop>\n\n34 1 EGNATIA STREET This central avenue has been there practically since Thessaloniki’s founding, as it is a section of the road constructed by the Romans in the 2nd c. BC, and connected Dyrrhachium (Durrës, in modern day Albania) with Constantinople. It starts at Dimokratia square (see p. 58) and ends at the TIF grounds (see p. 31) and the Aristotle University of Thessaloniki, splitting in two the town’s historic centre. It is a busy shopping area with numerous remarkable buildings of eclectic and art deco style dating to the early 20th c. (mostly old hotels) that are absolutely worth observing, as well as some of the city’s most important monuments. MUST SEE: 1.1 Kolomvou Square. The crossroads where Egnatia Street meets Antigonidon Street is indeed a bustling one! It was named after G. Colombo, an Italian who opened a hotel there in the early 20th century. This is the location of Kolomvou Archway (31, Egnatia St.) which has become a leisure hub with cafés, bars and restaurants inside. 1.2 Hamza Bey Mosque. It was built in 1467 by the daughter of Hamza Bey, the military commander of Sultan Murad II. It is the only mosque in Greece with a peristyle (a colonnaded yard). For many decades it housed a cinema named Alkazar. Currently there are renovation works under way. Once they are finished, it will house an exhibition of finds unearthed during the metro excavations. Right behind it you will see the City Manor which housed the Town Hall until recently. It is known at Karavan Serai as there used to be an ottoman inn here. (early 16th c.). 4th walk:']","Egnatia Street is a central avenue in Thessaloniki that has historical significance, dating back to its construction by the Romans in the 2nd century BC. It served as a vital connection between Dyrrhachium (modern-day Durrës, Albania) and Constantinople. Today, Egnatia Street is a bustling thoroughfare that splits the historic center of Thessaloniki and is known for its vibrant shopping scene and remarkable architecture, featuring eclectic and art deco styles from the early 20th century.

As a first-time visitor, you’ll find several must-see locations along Egnatia Street:

1. **Kolomvou Square**: This lively crossroads where Egnatia meets Antigonidon Street is a great spot to experience local life. Named after an Italian hotelier, it features the Kolomvou Archway and is surrounded by cafés, bars, and restaurants, making it perfect for leisurely breaks and social media-worthy photos.

2. **Hamza Bey Mosque**: Built in 1467, this mosque is a significant historical site that reflects the city’s rich cultural heritage. It was commissioned by the daughter of Hamza Bey, a military commander, and is an excellent example of Ottoman architecture.

3. **Electra Palace Hotel**: Located on the west side of Aristotelous Square, this hotel showcases monumental architecture and is a landmark of the city. It’s a great place to admire the blend of Byzantine and European interwar styles.

4. **Olympion**: Situated on the east side of Aristotelous Square, this building is home to the Thessaloniki Film Festival and was designed by architect J. Moshé. Its historical and cultural significance makes it a noteworthy stop.

Exploring Egnatia Street offers a blend of history, culture, and modern-day vibrancy, making it an ideal location for sightseeing and capturing Instagrammable moments during your weekend visit.","Egnatia Street is a central avenue in Thessaloniki that has been present since the city's founding, originally constructed by the Romans in the 2nd century BC. It connects Dyrrhachium with Constantinople and is a busy shopping area featuring remarkable buildings of eclectic and art deco style from the early 20th century. Important places along Egnatia Street include Kolomvou Square, known for its bustling atmosphere and leisure spots, and the Hamza Bey Mosque, built in 1467, which is notable for its unique peristyle and ongoing renovation works.",0.75,0.64,1.0,0.8737064976459207,0.9999999999,0.9999999999,1.0,0.7999999992,,0.8694560760283311
45,"What is the historical significance of the Railway Station on Monastiriou Street, and how does its construction timeline relate to the development of transportation in Thessaloniki?","['The road \ndistances (in km) where \nThessaloniki is the starting \npoint get calculated from  \nthis square.\n2 \t\n\x07AROUND DIMOKRATIAS \nSQUARE\nThere are mostly faceless \nbuildings in the area – \namong them you will find \nsmall manufactures or old \nindustries. However there are \nalso historic sites, as there \nare sections of the city’s west \nwalls here, Byzantine and \nottoman monuments and other \narchaeological sites (temple  \nof Aphrodite, 6th c. BC).\nMUST SEE:\n2.1  Railway Station.\nIt is on Monastiriou Street \nwhich is renamed at some \npoint Egnatia Street (see p. 34). \nConstruction began in 1939 \nand it became fully operational \nin 1951, but it was officially \n66.  \nVardariou \nTower (Top \nHane).\n67.  \nOld steam \nengine \nfronting \nThessaloniki’s \nRailway \nStation.', '59\n7th walk: \nWEST OF THE CENTRE-STAVROUPOLI\ninaugurated in 1962 (S. Molfesis, \nTh. Papagiannis). Its exterior \nside combines modern and \nclassical elements with wings \nadded on the sides. It connects \nThessaloniki with the rest of \nGreece, the Balkans and Istanbul; \nit is also the bus terminus \ntowards most of the city areas. \nThis will be the location of the \nwest metro line terminus under \nconstruction in Thessaloniki.\n2.2  Old Railway Station.\nIt was built in 1894 near the \nharbour (Old Station Street) \nin the neoclassical style, \nand it gradually connected \nThessaloniki with Skopje, \nBelgrade, Monastir and \nConstantinople (modern-day \nIstanbul). Today it is exclusively \nused as a cargo train station. \nThis is where the German \noccupation forces mustered \nabout 50,000 Jewish residents, \nfrom March until August 1943, \nin order to send them by train \noff to concentration camps.\n2.3  Top Hane (Vardariou \nTower).\nSituated where the west \nand seafront city walls used \nto meet, this Tower was built \nby the Ottomans in 1546 and \nit was known as the Armoury \nTower. It is a six-sided, three-\nstorey and 10-metre high tower \nwhich used to be the main city \nstronghold.']","['<1-hop>\n\nMUST SEE: 2.1 Railway Station. It is on Monastiriou Street which is renamed at some point Egnatia Street (see p. 34). Construction began in 1939 and it became fully operational in 1951, but it was officially 66. Vardariou Tower (Top Hane). 67. Old steam engine fronting Thessaloniki’s Railway Station.']","The Railway Station on Monastiriou Street holds significant historical importance as a key transportation hub in Thessaloniki. Construction of the station began in 1939 and it became fully operational in 1951, marking a pivotal moment in the city's transportation development. This timeline reflects the broader context of post-war reconstruction and modernization in Greece, particularly in the wake of World War II.

Initially, the station was designed to connect Thessaloniki with various regions, including the rest of Greece, the Balkans, and Istanbul. This connectivity was crucial for trade, travel, and cultural exchange, facilitating the movement of people and goods across borders. The station's strategic location near the harbor further enhanced its role as a vital link in the transportation network.

The architectural design of the station, which combines modern and classical elements, symbolizes the blend of historical influences that characterize Thessaloniki. It serves not only as a functional space but also as a representation of the city's evolving identity during a time of significant change.

Moreover, the Old Railway Station, built in 1894, played a foundational role in establishing Thessaloniki as a regional transportation center. It connected the city to major destinations like Skopje, Belgrade, and Constantinople, laying the groundwork for future developments. The transition of the Old Railway Station to a cargo-only facility highlights the shift in transportation needs over time, as passenger services became centralized at the newer station.

In summary, the Railway Station on Monastiriou Street is historically significant as a symbol of Thessaloniki's transportation evolution, reflecting the city's resilience and adaptability in the face of historical challenges. Its construction timeline underscores the importance of connectivity in fostering economic and cultural ties, making it a noteworthy site for any visitor interested in the city's rich history.","The Railway Station on Monastiriou Street, which was renamed Egnatia Street, holds historical significance as a key transportation hub in Thessaloniki. Construction of the station began in 1939, and it became fully operational in 1951, marking an important development in the city's transportation infrastructure. The station's establishment coincided with a period of modernization in Thessaloniki, enhancing connectivity and facilitating travel, which was crucial for the city's growth and development.",0.6666666666666666,0.34,0.42857142857142855,0.8665710961540297,0.99999999995,0.9999999999,0.0,0.9999999983333333,,0.9201515012847198
46,"Whaht is the hstory of the Railway Station on Monastiriou Street, and how does it relate to transportation in Thessaloniki?","['The road \ndistances (in km) where \nThessaloniki is the starting \npoint get calculated from  \nthis square.\n2 \t\n\x07AROUND DIMOKRATIAS \nSQUARE\nThere are mostly faceless \nbuildings in the area – \namong them you will find \nsmall manufactures or old \nindustries. However there are \nalso historic sites, as there \nare sections of the city’s west \nwalls here, Byzantine and \nottoman monuments and other \narchaeological sites (temple  \nof Aphrodite, 6th c. BC).\nMUST SEE:\n2.1  Railway Station.\nIt is on Monastiriou Street \nwhich is renamed at some \npoint Egnatia Street (see p. 34). \nConstruction began in 1939 \nand it became fully operational \nin 1951, but it was officially \n66.  \nVardariou \nTower (Top \nHane).\n67.  \nOld steam \nengine \nfronting \nThessaloniki’s \nRailway \nStation.', '106\nPassenger Railway Station.\n28, Monastiriou St, information \non domestic and international \ntimetables: \ntel.: 14511 \nwebsite: www.ose.gr\nThessaloniki Central Port \nAuthority (at the harbour). \nFor info on passenger ship \ntimetables,  \ntel.: 2313 325.821-4\nStavros Port Station: \ntel.: 23970 61.280\nIntercity bus service \n(K.T.E.L.).\nThere is a coach service to \nregional areas beyond the city \nlimits, and to most areas of \ncontinental Greece as well as \nthe islands of Corfu, Zante and \nCrete; buses leave from the \nMacedonia Intercity Bus Station, \nat 244, Giannitson St. (5 km W \nof the centre) \ntel.: 2310 595.400 \nwebsite: www.ktelmacedonia.gr\nTaxi Service.\nTaxis carry taximeters which \ncalculate the fare that must be \npaid and the driver must turn \nthe meter on as soon as the \npassenger is picked up. Fare 1 \nis on from 05.00-24.00; it is \nchanged to Fare 2 from 24.00 \nto 05.00. Every taxi driver \nmust have the updated charge \nrates on display as well as any \nadditional charges.  \nRadio Taxi:  \n«Taxiway» (tel.: 18300), \n«Mercedes» (tel.: 18180), \n«Macedonia» (tel.']","['<1-hop>\n\nMUST SEE: 2.1 Railway Station. It is on Monastiriou Street which is renamed at some point Egnatia Street (see p. 34). Construction began in 1939 and it became fully operational in 1951, but it was officially 66. Vardariou Tower (Top Hane). 67. Old steam engine fronting Thessaloniki’s Railway Station.']","The Railway Station on Monastiriou Street in Thessaloniki has a rich history that reflects the city's development and its role as a transportation hub. Construction of the station began in 1939, but it was not fully operational until 1951. This delay was largely due to the disruptions caused by World War II. The station was officially inaugurated in a period when Thessaloniki was emerging from the war's aftermath, marking a significant step in revitalizing the city's infrastructure.

The station serves as a critical point for both domestic and international rail services, connecting Thessaloniki to various regions across Greece and neighboring countries. It plays a vital role in facilitating travel for locals and tourists alike, making it an essential part of the city's transportation network. The station's location on Monastiriou Street, which later transitions into Egnatia Street, places it at a strategic point for accessing other parts of the city.

In addition to its functional importance, the Railway Station is also a historical landmark. It showcases architectural elements from the mid-20th century and stands as a testament to the city's resilience and growth. The surrounding area, including sections of the city’s west walls and other historical sites, adds to the cultural significance of the station, making it a point of interest for visitors.

For a first-time visitor, the Railway Station not only provides practical transportation options but also offers a glimpse into Thessaloniki's history and urban landscape. Its proximity to various attractions makes it an ideal starting point for sightseeing, allowing travelers to explore the city's rich heritage while enjoying the convenience of modern transport.","The Railway Station on Monastiriou Street, which was renamed Egnatia Street, began construction in 1939 and became fully operational in 1951. It plays a significant role in transportation in Thessaloniki, serving as a key hub for travelers and connecting various modes of transport. Additionally, the old steam engine located in front of the station highlights its historical significance in the development of railway transportation in the region.",1.0,0.54,0.16666666666666666,0.8659403545748416,0.99999999995,0.9999999999,0.0,0.7499999990624999,,0.869303122698283
47,"What historical significance does Egnatia Street hold in Thessaloniki, and what notable landmarks can be found along it?","['34\n1 \tEGNATIA STREET\nThis central avenue has \nbeen there practically since \nThessaloniki’s founding,  \nas it is a section of the road \nconstructed by the Romans  \nin the 2nd c. BC, and connected \nDyrrhachium (Durrës, in \nmodern day Albania) with \nConstantinople. It starts at \nDimokratia square (see p. 58) \nand ends at the TIF grounds \n(see p. 31) and the Aristotle \nUniversity of Thessaloniki, \nsplitting in two the town’s \nhistoric centre. It is a busy \nshopping area with numerous \nremarkable buildings of \neclectic and art deco style \ndating to the early 20th c. \n(mostly old hotels) that are \nabsolutely worth observing,  \nas well as some of the city’s \nmost important monuments.\nMUST SEE:\n1.1  Kolomvou Square.\nThe crossroads where \nEgnatia Street meets \nAntigonidon Street is indeed \na bustling one! It was named \nafter G. Colombo, an Italian \nwho opened a hotel there  \nin the early 20th century. This \nis the location of Kolomvou \nArchway (31, Egnatia St.) \nwhich has become a leisure \nhub with cafés, bars and \nrestaurants inside.\n1.2  Hamza Bey Mosque.\nIt was built in 1467 by the \ndaughter of Hamza Bey, the \nmilitary commander of Sultan \nMurad II.', '30\n3rd walk: \nHISTORIC CENTRE (2)\nMUSEUM AREA\nflats facing the adjacent \nIppodromiou square. This was \na 450 m. long and a 95 m. \nwide structure and it used to \nbe the centre of social activity \nfor citizens until 390 AD, \nwhen emperor Theodosius \nordered the massacre of \n7,000 Thessalonians there; \nthe event led to the close-\ndown of the Hippodrome. It is \nworth visiting the Thessaloniki \nHistory Centre, situated in the \nsquare’s south side as well as \nthe remarkable 18th c. Agios \nAntonios church in Margariti \nstreet nearby. \n8.7  Arched Hall.\nIt lies at the intersection  \nof Gounari and Svolou streets. \nThis was a place with heating \ninstallations for holding \nsymposia and ceremonies. \nIt had a direct access to \nthe imperial box in the \nHippodrome.\n8.8  Theatre - stadium  \nin Apellou Street.\nThe remains of a building \nhave been located at 5 & \n7 Apellou St., and they are \nconsidered to have been part \nof the theatre-stadium of the \ntown, which was in use from \nthe 1st until the 4th c. AD.  \nThere are references connecting \nthis place with the martyrdom \nof Agios Dimitrios, the city’s \npatron saint.\n9 \tTHREE CHURCHES\nOn the south side of Egnatia \nStreet, between K. Palaiologou \nSt.']","['<1-hop>\n\n34 1 EGNATIA STREET This central avenue has been there practically since Thessaloniki’s founding, as it is a section of the road constructed by the Romans in the 2nd c. BC, and connected Dyrrhachium (Durrës, in modern day Albania) with Constantinople. It starts at Dimokratia square (see p. 58) and ends at the TIF grounds (see p. 31) and the Aristotle University of Thessaloniki, splitting in two the town’s historic centre. It is a busy shopping area with numerous remarkable buildings of eclectic and art deco style dating to the early 20th c. (mostly old hotels) that are absolutely worth observing, as well as some of the city’s most important monuments. MUST SEE: 1.1 Kolomvou Square. The crossroads where Egnatia Street meets Antigonidon Street is indeed a bustling one! It was named after G. Colombo, an Italian who opened a hotel there in the early 20th century. This is the location of Kolomvou Archway (31, Egnatia St.) which has become a leisure hub with cafés, bars and restaurants inside. 1.2 Hamza Bey Mosque. It was built in 1467 by the daughter of Hamza Bey, the military commander of Sultan Murad II. It is the only mosque in Greece with a peristyle (a colonnaded yard). For many decades it housed a cinema named Alkazar. Currently there are renovation works under way. Once they are finished, it will house an exhibition of finds unearthed during the metro excavations. Right behind it you will see the City Manor which housed the Town Hall until recently. It is known at Karavan Serai as there used to be an ottoman inn here. (early 16th c.). 4th walk:']","Egnatia Street is a historically significant avenue in Thessaloniki, tracing its origins back to the Roman era in the 2nd century BC. It served as a vital connection between Dyrrhachium (modern-day Durrës, Albania) and Constantinople, making it an essential route for trade and travel in antiquity. Today, Egnatia Street remains a central artery of the city, dividing its historic center and bustling with activity.

As a solo traveler interested in sightseeing, you will find several notable landmarks along Egnatia Street that reflect the city's rich history and architectural diversity. 

1. **Kolomvou Square**: This lively crossroads at the intersection of Egnatia and Antigonidon Streets is named after an Italian hotelier from the early 20th century. It features the Kolomvou Archway, which has become a popular leisure hub filled with cafés, bars, and restaurants, perfect for capturing Instagrammable moments.

2. **Hamza Bey Mosque**: Built in 1467, this mosque is a significant historical site, showcasing the city's Ottoman heritage. Its architecture and serene atmosphere make it a worthwhile stop for those interested in the cultural layers of Thessaloniki.

3. **Aristotle University of Thessaloniki**: Located at the end of Egnatia Street, this prominent university is a key educational institution in Greece. The surrounding area is vibrant and offers a glimpse into student life and local culture.

4. **TIF Grounds**: The Thessaloniki International Fair grounds, also at the end of Egnatia, host various events throughout the year and are a focal point for local gatherings.

Exploring Egnatia Street provides a unique opportunity to experience Thessaloniki's historical significance while enjoying its modern-day vibrancy, making it an ideal destination for your weekend visit.","Egnatia Street is historically significant as it has been a central avenue since the founding of Thessaloniki, originating from a Roman road constructed in the 2nd century BC that connected Dyrrhachium with Constantinople. Along this busy shopping area, notable landmarks include Kolomvou Square, which features the Kolomvou Archway, and the Hamza Bey Mosque, built in 1467, known for its unique peristyle and current renovation for an exhibition of archaeological finds.",0.6666666666666666,0.42,0.4666666666666667,0.8302705079427777,0.9999999999,0.9999999999,1.0,0.6363636357851239,,0.8335181066690112
48,What are some attractions in Kalamaria and how does it relate to the overall experience of visiting Thessaloniki?,"['64\nSUBURBS AND CITY OUTSKIRTS\nsituated nearby. The small \nmounds in the field are ancient \ntombs; a Neolithic settlement \nwas excavated in one of them \nwith a cemetery dating to the \nGeometric and Archaic period. \nAn impressive Macedonian \ntomb was also unearthed in \nAgios Athanasios area.\nHow to get there. Bus \nlines 40, 40A and 40K leave \nfor Kalochori from the Railway \nStation Stop. If you travel by \ncar, take the Athens direction \non the national road and turn \ntowards Kalochori.\n2 \tKALAMARIA\nThis is practically an eastward \n‘extension’ of Thessaloniki and \nthe city’s best known suburb, \nstretching along the waterfront, \nwith many green spaces and \na self-contained shopping \ncentre. The first inhabitants are \nrecorded in the early 20th c. and \nduring the 1920’s significant \nnumbers of Greek refugee \npopulations settled here and \nbuilt their small houses. They \ncame from Caucasus, Minor \nAsia and Pontus [modern- \nday northeast Turkey]. Today,  \ndespite the rising building trend  \nin the area, several refugee \nhouses remain, still keeping  \na flavour of times goneby.\nMUST SEΕ: \n2.1  Sofouli Street\n(see p. 53).\n2.2  Kyverneio [Government \nHouse] (Little Palace).', '7\n«…There is a homeland for everyone,  \nwhile there is Thessaloniki»\nNikiforos Choumnos, \n14thc. Byzantine dignitary and a scholar.\nNowadays, the historic capital -by right- of Macedonia, \nthe land of Alexander the Great, has evolved into a modern \nand particularly charming metropolis. A multitide of \nmonuments and cultural assets and the town’s traditional \nways exist in harmony with the modern aspects and the \nhigh standard infrastructure, the carefree mood, the spirit \nof hospitality, the vitality of the locals – particularly the \nyoung – setting the pace of town life, the diversity of \nartistic events, the long list of choices for entertainment, \nthe exceptional culinary tradition, and the fresh feel in \nthe atmosphere, coming from the seafront, as well as the \ncoolness of the northwest wind called Vardaris.   \nThessaloniki’s location is at the centre of a greater area \nwith incomparable historical monuments and natural assets \nas it offers the opportunity for a visit to archaeological \nsites known the world over (Ancient Pella, Vergina, Dion, \nPetralona Cave), to areas of exquisite nature (river deltas, \nlakes, Mt Olympus), to the monastic state of Agion Oros \n[the Holy Mountain] as well as to Halkidiki, a famous tourist \ndestination. And there is always an opportunity to practice \nsports (swimming, skiing, playing golf etc) or to indulge in \nwellness tourism (hot springs, spas)!\nIn short, Thessaloniki is a city that can cater for even the \nmost demanding needs, any time of the year.']","['<1-hop>\n\n65 SUBURBS AND CITY OUTSKIRTS 2.4 Aretsou – Krini. These two most popular areas of Kalamaria stretch along the seafront. The facilities of the local marine sports club are here, next to Aretsou-Krini beach; there is also an open air cinema and a marina (the only one in town) with a 242-berth capacity (there are power, water and telephone services). The waterfront N. Plastira Street is lined with café-bars and fish tavernas which get filled to capacity all year round. 2.5 Komninon Street. The longest part of the town’s main street is for pedestrian use only and you will find shops, cafés, small bars and restaurants along the way. This is also where you will find the area’s central square where the Town Hall and the church of the Transfiguration of Christ are. From the direction of the seafront, you can reach the area via I. Passalidis Street. How to get there. Bus lines 5 and 5A leave from Eleftherias square. Get off at Naftikos Omilos [Marine Club] stop or at Chamodrakas stop in Aretsou area. 3', '<2-hop>\n\nPANORAMA One of the best suburbs of Thessaloniki is situated at a 12 km distance S of the city centre and was built on the slope of Mt Chortiatis, offering a panoramic city view. It was uninhabited until the early 20th c., although traces of a prehistoric settlement have been located on the area. The first inhabitants were refugees from Asia Minor and Pontus. Today its largest part is covered by luxury villas and impressive detached homes; there is a small shopping area in the centre. Trigona Panoramatos [a cream puff pastry] – one of the city’s best known sweet delicacies – were created at a local confectionery in the 1950’s. MUST SEE: Platanakia. It is a nice place for relaxing, in a wooded ravine, with a small Zoo and a café. A 6 km path begins here and leads up to the artificial lake (dam) of Thermi. Along the way you will come across spots for a brief rest, short waterfalls and fragments of eight Byzantine watermills. 11 12 13 14 KONSTANTINOUPOLEOS SSIS OLGAS GIOU PAPANDREOU ROSIDI ROSIDI GEORGIOU PAPANDREOU APAFI MARKOU BOTSARI PAPANASTASIOU ANATOLIKIS THRAKIS PAPANASTASIOU VOULGARI KANARI KANARI KARAKASI KARAKASI DELFON GAVRIILIDI TH. SAKELLARIDI GAVRIILIDI KARAOLI VOULGARI KOURTIDI YPSILANTOU PLASTIRA KORAI SMYRNIS MIAOULI PLASTIRA PLASTIRA KERASOUNTOS THEMISTOKLI SOFOULI KALYVA METAMORFOSEOS KOMNINON PONTOU PONTOU AIGAIOU AIGAIOU ADRIANOUPOLEOS EL. VENIZELOU ETHNIKIS ANTISTASIS KOLOTOUROU THICHIS PAPAFLESSA MERKOURIOU KIFISIAS KIFISIAS PSELOU SOLONOS MANTINEIAS GAMVETA METAMORFOSI AGIOS NIKOLAOS NATHANAIL MALAKASI POLYLA PARASCHOU TYPALDOU GRYPARI ROIDI GAMVETA MAKEDONIAS STROMNITSIS MELENIKOU MOUSOURI PAPANTONIOU CHRISTOVASILI PORFYRA SKIATHOU ANINOU KRITIS CHAIRONEIAS PARNASSOU KOUSKOURA PAPADIMITRIOU TAKI OIKONOMIDI DODEKANISOU MITROPOLITI AMVROSIOU MITROPOLITI KALIDI MITROPOLITI GRIGORIOU KYDONION MOSCHONISION THEMISTOKLI SOFOULI KROMNIS PLOUTONOS KASSOMOULI SANGARIOU VISSARIONOS KAPETANIDI NAVARINOU KOLCHIDAS PAPAGOU KIOU POULANTZAKI KALIDOU KAVASITON XENOFONTOS IL E TIR G A NIKOMIDEIAS TRIPOLEOS CHILIS MARMARA CHALKIS VITHYNIAS MIKROULEA KONITSIS SARATSI THERAPEION NIKAIAS AGIAS ELENIS AGIOU IOANNOU VOSPOROU ELLISPONTOU MAKROCHORIOU KARAMAOUNA KARATASOU PAPANASTASIOU LEVANTI KAZIKA IRAKLEIAS IOAKEIM G’ CHRYSOSTOMOU SMYRNIS ADRAMITIOU METRON ANDROUTSOU EFESOU PASALIDI TAXIARCHON MYSTAKIDI MOUDANION EVELPIDOU AGIOU NIKOLAOU PROUSAS DALIPI BALA PAPAPETROU AVDELA KOMNINON KOTYORON ARGYROUPOLEOS SANTAS MYRION AKRITIDI EPANOMIS PAPAKYRITSI AMISSOU LEROU KYPROU PATMOU YPSILANTOU KYMIS MAKRYRACHIS SOUMELA PARANIKA VAZELONOS IASONIDI KYRIAKIDI FOKAIAS DAVAKI AGIOU VASILEIOU DIOGENOUS LEFKOSIAS ARISTOFANOUS FANARIOU PALAMA PANORMOU GRIGORIADI KALANTIDI ANATOLIKIS THRAKIS SOULIOU OMIROU ZALONGOU IONIAS PARIDOS FILADELFEIAS KAPADDOKIAS PROMITHEOS XENOPOULOU IKONIOU IPPOKRATOUS RANGAVI DIOS SOKRATOUS SOLOMOU PLOUTARCHOU EVRIPIDOU SOURI PAPANTONIOU THOUKYDIDI IOUSTINIANOU ALKIONOS ZIRGANOU IRAS LOUI SEVASTEIAS KARAVANGELI ERYTHROU STAVROU MEGALOU ALEXANDROU KAZAZI KAISAREIAS LAODIKIAS IEROSOLYMON AIANTOS AIVATZIDI AGIOU PANTELEIMONOS ANEMONAS PASTER FILELLINON KERAMOPOULOU KALAVRYTON PAPADIAMANTI FILIPPOU V. IPEIROU KOLOKOTRONI VLACHERNON KORYTSAS RODOU IRODOTOU LASANI ARISTOTELOUS ARISTEIDOU PERIKLEOUS TATAOULON DORILEOU POKIOUPTSIDI KYZIKOU KAFKASOU TSINGIRIDI AGIOU ZACHARIA CHERIANON CHALDEIAS KAROLIDI CHEIMONIDI AIMILIANOU MITR. ARTAKIS ERATYRAS ANTIGONIS VOULGAROKTONOU PARASKEVOPOULOU APOSTOLOU PAVLOU FLEMING KONSTANTINOUPOLEOS KYFONIDI S A R E M I CHRYSOULIDI THERMAIKOU PAPANIKOLA NIKOPOLEOS TRAPEZOUNTAS VASILEIADOU SIFILINON SOURMENON ARGYROPOULOU NEAPOLEOS STRAVONOS ARGONAFTON KYDONION PAPADAKI SIGALA AKTAIOU ANDRONIKOU POLEMI PAPADAKI PANSELINOU ADMITOU KASSANDREOS TSOUNTA POULIOU KORNAROU NALTSA FRANTZI KRYSTALI AINOU SIK A R H T O M A S LOGOTHETOU NIKOLAIDI THEMELI SPETSON LASKARATOU TYPA YPSILANTOU DROSINI CHALKIDIKIS THERMOPYLON THALITOS PITTAKOU GRAVIAS GRAVIAS FILELLINON OROMILA KRITIS PAPADIAMANTI NASTOU ALKMINIS NATSINA GENNADIOU MITR. NEMEAS PLATAION DANIOLOU AGIOU VASILEIOU GENNADIOU MITR. PAPAKYRIAZI KARKAVITSA AVROKORDATOU VOGA US IPATIAS KISSOU KARIATIDAS KAVIRON AGAMEMNONOS U S ARGAIOU FOINIKOS EFESSOU KAISAREIAS KALLIPOLEOS VRYOULON KYZIKOU NIKOMIDEIAS NEAPOLEOS MIDEIAS APADDOKIAS KAONIAS INIOSOGLOU NIKAIAS KAROLIDOU RANTI AS KI NIAS SANTAS POULA YPARCHOU FOKYLIDOU KERAMIKOU EPIDAVROU TSELIOU TSELIOU PRAXAGORA OLYMPIAS VOSPOROU AMFIPOLEOS MIKRAS ASIAS PONTOU VITHYNIAS PAPAGEORGIOU IOANNOU KAISAREIAS METRON IMVROU AGRIANON CHIOU CHOURMOUZI APOLLONOS SYROU FAIAKON LARNAKOS AMMOCHOSTOU NAFPLIOU NAFPLIOU DERKON KORDELIOU VIZYIS DORYLAIOU TINOU TENEDOU DARDANELLION DIMITSANAS EPIDAVROU EFSTATHIOU MITROPOLITOU PILEAS CHANDRINOU FILINTA DORYLAIOU KARANIVALOU ATLANTIDAS SVOLOU VOSPOROU ZACHOU ZIRINI ZONARA ANAXIMENOUS ANATOLIKIS ROMYLIAS ISOKRATOUS TOUSSA SPEFSIPOU MYSTAKIDI DYSTOMOU MIKROU ANTISTHENOUS STEFANOU DIMOCHAROUS MISIRLI PILEAS AEROPOU PAFSILYPOU TRIANTAFYLLOPOULOU AGALIANOU PRAIDI STAMATELOU FILI STAGIRITI STADIOU IPEIROU KYPROU KARAVANGELI MARATHONOS MAKEDONIAS ETHNIKIS CHRΥSOSTOMOU AGRA NEARCHOU IFAISTIONOS OLYMPOU KORYTSAS PTOLEMAIOU PERDIKA OLYMPIADOS OLYMPIADOS THER MOPYLON KENEDY PLASTIRA PLASTIRA PROFITI ILIA MEGALOU ALEXANDROU VAS. KONSTANTINOU GRIGORIOU LAMPRAKI (KONITSIS) FLEMING NIKIS AMFOTEROU ETEOKLI DIGKA ETEOKLI IGILOCHOU NIKANOROS EVMENOUS VASIKYROU KARATHEODORI GAZI ANAKREONTOS ANTAIOU NOUKA SEFERI POSEIDONOS MELEAGROU ANGELOU ALKAMENOUS ANAXIMANDROU ANAXIMANDROU LEONIDOU KARDITSIS IRAKLEOUS KORAI MELENIKOU ALKMINIS PARALI GLYNOU TZAVELA TZAVELA RIGA FERAIOU CHORN ZOUMETIKOU MARASLI MARSLI XENOU MAVROMICHALI ADRIANOUPOLEOS ATREIDON XYNGOPOULOU ARKADIOU OSIAS XENIS STROMNITSIS OKEANIDON DEINOKRATOUS VAMVA AGISILAOU NEOPTOLEMOU PAPA PAVLOU MELA VENIZELOU ARISTOTELOUS EIRINIS FILIKIS ETAIRIAS FILIPPOU PRASSAKAKI SCHOLEION OMIROU KOLOKOTRONI PALAIOLOGOU LAOGR. MOUSEIOU DAVAKI SELEFKOU TSELEPI TSIAPANOU TSAMI STRATIGI STRATIGI VISTA ANGELOPOULOU DIVOLI GKOURA GRIGORIOU STEFANOU ATHINA ANTHEMOUNTOS LEFAKI PAFSANIA SEMELIS AETIONOS PANTAZIDI PERRAIVOU PERRAIVOU SPANOU IPPOKRATOUS IPPOKRATOUS DIMOKRITOU VOSPOROU GLYNOU GLYNOU THEOFILOU PAPANASTASIOU VYZANTIOU PAPAFLESSA ANOIXIS VARNALI SPYROU LOUI KALVOU SYMEONIDI PROTOMAGIAS PALAMA DIMOKRATIAS VISVIZI ARTAKIS U EPTALOFOU PARMENIDI TIROLOIS EMOU POLYGNOTOU DROMIOU LISSIPOU ANTIFANOS MEGAKLEOUS EMMANOUIL EFTALIOTI EFTALIOTI DOMPOLI DOUKA ANAXIMENOUS NEARCHOU RIGA FERAIOU SEFERI MENANDROU PAPANIKOLAOU ANAPAFSEOS ZORBA ANAPAFSEOS KAFANTARI POSEIDONOS ALATSATON ANTISTASEOS AGIOS THERAPON PROFITIS ILIAS AGIOS ELEFTHERIOS TREIS IERARCHES OSIA XENI MALAKOPI CHARILAOU ARETSOU TROCHIODROMIKON DEPO ALATINI CHEN KOURI VOTSI KIFISIA VYZANTIO KATIRLI DERKON KARAMPOURNAKI EXOCHES KONSTANTINOUPOLITON KATO TOUMPA TOUMPA CEMETERY ENGLISH CEMETERY KALAMARIA CEMETERY PILEA CEMETERY THERMI - CHALKIDIKI MIKRA CHALKIDIKI PANORAMA GOVATZIDAKI SQ. AINOU SQ. KAOUDI SQ. PATRIKIOU AILIDI SQ. SQ. SKRA SQ. PILEA KALAMARIA THESSALONIKI KERAMEIA ALATINI ARISTOTELIS AGIOU ELEFTHERIOU SQ. RETIREMENT HOME 2.2 2.3 2.4 2.5 2.1 2.4 72']","Kalamaria, a charming suburb of Thessaloniki, offers a delightful blend of history, culture, and scenic beauty, making it an ideal destination for a weekend getaway. Stretching along the waterfront, Kalamaria is known for its picturesque views and green spaces, perfect for leisurely strolls and capturing Instagram-worthy moments.

One of the must-see attractions in Kalamaria is Sofouli Street, renowned for its vibrant atmosphere, lined with cafes, shops, and local eateries. This bustling street provides an excellent opportunity to immerse yourself in the local culture while enjoying a coffee or a meal. The Kyverneio, or Government House, also known as the Little Palace, is another notable site that reflects the area's historical significance and architectural charm.

The suburb's rich history is evident in its architecture, with many preserved refugee houses from the early 20th century, offering a glimpse into the past and the stories of the people who once lived there. These structures add a unique character to the area, allowing visitors to appreciate the cultural heritage of Thessaloniki.

Kalamaria's waterfront is perfect for relaxation and social interaction, where you can enjoy the refreshing sea breeze and engage with locals. The area is also well-connected to the city center, making it easy to explore Thessaloniki's numerous attractions, such as its historic monuments and vibrant nightlife.

Overall, visiting Kalamaria enhances the experience of exploring Thessaloniki by providing a balance of urban life and serene coastal charm. The suburb's blend of historical significance, local culture, and scenic beauty makes it a memorable part of your journey, ensuring that your first visit to Thessaloniki is both enjoyable and enriching.","In Kalamaria, popular attractions include the seafront areas of Aretsou and Krini, which feature a local marine sports club, an open-air cinema, and a marina. The waterfront N. Plastira Street is lined with café-bars and fish tavernas, making it a lively spot year-round. Additionally, Komninon Street, which is pedestrian-only, offers shops, cafés, and restaurants, along with the central square where the Town Hall and the church of the Transfiguration of Christ are located. This vibrant atmosphere in Kalamaria contributes to the overall experience of visiting Thessaloniki, as it provides a mix of leisure, dining, and cultural exploration, enhancing the travel experience in the region.",0.0,0.38,0.3448275862068966,0.836015127101648,0.9999999999,0.49999999995,0.0,0.12499999984374999,,0.7477184516492207
49,Can you tell me more about the railway station and its history and how it relates to transportation in the area?,"['ARC\nAG\nDIMIT\nTERPSITHEA\nSQ.\nRAILWAY STATION\nSQ.\nOLD RAILWAY\nSTATION SQ.\nGALANOPOULOU\nSQ.\nSYKIES\nNEAPOLI\nAMPELOKIPOI\nMENEMENI\nMAKEDONOMACHON\nSQ.\nKARAOLI-DIMITRIOU SQ.\nELEFTHERIAS\nSQ.\nDROPOTAMOS\n7th walk: \nWEST OF THE CENTRE-STAVROUPOLI\n2\n3\n1\n4\n3.2\n2.2\n2.1\n4.1\n4.2\n4.3\n4.3\n4.4\n2.3\n2.4\n2.5\n2.8\n2.7 2.6\n3.1\n3.3\n1 \t\x07DIMOKRATIAS SQUARE \n(VARDARI)\nSince ancient times, this  \nhas been the most important \nentry point to Thessaloniki. \nThis relatively disadvantaged \narea is a transportation hub \nconnecting the west and \nnorthwest suburbs with the \ncity centre; there are also \nseveral hotels, small shops, \ntavernas and cafés in the \narea. In the centre of the \nsquare you will see the statue \nof King Constantine (1868-\n1923), who entered the \ncity in 1912 in his capacity \nas commander-in-chief of \nthe Greek Army. The road \ndistances (in km) where \nThessaloniki is the starting \npoint get calculated from  \nthis square.', '59\n7th walk: \nWEST OF THE CENTRE-STAVROUPOLI\ninaugurated in 1962 (S. Molfesis, \nTh. Papagiannis). Its exterior \nside combines modern and \nclassical elements with wings \nadded on the sides. It connects \nThessaloniki with the rest of \nGreece, the Balkans and Istanbul; \nit is also the bus terminus \ntowards most of the city areas. \nThis will be the location of the \nwest metro line terminus under \nconstruction in Thessaloniki.\n2.2  Old Railway Station.\nIt was built in 1894 near the \nharbour (Old Station Street) \nin the neoclassical style, \nand it gradually connected \nThessaloniki with Skopje, \nBelgrade, Monastir and \nConstantinople (modern-day \nIstanbul). Today it is exclusively \nused as a cargo train station. \nThis is where the German \noccupation forces mustered \nabout 50,000 Jewish residents, \nfrom March until August 1943, \nin order to send them by train \noff to concentration camps.\n2.3  Top Hane (Vardariou \nTower).\nSituated where the west \nand seafront city walls used \nto meet, this Tower was built \nby the Ottomans in 1546 and \nit was known as the Armoury \nTower. It is a six-sided, three-\nstorey and 10-metre high tower \nwhich used to be the main city \nstronghold.']","['<1-hop>\n\nMUST SEE: 2.1 Railway Station. It is on Monastiriou Street which is renamed at some point Egnatia Street (see p. 34). Construction began in 1939 and it became fully operational in 1951, but it was officially 66. Vardariou Tower (Top Hane). 67. Old steam engine fronting Thessaloniki’s Railway Station.']","The Old Railway Station in Thessaloniki, built in 1894, is a significant historical landmark located near the harbor on Old Station Street. Designed in a neoclassical style, it played a crucial role in connecting Thessaloniki with major cities such as Skopje, Belgrade, Monastir, and Constantinople (modern-day Istanbul). This station was vital for both passenger and cargo transport, facilitating trade and travel across the Balkans.

During World War II, the station became a site of tragedy when approximately 50,000 Jewish residents were gathered by German occupation forces from March to August 1943, before being deported to concentration camps. This dark chapter in its history adds a layer of somber reflection to its architectural significance.

Today, the Old Railway Station is exclusively used as a cargo train station, marking a shift from its original purpose. However, it remains a key transportation hub in Thessaloniki, connecting the city to the rest of Greece and the Balkans. The station's historical importance is complemented by its modern counterpart, which serves as a bus terminus for various city areas and is set to be the terminus for the west metro line currently under construction.

For a solo traveler interested in sightseeing, the Old Railway Station offers a glimpse into Thessaloniki's rich history and its evolution as a transportation center. The surrounding area features several hotels, small shops, and local tavernas, providing opportunities to engage with the local culture. As you explore, you can capture Instagrammable moments against the backdrop of this historical site, making it a worthwhile stop during your weekend visit.","The railway station, located on Monastiriou Street, which was later renamed Egnatia Street, is a significant landmark. Construction of the station began in 1939, and it became fully operational in 1951. It is an important hub for transportation in the area, with historical significance highlighted by the old steam engine that stands in front of Thessaloniki’s Railway Station.",0.25,0.25,0.4583333333333333,0.7803764626348002,0.99999999995,0.0,0.0,0.0,,0.5195909340306041
50,Can you tell me more about the railway station and its history and also how it relates to transportation in the area?,"['ARC\nAG\nDIMIT\nTERPSITHEA\nSQ.\nRAILWAY STATION\nSQ.\nOLD RAILWAY\nSTATION SQ.\nGALANOPOULOU\nSQ.\nSYKIES\nNEAPOLI\nAMPELOKIPOI\nMENEMENI\nMAKEDONOMACHON\nSQ.\nKARAOLI-DIMITRIOU SQ.\nELEFTHERIAS\nSQ.\nDROPOTAMOS\n7th walk: \nWEST OF THE CENTRE-STAVROUPOLI\n2\n3\n1\n4\n3.2\n2.2\n2.1\n4.1\n4.2\n4.3\n4.3\n4.4\n2.3\n2.4\n2.5\n2.8\n2.7 2.6\n3.1\n3.3\n1 \t\x07DIMOKRATIAS SQUARE \n(VARDARI)\nSince ancient times, this  \nhas been the most important \nentry point to Thessaloniki. \nThis relatively disadvantaged \narea is a transportation hub \nconnecting the west and \nnorthwest suburbs with the \ncity centre; there are also \nseveral hotels, small shops, \ntavernas and cafés in the \narea. In the centre of the \nsquare you will see the statue \nof King Constantine (1868-\n1923), who entered the \ncity in 1912 in his capacity \nas commander-in-chief of \nthe Greek Army. The road \ndistances (in km) where \nThessaloniki is the starting \npoint get calculated from  \nthis square.', '59\n7th walk: \nWEST OF THE CENTRE-STAVROUPOLI\ninaugurated in 1962 (S. Molfesis, \nTh. Papagiannis). Its exterior \nside combines modern and \nclassical elements with wings \nadded on the sides. It connects \nThessaloniki with the rest of \nGreece, the Balkans and Istanbul; \nit is also the bus terminus \ntowards most of the city areas. \nThis will be the location of the \nwest metro line terminus under \nconstruction in Thessaloniki.\n2.2  Old Railway Station.\nIt was built in 1894 near the \nharbour (Old Station Street) \nin the neoclassical style, \nand it gradually connected \nThessaloniki with Skopje, \nBelgrade, Monastir and \nConstantinople (modern-day \nIstanbul). Today it is exclusively \nused as a cargo train station. \nThis is where the German \noccupation forces mustered \nabout 50,000 Jewish residents, \nfrom March until August 1943, \nin order to send them by train \noff to concentration camps.\n2.3  Top Hane (Vardariou \nTower).\nSituated where the west \nand seafront city walls used \nto meet, this Tower was built \nby the Ottomans in 1546 and \nit was known as the Armoury \nTower. It is a six-sided, three-\nstorey and 10-metre high tower \nwhich used to be the main city \nstronghold.']","['<1-hop>\n\nMUST SEE: 2.1 Railway Station. It is on Monastiriou Street which is renamed at some point Egnatia Street (see p. 34). Construction began in 1939 and it became fully operational in 1951, but it was officially 66. Vardariou Tower (Top Hane). 67. Old steam engine fronting Thessaloniki’s Railway Station.']","The Old Railway Station in Thessaloniki, built in 1894 in a neoclassical style, is a significant historical landmark located near the harbor on Old Station Street. Initially, it served as a vital connection point for Thessaloniki, linking the city to major destinations such as Skopje, Belgrade, Monastir, and Constantinople (modern-day Istanbul). This station played a crucial role in the region's transportation network, facilitating both passenger and cargo transport.

During World War II, the station became a site of tragedy, as it was used by German occupation forces to gather approximately 50,000 Jewish residents from March to August 1943 before deporting them to concentration camps. Today, the Old Railway Station is exclusively a cargo train station, reflecting the changes in transportation needs over the years.

In terms of transportation in the area, the Old Railway Station is part of a broader network that connects Thessaloniki with the rest of Greece and the Balkans. It serves as a hub for various transportation modes, including buses that link the city to its suburbs and other regions. The station is also set to become the terminus for the west metro line currently under construction, which will further enhance accessibility and connectivity in Thessaloniki.

For a solo traveler interested in sightseeing, the Old Railway Station offers a glimpse into the city's rich history and architectural heritage. Its location near the harbor makes it an ideal starting point for exploring other attractions in Thessaloniki. The blend of historical significance and modern transportation developments makes the Old Railway Station a noteworthy stop during your visit, providing opportunities for both reflection and exploration.","The railway station, located on Monastiriou Street, which was later renamed Egnatia Street, is a significant landmark in Thessaloniki. Construction of the station began in 1939, and it became fully operational in 1951. It features an old steam engine in front, symbolizing its historical importance in transportation. The station serves as a crucial hub for travelers, connecting various regions and facilitating the movement of people and goods.",0.0,0.46,1.0,0.7818189135889761,0.99999999995,0.0,0.0,0.16666666638888888,,0.5222637617493086
51,"What is the historical significance of the Railway Station in Thessaloniki, and when did it become fully operational?","['The road \ndistances (in km) where \nThessaloniki is the starting \npoint get calculated from  \nthis square.\n2 \t\n\x07AROUND DIMOKRATIAS \nSQUARE\nThere are mostly faceless \nbuildings in the area – \namong them you will find \nsmall manufactures or old \nindustries. However there are \nalso historic sites, as there \nare sections of the city’s west \nwalls here, Byzantine and \nottoman monuments and other \narchaeological sites (temple  \nof Aphrodite, 6th c. BC).\nMUST SEE:\n2.1  Railway Station.\nIt is on Monastiriou Street \nwhich is renamed at some \npoint Egnatia Street (see p. 34). \nConstruction began in 1939 \nand it became fully operational \nin 1951, but it was officially \n66.  \nVardariou \nTower (Top \nHane).\n67.  \nOld steam \nengine \nfronting \nThessaloniki’s \nRailway \nStation.', '59\n7th walk: \nWEST OF THE CENTRE-STAVROUPOLI\ninaugurated in 1962 (S. Molfesis, \nTh. Papagiannis). Its exterior \nside combines modern and \nclassical elements with wings \nadded on the sides. It connects \nThessaloniki with the rest of \nGreece, the Balkans and Istanbul; \nit is also the bus terminus \ntowards most of the city areas. \nThis will be the location of the \nwest metro line terminus under \nconstruction in Thessaloniki.\n2.2  Old Railway Station.\nIt was built in 1894 near the \nharbour (Old Station Street) \nin the neoclassical style, \nand it gradually connected \nThessaloniki with Skopje, \nBelgrade, Monastir and \nConstantinople (modern-day \nIstanbul). Today it is exclusively \nused as a cargo train station. \nThis is where the German \noccupation forces mustered \nabout 50,000 Jewish residents, \nfrom March until August 1943, \nin order to send them by train \noff to concentration camps.\n2.3  Top Hane (Vardariou \nTower).\nSituated where the west \nand seafront city walls used \nto meet, this Tower was built \nby the Ottomans in 1546 and \nit was known as the Armoury \nTower. It is a six-sided, three-\nstorey and 10-metre high tower \nwhich used to be the main city \nstronghold.']","['<1-hop>\n\nMUST SEE: 2.1 Railway Station. It is on Monastiriou Street which is renamed at some point Egnatia Street (see p. 34). Construction began in 1939 and it became fully operational in 1951, but it was officially 66. Vardariou Tower (Top Hane). 67. Old steam engine fronting Thessaloniki’s Railway Station.']","The Railway Station in Thessaloniki holds significant historical importance as a key transportation hub that facilitated connections between Thessaloniki and various major cities in the region, including Skopje, Belgrade, Monastir, and Constantinople (modern-day Istanbul). Built in 1894 near the harbor, the station is designed in a neoclassical style and has played a crucial role in the economic and social development of the city.

During World War II, the station became a site of tragedy when German occupation forces used it to gather approximately 50,000 Jewish residents from March to August 1943. These individuals were deported by train to concentration camps, marking a dark chapter in Thessaloniki's history and highlighting the station's role in the broader narrative of the Holocaust.

The Railway Station underwent significant changes over the years, including renovations and expansions to accommodate the growing transportation needs of the region. It officially became fully operational in 1951, after construction began in 1939. Today, while it primarily serves as a cargo train station, its historical architecture and the stories it carries make it a noteworthy site for visitors interested in the rich history of Thessaloniki.

For a first-time visitor, the Railway Station not only offers a glimpse into the city's past but also serves as a starting point for exploring other historical sites and attractions in Thessaloniki. Its blend of historical significance and architectural beauty makes it an ideal spot for sightseeing and photography, appealing to those seeking to capture the essence of the city.","The Railway Station in Thessaloniki, located on Monastiriou Street (later renamed Egnatia Street), began construction in 1939 and became fully operational in 1951. It is a must-see landmark, notable for its historical significance and the old steam engine that fronts the station.",0.5,0.29,0.56,0.8066383571808047,0.99999999995,0.9999999999,0.0,0.8571428559183674,,0.8988666614029732
52,"What is the historical significance of the Railway Station on Monastiriou Street in Thessaloniki, and how does it relate to the city's transportation development?","['The road \ndistances (in km) where \nThessaloniki is the starting \npoint get calculated from  \nthis square.\n2 \t\n\x07AROUND DIMOKRATIAS \nSQUARE\nThere are mostly faceless \nbuildings in the area – \namong them you will find \nsmall manufactures or old \nindustries. However there are \nalso historic sites, as there \nare sections of the city’s west \nwalls here, Byzantine and \nottoman monuments and other \narchaeological sites (temple  \nof Aphrodite, 6th c. BC).\nMUST SEE:\n2.1  Railway Station.\nIt is on Monastiriou Street \nwhich is renamed at some \npoint Egnatia Street (see p. 34). \nConstruction began in 1939 \nand it became fully operational \nin 1951, but it was officially \n66.  \nVardariou \nTower (Top \nHane).\n67.  \nOld steam \nengine \nfronting \nThessaloniki’s \nRailway \nStation.', '106\nPassenger Railway Station.\n28, Monastiriou St, information \non domestic and international \ntimetables: \ntel.: 14511 \nwebsite: www.ose.gr\nThessaloniki Central Port \nAuthority (at the harbour). \nFor info on passenger ship \ntimetables,  \ntel.: 2313 325.821-4\nStavros Port Station: \ntel.: 23970 61.280\nIntercity bus service \n(K.T.E.L.).\nThere is a coach service to \nregional areas beyond the city \nlimits, and to most areas of \ncontinental Greece as well as \nthe islands of Corfu, Zante and \nCrete; buses leave from the \nMacedonia Intercity Bus Station, \nat 244, Giannitson St. (5 km W \nof the centre) \ntel.: 2310 595.400 \nwebsite: www.ktelmacedonia.gr\nTaxi Service.\nTaxis carry taximeters which \ncalculate the fare that must be \npaid and the driver must turn \nthe meter on as soon as the \npassenger is picked up. Fare 1 \nis on from 05.00-24.00; it is \nchanged to Fare 2 from 24.00 \nto 05.00. Every taxi driver \nmust have the updated charge \nrates on display as well as any \nadditional charges.  \nRadio Taxi:  \n«Taxiway» (tel.: 18300), \n«Mercedes» (tel.: 18180), \n«Macedonia» (tel.']","['<1-hop>\n\nMUST SEE: 2.1 Railway Station. It is on Monastiriou Street which is renamed at some point Egnatia Street (see p. 34). Construction began in 1939 and it became fully operational in 1951, but it was officially 66. Vardariou Tower (Top Hane). 67. Old steam engine fronting Thessaloniki’s Railway Station.']","The Railway Station on Monastiriou Street in Thessaloniki holds significant historical importance as a key infrastructure development that reflects the city's evolution in transportation. Construction of the station began in 1939 and it became fully operational in 1951, marking a pivotal moment in Thessaloniki's connectivity with other regions of Greece and beyond. This station not only facilitated domestic travel but also served as a gateway for international connections, enhancing the city's role as a transportation hub.

The station's architectural design and operational history are emblematic of the mid-20th century, a period when Thessaloniki was modernizing and expanding its urban landscape. The establishment of the Railway Station coincided with the post-World War II reconstruction efforts, which aimed to revitalize the economy and improve infrastructure. As a result, the station became a vital link for passengers traveling to and from various destinations, including regional areas and major cities.

Moreover, the Railway Station is situated near other historical sites and monuments, such as sections of the city's west walls and the temple of Aphrodite, making it a convenient starting point for sightseeing. This proximity allows visitors to explore Thessaloniki's rich cultural heritage while utilizing modern transportation facilities.

In summary, the Railway Station on Monastiriou Street is not just a functional transit point; it symbolizes Thessaloniki's historical journey towards modernization and its ongoing development as a significant transportation center in Greece. For a first-time visitor, it offers an opportunity to appreciate both the city's past and its present, making it an essential stop for those interested in the historical context of their travels.","The Railway Station on Monastiriou Street, which was later renamed Egnatia Street, holds historical significance as its construction began in 1939 and it became fully operational in 1951. This station is a key part of Thessaloniki's transportation development, symbolizing the city's connectivity and progress in the mid-20th century. Additionally, the presence of the old steam engine in front of the station highlights the historical evolution of transportation in the area.",1.0,0.46,0.16666666666666666,0.8614130945369959,0.9999999999,0.9999999999,0.0,0.7499999990624999,,0.9316028202337922
53,What is the historical significance of the Railway Station on Monastiriou Street in Thessaloniki?,"['The road \ndistances (in km) where \nThessaloniki is the starting \npoint get calculated from  \nthis square.\n2 \t\n\x07AROUND DIMOKRATIAS \nSQUARE\nThere are mostly faceless \nbuildings in the area – \namong them you will find \nsmall manufactures or old \nindustries. However there are \nalso historic sites, as there \nare sections of the city’s west \nwalls here, Byzantine and \nottoman monuments and other \narchaeological sites (temple  \nof Aphrodite, 6th c. BC).\nMUST SEE:\n2.1  Railway Station.\nIt is on Monastiriou Street \nwhich is renamed at some \npoint Egnatia Street (see p. 34). \nConstruction began in 1939 \nand it became fully operational \nin 1951, but it was officially \n66.  \nVardariou \nTower (Top \nHane).\n67.  \nOld steam \nengine \nfronting \nThessaloniki’s \nRailway \nStation.', '59\n7th walk: \nWEST OF THE CENTRE-STAVROUPOLI\ninaugurated in 1962 (S. Molfesis, \nTh. Papagiannis). Its exterior \nside combines modern and \nclassical elements with wings \nadded on the sides. It connects \nThessaloniki with the rest of \nGreece, the Balkans and Istanbul; \nit is also the bus terminus \ntowards most of the city areas. \nThis will be the location of the \nwest metro line terminus under \nconstruction in Thessaloniki.\n2.2  Old Railway Station.\nIt was built in 1894 near the \nharbour (Old Station Street) \nin the neoclassical style, \nand it gradually connected \nThessaloniki with Skopje, \nBelgrade, Monastir and \nConstantinople (modern-day \nIstanbul). Today it is exclusively \nused as a cargo train station. \nThis is where the German \noccupation forces mustered \nabout 50,000 Jewish residents, \nfrom March until August 1943, \nin order to send them by train \noff to concentration camps.\n2.3  Top Hane (Vardariou \nTower).\nSituated where the west \nand seafront city walls used \nto meet, this Tower was built \nby the Ottomans in 1546 and \nit was known as the Armoury \nTower. It is a six-sided, three-\nstorey and 10-metre high tower \nwhich used to be the main city \nstronghold.']","['<1-hop>\n\nMUST SEE: 2.1 Railway Station. It is on Monastiriou Street which is renamed at some point Egnatia Street (see p. 34). Construction began in 1939 and it became fully operational in 1951, but it was officially 66. Vardariou Tower (Top Hane). 67. Old steam engine fronting Thessaloniki’s Railway Station.']","The Railway Station on Monastiriou Street in Thessaloniki holds significant historical importance as a key transportation hub that has shaped the city's connectivity and development. Constructed in 1939 and fully operational by 1951, the station was inaugurated during a period of modernization in Greece. It served as a vital link between Thessaloniki and various destinations across Greece, the Balkans, and Istanbul, facilitating trade and travel.

The station's architectural design reflects a blend of modern and classical elements, showcasing the evolution of railway architecture in the region. It was strategically located near the harbor, enhancing its role in connecting Thessaloniki to major cities such as Skopje, Belgrade, and Constantinople (now Istanbul). This connectivity was crucial for economic growth and cultural exchange, making the station a focal point for travelers and goods.

Moreover, the Old Railway Station has a poignant historical narrative tied to World War II. During the German occupation, it became a site of tragedy as approximately 50,000 Jewish residents were gathered here from March to August 1943 before being deported to concentration camps. This dark chapter in history adds a layer of significance to the station, reminding visitors of the impact of war on local communities.

Today, while the station primarily serves cargo trains, its historical legacy remains a point of interest for visitors. The surrounding area, including the nearby Top Hane (Vardariou Tower) and sections of the city’s west walls, offers a glimpse into Thessaloniki's rich past. For those interested in sightseeing, the Railway Station stands as a testament to the city's resilience and transformation over the decades, making it an essential stop for anyone exploring Thessaloniki's historical landscape.","The Railway Station on Monastiriou Street, which was later renamed Egnatia Street, has historical significance as its construction began in 1939 and it became fully operational in 1951. Additionally, it features the old steam engine fronting the station, which adds to its historical charm.",1.0,0.46,0.9,0.7239918737570656,0.99999999995,0.9999999999,0.0,0.8333333319444445,,0.9999995034243421
54,"What cultural heritage significance do the UNESCO World Heritage Byzantine monuments in Thessaloniki hold, and how does their history relate to the early Christian period?","['10\n1st walk: \nUNESCO BYZANTINE MONUMENTS\nThessaloniki has been  \none of the first towns to \nknow the Christian religion by \nthe Apostle Paul; during the \nByzantine period it used to be \nthe second most important \ncity of the empire (co-reigning \ncity) after Constantinople. \nAt that time (4th – 15th c.), \nChristian monuments and \nchurches were constructed in \nthe town, and these make up \na diachronic typology with a \ndecisive influence on the entire \nByzantine world. The following \nearly-Christian and Byzantine \nmonuments of the town are \nconsidered to be excellent \nspecimens of the Byzantine \nchurch-building and art, and \nfor this reason UNESCO \ndeclared them to be World \nHeritage Monuments, in 1988. \nA tour across this unique \nopen-air Byzantine museum  \nis truly a special experience.\n1 \t\x07HOLY TWELVE  \nAPOSTLES CHURCH\nOne of the town’s oldest \nchurches was built in 1310 – \n1314 under the sponsorship  \nof Patriarch Nephon I. It used \nto be a katholicon [main church] \nof a monastery dedicated to \nTheotokos [Mother of God] as \nshown by the mural depicting \nTheotokos and the Founder, \nas well as by the iconography \non the aisle with images of \nthe Holy Virgin’s life.', '72\nMUSEUMS\nby tradesmen. Aspects of \nthe Byzantine everyday life, \nart and culture are depicted, \ncovering the times from \nthe early Byzantine until \nthe post Byzantine period. \nThe exhibition is structured \nby dates, in the following \nthematic categories:\n• Early Christian or Early \nByzantine period (4th–7th c.).  \nIt includes the chapters: i. The \nEarly Christian church (room \n1) where the general shape \nand the particular elements \nof churches of that period are \ndescribed, ii) Early christian \ntown and house (room 2), \noffering some insight into \nthe public and private life of \npeople in those times and iii) \nFrom the Elysian Fields to the \nChristian Paradise (room 3) \ndealing with the burial of the \ndead and the cemeteries of \nthe early Christian period.\n• Middle Byzantine \nperiod (8th – 12th c.).']","[""<1-hop>\n\nUNESCO BYZANTINE MONUMENTS Thessaloniki has been one of the first towns to know the Christian religion by the Apostle Paul; during the Byzantine period it used to be the second most important city of the empire (co-reigning city) after Constantinople. At that time (4th – 15th c.), Christian monuments and churches were constructed in the town, and these make up a diachronic typology with a decisive influence on the entire Byzantine world. The following early-Christian and Byzantine monuments of the town are considered to be excellent specimens of the Byzantine church-building and art, and for this reason UNESCO declared them to be World Heritage Monuments, in 1988. A tour across this unique open-air Byzantine museum is truly a special experience. 1 \x07HOLY TWELVE APOSTLES CHURCH One of the town’s oldest churches was built in 1310 – 1314 under the sponsorship of Patriarch Nephon I. It used to be a katholicon [main church] of a monastery dedicated to Theotokos [Mother of God] as shown by the mural depicting Theotokos and the Founder, as well as by the iconography on the aisle with images of the Holy Virgin’s life. Out of the original monastery complex, -apart from the katholicon – there remain the NIKIS NIKIS GERMANOU SVOLOU IASONIDOU TSIMISKI VAS. IRAKLEIOU FILIPPOU AKROPOLEOS THEOTOKOPOULOU AKROPOLEOS OCHI AVENUE EPTAPYRGIOU SOFOKLEOUS OLYMPOU MONASTIRIOU KAZANTZAKI A N A G E NN I S E OS DAMONOS KALOU DRAGOUMANOU POLYTECHNIOU MITROPOLEOS ARISTOTELOUS DODEKANISOU LANGADA SALAMINOS ERMOU ANGELAKI ETHNIKIS AMYNAS AG. ANTONIOS AGIA THEODORA AG. ATHANASIOS AG. KONSTANTINOU YPAPANTI AGIOS STYLIANOS LAODI GITRIA TAXIARCHES AGIOS PAVLOS FANEROMENI AG. THEODOROI KALARI TSOPELA ISAVRON DELIOU IOANNI VELLIDI MAKRYGIANNI MITR. GENADIOU MODI PETROPOULAKIDON ARIANOU ARIANOU KLEISTHENOUS VIZYINOU KASTRON PANORMOU KES AMPATZOGLOU SKOPELOU PETRAS VASILIKO IRAKLEIAS SK SK KAVAFI ADRIANOUPOLEOS AIANT AGATHOUPOLEOS NG ROAD REDAISTO VYZOUKIDI VIZYINO THETIDOS AFXENTIOU MOUDANION PANEPISTIMIOU KALELPIDOS KONSTANTINOUPOLEOS SMYRNIS PYRGOU VRYANDOU KITROUS MELENIKOU PATR. IOAKEIM PALAION PATRON GERMANOU MICHAIL IO. ARMENOPOULOU IKTINOU KOMNINON SOLOMOU VLALI BALANOU ASKITOU VOGATSIKOU PLOUTARCHOU LASSANI MORKENTAOU TATI DRAGOUMI KYRIAKOU IOULIANOU SOKRATOUS EVRIPIDOU GYZI VLACHAVA AISCHYLOU ATHINAS MOREAS GKRATZIOU ATHONOS THEOFILOU PILEOS ANTIOCHOU VLATADON KASTOROS IGOUMENOU PERIANDROU POLYDOROU KLAFTHMONOS DRAGATSANIOU ACHTARI KARADIMOU DIONYSIOU EPIMENIDOU EVRYMEDONTOS AREOS ARTIS IRAKLIOU SYRAKOUSON PYDNAS KARAVANGELI TSAKALOF KIMONOS FLORINAS PLASTIRA FILIPPOU KLISTHENOUS FERON EVROU GKRATZIOU RAKTIVAN LAMPOUSIDI PASTER MAK KAMENIATOU PROFITI ILIA ATHINAS IFIKRATOUS PRASAKAKI STAVROU DIMOSTHENOUS KASTRITSIOU MENELAOU AMYNTA PELOPONNISOU PLATONOS DELMOUZOU AVDELA OUGKO KARATASOU KOUNTOURIOTI MIONIS CH. IATROU PAPANASTASIOU KLEISOURAS LAMPRAKI OLYMPIOU FEIDIOU FINTIA DAIDALOU VOULGAR THASO FREIDERIK NIKITARA IATRIDON THYRON KOZANIS KILKIS PONTOU NAFPLIOU VALTETSIOU KALPAKIOU LORDOU ELEFSINAS DELTA KONITSIS PLATONOS IPPOKRATOUS AGIOU DIMITRIOU VERMIOU SOUFLIOU BIZANIOU LECHO VOREIOU IPEIROU ARAP BOUBOUL KANARI KA AKI SOLOMOU LACHANA AGRAFON PSARON MIAOULI KAVALAS KRITIS LEVENTI KANARI GRAVIAS KYPROU FILIATRON ARACHTHOU TSACHILA AGRAFON KARVOUNIDI ERASMOU ELENIS KAPETAN NIKOLAOU PELOPONNISOU AGIOU PAVLOU MAKEDONOMACHON KONITSIS IKARON EL. VENIZELOU OMIROU IPEIROU KONTOSOGLOU PAPANIKOLI TEPELENIOU MEGARON VITSI KASTORIAS ARGYROKASTROU DIMITRIOU THASSOU FOKA PAPAFLESSA KOMNINON KONDYLI PANGKALOU KRITIS KRITIS EPIDAVROU LAMPRAKI CHORTIATI ELLIS ELPIDOS MAVROKORDATOU EPTAPYRGIOU EPTAPYRGIOU EPTAPYRGIOU EPTAPYRGIOU ANTHEON ATHANASIOU DIAKOU YPATROU GIALOUROU OU DODEKANISOU VAS. KONSTANTINOU MARKOU BOTSARI ANATOLIKIS ROMYLIAS U OI M R E V RIOU OPOS AISTOU DERMETZI APOLLONIADOS TYROLOIS BOROU PRIAMOU VORONOF OREIOU IPEIROU LATOMEION KATSONI ZALONGOU PAPANASTASIOU KAFKASOU METEORON KASSANDROU OLYMPIADOS A L. P A P A D O P O U L OU KASSANDROU OLYMPIADOS OLYMPOU POLYZOIDI AGIOU DIMITRIOU AGIOU DIMITRIOU AVRILIANIS ARKADIOUPOLEOS IFAISTIONOS ELPIDOS EL. VE NI ZE L O U NAVARINOU TYRNAVOU KOLOKOTRONI ARISTARCHOU KARAOLI PAPAGOU KASTAMONIS KARAVANGELI MATROZOU EVDOKIOU KESANIS KALLIKRATIAS VOULGAROKTONOU THEMISTOKLEOUS A R O G A X A N A KYPROU 28 OKTOVRIOU M. ASIAS ELLISPONTOU IT OIR U O T N U O K PARASKEVA NIGDIS ARAVYSSOU ALEXIOU TRANOU MOUSCHOUNTI KALAMPAKAS ROUZVELT ONOS SIOU OUMAN THOUKYDIDI ZARIFI SACHTOURI AKRITA KLIOS PERSEOS PYTHEOS RAKTIVAN ODYSSEOS SARAFI ETHN. ANTISTASEOS U O TIR K O M ID PARASKEVA PANIDOU OINOIS KARAOLI OLYMPOU ROMANIDI ARISTEIDOU SOULINI KRITIS DEXAMENI DIOS KALVOU EIRINIS PAPARIGOPOULOU PALAMA ZEFYRON MAVILI PINIOU GLADSTONOS THALIAS PRONOIAS SACHINI KRATEROU FILOTA SOURI ANTON SOUTSOU SYNGROU PTOLEMAION IOUSTINIANOU KARBOLA TOSITSA ZALIKI CHALKEON AMVROSIOU KRYSTALI ANTIGONIDON S T O U R N A R A MAKEDON O MACHON ELLISPONTOU LEFKOSIAS THER M OPYLON RIG A FE RAI O U KAFKASOU PANAGIAS FANEROMENIS EOS KAVAKION KORYDALLOU HMOU VOUTYRA YRILLOU PATR. FINTIA SANTAROZA SAPFOUS KARIOFYLLI AVEROF PANGAIOU AXIOU VAIOU PINDOU DOXIS VOTSI KALAPOTHAKI KATOUNI AIGYPTOU FRANGON DANAIDON AISOPOU ENOTIKON AFRODITIS NTEKA PAPATHANASIOU PAPADIMA GALANAKI IVANOF KAPATOU GDON HOUNTI CHATZITSIROU VAKCHOU STEFANAKI FARMAKI ODYSSEOS ODYSSEOS TANTALOU PROMITHEOS SAPFOUS NAVM. CHAPSA LIMNOU VALAORITI ORPHANIDI TANTALIDI OLYMPIOU DIAMANTI LOUI IPPODROMIOU NIKIFOROU DESPERE GOUNARI DIALETI DANGLI FILIKIS ETAIRIAS CHR. SMYRNIS MITR. IOSIF FOKA PANAGIA KARATZA KREMASTIS POLIORKITI SYNGROU VYRONOS AGIOS DIMITRIOS RIGA FERAIOU A R C H A I O T I T O N S E L E F K I D O N M E L E N I K O U PROX. KOROMILA PARASCHOU EPTAPYRGIO ANO POLI 40 EKKLISIES EVANGELISTRIA RIGAS FERAIOS KALLITHEA AXIOS MUNICIPAL PARK RODOCHORI EVANGELISTRIA'S CEMETERY KOLOKOTRONI TYROLOI VARNAS SQ. MOUSHOUNTI SQ. FANARIOTON SQ. ELEFTHERIAS SQ. EMPORIOU SQ. DIMOKRATIAS VARDARI SQ. KYPRION AGONISTON SQ. ARCHAIAS AG. SOFIAS AGORAS SQ. DIMITRION SQ. TERPSITHEA SQ. ROMFEI SQ. RAILWAY STATION SQ. RAILWAY ATION SQ. GALANOPOULOU SQ. SYNTRIVANIOU SQ. NAVARINOU SQ. SQ. SYKIES EAPOLI CHNI ZIDROU SQ. LYSSIATREIO AGIOS DIMITRIOS HOSPITAL GENERAL HOSPITAL OF THESSALONIKI G. GENNIMATAS U G O A 1 2 3 4 5 7 6 8 9 12 15 15 15 15 13 14 10 11 2. Southern view of Panagia Chalkeon Church. 3. Agia Sofia Church surrounded by a small garden.""]","The UNESCO World Heritage Byzantine monuments in Thessaloniki hold immense cultural heritage significance as they represent a pivotal chapter in the city’s history and the broader narrative of Byzantine art and architecture. Designated as World Heritage Monuments in 1988, these sites reflect Thessaloniki's status as a major center of Christianity during the Byzantine period, particularly from the 4th to the 15th centuries. 

Thessaloniki was one of the first cities to embrace Christianity, influenced by the Apostle Paul, and it became the second most important city of the Byzantine Empire after Constantinople. The monuments, including churches and other religious structures, showcase the evolution of Byzantine architecture and art, characterized by intricate mosaics, frescoes, and unique architectural styles that have influenced Christian buildings worldwide.

The early Christian period, spanning the 4th to the 7th centuries, is particularly significant as it marks the transition from paganism to Christianity. The monuments from this era, such as the Holy Twelve Apostles Church, exemplify the architectural innovations of the time, including the basilica layout and the use of domes. These structures not only served as places of worship but also as community centers that fostered social and cultural life.

Moreover, the thematic exhibitions in local museums, such as those detailing the early Christian church and the burial practices from the Elysian Fields to the Christian Paradise, provide deeper insights into the daily lives and beliefs of the people during this transformative period. 

Visiting these monuments offers a unique opportunity to connect with the rich history of Thessaloniki, making it an enriching experience for anyone interested in the interplay between culture, religion, and art in the context of early Christianity.","The UNESCO World Heritage Byzantine monuments in Thessaloniki are significant as they represent some of the earliest examples of Christian architecture and art, constructed during the Byzantine period when Thessaloniki was a major city of the empire. These monuments, built between the 4th and 15th centuries, reflect a diachronic typology that has had a decisive influence on the entire Byzantine world. Their historical importance is underscored by the fact that Thessaloniki was one of the first towns to embrace Christianity, as introduced by the Apostle Paul, making these monuments not only architectural treasures but also vital components of the cultural heritage that narrates the city's early Christian history.",0.75,0.49,0.6923076923076923,0.9059910428342366,0.99999999995,0.99999999995,0.0,0.18181818165289254,,0.8433143579391945
55,Can you tell me about the historical significance of Egnatia Street and its connection to the Railway Station in Thessaloniki?,"['The road \ndistances (in km) where \nThessaloniki is the starting \npoint get calculated from  \nthis square.\n2 \t\n\x07AROUND DIMOKRATIAS \nSQUARE\nThere are mostly faceless \nbuildings in the area – \namong them you will find \nsmall manufactures or old \nindustries. However there are \nalso historic sites, as there \nare sections of the city’s west \nwalls here, Byzantine and \nottoman monuments and other \narchaeological sites (temple  \nof Aphrodite, 6th c. BC).\nMUST SEE:\n2.1  Railway Station.\nIt is on Monastiriou Street \nwhich is renamed at some \npoint Egnatia Street (see p. 34). \nConstruction began in 1939 \nand it became fully operational \nin 1951, but it was officially \n66.  \nVardariou \nTower (Top \nHane).\n67.  \nOld steam \nengine \nfronting \nThessaloniki’s \nRailway \nStation.', '59\n7th walk: \nWEST OF THE CENTRE-STAVROUPOLI\ninaugurated in 1962 (S. Molfesis, \nTh. Papagiannis). Its exterior \nside combines modern and \nclassical elements with wings \nadded on the sides. It connects \nThessaloniki with the rest of \nGreece, the Balkans and Istanbul; \nit is also the bus terminus \ntowards most of the city areas. \nThis will be the location of the \nwest metro line terminus under \nconstruction in Thessaloniki.\n2.2  Old Railway Station.\nIt was built in 1894 near the \nharbour (Old Station Street) \nin the neoclassical style, \nand it gradually connected \nThessaloniki with Skopje, \nBelgrade, Monastir and \nConstantinople (modern-day \nIstanbul). Today it is exclusively \nused as a cargo train station. \nThis is where the German \noccupation forces mustered \nabout 50,000 Jewish residents, \nfrom March until August 1943, \nin order to send them by train \noff to concentration camps.\n2.3  Top Hane (Vardariou \nTower).\nSituated where the west \nand seafront city walls used \nto meet, this Tower was built \nby the Ottomans in 1546 and \nit was known as the Armoury \nTower. It is a six-sided, three-\nstorey and 10-metre high tower \nwhich used to be the main city \nstronghold.']","['<1-hop>\n\n34 1 EGNATIA STREET This central avenue has been there practically since Thessaloniki’s founding, as it is a section of the road constructed by the Romans in the 2nd c. BC, and connected Dyrrhachium (Durrës, in modern day Albania) with Constantinople. It starts at Dimokratia square (see p. 58) and ends at the TIF grounds (see p. 31) and the Aristotle University of Thessaloniki, splitting in two the town’s historic centre. It is a busy shopping area with numerous remarkable buildings of eclectic and art deco style dating to the early 20th c. (mostly old hotels) that are absolutely worth observing, as well as some of the city’s most important monuments. MUST SEE: 1.1 Kolomvou Square. The crossroads where Egnatia Street meets Antigonidon Street is indeed a bustling one! It was named after G. Colombo, an Italian who opened a hotel there in the early 20th century. This is the location of Kolomvou Archway (31, Egnatia St.) which has become a leisure hub with cafés, bars and restaurants inside. 1.2 Hamza Bey Mosque. It was built in 1467 by the daughter of Hamza Bey, the military commander of Sultan Murad II. It is the only mosque in Greece with a peristyle (a colonnaded yard). For many decades it housed a cinema named Alkazar. Currently there are renovation works under way. Once they are finished, it will house an exhibition of finds unearthed during the metro excavations. Right behind it you will see the City Manor which housed the Town Hall until recently. It is known at Karavan Serai as there used to be an ottoman inn here. (early 16th c.). 4th walk:', '<2-hop>\n\nMUST SEE: 2.1 Railway Station. It is on Monastiriou Street which is renamed at some point Egnatia Street (see p. 34). Construction began in 1939 and it became fully operational in 1951, but it was officially 66. Vardariou Tower (Top Hane). 67. Old steam engine fronting Thessaloniki’s Railway Station.']","Egnatia Street is a historically significant thoroughfare in Thessaloniki, serving as a vital artery that connects various parts of the city and facilitates access to key landmarks. Originally known as Monastiriou Street, it underwent a name change that reflects its evolving role in the city's infrastructure. The street is notable for its proximity to the Railway Station, which is a crucial transportation hub for both local and international travel.

The Railway Station, inaugurated in 1962, showcases a blend of modern and classical architectural elements. It plays a pivotal role in connecting Thessaloniki to other major cities in Greece and the Balkans, including Skopje, Belgrade, and Istanbul. This connectivity has historically positioned Thessaloniki as a significant transit point, enhancing its cultural and economic interactions with neighboring regions.

The Old Railway Station, built in 1894, further emphasizes the historical importance of this area. Initially serving as a neoclassical station near the harbor, it was instrumental in linking Thessaloniki with key destinations, including Constantinople (modern-day Istanbul). Although it now functions primarily as a cargo station, its historical context is profound, particularly during World War II when it was used by German occupation forces to transport Jewish residents to concentration camps.

Egnatia Street and the Railway Station together encapsulate the rich tapestry of Thessaloniki's history, reflecting its strategic importance as a transportation hub and its role in the broader narrative of regional connectivity. For a first-time visitor, exploring this area offers a glimpse into the city's past while providing opportunities for sightseeing and capturing Instagrammable moments amidst its historical architecture.","Egnatia Street is a central avenue in Thessaloniki that has been in existence since the city's founding, originally constructed by the Romans in the 2nd century BC. It served as a vital connection between Dyrrhachium and Constantinople. The street is notable for its eclectic and art deco buildings, as well as important monuments. The Railway Station, located on Monastiriou Street, was renamed Egnatia Street at some point. Construction of the station began in 1939, and it became fully operational in 1951. This connection highlights the historical importance of Egnatia Street as a major thoroughfare in Thessaloniki's urban landscape.",0.3333333333333333,0.31,0.4827586206896552,0.8701847445722459,0.99999999995,0.9999999999,0.0,0.6999999992999999,,0.9489420928129161
56,Wher is the Railway Stashun and wen was it built?,"['59\n7th walk: \nWEST OF THE CENTRE-STAVROUPOLI\ninaugurated in 1962 (S. Molfesis, \nTh. Papagiannis). Its exterior \nside combines modern and \nclassical elements with wings \nadded on the sides. It connects \nThessaloniki with the rest of \nGreece, the Balkans and Istanbul; \nit is also the bus terminus \ntowards most of the city areas. \nThis will be the location of the \nwest metro line terminus under \nconstruction in Thessaloniki.\n2.2  Old Railway Station.\nIt was built in 1894 near the \nharbour (Old Station Street) \nin the neoclassical style, \nand it gradually connected \nThessaloniki with Skopje, \nBelgrade, Monastir and \nConstantinople (modern-day \nIstanbul). Today it is exclusively \nused as a cargo train station. \nThis is where the German \noccupation forces mustered \nabout 50,000 Jewish residents, \nfrom March until August 1943, \nin order to send them by train \noff to concentration camps.\n2.3  Top Hane (Vardariou \nTower).\nSituated where the west \nand seafront city walls used \nto meet, this Tower was built \nby the Ottomans in 1546 and \nit was known as the Armoury \nTower. It is a six-sided, three-\nstorey and 10-metre high tower \nwhich used to be the main city \nstronghold.', 'The road \ndistances (in km) where \nThessaloniki is the starting \npoint get calculated from  \nthis square.\n2 \t\n\x07AROUND DIMOKRATIAS \nSQUARE\nThere are mostly faceless \nbuildings in the area – \namong them you will find \nsmall manufactures or old \nindustries. However there are \nalso historic sites, as there \nare sections of the city’s west \nwalls here, Byzantine and \nottoman monuments and other \narchaeological sites (temple  \nof Aphrodite, 6th c. BC).\nMUST SEE:\n2.1  Railway Station.\nIt is on Monastiriou Street \nwhich is renamed at some \npoint Egnatia Street (see p. 34). \nConstruction began in 1939 \nand it became fully operational \nin 1951, but it was officially \n66.  \nVardariou \nTower (Top \nHane).\n67.  \nOld steam \nengine \nfronting \nThessaloniki’s \nRailway \nStation.']","['<1-hop>\n\nMUST SEE: 2.1 Railway Station. It is on Monastiriou Street which is renamed at some point Egnatia Street (see p. 34). Construction began in 1939 and it became fully operational in 1951, but it was officially 66. Vardariou Tower (Top Hane). 67. Old steam engine fronting Thessaloniki’s Railway Station.']","The Railway Station in Thessaloniki is located on Monastiriou Street, which later becomes Egnatia Street. It was built in 1939 and became fully operational in 1951. This station is an important historical site, reflecting the city's architectural evolution and its role in connecting Thessaloniki with other regions.

If you're interested in sightseeing, the Railway Station is a must-visit, as it showcases a blend of modern and historical elements. While you're there, you can also explore the surrounding area, which features sections of the city's west walls, Byzantine and Ottoman monuments, and other archaeological sites, including the temple of Aphrodite from the 6th century BC.

The station is not only a functional transport hub but also a place where you can capture some Instagrammable moments, especially with its historical architecture and the old steam engine displayed in front of it. This combination of history and modernity makes it an appealing spot for a first-time visitor like yourself. Enjoy your weekend in Thessaloniki!","The Railway Station is located on Monastiriou Street, which was renamed Egnatia Street. Construction of the station began in 1939, and it became fully operational in 1951.",1.0,0.33,0.6666666666666666,0.7313119632535321,0.49999999995,0.49999999995,0.0,0.9999999980000001,,0.4228136843185771
57,Can you tell me more about the railway station and its history and how it relates to transportation in the area?,"['ARC\nAG\nDIMIT\nTERPSITHEA\nSQ.\nRAILWAY STATION\nSQ.\nOLD RAILWAY\nSTATION SQ.\nGALANOPOULOU\nSQ.\nSYKIES\nNEAPOLI\nAMPELOKIPOI\nMENEMENI\nMAKEDONOMACHON\nSQ.\nKARAOLI-DIMITRIOU SQ.\nELEFTHERIAS\nSQ.\nDROPOTAMOS\n7th walk: \nWEST OF THE CENTRE-STAVROUPOLI\n2\n3\n1\n4\n3.2\n2.2\n2.1\n4.1\n4.2\n4.3\n4.3\n4.4\n2.3\n2.4\n2.5\n2.8\n2.7 2.6\n3.1\n3.3\n1 \t\x07DIMOKRATIAS SQUARE \n(VARDARI)\nSince ancient times, this  \nhas been the most important \nentry point to Thessaloniki. \nThis relatively disadvantaged \narea is a transportation hub \nconnecting the west and \nnorthwest suburbs with the \ncity centre; there are also \nseveral hotels, small shops, \ntavernas and cafés in the \narea. In the centre of the \nsquare you will see the statue \nof King Constantine (1868-\n1923), who entered the \ncity in 1912 in his capacity \nas commander-in-chief of \nthe Greek Army. The road \ndistances (in km) where \nThessaloniki is the starting \npoint get calculated from  \nthis square.', '59\n7th walk: \nWEST OF THE CENTRE-STAVROUPOLI\ninaugurated in 1962 (S. Molfesis, \nTh. Papagiannis). Its exterior \nside combines modern and \nclassical elements with wings \nadded on the sides. It connects \nThessaloniki with the rest of \nGreece, the Balkans and Istanbul; \nit is also the bus terminus \ntowards most of the city areas. \nThis will be the location of the \nwest metro line terminus under \nconstruction in Thessaloniki.\n2.2  Old Railway Station.\nIt was built in 1894 near the \nharbour (Old Station Street) \nin the neoclassical style, \nand it gradually connected \nThessaloniki with Skopje, \nBelgrade, Monastir and \nConstantinople (modern-day \nIstanbul). Today it is exclusively \nused as a cargo train station. \nThis is where the German \noccupation forces mustered \nabout 50,000 Jewish residents, \nfrom March until August 1943, \nin order to send them by train \noff to concentration camps.\n2.3  Top Hane (Vardariou \nTower).\nSituated where the west \nand seafront city walls used \nto meet, this Tower was built \nby the Ottomans in 1546 and \nit was known as the Armoury \nTower. It is a six-sided, three-\nstorey and 10-metre high tower \nwhich used to be the main city \nstronghold.']","['<1-hop>\n\nMUST SEE: 2.1 Railway Station. It is on Monastiriou Street which is renamed at some point Egnatia Street (see p. 34). Construction began in 1939 and it became fully operational in 1951, but it was officially 66. Vardariou Tower (Top Hane). 67. Old steam engine fronting Thessaloniki’s Railway Station.']","The Old Railway Station in Thessaloniki, built in 1894, is a significant historical landmark located near the harbor on Old Station Street. Designed in a neoclassical style, it played a crucial role in connecting Thessaloniki with major cities in the Balkans, including Skopje, Belgrade, Monastir, and Constantinople (modern-day Istanbul). This station was not only a hub for passenger travel but also facilitated cargo transport, which remains its primary function today.

During World War II, the station became a site of tragedy when German occupation forces gathered approximately 50,000 Jewish residents from March to August 1943 to deport them to concentration camps. This dark chapter in its history adds a layer of significance to the station, making it a poignant place to visit.

In terms of transportation, the Old Railway Station has historically served as a vital link for travelers moving between Thessaloniki and other regions. It is complemented by the modern bus terminus nearby, which connects the city with various areas across Greece and the Balkans. Currently, the station is also set to become the terminus for the west metro line under construction, further enhancing its role in the city's transportation network.

For a solo traveler interested in sightseeing, visiting the Old Railway Station offers a glimpse into Thessaloniki's rich history and its evolution as a transportation hub. The blend of modern and historical elements in the area provides numerous opportunities for photography, making it an Instagrammable spot. Additionally, the surrounding neighborhood features local shops and cafés, allowing for interaction with the local culture, which can enrich your travel experience.","The railway station, located on Monastiriou Street, which was later renamed Egnatia Street, is a significant landmark. Construction of the station began in 1939, and it became fully operational in 1951. It is an important hub for transportation in the area, with the old steam engine in front of the station serving as a historical reminder of the railway's past in Thessaloniki.",0.25,0.4,0.9655172413793104,0.7589410125194884,0.99999999995,0.0,0.0,0.1999999996,,0.5195909340306041
58,"What historical significance does Egnatia Street hold in Thessaloniki, and what notable landmarks can be found along it?","['34\n1 \tEGNATIA STREET\nThis central avenue has \nbeen there practically since \nThessaloniki’s founding,  \nas it is a section of the road \nconstructed by the Romans  \nin the 2nd c. BC, and connected \nDyrrhachium (Durrës, in \nmodern day Albania) with \nConstantinople. It starts at \nDimokratia square (see p. 58) \nand ends at the TIF grounds \n(see p. 31) and the Aristotle \nUniversity of Thessaloniki, \nsplitting in two the town’s \nhistoric centre. It is a busy \nshopping area with numerous \nremarkable buildings of \neclectic and art deco style \ndating to the early 20th c. \n(mostly old hotels) that are \nabsolutely worth observing,  \nas well as some of the city’s \nmost important monuments.\nMUST SEE:\n1.1  Kolomvou Square.\nThe crossroads where \nEgnatia Street meets \nAntigonidon Street is indeed \na bustling one! It was named \nafter G. Colombo, an Italian \nwho opened a hotel there  \nin the early 20th century. This \nis the location of Kolomvou \nArchway (31, Egnatia St.) \nwhich has become a leisure \nhub with cafés, bars and \nrestaurants inside.\n1.2  Hamza Bey Mosque.\nIt was built in 1467 by the \ndaughter of Hamza Bey, the \nmilitary commander of Sultan \nMurad II.', '30\n3rd walk: \nHISTORIC CENTRE (2)\nMUSEUM AREA\nflats facing the adjacent \nIppodromiou square. This was \na 450 m. long and a 95 m. \nwide structure and it used to \nbe the centre of social activity \nfor citizens until 390 AD, \nwhen emperor Theodosius \nordered the massacre of \n7,000 Thessalonians there; \nthe event led to the close-\ndown of the Hippodrome. It is \nworth visiting the Thessaloniki \nHistory Centre, situated in the \nsquare’s south side as well as \nthe remarkable 18th c. Agios \nAntonios church in Margariti \nstreet nearby. \n8.7  Arched Hall.\nIt lies at the intersection  \nof Gounari and Svolou streets. \nThis was a place with heating \ninstallations for holding \nsymposia and ceremonies. \nIt had a direct access to \nthe imperial box in the \nHippodrome.\n8.8  Theatre - stadium  \nin Apellou Street.\nThe remains of a building \nhave been located at 5 & \n7 Apellou St., and they are \nconsidered to have been part \nof the theatre-stadium of the \ntown, which was in use from \nthe 1st until the 4th c. AD.  \nThere are references connecting \nthis place with the martyrdom \nof Agios Dimitrios, the city’s \npatron saint.\n9 \tTHREE CHURCHES\nOn the south side of Egnatia \nStreet, between K. Palaiologou \nSt.']","['<1-hop>\n\n34 1 EGNATIA STREET This central avenue has been there practically since Thessaloniki’s founding, as it is a section of the road constructed by the Romans in the 2nd c. BC, and connected Dyrrhachium (Durrës, in modern day Albania) with Constantinople. It starts at Dimokratia square (see p. 58) and ends at the TIF grounds (see p. 31) and the Aristotle University of Thessaloniki, splitting in two the town’s historic centre. It is a busy shopping area with numerous remarkable buildings of eclectic and art deco style dating to the early 20th c. (mostly old hotels) that are absolutely worth observing, as well as some of the city’s most important monuments. MUST SEE: 1.1 Kolomvou Square. The crossroads where Egnatia Street meets Antigonidon Street is indeed a bustling one! It was named after G. Colombo, an Italian who opened a hotel there in the early 20th century. This is the location of Kolomvou Archway (31, Egnatia St.) which has become a leisure hub with cafés, bars and restaurants inside. 1.2 Hamza Bey Mosque. It was built in 1467 by the daughter of Hamza Bey, the military commander of Sultan Murad II. It is the only mosque in Greece with a peristyle (a colonnaded yard). For many decades it housed a cinema named Alkazar. Currently there are renovation works under way. Once they are finished, it will house an exhibition of finds unearthed during the metro excavations. Right behind it you will see the City Manor which housed the Town Hall until recently. It is known at Karavan Serai as there used to be an ottoman inn here. (early 16th c.). 4th walk:']","Egnatia Street is a historically significant avenue in Thessaloniki, tracing its origins back to the Roman era in the 2nd century BC. It served as a vital connection between Dyrrhachium (modern-day Durrës in Albania) and Constantinople, playing a crucial role in the city's development and trade. Today, it divides the historic center of Thessaloniki and is a bustling hub filled with shops, cafes, and remarkable architecture.

Notable landmarks along Egnatia Street include:

1. **Kolomvou Square**: This lively crossroads is where Egnatia meets Antigonidon Street. Named after an Italian hotelier, it features the Kolomvou Archway, which has become a popular leisure spot with various dining options.

2. **Hamza Bey Mosque**: Built in 1467, this mosque was commissioned by the daughter of Hamza Bey, a military commander. It stands as a testament to the city's rich Ottoman heritage.

3. **Aristotle University of Thessaloniki**: Located at the end of Egnatia Street, this prominent university is a key educational institution in Greece and adds to the vibrant atmosphere of the area.

4. **TIF Grounds**: The Thessaloniki International Fair grounds are also situated at the end of Egnatia Street, hosting various events and exhibitions throughout the year.

As a first-time visitor, Egnatia Street offers a blend of historical significance and modern vibrancy, making it an ideal spot for sightseeing. The eclectic and art deco buildings from the early 20th century, along with the city's important monuments, provide ample opportunities for photography and social media sharing. Exploring this avenue allows for a deeper appreciation of Thessaloniki's cultural heritage while enjoying the lively local atmosphere.","Egnatia Street is historically significant as it has been a central avenue since Thessaloniki’s founding, originally constructed by the Romans in the 2nd century BC to connect Dyrrhachium with Constantinople. Along this busy shopping area, notable landmarks include Kolomvou Square, which features the Kolomvou Archway, and the Hamza Bey Mosque, built in 1467. The mosque is unique as it is the only one in Greece with a peristyle and has undergone renovations to house an exhibition of archaeological finds.",0.6666666666666666,0.59,0.52,0.8379288588420468,0.9999999999,0.9999999999,1.0,0.7272727266115702,,0.8857442344790405
59,"What is the significance of the UNESCO World Heritage status of the Byzantine monuments in Thessaloniki, and how do they reflect the cultural heritage of the Byzantine period?","['10\n1st walk: \nUNESCO BYZANTINE MONUMENTS\nThessaloniki has been  \none of the first towns to \nknow the Christian religion by \nthe Apostle Paul; during the \nByzantine period it used to be \nthe second most important \ncity of the empire (co-reigning \ncity) after Constantinople. \nAt that time (4th – 15th c.), \nChristian monuments and \nchurches were constructed in \nthe town, and these make up \na diachronic typology with a \ndecisive influence on the entire \nByzantine world. The following \nearly-Christian and Byzantine \nmonuments of the town are \nconsidered to be excellent \nspecimens of the Byzantine \nchurch-building and art, and \nfor this reason UNESCO \ndeclared them to be World \nHeritage Monuments, in 1988. \nA tour across this unique \nopen-air Byzantine museum  \nis truly a special experience.\n1 \t\x07HOLY TWELVE  \nAPOSTLES CHURCH\nOne of the town’s oldest \nchurches was built in 1310 – \n1314 under the sponsorship  \nof Patriarch Nephon I. It used \nto be a katholicon [main church] \nof a monastery dedicated to \nTheotokos [Mother of God] as \nshown by the mural depicting \nTheotokos and the Founder, \nas well as by the iconography \non the aisle with images of \nthe Holy Virgin’s life.', '6\nEver since the 4th c. BC when it was founded, \nThessaloniki has kept its urban character and has \nremained a civic centre and the hub of that region. \nThe city’s centuries-old multicultural history has been \nassociated with great empires, as it has known the \nRoman, Byzantine and Ottoman Rule. The town was also \ngreatly influenced by many ethnic and religious groups \n(Jews, Latins, Armenians and others) as well as Greeks \nfrom Constantinople, Pontus [modern-day northeastern \nTurkey] and Asia Minor [a.k.a. Anatolia]. The numerous \nmonuments, dating to many historical periods, coexist in \na singular and charming way and manifest Thessaloniki’s \nhistorical multicultural and cosmopolitan nature.\n1. \nThe White Tower \narea is one of the \nbusiest parts of \nthe city, where \nthe old seafront \n(Nikis Ave.) meets \nthe new (eastern) \nwaterfront area \nof Thessaloniki.\nDION – VERGINA – ANCIENT PELLA\nPETRALONA CAVE – LAKES AREA\nTHESSALONIKI']","[""<1-hop>\n\nUNESCO BYZANTINE MONUMENTS Thessaloniki has been one of the first towns to know the Christian religion by the Apostle Paul; during the Byzantine period it used to be the second most important city of the empire (co-reigning city) after Constantinople. At that time (4th – 15th c.), Christian monuments and churches were constructed in the town, and these make up a diachronic typology with a decisive influence on the entire Byzantine world. The following early-Christian and Byzantine monuments of the town are considered to be excellent specimens of the Byzantine church-building and art, and for this reason UNESCO declared them to be World Heritage Monuments, in 1988. A tour across this unique open-air Byzantine museum is truly a special experience. 1 \x07HOLY TWELVE APOSTLES CHURCH One of the town’s oldest churches was built in 1310 – 1314 under the sponsorship of Patriarch Nephon I. It used to be a katholicon [main church] of a monastery dedicated to Theotokos [Mother of God] as shown by the mural depicting Theotokos and the Founder, as well as by the iconography on the aisle with images of the Holy Virgin’s life. Out of the original monastery complex, -apart from the katholicon – there remain the NIKIS NIKIS GERMANOU SVOLOU IASONIDOU TSIMISKI VAS. IRAKLEIOU FILIPPOU AKROPOLEOS THEOTOKOPOULOU AKROPOLEOS OCHI AVENUE EPTAPYRGIOU SOFOKLEOUS OLYMPOU MONASTIRIOU KAZANTZAKI A N A G E NN I S E OS DAMONOS KALOU DRAGOUMANOU POLYTECHNIOU MITROPOLEOS ARISTOTELOUS DODEKANISOU LANGADA SALAMINOS ERMOU ANGELAKI ETHNIKIS AMYNAS AG. ANTONIOS AGIA THEODORA AG. ATHANASIOS AG. KONSTANTINOU YPAPANTI AGIOS STYLIANOS LAODI GITRIA TAXIARCHES AGIOS PAVLOS FANEROMENI AG. THEODOROI KALARI TSOPELA ISAVRON DELIOU IOANNI VELLIDI MAKRYGIANNI MITR. GENADIOU MODI PETROPOULAKIDON ARIANOU ARIANOU KLEISTHENOUS VIZYINOU KASTRON PANORMOU KES AMPATZOGLOU SKOPELOU PETRAS VASILIKO IRAKLEIAS SK SK KAVAFI ADRIANOUPOLEOS AIANT AGATHOUPOLEOS NG ROAD REDAISTO VYZOUKIDI VIZYINO THETIDOS AFXENTIOU MOUDANION PANEPISTIMIOU KALELPIDOS KONSTANTINOUPOLEOS SMYRNIS PYRGOU VRYANDOU KITROUS MELENIKOU PATR. IOAKEIM PALAION PATRON GERMANOU MICHAIL IO. ARMENOPOULOU IKTINOU KOMNINON SOLOMOU VLALI BALANOU ASKITOU VOGATSIKOU PLOUTARCHOU LASSANI MORKENTAOU TATI DRAGOUMI KYRIAKOU IOULIANOU SOKRATOUS EVRIPIDOU GYZI VLACHAVA AISCHYLOU ATHINAS MOREAS GKRATZIOU ATHONOS THEOFILOU PILEOS ANTIOCHOU VLATADON KASTOROS IGOUMENOU PERIANDROU POLYDOROU KLAFTHMONOS DRAGATSANIOU ACHTARI KARADIMOU DIONYSIOU EPIMENIDOU EVRYMEDONTOS AREOS ARTIS IRAKLIOU SYRAKOUSON PYDNAS KARAVANGELI TSAKALOF KIMONOS FLORINAS PLASTIRA FILIPPOU KLISTHENOUS FERON EVROU GKRATZIOU RAKTIVAN LAMPOUSIDI PASTER MAK KAMENIATOU PROFITI ILIA ATHINAS IFIKRATOUS PRASAKAKI STAVROU DIMOSTHENOUS KASTRITSIOU MENELAOU AMYNTA PELOPONNISOU PLATONOS DELMOUZOU AVDELA OUGKO KARATASOU KOUNTOURIOTI MIONIS CH. IATROU PAPANASTASIOU KLEISOURAS LAMPRAKI OLYMPIOU FEIDIOU FINTIA DAIDALOU VOULGAR THASO FREIDERIK NIKITARA IATRIDON THYRON KOZANIS KILKIS PONTOU NAFPLIOU VALTETSIOU KALPAKIOU LORDOU ELEFSINAS DELTA KONITSIS PLATONOS IPPOKRATOUS AGIOU DIMITRIOU VERMIOU SOUFLIOU BIZANIOU LECHO VOREIOU IPEIROU ARAP BOUBOUL KANARI KA AKI SOLOMOU LACHANA AGRAFON PSARON MIAOULI KAVALAS KRITIS LEVENTI KANARI GRAVIAS KYPROU FILIATRON ARACHTHOU TSACHILA AGRAFON KARVOUNIDI ERASMOU ELENIS KAPETAN NIKOLAOU PELOPONNISOU AGIOU PAVLOU MAKEDONOMACHON KONITSIS IKARON EL. VENIZELOU OMIROU IPEIROU KONTOSOGLOU PAPANIKOLI TEPELENIOU MEGARON VITSI KASTORIAS ARGYROKASTROU DIMITRIOU THASSOU FOKA PAPAFLESSA KOMNINON KONDYLI PANGKALOU KRITIS KRITIS EPIDAVROU LAMPRAKI CHORTIATI ELLIS ELPIDOS MAVROKORDATOU EPTAPYRGIOU EPTAPYRGIOU EPTAPYRGIOU EPTAPYRGIOU ANTHEON ATHANASIOU DIAKOU YPATROU GIALOUROU OU DODEKANISOU VAS. KONSTANTINOU MARKOU BOTSARI ANATOLIKIS ROMYLIAS U OI M R E V RIOU OPOS AISTOU DERMETZI APOLLONIADOS TYROLOIS BOROU PRIAMOU VORONOF OREIOU IPEIROU LATOMEION KATSONI ZALONGOU PAPANASTASIOU KAFKASOU METEORON KASSANDROU OLYMPIADOS A L. P A P A D O P O U L OU KASSANDROU OLYMPIADOS OLYMPOU POLYZOIDI AGIOU DIMITRIOU AGIOU DIMITRIOU AVRILIANIS ARKADIOUPOLEOS IFAISTIONOS ELPIDOS EL. VE NI ZE L O U NAVARINOU TYRNAVOU KOLOKOTRONI ARISTARCHOU KARAOLI PAPAGOU KASTAMONIS KARAVANGELI MATROZOU EVDOKIOU KESANIS KALLIKRATIAS VOULGAROKTONOU THEMISTOKLEOUS A R O G A X A N A KYPROU 28 OKTOVRIOU M. ASIAS ELLISPONTOU IT OIR U O T N U O K PARASKEVA NIGDIS ARAVYSSOU ALEXIOU TRANOU MOUSCHOUNTI KALAMPAKAS ROUZVELT ONOS SIOU OUMAN THOUKYDIDI ZARIFI SACHTOURI AKRITA KLIOS PERSEOS PYTHEOS RAKTIVAN ODYSSEOS SARAFI ETHN. ANTISTASEOS U O TIR K O M ID PARASKEVA PANIDOU OINOIS KARAOLI OLYMPOU ROMANIDI ARISTEIDOU SOULINI KRITIS DEXAMENI DIOS KALVOU EIRINIS PAPARIGOPOULOU PALAMA ZEFYRON MAVILI PINIOU GLADSTONOS THALIAS PRONOIAS SACHINI KRATEROU FILOTA SOURI ANTON SOUTSOU SYNGROU PTOLEMAION IOUSTINIANOU KARBOLA TOSITSA ZALIKI CHALKEON AMVROSIOU KRYSTALI ANTIGONIDON S T O U R N A R A MAKEDON O MACHON ELLISPONTOU LEFKOSIAS THER M OPYLON RIG A FE RAI O U KAFKASOU PANAGIAS FANEROMENIS EOS KAVAKION KORYDALLOU HMOU VOUTYRA YRILLOU PATR. FINTIA SANTAROZA SAPFOUS KARIOFYLLI AVEROF PANGAIOU AXIOU VAIOU PINDOU DOXIS VOTSI KALAPOTHAKI KATOUNI AIGYPTOU FRANGON DANAIDON AISOPOU ENOTIKON AFRODITIS NTEKA PAPATHANASIOU PAPADIMA GALANAKI IVANOF KAPATOU GDON HOUNTI CHATZITSIROU VAKCHOU STEFANAKI FARMAKI ODYSSEOS ODYSSEOS TANTALOU PROMITHEOS SAPFOUS NAVM. CHAPSA LIMNOU VALAORITI ORPHANIDI TANTALIDI OLYMPIOU DIAMANTI LOUI IPPODROMIOU NIKIFOROU DESPERE GOUNARI DIALETI DANGLI FILIKIS ETAIRIAS CHR. SMYRNIS MITR. IOSIF FOKA PANAGIA KARATZA KREMASTIS POLIORKITI SYNGROU VYRONOS AGIOS DIMITRIOS RIGA FERAIOU A R C H A I O T I T O N S E L E F K I D O N M E L E N I K O U PROX. KOROMILA PARASCHOU EPTAPYRGIO ANO POLI 40 EKKLISIES EVANGELISTRIA RIGAS FERAIOS KALLITHEA AXIOS MUNICIPAL PARK RODOCHORI EVANGELISTRIA'S CEMETERY KOLOKOTRONI TYROLOI VARNAS SQ. MOUSHOUNTI SQ. FANARIOTON SQ. ELEFTHERIAS SQ. EMPORIOU SQ. DIMOKRATIAS VARDARI SQ. KYPRION AGONISTON SQ. ARCHAIAS AG. SOFIAS AGORAS SQ. DIMITRION SQ. TERPSITHEA SQ. ROMFEI SQ. RAILWAY STATION SQ. RAILWAY ATION SQ. GALANOPOULOU SQ. SYNTRIVANIOU SQ. NAVARINOU SQ. SQ. SYKIES EAPOLI CHNI ZIDROU SQ. LYSSIATREIO AGIOS DIMITRIOS HOSPITAL GENERAL HOSPITAL OF THESSALONIKI G. GENNIMATAS U G O A 1 2 3 4 5 7 6 8 9 12 15 15 15 15 13 14 10 11 2. Southern view of Panagia Chalkeon Church. 3. Agia Sofia Church surrounded by a small garden.""]","The UNESCO World Heritage status of the Byzantine monuments in Thessaloniki signifies their outstanding universal value and importance to the cultural heritage of humanity. Declared in 1988, these monuments represent a remarkable legacy of Byzantine architecture and art, showcasing the city’s historical significance as a major center of Christianity and culture during the Byzantine period (4th – 15th centuries).

Thessaloniki was a pivotal city in the Byzantine Empire, second only to Constantinople. The monuments, including churches and other religious structures, reflect the architectural innovations and artistic expressions of the time. They embody a unique blend of early Christian and Byzantine styles, characterized by intricate mosaics, frescoes, and distinctive architectural elements such as domes and arches. This rich artistic heritage not only highlights the religious devotion of the era but also illustrates the city’s role as a melting pot of cultures, influenced by various ethnic and religious groups.

Visiting these UNESCO sites offers a profound insight into the city’s multicultural history, where monuments coexist harmoniously, telling stories of the diverse communities that have shaped Thessaloniki. The Holy Twelve Apostles Church, for instance, built under the sponsorship of Patriarch Nephon I, is a prime example of Byzantine ecclesiastical architecture, adorned with significant iconography that reflects the theological and artistic values of the period.

For a solo traveler interested in sightseeing, exploring these monuments provides an opportunity to engage with the local culture and history. The open-air museum experience allows for Instagrammable moments, capturing the beauty of the architecture and the vibrant atmosphere of the city. Overall, the UNESCO designation not only preserves these historical treasures but also promotes awareness and appreciation of Thessaloniki’s rich Byzantine heritage, making it a must-visit destination for those seeking to connect with the past.","The UNESCO World Heritage status of the Byzantine monuments in Thessaloniki signifies their outstanding universal value and importance in representing the cultural heritage of the Byzantine period. These monuments, constructed between the 4th and 15th centuries, showcase a diachronic typology of Christian architecture and art that had a decisive influence on the entire Byzantine world. The early-Christian and Byzantine monuments, such as the Holy Twelve Apostles Church, are considered excellent specimens of Byzantine church-building, reflecting the rich cultural heritage and historical significance of Thessaloniki as a major city during the Byzantine Empire.",1.0,0.54,0.5,0.8830864722127019,0.9999999999,0.9999999999,0.0,0.29999999969999996,,0.9459456858938912
60,Whaht is the hstory of the Railway Station in Thessaloniki and when did it become fully operational?,"['59\n7th walk: \nWEST OF THE CENTRE-STAVROUPOLI\ninaugurated in 1962 (S. Molfesis, \nTh. Papagiannis). Its exterior \nside combines modern and \nclassical elements with wings \nadded on the sides. It connects \nThessaloniki with the rest of \nGreece, the Balkans and Istanbul; \nit is also the bus terminus \ntowards most of the city areas. \nThis will be the location of the \nwest metro line terminus under \nconstruction in Thessaloniki.\n2.2  Old Railway Station.\nIt was built in 1894 near the \nharbour (Old Station Street) \nin the neoclassical style, \nand it gradually connected \nThessaloniki with Skopje, \nBelgrade, Monastir and \nConstantinople (modern-day \nIstanbul). Today it is exclusively \nused as a cargo train station. \nThis is where the German \noccupation forces mustered \nabout 50,000 Jewish residents, \nfrom March until August 1943, \nin order to send them by train \noff to concentration camps.\n2.3  Top Hane (Vardariou \nTower).\nSituated where the west \nand seafront city walls used \nto meet, this Tower was built \nby the Ottomans in 1546 and \nit was known as the Armoury \nTower. It is a six-sided, three-\nstorey and 10-metre high tower \nwhich used to be the main city \nstronghold.', 'The road \ndistances (in km) where \nThessaloniki is the starting \npoint get calculated from  \nthis square.\n2 \t\n\x07AROUND DIMOKRATIAS \nSQUARE\nThere are mostly faceless \nbuildings in the area – \namong them you will find \nsmall manufactures or old \nindustries. However there are \nalso historic sites, as there \nare sections of the city’s west \nwalls here, Byzantine and \nottoman monuments and other \narchaeological sites (temple  \nof Aphrodite, 6th c. BC).\nMUST SEE:\n2.1  Railway Station.\nIt is on Monastiriou Street \nwhich is renamed at some \npoint Egnatia Street (see p. 34). \nConstruction began in 1939 \nand it became fully operational \nin 1951, but it was officially \n66.  \nVardariou \nTower (Top \nHane).\n67.  \nOld steam \nengine \nfronting \nThessaloniki’s \nRailway \nStation.']","['<1-hop>\n\nMUST SEE: 2.1 Railway Station. It is on Monastiriou Street which is renamed at some point Egnatia Street (see p. 34). Construction began in 1939 and it became fully operational in 1951, but it was officially 66. Vardariou Tower (Top Hane). 67. Old steam engine fronting Thessaloniki’s Railway Station.']","The Railway Station in Thessaloniki, located on Monastiriou Street (which later became Egnatia Street), has a rich history that reflects the city's development and its connections to the wider region. Construction of the station began in 1939, and it became fully operational in 1951. The station was designed in a neoclassical style, embodying the architectural trends of the time.

Initially, the station served as a vital hub, connecting Thessaloniki with key cities in the Balkans, including Skopje, Belgrade, and Monastir, as well as Constantinople (modern-day Istanbul). This connectivity was crucial for trade and travel, especially during the early to mid-20th century. The station played a significant role during World War II, as it was used by German occupation forces to gather approximately 50,000 Jewish residents from March to August 1943, who were then deported to concentration camps.

Over the years, the Railway Station has transitioned from a bustling passenger hub to a facility primarily serving cargo trains. Despite this change, it remains an important historical landmark in Thessaloniki, symbolizing the city’s past and its connections to various regions.

For visitors interested in history and architecture, the Railway Station is a noteworthy site, showcasing the evolution of transportation in Thessaloniki and its impact on the city's development. The station's neoclassical design and historical significance make it an intriguing stop for those exploring the city.","The Railway Station in Thessaloniki, located on Monastiriou Street (which was renamed Egnatia Street), began construction in 1939 and became fully operational in 1951. Additionally, it features the Old steam engine fronting the station, which adds to its historical significance.",0.5,0.45,0.4838709677419355,0.8723033474319688,0.99999999995,0.49999999995,0.0,0.8571428559183674,,0.8578896894276755
61,"What historical significance does Egnatia Street hold in Thessaloniki, and what notable landmarks can be found along it?","['34\n1 \tEGNATIA STREET\nThis central avenue has \nbeen there practically since \nThessaloniki’s founding,  \nas it is a section of the road \nconstructed by the Romans  \nin the 2nd c. BC, and connected \nDyrrhachium (Durrës, in \nmodern day Albania) with \nConstantinople. It starts at \nDimokratia square (see p. 58) \nand ends at the TIF grounds \n(see p. 31) and the Aristotle \nUniversity of Thessaloniki, \nsplitting in two the town’s \nhistoric centre. It is a busy \nshopping area with numerous \nremarkable buildings of \neclectic and art deco style \ndating to the early 20th c. \n(mostly old hotels) that are \nabsolutely worth observing,  \nas well as some of the city’s \nmost important monuments.\nMUST SEE:\n1.1  Kolomvou Square.\nThe crossroads where \nEgnatia Street meets \nAntigonidon Street is indeed \na bustling one! It was named \nafter G. Colombo, an Italian \nwho opened a hotel there  \nin the early 20th century. This \nis the location of Kolomvou \nArchway (31, Egnatia St.) \nwhich has become a leisure \nhub with cafés, bars and \nrestaurants inside.\n1.2  Hamza Bey Mosque.\nIt was built in 1467 by the \ndaughter of Hamza Bey, the \nmilitary commander of Sultan \nMurad II.', 'The monumental style of \narchitecture is shown in the \nbuildings’ facades, colonnades, \narcades and porticos, which \ncombine elements from the \ncity’s Byzantine tradition \nwith European interwar \nperiod motifs. The square is \nlandmarked by two identical \nconcave buildings: Electra \nPalace hotel (late sixties) - \nbuilt by GNTO architects -  \non the west side, and Olympion \non the east side, which was \nprogressively erected and \ncompleted by the late fifties \n(designed by J. Moshé) \nand is now the seat of the \nThessaloniki Film Festival  \n(see p. 108).\nMUST SEE:\n1.1  Aristotelous Street.\nPedestrianised historic \nboulevard, that ends in Egnatia \nStreet (see p. 34). According \nto the Hébrard plans, it would \n2nd walk: \nHISTORIC CENTRE (1) \nTRADITIONAL COMMERCIAL CENTRE\n4.1\n6.1\n6.3\n6.2\n6.5\n6.6\n6.7\n1.1\n1.2\n6.8\n7.5\n7.3\n7.2\n7.2\n7.1\n7.4\n6.4\n3.1\n1\n2\n3\n4\n5\n7']","['<1-hop>\n\n34 1 EGNATIA STREET This central avenue has been there practically since Thessaloniki’s founding, as it is a section of the road constructed by the Romans in the 2nd c. BC, and connected Dyrrhachium (Durrës, in modern day Albania) with Constantinople. It starts at Dimokratia square (see p. 58) and ends at the TIF grounds (see p. 31) and the Aristotle University of Thessaloniki, splitting in two the town’s historic centre. It is a busy shopping area with numerous remarkable buildings of eclectic and art deco style dating to the early 20th c. (mostly old hotels) that are absolutely worth observing, as well as some of the city’s most important monuments. MUST SEE: 1.1 Kolomvou Square. The crossroads where Egnatia Street meets Antigonidon Street is indeed a bustling one! It was named after G. Colombo, an Italian who opened a hotel there in the early 20th century. This is the location of Kolomvou Archway (31, Egnatia St.) which has become a leisure hub with cafés, bars and restaurants inside. 1.2 Hamza Bey Mosque. It was built in 1467 by the daughter of Hamza Bey, the military commander of Sultan Murad II. It is the only mosque in Greece with a peristyle (a colonnaded yard). For many decades it housed a cinema named Alkazar. Currently there are renovation works under way. Once they are finished, it will house an exhibition of finds unearthed during the metro excavations. Right behind it you will see the City Manor which housed the Town Hall until recently. It is known at Karavan Serai as there used to be an ottoman inn here. (early 16th c.). 4th walk:']","Egnatia Street is a historically significant avenue in Thessaloniki, tracing its origins back to the Roman era in the 2nd century BC. It served as a vital connection between Dyrrhachium (modern-day Durrës, Albania) and Constantinople, making it an essential route for trade and travel throughout history. Today, Egnatia Street divides the city’s historic center and is a bustling commercial area, rich in architectural heritage.

Notable landmarks along Egnatia Street include:

1. **Kolomvou Square**: This lively crossroads is where Egnatia Street intersects with Antigonidon Street. It features the Kolomvou Archway, a popular leisure hub filled with cafés, bars, and restaurants, making it an ideal spot for socializing and enjoying local cuisine.

2. **Hamza Bey Mosque**: Built in 1467, this mosque is a significant historical site, constructed by the daughter of Hamza Bey, a military commander of Sultan Murad II. Its architecture reflects the city's Ottoman past and is a must-visit for those interested in the diverse cultural influences that have shaped Thessaloniki.

3. **Electra Palace Hotel**: Located on the west side of Aristotelous Square, this hotel showcases monumental architecture from the late sixties, designed by GNTO architects. It is a prominent landmark that adds to the square's grandeur.

4. **Olympion**: Situated on the east side of Aristotelous Square, this building was completed in the late fifties and is now home to the Thessaloniki Film Festival. Its design by J. Moshé highlights the blend of modern and historical influences in the city.

Exploring Egnatia Street offers a unique opportunity to appreciate Thessaloniki's rich history while enjoying its vibrant atmosphere, making it an excellent choice for sightseeing and local interaction.","Egnatia Street is historically significant as it has been a central avenue since the founding of Thessaloniki, originally constructed by the Romans in the 2nd century BC to connect Dyrrhachium with Constantinople. Along this busy shopping area, notable landmarks include Kolomvou Square, which features the Kolomvou Archway, and the Hamza Bey Mosque, built in 1467. The mosque is unique as it is the only one in Greece with a peristyle and has undergone renovations to house an exhibition of archaeological finds.",0.6666666666666666,0.49,0.6,0.867914494637745,0.9999999999,0.9999999999,1.0,0.7272727266115702,,0.8727488375326042
62,What is the historical significance of Egnatia Street and how does it relate to the Railway Station in Thessaloniki?,"['The road \ndistances (in km) where \nThessaloniki is the starting \npoint get calculated from  \nthis square.\n2 \t\n\x07AROUND DIMOKRATIAS \nSQUARE\nThere are mostly faceless \nbuildings in the area – \namong them you will find \nsmall manufactures or old \nindustries. However there are \nalso historic sites, as there \nare sections of the city’s west \nwalls here, Byzantine and \nottoman monuments and other \narchaeological sites (temple  \nof Aphrodite, 6th c. BC).\nMUST SEE:\n2.1  Railway Station.\nIt is on Monastiriou Street \nwhich is renamed at some \npoint Egnatia Street (see p. 34). \nConstruction began in 1939 \nand it became fully operational \nin 1951, but it was officially \n66.  \nVardariou \nTower (Top \nHane).\n67.  \nOld steam \nengine \nfronting \nThessaloniki’s \nRailway \nStation.', '59\n7th walk: \nWEST OF THE CENTRE-STAVROUPOLI\ninaugurated in 1962 (S. Molfesis, \nTh. Papagiannis). Its exterior \nside combines modern and \nclassical elements with wings \nadded on the sides. It connects \nThessaloniki with the rest of \nGreece, the Balkans and Istanbul; \nit is also the bus terminus \ntowards most of the city areas. \nThis will be the location of the \nwest metro line terminus under \nconstruction in Thessaloniki.\n2.2  Old Railway Station.\nIt was built in 1894 near the \nharbour (Old Station Street) \nin the neoclassical style, \nand it gradually connected \nThessaloniki with Skopje, \nBelgrade, Monastir and \nConstantinople (modern-day \nIstanbul). Today it is exclusively \nused as a cargo train station. \nThis is where the German \noccupation forces mustered \nabout 50,000 Jewish residents, \nfrom March until August 1943, \nin order to send them by train \noff to concentration camps.\n2.3  Top Hane (Vardariou \nTower).\nSituated where the west \nand seafront city walls used \nto meet, this Tower was built \nby the Ottomans in 1546 and \nit was known as the Armoury \nTower. It is a six-sided, three-\nstorey and 10-metre high tower \nwhich used to be the main city \nstronghold.']","['<1-hop>\n\n34 1 EGNATIA STREET This central avenue has been there practically since Thessaloniki’s founding, as it is a section of the road constructed by the Romans in the 2nd c. BC, and connected Dyrrhachium (Durrës, in modern day Albania) with Constantinople. It starts at Dimokratia square (see p. 58) and ends at the TIF grounds (see p. 31) and the Aristotle University of Thessaloniki, splitting in two the town’s historic centre. It is a busy shopping area with numerous remarkable buildings of eclectic and art deco style dating to the early 20th c. (mostly old hotels) that are absolutely worth observing, as well as some of the city’s most important monuments. MUST SEE: 1.1 Kolomvou Square. The crossroads where Egnatia Street meets Antigonidon Street is indeed a bustling one! It was named after G. Colombo, an Italian who opened a hotel there in the early 20th century. This is the location of Kolomvou Archway (31, Egnatia St.) which has become a leisure hub with cafés, bars and restaurants inside. 1.2 Hamza Bey Mosque. It was built in 1467 by the daughter of Hamza Bey, the military commander of Sultan Murad II. It is the only mosque in Greece with a peristyle (a colonnaded yard). For many decades it housed a cinema named Alkazar. Currently there are renovation works under way. Once they are finished, it will house an exhibition of finds unearthed during the metro excavations. Right behind it you will see the City Manor which housed the Town Hall until recently. It is known at Karavan Serai as there used to be an ottoman inn here. (early 16th c.). 4th walk:', '<2-hop>\n\nMUST SEE: 2.1 Railway Station. It is on Monastiriou Street which is renamed at some point Egnatia Street (see p. 34). Construction began in 1939 and it became fully operational in 1951, but it was officially 66. Vardariou Tower (Top Hane). 67. Old steam engine fronting Thessaloniki’s Railway Station.']","Egnatia Street holds significant historical importance in Thessaloniki as it has been a central thoroughfare since ancient times, serving as a vital route for trade and communication. Originally part of the Via Egnatia, a Roman road that connected the Adriatic Sea to Byzantium (modern-day Istanbul), it facilitated the movement of goods and people across the region, linking Thessaloniki to various cities in the Balkans and beyond.

The Railway Station, located on Monastiriou Street, which later becomes Egnatia Street, further enhances the historical narrative of this area. Opened in 1951, the station was built to connect Thessaloniki with other major cities, including Skopje, Belgrade, and Istanbul. Its neoclassical architecture reflects the city's rich cultural heritage and its role as a transportation hub. The station was crucial during the 20th century, especially during the German occupation in World War II, when it was used to deport thousands of Jewish residents to concentration camps.

Egnatia Street's evolution from an ancient trade route to a modern urban artery mirrors the development of Thessaloniki itself. The street not only serves as a physical connection between historical sites and contemporary life but also embodies the city's resilience and adaptability through various historical phases. 

For a solo traveler interested in sightseeing, Egnatia Street and the Railway Station offer a blend of historical significance and modern-day relevance, making them ideal spots for exploration. The area is rich in Instagrammable moments, from the architectural beauty of the station to the remnants of the city's past along the street. Engaging with locals and experiencing the vibrant atmosphere of Egnatia Street can provide deeper insights into Thessaloniki's cultural landscape, enhancing your travel experience.","Egnatia Street is a central avenue in Thessaloniki that has been in existence since the city's founding, originally constructed by the Romans in the 2nd century BC to connect Dyrrhachium with Constantinople. It features a busy shopping area with notable buildings and important monuments. The Railway Station, located on Monastiriou Street, which was renamed Egnatia Street, began construction in 1939 and became operational in 1951. This connection highlights the evolution of Egnatia Street as it transformed from an ancient Roman road to a modern thoroughfare that includes significant transportation infrastructure.",0.25,0.47,0.2413793103448276,0.8557776104702183,0.99999999995,0.9999999999,0.0,0.6363636357851239,,0.89040089576217
63,"What is the historical significance of the Railway Station on Monastiriou Street in Thessaloniki, and how does it relate to the city's transportation development?","['The road \ndistances (in km) where \nThessaloniki is the starting \npoint get calculated from  \nthis square.\n2 \t\n\x07AROUND DIMOKRATIAS \nSQUARE\nThere are mostly faceless \nbuildings in the area – \namong them you will find \nsmall manufactures or old \nindustries. However there are \nalso historic sites, as there \nare sections of the city’s west \nwalls here, Byzantine and \nottoman monuments and other \narchaeological sites (temple  \nof Aphrodite, 6th c. BC).\nMUST SEE:\n2.1  Railway Station.\nIt is on Monastiriou Street \nwhich is renamed at some \npoint Egnatia Street (see p. 34). \nConstruction began in 1939 \nand it became fully operational \nin 1951, but it was officially \n66.  \nVardariou \nTower (Top \nHane).\n67.  \nOld steam \nengine \nfronting \nThessaloniki’s \nRailway \nStation.', 'ARC\nAG\nDIMIT\nTERPSITHEA\nSQ.\nRAILWAY STATION\nSQ.\nOLD RAILWAY\nSTATION SQ.\nGALANOPOULOU\nSQ.\nSYKIES\nNEAPOLI\nAMPELOKIPOI\nMENEMENI\nMAKEDONOMACHON\nSQ.\nKARAOLI-DIMITRIOU SQ.\nELEFTHERIAS\nSQ.\nDROPOTAMOS\n7th walk: \nWEST OF THE CENTRE-STAVROUPOLI\n2\n3\n1\n4\n3.2\n2.2\n2.1\n4.1\n4.2\n4.3\n4.3\n4.4\n2.3\n2.4\n2.5\n2.8\n2.7 2.6\n3.1\n3.3\n1 \t\x07DIMOKRATIAS SQUARE \n(VARDARI)\nSince ancient times, this  \nhas been the most important \nentry point to Thessaloniki. \nThis relatively disadvantaged \narea is a transportation hub \nconnecting the west and \nnorthwest suburbs with the \ncity centre; there are also \nseveral hotels, small shops, \ntavernas and cafés in the \narea. In the centre of the \nsquare you will see the statue \nof King Constantine (1868-\n1923), who entered the \ncity in 1912 in his capacity \nas commander-in-chief of \nthe Greek Army. The road \ndistances (in km) where \nThessaloniki is the starting \npoint get calculated from  \nthis square.']","['<1-hop>\n\nMUST SEE: 2.1 Railway Station. It is on Monastiriou Street which is renamed at some point Egnatia Street (see p. 34). Construction began in 1939 and it became fully operational in 1951, but it was officially 66. Vardariou Tower (Top Hane). 67. Old steam engine fronting Thessaloniki’s Railway Station.']","The Railway Station on Monastiriou Street in Thessaloniki holds significant historical importance as a key transportation hub that has shaped the city's connectivity and development. Construction of the station began in 1939 and it became fully operational in 1951, marking a pivotal moment in Thessaloniki's transportation infrastructure. The station not only facilitated the movement of people and goods but also symbolized the modernization of the city post-World War II.

Historically, the Railway Station served as a critical entry point for travelers, linking Thessaloniki to other regions and enhancing its role as a commercial and cultural center. Its strategic location on Monastiriou Street, which later transitions into Egnatia Street, underscores its importance in the urban layout and transportation network of the city. This area has been a transportation hub since ancient times, and the station continues to be a vital connection point for both local and international travel.

The station is also surrounded by various historical and cultural sites, making it an ideal starting point for sightseeing. Visitors can explore nearby attractions, including sections of the city's ancient walls and Byzantine monuments, enriching their understanding of Thessaloniki's rich history. The presence of the old steam engine in front of the station serves as a nostalgic reminder of the city's railway heritage.

For a first-time visitor, the Railway Station not only offers practical travel options but also provides an opportunity to engage with the local culture and history. Its significance extends beyond mere transportation; it represents the evolution of Thessaloniki as a vibrant urban center, making it a noteworthy stop for anyone interested in the city's past and its ongoing development.","The Railway Station on Monastiriou Street, which was later renamed Egnatia Street, holds historical significance as its construction began in 1939 and it became fully operational in 1951. This station is a key part of Thessaloniki's transportation development, symbolizing the city's connectivity and progress in the mid-20th century. Additionally, the presence of the old steam engine in front of the station highlights the historical evolution of transportation in the area.",0.3333333333333333,0.71,0.39285714285714285,0.8804892804383633,0.99999999995,0.9999999999,0.0,0.7499999990624999,,0.9316067108153283
64,"What historical significance does Egnatia Street hold in Thessaloniki, and what notable landmarks can be found along this avenue?","['34\n1 \tEGNATIA STREET\nThis central avenue has \nbeen there practically since \nThessaloniki’s founding,  \nas it is a section of the road \nconstructed by the Romans  \nin the 2nd c. BC, and connected \nDyrrhachium (Durrës, in \nmodern day Albania) with \nConstantinople. It starts at \nDimokratia square (see p. 58) \nand ends at the TIF grounds \n(see p. 31) and the Aristotle \nUniversity of Thessaloniki, \nsplitting in two the town’s \nhistoric centre. It is a busy \nshopping area with numerous \nremarkable buildings of \neclectic and art deco style \ndating to the early 20th c. \n(mostly old hotels) that are \nabsolutely worth observing,  \nas well as some of the city’s \nmost important monuments.\nMUST SEE:\n1.1  Kolomvou Square.\nThe crossroads where \nEgnatia Street meets \nAntigonidon Street is indeed \na bustling one! It was named \nafter G. Colombo, an Italian \nwho opened a hotel there  \nin the early 20th century. This \nis the location of Kolomvou \nArchway (31, Egnatia St.) \nwhich has become a leisure \nhub with cafés, bars and \nrestaurants inside.\n1.2  Hamza Bey Mosque.\nIt was built in 1467 by the \ndaughter of Hamza Bey, the \nmilitary commander of Sultan \nMurad II.', '30\n3rd walk: \nHISTORIC CENTRE (2)\nMUSEUM AREA\nflats facing the adjacent \nIppodromiou square. This was \na 450 m. long and a 95 m. \nwide structure and it used to \nbe the centre of social activity \nfor citizens until 390 AD, \nwhen emperor Theodosius \nordered the massacre of \n7,000 Thessalonians there; \nthe event led to the close-\ndown of the Hippodrome. It is \nworth visiting the Thessaloniki \nHistory Centre, situated in the \nsquare’s south side as well as \nthe remarkable 18th c. Agios \nAntonios church in Margariti \nstreet nearby. \n8.7  Arched Hall.\nIt lies at the intersection  \nof Gounari and Svolou streets. \nThis was a place with heating \ninstallations for holding \nsymposia and ceremonies. \nIt had a direct access to \nthe imperial box in the \nHippodrome.\n8.8  Theatre - stadium  \nin Apellou Street.\nThe remains of a building \nhave been located at 5 & \n7 Apellou St., and they are \nconsidered to have been part \nof the theatre-stadium of the \ntown, which was in use from \nthe 1st until the 4th c. AD.  \nThere are references connecting \nthis place with the martyrdom \nof Agios Dimitrios, the city’s \npatron saint.\n9 \tTHREE CHURCHES\nOn the south side of Egnatia \nStreet, between K. Palaiologou \nSt.']","['<1-hop>\n\n34 1 EGNATIA STREET This central avenue has been there practically since Thessaloniki’s founding, as it is a section of the road constructed by the Romans in the 2nd c. BC, and connected Dyrrhachium (Durrës, in modern day Albania) with Constantinople. It starts at Dimokratia square (see p. 58) and ends at the TIF grounds (see p. 31) and the Aristotle University of Thessaloniki, splitting in two the town’s historic centre. It is a busy shopping area with numerous remarkable buildings of eclectic and art deco style dating to the early 20th c. (mostly old hotels) that are absolutely worth observing, as well as some of the city’s most important monuments. MUST SEE: 1.1 Kolomvou Square. The crossroads where Egnatia Street meets Antigonidon Street is indeed a bustling one! It was named after G. Colombo, an Italian who opened a hotel there in the early 20th century. This is the location of Kolomvou Archway (31, Egnatia St.) which has become a leisure hub with cafés, bars and restaurants inside. 1.2 Hamza Bey Mosque. It was built in 1467 by the daughter of Hamza Bey, the military commander of Sultan Murad II. It is the only mosque in Greece with a peristyle (a colonnaded yard). For many decades it housed a cinema named Alkazar. Currently there are renovation works under way. Once they are finished, it will house an exhibition of finds unearthed during the metro excavations. Right behind it you will see the City Manor which housed the Town Hall until recently. It is known at Karavan Serai as there used to be an ottoman inn here. (early 16th c.). 4th walk:']","Egnatia Street is a historically significant avenue in Thessaloniki, tracing its origins back to the Roman era in the 2nd century BC. It served as a vital connection between Dyrrhachium (modern-day Durrës in Albania) and Constantinople, making it a crucial route for trade and travel. Today, Egnatia Street splits the historic center of Thessaloniki and is a bustling hub of activity, lined with eclectic and art deco buildings from the early 20th century, including notable old hotels.

As you explore Egnatia Street, several landmarks stand out:

1. **Kolomvou Square**: This lively crossroads where Egnatia meets Antigonidon Street is named after G. Colombo, an Italian hotelier. The square features the Kolomvou Archway and is a popular leisure spot filled with cafés, bars, and restaurants, perfect for enjoying local cuisine and people-watching.

2. **Hamza Bey Mosque**: Built in 1467, this mosque was commissioned by the daughter of Hamza Bey, a military commander. It represents the city's rich Ottoman heritage and is an important historical site worth visiting.

3. **Arched Hall**: Located at the intersection of Gounari and Svolou streets, this structure was once a venue for social gatherings and ceremonies, showcasing the city's ancient architectural prowess.

4. **Theatre-Stadium in Apellou Street**: The remains of this ancient building, located at 5 & 7 Apellou St., are believed to have been part of the town's theatre-stadium, in use from the 1st to the 4th century AD. It is linked to the martyrdom of Agios Dimitrios, Thessaloniki's patron saint.

Egnatia Street not only offers a glimpse into Thessaloniki's past but also provides numerous opportunities for sightseeing and capturing Instagrammable moments, making it an ideal destination for a weekend visit.","Egnatia Street is historically significant as it has been a central avenue since the founding of Thessaloniki, originally constructed by the Romans in the 2nd century BC. It connected Dyrrhachium (modern-day Durrës, Albania) with Constantinople. Along this busy shopping area, notable landmarks include Kolomvou Square, which features the Kolomvou Archway, a leisure hub with cafés and restaurants, and the Hamza Bey Mosque, built in 1467, which is unique for its peristyle and currently undergoing renovations to house an exhibition of archaeological finds.",0.75,0.61,0.7666666666666667,0.8605985552055553,0.99999999995,0.9999999999,1.0,0.7692307686390532,,0.8664669834094861
65,"What are the UNESCO World Heritage sites in Thessaloniki that reflect its cultural heritage, particularly during the Byzantine period?","['10\n1st walk: \nUNESCO BYZANTINE MONUMENTS\nThessaloniki has been  \none of the first towns to \nknow the Christian religion by \nthe Apostle Paul; during the \nByzantine period it used to be \nthe second most important \ncity of the empire (co-reigning \ncity) after Constantinople. \nAt that time (4th – 15th c.), \nChristian monuments and \nchurches were constructed in \nthe town, and these make up \na diachronic typology with a \ndecisive influence on the entire \nByzantine world. The following \nearly-Christian and Byzantine \nmonuments of the town are \nconsidered to be excellent \nspecimens of the Byzantine \nchurch-building and art, and \nfor this reason UNESCO \ndeclared them to be World \nHeritage Monuments, in 1988. \nA tour across this unique \nopen-air Byzantine museum  \nis truly a special experience.\n1 \t\x07HOLY TWELVE  \nAPOSTLES CHURCH\nOne of the town’s oldest \nchurches was built in 1310 – \n1314 under the sponsorship  \nof Patriarch Nephon I. It used \nto be a katholicon [main church] \nof a monastery dedicated to \nTheotokos [Mother of God] as \nshown by the mural depicting \nTheotokos and the Founder, \nas well as by the iconography \non the aisle with images of \nthe Holy Virgin’s life.', 'It was \nsituated in the centre of \nthe area which was called \n“Macedonian Land” by \nHerodotus [an ancient Greek \nHistorian]. The first magnificent \npalaces of the Macedonian \nKings were built here and \nthe foundations of the great \nMacedon State were laid at \nthat time. It was the sacred \ntown of the Macedonians \nand remained so after the \n5th c. BC as Aiges was the \nplace of origin of the Royal \nHouse of Argeades whose \nmembers were thought to be \ndescendants of the House \nof Timenides and Hercules. \nIn 168 BC the town was \ndestroyed by the Romans and \nfinally got deserted in the 1st \nc. AD. On the grounds of its \nimportance, the archaeological \nsite has been included in the \nUNESCO World Heritage List \nas a Multiple Thematic Focus \nMuseum.\nMUST SEE:\nRoyal Tombs. In 1977, \nthe archaeologist Manolis \nAndronikos unearthed the \nroyal tombs inside a big earth \nmound (Megali Toumpa - \nGreat Tumulus). The tombs \nand the mound interior have \nbeen restructured into an \namazing museum where the \n99\n100']","[""<1-hop>\n\nUNESCO BYZANTINE MONUMENTS Thessaloniki has been one of the first towns to know the Christian religion by the Apostle Paul; during the Byzantine period it used to be the second most important city of the empire (co-reigning city) after Constantinople. At that time (4th – 15th c.), Christian monuments and churches were constructed in the town, and these make up a diachronic typology with a decisive influence on the entire Byzantine world. The following early-Christian and Byzantine monuments of the town are considered to be excellent specimens of the Byzantine church-building and art, and for this reason UNESCO declared them to be World Heritage Monuments, in 1988. A tour across this unique open-air Byzantine museum is truly a special experience. 1 \x07HOLY TWELVE APOSTLES CHURCH One of the town’s oldest churches was built in 1310 – 1314 under the sponsorship of Patriarch Nephon I. It used to be a katholicon [main church] of a monastery dedicated to Theotokos [Mother of God] as shown by the mural depicting Theotokos and the Founder, as well as by the iconography on the aisle with images of the Holy Virgin’s life. Out of the original monastery complex, -apart from the katholicon – there remain the NIKIS NIKIS GERMANOU SVOLOU IASONIDOU TSIMISKI VAS. IRAKLEIOU FILIPPOU AKROPOLEOS THEOTOKOPOULOU AKROPOLEOS OCHI AVENUE EPTAPYRGIOU SOFOKLEOUS OLYMPOU MONASTIRIOU KAZANTZAKI A N A G E NN I S E OS DAMONOS KALOU DRAGOUMANOU POLYTECHNIOU MITROPOLEOS ARISTOTELOUS DODEKANISOU LANGADA SALAMINOS ERMOU ANGELAKI ETHNIKIS AMYNAS AG. ANTONIOS AGIA THEODORA AG. ATHANASIOS AG. KONSTANTINOU YPAPANTI AGIOS STYLIANOS LAODI GITRIA TAXIARCHES AGIOS PAVLOS FANEROMENI AG. THEODOROI KALARI TSOPELA ISAVRON DELIOU IOANNI VELLIDI MAKRYGIANNI MITR. GENADIOU MODI PETROPOULAKIDON ARIANOU ARIANOU KLEISTHENOUS VIZYINOU KASTRON PANORMOU KES AMPATZOGLOU SKOPELOU PETRAS VASILIKO IRAKLEIAS SK SK KAVAFI ADRIANOUPOLEOS AIANT AGATHOUPOLEOS NG ROAD REDAISTO VYZOUKIDI VIZYINO THETIDOS AFXENTIOU MOUDANION PANEPISTIMIOU KALELPIDOS KONSTANTINOUPOLEOS SMYRNIS PYRGOU VRYANDOU KITROUS MELENIKOU PATR. IOAKEIM PALAION PATRON GERMANOU MICHAIL IO. ARMENOPOULOU IKTINOU KOMNINON SOLOMOU VLALI BALANOU ASKITOU VOGATSIKOU PLOUTARCHOU LASSANI MORKENTAOU TATI DRAGOUMI KYRIAKOU IOULIANOU SOKRATOUS EVRIPIDOU GYZI VLACHAVA AISCHYLOU ATHINAS MOREAS GKRATZIOU ATHONOS THEOFILOU PILEOS ANTIOCHOU VLATADON KASTOROS IGOUMENOU PERIANDROU POLYDOROU KLAFTHMONOS DRAGATSANIOU ACHTARI KARADIMOU DIONYSIOU EPIMENIDOU EVRYMEDONTOS AREOS ARTIS IRAKLIOU SYRAKOUSON PYDNAS KARAVANGELI TSAKALOF KIMONOS FLORINAS PLASTIRA FILIPPOU KLISTHENOUS FERON EVROU GKRATZIOU RAKTIVAN LAMPOUSIDI PASTER MAK KAMENIATOU PROFITI ILIA ATHINAS IFIKRATOUS PRASAKAKI STAVROU DIMOSTHENOUS KASTRITSIOU MENELAOU AMYNTA PELOPONNISOU PLATONOS DELMOUZOU AVDELA OUGKO KARATASOU KOUNTOURIOTI MIONIS CH. IATROU PAPANASTASIOU KLEISOURAS LAMPRAKI OLYMPIOU FEIDIOU FINTIA DAIDALOU VOULGAR THASO FREIDERIK NIKITARA IATRIDON THYRON KOZANIS KILKIS PONTOU NAFPLIOU VALTETSIOU KALPAKIOU LORDOU ELEFSINAS DELTA KONITSIS PLATONOS IPPOKRATOUS AGIOU DIMITRIOU VERMIOU SOUFLIOU BIZANIOU LECHO VOREIOU IPEIROU ARAP BOUBOUL KANARI KA AKI SOLOMOU LACHANA AGRAFON PSARON MIAOULI KAVALAS KRITIS LEVENTI KANARI GRAVIAS KYPROU FILIATRON ARACHTHOU TSACHILA AGRAFON KARVOUNIDI ERASMOU ELENIS KAPETAN NIKOLAOU PELOPONNISOU AGIOU PAVLOU MAKEDONOMACHON KONITSIS IKARON EL. VENIZELOU OMIROU IPEIROU KONTOSOGLOU PAPANIKOLI TEPELENIOU MEGARON VITSI KASTORIAS ARGYROKASTROU DIMITRIOU THASSOU FOKA PAPAFLESSA KOMNINON KONDYLI PANGKALOU KRITIS KRITIS EPIDAVROU LAMPRAKI CHORTIATI ELLIS ELPIDOS MAVROKORDATOU EPTAPYRGIOU EPTAPYRGIOU EPTAPYRGIOU EPTAPYRGIOU ANTHEON ATHANASIOU DIAKOU YPATROU GIALOUROU OU DODEKANISOU VAS. KONSTANTINOU MARKOU BOTSARI ANATOLIKIS ROMYLIAS U OI M R E V RIOU OPOS AISTOU DERMETZI APOLLONIADOS TYROLOIS BOROU PRIAMOU VORONOF OREIOU IPEIROU LATOMEION KATSONI ZALONGOU PAPANASTASIOU KAFKASOU METEORON KASSANDROU OLYMPIADOS A L. P A P A D O P O U L OU KASSANDROU OLYMPIADOS OLYMPOU POLYZOIDI AGIOU DIMITRIOU AGIOU DIMITRIOU AVRILIANIS ARKADIOUPOLEOS IFAISTIONOS ELPIDOS EL. VE NI ZE L O U NAVARINOU TYRNAVOU KOLOKOTRONI ARISTARCHOU KARAOLI PAPAGOU KASTAMONIS KARAVANGELI MATROZOU EVDOKIOU KESANIS KALLIKRATIAS VOULGAROKTONOU THEMISTOKLEOUS A R O G A X A N A KYPROU 28 OKTOVRIOU M. ASIAS ELLISPONTOU IT OIR U O T N U O K PARASKEVA NIGDIS ARAVYSSOU ALEXIOU TRANOU MOUSCHOUNTI KALAMPAKAS ROUZVELT ONOS SIOU OUMAN THOUKYDIDI ZARIFI SACHTOURI AKRITA KLIOS PERSEOS PYTHEOS RAKTIVAN ODYSSEOS SARAFI ETHN. ANTISTASEOS U O TIR K O M ID PARASKEVA PANIDOU OINOIS KARAOLI OLYMPOU ROMANIDI ARISTEIDOU SOULINI KRITIS DEXAMENI DIOS KALVOU EIRINIS PAPARIGOPOULOU PALAMA ZEFYRON MAVILI PINIOU GLADSTONOS THALIAS PRONOIAS SACHINI KRATEROU FILOTA SOURI ANTON SOUTSOU SYNGROU PTOLEMAION IOUSTINIANOU KARBOLA TOSITSA ZALIKI CHALKEON AMVROSIOU KRYSTALI ANTIGONIDON S T O U R N A R A MAKEDON O MACHON ELLISPONTOU LEFKOSIAS THER M OPYLON RIG A FE RAI O U KAFKASOU PANAGIAS FANEROMENIS EOS KAVAKION KORYDALLOU HMOU VOUTYRA YRILLOU PATR. FINTIA SANTAROZA SAPFOUS KARIOFYLLI AVEROF PANGAIOU AXIOU VAIOU PINDOU DOXIS VOTSI KALAPOTHAKI KATOUNI AIGYPTOU FRANGON DANAIDON AISOPOU ENOTIKON AFRODITIS NTEKA PAPATHANASIOU PAPADIMA GALANAKI IVANOF KAPATOU GDON HOUNTI CHATZITSIROU VAKCHOU STEFANAKI FARMAKI ODYSSEOS ODYSSEOS TANTALOU PROMITHEOS SAPFOUS NAVM. CHAPSA LIMNOU VALAORITI ORPHANIDI TANTALIDI OLYMPIOU DIAMANTI LOUI IPPODROMIOU NIKIFOROU DESPERE GOUNARI DIALETI DANGLI FILIKIS ETAIRIAS CHR. SMYRNIS MITR. IOSIF FOKA PANAGIA KARATZA KREMASTIS POLIORKITI SYNGROU VYRONOS AGIOS DIMITRIOS RIGA FERAIOU A R C H A I O T I T O N S E L E F K I D O N M E L E N I K O U PROX. KOROMILA PARASCHOU EPTAPYRGIO ANO POLI 40 EKKLISIES EVANGELISTRIA RIGAS FERAIOS KALLITHEA AXIOS MUNICIPAL PARK RODOCHORI EVANGELISTRIA'S CEMETERY KOLOKOTRONI TYROLOI VARNAS SQ. MOUSHOUNTI SQ. FANARIOTON SQ. ELEFTHERIAS SQ. EMPORIOU SQ. DIMOKRATIAS VARDARI SQ. KYPRION AGONISTON SQ. ARCHAIAS AG. SOFIAS AGORAS SQ. DIMITRION SQ. TERPSITHEA SQ. ROMFEI SQ. RAILWAY STATION SQ. RAILWAY ATION SQ. GALANOPOULOU SQ. SYNTRIVANIOU SQ. NAVARINOU SQ. SQ. SYKIES EAPOLI CHNI ZIDROU SQ. LYSSIATREIO AGIOS DIMITRIOS HOSPITAL GENERAL HOSPITAL OF THESSALONIKI G. GENNIMATAS U G O A 1 2 3 4 5 7 6 8 9 12 15 15 15 15 13 14 10 11 2. Southern view of Panagia Chalkeon Church. 3. Agia Sofia Church surrounded by a small garden.""]","Thessaloniki is home to several UNESCO World Heritage sites that showcase its rich cultural heritage, particularly from the Byzantine period. Here are some key sites to explore:

1. **The Church of the Holy Twelve Apostles**: Built between 1310 and 1314, this church is one of the oldest in Thessaloniki. It was constructed under the sponsorship of Patriarch Nephon I and served as the main church of a monastery dedicated to the Theotokos (Mother of God). The church features stunning murals and iconography that depict the life of the Holy Virgin, making it a significant example of Byzantine art and architecture.

2. **The Rotunda**: Originally built as a mausoleum for Emperor Galerius in the early 4th century, the Rotunda later served as a church and then a mosque. Its massive structure and impressive mosaics reflect the architectural grandeur of the Byzantine era.

3. **The Church of Saint Demetrius**: This church is dedicated to the patron saint of Thessaloniki and is renowned for its beautiful mosaics and historical significance. It has been a place of worship since the early Christian period and is a prime example of Byzantine ecclesiastical architecture.

4. **The Byzantine Walls**: These ancient fortifications date back to the 4th century and provide a glimpse into the city's defensive architecture. Walking along the walls offers stunning views of Thessaloniki and the sea.

5. **The Church of the Acheiropoietos**: This church, built in the 5th century, is one of the oldest in the city and features remarkable mosaics and a unique architectural style that reflects the early Byzantine period.

Exploring these sites will provide you with a deep appreciation of Thessaloniki's Byzantine heritage, making your visit both enriching and memorable. Each location offers unique opportunities for photography and local interaction, enhancing your overall experience in this historic city.","Thessaloniki is home to several UNESCO World Heritage sites that reflect its rich cultural heritage, particularly from the Byzantine period. The city was one of the first to embrace Christianity, and during the Byzantine era, it became the second most important city of the empire after Constantinople. Notable monuments include the Holy Twelve Apostles Church, built between 1310 and 1314, which served as the main church of a monastery dedicated to Theotokos. These early-Christian and Byzantine monuments are considered excellent specimens of Byzantine church-building and art, leading to their designation as World Heritage Monuments by UNESCO in 1988.",1.0,0.35,0.40625,0.8324133859161342,0.99999999995,0.9999999999,0.0,0.7692307686390532,,0.8605481325451318
66,"What is the historical significance of the Railway Station on Monastiriou Street in Thessaloniki, and how does it relate to the transportation infrastructure in the city?","['The road \ndistances (in km) where \nThessaloniki is the starting \npoint get calculated from  \nthis square.\n2 \t\n\x07AROUND DIMOKRATIAS \nSQUARE\nThere are mostly faceless \nbuildings in the area – \namong them you will find \nsmall manufactures or old \nindustries. However there are \nalso historic sites, as there \nare sections of the city’s west \nwalls here, Byzantine and \nottoman monuments and other \narchaeological sites (temple  \nof Aphrodite, 6th c. BC).\nMUST SEE:\n2.1  Railway Station.\nIt is on Monastiriou Street \nwhich is renamed at some \npoint Egnatia Street (see p. 34). \nConstruction began in 1939 \nand it became fully operational \nin 1951, but it was officially \n66.  \nVardariou \nTower (Top \nHane).\n67.  \nOld steam \nengine \nfronting \nThessaloniki’s \nRailway \nStation.', '59\n7th walk: \nWEST OF THE CENTRE-STAVROUPOLI\ninaugurated in 1962 (S. Molfesis, \nTh. Papagiannis). Its exterior \nside combines modern and \nclassical elements with wings \nadded on the sides. It connects \nThessaloniki with the rest of \nGreece, the Balkans and Istanbul; \nit is also the bus terminus \ntowards most of the city areas. \nThis will be the location of the \nwest metro line terminus under \nconstruction in Thessaloniki.\n2.2  Old Railway Station.\nIt was built in 1894 near the \nharbour (Old Station Street) \nin the neoclassical style, \nand it gradually connected \nThessaloniki with Skopje, \nBelgrade, Monastir and \nConstantinople (modern-day \nIstanbul). Today it is exclusively \nused as a cargo train station. \nThis is where the German \noccupation forces mustered \nabout 50,000 Jewish residents, \nfrom March until August 1943, \nin order to send them by train \noff to concentration camps.\n2.3  Top Hane (Vardariou \nTower).\nSituated where the west \nand seafront city walls used \nto meet, this Tower was built \nby the Ottomans in 1546 and \nit was known as the Armoury \nTower. It is a six-sided, three-\nstorey and 10-metre high tower \nwhich used to be the main city \nstronghold.']","['<1-hop>\n\nMUST SEE: 2.1 Railway Station. It is on Monastiriou Street which is renamed at some point Egnatia Street (see p. 34). Construction began in 1939 and it became fully operational in 1951, but it was officially 66. Vardariou Tower (Top Hane). 67. Old steam engine fronting Thessaloniki’s Railway Station.']","The Railway Station on Monastiriou Street in Thessaloniki holds significant historical and cultural importance. Constructed in 1894 in a neoclassical style, it was pivotal in connecting Thessaloniki to major cities in the Balkans, including Skopje, Belgrade, and Constantinople (modern-day Istanbul). This connectivity facilitated trade, travel, and cultural exchange, making the station a crucial hub in the region's transportation infrastructure.

The station's role evolved over time, especially during the German occupation in World War II, when it became a site of tragedy. Approximately 50,000 Jewish residents were gathered here from March to August 1943 before being deported to concentration camps. This dark chapter in history adds a layer of significance to the station, marking it as a site of remembrance and reflection.

Today, the Old Railway Station is primarily used as a cargo train station, but its historical architecture and the stories it holds make it an important landmark for visitors. The station's location near the harbor also highlights its strategic importance in facilitating both passenger and freight transport, contributing to Thessaloniki's development as a key economic center in Greece.

For a first-time visitor, especially one interested in sightseeing and local history, the Railway Station offers a glimpse into the city's past and its evolution over the years. Exploring this site can provide valuable insights into Thessaloniki's role in regional transportation and its historical context, making it a worthwhile stop during your visit. The blend of historical significance and architectural beauty makes the Railway Station an Instagrammable spot, appealing to those looking to capture the essence of Thessaloniki's rich heritage.","The Railway Station on Monastiriou Street, which was renamed Egnatia Street, holds historical significance as its construction began in 1939 and it became fully operational in 1951. This station is a key part of Thessaloniki's transportation infrastructure, symbolizing the city's connectivity and development in the mid-20th century. Additionally, it features an old steam engine in front, which adds to its historical charm and reflects the evolution of transportation in the region.",1.0,0.49,0.5666666666666667,0.8051231452426939,0.99999999995,0.9999999999,0.0,0.7499999990624999,,0.9290241498461763
67,What is the historical significance of Egnatia Street in Thessaloniki and what notable sites can be found in the historic centre along this avenue?,"['34\n1 \tEGNATIA STREET\nThis central avenue has \nbeen there practically since \nThessaloniki’s founding,  \nas it is a section of the road \nconstructed by the Romans  \nin the 2nd c. BC, and connected \nDyrrhachium (Durrës, in \nmodern day Albania) with \nConstantinople. It starts at \nDimokratia square (see p. 58) \nand ends at the TIF grounds \n(see p. 31) and the Aristotle \nUniversity of Thessaloniki, \nsplitting in two the town’s \nhistoric centre. It is a busy \nshopping area with numerous \nremarkable buildings of \neclectic and art deco style \ndating to the early 20th c. \n(mostly old hotels) that are \nabsolutely worth observing,  \nas well as some of the city’s \nmost important monuments.\nMUST SEE:\n1.1  Kolomvou Square.\nThe crossroads where \nEgnatia Street meets \nAntigonidon Street is indeed \na bustling one! It was named \nafter G. Colombo, an Italian \nwho opened a hotel there  \nin the early 20th century. This \nis the location of Kolomvou \nArchway (31, Egnatia St.) \nwhich has become a leisure \nhub with cafés, bars and \nrestaurants inside.\n1.2  Hamza Bey Mosque.\nIt was built in 1467 by the \ndaughter of Hamza Bey, the \nmilitary commander of Sultan \nMurad II.', 'The monumental style of \narchitecture is shown in the \nbuildings’ facades, colonnades, \narcades and porticos, which \ncombine elements from the \ncity’s Byzantine tradition \nwith European interwar \nperiod motifs. The square is \nlandmarked by two identical \nconcave buildings: Electra \nPalace hotel (late sixties) - \nbuilt by GNTO architects -  \non the west side, and Olympion \non the east side, which was \nprogressively erected and \ncompleted by the late fifties \n(designed by J. Moshé) \nand is now the seat of the \nThessaloniki Film Festival  \n(see p. 108).\nMUST SEE:\n1.1  Aristotelous Street.\nPedestrianised historic \nboulevard, that ends in Egnatia \nStreet (see p. 34). According \nto the Hébrard plans, it would \n2nd walk: \nHISTORIC CENTRE (1) \nTRADITIONAL COMMERCIAL CENTRE\n4.1\n6.1\n6.3\n6.2\n6.5\n6.6\n6.7\n1.1\n1.2\n6.8\n7.5\n7.3\n7.2\n7.2\n7.1\n7.4\n6.4\n3.1\n1\n2\n3\n4\n5\n7']","['<1-hop>\n\n34 1 EGNATIA STREET This central avenue has been there practically since Thessaloniki’s founding, as it is a section of the road constructed by the Romans in the 2nd c. BC, and connected Dyrrhachium (Durrës, in modern day Albania) with Constantinople. It starts at Dimokratia square (see p. 58) and ends at the TIF grounds (see p. 31) and the Aristotle University of Thessaloniki, splitting in two the town’s historic centre. It is a busy shopping area with numerous remarkable buildings of eclectic and art deco style dating to the early 20th c. (mostly old hotels) that are absolutely worth observing, as well as some of the city’s most important monuments. MUST SEE: 1.1 Kolomvou Square. The crossroads where Egnatia Street meets Antigonidon Street is indeed a bustling one! It was named after G. Colombo, an Italian who opened a hotel there in the early 20th century. This is the location of Kolomvou Archway (31, Egnatia St.) which has become a leisure hub with cafés, bars and restaurants inside. 1.2 Hamza Bey Mosque. It was built in 1467 by the daughter of Hamza Bey, the military commander of Sultan Murad II. It is the only mosque in Greece with a peristyle (a colonnaded yard). For many decades it housed a cinema named Alkazar. Currently there are renovation works under way. Once they are finished, it will house an exhibition of finds unearthed during the metro excavations. Right behind it you will see the City Manor which housed the Town Hall until recently. It is known at Karavan Serai as there used to be an ottoman inn here. (early 16th c.). 4th walk:']","Egnatia Street holds significant historical importance as it has been a central thoroughfare in Thessaloniki since the city’s founding. Originally constructed by the Romans in the 2nd century BC, it served as a vital connection between Dyrrhachium (modern-day Durrës, Albania) and Constantinople. This avenue not only facilitates movement through the city but also divides Thessaloniki's historic center, making it a focal point for both locals and visitors.

As a solo traveler interested in sightseeing, you will find several notable sites along Egnatia Street. One of the must-see locations is Kolomvou Square, a vibrant crossroads where Egnatia meets Antigonidon Street. This area is lively, featuring the Kolomvou Archway, which has transformed into a leisure hub with various cafés, bars, and restaurants, perfect for enjoying local flavors and capturing Instagrammable moments.

Another significant site is the Hamza Bey Mosque, built in 1467. This historical mosque reflects the city’s rich cultural tapestry and offers insight into Thessaloniki's Ottoman past. The architecture and ambiance provide excellent opportunities for photography and local interaction.

Additionally, Egnatia Street leads to the bustling shopping district filled with eclectic and art deco buildings from the early 20th century, including old hotels that are worth observing. The street culminates at the TIF grounds and the Aristotle University of Thessaloniki, further enriching your experience with the city's educational and cultural heritage.

Exploring Egnatia Street and its surroundings will not only satisfy your sightseeing interests but also immerse you in the local culture, making your first visit to Thessaloniki memorable.","Egnatia Street is historically significant as it has been a central avenue since the founding of Thessaloniki, being part of the Roman road constructed in the 2nd century BC that connected Dyrrhachium with Constantinople. This street splits the town’s historic centre and is a busy shopping area featuring remarkable buildings of eclectic and art deco style from the early 20th century. Notable sites along Egnatia Street include Kolomvou Square, a bustling crossroads with cafés and restaurants, and the Hamza Bey Mosque, built in 1467, which is the only mosque in Greece with a peristyle. The mosque is currently undergoing renovations to house an exhibition of archaeological finds.",0.75,0.68,1.0,0.8731981826274671,0.9999999999,0.9999999999,1.0,0.5833333328472222,,0.8369023307376903
68,Wht is the hstory of Egnatia Street in Thessaloniki and what are some must-see places along it?,"['34\n1 \tEGNATIA STREET\nThis central avenue has \nbeen there practically since \nThessaloniki’s founding,  \nas it is a section of the road \nconstructed by the Romans  \nin the 2nd c. BC, and connected \nDyrrhachium (Durrës, in \nmodern day Albania) with \nConstantinople. It starts at \nDimokratia square (see p. 58) \nand ends at the TIF grounds \n(see p. 31) and the Aristotle \nUniversity of Thessaloniki, \nsplitting in two the town’s \nhistoric centre. It is a busy \nshopping area with numerous \nremarkable buildings of \neclectic and art deco style \ndating to the early 20th c. \n(mostly old hotels) that are \nabsolutely worth observing,  \nas well as some of the city’s \nmost important monuments.\nMUST SEE:\n1.1  Kolomvou Square.\nThe crossroads where \nEgnatia Street meets \nAntigonidon Street is indeed \na bustling one! It was named \nafter G. Colombo, an Italian \nwho opened a hotel there  \nin the early 20th century. This \nis the location of Kolomvou \nArchway (31, Egnatia St.) \nwhich has become a leisure \nhub with cafés, bars and \nrestaurants inside.\n1.2  Hamza Bey Mosque.\nIt was built in 1467 by the \ndaughter of Hamza Bey, the \nmilitary commander of Sultan \nMurad II.', 'The monumental style of \narchitecture is shown in the \nbuildings’ facades, colonnades, \narcades and porticos, which \ncombine elements from the \ncity’s Byzantine tradition \nwith European interwar \nperiod motifs. The square is \nlandmarked by two identical \nconcave buildings: Electra \nPalace hotel (late sixties) - \nbuilt by GNTO architects -  \non the west side, and Olympion \non the east side, which was \nprogressively erected and \ncompleted by the late fifties \n(designed by J. Moshé) \nand is now the seat of the \nThessaloniki Film Festival  \n(see p. 108).\nMUST SEE:\n1.1  Aristotelous Street.\nPedestrianised historic \nboulevard, that ends in Egnatia \nStreet (see p. 34). According \nto the Hébrard plans, it would \n2nd walk: \nHISTORIC CENTRE (1) \nTRADITIONAL COMMERCIAL CENTRE\n4.1\n6.1\n6.3\n6.2\n6.5\n6.6\n6.7\n1.1\n1.2\n6.8\n7.5\n7.3\n7.2\n7.2\n7.1\n7.4\n6.4\n3.1\n1\n2\n3\n4\n5\n7']","['<1-hop>\n\n34 1 EGNATIA STREET This central avenue has been there practically since Thessaloniki’s founding, as it is a section of the road constructed by the Romans in the 2nd c. BC, and connected Dyrrhachium (Durrës, in modern day Albania) with Constantinople. It starts at Dimokratia square (see p. 58) and ends at the TIF grounds (see p. 31) and the Aristotle University of Thessaloniki, splitting in two the town’s historic centre. It is a busy shopping area with numerous remarkable buildings of eclectic and art deco style dating to the early 20th c. (mostly old hotels) that are absolutely worth observing, as well as some of the city’s most important monuments. MUST SEE: 1.1 Kolomvou Square. The crossroads where Egnatia Street meets Antigonidon Street is indeed a bustling one! It was named after G. Colombo, an Italian who opened a hotel there in the early 20th century. This is the location of Kolomvou Archway (31, Egnatia St.) which has become a leisure hub with cafés, bars and restaurants inside. 1.2 Hamza Bey Mosque. It was built in 1467 by the daughter of Hamza Bey, the military commander of Sultan Murad II. It is the only mosque in Greece with a peristyle (a colonnaded yard). For many decades it housed a cinema named Alkazar. Currently there are renovation works under way. Once they are finished, it will house an exhibition of finds unearthed during the metro excavations. Right behind it you will see the City Manor which housed the Town Hall until recently. It is known at Karavan Serai as there used to be an ottoman inn here. (early 16th c.). 4th walk:']","Egnatia Street is a historic avenue in Thessaloniki that dates back to the city’s founding, serving as a vital route since the 2nd century BC. Originally constructed by the Romans, it connected Dyrrhachium (modern-day Durrës, Albania) to Constantinople. Today, Egnatia Street runs from Dimokratia Square to the TIF grounds and the Aristotle University of Thessaloniki, effectively splitting the city’s historic center.

As a solo traveler interested in sightseeing, Egnatia Street offers a vibrant atmosphere filled with remarkable architecture and cultural landmarks. Here are some must-see places along the street:

1. **Kolomvou Square**: This bustling crossroads is where Egnatia Street meets Antigonidon Street. Named after G. Colombo, an Italian hotelier, the square features the Kolomvou Archway and is a lively hub with numerous cafés, bars, and restaurants, perfect for enjoying local cuisine and people-watching.

2. **Hamza Bey Mosque**: Built in 1467 by the daughter of Hamza Bey, this mosque is a significant historical site that reflects the city’s rich Ottoman heritage. Its architecture is a testament to the diverse cultural influences that have shaped Thessaloniki.

3. **Electra Palace Hotel**: Located on the west side of Aristotelous Square, this hotel showcases monumental architecture from the late sixties. It’s an excellent spot for photography, offering a glimpse into the city’s luxurious past.

4. **Olympion**: Situated on the east side of Aristotelous Square, this building, designed by J. Moshé, is now the seat of the Thessaloniki Film Festival. Its unique design and cultural significance make it a noteworthy stop.

Exploring Egnatia Street provides a blend of history, culture, and modern-day vibrancy, making it an ideal destination for your weekend getaway in Thessaloniki.","Egnatia Street is a central avenue in Thessaloniki that has been present since the city's founding, originally constructed by the Romans in the 2nd century BC. It connected Dyrrhachium (modern-day Durrës in Albania) with Constantinople. The street starts at Dimokratia Square and ends at the TIF grounds and Aristotle University, dividing the historic center of the town. Along Egnatia Street, there are several must-see places, including Kolomvou Square, which is a bustling crossroads named after G. Colombo, an Italian hotelier. Another notable site is the Hamza Bey Mosque, built in 1467, which is unique for its peristyle and has undergone renovations to house an exhibition of archaeological finds.",0.8,0.49,0.6774193548387096,0.883232799008558,0.99999999995,0.9999999999,1.0,0.7999999994666667,,0.8818190687297477
69,"What historical significance does Egnatia Street hold in Thessaloniki, and what notable landmarks can be found along this avenue?","['34\n1 \tEGNATIA STREET\nThis central avenue has \nbeen there practically since \nThessaloniki’s founding,  \nas it is a section of the road \nconstructed by the Romans  \nin the 2nd c. BC, and connected \nDyrrhachium (Durrës, in \nmodern day Albania) with \nConstantinople. It starts at \nDimokratia square (see p. 58) \nand ends at the TIF grounds \n(see p. 31) and the Aristotle \nUniversity of Thessaloniki, \nsplitting in two the town’s \nhistoric centre. It is a busy \nshopping area with numerous \nremarkable buildings of \neclectic and art deco style \ndating to the early 20th c. \n(mostly old hotels) that are \nabsolutely worth observing,  \nas well as some of the city’s \nmost important monuments.\nMUST SEE:\n1.1  Kolomvou Square.\nThe crossroads where \nEgnatia Street meets \nAntigonidon Street is indeed \na bustling one! It was named \nafter G. Colombo, an Italian \nwho opened a hotel there  \nin the early 20th century. This \nis the location of Kolomvou \nArchway (31, Egnatia St.) \nwhich has become a leisure \nhub with cafés, bars and \nrestaurants inside.\n1.2  Hamza Bey Mosque.\nIt was built in 1467 by the \ndaughter of Hamza Bey, the \nmilitary commander of Sultan \nMurad II.', '30\n3rd walk: \nHISTORIC CENTRE (2)\nMUSEUM AREA\nflats facing the adjacent \nIppodromiou square. This was \na 450 m. long and a 95 m. \nwide structure and it used to \nbe the centre of social activity \nfor citizens until 390 AD, \nwhen emperor Theodosius \nordered the massacre of \n7,000 Thessalonians there; \nthe event led to the close-\ndown of the Hippodrome. It is \nworth visiting the Thessaloniki \nHistory Centre, situated in the \nsquare’s south side as well as \nthe remarkable 18th c. Agios \nAntonios church in Margariti \nstreet nearby. \n8.7  Arched Hall.\nIt lies at the intersection  \nof Gounari and Svolou streets. \nThis was a place with heating \ninstallations for holding \nsymposia and ceremonies. \nIt had a direct access to \nthe imperial box in the \nHippodrome.\n8.8  Theatre - stadium  \nin Apellou Street.\nThe remains of a building \nhave been located at 5 & \n7 Apellou St., and they are \nconsidered to have been part \nof the theatre-stadium of the \ntown, which was in use from \nthe 1st until the 4th c. AD.  \nThere are references connecting \nthis place with the martyrdom \nof Agios Dimitrios, the city’s \npatron saint.\n9 \tTHREE CHURCHES\nOn the south side of Egnatia \nStreet, between K. Palaiologou \nSt.']","['<1-hop>\n\n34 1 EGNATIA STREET This central avenue has been there practically since Thessaloniki’s founding, as it is a section of the road constructed by the Romans in the 2nd c. BC, and connected Dyrrhachium (Durrës, in modern day Albania) with Constantinople. It starts at Dimokratia square (see p. 58) and ends at the TIF grounds (see p. 31) and the Aristotle University of Thessaloniki, splitting in two the town’s historic centre. It is a busy shopping area with numerous remarkable buildings of eclectic and art deco style dating to the early 20th c. (mostly old hotels) that are absolutely worth observing, as well as some of the city’s most important monuments. MUST SEE: 1.1 Kolomvou Square. The crossroads where Egnatia Street meets Antigonidon Street is indeed a bustling one! It was named after G. Colombo, an Italian who opened a hotel there in the early 20th century. This is the location of Kolomvou Archway (31, Egnatia St.) which has become a leisure hub with cafés, bars and restaurants inside. 1.2 Hamza Bey Mosque. It was built in 1467 by the daughter of Hamza Bey, the military commander of Sultan Murad II. It is the only mosque in Greece with a peristyle (a colonnaded yard). For many decades it housed a cinema named Alkazar. Currently there are renovation works under way. Once they are finished, it will house an exhibition of finds unearthed during the metro excavations. Right behind it you will see the City Manor which housed the Town Hall until recently. It is known at Karavan Serai as there used to be an ottoman inn here. (early 16th c.). 4th walk:']","Egnatia Street is a historically significant avenue in Thessaloniki, tracing its origins back to the Roman era in the 2nd century BC. It served as a vital route connecting Dyrrhachium (modern-day Durrës in Albania) to Constantinople, playing a crucial role in the city's development and trade. Today, Egnatia Street divides the historic center of Thessaloniki and is a bustling hub filled with shops, cafes, and remarkable architecture.

Notable landmarks along Egnatia Street include:

1. **Kolomvou Square**: This lively intersection, where Egnatia meets Antigonidon Street, is named after G. Colombo, an Italian hotelier from the early 20th century. The square features the Kolomvou Archway, which has become a popular leisure spot with various dining options.

2. **Hamza Bey Mosque**: Built in 1467, this mosque was commissioned by the daughter of Hamza Bey, a military commander. It stands as a testament to the city's rich Ottoman heritage and is an important historical site.

3. **Aristotle University of Thessaloniki**: Located at the end of Egnatia Street, this prominent university is a key educational institution in Greece and adds to the vibrant atmosphere of the area.

4. **TIF Grounds**: The Thessaloniki International Fair grounds are also situated at the end of Egnatia Street, hosting various events and exhibitions throughout the year.

Exploring Egnatia Street offers a blend of history, culture, and modern life, making it an ideal spot for sightseeing. The eclectic and art deco buildings from the early 20th century, along with significant monuments, provide numerous opportunities for photography and local interaction, enriching your experience in Thessaloniki.","Egnatia Street is historically significant as it has been a central avenue since the founding of Thessaloniki, originally constructed by the Romans in the 2nd century BC. It connected Dyrrhachium (modern-day Durrës, Albania) with Constantinople. Along this busy shopping area, notable landmarks include Kolomvou Square, which features the Kolomvou Archway, a leisure hub with cafés and restaurants, and the Hamza Bey Mosque, built in 1467, which is the only mosque in Greece with a peristyle. The mosque is currently undergoing renovations to house an exhibition of archaeological finds from metro excavations.",0.6,0.68,0.5416666666666666,0.850339342279943,0.9999999999,0.9999999999,1.0,0.7692307686390532,,0.8724093697372357
70,"What are the main attractions and facilities in Kalamaria, and how does it compare to the suburb of Panorama in Thessaloniki?","['65\nSUBURBS AND CITY OUTSKIRTS\n2.4  Aretsou – Krini.\nThese two most popular \nareas of Kalamaria stretch \nalong the seafront. The \nfacilities of the local marine \nsports club are here, next to \nAretsou-Krini beach; there is \nalso an open air cinema and a \nmarina (the only one in town) \nwith a 242-berth capacity \n(there are power, water and \ntelephone services). The \nwaterfront N. Plastira Street  \nis lined with café-bars and \nfish tavernas which get filled \nto capacity all year round.\n2.5  Komninon Street.\nThe longest part of the \ntown’s main street is for \npedestrian use only and you \nwill find shops, cafés, small \nbars and restaurants along \nthe way. This is also where \nyou will find the area’s central \nsquare where the Town \nHall and the church of the \nTransfiguration of Christ are. \nFrom the direction of the \nseafront, you can reach the \narea via I. Passalidis Street. \nHow to get there. Bus \nlines 5 and 5A leave from \nEleftherias square. Get off at \nNaftikos Omilos [Marine Club] \nstop or at Chamodrakas stop \nin Aretsou area.', 'MUST SEΕ: \n2.1  Sofouli Street\n(see p. 53).\n2.2  Kyverneio [Government \nHouse] (Little Palace).\nSituated on cape Mikro \nEmvolo or Karampournaki, \nLittle Palace was built in the \n1950’s and used to be the \ncountry residence of the greek \nroyal family; today the minister \nof Macedonia-Thrace and \nthe President of the Hellenic \nRepublic stay here when \nvisiting the city. The ground \nfloor includes the lounges,  \na dance hall and an atrium;  \nthe first floor includes two \nsuites and secondary rooms. \nIt is surrounded by a garden \nand it affords an amazing \nview of the city as well as Mts \nChortiatis and Olympus.\n2.3  Kodra former military \ncamp.\nBuilding works are under way \nto change it into a park. The \nMunicipality of Kalamaria often \nhosts cultural events and visual \nart exhibitions there. On-site \nexcavations brought to light a \nsettlement dating to the archaic \nand classical times (9th – 5th \nc. BC), which some scientists \nbelieve it is identified as the \nlocation of Ancient Thermi.\n71.  \nKyverneio \n(Palataki) \noverlooks cape \nKarampournaki \n(Kalamaria).\n72.  \nPanorama \narea offers a \nfine view of \nthe city and its \nenvirons.\n71']","['<1-hop>\n\n65 SUBURBS AND CITY OUTSKIRTS 2.4 Aretsou – Krini. These two most popular areas of Kalamaria stretch along the seafront. The facilities of the local marine sports club are here, next to Aretsou-Krini beach; there is also an open air cinema and a marina (the only one in town) with a 242-berth capacity (there are power, water and telephone services). The waterfront N. Plastira Street is lined with café-bars and fish tavernas which get filled to capacity all year round. 2.5 Komninon Street. The longest part of the town’s main street is for pedestrian use only and you will find shops, cafés, small bars and restaurants along the way. This is also where you will find the area’s central square where the Town Hall and the church of the Transfiguration of Christ are. From the direction of the seafront, you can reach the area via I. Passalidis Street. How to get there. Bus lines 5 and 5A leave from Eleftherias square. Get off at Naftikos Omilos [Marine Club] stop or at Chamodrakas stop in Aretsou area. 3', '<2-hop>\n\nPANORAMA One of the best suburbs of Thessaloniki is situated at a 12 km distance S of the city centre and was built on the slope of Mt Chortiatis, offering a panoramic city view. It was uninhabited until the early 20th c., although traces of a prehistoric settlement have been located on the area. The first inhabitants were refugees from Asia Minor and Pontus. Today its largest part is covered by luxury villas and impressive detached homes; there is a small shopping area in the centre. Trigona Panoramatos [a cream puff pastry] – one of the city’s best known sweet delicacies – were created at a local confectionery in the 1950’s. MUST SEE: Platanakia. It is a nice place for relaxing, in a wooded ravine, with a small Zoo and a café. A 6 km path begins here and leads up to the artificial lake (dam) of Thermi. Along the way you will come across spots for a brief rest, short waterfalls and fragments of eight Byzantine watermills. 11 12 13 14 KONSTANTINOUPOLEOS SSIS OLGAS GIOU PAPANDREOU ROSIDI ROSIDI GEORGIOU PAPANDREOU APAFI MARKOU BOTSARI PAPANASTASIOU ANATOLIKIS THRAKIS PAPANASTASIOU VOULGARI KANARI KANARI KARAKASI KARAKASI DELFON GAVRIILIDI TH. SAKELLARIDI GAVRIILIDI KARAOLI VOULGARI KOURTIDI YPSILANTOU PLASTIRA KORAI SMYRNIS MIAOULI PLASTIRA PLASTIRA KERASOUNTOS THEMISTOKLI SOFOULI KALYVA METAMORFOSEOS KOMNINON PONTOU PONTOU AIGAIOU AIGAIOU ADRIANOUPOLEOS EL. VENIZELOU ETHNIKIS ANTISTASIS KOLOTOUROU THICHIS PAPAFLESSA MERKOURIOU KIFISIAS KIFISIAS PSELOU SOLONOS MANTINEIAS GAMVETA METAMORFOSI AGIOS NIKOLAOS NATHANAIL MALAKASI POLYLA PARASCHOU TYPALDOU GRYPARI ROIDI GAMVETA MAKEDONIAS STROMNITSIS MELENIKOU MOUSOURI PAPANTONIOU CHRISTOVASILI PORFYRA SKIATHOU ANINOU KRITIS CHAIRONEIAS PARNASSOU KOUSKOURA PAPADIMITRIOU TAKI OIKONOMIDI DODEKANISOU MITROPOLITI AMVROSIOU MITROPOLITI KALIDI MITROPOLITI GRIGORIOU KYDONION MOSCHONISION THEMISTOKLI SOFOULI KROMNIS PLOUTONOS KASSOMOULI SANGARIOU VISSARIONOS KAPETANIDI NAVARINOU KOLCHIDAS PAPAGOU KIOU POULANTZAKI KALIDOU KAVASITON XENOFONTOS IL E TIR G A NIKOMIDEIAS TRIPOLEOS CHILIS MARMARA CHALKIS VITHYNIAS MIKROULEA KONITSIS SARATSI THERAPEION NIKAIAS AGIAS ELENIS AGIOU IOANNOU VOSPOROU ELLISPONTOU MAKROCHORIOU KARAMAOUNA KARATASOU PAPANASTASIOU LEVANTI KAZIKA IRAKLEIAS IOAKEIM G’ CHRYSOSTOMOU SMYRNIS ADRAMITIOU METRON ANDROUTSOU EFESOU PASALIDI TAXIARCHON MYSTAKIDI MOUDANION EVELPIDOU AGIOU NIKOLAOU PROUSAS DALIPI BALA PAPAPETROU AVDELA KOMNINON KOTYORON ARGYROUPOLEOS SANTAS MYRION AKRITIDI EPANOMIS PAPAKYRITSI AMISSOU LEROU KYPROU PATMOU YPSILANTOU KYMIS MAKRYRACHIS SOUMELA PARANIKA VAZELONOS IASONIDI KYRIAKIDI FOKAIAS DAVAKI AGIOU VASILEIOU DIOGENOUS LEFKOSIAS ARISTOFANOUS FANARIOU PALAMA PANORMOU GRIGORIADI KALANTIDI ANATOLIKIS THRAKIS SOULIOU OMIROU ZALONGOU IONIAS PARIDOS FILADELFEIAS KAPADDOKIAS PROMITHEOS XENOPOULOU IKONIOU IPPOKRATOUS RANGAVI DIOS SOKRATOUS SOLOMOU PLOUTARCHOU EVRIPIDOU SOURI PAPANTONIOU THOUKYDIDI IOUSTINIANOU ALKIONOS ZIRGANOU IRAS LOUI SEVASTEIAS KARAVANGELI ERYTHROU STAVROU MEGALOU ALEXANDROU KAZAZI KAISAREIAS LAODIKIAS IEROSOLYMON AIANTOS AIVATZIDI AGIOU PANTELEIMONOS ANEMONAS PASTER FILELLINON KERAMOPOULOU KALAVRYTON PAPADIAMANTI FILIPPOU V. IPEIROU KOLOKOTRONI VLACHERNON KORYTSAS RODOU IRODOTOU LASANI ARISTOTELOUS ARISTEIDOU PERIKLEOUS TATAOULON DORILEOU POKIOUPTSIDI KYZIKOU KAFKASOU TSINGIRIDI AGIOU ZACHARIA CHERIANON CHALDEIAS KAROLIDI CHEIMONIDI AIMILIANOU MITR. ARTAKIS ERATYRAS ANTIGONIS VOULGAROKTONOU PARASKEVOPOULOU APOSTOLOU PAVLOU FLEMING KONSTANTINOUPOLEOS KYFONIDI S A R E M I CHRYSOULIDI THERMAIKOU PAPANIKOLA NIKOPOLEOS TRAPEZOUNTAS VASILEIADOU SIFILINON SOURMENON ARGYROPOULOU NEAPOLEOS STRAVONOS ARGONAFTON KYDONION PAPADAKI SIGALA AKTAIOU ANDRONIKOU POLEMI PAPADAKI PANSELINOU ADMITOU KASSANDREOS TSOUNTA POULIOU KORNAROU NALTSA FRANTZI KRYSTALI AINOU SIK A R H T O M A S LOGOTHETOU NIKOLAIDI THEMELI SPETSON LASKARATOU TYPA YPSILANTOU DROSINI CHALKIDIKIS THERMOPYLON THALITOS PITTAKOU GRAVIAS GRAVIAS FILELLINON OROMILA KRITIS PAPADIAMANTI NASTOU ALKMINIS NATSINA GENNADIOU MITR. NEMEAS PLATAION DANIOLOU AGIOU VASILEIOU GENNADIOU MITR. PAPAKYRIAZI KARKAVITSA AVROKORDATOU VOGA US IPATIAS KISSOU KARIATIDAS KAVIRON AGAMEMNONOS U S ARGAIOU FOINIKOS EFESSOU KAISAREIAS KALLIPOLEOS VRYOULON KYZIKOU NIKOMIDEIAS NEAPOLEOS MIDEIAS APADDOKIAS KAONIAS INIOSOGLOU NIKAIAS KAROLIDOU RANTI AS KI NIAS SANTAS POULA YPARCHOU FOKYLIDOU KERAMIKOU EPIDAVROU TSELIOU TSELIOU PRAXAGORA OLYMPIAS VOSPOROU AMFIPOLEOS MIKRAS ASIAS PONTOU VITHYNIAS PAPAGEORGIOU IOANNOU KAISAREIAS METRON IMVROU AGRIANON CHIOU CHOURMOUZI APOLLONOS SYROU FAIAKON LARNAKOS AMMOCHOSTOU NAFPLIOU NAFPLIOU DERKON KORDELIOU VIZYIS DORYLAIOU TINOU TENEDOU DARDANELLION DIMITSANAS EPIDAVROU EFSTATHIOU MITROPOLITOU PILEAS CHANDRINOU FILINTA DORYLAIOU KARANIVALOU ATLANTIDAS SVOLOU VOSPOROU ZACHOU ZIRINI ZONARA ANAXIMENOUS ANATOLIKIS ROMYLIAS ISOKRATOUS TOUSSA SPEFSIPOU MYSTAKIDI DYSTOMOU MIKROU ANTISTHENOUS STEFANOU DIMOCHAROUS MISIRLI PILEAS AEROPOU PAFSILYPOU TRIANTAFYLLOPOULOU AGALIANOU PRAIDI STAMATELOU FILI STAGIRITI STADIOU IPEIROU KYPROU KARAVANGELI MARATHONOS MAKEDONIAS ETHNIKIS CHRΥSOSTOMOU AGRA NEARCHOU IFAISTIONOS OLYMPOU KORYTSAS PTOLEMAIOU PERDIKA OLYMPIADOS OLYMPIADOS THER MOPYLON KENEDY PLASTIRA PLASTIRA PROFITI ILIA MEGALOU ALEXANDROU VAS. KONSTANTINOU GRIGORIOU LAMPRAKI (KONITSIS) FLEMING NIKIS AMFOTEROU ETEOKLI DIGKA ETEOKLI IGILOCHOU NIKANOROS EVMENOUS VASIKYROU KARATHEODORI GAZI ANAKREONTOS ANTAIOU NOUKA SEFERI POSEIDONOS MELEAGROU ANGELOU ALKAMENOUS ANAXIMANDROU ANAXIMANDROU LEONIDOU KARDITSIS IRAKLEOUS KORAI MELENIKOU ALKMINIS PARALI GLYNOU TZAVELA TZAVELA RIGA FERAIOU CHORN ZOUMETIKOU MARASLI MARSLI XENOU MAVROMICHALI ADRIANOUPOLEOS ATREIDON XYNGOPOULOU ARKADIOU OSIAS XENIS STROMNITSIS OKEANIDON DEINOKRATOUS VAMVA AGISILAOU NEOPTOLEMOU PAPA PAVLOU MELA VENIZELOU ARISTOTELOUS EIRINIS FILIKIS ETAIRIAS FILIPPOU PRASSAKAKI SCHOLEION OMIROU KOLOKOTRONI PALAIOLOGOU LAOGR. MOUSEIOU DAVAKI SELEFKOU TSELEPI TSIAPANOU TSAMI STRATIGI STRATIGI VISTA ANGELOPOULOU DIVOLI GKOURA GRIGORIOU STEFANOU ATHINA ANTHEMOUNTOS LEFAKI PAFSANIA SEMELIS AETIONOS PANTAZIDI PERRAIVOU PERRAIVOU SPANOU IPPOKRATOUS IPPOKRATOUS DIMOKRITOU VOSPOROU GLYNOU GLYNOU THEOFILOU PAPANASTASIOU VYZANTIOU PAPAFLESSA ANOIXIS VARNALI SPYROU LOUI KALVOU SYMEONIDI PROTOMAGIAS PALAMA DIMOKRATIAS VISVIZI ARTAKIS U EPTALOFOU PARMENIDI TIROLOIS EMOU POLYGNOTOU DROMIOU LISSIPOU ANTIFANOS MEGAKLEOUS EMMANOUIL EFTALIOTI EFTALIOTI DOMPOLI DOUKA ANAXIMENOUS NEARCHOU RIGA FERAIOU SEFERI MENANDROU PAPANIKOLAOU ANAPAFSEOS ZORBA ANAPAFSEOS KAFANTARI POSEIDONOS ALATSATON ANTISTASEOS AGIOS THERAPON PROFITIS ILIAS AGIOS ELEFTHERIOS TREIS IERARCHES OSIA XENI MALAKOPI CHARILAOU ARETSOU TROCHIODROMIKON DEPO ALATINI CHEN KOURI VOTSI KIFISIA VYZANTIO KATIRLI DERKON KARAMPOURNAKI EXOCHES KONSTANTINOUPOLITON KATO TOUMPA TOUMPA CEMETERY ENGLISH CEMETERY KALAMARIA CEMETERY PILEA CEMETERY THERMI - CHALKIDIKI MIKRA CHALKIDIKI PANORAMA GOVATZIDAKI SQ. AINOU SQ. KAOUDI SQ. PATRIKIOU AILIDI SQ. SQ. SKRA SQ. PILEA KALAMARIA THESSALONIKI KERAMEIA ALATINI ARISTOTELIS AGIOU ELEFTHERIOU SQ. RETIREMENT HOME 2.2 2.3 2.4 2.5 2.1 2.4 72']","Kalamaria, a vibrant suburb of Thessaloniki, offers a mix of attractions and facilities ideal for a weekend getaway. Key highlights include the picturesque Aretsou-Krini area, which features a beautiful seafront, a marina with 242 berths, and a variety of café-bars and fish tavernas along N. Plastira Street. This bustling waterfront is perfect for leisurely strolls and enjoying local cuisine. The pedestrian-friendly Komninon Street is another focal point, lined with shops, cafés, and restaurants, and home to the central square where the Town Hall and the church of the Transfiguration of Christ are located.

For cultural experiences, the Kyverneio (Little Palace) is noteworthy. Once a royal residence, it now serves as a government house and offers stunning views of the city and surrounding mountains. The Kodra former military camp is being transformed into a park, hosting cultural events and exhibitions, making it a great spot for local interaction.

In comparison, the suburb of Panorama is known for its elevated views of Thessaloniki and a more residential atmosphere. While it offers scenic vistas and a quieter environment, it may lack the vibrant seaside experience and bustling social scene found in Kalamaria. Panorama is ideal for those seeking tranquility and panoramic views, but for a first-time visitor looking for lively interactions, local cuisine, and a mix of cultural and leisure activities, Kalamaria stands out as the more engaging option.

