,user_input,retrieved_contexts,reference_contexts,response,reference,context_recall,factual_correctness,faithfulness,semantic_similarity,llm_context_precision_without_reference,llm_context_precision_with_reference,non_llm_context_recall,context_entity_recall,noise_sensitivity_relevant,answer_relevancy
0,What fun things to do in Thessaloniki for kids and families?,"['Another option for you \nis to go swimming in the \nbeautiful beaches by the \nseaside suburbs and city \noutskirts (see p. 63-69), in \nplaces within the regional \nunit of Thessaloniki (see p. \n91-95), and in Halkidiki (see \np. 92). You can also visit the \nMagic Park (12th km on the \nThessaloniki – Airport Road), \nthe biggest amusement park \nin Greece, which attracts \nchildren, teenagers, grown-\nups and families alike  \n(www.magicpark.gr); the \nWaterLand is another \nfun option as there are \nwaterpools, waterslides  \nof various sizes, with different \nlevels of difficulty, restaurants \nand mini markets. It is \nlocated in Tagarades,  \nThermi area, (see p. 66).\nTOURING THESSALONIKI WITH CHILDREN\n123', 'AG. SOFIAS\nMFEI\nSQ.\nSYNTRIVANIOU\nSQ.\nNAVARINOU\nSQ.\nSQ.\nLYSSIATREIO\nTHEA\nCANC\nGENERAL\nHOSPITAL\nOF THESSALONIKI\nG. GENNIMATAS\nUNIVERSITY\nGENERAL\nHOSPITAL\nOF THESSALONIKI\nAHEPA\n   INFECTIOUS\n  DISEASES\nHOSPITAL\n3rd walk: \nHISTORIC CENTRE (2)\nMUSEUM AREA\nThe area is considered  \nas one of the most privileged \nplaces downtown on account \nof its proximity to the beach;  \nit is traditionally regarded as \nthe residential area of the \nwell-to-do. There are many \nwell-known shops here, green \nspots, as well as some of the \nmost important museums  \nand cultural institutions.\n1 \t\x07\nTHE WHITE TOWER \nAREA\nThis central location is where \nmajor city roads meet (Nikis \nAve, Megalou Alexandrou Ave., \nPavlou Mela, Ethnikis Amynis, \nGermanou) and where the old \npart of the waterfront meets \nthe new one. It affords a lovely \nview of the sea; there are \ngreen areas and many shops, \ncafés and bars.\nMUST SEE:\n1.1  The White Tower.\nThis is the city’s most \nfamous landmark - \nmonument.', 'It is about an excursion taken \nto the most interesting parts \nof the viticultural zone; this is \ncombined with a visit to the \narchaeological and historical \nassets of those areas, with \ncountryside activities, as \nwell as a visit to wineries \nand degustation. Make sure \nyou visit the impressive \nGerovassiliou Wine Museum  \nin Epanomi (see p. 68 & 80). \nFor more information, \ncontact the Wine Roads \nof North Greece: tel: 2310 \n281.617 and 2310 281.632, \nwww.winesofnorthgreece.gr\n121, 122 & \n123.  \nThessaloniki \noffers its little \nvisitors a host \nof fun activities \nand games to \nchoose from.\n121\n122', 'The last part consists of \nwhat is believed to have \nbeen the tomb of Alexander \nIV, son of Alexander the \nGreat and Roxanne, who was \nassassinated by Cassander in \n310 BC; a silver urn containing \nthe bones of the dead person, \nframed with the ivory relief \nmotifs of the funeral bed. \nIn a separate room, visitors \ncan watch a video where M. \nAndronikos takes them on a \ntour of the monuments. Other \nexcavations in the wider area \nof the Aiges necropolis have \nunearthed archaic tombs, pit \nand cist tombs (6th and 5th c. \nBC), as well as temple-shaped \nmacedonian tombs one of \nwhich apparently belonged  \nto Queen Eurydice, the mother  \nof King Philip II\nPalace. It covers a 12,500 \nm2 area and it used to be \nthe largest and the most \nimportant construction (next \nto Parthenon, Athens) of the \nHellenic Classical Antiquity. \nThis two-storeyed edifice \nis presumed to be the work \nof Pytheos who was the \narchitect of the Mausoleum \nof Halicarnassos [modern-day \nBodrum, Turkey], one of the 7 \nwonders of the ancient world. \nThe palace’s architectural style \nis considered avant-garde for \nthat time and it was built of \nlimestone during the 2nd half \nof the 4th c. BC on a plateau; \n101, 102 & \n103.', '41\n4th walk: \nHISTORIC CENTRE (3)\na small museum dedicated \nto the founder of the modern \nTurkish state. To visit it you need \nan identity card or passport  \n(for museum exhibits, see p. 74).\n3.8  Teloglion Foundation \nof Art. \nBuilt on elevated ground in \nthe north side of the Campus, \nit is a modern building complex \ncovering a 3,200 m2 area and \nit was inaugurated in 1998. \nThere are spatious exhibition \nareas, an amphitheatre,  \na library – reading room,  \nas well as rooms for research \nand educational programmes, \na shop and a café-restaurant  \n(for the foundation’s collections \nsee p. 76). Thessaloniki’s \nNational Swimming Pool  \nis located east of Teloglion. \n3.9  Kaftanzogleio Stadium.\nIt was built in 1960, following \na donation by L. Kaftanzoglou, \na member of a very old family \nof Thessaloniki; until 1982 \nthis used to be the largest \nstadium in the country in terms \nof capacity. It is the home \nground of Iraklis team which \nwas founded in 1908 – the \ncity’s oldest football team! \nThis stadium was one  \nof the official sports fields  \nfor the Athens Olympic Games \nin 2004 and it is often \nused for domestic and \ninternational sports events.', '101\nand sports facilities.\nTour the suburban forests \nof Seich Sou (see p. 47) and \nChortiatis (see p. 66) where \nyou can follow the hiking trails \nor go mountain biking, find the \nspots designated for sports \nactivities or just relax by the \nDeltas of Gallikos river and \nAxios-Loudias-Aliakmonas \nrivers (see p. 63) or by the \nlakes Koroneia and Volvi  \n(see p. 93-94).\nThere are some quite \ninteresting educational \nprogrammes for children, \nrunning in most museums \n(see p. 70 - 81), particularly \nin the Children’s Museum \n(see p. 79) which is the only one  \nof its kind.\nHave fun and at the same  \ntime get familiar with science  \nand technology at the Noesis  \n– Science Centre and \nTechnology Museum (see p. \n67) or at the Nouvelle multi-\npurpose venue (7th km on the \nThessaloniki – Oraiokastro \nRoad) where you can visit the \nEnvironmental Dinosaur Theme \nPark and see the natural size \nreconstructions of animals, \nthe Mammoth Museum where \nfossils of the hairy mammoth \nare on display, the Cave where \nthere are depictions of creation \nand prehistoric life in caves  \nas well as the Interactive \nMuseum of Greek Traditional \nToys and Games  \n(www.parkodeinosauron.gr).   \nAnother option for you \nis to go swimming in the \nbeautiful beaches by the \nseaside suburbs and city \noutskirts (see p.', '56\n6th walk: \nNEA PARALIA – VASILISSIS OLGAS AVENUE\nCulture events in Thessaloniki \nwere housed in this villa.\n3.7  Folklife and Ethnological \nMuseum of Macedonia – \nThrace (68, Vas. Olgas Ave.)\nThis eclectic building (you \nwill get a better view from \nMegalou Alexandrou Ave.) was \nthe residence of the banker \nJacob Modiano in the early 20th \nc. In 1913 it was bought by \nthe Greek State, offered to the \nGreek Royal Family and, later on, \nit became the residence of the \nGovernor General of Macedonia, \na Military School of Medicine \nand a Seminary. In 1970 it was \ngranted to the Museum and \nin 1980 the premises were \ndeclared a scheduled monument \n(for museum exhibits, see p. \n75). The adjacent noteworthy \ncomplex belongs to the Goethe \nInstitut (1929).\n3.8  Building at 71,  \nVas. Olgas Ave.\nA once private residence, it has \nalso housed a private school in \nthe past and today it is a private \nnursery school and kindergarten.\n3.9  Melissa Building  \n(36, Vas. Olgas Ave.).\nIt was built in 1896 as the \nresidence of a Turkish merchant \nand in 1908 it was purchased \nby the Bulgarian government.', 'The \nmuseum collections are \narranged in seven categories:\n• Introduction. The \nwine-making history of the \nGerovassiliou family is shown \nas well as the stages of the \nmuseum’s creation.\n• The journey of the wine. \n(Room A). A depiction is made \nof the course of wine across the \nages and the vessels for carrying \nit since the ancient times.\n• Wine and food. (Room \nA). Combinations of food and \nwine from the vineyards are on \ndisplay in three-dimensional \ndepictions.\n93.  \nInterior view \nof Noesis \nMuseum.\n94.  \nEntrance to the \nGerovassiliou \nWine Museum. \n95 & 96. The \nGerovassiliou \nWine Museum: \n(left) part of \nthe impressive \ncollection of \ncorkscrews; \n(right) part of \nthe collection \nof wine-making \nequipment.\n93', '53\n6th walk: \nNEA PARALIA – VASILISSIS OLGAS AVENUE\ncomplex of 14 listed industrial \nbuildings is quite impressive. \nThe complex’s construction \ndate is 1854 and the town’s \nfirst steam-driven flour mill was \nlocated by the sea. Originally \nunder French ownership, they \nbecame property of the Allatini \nfamily in 1882. \n2.2  Vafopouleio Cultural \nCentre.\nTwo contiguous buildings \nform this structure which was \ninaugurated in 1983 by the \nMunicipality of Thessaloniki. \nThe Centre hosts visual art \nexhibitions, theatre and \nmusic performances as well \nas discourse events. Other \nfacilities include three libraries \none of which is a Children’s \nlibrary which contains over \n14,500 volumes.\n2.3  Ouziel quarter.\nThis complex of very \npicturesque semi-detached \nhouses (defined within \nPapandreou, Ploutonos, \nChaironeias and Dimitrakopoulou \nstreets) were built to house \nthe workers employed in the \ntramway construction and \nwas named after the French \ncontractor Ouziel. In 1985 \nit was declared a protected \narchitectural monument and in \nrecent years a new generation \nof residents occupies the \narea.', '80\nMUSEUMS\nmechanics and so on, which \nlay emphasis on the visitor’s \nactive participation as well as \non learning and having fun  \nat the same time.\n• Car Exhibition. \nOld car models that have \nbeen the most popular \nproductions in the history of \nthe automobile industry can  \nbe seen here.\nThe education rooms are \nthe following:\n• Planetarium. This \n160-seat room has a domed \nscreen (the dome is visible on \nthe outside as well). Visitors \ncan watch educational and \nrecreational films such as The \nEarth and me, Wonders of the \nUniverse and others.\n• Cosmotheatre. This film \ntheatre features the largest flat \nscreen in Southeast Europe \n(23X17 m.). Movies such as \nDinosaurs and Beyond the skies \nare screened here\n• Virtual Reality Simulator. \nThe spectator wears 3-D \nglasses, boards a small wagon \nand enjoys an on-the-go \nsimulation experience of \nvarious types such as flight, \ndeep-sea voyage and tours  \nin imaginary worlds.\nFurthermore, Noesis \norganises educational \nprogrammes on Renewable \nSources of Energy and \nScience Shows to further \nexplicate the laws of Physics \nand Chemistry.\nGEROVASSILIOU WINE \nMUSEUM\nThis outstanding museum \nhas been open since 2008  \nin the winery’s grounds where \nthe vineyards spread in a \n56-hectare area, affording \na fine view of the greater \narea and Thermaic Gulf. The \nmuseum collections are \narranged in seven categories:\n• Introduction.']","['TOURING THESSALONIKI\nWITH CHILDREN\nThessaloniki’s relatively \nsmall size - for a city – \nmakes it a particularly friendly \nplace for children and offers a \nhost of activities for them. \nGo on a bicycle ride \nalong the town’s bike lanes, \nespecially by the waterfront, \nstarting from the harbour \n(see p. 17), past the White \nTower area (see p. 24) and up \nto the Concert Hall (see p. 52) \nor visit the Theme Parks of \nthe new (east) seafront [Nea \nAnatoliki Paralia] (see p. 50) \nwhere there are playgrounds \nThessaloniki Wines. \nMacedonia has a long \ntradition on wine-making, \nas the district can boast \nsome of the most renowned \nGreek vineyards. In the area \nsurrounding the town, a wide \nrange of varieties are grown \nsuch as Roditis, Asyrtiko, \nMalagouzia, Sauvignon \nBlanc, Chardonnay, Voignier, \nSyrah, Merlot, Grenache \nRouge, Limnio, Mavroudi, \nMavrotragano, Xinomavro, \nCabernet Sauvignon, Athiri and \nMalvasia. The Wine Producers \nAssociation of Northern \nGreece Vineyards, under the \ntrade name Wines of Northern \nGreece, realises a programme \ntitled “Wine Roads of North \nGreece” (www.wineroads.gr). \nIt is about an excursion taken \nto the most interesting parts \nof the viticultural zone; this is \ncombined with a visit to the \narchaeological and historical \nassets of those areas, with \ncountryside activities, as \nwell as a visit to wineries \nand degustation. Make sure \nyou visit the impressive \nGerovassiliou Wine Museum  \nin Epanomi (see p. 68 & 80). \nFor more information, \ncontact the Wine Roads \nof North Greece: tel: 2310 \n281.617 and 2310 281.632, \nwww.winesofnorthgreece.gr\n121, 122 & \n123.  \nThessaloniki \noffers its little \nvisitors a host \nof fun activities \nand games to \nchoose from.\n121\n122']"," Thessaloniki offers its little visitors a host of fun activities and games to choose from. Some options include:

* Going swimming in the beautiful beaches by the seaside suburbs and city outskirts (see p. 63-69, 91-95, and 92)
* Visiting the Magic Park (12th km on the Thessaloniki – Airport Road), the biggest amusement park in Greece
* Exploring the WaterLand, a fun place with waterpools, waterslides of various sizes, restaurants, and mini markets
* Playing sports at the Kaftanzogleio Stadium, the home ground of Iraklis team
* Following hiking trails or going mountain biking in the suburban forests of Seich Sou and Chortiatis
* Visiting the Children’s Museum (see p. 79), the only one of its kind
* Having fun at the Noesis – Science Centre and Technology Museum, with interactive exhibits and a dinosaur theme park
* Enjoying the Environmental Dinosaur Theme Park and the Mammoth Museum
* Participating in educational programmes at the Noesis – Science Centre and Technology Museum
* Exploring the Folklife and Ethnological Museum of Macedonia – Thessaloniki (68, Vas. Olgas","Thessaloniki offers fun activities for kids and families, including bicycle rides along the waterfront, visiting theme parks with playgrounds, and various games and activities for children.",0.0,0.14,1.0,0.7893035784578938,0.6814814814701234,0.7222222221981481,0.0,0.12499999984374999,,0.8694778331024066
1,What conceptual frameworks can be derived from the absence of context in understanding themes?,"['The last part consists of \nwhat is believed to have \nbeen the tomb of Alexander \nIV, son of Alexander the \nGreat and Roxanne, who was \nassassinated by Cassander in \n310 BC; a silver urn containing \nthe bones of the dead person, \nframed with the ivory relief \nmotifs of the funeral bed. \nIn a separate room, visitors \ncan watch a video where M. \nAndronikos takes them on a \ntour of the monuments. Other \nexcavations in the wider area \nof the Aiges necropolis have \nunearthed archaic tombs, pit \nand cist tombs (6th and 5th c. \nBC), as well as temple-shaped \nmacedonian tombs one of \nwhich apparently belonged  \nto Queen Eurydice, the mother  \nof King Philip II\nPalace. It covers a 12,500 \nm2 area and it used to be \nthe largest and the most \nimportant construction (next \nto Parthenon, Athens) of the \nHellenic Classical Antiquity. \nThis two-storeyed edifice \nis presumed to be the work \nof Pytheos who was the \narchitect of the Mausoleum \nof Halicarnassos [modern-day \nBodrum, Turkey], one of the 7 \nwonders of the ancient world. \nThe palace’s architectural style \nis considered avant-garde for \nthat time and it was built of \nlimestone during the 2nd half \nof the 4th c. BC on a plateau; \n101, 102 & \n103.', '52\n6th walk: \nNEA PARALIA – VASILISSIS OLGAS AVENUE\n1.5  Theme gardens.\nAlong Megalou Alexandrou \nAvenue towards the direction \nof the sea, 12 Theme Gardens \ncover an area of 76,657 m2 \nand are just the ideal place for \nspending your leisure time, \nstrolling or relaxing. They are as \nfollows: Garden of Alexander; \nGarden of the Afternoon Sun; \nGarden of Sand (with a café, \ntennis courts and a playground); \nGarden of the Seasons (includes \nan amphitheatre open for various \nevents and a café); Garden of \nOdysseas Fokas (playground \ninside); Garden of the \nMediterranean (café included); \nGarden of Sculptures (outdoor \ncontemporary art sculptures); \nGarden of Sound (with flowing \nwaters); Garden of Roses (with \nornamental flower beds and a \nplayground); Garden of Memory \n(with basketball grounds and \ntennis courts); Garden of Water \n(you will see lakes with plants \ngrowing in water, a small waterfall \nand a skatepark); and Garden of \nMusic with a space reserved for \nmusic events. You can also ride \nalong the area’s 3 km cycle path. \nThis is also the location of the \nNautical Club of Thessaloniki.\n1.6  Thessaloniki Concert \nHall.\nIt was inaugurated in 2000 on \na privileged location.', '100\nTOURING THESSALONIKI\nWITH CHILDREN\nThessaloniki’s relatively \nsmall size - for a city – \nmakes it a particularly friendly \nplace for children and offers a \nhost of activities for them. \nGo on a bicycle ride \nalong the town’s bike lanes, \nespecially by the waterfront, \nstarting from the harbour \n(see p. 17), past the White \nTower area (see p. 24) and up \nto the Concert Hall (see p. 52) \nor visit the Theme Parks of \nthe new (east) seafront [Nea \nAnatoliki Paralia] (see p. 50) \nwhere there are playgrounds \nThessaloniki Wines. \nMacedonia has a long \ntradition on wine-making, \nas the district can boast \nsome of the most renowned \nGreek vineyards. In the area \nsurrounding the town, a wide \nrange of varieties are grown \nsuch as Roditis, Asyrtiko, \nMalagouzia, Sauvignon \nBlanc, Chardonnay, Voignier, \nSyrah, Merlot, Grenache \nRouge, Limnio, Mavroudi, \nMavrotragano, Xinomavro, \nCabernet Sauvignon, Athiri and \nMalvasia. The Wine Producers \nAssociation of Northern \nGreece Vineyards, under the \ntrade name Wines of Northern \nGreece, realises a programme \ntitled “Wine Roads of North \nGreece” (www.wineroads.gr).', ': 2310 454.111 \nwebsite: www.naokth.gr\nTheme Park Fields \n(see p. --)\nMegas Alexandros \nInternational Marathon \nrace. \nIt takes place every spring;  \nthe starting point is in Ancient \nPella and the finish is in \nThessaloniki town. 5 and 10 \nkm races get also organised. \nFor more information: \ntel.: \x072310 200.360,  \n2310 725.775\nwebsite: www.atgm.gr\nDepartment of Municipal \nGyms, Swimming Pools \nand Sport Grounds of \nthe Municipality of \nThessaloniki \nGr. Lampraki & 57, Kleanthous Sts.\ntel.: 2310 317.636\nDepartment of Sporting \nEvents & Programms \nof the Municipality of \nThessaloniki \nGr. Lampraki & 57, Kleanthous Sts. \ntel.: 2310 317.636\nYou can get information on \nmunicipal gyms, the municipal \nINFORMATION', '101\nand sports facilities.\nTour the suburban forests \nof Seich Sou (see p. 47) and \nChortiatis (see p. 66) where \nyou can follow the hiking trails \nor go mountain biking, find the \nspots designated for sports \nactivities or just relax by the \nDeltas of Gallikos river and \nAxios-Loudias-Aliakmonas \nrivers (see p. 63) or by the \nlakes Koroneia and Volvi  \n(see p. 93-94).\nThere are some quite \ninteresting educational \nprogrammes for children, \nrunning in most museums \n(see p. 70 - 81), particularly \nin the Children’s Museum \n(see p. 79) which is the only one  \nof its kind.\nHave fun and at the same  \ntime get familiar with science  \nand technology at the Noesis  \n– Science Centre and \nTechnology Museum (see p. \n67) or at the Nouvelle multi-\npurpose venue (7th km on the \nThessaloniki – Oraiokastro \nRoad) where you can visit the \nEnvironmental Dinosaur Theme \nPark and see the natural size \nreconstructions of animals, \nthe Mammoth Museum where \nfossils of the hairy mammoth \nare on display, the Cave where \nthere are depictions of creation \nand prehistoric life in caves  \nas well as the Interactive \nMuseum of Greek Traditional \nToys and Games  \n(www.parkodeinosauron.gr).   \nAnother option for you \nis to go swimming in the \nbeautiful beaches by the \nseaside suburbs and city \noutskirts (see p.', 'A chapter \ntitled Byzantium after \nByzantium –Byzantine legacy \nin the years that followed the \nConquest unfolds in room 10.\n• Private collections. The D. \nPapastratos Collection in room \n8 includes 210 rare pieces of \nart - etchings with religious \n(orthodox) themes, and the D. \nOikonomopoulos Collection, in \nroom 9, counts 1,460 works of \nart of any type (coins, ceramics, \nicons and so on).\n82, 83 & 84. \nThe Jewish \nMuseum of \nThessaloniki: \n(left & middle) \npermanent \nexhibits from \nthe collection \nJewish \nNecropolis; \n(right) the \nJewish History \nexhibition.\n82\n83', '70\nARCHAEOLOGICAL MUSEUM \nOF THESSALONIKI\nWorks of art of outstanding \nvalue and excavated ensembles \nfrom the entire region of \nMacedonia are on display, \ncovering all the aspects of \nprivate and public life in the \narea, from the prehistoric era \nto the late antiquity period. \nExhibits are organised in six \nbasic categories:\n• Towards the birth of towns. \n(ground floor, room 4). The \nevidence on display shows \nthat there were settlements in \nMacedonia dating to the Iron \nAge, from 1100 to 700 BC.\n• Macedonia from the 7th c.  \nBC until Late Antiquity. \n(ground floor, room 5). Eight \nlarge theme sections cover \nvarious aspects of private \nand public life in Macedonia \nfrom the archaic years, when \nthe independent Macedonian \nkingdom was created, until \nthe 1st – 4th c. AD, when the \nentire region was a province \nof the Roman Empire. Finds \ncome mainly from excavations \ncarried out in areas of central \nMacedonia.\n• Thessaloniki, Metropolis \nof Macedonia. (ground \nfloor, room 6). Historical and \narchaeological information \nis presented, starting from \n315 BC when the town was \nfounded. There is also a \npartial reconstruction of an \narchaic temple of Ionic order, \nwhose original position is yet \nunknown; it was transported \nto the area of the Temples of \nThessaloniki during the Roman \noccupation.', '93). Buses run \nfrom 5 am until midnight, yet \nthere are certain lines running \nafter midnight connecting major \njunctions. You can purchase a \nbus pass (one-month, three-\nmonths or an annual one) or \nuse a ticket: the one-way basic \ntype, the ticket valid for two \ntrips for a 70-min. period, the \nticket valid for three trips for a \n90-min. period and the ticket \nvalid for four trips for a 120-min. \nperiod, towards any direction \non any bus route. You will find \nticket boxes in central locations, \nat the interchange stations and \nthere are also ticket machines \ninside the buses. Tickets must \nbe validated on the first trip (bus \nroutes info in Greek:  \ntel.: 11085  \nwebsite: www.oasth.gr.\nCultural route:\nThe 50 bus service runs by the \ncity’s major historical and cultural \nmonuments starting from the \nWhite Tower and following \na circular 50 min. route. On \nthe way, passengers can get \ninformation on the monuments \nusing the audiovisual material \nand pamphlets supplied (in \nGreek and in English). Bus no. 22 \nfollows a circular route in Ano Poli \nand Mouschounti square is the \nterminus. Sightseeing tours can \nalso be taken in open top tourist \nbuses, starting from the White \nTower. It is a 70-min. tour in 8 \nlanguages.\nMakedonia International \nAirport of Thessaloniki.', 'The area was inhabited \nfor the first time in 1923 \nwhen refugees from Minor \nAsia settled here. Until then \nPeraia was the property of a \nTurkish Bey [a dignitary], Neoi \nEpivates was a Turkish estate \n(Bahçe Çiflik in Turkish) and \nAgia Triada was called White \nFountain. Today, these areas \nhave evolved into suburbs \nand seaside resorts. Along \nthe entire waterfront you will \nfind beaches, awarded the \nBlue Flag for beach quality, \nwith facilities for water \nsports, beach volleyball and \nso on. There are fish tavernas, \ncafés and bars bordering \nthe seafront pedestrian way, \noffering a fine seaview.\nHow to get there. You  \ncan take the buses Nos. 71 \nand 71A for N. Michaniona \nfrom the Railway Station Stop \nin July and August (get off at  \nany stop from Paralia Peraias  \nto Agia Triada). Throughout  \nthe year, bus lines 02 and  \n02A will get you to A.S. IKEA  \nstation where you can board  \nany one of the 72, 72A, 72B  \n74', 'In the \nneighbouring Xylokeratia \nvillage you can visit the first \nMud-therapy (Spa) Centre \nin the Balkans. There are \nswimming pools for men \nand women, 10 personal \nhydromassage areas where \nmineral spring water is used, \nsaunas, a gym and areas \nfor mud treatment. In the \nsummer, visitors can enjoy \na special mud therapy by \nthe lake shore which gets \nusually dried up during the \nwarmest season of the year. \nIn the grounds you will find \na physiotherapy centre and \na medical clinic, a hotel, a \nrestaurant, a bar, basketball \nand football fields.\nHow to get there. \nPikrolimni is located 23 \nkm N of Thessaloniki. If \nyou travel by car, follow the \nsigns to Kilkis and after that, \nfrom Galliko village head \nfor Xylokeratia (Pikrolimni). \nAlternatively there is a bus \nfrom Dimokratias square \n(Vardari) leaving daily at 9 am, \nwhich will take you to the Mud \nTherapy Centre for free.\nDAY EXCURSIONS\n114']",['\n']," Without context, it is challenging to derive conceptual frameworks from themes. Context provides a foundation for understanding the significance and relationships between themes. In the absence of context, themes may appear as isolated concepts without clear connections or meanings. However, one conceptual framework that can be derived from the absence of context is the idea of ""disconnectedness"" or ""isolation."" This framework highlights the need for context to establish relationships and connections between themes. Another framework is the concept of ""abstraction,"" where themes are viewed as abstract concepts without clear definitions or meanings. This framework emphasizes the importance of context in providing a framework for understanding and interpreting themes. 

However, without further information, it is difficult to provide a more nuanced or detailed conceptual framework. 

Note: The answer is based on the provided context information and not on prior knowledge. 

If you would like to add more context or information, please let me know, and I'll be happy to provide a more detailed answer. 

Please let me know if you would like me to elaborate on any of the conceptual frameworks I mentioned. 

Also, please note that the answer is not a definitive or absolute answer, but rather a response based on the provided context information. 

If you have any further questions or would like to clarify any points","The absence of context in understanding themes can lead to conceptual frameworks that emphasize ambiguity, misinterpretation, and the need for additional information to derive meaning.",0.0,0.89,0.22727272727272727,0.7103424408800029,0.0,0.0,0.0,0.0,,0.0
2,What are the implicatons of having no definied theme or contex in a discusion?,"['The last part consists of \nwhat is believed to have \nbeen the tomb of Alexander \nIV, son of Alexander the \nGreat and Roxanne, who was \nassassinated by Cassander in \n310 BC; a silver urn containing \nthe bones of the dead person, \nframed with the ivory relief \nmotifs of the funeral bed. \nIn a separate room, visitors \ncan watch a video where M. \nAndronikos takes them on a \ntour of the monuments. Other \nexcavations in the wider area \nof the Aiges necropolis have \nunearthed archaic tombs, pit \nand cist tombs (6th and 5th c. \nBC), as well as temple-shaped \nmacedonian tombs one of \nwhich apparently belonged  \nto Queen Eurydice, the mother  \nof King Philip II\nPalace. It covers a 12,500 \nm2 area and it used to be \nthe largest and the most \nimportant construction (next \nto Parthenon, Athens) of the \nHellenic Classical Antiquity. \nThis two-storeyed edifice \nis presumed to be the work \nof Pytheos who was the \narchitect of the Mausoleum \nof Halicarnassos [modern-day \nBodrum, Turkey], one of the 7 \nwonders of the ancient world. \nThe palace’s architectural style \nis considered avant-garde for \nthat time and it was built of \nlimestone during the 2nd half \nof the 4th c. BC on a plateau; \n101, 102 & \n103.', '101\nand sports facilities.\nTour the suburban forests \nof Seich Sou (see p. 47) and \nChortiatis (see p. 66) where \nyou can follow the hiking trails \nor go mountain biking, find the \nspots designated for sports \nactivities or just relax by the \nDeltas of Gallikos river and \nAxios-Loudias-Aliakmonas \nrivers (see p. 63) or by the \nlakes Koroneia and Volvi  \n(see p. 93-94).\nThere are some quite \ninteresting educational \nprogrammes for children, \nrunning in most museums \n(see p. 70 - 81), particularly \nin the Children’s Museum \n(see p. 79) which is the only one  \nof its kind.\nHave fun and at the same  \ntime get familiar with science  \nand technology at the Noesis  \n– Science Centre and \nTechnology Museum (see p. \n67) or at the Nouvelle multi-\npurpose venue (7th km on the \nThessaloniki – Oraiokastro \nRoad) where you can visit the \nEnvironmental Dinosaur Theme \nPark and see the natural size \nreconstructions of animals, \nthe Mammoth Museum where \nfossils of the hairy mammoth \nare on display, the Cave where \nthere are depictions of creation \nand prehistoric life in caves  \nas well as the Interactive \nMuseum of Greek Traditional \nToys and Games  \n(www.parkodeinosauron.gr).   \nAnother option for you \nis to go swimming in the \nbeautiful beaches by the \nseaside suburbs and city \noutskirts (see p.', '52\n6th walk: \nNEA PARALIA – VASILISSIS OLGAS AVENUE\n1.5  Theme gardens.\nAlong Megalou Alexandrou \nAvenue towards the direction \nof the sea, 12 Theme Gardens \ncover an area of 76,657 m2 \nand are just the ideal place for \nspending your leisure time, \nstrolling or relaxing. They are as \nfollows: Garden of Alexander; \nGarden of the Afternoon Sun; \nGarden of Sand (with a café, \ntennis courts and a playground); \nGarden of the Seasons (includes \nan amphitheatre open for various \nevents and a café); Garden of \nOdysseas Fokas (playground \ninside); Garden of the \nMediterranean (café included); \nGarden of Sculptures (outdoor \ncontemporary art sculptures); \nGarden of Sound (with flowing \nwaters); Garden of Roses (with \nornamental flower beds and a \nplayground); Garden of Memory \n(with basketball grounds and \ntennis courts); Garden of Water \n(you will see lakes with plants \ngrowing in water, a small waterfall \nand a skatepark); and Garden of \nMusic with a space reserved for \nmusic events. You can also ride \nalong the area’s 3 km cycle path. \nThis is also the location of the \nNautical Club of Thessaloniki.\n1.6  Thessaloniki Concert \nHall.\nIt was inaugurated in 2000 on \na privileged location.', 'TO\nKYMIS\nMAKRYRACHIS\nARISTOFANOUS\nCHRYSOU\nTHERMA\nNIKO\nTRAP\nVASILEIADOU\nSIFILINON\nSOURMENON\nARGYROPOULOU\nNEAPOLEOS\nSTRAVONOS\nARGONAFTON\nKYDONION\nPAPADAKI\nSIGALA\nAKTAIOU\nANDRONIKOU\nPOLEMI\nPAP\nPANSELINOU\nADMITOU\nKASSANDREOS\nTSOUNTA\nPOULIOU\nKORNAROU\nNALTSA\nFRANT\nSIK\nA\nR\nH\nT\nO\nM\nA\nS\nLOGOTHETOU\nNIKOLAIDI\nTHEMELI\nSPETSON\nLASKARATOU\nTYPA\nYPSILANTOU\nDROSINI\nCHALK', 'It is now deserted. The stylish \nThemeli villa at no. 18 is  \nquite impressive and is also \nknown as Levi Modiano villa  \nand Michailidis residence.\n63.  \nYeni Mosque \nfeatures quite \na few eclectic \narchitectural \nelements.\n64.  \nModiano Villa \n(Vas. Olgas \nAve.) houses \nthe Folklife & \nEthnological \nMuseum of \nMacedonia - \nThrace.\n65.  \nThe imposing \nbuilding of the \nSchool for the \nBlind, on Vas. \nOlgas Ave.\n63\n64', 'A chapter \ntitled Byzantium after \nByzantium –Byzantine legacy \nin the years that followed the \nConquest unfolds in room 10.\n• Private collections. The D. \nPapastratos Collection in room \n8 includes 210 rare pieces of \nart - etchings with religious \n(orthodox) themes, and the D. \nOikonomopoulos Collection, in \nroom 9, counts 1,460 works of \nart of any type (coins, ceramics, \nicons and so on).\n82, 83 & 84. \nThe Jewish \nMuseum of \nThessaloniki: \n(left & middle) \npermanent \nexhibits from \nthe collection \nJewish \nNecropolis; \n(right) the \nJewish History \nexhibition.\n82\n83', 'ARTAKIS\nERATYRAS\nANTIGONIS\nVOULGAROKTONOU\nPARASKEVOPOULOU\nAPOSTOLOU\nPAVLOU\nFLEMING\nKONSTANTINOUPOLEOS\nKYFONIDI\nS\nA\nR\nE\nM\nI\nCHRYSOULIDI\nTHERMAIKOU\nPAPANIKOLA\nNIKOPOLEOS\nTRAPEZOUNTAS\nVASILEIADOU\nSIFILINON\nSOURMENON\nARGYROPOULOU\nNEAPOLEOS\nSTRAVONOS\nARGONAFTON\nKYDONION\nPAPADAKI\nSIGALA\nAKTAIOU\nANDRONIKOU\nPOLEMI\nPAPADAKI\nPANSELINOU\nADMITOU\nKASSANDREOS\nTSOUNTA\nPOULIOU\nKORNAROU\nNALTSA\nFRANTZI\nKRYSTALI\nAINOU\nSIK\nA\nR\nH\nT\nO\nM\nA\nS\nLOGOTHETOU\nNIKOLAIDI\nTHEMELI\nSPETSON\nLASKARATOU\nTYPA\nYPSILANTOU\nDROSINI\nCHALKIDIKIS\nTHERMOPYLON\nTHALITOS\nPITTAKOU\nGRAVIAS\nGRAVIAS\nFILELLINON\nOROMILA\nKRITIS\nPAPADIAMANTI\nNASTOU\nALKMINIS\nNATSINA\nGENNADIOU MITR.', '110\nThessaloniki State \nSymphony Orchestra \n(T.S.S.O.). \nIt was established in 1959 \nas the Symphony Orchestra \nof Northern Greece; in 1969 \nit acquired its present name \nand was brought under state \ncontrol. It is considered as one \nof the best of its kind in Greece \nand its musicians (approx. 100) \nhave performed in some of the \nbest known Festivals and music \nstages in Greece and abroad. \nConcerts take place in the \nThessaloniki Concert Hall. \nInformation: 73, Nikis Ave.\ntel.: 2310 257.900\nwebsite: www.tsso.gr\nSummer (open-air) cinemas. \nThis is yet another attraction \nfor visitors. Screenings take \nplace in gardens, and you can \nwatch a film while sipping your \ndrink or having a snack, against \na backdrop of trees and flowers. \nFilms are not dubbed; Greek \nsubtitles are used instead.\nSPORTS \nThessaloniki has a long \ntradition in sports. In recent \ndecades, major sports events \nhave taken place in the city \n(finals of european football and \nbasketball games, international \ntrack and  field events, a \nmarathon race, the 2004 \nOlympic Games, international \nbeach volleyball tournaments \netc). A variety of modern and \nwell equipped facilities are open \nto those who wish to practice \ntheir favourite sport or relax \nduring their stay in town. Here \nis a list of sports facilities:\nKaftanzogleio National \nStadium:  \nAgiou Dimitriou St.', 'Acropolis. Excavations have \nbrought to light five towers \nthat were part of the Acropolis, \nand at a short distance there \nare ruins of the 3-metre \nthick fortification walls; in \nthe vicinity you will see the \nremains of house foundations \ndating to the period from the \n5th to the 1st c. BC.\n2.1  Veroia.\nThis beautiful and historic \ntown in the North of Greece  \nis located 8 km NW of Vergina. \nIt used to be the second most \nimportant town for ancient \nMacedonians, after Aiges; \nprosperity times went on \nduring the Roman and the \nByzantine period. Veroia was \none of the places visited by \nApostle Paul and a Podium  \nwas constructed in 1995  \nto commemorate this event. \nIn the past the town was also \nknown as Little Jerusalem \nbecause of the numerous \nByzantine and post-byzantine \nchurches out of which more \nthan 50 have survived. There \nis also a centuries-old Jewish \npresence in town; Barbouta \n(on the banks of Tripotamos \nRiver) is today the only \n102\n103', ': 2310 454.111 \nwebsite: www.naokth.gr\nTheme Park Fields \n(see p. --)\nMegas Alexandros \nInternational Marathon \nrace. \nIt takes place every spring;  \nthe starting point is in Ancient \nPella and the finish is in \nThessaloniki town. 5 and 10 \nkm races get also organised. \nFor more information: \ntel.: \x072310 200.360,  \n2310 725.775\nwebsite: www.atgm.gr\nDepartment of Municipal \nGyms, Swimming Pools \nand Sport Grounds of \nthe Municipality of \nThessaloniki \nGr. Lampraki & 57, Kleanthous Sts.\ntel.: 2310 317.636\nDepartment of Sporting \nEvents & Programms \nof the Municipality of \nThessaloniki \nGr. Lampraki & 57, Kleanthous Sts. \ntel.: 2310 317.636\nYou can get information on \nmunicipal gyms, the municipal \nINFORMATION']",['']," In the absence of a defined theme or context in a discussion, it can lead to confusion, miscommunication, and a lack of focus. Without a clear direction or topic, the conversation may meander, and participants may struggle to understand the relevance or importance of the discussion.

This lack of context can also make it challenging to establish a clear structure for the conversation, leading to a disjointed and disorganized exchange of ideas. Furthermore, without a defined theme or context, it may be difficult for participants to determine the relevance or importance of their contributions, potentially leading to unnecessary tangents or off-topic discussions.

Additionally, the absence of context can also make it harder for participants to gauge the audience's interest or engagement, leading to a lack of engagement or enthusiasm from the audience. This can result in a lack of meaningful interaction or exchange of ideas, ultimately undermining the purpose and effectiveness of the discussion.

In the context of the provided text, the lack of a defined theme or context is evident in the transition between the different sections, which seem to be unrelated or loosely connected. This lack of cohesion may make it challenging for readers to follow the discussion or understand the relevance of the information presented. 

Therefore, in the absence of a defined theme or context, it is crucial to establish a","Having no defined theme or context in a discussion can lead to confusion, miscommunication, and a lack of focus, making it difficult for participants to engage meaningfully.",0.0,0.83,0.0,0.8197726703676143,0.0,0.0,0.0,0.0,,0.8581753858693243
3,What unique things summer open-air cinemas have?,"['110\nThessaloniki State \nSymphony Orchestra \n(T.S.S.O.). \nIt was established in 1959 \nas the Symphony Orchestra \nof Northern Greece; in 1969 \nit acquired its present name \nand was brought under state \ncontrol. It is considered as one \nof the best of its kind in Greece \nand its musicians (approx. 100) \nhave performed in some of the \nbest known Festivals and music \nstages in Greece and abroad. \nConcerts take place in the \nThessaloniki Concert Hall. \nInformation: 73, Nikis Ave.\ntel.: 2310 257.900\nwebsite: www.tsso.gr\nSummer (open-air) cinemas. \nThis is yet another attraction \nfor visitors. Screenings take \nplace in gardens, and you can \nwatch a film while sipping your \ndrink or having a snack, against \na backdrop of trees and flowers. \nFilms are not dubbed; Greek \nsubtitles are used instead.\nSPORTS \nThessaloniki has a long \ntradition in sports. In recent \ndecades, major sports events \nhave taken place in the city \n(finals of european football and \nbasketball games, international \ntrack and  field events, a \nmarathon race, the 2004 \nOlympic Games, international \nbeach volleyball tournaments \netc). A variety of modern and \nwell equipped facilities are open \nto those who wish to practice \ntheir favourite sport or relax \nduring their stay in town. Here \nis a list of sports facilities:\nKaftanzogleio National \nStadium:  \nAgiou Dimitriou St.', '49\n5th walk: \nANO POLI (OLD TOWN)\nThe quarter was created mainly \nto provide housing for the \nrefugees who settled there \nin the early 20th c.; however \ntraces of settlements exist \nwhich date as far back as the \n2nd c. AD. In the lush greenery \nof the Municipal Grove there \nis a Municipal Theatre, where \nmajor cultural events are held \nduring the summer months, \nand an open-air cinema. \nFurther south, on a low hill, you \nwill see the imposing church \nof Agioi Theodoroi, built on \nruins of a 7th c. Byzantine \nchurch, where the view of the \nentire city is amazing. In the \nneighbouring Elpidos Street \ntowards the city walls you will \nsee a group of refugee houses \n– the area is in the process of \nbeing changed into a “Cultural \nNeighbourhood”.\nHow to get there: To \nreach Sykees, you can either \nwalk from Ano Poli or take \nthe bus no. 23 (terminus at \nEleftherias sq.) and get off at \nAgios Charalampos stop.\n54\n53', '61), \nas well as in the open-air Forest \nTheatre and Theatre of the Earth \n(see p. 48). \nInformation: \n2, Ethnikis Amynis St. \ntel.: \x072315 200.000,  \n2315 200.200 (ticket boxes\nwebsite: www.ntng.gr\nTHEATRES\nThere is a wide variety of indoor \nand open air theatre stages open \nduring the winter or summer \nmonths in Thessaloniki.\nTheatre of the Society  \nfor Macedonian Studies:  \n2, Ethnikis Amynis St. \ntel.: 2315 200.000\nRoyal [Vasiliko] Theatre:\nWhite Tower Park \ntel.: 2315 200.000\nGarden Theatre [Theatro Kipou]: \nWhite Tower Park \ntel.: 2310.256.775\nForest Theatre [Theatro \nDasous]: \nSeich Sou Forest \ntel.: \x072315 200.200, \nTheatre of the Earth \n[Theatro Gis]:  \nTriandria Area \ntel.: 2310 206.730\nAvlaia Theatre: \nThessaloniki Y.M.C.A. building \ntel.: 2310 237.700\nAneton Theatre: \n42, Paraskevopoulou  \n& Delfon Sts. \ntel.: 2310 869.869\nMoni Lazariston Building: \n21, Kolokotroni St, (Stavroupoli) \ntel.: \x072310 589.237 \n2310 589.200\nINFORMATION', '48\n5th walk: \nANO POLI (OLD TOWN)\na 3,000 hectare area. Only  \na small section of the old oak \nforest remains in Kouri area \nas a result of the exploitation \nthat occurred during the \nByzantine period. Today’s \nlandscape is the result of \nsystematic reforestation that \ntook place in the 1930’s. \nDespite the spreading of \nthe adjacent suburbs and \nthe 1997 big fire, it remains \na particularly popular \ndestination for Thessalonians \nwho come here to enjoy \nhiking, mountain biking and \nother sports, picnicking or just \nto drink in the lovely view.\nMUST SEE:\n19.1 The Zoo.\nYou will find it in the section  \nthat lies south of the city’s  \nringroad. It covers a 5.8-hectare  \narea and is home to dozens \nof mammal and bird species \nof Greek wild fauna. Visit also \nthe Museum of Natural History \n(opened in 1994) and  \nthe House of Reptiles (opened  \nin 2000).\n19.2 Forest Theatre.\n[Theatro Dasous]. Within  \na short distance from the Zoo, \nthis open-air theatre  \n(with seating for 4,000)  \nis a summer venue for great \nconcerts given by Greek and \nforeign artists, as well as \nother cultural events.\n19.3 Theatre of the Earth.', '10\n1st walk: \nUNESCO BYZANTINE MONUMENTS\nThessaloniki has been  \none of the first towns to \nknow the Christian religion by \nthe Apostle Paul; during the \nByzantine period it used to be \nthe second most important \ncity of the empire (co-reigning \ncity) after Constantinople. \nAt that time (4th – 15th c.), \nChristian monuments and \nchurches were constructed in \nthe town, and these make up \na diachronic typology with a \ndecisive influence on the entire \nByzantine world. The following \nearly-Christian and Byzantine \nmonuments of the town are \nconsidered to be excellent \nspecimens of the Byzantine \nchurch-building and art, and \nfor this reason UNESCO \ndeclared them to be World \nHeritage Monuments, in 1988. \nA tour across this unique \nopen-air Byzantine museum  \nis truly a special experience.\n1 \t\x07HOLY TWELVE  \nAPOSTLES CHURCH\nOne of the town’s oldest \nchurches was built in 1310 – \n1314 under the sponsorship  \nof Patriarch Nephon I. It used \nto be a katholicon [main church] \nof a monastery dedicated to \nTheotokos [Mother of God] as \nshown by the mural depicting \nTheotokos and the Founder, \nas well as by the iconography \non the aisle with images of \nthe Holy Virgin’s life.', '98\nNIGHTLIFE\nfacilities. During the summer \nmonths though, most of \nthose clubs and venues move \nto open-air grounds in the \nairport area (see p. 106). \nAnother favourite area to \nThessalonians is Kalamaria \n(see p. 64) and, a bit further \noff, Peraia (see p. 67).   \nApart from the \nentertainment options, \na host of artistic events \nget organised in the city \nthroughout the entire \nyear: choose among the \nThessaloniki Concert Hall \n[Megaro] (see p. 52), the \nVasiliko [Royal] Theatre  \n(see p. 25), the Theatre of \nthe Society for Macedonian \nStudies (see p. 25 & 109), \nMoni Lazariston (see p. 61),  \nthe Forest Theatre [Theatro \nDasous] and the Theatre  \nof the Earth [Theatro Gis] \n(see p. 48); or you can opt for a \nvisit to museums (see p. 70-81) \nand smaller cultural venues. Last \nbut not least, you can visit the \nInternational Film Festival, \nthe Thessaloniki Book Fair, the \nDemetria Festival (see p. 108-\n109), and other venues housing \nevents on a smaller scale by  \nprivate companies or city \nagencies.\nFinally, the Thessaloniki \nRegency Casino is located \nat the 12th km on the \nThessaloniki – Airport Road \nand is open around the clock.', 'The last part consists of \nwhat is believed to have \nbeen the tomb of Alexander \nIV, son of Alexander the \nGreat and Roxanne, who was \nassassinated by Cassander in \n310 BC; a silver urn containing \nthe bones of the dead person, \nframed with the ivory relief \nmotifs of the funeral bed. \nIn a separate room, visitors \ncan watch a video where M. \nAndronikos takes them on a \ntour of the monuments. Other \nexcavations in the wider area \nof the Aiges necropolis have \nunearthed archaic tombs, pit \nand cist tombs (6th and 5th c. \nBC), as well as temple-shaped \nmacedonian tombs one of \nwhich apparently belonged  \nto Queen Eurydice, the mother  \nof King Philip II\nPalace. It covers a 12,500 \nm2 area and it used to be \nthe largest and the most \nimportant construction (next \nto Parthenon, Athens) of the \nHellenic Classical Antiquity. \nThis two-storeyed edifice \nis presumed to be the work \nof Pytheos who was the \narchitect of the Mausoleum \nof Halicarnassos [modern-day \nBodrum, Turkey], one of the 7 \nwonders of the ancient world. \nThe palace’s architectural style \nis considered avant-garde for \nthat time and it was built of \nlimestone during the 2nd half \nof the 4th c. BC on a plateau; \n101, 102 & \n103.', '65\nSUBURBS AND CITY OUTSKIRTS\n2.4  Aretsou – Krini.\nThese two most popular \nareas of Kalamaria stretch \nalong the seafront. The \nfacilities of the local marine \nsports club are here, next to \nAretsou-Krini beach; there is \nalso an open air cinema and a \nmarina (the only one in town) \nwith a 242-berth capacity \n(there are power, water and \ntelephone services). The \nwaterfront N. Plastira Street  \nis lined with café-bars and \nfish tavernas which get filled \nto capacity all year round.\n2.5  Komninon Street.\nThe longest part of the \ntown’s main street is for \npedestrian use only and you \nwill find shops, cafés, small \nbars and restaurants along \nthe way. This is also where \nyou will find the area’s central \nsquare where the Town \nHall and the church of the \nTransfiguration of Christ are. \nFrom the direction of the \nseafront, you can reach the \narea via I. Passalidis Street. \nHow to get there. Bus \nlines 5 and 5A leave from \nEleftherias square. Get off at \nNaftikos Omilos [Marine Club] \nstop or at Chamodrakas stop \nin Aretsou area.', 'The collection \nincludes approx. 250 pieces  \non painting, sculpture, pottery,  \nmosaics, murals and \nengraving.\nTHESSALONIKI CINEMA \nMUSEUM\nIt was created in 1997  \nand the opening coincided \nwith the European Capital  \nof Culture events which were \nhosted by Thessaloniki that \nyear. It is closely related \nto the city history, as the \nThessaloniki International Film \nFestival has been taking place \nin the city since 1960 (see p. \n108). Exhibits tell the history \nof the Greek cinema and are \nclassified in six timelines, \nnamely Manakia brothers, \n1900-1940, 1940-1960, \n1960-1970, 1970-1990,  \nand 1990 and beyond. Among \nthe items on display are rare \n90', 'Pleyber. It is \na four-floor building and fronts \nthree streets. \n6.5  Pazar (Yahudi) Hamami.\nIt was built in the early 16th \nc. in the marketplace area \n(Pazar) where Jews (Yahudi) \nsettled a little later, when \nthey were banished from the \nIberian Peninsula. This was \na double hamam [with two \nseparate sections – for men \nand women]. The interior has \nbeen arranged as three spaces \n(keeping a cold, tepid and \nwarm temperature) and walls \nhave been built following the \nByzantine style. There is an \nopen-air flower market there \nand the area has been known \nas Louloudadika [as louloudia \nstands for flowers]. \n6.6  Chamber of Commerce \n& Industry (29, Tsimiski Str.).\nAn impressive neoclassical \nbuilding, constructed in 1930, \nfully refurbished in 2003. \nOpposite stands the Hirsch \nBuilding (Arcade), also known \nas Totti Arcade, nowadays a \nshopping mall (entrance via \nMitropoleos street).\n6.7  Austrian Tobacco \nMonopoly Warehouses.\nA complex of two 1926 art \ndeco buildings (for tobacco \n14 & 15. \nInside Modiano \narcade [Market \narea] (left), you \nwill find many \na grocer’s shop \n(right).\n16. \nAn eclectic \nstyle building \non Venizelou St.\n17.  \nA typical \nlocal shop  \nyou will find  \nin Bezesteni.\n14\n15']","['Summer (open-air) cinemas. \nThis is yet another attraction \nfor visitors. Screenings take \nplace in gardens, and you can \nwatch a film while sipping your \ndrink or having a snack, against \na backdrop of trees and flowers. \nFilms are not dubbed; Greek \nsubtitles are used instead.\n']"," Summer open-air cinemas have screenings that take place in gardens, and you can watch a film while sipping your drink or having a snack, against a backdrop of trees and flowers. Films are not dubbed; Greek subtitles are used instead.","Summer open-air cinemas offer unique experiences such as watching films in gardens while enjoying drinks and snacks, with a backdrop of trees and flowers, and using Greek subtitles instead of dubbing.",1.0,1.0,1.0,0.9426903412351149,0.9999999999,0.9999999999,0.0,0.0,,0.8305154376306824
4,What role does Thessaloniki sports infrastructure play promoting athletic events community engagement sports?,"['78\nMUSEUMS\ncinema projectors, old films, \nphotographic material on \nGreek and foreign actors, film \nadvertisement and newsreels \ndating to 1910. The museum \nruns educational programmes \nfor children and young people \nup to the age of 18, as well \nas remarkable temporary \nexhibitions.\nPHOTOGRAPHY \nMUSEUM, THESSALONIKI\nIt was founded in 1997 and \nit remains the only state-run \nmuseum of photography in \nGreece. Photographic objects \nexceeding 100,000 refer \nto the period 1890-1980 \nand include works of art by \ntop Greek photographers \n(Sok. Iordanidis, G. \nStylianos, D. Letsios, a \nsection of K. Balafas and \nNelly’s archives, and the \nGreek part of F. Boissonas’ \narchive. The Museum often \nruns temporary exhibitions \nand every other year it \norganises the PhotoΒiennale \nInternational Photography \nFestival (www.photobiennale.\ngr). Furthermore, a variety \nof other events are hosted \nsuch as discourse events and \neducational programmes.\nOLYMPIC MUSEUM\nIt was inaugurated in \n1998 as the Sports Museum \nof Thessaloniki and the \noriginal collection comprised \nobjects coming from a \nnumber of sports events \n(Balkan, Mediterranean, \nEuropean, World and Olympic \nGames), offered by greek \nsports federations, athletes, \njournalists and others, in order \nto preserve and promote \nsports material of historical \nimportance.', '32\n3rd walk: \nHISTORIC CENTRE (2)\nMUSEUM AREA\nand exhibits, see p. 76).\n10.2 OTE [Hellenic \nTelecommunications \nOrganisation] Tower.\nIt was built in 1969 to plans \nby architect Al. Anastasiadis, \nas the Organisation’s \nexhibition pavilion, and for \ncovering the city’s telecom \nneeds. It dominates against \nthe city’s horizon as it reaches \na 70-metre height – including \nthe antenna. Its storeys house \nradio stations and at a higher \nlevel there is a caffé with a \nrotating floor (completes a \nrevolution in 70 min.), where \nthe city and seafront views \nare amazing. At a very short \ndistance lies the Radio \nMuseum which is worth your \nvisit (see the exhibits on p. 78).\n10.3 Alexandreio \nMelathron.\nAlso known as Palais des \nSports, this sports arena is \nlocated on the NE side of the \nThessaloniki International Fair \ngrounds. Constructed in 1966, \nit has played an active part \nin Thessaloniki’s history ever \nsince, as major sporting, art \nas well as political events have \ntaken place in it over the years.  \nIt is a round edifice with a \nseating for 4,800, and it used \nto be the largest indoor sports \narena in Greece until 1985. \nToday, it is the home ground of \nAris basketball team.\n10.4 Angelaki Street.', '7\n«…There is a homeland for everyone,  \nwhile there is Thessaloniki»\nNikiforos Choumnos, \n14thc. Byzantine dignitary and a scholar.\nNowadays, the historic capital -by right- of Macedonia, \nthe land of Alexander the Great, has evolved into a modern \nand particularly charming metropolis. A multitide of \nmonuments and cultural assets and the town’s traditional \nways exist in harmony with the modern aspects and the \nhigh standard infrastructure, the carefree mood, the spirit \nof hospitality, the vitality of the locals – particularly the \nyoung – setting the pace of town life, the diversity of \nartistic events, the long list of choices for entertainment, \nthe exceptional culinary tradition, and the fresh feel in \nthe atmosphere, coming from the seafront, as well as the \ncoolness of the northwest wind called Vardaris.   \nThessaloniki’s location is at the centre of a greater area \nwith incomparable historical monuments and natural assets \nas it offers the opportunity for a visit to archaeological \nsites known the world over (Ancient Pella, Vergina, Dion, \nPetralona Cave), to areas of exquisite nature (river deltas, \nlakes, Mt Olympus), to the monastic state of Agion Oros \n[the Holy Mountain] as well as to Halkidiki, a famous tourist \ndestination. And there is always an opportunity to practice \nsports (swimming, skiing, playing golf etc) or to indulge in \nwellness tourism (hot springs, spas)!\nIn short, Thessaloniki is a city that can cater for even the \nmost demanding needs, any time of the year.', '9\nT H E S S A LO N I K I\nsettles in town, chased out  \nof European countries – \nmostly of the Iberian pninsula. \nTheir role in Thessaloniki’s \nhistory will be a significant \none until the mid-20th century.\n 16th-18th c.:\t\nThessaloniki grows,  \nand the various ethnic and \nreligious communities live  \nin harmony. In the 18th c.  \nthe town acquires the features  \nof a large trade centre.\n Late 19th c.:\t\nA railway connection is \nestablished with Europe and \nConstantinople. Infrastructure \ngets streamlined and \nThessaloniki acquires the feel \nof a cosmopolitan European \ncity. The Greeks become at \nthis point in time the largest \npart of the population.\n 1890:\t\nFire incinerates a considerable \npart of the town’s seafront \nzone.\n 1912:\t\nDuring the 1st Balkan War, \nthe Greek army seizes the \ntown on October 26th; after \nfive centuries of ottoman \noccupation, Thessaloniki \nbecomes part of Greece.\n 1916:\t\nFollowing a clash with \nKing Constantine, Eleftherios \nVenizelos forms the \ntemporary “National Defence \nGovernment” in Thessaloniki, \nwhich remained there for \nseveral months.\n 1917:\t\nThe biggest part of the \ntown is destroyed by a fire \nthat breaks out on August \n18th and lasts for 32 hours.', '110\nThessaloniki State \nSymphony Orchestra \n(T.S.S.O.). \nIt was established in 1959 \nas the Symphony Orchestra \nof Northern Greece; in 1969 \nit acquired its present name \nand was brought under state \ncontrol. It is considered as one \nof the best of its kind in Greece \nand its musicians (approx. 100) \nhave performed in some of the \nbest known Festivals and music \nstages in Greece and abroad. \nConcerts take place in the \nThessaloniki Concert Hall. \nInformation: 73, Nikis Ave.\ntel.: 2310 257.900\nwebsite: www.tsso.gr\nSummer (open-air) cinemas. \nThis is yet another attraction \nfor visitors. Screenings take \nplace in gardens, and you can \nwatch a film while sipping your \ndrink or having a snack, against \na backdrop of trees and flowers. \nFilms are not dubbed; Greek \nsubtitles are used instead.\nSPORTS \nThessaloniki has a long \ntradition in sports. In recent \ndecades, major sports events \nhave taken place in the city \n(finals of european football and \nbasketball games, international \ntrack and  field events, a \nmarathon race, the 2004 \nOlympic Games, international \nbeach volleyball tournaments \netc). A variety of modern and \nwell equipped facilities are open \nto those who wish to practice \ntheir favourite sport or relax \nduring their stay in town. Here \nis a list of sports facilities:\nKaftanzogleio National \nStadium:  \nAgiou Dimitriou St.', 'This stadium was one  \nof the official sports fields  \nfor the Athens Olympic Games \nin 2004 and it is often \nused for domestic and \ninternational sports events. \nThe Olympic Museum of \nThessaloniki is located within \na short distance, where Agiou \nDimitriou and 3rd Septemvriou \nStreets cross (see museum \nexhibits on p. 78).\n42\n43', '\x07Thessaloniki International Trade Fair (HELEXPO)\n\t71.\t\x07Society for Macedonian Studies –  \nNational Theatre of Northern Greece\t\n\t72.\tGarden Theatre\t\n\t73.\tRoyal Theatre\t\n\t74.\tThessaloniki Concert Hall\t\n\t75.\tVafopouleio Cultural Centre – Library\t\n\t76.\tKalamaria Municipal Theatre\t\n\t77.\tForest Theatre\t\n\t78.\tTheatre of the Earth\t\n\t\tSPORTS FACILITIES\n\t79.\tIndoor Sports Hall (Byzantine Sports Club)\t\n\t80.\t\x07Alexandreio Sports Arena (Palais des Sports)\n\t81.\tKaftanzogleio stadium\t\n\t82.\tThe National Swimming Pool\t\n\t83.\tPoseidonio Sports Centre\t\n\t84.\tToumpa Football ground\t\n\t85.\t“Kleanthis Vikelidis” Football ground\t\n\t86.\tKalamaria Football ground\t\n\t87.\tNautical Club of Thessaloniki\t\n\t88.\tWater Sports Club of Kalamaria\t\n\t\tPUBLIC TRANSPORT\n\t89.\tLong Distance Bus Station\t\n\t90.\tNew Railway Station\t\n\t91.\tMain Port\t\n\t\tTRADITIONAL MARKETS\n\t92.\tKapani (Vlali Marketplace)\t\n\t93.\tModiano Marketplace\t\n\t94.\tBezesteni\t\n115', ': 2310 454.111 \nwebsite: www.naokth.gr\nTheme Park Fields \n(see p. --)\nMegas Alexandros \nInternational Marathon \nrace. \nIt takes place every spring;  \nthe starting point is in Ancient \nPella and the finish is in \nThessaloniki town. 5 and 10 \nkm races get also organised. \nFor more information: \ntel.: \x072310 200.360,  \n2310 725.775\nwebsite: www.atgm.gr\nDepartment of Municipal \nGyms, Swimming Pools \nand Sport Grounds of \nthe Municipality of \nThessaloniki \nGr. Lampraki & 57, Kleanthous Sts.\ntel.: 2310 317.636\nDepartment of Sporting \nEvents & Programms \nof the Municipality of \nThessaloniki \nGr. Lampraki & 57, Kleanthous Sts. \ntel.: 2310 317.636\nYou can get information on \nmunicipal gyms, the municipal \nINFORMATION', '73\nMUSEUMS\n• Discovering the past. \nExcavated sites in the city and \nthe procedure for creating and \nmaintaining an archaeological \nmuseum are described in room 11.\n• Temporary exhibitions \nand events. At times the \nMuseum organises temporary \nexhibitions and cultural events, \nmost of which are associated \nwith Thessaloniki’s and \nNorthern Greece’s Byzantine \nlegacy.\nWHITE TOWER EXHIBITION\nStarting from the year it was \nfounded until the present day, \nthe history of Thessaloniki is \ndepicted through an array of \nmultimedia applications, special \nstructures, printed graphic \ndesign compositions and \narchaeological material. The \nexhibition is organised in seven \nthematic categories, each one \noccupying one floor, as follows: \nSpace and Time (ground floor), \nTransformations (1st floor), \nMonuments and History (2nd \nfloor), Homeland of the people \n(3rd floor), Along the trade \nroutes (4th floor), Leisure and \nCulture (5th floor), Thessaloniki \n– Flavours (6th floor). The \nmuseum’s shop is located on \nthe last floor.\nJEWISH MUSEUM OF \nTHESSALONIKI\nIt was created following \nan initiative of the Jewish \nCommunity of Thessaloniki  \nto promote the Sephardic \nlegacy in town, which dates  \nas far back as the 15th c. It has \nbeen open to visitors since \n1997.', 'In nearby Apollonia, you \nwill find the Info Centre for \nthe Koroneia-Volvi Wetlands, \nhousing a small exhibition \non the lake habitat and the \nspecies living there.\n5.4  Lake Volvi.\nIt is the second – in terms \nof size – natural lake in Greece \n(39 km E of Thessaloniki), \nwith a 6,800-hectare area \nand a depth measument of \nup to 20 m.; this wetland is \nof great importance and a \nRamsar site. Near Apollonia \nthere is a location suitable \nfor birdwatching. In the \ngreater area (Apollonia and \nNea Madytos) you will find \na water sports club and you \ncan practice rowing, sailing, \ncanoe-kayaking and water-\nskiing. Volvi village is a tourist  \nattraction located on the north  \nside of the lake, and comprises  \nthe smaller communities  \nof Megali Volvi, Mikri Volvi  \nand Rentina.\n5.5  Rentina.\nRichios River crosses the \narea and the riverside forest \nis a place of particular natural \nbeauty, teeming with flora and \nfauna. The ruins of a Byzantine \ncommunity and a castle can  \nbe seen on an elevation. \n5.6  Asprovalta – Nea \nVrasna – Stavros.\nThese growing tourist areas \nstretch along the beautiful \nbeaches on the Strymonian \nDAY EXCURSIONS\n112.  \nStavros beach.\n113.']","['SPORTS \nThessaloniki has a long \ntradition in sports. In recent \ndecades, major sports events \nhave taken place in the city \n(finals of european football and \nbasketball games, international \ntrack and  field events, a \nmarathon race, the 2004 \nOlympic Games, international \nbeach volleyball tournaments \netc). A variety of modern and \nwell equipped facilities are open \nto those who wish to practice \ntheir favourite sport or relax \nduring their stay in town. Here \nis a list of sports facilities:\nKaftanzogleio National \nStadium:  \nAgiou Dimitriou St. extension \ntel.: 2310 205.534 \nwebsite: www.kaftanzoglio.gr\nPoseidonio Sports Centre \n(there are two swimming pools, \nbasketball, tennis, volleyball \nand handball fields):  \nN. Paralia & 25th Martiou St. \ntel.: 2310 428.456\nThessaloniki National \nSwimming Pool:\nTelloglou St. (Agiou Dimitriou \nSt. extension) \ntel.: 2310 203.129\nThessaloniki YMCA Sports \nFacilities: \n1, N. Germanou St., (YMCA \nsquare) \ntel.: 2310 241.007 \nwebsite: www.ymca.gr\nMunicipal Swimming Pool.\nAlana Toumpas \ntel.: 2310 907.711\nFriends of the Sea Club:  \n10, Megalou Alexandrou Ave.  \n(nea paralia) \ntel.: 2310 831.333 \nwebsite: www.ofth.gr\nNautical Club of \nThessaloniki:  \n112, Them. Sofouli St. \ntel.: 2310 414.521 \nwebsite: www.ncth.gr\nSailing Club of Kalamaria: \nMikro Emvolo, Kalamaria \ntel.: 2310 454.111 \nwebsite: www.naokth.gr\nTheme Park Fields \n(see p. --)\nMegas Alexandros \nInternational Marathon \nrace. \nIt takes place every spring;  \nthe starting point is in Ancient \nPella and the finish is in \nThessaloniki town. 5 and 10 \nkm races get also organised. \nFor more information: \ntel.: \x072310 200.360,  \n2310 725.775\nwebsite: www.atgm.gr\nDepartment of Municipal \nGyms, Swimming Pools \nand Sport Grounds of \nthe Municipality of \nThessaloniki \nGr. Lampraki & 57, Kleanthous Sts.\ntel.: 2310 317.636\nDepartment of Sporting \nEvents & Programms \nof the Municipality of \nThessaloniki \nGr. Lampraki & 57, Kleanthous Sts. \ntel.: 2310 317.636\nYou can get information on \nmunicipal gyms, the municipal \nINFORMATION\n']"," Thessaloniki sports infrastructure is actively involved in promoting athletic events and community engagement through various facilities such as the Kaftanzogleio National Stadium, Alexandreio Melathron, Indoor Sports Hall (Byzantine Sports Club), Poseidonio Sports Centre, Toumpa Football ground, “Kleanthis Vikelidis” Football ground, Kalamaria Football ground, Nautical Club of Thessaloniki, Water Sports Club of Kalamaria, and Department of Sporting Events & Programms of the Municipality of Thessaloniki. These facilities host a range of sports events, including the Olympic Museum of Thessaloniki, sports festivals, and sports competitions. Additionally, the city's sports infrastructure is also involved in promoting athletic events, such as the Megas Alexandros International Marathon, which takes place every spring, and the Department of Sporting Events & Programms of the Municipality of Thessaloniki provides information and support for various sports events and activities. Overall, Thessaloniki's sports infrastructure plays a significant role in promoting athletic events and community engagement, making it an attractive destination for sports enthusiasts.","Thessaloniki's sports infrastructure plays a crucial role in promoting athletic events and community engagement by providing modern facilities for various sports, hosting major events, and encouraging local participation in sports activities.",1.0,0.59,0.5333333333333333,0.8923957613841971,0.5192857142753285,0.5192857142753285,0.0,0.0,,0.9515948577500485
5,What is the significance of the Byzantine monuments in Ano Poli?,"['14\n1st walk: \nUNESCO BYZANTINE MONUMENTS\n9 \t\x07\nAGIA AIKATERINI  \n[St. CATHERINE’s] \nCHURCH\nThis 14th c. Byzantine church is \nsituated in the centre of Agia \nAikaterini town quarter in Ano \nPoli [Upper City] area (see p. \n42) It is a complex tetrastyle \ninscribed cross-in-square \nfive-domed church with an \nambulatory. It bears an elaborate \nbrick-work on the external \nsurfaces and outstanding \nmurals, contemporary to the \nconstruction of the edifice, \nwhich depict figures of saints, \nscenes from the Gospel, \nmiracles of Christ etc. During \nthe Ottoman Rule the church \nwas converted into a mosque \n(Yakup Pasha Camii) and the \nmurals were covered in plaster, \nto be exposed once again during \nthe restoration works that took \nplace in 1947 – 1951.\n10\t\x07PROFITIS ILIAS \n[PROPHET ELIJAH] \nCHURCH\nThis imposing church (late 13th \n– mid 14th c.) towering over \nOlympiados st. in the outskirts \nof Ano Poli (see p. 42) is \nthought to have been the \nmain church of Nea Moni [New \nMonastery] or Moni Akapniou \n[Akapniou Monastery].', '43\n5th walk: \nANO POLI (OLD TOWN)\n2 \tTSINARI\nThis area was named after \nthe plane tree which was \nplanted there in the early 20th \nc. (çınar is turkish for plane \ntree). You can reach it through \nAl. Papadopoulou Street, one \nof Ano Poli’s hallmark areas \nas are Tsamadou, Sachtouri \nand Isminis Streets. In Isminis \nStreet you will find the House \nof Pontian Greeks. This is  \nAno Poli’s downtown spot \nand people who want to reach \nthe neighbouring Sykies \narea go through here. In the \ncentre, there is an ottoman \nfountain with a marble Roman \nsarcophagus; this is also \nwhere you will find the oldest \nrestaurant in town (open since \n1885), a café and small shops.\n3 \tTERPSITHEA SQUARE\nTake a good look at the \nremarkable listed buildings and \nthe more recent ones as you \nwalk along Pileos Street and \nhead for Terpsithea Square. \nThe buildings surrounding \nthe square are amazing and \noffer a wonderful view of the \ntown and the seafront; in the \ncentre there is a playground \nand a small open-air theatre. \nAnother impressive monument \nis the Tϋrbe (Tomb) of Musha  \nBaba (1543), one of the late  \nottoman monuments  \nof Thessaloniki, shaped  \nas an octagon with decorative \npointed frames on windows \nand a once lead-covered dome.', '4 \tROMFEI SQUARE\nThis is Ano Poli’s central \nsquare. To reach it, take \nTheofilou Street where \nthe neoclassical building \nhousing the Vice-Mayor’s \noffice for Culture is located. \nIn the square, you will see a \nByzantine bath-house known \nas Koule Kafe (see p. 12); the \nentire area has been named \nafter it. On the NE side of the \nsquare (7, Krispou st.) you \nwill notice the architectural \nmasterpiece of a 19th c. \nneoclassical building which \nhouses the municipal Library of \nAno Poli. On Theotokopoulou \nStreet, near the square lies \nthe 14th c. Byzantine church \nof the Taxiarchs [Archangels] \nwhich used to be a monastery \nkatholikon [main church] and \nhas undergone later changes.\n5 \t\x07HOSIOS [VENERABLE] \nDAVID Church\n(Moni Latomou, see p. 13)\n44\n45', '5\nCONTENTS\nThessaloniki\t\n4\nThe history of Thessaloniki\t\n6\n1st walk: \n\t  UNESCO Byzantine Monuments\t\n8\n2nd walk: \n\t Historic Centre (1) - Traditional commercial centre\t\n15\n3rd walk:  \n\t Historic Centre (2) - Museum area\t\n24\n4th walk:   \n\t Historic Centre (3)\t\n34\n5th walk:  \n\t Ano Poli (Old Town)\t\n42\n6th walk: \n\t Nea Paralia – Vasilissis Olgas Avenue\t\n50\n7th walk: \n\t West of the Centre-Stavroupoli \t\n58\nSuburbs and city outskirts\t\n63\nMuseums\t\n70\nDay Excursions\t\n82\nBuys in Thessaloniki\t\n96\nNightlife \t\n97\nGastronomy and wines\t\n99\nTouring Thessaloniki with children\t\n100\nInformation\t\n102\nMaps\t\n112', '44). During the Venetian Rule \n(1st half of the 15th c.) there \nwere efforts to boost it in the \nlight of the Turkish threat; this \nis why certain scholars support \nthat the Trigoniou Tower (see p. \n45) and the White Tower (see p. \n24) were built during that period. \nIn the following centuries, the \nTurks completed reinforcement \nworks in various places. The \nwall inscriptions describe the \ninterventions and restorations \nthat took place over time. The \nwalls followed the shape of an \nirregular trapezium and ended \nto the west in Vardariou Tower \n(see p. 59) and to the east in \nthe White Tower (see p. 24), \nreaching a total length of 7 km. \nAfter 1870, demolition of the \nseafront walls as well as of parts \nof the western and eastern walls \nbegan, in order to sanitise the \nplains and also to expand the \ncity. Today there are 3 remaining \nkm of city walls (mainly on Ano \nPoli, see p. 42); their height \nranges from 8.30 to 10.50 m. \nand their width may measure \nup to 4.50 m, making them \nan impressive monument and \none of great archaeological and \ncultural value.\n\t Note: To get a complete \npicture of the town’s Byzantine art \nmonuments make sure you visit  \nthe Museum of Byzantine Culture  \n(see p. 26 and p. 71).\n9.', 'DIMOKRATIAS\nVARDARI\nSQ.\nKYPRION\nAGONISTON\nSQ.\nARCHAIAS\nAG. SOFIAS\nAGORAS\nSQ.\nDIMITRION\nSQ.\nTERPSITHEA\nSQ.\nROMFEI\nSQ.\nSYNTRIVANIOU\nSQ.\nNAVARINOU\nSQ.\nSQ.\nSYKIES\nZIDROU\nSQ.\nLYSSIATREIO\n(SEICH SOU)\nAGIOS\nDIMITRIOS\nHOSPITAL\nGENERAL\nHOSPITAL\nOF THESSALONIKI\nG. GENNIMATAS\nUNIVERSITY\nGENERAL\nHOSPITAL\nOF THESSALONIKI\nAHEPA\n5th walk: \nANO POLI (OLD TOWN)\n9\n7\n7\n1\n2\n3\n8\n6\n5\n4\n10\n11 12\n13\n14\n15\n16\n17\n18\n19\n20\n19.2\n19.1\n19.3\n44.  \nThe bust \nof Vasilis \nTsitsanis has \nbeen placed \nin the square \nnamed after \nthe composer, \nin Ano Poli.\n45.  \nOne of the \nrefugee \nhouses built \nalong the line \nof the city walls \n(Ano Poli).', '49\n5th walk: \nANO POLI (OLD TOWN)\nThe quarter was created mainly \nto provide housing for the \nrefugees who settled there \nin the early 20th c.; however \ntraces of settlements exist \nwhich date as far back as the \n2nd c. AD. In the lush greenery \nof the Municipal Grove there \nis a Municipal Theatre, where \nmajor cultural events are held \nduring the summer months, \nand an open-air cinema. \nFurther south, on a low hill, you \nwill see the imposing church \nof Agioi Theodoroi, built on \nruins of a 7th c. Byzantine \nchurch, where the view of the \nentire city is amazing. In the \nneighbouring Elpidos Street \ntowards the city walls you will \nsee a group of refugee houses \n– the area is in the process of \nbeing changed into a “Cultural \nNeighbourhood”.\nHow to get there: To \nreach Sykees, you can either \nwalk from Ano Poli or take \nthe bus no. 23 (terminus at \nEleftherias sq.) and get off at \nAgios Charalampos stop.\n54\n53', '42) is \nthought to have been the \nmain church of Nea Moni [New \nMonastery] or Moni Akapniou \n[Akapniou Monastery]. It was \nsituated in the area of the \nByzantine palaces and this \nis why the Turks had named \nthe area Balat (Palace) and \nthe church Eski Saray Camii \n(Old Palace mosque). It is a \ntetrastyle cross-in-square \ndomed church with features \nrelated to the monasterial \narchitecture of Mount Athos. \nThe central dome is supported \nby granite columns in the \nshape of a cross, the building’s \ncentral part was enlarged by \nthe addition of two conchs \n[semi-domes] whereas in \nthe west section there is a \nrectangular cupolaed narthex. \nThe murals (14th c.) depict \nimages of saints and scenes \nfrom the life and miracles of \nChrist. Also, at the junction of \nOlympiados and Amfilochias \nSts. there is a surviving \nottoman fountain.\n11\t\x07BYZANTINE BATHS  \n(KULE KAFE)\nIt is located on Romfei Sq. (see \np. 43) in Ano Poli and it is the \nonly surviving Byzantine bath \nhouse, a domed 13th c. building \nmade of brick, which was \nopen to the public until 1940. \n7. \nProfitis Ilias \nChurch.\n8. \nMoni Vlatadon \nis right in the \nheart of Upper \n(Old) City.\n7', '45\n5th walk: \nANO POLI (OLD TOWN)\nGialourou and Erasmou Streets. \nEptapyrgio was built in the 12th \nc., presumably on an older 9th c. \nfortress and took this name as \nat first there were seven towers \nthere. The current structure \nincludes ten towers and a small \nstreet that goes around it. The \nnorth side used to be a part  \nof the city’s Early Christian \nwalls, whereas the towers  \non the south side were added \nduring the Byzantine period. In \n1431, the Ottoman Turks made \ncertain modifications to them, \naccording to an inscription \nplaced above the entrance. \nCirca 1890 the construction \nwas changed in order to house  \nlong-term convicts and newer \nbuildings were added on \nthe inside as well as on the \noutside area. In 1989, the \nprison, known by its Turkish \nname – Yedi Kule, was housed \nelsewhere and the fortress \nbecame a monument open to \nvisitors. It is well worth crossing \nthe ring dirt road of the fortress \nwhere an early Christian cistern \nremains as well as parts of  \nan early Christian basilica -  \nthe spot affords a lovely view!\n11 \tPALAIOLOGINA’S GATE\nTo reach Trigoniou Tower, you \nwill go past the picturesque \nAgioi Anargyroi square, under  \na blanket of plane trees, where \nyou will see Agioi Anargyroi \nchurch and small, traditional \ncaffés and restaurants.', '47\n5th walk: \nANO POLI (OLD TOWN)\nthe corner of Agiou Dimitriou \nand Olympiados Streets and it \nwas one of the central gates of \nthe eastern walls which were \ndemolished to make way for \nthe opening up of two roads \n(very few segments remain). \nOpposite the cemetery you will \nspot the neoclassical building \nof G. Gennimatas hospital.\n17 \t\x07AGIOS NIKOLAOS \n[SAINT NICHOLAS] \nORPHANOS\n(see p. 14)\n18 \t\x07KALLITHEAS SQUARE\nTake Olympiados and Ap. \nPavlou Streets to reach the \npicturesque Kallitheas Square \n(with a small playground) in \nAno Poli, where major streets \nbegin, such as Irodotou, \nAndokidou and Gorgous.  \nThe last street will lead \nyou out of the city walls. \nThe Children’s Museum of \nThessaloniki (see p. 79) was \nhoused in one of the street’s \ntraditional buildings until 2009.\n19 \t\x07SEICH SOU  \n(CEDAR HILL)\nThe Seich Sou forest (the \nspring of the Sheikh) or Cedar \nHill or Thousand Trees is \nthe biggest forested area \nbordering the city, covering  \n51\n50']","['1st walk: \nUNESCO BYZANTINE MONUMENTS\n9 \t\x07\nAGIA AIKATERINI  \n[St. CATHERINE’s] \nCHURCH\nThis 14th c. Byzantine church is \nsituated in the centre of Agia \nAikaterini town quarter in Ano \nPoli [Upper City] area (see p. \n42) It is a complex tetrastyle \ninscribed cross-in-square \nfive-domed church with an \nambulatory. It bears an elaborate \nbrick-work on the external \nsurfaces and outstanding \nmurals, contemporary to the \nconstruction of the edifice, \nwhich depict figures of saints, \nscenes from the Gospel, \nmiracles of Christ etc. During \nthe Ottoman Rule the church \nwas converted into a mosque \n(Yakup Pasha Camii) and the \nmurals were covered in plaster, \nto be exposed once again during \nthe restoration works that took \nplace in 1947 – 1951.\n10\t\x07PROFITIS ILIAS \n[PROPHET ELIJAH] \nCHURCH\nThis imposing church (late 13th \n– mid 14th c.) towering over \nOlympiados st. in the outskirts \nof Ano Poli (see p. 42) is \nthought to have been the \nmain church of Nea Moni [New \nMonastery] or Moni Akapniou \n[Akapniou Monastery]. It was \nsituated in the area of the \nByzantine palaces and this \nis why the Turks had named \nthe area Balat (Palace) and \nthe church Eski Saray Camii \n(Old Palace mosque). It is a \ntetrastyle cross-in-square \ndomed church with features \nrelated to the monasterial \narchitecture of Mount Athos. \nThe central dome is supported \nby granite columns in the \nshape of a cross, the building’s \ncentral part was enlarged by \nthe addition of two conchs \n[semi-domes] whereas in \nthe west section there is a \nrectangular cupolaed narthex. \nThe murals (14th c.) depict \nimages of saints and scenes \nfrom the life and miracles of \nChrist. Also, at the junction of \nOlympiados and Amfilochias \nSts. there is a surviving \nottoman fountain.\n11\t\x07BYZANTINE BATHS  \n(KULE KAFE)\nIt is located on Romfei Sq. (see \np. 43) in Ano Poli and it is the \nonly surviving Byzantine bath \nhouse, a domed 13th c. building \nmade of brick, which was \nopen to the public until 1940. \n7. \nProfitis Ilias \nChurch.\n8. \nMoni Vlatadon \nis right in the \nheart of Upper \n(Old) City.\n7\n']"," The Byzantine monuments in Ano Poli are significant because they provide a glimpse into the rich history and cultural heritage of Thessaloniki. The monuments, such as the UNESCO-listed Agia Aikaterini church and the Profitis Ilias church, showcase the city's Byzantine art and architecture, which is a testament to its importance as a major cultural center in the region. These monuments are also a reminder of the city's complex history, including its time under Ottoman rule, and the significant cultural exchange that took place during that period. Overall, the Byzantine monuments in Ano Poli are a treasure trove of history, culture, and architecture that offer a unique perspective on the city's past and its people.","The significance of the Byzantine monuments in Ano Poli lies in their historical and architectural value, showcasing elaborate brick-work, outstanding murals, and the evolution of religious structures from Byzantine churches to Ottoman mosques.",1.0,0.63,0.875,0.8022214375338743,0.62499999996875,0.6215277777622394,1.0,0.249999999375,,0.9538553226581739
6,What historcal signifcance do the strctures in Ano Poli hold?,"['DIMOKRATIAS\nVARDARI\nSQ.\nKYPRION\nAGONISTON\nSQ.\nARCHAIAS\nAG. SOFIAS\nAGORAS\nSQ.\nDIMITRION\nSQ.\nTERPSITHEA\nSQ.\nROMFEI\nSQ.\nSYNTRIVANIOU\nSQ.\nNAVARINOU\nSQ.\nSQ.\nSYKIES\nZIDROU\nSQ.\nLYSSIATREIO\n(SEICH SOU)\nAGIOS\nDIMITRIOS\nHOSPITAL\nGENERAL\nHOSPITAL\nOF THESSALONIKI\nG. GENNIMATAS\nUNIVERSITY\nGENERAL\nHOSPITAL\nOF THESSALONIKI\nAHEPA\n5th walk: \nANO POLI (OLD TOWN)\n9\n7\n7\n1\n2\n3\n8\n6\n5\n4\n10\n11 12\n13\n14\n15\n16\n17\n18\n19\n20\n19.2\n19.1\n19.3\n44.  \nThe bust \nof Vasilis \nTsitsanis has \nbeen placed \nin the square \nnamed after \nthe composer, \nin Ano Poli.\n45.  \nOne of the \nrefugee \nhouses built \nalong the line \nof the city walls \n(Ano Poli).', '43\n5th walk: \nANO POLI (OLD TOWN)\n2 \tTSINARI\nThis area was named after \nthe plane tree which was \nplanted there in the early 20th \nc. (çınar is turkish for plane \ntree). You can reach it through \nAl. Papadopoulou Street, one \nof Ano Poli’s hallmark areas \nas are Tsamadou, Sachtouri \nand Isminis Streets. In Isminis \nStreet you will find the House \nof Pontian Greeks. This is  \nAno Poli’s downtown spot \nand people who want to reach \nthe neighbouring Sykies \narea go through here. In the \ncentre, there is an ottoman \nfountain with a marble Roman \nsarcophagus; this is also \nwhere you will find the oldest \nrestaurant in town (open since \n1885), a café and small shops.\n3 \tTERPSITHEA SQUARE\nTake a good look at the \nremarkable listed buildings and \nthe more recent ones as you \nwalk along Pileos Street and \nhead for Terpsithea Square. \nThe buildings surrounding \nthe square are amazing and \noffer a wonderful view of the \ntown and the seafront; in the \ncentre there is a playground \nand a small open-air theatre. \nAnother impressive monument \nis the Tϋrbe (Tomb) of Musha  \nBaba (1543), one of the late  \nottoman monuments  \nof Thessaloniki, shaped  \nas an octagon with decorative \npointed frames on windows \nand a once lead-covered dome.', '4 \tROMFEI SQUARE\nThis is Ano Poli’s central \nsquare. To reach it, take \nTheofilou Street where \nthe neoclassical building \nhousing the Vice-Mayor’s \noffice for Culture is located. \nIn the square, you will see a \nByzantine bath-house known \nas Koule Kafe (see p. 12); the \nentire area has been named \nafter it. On the NE side of the \nsquare (7, Krispou st.) you \nwill notice the architectural \nmasterpiece of a 19th c. \nneoclassical building which \nhouses the municipal Library of \nAno Poli. On Theotokopoulou \nStreet, near the square lies \nthe 14th c. Byzantine church \nof the Taxiarchs [Archangels] \nwhich used to be a monastery \nkatholikon [main church] and \nhas undergone later changes.\n5 \t\x07HOSIOS [VENERABLE] \nDAVID Church\n(Moni Latomou, see p. 13)\n44\n45', '49\n5th walk: \nANO POLI (OLD TOWN)\nThe quarter was created mainly \nto provide housing for the \nrefugees who settled there \nin the early 20th c.; however \ntraces of settlements exist \nwhich date as far back as the \n2nd c. AD. In the lush greenery \nof the Municipal Grove there \nis a Municipal Theatre, where \nmajor cultural events are held \nduring the summer months, \nand an open-air cinema. \nFurther south, on a low hill, you \nwill see the imposing church \nof Agioi Theodoroi, built on \nruins of a 7th c. Byzantine \nchurch, where the view of the \nentire city is amazing. In the \nneighbouring Elpidos Street \ntowards the city walls you will \nsee a group of refugee houses \n– the area is in the process of \nbeing changed into a “Cultural \nNeighbourhood”.\nHow to get there: To \nreach Sykees, you can either \nwalk from Ano Poli or take \nthe bus no. 23 (terminus at \nEleftherias sq.) and get off at \nAgios Charalampos stop.\n54\n53', '47\n5th walk: \nANO POLI (OLD TOWN)\nthe corner of Agiou Dimitriou \nand Olympiados Streets and it \nwas one of the central gates of \nthe eastern walls which were \ndemolished to make way for \nthe opening up of two roads \n(very few segments remain). \nOpposite the cemetery you will \nspot the neoclassical building \nof G. Gennimatas hospital.\n17 \t\x07AGIOS NIKOLAOS \n[SAINT NICHOLAS] \nORPHANOS\n(see p. 14)\n18 \t\x07KALLITHEAS SQUARE\nTake Olympiados and Ap. \nPavlou Streets to reach the \npicturesque Kallitheas Square \n(with a small playground) in \nAno Poli, where major streets \nbegin, such as Irodotou, \nAndokidou and Gorgous.  \nThe last street will lead \nyou out of the city walls. \nThe Children’s Museum of \nThessaloniki (see p. 79) was \nhoused in one of the street’s \ntraditional buildings until 2009.\n19 \t\x07SEICH SOU  \n(CEDAR HILL)\nThe Seich Sou forest (the \nspring of the Sheikh) or Cedar \nHill or Thousand Trees is \nthe biggest forested area \nbordering the city, covering  \n51\n50', '14\n1st walk: \nUNESCO BYZANTINE MONUMENTS\n9 \t\x07\nAGIA AIKATERINI  \n[St. CATHERINE’s] \nCHURCH\nThis 14th c. Byzantine church is \nsituated in the centre of Agia \nAikaterini town quarter in Ano \nPoli [Upper City] area (see p. \n42) It is a complex tetrastyle \ninscribed cross-in-square \nfive-domed church with an \nambulatory. It bears an elaborate \nbrick-work on the external \nsurfaces and outstanding \nmurals, contemporary to the \nconstruction of the edifice, \nwhich depict figures of saints, \nscenes from the Gospel, \nmiracles of Christ etc. During \nthe Ottoman Rule the church \nwas converted into a mosque \n(Yakup Pasha Camii) and the \nmurals were covered in plaster, \nto be exposed once again during \nthe restoration works that took \nplace in 1947 – 1951.\n10\t\x07PROFITIS ILIAS \n[PROPHET ELIJAH] \nCHURCH\nThis imposing church (late 13th \n– mid 14th c.) towering over \nOlympiados st. in the outskirts \nof Ano Poli (see p. 42) is \nthought to have been the \nmain church of Nea Moni [New \nMonastery] or Moni Akapniou \n[Akapniou Monastery].', '44\n5th walk: \nANO POLI (OLD TOWN)\n6 \tTSITSANI SQUARE\nThis small square with beautiful,  \nwell-tended houses is located \nin between Moni Vlatadon and \nHosios David where you can go \nif you take Timotheou Street \n(notice the ottoman fountain) \nand Dimitriou Poliorkitou Street. \nIn the square centre you will see \nthe bust of V. Tsitsanis (1915 – \n1984) a leading Greek popular \ncomposer who lived and worked \nin the town during World War II.\n7 \tEPTAPYRGIOU STREET\nThis is one of the most \ninteresting roads of Ano Poli \nquarter. It follows the interior \nline of the northern city walls \nwhich used to be the ramparts \nof the Acropolis (see also p. – \nfor the city walls). It is worth \ntaking a walk from the corner \nof Eptapyrgiou and Palamidiou \nStreets (to the west) where \nthe 3rd Gate is - also known \nas “Eski Delik” – and head \nfor the main Gate. Besides the \ninteresting traditional buildings \nand the deserted Zihne Camii \n[Mosque] (1902) you will pass \nby the old refugee houses called \n“kastroplikta”; these were built \nalong the line of the city walls or \nadjoining them – as far back as \nthe early 1920’s. Similar houses \ncan be seen also on the eastern \nand western walls.', ""KOROMILA\nPARASCHOU\nEPTAPYRGIO\nANO\nPOLI\n40 EKKLISIES\nEVANGELISTRIA\nALLITHEA\nMUNICIPAL\nPARK\nRODOCHORI\nEVANGELISTRIA'S\nCEMETERY\nKOLOKOTRONI\nASVESTOCHORI\nCHORTIATI\nVARNAS\nSQ.\nMOUSHOUNTI\nSQ.\nFANARIOTON\nSQ.\nELEFTHERIAS\nSQ.\nEMPORIOU\nSQ.\nDIMOKRATIAS\nVARDARI\nSQ.\nKYPRION\nAGONISTON\nSQ.\nARCHAIAS\nAG. SOFIAS\nAGORAS\nSQ.\nDIMITRION\nSQ.\nTERPSITHEA\nSQ.\nROMFEI\nSQ.\nN\nSYNTRIVANIOU\nSQ.\nNAVARINOU\nSQ.\nSQ.\nSYKIES\nZIDROU\nSQ."", ""CHAPSA\nLIMNOU\nVALAORITI\nORPHANIDI\nTANTALIDI\nOLYMPIOU\nDIAMANTI\nLOUI\nIPPODROMIOU\nNIKIFOROU\nDESPERE\nGOUNARI\nDIALETI\nDANGLI\nFILIKIS ETAIRIAS\nCHR. SMYRNIS\nMITR. IOSIF\nFOKA\nPANAGIA\nKARATZA\nPOLIORKITI\nSYNGROU\n VYRONOS\nAGIOS DIMITRIOS\nRIGA FERAIOU\nA\nR\nC\nH\nA\nI\nO\nT\nI\nT\nO\nN\nS\nE\nL\nE\nF\nK\nI\nD\nO\nN\nM\nE\nL\nE\nN\nI\nK\nO\nU\nPROX.\nKOROMILA\nPARASCHOU\nEPTAPYRGIO\nANO\nPOLI\n40 EKKLISIES\nEVANGELISTRIA\nTHEA\nMUNICIPAL\nPARK\nRODOCHORI\nEVANGELISTRIA'S\nCEMETERY\nKOTRONI\nVARNAS\nSQ.\nMOUSHOUNTI\nSQ.\nFANARIOTON\nSQ.\nELEFTHERIAS\nSQ.\nEMPORIOU\nSQ.\nDIMOKRATIAS\nVARDARI\nSQ.\nKYPRION\nAGONISTON\nSQ.\nARCHAIAS\nAG. SOFIAS\nAGORAS\nSQ.\nDIMITRION\nSQ."", ""SMYRNIS\nMITR. IOSIF\nFOKA\nPANAGIA\nKARATZA\nKREMASTIS\nPOLIORKITI\nSYNGROU\n VYRONOS\nAGIOS DIMITRIOS\nRIGA FERAIOU\nA\nR\nC\nH\nA\nI\nO\nT\nI\nT\nO\nN\nS\nE\nL\nE\nF\nK\nI\nD\nO\nN\nM\nE\nL\nE\nN\nI\nK\nO\nU\nPROX.\nKOROMILA\nPARASCHOU\nEPTAPYRGIO\nANO\nPOLI\n40 EKKLISIES\nEVANGELISTRIA\nRIGAS FERAIOS\nKALLITHEA\nAXIOS\nMUNICIPAL\nPARK\nRODOCHORI\nEVANGELISTRIA'S\nCEMETERY\nKOLOKOTRONI\nTYROLOI\nVARNAS\nSQ.\nMOUSHOUNTI\nSQ.\nFANARIOTON\nSQ.\nELEFTHERIAS\nSQ.\nEMPORIOU\nSQ.\nDIMOKRATIAS\nVARDARI\nSQ.\nKYPRION\nAGONISTON\nSQ.\nARCHAIAS\nAG. SOFIAS\nAGORAS\nSQ.\nDIMITRION\nSQ.\nTERPSITHEA\nSQ.\nROMFEI\nSQ.\nRAILWAY STATION\nSQ.\nRAILWAY\nATION SQ.\nGALANOPOULOU\nSQ.\nSYNTRIVANIOU\nSQ.\nNAVARINOU\nSQ.\nSQ.""]","['5th walk: \nANO POLI (OLD TOWN)\n6 \tTSITSANI SQUARE\nThis small square with beautiful,  \nwell-tended houses is located \nin between Moni Vlatadon and \nHosios David where you can go \nif you take Timotheou Street \n(notice the ottoman fountain) \nand Dimitriou Poliorkitou Street. \nIn the square centre you will see \nthe bust of V. Tsitsanis (1915 – \n1984) a leading Greek popular \ncomposer who lived and worked \nin the town during World War II.\n7 \tEPTAPYRGIOU STREET\nThis is one of the most \ninteresting roads of Ano Poli \nquarter. It follows the interior \nline of the northern city walls \nwhich used to be the ramparts \nof the Acropolis (see also p. – \nfor the city walls). It is worth \ntaking a walk from the corner \nof Eptapyrgiou and Palamidiou \nStreets (to the west) where \nthe 3rd Gate is - also known \nas “Eski Delik” – and head \nfor the main Gate. Besides the \ninteresting traditional buildings \nand the deserted Zihne Camii \n[Mosque] (1902) you will pass \nby the old refugee houses called \n“kastroplikta”; these were built \nalong the line of the city walls or \nadjoining them – as far back as \nthe early 1920’s. Similar houses \ncan be seen also on the eastern \nand western walls.\n8 \tMONI VLATADON\n(see p. 13)\n9 \tPORTARA \nThis is one of the two main \ngates (the other one is Eski \nDelik) on the northern city \nwalls. Near the gates, the \nconstruction of the walls was \ndone particularly carefully and \nmany spots were decorated \nwith ceramics, inscriptions etc \nwhich can be seen best from \nPolydorou Street. This location \nis a very busy road junction and \nyou will find tourist shops and \ntavernas nearby.\n10\t\x07ACROPOLIS – \nEPTAPYRGIO  \n(YEDI KULE)\nThis impressive fortified area \nis situated on the NE end \nof the city walls, within the \nacropolis - one of the few \nremaining citadels that are \nstill populated worldwide. To \nget there from Portara, follow \nPolydorou Street, alongside the \nnorthern walls and then take \n46.  \nPortara, \na gate in \nThessaloniki’s \nnorthern walls.\n47.  \nEptapyrgio \n(Yedi Koule) \nand part of \nthe eastern \ncity walls.\n48.  \nTrigoniou \nTower area \nis popular to \nresidents and \nvisitors alike.\n46\n47\n']"," Ano Poli, the Old Town, holds significant historical importance as it was created mainly to provide housing for refugees who settled there in the early 20th century. However, traces of settlements exist that date back to the 2nd century AD. The area is also home to several notable historical structures, including the Byzantine bath-house known as Koule Kafe, the neoclassical building of G. Gennimatas hospital, the 14th-century Byzantine church of the Taxiarchs [Archangels], and the imposing church of Agios Nikolaos [Saint Nicholas] Orphanos. These structures demonstrate the rich cultural and historical heritage of the area, showcasing the evolution of the city over time. Additionally, the area is home to several Ottoman-era monuments, such as the Tϋrbe (Tomb) of Musha Baba (1543) and the Zihne Camii [Mosque] (1902), which highlight the significant impact of the Ottoman Rule on the city's history. Overall, Ano Poli's historical structures hold great cultural and historical significance, providing a glimpse into the city's complex past.","The structures in Ano Poli hold historical significance as they include traditional buildings, the ramparts of the Acropolis, and remnants of the city's walls, reflecting the area's rich cultural heritage and history, particularly during World War II and the early 1920s.",0.0,0.29,1.0,0.7523403156967001,0.9888888888779013,0.3595238095118254,1.0,0.249999999375,,0.8100720796614986
7,What cultral and natral atractshuns can be explord in the vicinty of Thessaloniki?,"['The last part consists of \nwhat is believed to have \nbeen the tomb of Alexander \nIV, son of Alexander the \nGreat and Roxanne, who was \nassassinated by Cassander in \n310 BC; a silver urn containing \nthe bones of the dead person, \nframed with the ivory relief \nmotifs of the funeral bed. \nIn a separate room, visitors \ncan watch a video where M. \nAndronikos takes them on a \ntour of the monuments. Other \nexcavations in the wider area \nof the Aiges necropolis have \nunearthed archaic tombs, pit \nand cist tombs (6th and 5th c. \nBC), as well as temple-shaped \nmacedonian tombs one of \nwhich apparently belonged  \nto Queen Eurydice, the mother  \nof King Philip II\nPalace. It covers a 12,500 \nm2 area and it used to be \nthe largest and the most \nimportant construction (next \nto Parthenon, Athens) of the \nHellenic Classical Antiquity. \nThis two-storeyed edifice \nis presumed to be the work \nof Pytheos who was the \narchitect of the Mausoleum \nof Halicarnassos [modern-day \nBodrum, Turkey], one of the 7 \nwonders of the ancient world. \nThe palace’s architectural style \nis considered avant-garde for \nthat time and it was built of \nlimestone during the 2nd half \nof the 4th c. BC on a plateau; \n101, 102 & \n103.', '98\nNIGHTLIFE\nfacilities. During the summer \nmonths though, most of \nthose clubs and venues move \nto open-air grounds in the \nairport area (see p. 106). \nAnother favourite area to \nThessalonians is Kalamaria \n(see p. 64) and, a bit further \noff, Peraia (see p. 67).   \nApart from the \nentertainment options, \na host of artistic events \nget organised in the city \nthroughout the entire \nyear: choose among the \nThessaloniki Concert Hall \n[Megaro] (see p. 52), the \nVasiliko [Royal] Theatre  \n(see p. 25), the Theatre of \nthe Society for Macedonian \nStudies (see p. 25 & 109), \nMoni Lazariston (see p. 61),  \nthe Forest Theatre [Theatro \nDasous] and the Theatre  \nof the Earth [Theatro Gis] \n(see p. 48); or you can opt for a \nvisit to museums (see p. 70-81) \nand smaller cultural venues. Last \nbut not least, you can visit the \nInternational Film Festival, \nthe Thessaloniki Book Fair, the \nDemetria Festival (see p. 108-\n109), and other venues housing \nevents on a smaller scale by  \nprivate companies or city \nagencies.\nFinally, the Thessaloniki \nRegency Casino is located \nat the 12th km on the \nThessaloniki – Airport Road \nand is open around the clock.', 'Confectionery \nis also an important part \nof local gastronomy and it \nfeatures the renowned syrupy \ncakes and pastry originating \nfrom Istanbul (ekmek kadayifi, \nkazandibi, tulumba etc) the \nwell-known bougatsa [filled \neither with cheese or with \ncream], galaktompoureko \n[a type of pastry filled with \ncustard], and last but not least \ntrigona Panoramatos [a cone-\nshaped syrupy cream-filled puff \npastry] (see p. 65). Koulouri \nThessalonikis is also worthy \nof mention. It is a sesame-\ncovered piece of bread and \nan everyday snack for locals, \nwhich you can find in the \nmorning hours sold by street \nvendors or at the baker’s. \nDuring the winter months, you \ncan try salep, an interesting \nhot beverage.\n119\n120', '93). Buses run \nfrom 5 am until midnight, yet \nthere are certain lines running \nafter midnight connecting major \njunctions. You can purchase a \nbus pass (one-month, three-\nmonths or an annual one) or \nuse a ticket: the one-way basic \ntype, the ticket valid for two \ntrips for a 70-min. period, the \nticket valid for three trips for a \n90-min. period and the ticket \nvalid for four trips for a 120-min. \nperiod, towards any direction \non any bus route. You will find \nticket boxes in central locations, \nat the interchange stations and \nthere are also ticket machines \ninside the buses. Tickets must \nbe validated on the first trip (bus \nroutes info in Greek:  \ntel.: 11085  \nwebsite: www.oasth.gr.\nCultural route:\nThe 50 bus service runs by the \ncity’s major historical and cultural \nmonuments starting from the \nWhite Tower and following \na circular 50 min. route. On \nthe way, passengers can get \ninformation on the monuments \nusing the audiovisual material \nand pamphlets supplied (in \nGreek and in English). Bus no. 22 \nfollows a circular route in Ano Poli \nand Mouschounti square is the \nterminus. Sightseeing tours can \nalso be taken in open top tourist \nbuses, starting from the White \nTower. It is a 70-min. tour in 8 \nlanguages.\nMakedonia International \nAirport of Thessaloniki.', 'In the \nneighbouring Xylokeratia \nvillage you can visit the first \nMud-therapy (Spa) Centre \nin the Balkans. There are \nswimming pools for men \nand women, 10 personal \nhydromassage areas where \nmineral spring water is used, \nsaunas, a gym and areas \nfor mud treatment. In the \nsummer, visitors can enjoy \na special mud therapy by \nthe lake shore which gets \nusually dried up during the \nwarmest season of the year. \nIn the grounds you will find \na physiotherapy centre and \na medical clinic, a hotel, a \nrestaurant, a bar, basketball \nand football fields.\nHow to get there. \nPikrolimni is located 23 \nkm N of Thessaloniki. If \nyou travel by car, follow the \nsigns to Kilkis and after that, \nfrom Galliko village head \nfor Xylokeratia (Pikrolimni). \nAlternatively there is a bus \nfrom Dimokratias square \n(Vardari) leaving daily at 9 am, \nwhich will take you to the Mud \nTherapy Centre for free.\nDAY EXCURSIONS\n114', 'Another option for you \nis to go swimming in the \nbeautiful beaches by the \nseaside suburbs and city \noutskirts (see p. 63-69), in \nplaces within the regional \nunit of Thessaloniki (see p. \n91-95), and in Halkidiki (see \np. 92). You can also visit the \nMagic Park (12th km on the \nThessaloniki – Airport Road), \nthe biggest amusement park \nin Greece, which attracts \nchildren, teenagers, grown-\nups and families alike  \n(www.magicpark.gr); the \nWaterLand is another \nfun option as there are \nwaterpools, waterslides  \nof various sizes, with different \nlevels of difficulty, restaurants \nand mini markets. It is \nlocated in Tagarades,  \nThermi area, (see p. 66).\nTOURING THESSALONIKI WITH CHILDREN\n123', 'Similar houses \ncan be seen also on the eastern \nand western walls.\n8 \tMONI VLATADON\n(see p. 13)\n9 \tPORTARA \nThis is one of the two main \ngates (the other one is Eski \nDelik) on the northern city \nwalls. Near the gates, the \nconstruction of the walls was \ndone particularly carefully and \nmany spots were decorated \nwith ceramics, inscriptions etc \nwhich can be seen best from \nPolydorou Street. This location \nis a very busy road junction and \nyou will find tourist shops and \ntavernas nearby.\n10\t\x07ACROPOLIS – \nEPTAPYRGIO  \n(YEDI KULE)\nThis impressive fortified area \nis situated on the NE end \nof the city walls, within the \nacropolis - one of the few \nremaining citadels that are \nstill populated worldwide. To \nget there from Portara, follow \nPolydorou Street, alongside the \nnorthern walls and then take \n46.  \nPortara, \na gate in \nThessaloniki’s \nnorthern walls.\n47.  \nEptapyrgio \n(Yedi Koule) \nand part of \nthe eastern \ncity walls.\n48.  \nTrigoniou \nTower area \nis popular to \nresidents and \nvisitors alike.\n46\n47', '88\nDAY EXCURSIONS\nJewish quarter in Europe, \nwhich maintains a traditional \ncharacter in its entirety. It \nis worth taking a walk and \nvisiting the Roman, Ottoman \nand Industrial age monuments \nin the traditional districts of \nKyriotissa, Panagia Dexia, and \nMakariotissa; you can also visit \nthe Public Central Library which \nhas earned an international \naward, or relax in the parks  \nand squares.\nHow to get there.  \nVergina is about 63 km SW  \nof Thessaloniki. If you travel by \ncar, follow the signs to Veroia \nand after that to Vergina. You \ncan also take the intercity bus \nor the train to reach Veroia  \nand then take the local bus  \nto Vergina.\n3 \tDION\nThis most enchanting \narchaeological site is  \nlocated under the imposing \nOlympus mountain range, in  \na 150-hectare green area amid \nflowing waters coming from \nVafyras River and from other \nsprings; it is the habitat of \nmany species of birds, reptiles \nand amphibians. This used to \nbe a sacred place to ancient \nMacedonians who worshipped \nOlympian Zeus and the Muses \n[daughters of Zeus] here.', 'In nearby Apollonia, you \nwill find the Info Centre for \nthe Koroneia-Volvi Wetlands, \nhousing a small exhibition \non the lake habitat and the \nspecies living there.\n5.4  Lake Volvi.\nIt is the second – in terms \nof size – natural lake in Greece \n(39 km E of Thessaloniki), \nwith a 6,800-hectare area \nand a depth measument of \nup to 20 m.; this wetland is \nof great importance and a \nRamsar site. Near Apollonia \nthere is a location suitable \nfor birdwatching. In the \ngreater area (Apollonia and \nNea Madytos) you will find \na water sports club and you \ncan practice rowing, sailing, \ncanoe-kayaking and water-\nskiing. Volvi village is a tourist  \nattraction located on the north  \nside of the lake, and comprises  \nthe smaller communities  \nof Megali Volvi, Mikri Volvi  \nand Rentina.\n5.5  Rentina.\nRichios River crosses the \narea and the riverside forest \nis a place of particular natural \nbeauty, teeming with flora and \nfauna. The ruins of a Byzantine \ncommunity and a castle can  \nbe seen on an elevation. \n5.6  Asprovalta – Nea \nVrasna – Stavros.\nThese growing tourist areas \nstretch along the beautiful \nbeaches on the Strymonian \nDAY EXCURSIONS\n112.  \nStavros beach.\n113.', ': 2310 454.111 \nwebsite: www.naokth.gr\nTheme Park Fields \n(see p. --)\nMegas Alexandros \nInternational Marathon \nrace. \nIt takes place every spring;  \nthe starting point is in Ancient \nPella and the finish is in \nThessaloniki town. 5 and 10 \nkm races get also organised. \nFor more information: \ntel.: \x072310 200.360,  \n2310 725.775\nwebsite: www.atgm.gr\nDepartment of Municipal \nGyms, Swimming Pools \nand Sport Grounds of \nthe Municipality of \nThessaloniki \nGr. Lampraki & 57, Kleanthous Sts.\ntel.: 2310 317.636\nDepartment of Sporting \nEvents & Programms \nof the Municipality of \nThessaloniki \nGr. Lampraki & 57, Kleanthous Sts. \ntel.: 2310 317.636\nYou can get information on \nmunicipal gyms, the municipal \nINFORMATION']","['DAY EXCURSIONS\na day trip (it’s only a short \ndistance from the city) or \nfor a longer one; quite a few \nown country houses there. In \nthe Athos peninsula amidst \na beautiful and pristine \nnatural environment lies the \nglobally known monastic \nstate of Mount Athos which \nencompasses 20 -presently \ninhabited- monasteries \n(10th – 14th c.), sketes [small \nmonastic settlements] and \ncells for monks. UNESCO has \nincluded the ‘Holy Mount’ in its \nWorld Heritage Monument List \nin 1988, on grounds of the \noutstanding architecture and \nthe priceless cultural treasures \nof the monastic community.\nHow to get there. \nPetralona Cave is situated  \n53 km SE of Thessaloniki. Take \nthe coach to Halkidiki, get \noff at Nea Kallikrateia Village \nstop and then take a taxi to \nthe cave (approx. a 10-km \njourney). If you travel by car, \ngo along the Thessaloniki-\nHalkidiki national road and  \nthen follow the signs to \nPetralona village and the cave.\n5 \tLAKES AREA\nNortheast of Thessaloniki, in \nthe direction of Strymonas \n(also Strymonian) gulf \nstretches a 200,000 hectare-\narea around Lakes Koroneia \nand Volvi; the place is a \nNational Park. It is a rare \ngroup of ecosystems with wet \nforests and meadows, rivers \nand shrubland, and the ideal \nplace for outdoor activities \n(horse-riding, mountain biking, \nbirdwatching, agritourism \nand so on); the Agency for \nthe Management of Lakes \nKoroneia and Volvi (www.\nforeaskv.gr) runs tours in \nthe area. Make sure you try \nsome of the local delicacies, \nincluding lake fish dishes.\nMUST SEE:\n5.1  Lagadas.\nThis picturesque town \nis situated 20 km NE of \nThessaloniki and has been \nknown for keeping the custom \nof fire-walking (anastenaria) \non May 21st. The ultra modern \nSpa facilities of the area also \ninclude two Byzantine bathtubs \n(10th and 15th c.) and they \nare located two km E amid \nlush greenery. The sulphur \nsprings (water temperature: \n39.2ο C) are recommended \nfor treating neuropathy, \nrheumatism, arthritis, skin and \ngynaecological diseases.\n111']"," There are several cultural and natural attractions that can be explored in the vicinity of Thessaloniki. Some of the top recommendations include:

*   Dion: A most enchanting archaeological site located under the imposing Olympus mountain range, featuring ancient Macedonian ruins and a sacred place of worship.
*   Lake Volvi: The second-largest natural lake in Greece, offering a Ramsar site and a variety of water sports, including rowing, sailing, canoe-kayaking, and water-skiing.
*   Asprovalta – Nea Vrasna – Stavros: Growing tourist areas along the beautiful beaches on the Strymonian Gulf, perfect for swimming and sunbathing.
*   Xylokeratia: A village with a mud-therapy spa center, featuring swimming pools, personal hydromassage areas, saunas, and a gym.
*   Vergina: A historic site with a traditional Jewish quarter, Roman, Ottoman, and Industrial age monuments, and a public central library.
*   The White Tower: A historic landmark and the starting point for a 50 bus tour that covers the city's major historical and cultural monuments.
*   The Magic Park: A popular theme park with various attractions and activities for children, teenagers,","In the vicinity of Thessaloniki, cultural and natural attractions include the monastic state of Mount Athos, Petralona Cave, and the Lakes Area, which is a National Park offering outdoor activities and local delicacies.",0.0,0.08,0.9565217391304348,0.7951647495297618,0.7048611110934896,0.0,0.0,0.1999999996,,0.8441202555656999
8,What are the implications of lacking a defined theme in a context?,"['53\n6th walk: \nNEA PARALIA – VASILISSIS OLGAS AVENUE\ncomplex of 14 listed industrial \nbuildings is quite impressive. \nThe complex’s construction \ndate is 1854 and the town’s \nfirst steam-driven flour mill was \nlocated by the sea. Originally \nunder French ownership, they \nbecame property of the Allatini \nfamily in 1882. \n2.2  Vafopouleio Cultural \nCentre.\nTwo contiguous buildings \nform this structure which was \ninaugurated in 1983 by the \nMunicipality of Thessaloniki. \nThe Centre hosts visual art \nexhibitions, theatre and \nmusic performances as well \nas discourse events. Other \nfacilities include three libraries \none of which is a Children’s \nlibrary which contains over \n14,500 volumes.\n2.3  Ouziel quarter.\nThis complex of very \npicturesque semi-detached \nhouses (defined within \nPapandreou, Ploutonos, \nChaironeias and Dimitrakopoulou \nstreets) were built to house \nthe workers employed in the \ntramway construction and \nwas named after the French \ncontractor Ouziel. In 1985 \nit was declared a protected \narchitectural monument and in \nrecent years a new generation \nof residents occupies the \narea.', 'The last part consists of \nwhat is believed to have \nbeen the tomb of Alexander \nIV, son of Alexander the \nGreat and Roxanne, who was \nassassinated by Cassander in \n310 BC; a silver urn containing \nthe bones of the dead person, \nframed with the ivory relief \nmotifs of the funeral bed. \nIn a separate room, visitors \ncan watch a video where M. \nAndronikos takes them on a \ntour of the monuments. Other \nexcavations in the wider area \nof the Aiges necropolis have \nunearthed archaic tombs, pit \nand cist tombs (6th and 5th c. \nBC), as well as temple-shaped \nmacedonian tombs one of \nwhich apparently belonged  \nto Queen Eurydice, the mother  \nof King Philip II\nPalace. It covers a 12,500 \nm2 area and it used to be \nthe largest and the most \nimportant construction (next \nto Parthenon, Athens) of the \nHellenic Classical Antiquity. \nThis two-storeyed edifice \nis presumed to be the work \nof Pytheos who was the \narchitect of the Mausoleum \nof Halicarnassos [modern-day \nBodrum, Turkey], one of the 7 \nwonders of the ancient world. \nThe palace’s architectural style \nis considered avant-garde for \nthat time and it was built of \nlimestone during the 2nd half \nof the 4th c. BC on a plateau; \n101, 102 & \n103.', '52\n6th walk: \nNEA PARALIA – VASILISSIS OLGAS AVENUE\n1.5  Theme gardens.\nAlong Megalou Alexandrou \nAvenue towards the direction \nof the sea, 12 Theme Gardens \ncover an area of 76,657 m2 \nand are just the ideal place for \nspending your leisure time, \nstrolling or relaxing. They are as \nfollows: Garden of Alexander; \nGarden of the Afternoon Sun; \nGarden of Sand (with a café, \ntennis courts and a playground); \nGarden of the Seasons (includes \nan amphitheatre open for various \nevents and a café); Garden of \nOdysseas Fokas (playground \ninside); Garden of the \nMediterranean (café included); \nGarden of Sculptures (outdoor \ncontemporary art sculptures); \nGarden of Sound (with flowing \nwaters); Garden of Roses (with \nornamental flower beds and a \nplayground); Garden of Memory \n(with basketball grounds and \ntennis courts); Garden of Water \n(you will see lakes with plants \ngrowing in water, a small waterfall \nand a skatepark); and Garden of \nMusic with a space reserved for \nmusic events. You can also ride \nalong the area’s 3 km cycle path. \nThis is also the location of the \nNautical Club of Thessaloniki.\n1.6  Thessaloniki Concert \nHall.\nIt was inaugurated in 2000 on \na privileged location.', 'TO\nKYMIS\nMAKRYRACHIS\nARISTOFANOUS\nCHRYSOU\nTHERMA\nNIKO\nTRAP\nVASILEIADOU\nSIFILINON\nSOURMENON\nARGYROPOULOU\nNEAPOLEOS\nSTRAVONOS\nARGONAFTON\nKYDONION\nPAPADAKI\nSIGALA\nAKTAIOU\nANDRONIKOU\nPOLEMI\nPAP\nPANSELINOU\nADMITOU\nKASSANDREOS\nTSOUNTA\nPOULIOU\nKORNAROU\nNALTSA\nFRANT\nSIK\nA\nR\nH\nT\nO\nM\nA\nS\nLOGOTHETOU\nNIKOLAIDI\nTHEMELI\nSPETSON\nLASKARATOU\nTYPA\nYPSILANTOU\nDROSINI\nCHALK', 'It is now deserted. The stylish \nThemeli villa at no. 18 is  \nquite impressive and is also \nknown as Levi Modiano villa  \nand Michailidis residence.\n63.  \nYeni Mosque \nfeatures quite \na few eclectic \narchitectural \nelements.\n64.  \nModiano Villa \n(Vas. Olgas \nAve.) houses \nthe Folklife & \nEthnological \nMuseum of \nMacedonia - \nThrace.\n65.  \nThe imposing \nbuilding of the \nSchool for the \nBlind, on Vas. \nOlgas Ave.\n63\n64', 'A chapter \ntitled Byzantium after \nByzantium –Byzantine legacy \nin the years that followed the \nConquest unfolds in room 10.\n• Private collections. The D. \nPapastratos Collection in room \n8 includes 210 rare pieces of \nart - etchings with religious \n(orthodox) themes, and the D. \nOikonomopoulos Collection, in \nroom 9, counts 1,460 works of \nart of any type (coins, ceramics, \nicons and so on).\n82, 83 & 84. \nThe Jewish \nMuseum of \nThessaloniki: \n(left & middle) \npermanent \nexhibits from \nthe collection \nJewish \nNecropolis; \n(right) the \nJewish History \nexhibition.\n82\n83', 'ARTAKIS\nERATYRAS\nANTIGONIS\nVOULGAROKTONOU\nPARASKEVOPOULOU\nAPOSTOLOU\nPAVLOU\nFLEMING\nKONSTANTINOUPOLEOS\nKYFONIDI\nS\nA\nR\nE\nM\nI\nCHRYSOULIDI\nTHERMAIKOU\nPAPANIKOLA\nNIKOPOLEOS\nTRAPEZOUNTAS\nVASILEIADOU\nSIFILINON\nSOURMENON\nARGYROPOULOU\nNEAPOLEOS\nSTRAVONOS\nARGONAFTON\nKYDONION\nPAPADAKI\nSIGALA\nAKTAIOU\nANDRONIKOU\nPOLEMI\nPAPADAKI\nPANSELINOU\nADMITOU\nKASSANDREOS\nTSOUNTA\nPOULIOU\nKORNAROU\nNALTSA\nFRANTZI\nKRYSTALI\nAINOU\nSIK\nA\nR\nH\nT\nO\nM\nA\nS\nLOGOTHETOU\nNIKOLAIDI\nTHEMELI\nSPETSON\nLASKARATOU\nTYPA\nYPSILANTOU\nDROSINI\nCHALKIDIKIS\nTHERMOPYLON\nTHALITOS\nPITTAKOU\nGRAVIAS\nGRAVIAS\nFILELLINON\nOROMILA\nKRITIS\nPAPADIAMANTI\nNASTOU\nALKMINIS\nNATSINA\nGENNADIOU MITR.', ': 2310 454.111 \nwebsite: www.naokth.gr\nTheme Park Fields \n(see p. --)\nMegas Alexandros \nInternational Marathon \nrace. \nIt takes place every spring;  \nthe starting point is in Ancient \nPella and the finish is in \nThessaloniki town. 5 and 10 \nkm races get also organised. \nFor more information: \ntel.: \x072310 200.360,  \n2310 725.775\nwebsite: www.atgm.gr\nDepartment of Municipal \nGyms, Swimming Pools \nand Sport Grounds of \nthe Municipality of \nThessaloniki \nGr. Lampraki & 57, Kleanthous Sts.\ntel.: 2310 317.636\nDepartment of Sporting \nEvents & Programms \nof the Municipality of \nThessaloniki \nGr. Lampraki & 57, Kleanthous Sts. \ntel.: 2310 317.636\nYou can get information on \nmunicipal gyms, the municipal \nINFORMATION', '29). \nConstruction took place possibly \naround 1340 and it is a typical \nexample of the transitional type \nin Byzantine church-building, \nfound particularly in Macedonia. \nFine depictions of the Ascension \nof Christ, the Prophets and the \nDivine Liturgy decorate the dome.\n6 \tROTUNDA [ROTONTA]\nThis impressive round building \nlies on the route connecting \nthe triumphal arch of Galerius \n(Kamara, see p. 37) and the \nPalace of Galerius (see p. 29). \nIt has a diameter of 24.5 m. \nand its gigantic dome is 30 \nm. high. It was built in 306 \nAD by Galerius, probably as a \ntemple of Zeus or Kaveiros or \nas a mausoleum; in the 5th c. \nit was converted into a church \ndedicated to the Holy Bodiless \nPowers. The 5th c. outstanding \npreserved mosaics impress \nwith their variety of themes, \ntheir naturalistic rendering, \nthe colour diversity and the \nbrilliance of the gold and \nsilver tesserae. In 1591 it was \nturned into a mosque when a \ntowering minaret was added, \nwhich survives today. In the \nsquare, next to Rotunda, lies \nthe small church of Agios  \nGeorgios [St. George] whence \nthe monument took its \n4. \nThe church of the \nTransfiguration \nof the Saviour.\n5. \nThe impressive \nRotunda \nmonument \n(Agios Georgios).\n6.', '15) and in \nfour movie theatres housed in \nwarehouses in the harbour  \n(see p. 18). \nInformation: \n10, Aristotelous square \ntel.: 2310 378.400 \nwebsite: www.filmfestival.gr\nThessaloniki International \nFair (T.I.F.) - HELEXPO. \nSince 1926 this has been the \ntop trade fair in the Balkans \nand an institution as such in \nthe city. It takes place every \nSeptember and it is a major \ntrading and commercial event as \nthe achievements of the Greek \nindustry and entrepreneurship \nare presented to the world. The \nfirst radio station in southeast \nEurope broadcasted from \nthese grounds for the first \ntime in 1926, followed by the \nGreek television in the mid \nsixties. Since the 1960s T.I.F. \nestablished the Greek Film \nFestival (1960, see p. 108) and \nthe Thessaloniki Song Festival \nin 1962. In 1999 it was replaced \nby two companies: T.I.F. A.E. \nand HELEXPO A.E. responsible \nfor organising over 20 theme \nexhibitions held throughout \nthe year on clothing, furniture, \nenvironment, transport, tourism, \ntechnology, food industry, \nservices etc. Numerous Greek \nand foreign companies and \nagencies participate in the fair \nand over 2 million people visit it \nevery year.  \nInformation: 154, Egnatia St.  \ntel.']",['\n']," In a context, lacking a defined theme can lead to a lack of focus and direction, making it difficult to provide a clear and coherent narrative or information. It can also result in a meandering or disjointed presentation, failing to engage the audience or convey the intended message. Additionally, without a defined theme, the context may become overwhelming or confusing, making it challenging to extract key points or takeaways. Furthermore, a lack of theme can also lead to a failure to establish a clear tone or atmosphere, potentially alienating the audience or failing to convey the intended message. Ultimately, a defined theme is essential for creating a clear, concise, and engaging context that effectively communicates the intended message.","Lacking a defined theme in a context can lead to confusion, misinterpretation, and a lack of coherence in communication.",0.0,0.74,0.0,0.8095849041664548,0.0,0.0,0.0,0.0,,0.7789895532249801
9,What architectural styles are found in the historic center?,"['The last part consists of \nwhat is believed to have \nbeen the tomb of Alexander \nIV, son of Alexander the \nGreat and Roxanne, who was \nassassinated by Cassander in \n310 BC; a silver urn containing \nthe bones of the dead person, \nframed with the ivory relief \nmotifs of the funeral bed. \nIn a separate room, visitors \ncan watch a video where M. \nAndronikos takes them on a \ntour of the monuments. Other \nexcavations in the wider area \nof the Aiges necropolis have \nunearthed archaic tombs, pit \nand cist tombs (6th and 5th c. \nBC), as well as temple-shaped \nmacedonian tombs one of \nwhich apparently belonged  \nto Queen Eurydice, the mother  \nof King Philip II\nPalace. It covers a 12,500 \nm2 area and it used to be \nthe largest and the most \nimportant construction (next \nto Parthenon, Athens) of the \nHellenic Classical Antiquity. \nThis two-storeyed edifice \nis presumed to be the work \nof Pytheos who was the \narchitect of the Mausoleum \nof Halicarnassos [modern-day \nBodrum, Turkey], one of the 7 \nwonders of the ancient world. \nThe palace’s architectural style \nis considered avant-garde for \nthat time and it was built of \nlimestone during the 2nd half \nof the 4th c. BC on a plateau; \n101, 102 & \n103.', '22\n2nd walk: \nHISTORIC CENTRE (1)\nTRADITIONAL COMMERCIAL CENTRE\naisled post-byzantine basilica. \nThe interior decoration is of \nparticular interest as it shows \ninfluences from baroque, \nrococo and neoclassical styles.\n6.3  The Jewish Museum \nof Thessaloniki.\nIt is housed in a 1904 historic \nbuilding (V. Poselli), which \nsurvived the 1917 fire and is \nowned by Jews. There used to \nbe a shopping arcade there, \nonce, and it has –at times- \nhoused a bank and the offices \nof a jewish newspaper (for \nmuseum exhibits, see p. 73).\n6.4  Venizelou street. \nA very busy street linking \nEleftherias sq. with the \nResidency since 1867 (see p. 39). \nIt is a shopping street lined \nwith many interesting buildings \nof eclectic and art deco style, \nmostly up to Egnatia street \n(see p. 34). On the north side \nof the junction of Venizelou \nand Tsimiski streets, lies the \nGategno-Florentin Building, a \ntypical example of architectural \neclecticism, built in 1925, by \ncivil engineer J.J. Pleyber. It is \na four-floor building and fronts \nthree streets. \n6.5  Pazar (Yahudi) Hamami.', 'The monumental style of \narchitecture is shown in the \nbuildings’ facades, colonnades, \narcades and porticos, which \ncombine elements from the \ncity’s Byzantine tradition \nwith European interwar \nperiod motifs. The square is \nlandmarked by two identical \nconcave buildings: Electra \nPalace hotel (late sixties) - \nbuilt by GNTO architects -  \non the west side, and Olympion \non the east side, which was \nprogressively erected and \ncompleted by the late fifties \n(designed by J. Moshé) \nand is now the seat of the \nThessaloniki Film Festival  \n(see p. 108).\nMUST SEE:\n1.1  Aristotelous Street.\nPedestrianised historic \nboulevard, that ends in Egnatia \nStreet (see p. 34). According \nto the Hébrard plans, it would \n2nd walk: \nHISTORIC CENTRE (1) \nTRADITIONAL COMMERCIAL CENTRE\n4.1\n6.1\n6.3\n6.2\n6.5\n6.6\n6.7\n1.1\n1.2\n6.8\n7.5\n7.3\n7.2\n7.2\n7.1\n7.4\n6.4\n3.1\n1\n2\n3\n4\n5\n7', '26\n3rd walk: \nHISTORIC CENTRE (2)\nMUSEUM AREA\nquarter covers the area around \nthe junction of Tsimiski and \nPavlou Mela streets. It was \nnamed after the diagonal \ntracing of P. Mela street.\n1.5  YMCA Building.\nThis emblematic building \n(1934) houses the Young \nMen’s Christian Association \nof Thessaloniki. It bears a \nsignificant mixture of elements \nof neo-colonial and byzantine \narchitecture. The building also \nhouses Avlaia theatre; among \nthe surrounding constructions \nare an outdoor basketball field \nand a tennis court, an indoor \ngym and a cultural centre.  \nIn front of the building lies  \nthe small YMCA square.  \nThe Armenian Church (1903, \nV. Poselli) is at a very short \ndistance, between Dialetti  \nand Ant. Kamara Streets.\n1.6  Archaeological \nMuseum.\nIt was designed by P. \nKarantinos, a major Greek \narchitect, and it was \ninaugurated in 1962. Inspired \nby the ancient Greek Revival \nArchitectural style, it is \nconsidered as one of the most \ntypical examples of modernist \narchitectural design in Greece. \nAn annex was added in 1980 \nand in 2003 the museum  \nwas extensively remodelled  \nto accommodate contemporary \nneeds. There are rooms for \nperiodic exhibitions, events \nand educational programmes, \na café and a shop (see p.70  \nfor museum exhibits).', '57\n6th walk: \nNEA PARALIA – VASILISSIS OLGAS AVENUE\n3.12 Yeni Camii  \n(New Mosque).\nIt is located at 30, Archaeolo-\ngikou Mouseiou Street. It was \nbuilt in 1902 by the Italian \narchitect V. Poselli as the \nmosque for Jews converted  \nto Islam (Donmeh). It combines \nfeatures of the Muslim \narchitectural tradition and \neclecticism. In 1922 the building \nprovided accommodation for \nrefugees and during the period \n1925–1963 it housed the city’s \nArchaeological Museum. It is now \na municipal exhibition area; in the \nyard there is a collection of marble \nsculptures dating to Roman and \nEarly Christian times (sarcophagi, \nstelae and others), collected from \nthe wider urban area. \n3.13 Hatzimisef Villa  \n(3, Vas. Olgas Ave.)\nThis is yet another building \ntypical of the style found in \nthe area, housing the town’s \n1st High School. At no. 5, lies \nthe Joseph Modiano villa, \ntoday uninhabited and barely \ndiscernible behind the fencing. \nA branch of the town’s 1st High \nSchool was once located here.\n3.14 Bust of George I.\nIt is found at the corner \nof Vas. Olgas Ave. and Agias \nTriadas St. This is the spot \nwhere King George I was \nassassinated on March 5, 1913 \nby Al.', '37\n4th walk: \nHISTORIC CENTRE (3)\n1970. It combines elements \nof modern and traditional \nMacedonian architecture with \nreferences to the style of the \nMount Athos monasteries.\n1.9  Acheiropoiitos church.\n(see p. 9) \n1.10 Agios [Saint] \nAthanasios church.\nThis timber-roofed church  \nis located in the SE side  \nof Acheiropoiitos church.  \nIt was built in 1818 as a three-\naisled basilica and until 1880 \nthere were ruins of an ancient \nstructure in the churchyard.  \nIt is now a parish church.\n1.11 Nedelkou Building.\n(109, Egnatia st.). This 1909 \nbuilding is a two-storeyed \npiece of fine architecture (Xen. \nPaionidis). In the past, the \nground floor housed shops \nand the 1st floor was the \nhouse of the Nedelkou family. \nIt combines renaissance, \nbaroque, neoclassical and art-\nnouveau elements and has an \ninteresting interior decoration. \nToday it houses the Mount \nAthos Centre where the stay \npermits are issued to those \nwho wish to visit the Mount \nAthos monasteries (see p. 92); \nthere is also a bookshop and \nan exhibition area.\n1.12 Galerius Arch (Kamara).\nOne of the town’s major \nlandmarks, this arch is  \nthe usual rendezvous place  \nfor locals.', '34\n1 \tEGNATIA STREET\nThis central avenue has \nbeen there practically since \nThessaloniki’s founding,  \nas it is a section of the road \nconstructed by the Romans  \nin the 2nd c. BC, and connected \nDyrrhachium (Durrës, in \nmodern day Albania) with \nConstantinople. It starts at \nDimokratia square (see p. 58) \nand ends at the TIF grounds \n(see p. 31) and the Aristotle \nUniversity of Thessaloniki, \nsplitting in two the town’s \nhistoric centre. It is a busy \nshopping area with numerous \nremarkable buildings of \neclectic and art deco style \ndating to the early 20th c. \n(mostly old hotels) that are \nabsolutely worth observing,  \nas well as some of the city’s \nmost important monuments.\nMUST SEE:\n1.1  Kolomvou Square.\nThe crossroads where \nEgnatia Street meets \nAntigonidon Street is indeed \na bustling one! It was named \nafter G. Colombo, an Italian \nwho opened a hotel there  \nin the early 20th century. This \nis the location of Kolomvou \nArchway (31, Egnatia St.) \nwhich has become a leisure \nhub with cafés, bars and \nrestaurants inside.\n1.2  Hamza Bey Mosque.\nIt was built in 1467 by the \ndaughter of Hamza Bey, the \nmilitary commander of Sultan \nMurad II.', '46\n5th walk: \nANO POLI (OLD TOWN)\nconnect Agios Pavlos area \nand Agiou Dimitriou Street. \nFrom here you will enjoy the \nwonderful view of the external \nside of the city’s eastern \nwalls, which remain in an \nimpressively good condition \n(see p. 14 for the city walls).\n14\t\x07GARDENS  \nOF THE PASHA\nThey were built in 1904 by \nan unknown architect and \nare the only specimen of \neccentric architecture in town. \nThey cover a 1000 m2 area, \nthe decorations are quite \npeculiar and they include an \nart nouveau fountain which is \nno longer functional. At the far \nend lies Agios Pavlos [Saint \nPaul] church in the area  \nby the same name. According \nto the legend it was named \nafter the fountain where \nApostle Paul drank water \nduring his stay in town.\n15\t\x07AGIOS DIMITRIOS \nHOSPITAL\nOriginally a Municipal Hospital, \nit was most probably built in \n1902-3 and the architectural \nplans appear to have been \nsigned by Xen. Paionidis  \n(or by V. Poselli according to \nother sources). It is a two-\nstorey, oblong building with \nfour wings on the edges and \nshares the same architectural \nstyle with the edifices of the \n3rd Army Corps (see p. 32), \nthe Customs House (see p. \n18) and the Administration \nHouse [Dioikitirio] (see p. 39), \nwith pronounced classicist and \nbaroque elements.', 'Following the central \nEuropean architectural trend of \nthe time, the main building is  \na three storey construction with \nelaborate interior decoration \nand has access to a tower. \nPrince Nicholas, the city’s first \nGreek military commander, was \naccommodated here in 1912; \nin 1916-1917 E. Venizelos \nstayed in the villa as head of \nthe temporary revolutionary \nGovernment of National Defence. \nIn 1928 the building was bought \nby the National Bank of Greece \nand during the years 1938 – \n1961 it housed some of the city’s \nhighschools. Since 1989, this  \nis the location of the Thessaloniki  \nCultural Centre of the National \nBank of Greece Cultural \nFoundation (MIET, see p. 77). \nNext to it there is a red brick \ncastle, known as Chateau mon \nbonheur, dating to 1890.\n3.6  Ahmet Kapanci Villa \n(105, Vas. Olgas Ave.).\nIt was built in 1905 by P. \nArrigoni, as a country (seaside) \nresidence for Ahmet Kapanci,  \na Jewish merchant and Mayor \nof the City. The architectural \nstyle is a mixed one as the \neclectic features combine \nneoclassical, renaissance, art \nnouveau and gothic motifs.  \nIn 1926, the Greek State took \nownership and since then \nthe premises housed the Red \nCross, the Gestapo, and NATO \nservices until 1973.', '42\nThessaloniki’s Old Town is \nfull of atmosphere. It covers \nthe area in between the city \nwalls (to the north and east) \nand Olympiados Street (to \nthe south), and has had the \nluck to remain untouched by \nthe 1917 great fire. It was \nvirtually uninhabited until \nthe mid-15th century, when \nit was conquered by the \nOttomans who selected it for \nsettlement on account of its \nfine climate, panoramic views \nand strategic position. The \ntwo and three-storey houses \nbear mixed Macedonian \nand Ottoman architectural \nelements (sachnisia) [Şahniş \nin turkish]; there are also \nresidences with neoclassical \nand eclectic style motifs \nwhere the Dönmeh lived, i.e. \nconverts to Islam who secretly \nremained Jews. After 1922 \nmany refugees settled in the \narea. Despite the construction \nof newer buildings and the \nopening up of new streets in \nrecent decades, it has kept \nits original town planning, to \na large extent, with narrow \nalleys and scant squares, as \nwell as its original architectural \nfeatures, particularly in the \nwest and east part of the town. \nThis particular atmosphere has \nlured intellects, artists \nand students who chose it  \nfor settlement in recent years.\n1\n\t \x07AGIA AIKATERINI \n[SAINT CATHERINE] \nCHURCH\n(see p.']","['4th walk: \nHISTORIC CENTRE (3)\n1970. It combines elements \nof modern and traditional \nMacedonian architecture with \nreferences to the style of the \nMount Athos monasteries.\n1.9  Acheiropoiitos church.\n(see p. 9) \n1.10 Agios [Saint] \nAthanasios church.\nThis timber-roofed church  \nis located in the SE side  \nof Acheiropoiitos church.  \nIt was built in 1818 as a three-\naisled basilica and until 1880 \nthere were ruins of an ancient \nstructure in the churchyard.  \nIt is now a parish church.\n1.11 Nedelkou Building.\n(109, Egnatia st.). This 1909 \nbuilding is a two-storeyed \npiece of fine architecture (Xen. \nPaionidis). In the past, the \nground floor housed shops \nand the 1st floor was the \nhouse of the Nedelkou family. \nIt combines renaissance, \nbaroque, neoclassical and art-\nnouveau elements and has an \ninteresting interior decoration. \nToday it houses the Mount \nAthos Centre where the stay \npermits are issued to those \nwho wish to visit the Mount \nAthos monasteries (see p. 92); \nthere is also a bookshop and \nan exhibition area.\n1.12 Galerius Arch (Kamara).\nOne of the town’s major \nlandmarks, this arch is  \nthe usual rendezvous place  \nfor locals. It was built in \n295-305 AD followingthe \nincontestable victory of \nGalerius over the Persians  \nand it was a monumental \narch on the north side of his \npalatial complex (see p. 28). \nIts west section still stands \nand you can see embossed \ndepictions of Galerius’ military \nsuccesses. It is connected  \nto Rotunda via a wide \npedestrian way. Right next to it  \nlies Panagia Dexia church \n(1950s), built on the location \nof a postbyzantine church. \nIn it there is a rare icon of \nPanagia (Virgin Mary) holding \nlittle Jesus on her right side.\n1.13 Rotunda.\n(see p. 10)\n1.14 Agios [Saint] \nPanteleimon\n(see p. 11)\n1.15 Plateia Syntrivaniou \n[Fountain Square].\nIt was named after the marble \nfountain with the obelisk, located \n36\n']"," The historic center of Thessaloniki features a mix of architectural styles, including Byzantine, neo-colonial, art deco, renaissance, baroque, neoclassical, and eclectic styles, among others. Notable examples can be seen in the use of classical elements in building design, as well as the incorporation of elements from the city's Byzantine tradition with European interwar period motifs. The area is also characterized by the presence of monumental architecture, with many buildings featuring colonnades, arcades, and porticos. Additionally, the historic center is home to several notable buildings that showcase a mix of modern and traditional Macedonian architecture, such as the Acheiropoiitos church and the Nedelkou Building. The area's unique blend of architectural styles is also reflected in its town planning, with narrow alleys and scant squares that have been preserved to a large extent. The historic center has lured intellects, artists, and students in recent years with its unique atmosphere, which has retained much of its original character despite the construction of newer buildings and the opening up of new streets in recent decades. In particular, the area features a mix of Macedonian and Ottoman architectural elements, as well as neoclassical and eclectic style motifs, particularly","The architectural styles found in the historic center include modern and traditional Macedonian architecture, elements of Mount Athos monasteries, renaissance, baroque, neoclassical, and art-nouveau.",1.0,0.2,1.0,0.7707363380039454,0.7856701939947976,0.3805555555479444,1.0,0.0,,0.765721006988563
10,historical significance archaeological site cultural use over time,"['7\n«…There is a homeland for everyone,  \nwhile there is Thessaloniki»\nNikiforos Choumnos, \n14thc. Byzantine dignitary and a scholar.\nNowadays, the historic capital -by right- of Macedonia, \nthe land of Alexander the Great, has evolved into a modern \nand particularly charming metropolis. A multitide of \nmonuments and cultural assets and the town’s traditional \nways exist in harmony with the modern aspects and the \nhigh standard infrastructure, the carefree mood, the spirit \nof hospitality, the vitality of the locals – particularly the \nyoung – setting the pace of town life, the diversity of \nartistic events, the long list of choices for entertainment, \nthe exceptional culinary tradition, and the fresh feel in \nthe atmosphere, coming from the seafront, as well as the \ncoolness of the northwest wind called Vardaris.   \nThessaloniki’s location is at the centre of a greater area \nwith incomparable historical monuments and natural assets \nas it offers the opportunity for a visit to archaeological \nsites known the world over (Ancient Pella, Vergina, Dion, \nPetralona Cave), to areas of exquisite nature (river deltas, \nlakes, Mt Olympus), to the monastic state of Agion Oros \n[the Holy Mountain] as well as to Halkidiki, a famous tourist \ndestination. And there is always an opportunity to practice \nsports (swimming, skiing, playing golf etc) or to indulge in \nwellness tourism (hot springs, spas)!\nIn short, Thessaloniki is a city that can cater for even the \nmost demanding needs, any time of the year.', '36\n4th walk: \nHISTORIC CENTRE (3)\nthat the place had been used \nby Christians as well, during \nthe late Roman period. South \nof the passageway there \nwere shops dating from the \n1st until the 13th century; the \nunderground Museum of the \nRoman Forum (see p. 71) was \nbuilt there as an extension. \nA 2nd - 4th c. AD Odeon [C] \nwas found behind the well-\npreserved eastern stoa. It  \nhas been restored and it is now \nused as a venue for cultural \nevents. A mint and an archive \noffice are right next to it. In the \nSE side, a round bath house \n[D] was unearthed which has \nbeen in use since the 1st c. BC. \nParts of a colonnade, mosaic \nfloors, marble stairs, a section \nof a stone-paved street, sewer \npipes, silver coins, stone and \nmarble sculptures were all \nfound in this archaeological \nsite. The forum is also where \nthe “Enchanted Ones” (las \nIncantadas) were discovered, \na two-storeyed colonnaded \narchway with Corinthian-order \ncolumns and pillars four of \nwhich have survived. They are \ndecorated with figures in relief \nin their interior as well as their \nexterior side (“Stoa of the \nStatuettes”).', '73\nMUSEUMS\n• Discovering the past. \nExcavated sites in the city and \nthe procedure for creating and \nmaintaining an archaeological \nmuseum are described in room 11.\n• Temporary exhibitions \nand events. At times the \nMuseum organises temporary \nexhibitions and cultural events, \nmost of which are associated \nwith Thessaloniki’s and \nNorthern Greece’s Byzantine \nlegacy.\nWHITE TOWER EXHIBITION\nStarting from the year it was \nfounded until the present day, \nthe history of Thessaloniki is \ndepicted through an array of \nmultimedia applications, special \nstructures, printed graphic \ndesign compositions and \narchaeological material. The \nexhibition is organised in seven \nthematic categories, each one \noccupying one floor, as follows: \nSpace and Time (ground floor), \nTransformations (1st floor), \nMonuments and History (2nd \nfloor), Homeland of the people \n(3rd floor), Along the trade \nroutes (4th floor), Leisure and \nCulture (5th floor), Thessaloniki \n– Flavours (6th floor). The \nmuseum’s shop is located on \nthe last floor.\nJEWISH MUSEUM OF \nTHESSALONIKI\nIt was created following \nan initiative of the Jewish \nCommunity of Thessaloniki  \nto promote the Sephardic \nlegacy in town, which dates  \nas far back as the 15th c. It has \nbeen open to visitors since \n1997.', 'Radio Taxi:  \n«Taxiway» (tel.: 18300), \n«Mercedes» (tel.: 18180), \n«Macedonia» (tel.: 18288) \nMUSEUMS – \nARCHAEOLOGICAL SITES\nA large number of museums and \narchaeological sites are open to \nvisitors in the suburbs and city \noutskirts. A number of them are \nlisted below. For more info visit \nhttp://odysseus.culture.gr\nArchaeological Museum  \nof Thessaloniki: \n6, Manoli Andronikou St. \ntel.: 2313 310.201 \nwebsite: www.amth.gr\nMuseum of the Roman Forum:  \nOlympou and Filippou Sts. \ntel.: \x072313 310.400 \n2310 221.266\nMuseum of Byzantine Culture: \n2, Stratou Ave \ntel.: 2313 306.400 \nwebsite: www.mbp.gr\nWhite Tower Museum: \ntel.: 2310 267.832 \nwebsite: www.lpth.gr\nSaint Demetrius  \n[Agios Dimitrios] Crypt: \n83, Agiou Dimitriou St. \ntel.: 2310 270.591 \nwebsite: www.inad.gr\nJewish Museum of Thessaloniki: \n13, Agiou Mina St. \ntel.: 2310 250.406 \nwebsite: www.jmth.gr\nMuseum for the Macedonian \nStruggle: \n23, Proxenou Koromila St. \ntel.', '82\nThessaloniki lies in the \ncentre of a wide area that is \nextremely interesting from  \nan archaeological, historical \nand natural point of view; \nthere are countless options for \noutdoor activities, relaxing and \nentertainment. For instance, \nyou can combine your stay \nin town with a day excursion \nto renowned archaeological \nsites and places of historical \ninterest, to fascinating towns \nand great natural reserves  \nor to areas offering recreation \nor relaxation.\n1\n\t\nANCIENT PELLA\nInhabited since the Late \nHelladic period, the area \nflourished when Archelaos,  \nthe Macedon king, moved  \nthe capital of the Macedonian \nstate from Aiges (Vergina) to \nPella (late 5th – early 4th c. BC). \nThe then seaside town grew \nlarger during the reign of King \nPhilip II (his son, Alexander \nthe Great, was born here) \nand grew even larger later \nduring the rule of Cassander. \nBy the mid-2nd century BC it \nhad evolved into the greatest \npolitical, financial and cultural \ncentre among the Hellenic City \nStates. In 168 BC when the \nMacedonians were defeated in \nthe battle of Pydna, Pella was \nconquered by the Romans. \nIt gradually declined and got \neventually deserted in the 1st \ncentury BC. Among the finds \nof the greatest value are the \nexquisite mosaic floors in the \nbuildings, which manifest the \nhigh standard of living enjoyed \nby the residents.\nMUST SEE:\nHouses.', '26\n3rd walk: \nHISTORIC CENTRE (2)\nMUSEUM AREA\nquarter covers the area around \nthe junction of Tsimiski and \nPavlou Mela streets. It was \nnamed after the diagonal \ntracing of P. Mela street.\n1.5  YMCA Building.\nThis emblematic building \n(1934) houses the Young \nMen’s Christian Association \nof Thessaloniki. It bears a \nsignificant mixture of elements \nof neo-colonial and byzantine \narchitecture. The building also \nhouses Avlaia theatre; among \nthe surrounding constructions \nare an outdoor basketball field \nand a tennis court, an indoor \ngym and a cultural centre.  \nIn front of the building lies  \nthe small YMCA square.  \nThe Armenian Church (1903, \nV. Poselli) is at a very short \ndistance, between Dialetti  \nand Ant. Kamara Streets.\n1.6  Archaeological \nMuseum.\nIt was designed by P. \nKarantinos, a major Greek \narchitect, and it was \ninaugurated in 1962. Inspired \nby the ancient Greek Revival \nArchitectural style, it is \nconsidered as one of the most \ntypical examples of modernist \narchitectural design in Greece. \nAn annex was added in 1980 \nand in 2003 the museum  \nwas extensively remodelled  \nto accommodate contemporary \nneeds. There are rooms for \nperiodic exhibitions, events \nand educational programmes, \na café and a shop (see p.70  \nfor museum exhibits).', 'The road \ndistances (in km) where \nThessaloniki is the starting \npoint get calculated from  \nthis square.\n2 \t\n\x07AROUND DIMOKRATIAS \nSQUARE\nThere are mostly faceless \nbuildings in the area – \namong them you will find \nsmall manufactures or old \nindustries. However there are \nalso historic sites, as there \nare sections of the city’s west \nwalls here, Byzantine and \nottoman monuments and other \narchaeological sites (temple  \nof Aphrodite, 6th c. BC).\nMUST SEE:\n2.1  Railway Station.\nIt is on Monastiriou Street \nwhich is renamed at some \npoint Egnatia Street (see p. 34). \nConstruction began in 1939 \nand it became fully operational \nin 1951, but it was officially \n66.  \nVardariou \nTower (Top \nHane).\n67.  \nOld steam \nengine \nfronting \nThessaloniki’s \nRailway \nStation.', '44). During the Venetian Rule \n(1st half of the 15th c.) there \nwere efforts to boost it in the \nlight of the Turkish threat; this \nis why certain scholars support \nthat the Trigoniou Tower (see p. \n45) and the White Tower (see p. \n24) were built during that period. \nIn the following centuries, the \nTurks completed reinforcement \nworks in various places. The \nwall inscriptions describe the \ninterventions and restorations \nthat took place over time. The \nwalls followed the shape of an \nirregular trapezium and ended \nto the west in Vardariou Tower \n(see p. 59) and to the east in \nthe White Tower (see p. 24), \nreaching a total length of 7 km. \nAfter 1870, demolition of the \nseafront walls as well as of parts \nof the western and eastern walls \nbegan, in order to sanitise the \nplains and also to expand the \ncity. Today there are 3 remaining \nkm of city walls (mainly on Ano \nPoli, see p. 42); their height \nranges from 8.30 to 10.50 m. \nand their width may measure \nup to 4.50 m, making them \nan impressive monument and \none of great archaeological and \ncultural value.\n\t Note: To get a complete \npicture of the town’s Byzantine art \nmonuments make sure you visit  \nthe Museum of Byzantine Culture  \n(see p. 26 and p. 71).\n9.', '62\n7th walk: \nWEST OF THE CENTRE-STAVROUPOLI\nLazare church in Paris, which \nwas the seat of the order. \nAt times, the building was \nused as a hospital and a \nrefugee hospitality centre. \nIn 1980 it was declared a \nhistoric monument and a \nwork of art and in 1997 it \nwas fully renovated in order \nto accommodate the needs \narising from the European \nCapital of Culture events in \nThessaloniki. Since then it has \nbeen used as a multi-purpose \ncultural and entertainment \nvenue, as two halls of the \nNational Theatre of Northern \nGreece (N.T.N.G., see p. 109) \na Cultural Centre, a café-\nrestaurant and a bar are \nhoused here. Outdoor space \ntheatrical performances, \nconcerts and other events \nalso take place in the \npremises. The State Museum \nof Contemporary Art is \nhoused in one of the older \nstructures, covering an area \nof 3,270 m2 (for museum \ncollections, see p. 75). \n4.3  Kapnapothikes \n[Tobacco warehouses].\nFive old tobacco warehouses \n(tobacco shops) still stand \nin the area, as reminders of \nthe city’s booming tobacco \ntrade from the mid-19th c. \nuntil 1990. Most of them were \nbuilt in the Interwar Period and \nbear art deco and Bauhaus \narchitectural features.', '(Thermi) \ntel.: 2310 483.000 \nwebsite: www.noesis.edu.gr\nGerovassiliou Wine Museum: \nDomaine Gerovassiliou (Epanomi) \ntel.: 23920 44.567 \nwebsite: www.gerovassiliou.gr\nStavroupoli Botanical Garden: \ntel.: 2310 600.717\nThessaloniki Zoo: \ntel.: 2310 219.980\nMilitary Museum  \nof the Balkan Wars: \ntel.: 2310 716.000\nAncient Pella: \ntel.: \x0723820 31.160 \n23820 32.730  \n(archaeological site) \n23820 32.963 (museum)\nDion:\ntel.: \x0723510 53.484  \n(archaeological site),  \n23510 45.057 (museum)\nwebsite: www.ancientdion.org\nAiges (Vergina): \ntel.: \x0723310 92.347 \n(archaeological site – \nmuseum of the royal tombs)\nwebsite: www.aigai.gr\nPetralona Cave: \ntel.: 23730 73.365 \nwebsite: www.petralona-cave.gr\nCollaboration of 5 Museums \nin Thessaloniki.']","['4th walk: \nHISTORIC CENTRE (3)\nthat the place had been used \nby Christians as well, during \nthe late Roman period. South \nof the passageway there \nwere shops dating from the \n1st until the 13th century; the \nunderground Museum of the \nRoman Forum (see p. 71) was \nbuilt there as an extension. \nA 2nd - 4th c. AD Odeon [C] \nwas found behind the well-\npreserved eastern stoa. It  \nhas been restored and it is now \nused as a venue for cultural \nevents. A mint and an archive \noffice are right next to it. In the \nSE side, a round bath house \n[D] was unearthed which has \nbeen in use since the 1st c. BC. \nParts of a colonnade, mosaic \nfloors, marble stairs, a section \nof a stone-paved street, sewer \npipes, silver coins, stone and \nmarble sculptures were all \nfound in this archaeological \nsite. The forum is also where \nthe “Enchanted Ones” (las \nIncantadas) were discovered, \na two-storeyed colonnaded \narchway with Corinthian-order \ncolumns and pillars four of \nwhich have survived. They are \ndecorated with figures in relief \nin their interior as well as their \nexterior side (“Stoa of the \nStatuettes”). It is estimated \nthat the Stoa’s location was \nat the south entrance to the \nforum (from Egnatia Street);  \nin 1864 the pillars were \nremoved and escorted to their \npresent location at the Louvre \nMuseum (Paris) by E. Miller.\n1.7  Bit-Pazar.\nAn edifice with lots of \natmosphere, Bit Pazar (meaning \nSmall Market place) is a spot \nwhere the town’s antique shops \nare to be found. Its ground level \nwas constructed in 1930 and \nhigher floors were added in the \n1960s. Facing the inner square \nand lining the surrounding \nstreets namely Tositsa (where \nthe main entrance is), Venizelou \nand Olympou, there are many \nsecond-hand shops, antique \ndealers’ and furniture shops. \nIn recent years the variety of \nrestaurants, ouzo tavernas \nand café-bars has made it a \nhot spot particularly among \nstudents. Within a short \ndistance (at 35, Syngrou \nSt.) you will see the Jewish \nMonastirioton Synagogue  \nthe only one to have survived \nthe 2nd World War.\n1.8  Experimental School.\nIt was built following the \nplans of D. Pikionis, a leading \nGreek architect, from 1936 until \n34.  \nThe renovated \nRoman Forum \nOdeon.\n35.  \nThe Arch \nof Galerius \n(Kamara) \ndecorated with \nrelief carvings.\n36.  \nThe fountain \n[Syntrivani] \nin the square \nnamed after it.\n34\n35']"," Ancient Pella and Dion are two of the most significant historical sites in Thessaloniki, Greece. They have been used for various cultural purposes over time, including as archaeological sites, museums, and tourist destinations. Both sites have been used for various cultural purposes over time, including as archaeological sites, museums, and tourist destinations. They are significant examples of the cultural and historical heritage of Greece and are an important part of the country's rich history. The archaeological sites of Ancient Pella and Dion have been used to preserve and showcase the cultural and historical heritage of the region. The museums and cultural institutions associated with these sites have played a significant role in promoting the site's cultural and historical significance.

Additional information: There are also other historical sites in Thessaloniki, such as the Gerovassiliou Wine Museum, the Stavroupoli Botanical Garden, the Thessaloniki Zoo, the Military Museum of the Balkan Wars, and the Aiges (Vergina) archaeological site and museum. Additionally, the city has a rich cultural scene, with numerous museums, gardens, and other cultural institutions. The city's cultural and historical significance is further emphasized by its numerous archaeological sites, including the Petralona Cave.

Note: The original answer was not refined","The archaeological site has historical significance as it has been used for various cultural purposes over time, including as a venue for cultural events and housing shops from the 1st to the 13th century.",1.0,0.0,0.32142857142857145,0.47999786532830246,0.5666666666477778,0.863492063477672,0.0,0.0,,0.4015864064326949
11,What happens if no theme in talk?,"['The last part consists of \nwhat is believed to have \nbeen the tomb of Alexander \nIV, son of Alexander the \nGreat and Roxanne, who was \nassassinated by Cassander in \n310 BC; a silver urn containing \nthe bones of the dead person, \nframed with the ivory relief \nmotifs of the funeral bed. \nIn a separate room, visitors \ncan watch a video where M. \nAndronikos takes them on a \ntour of the monuments. Other \nexcavations in the wider area \nof the Aiges necropolis have \nunearthed archaic tombs, pit \nand cist tombs (6th and 5th c. \nBC), as well as temple-shaped \nmacedonian tombs one of \nwhich apparently belonged  \nto Queen Eurydice, the mother  \nof King Philip II\nPalace. It covers a 12,500 \nm2 area and it used to be \nthe largest and the most \nimportant construction (next \nto Parthenon, Athens) of the \nHellenic Classical Antiquity. \nThis two-storeyed edifice \nis presumed to be the work \nof Pytheos who was the \narchitect of the Mausoleum \nof Halicarnassos [modern-day \nBodrum, Turkey], one of the 7 \nwonders of the ancient world. \nThe palace’s architectural style \nis considered avant-garde for \nthat time and it was built of \nlimestone during the 2nd half \nof the 4th c. BC on a plateau; \n101, 102 & \n103.', '109\nwebsite: www.helexpo.gr\nInternational Book Fair.  \nHeld every spring in the \nHELEXPO-TIF exhibition \ncentre, it is well known as \nthe annual rendezvous place \nfor professionals and book \nlovers alike. Greek and foreign \npublishers present their new \nwork and special tributes to \nwriters and types of literature \nare included in the happenings \nwhere new books are presented \nand open discussions take \nplace with writers; other events \ninclude the honoured country, \nprofessional meetings, the \nChildren’s corner, the Teenagers’ \ncorner and the Book lover’s corner. \nInformation: National Book \nCentre, 4, Athan. Diakou St, \nAthens \ntel.: 210 92.00.300, \nwebsite:  \nwww.thessalonikibookfair.com  \nand www.ekebi.gr\nSociety for Macedonian \nStudies (S.M.S.). \nIt is a major cultural institution \nin Thessaloniki aimed at \ncollecting, preserving, studying \nand promoting the linguistic, \nhistorical, traditional and \narchaeological archives \nconnected with the history  \nof Macedonia. It has a large \nlibrary and an Art Gallery  \n(see p. 76). A variety of events, \nscientific congresses and \nspecialised publications are  \npart of the activities organised. \nInformation:  \n4, Ethnikis Amynis St.,  \ntel.: 2310 271.195,  \nwebsite: www.ems.gr\nThessaloniki Concert Hall. \nIt is located on 25th Martiou St.', '52\n6th walk: \nNEA PARALIA – VASILISSIS OLGAS AVENUE\n1.5  Theme gardens.\nAlong Megalou Alexandrou \nAvenue towards the direction \nof the sea, 12 Theme Gardens \ncover an area of 76,657 m2 \nand are just the ideal place for \nspending your leisure time, \nstrolling or relaxing. They are as \nfollows: Garden of Alexander; \nGarden of the Afternoon Sun; \nGarden of Sand (with a café, \ntennis courts and a playground); \nGarden of the Seasons (includes \nan amphitheatre open for various \nevents and a café); Garden of \nOdysseas Fokas (playground \ninside); Garden of the \nMediterranean (café included); \nGarden of Sculptures (outdoor \ncontemporary art sculptures); \nGarden of Sound (with flowing \nwaters); Garden of Roses (with \nornamental flower beds and a \nplayground); Garden of Memory \n(with basketball grounds and \ntennis courts); Garden of Water \n(you will see lakes with plants \ngrowing in water, a small waterfall \nand a skatepark); and Garden of \nMusic with a space reserved for \nmusic events. You can also ride \nalong the area’s 3 km cycle path. \nThis is also the location of the \nNautical Club of Thessaloniki.\n1.6  Thessaloniki Concert \nHall.\nIt was inaugurated in 2000 on \na privileged location.', 'On Good Friday afternoon every \nchurch prepares the Epitaphios \nwhich is an embroidered cloth \nicon of Christ prepared for burial, \nlying on a low table adorned with \nflowers. Later in the evening, \nEpitaphios is placed at the head of \na procession and it is followed by \nthe church congregation; people \nhold lit candles and chant as they \nwalk the streets of their town or \nvillage – this happens throughout \nthe country on Good Friday.\n• Resurrection of Christ: Mass \nis celebrated at midnight before \nEaster Sunday with fireworks and \nburning candles.\n• Easter Sunday: It is \ncustomary for Greeks to have \na meal of lamb roasted on the \nspit, that day. Celebrations \ninclude singing and dancing \nthroughout the entire day.\n• May 1st (Labour Day): \nFlower festivals take place in \nThessaloniki. \n• Dormition of Theotokos \n[Mother of God]: \nAugust 15th. \n• October 26th – 28th: \nA three-day celebration \ncommemorating the liberation \nof the city from the Turkish rule, \nand a religious feast in honour \nof Saint Demetrius [Agios \nDimitrios], the patron saint of \nthe city, on October 26th. A \nmilitary parade takes place on \nOctober 28th to commemorate \nthe beginning of Greek \nparticipation in World War II.\n• Christmas:  \nDecember 25th – 26th.\nOTHER TRADITIONAL \nFESTIVALS\n• Carnival: Carnival events last \nfor 3 weeks and end on Shrove \nMonday.', 'TO\nKYMIS\nMAKRYRACHIS\nARISTOFANOUS\nCHRYSOU\nTHERMA\nNIKO\nTRAP\nVASILEIADOU\nSIFILINON\nSOURMENON\nARGYROPOULOU\nNEAPOLEOS\nSTRAVONOS\nARGONAFTON\nKYDONION\nPAPADAKI\nSIGALA\nAKTAIOU\nANDRONIKOU\nPOLEMI\nPAP\nPANSELINOU\nADMITOU\nKASSANDREOS\nTSOUNTA\nPOULIOU\nKORNAROU\nNALTSA\nFRANT\nSIK\nA\nR\nH\nT\nO\nM\nA\nS\nLOGOTHETOU\nNIKOLAIDI\nTHEMELI\nSPETSON\nLASKARATOU\nTYPA\nYPSILANTOU\nDROSINI\nCHALK', 'It is now deserted. The stylish \nThemeli villa at no. 18 is  \nquite impressive and is also \nknown as Levi Modiano villa  \nand Michailidis residence.\n63.  \nYeni Mosque \nfeatures quite \na few eclectic \narchitectural \nelements.\n64.  \nModiano Villa \n(Vas. Olgas \nAve.) houses \nthe Folklife & \nEthnological \nMuseum of \nMacedonia - \nThrace.\n65.  \nThe imposing \nbuilding of the \nSchool for the \nBlind, on Vas. \nOlgas Ave.\n63\n64', 'A chapter \ntitled Byzantium after \nByzantium –Byzantine legacy \nin the years that followed the \nConquest unfolds in room 10.\n• Private collections. The D. \nPapastratos Collection in room \n8 includes 210 rare pieces of \nart - etchings with religious \n(orthodox) themes, and the D. \nOikonomopoulos Collection, in \nroom 9, counts 1,460 works of \nart of any type (coins, ceramics, \nicons and so on).\n82, 83 & 84. \nThe Jewish \nMuseum of \nThessaloniki: \n(left & middle) \npermanent \nexhibits from \nthe collection \nJewish \nNecropolis; \n(right) the \nJewish History \nexhibition.\n82\n83', 'ARTAKIS\nERATYRAS\nANTIGONIS\nVOULGAROKTONOU\nPARASKEVOPOULOU\nAPOSTOLOU\nPAVLOU\nFLEMING\nKONSTANTINOUPOLEOS\nKYFONIDI\nS\nA\nR\nE\nM\nI\nCHRYSOULIDI\nTHERMAIKOU\nPAPANIKOLA\nNIKOPOLEOS\nTRAPEZOUNTAS\nVASILEIADOU\nSIFILINON\nSOURMENON\nARGYROPOULOU\nNEAPOLEOS\nSTRAVONOS\nARGONAFTON\nKYDONION\nPAPADAKI\nSIGALA\nAKTAIOU\nANDRONIKOU\nPOLEMI\nPAPADAKI\nPANSELINOU\nADMITOU\nKASSANDREOS\nTSOUNTA\nPOULIOU\nKORNAROU\nNALTSA\nFRANTZI\nKRYSTALI\nAINOU\nSIK\nA\nR\nH\nT\nO\nM\nA\nS\nLOGOTHETOU\nNIKOLAIDI\nTHEMELI\nSPETSON\nLASKARATOU\nTYPA\nYPSILANTOU\nDROSINI\nCHALKIDIKIS\nTHERMOPYLON\nTHALITOS\nPITTAKOU\nGRAVIAS\nGRAVIAS\nFILELLINON\nOROMILA\nKRITIS\nPAPADIAMANTI\nNASTOU\nALKMINIS\nNATSINA\nGENNADIOU MITR.', ': 2310 454.111 \nwebsite: www.naokth.gr\nTheme Park Fields \n(see p. --)\nMegas Alexandros \nInternational Marathon \nrace. \nIt takes place every spring;  \nthe starting point is in Ancient \nPella and the finish is in \nThessaloniki town. 5 and 10 \nkm races get also organised. \nFor more information: \ntel.: \x072310 200.360,  \n2310 725.775\nwebsite: www.atgm.gr\nDepartment of Municipal \nGyms, Swimming Pools \nand Sport Grounds of \nthe Municipality of \nThessaloniki \nGr. Lampraki & 57, Kleanthous Sts.\ntel.: 2310 317.636\nDepartment of Sporting \nEvents & Programms \nof the Municipality of \nThessaloniki \nGr. Lampraki & 57, Kleanthous Sts. \ntel.: 2310 317.636\nYou can get information on \nmunicipal gyms, the municipal \nINFORMATION', '29). \nConstruction took place possibly \naround 1340 and it is a typical \nexample of the transitional type \nin Byzantine church-building, \nfound particularly in Macedonia. \nFine depictions of the Ascension \nof Christ, the Prophets and the \nDivine Liturgy decorate the dome.\n6 \tROTUNDA [ROTONTA]\nThis impressive round building \nlies on the route connecting \nthe triumphal arch of Galerius \n(Kamara, see p. 37) and the \nPalace of Galerius (see p. 29). \nIt has a diameter of 24.5 m. \nand its gigantic dome is 30 \nm. high. It was built in 306 \nAD by Galerius, probably as a \ntemple of Zeus or Kaveiros or \nas a mausoleum; in the 5th c. \nit was converted into a church \ndedicated to the Holy Bodiless \nPowers. The 5th c. outstanding \npreserved mosaics impress \nwith their variety of themes, \ntheir naturalistic rendering, \nthe colour diversity and the \nbrilliance of the gold and \nsilver tesserae. In 1591 it was \nturned into a mosque when a \ntowering minaret was added, \nwhich survives today. In the \nsquare, next to Rotunda, lies \nthe small church of Agios  \nGeorgios [St. George] whence \nthe monument took its \n4. \nThe church of the \nTransfiguration \nof the Saviour.\n5. \nThe impressive \nRotunda \nmonument \n(Agios Georgios).\n6.']",['']," There is no information available about what happens if no theme is chosen in talk. The text does not provide any information on this topic. The text appears to be a tourist guide for Thessaloniki, Greece, and it does not discuss the concept of ""talk"" or its themes. If you have any further context or clarification, I may be able to provide a more accurate answer. 

However, based on the context, it seems that the text is describing different themes and attractions in Thessaloniki, such as the Theme Gardens, the Rotunda, and the Jewish Museum. If you are looking for information on what happens if no theme is chosen in a specific context, I would need more information to provide a relevant answer. 

In this case, I would say that there is no information available on what happens if no theme is chosen in talk, as there is no information on the concept of ""talk"" or its themes. 

If you could provide more context or clarify what you mean by ""talk,"" I may be able to provide a more accurate answer. 

But based on the given context, I can say that the text is a tourist guide for Thessaloniki, Greece, and it does not provide any information on what happens if no theme is","If there is no theme in a talk, it may lack focus and coherence, making it difficult for the audience to engage or understand the main message.",0.0,0.0,0.5454545454545454,0.5411030740694964,0.0,0.0,0.0,0.0,,0.0
12,What are the implications of having no defined theme or context in a discussion?,"['The last part consists of \nwhat is believed to have \nbeen the tomb of Alexander \nIV, son of Alexander the \nGreat and Roxanne, who was \nassassinated by Cassander in \n310 BC; a silver urn containing \nthe bones of the dead person, \nframed with the ivory relief \nmotifs of the funeral bed. \nIn a separate room, visitors \ncan watch a video where M. \nAndronikos takes them on a \ntour of the monuments. Other \nexcavations in the wider area \nof the Aiges necropolis have \nunearthed archaic tombs, pit \nand cist tombs (6th and 5th c. \nBC), as well as temple-shaped \nmacedonian tombs one of \nwhich apparently belonged  \nto Queen Eurydice, the mother  \nof King Philip II\nPalace. It covers a 12,500 \nm2 area and it used to be \nthe largest and the most \nimportant construction (next \nto Parthenon, Athens) of the \nHellenic Classical Antiquity. \nThis two-storeyed edifice \nis presumed to be the work \nof Pytheos who was the \narchitect of the Mausoleum \nof Halicarnassos [modern-day \nBodrum, Turkey], one of the 7 \nwonders of the ancient world. \nThe palace’s architectural style \nis considered avant-garde for \nthat time and it was built of \nlimestone during the 2nd half \nof the 4th c. BC on a plateau; \n101, 102 & \n103.', '53\n6th walk: \nNEA PARALIA – VASILISSIS OLGAS AVENUE\ncomplex of 14 listed industrial \nbuildings is quite impressive. \nThe complex’s construction \ndate is 1854 and the town’s \nfirst steam-driven flour mill was \nlocated by the sea. Originally \nunder French ownership, they \nbecame property of the Allatini \nfamily in 1882. \n2.2  Vafopouleio Cultural \nCentre.\nTwo contiguous buildings \nform this structure which was \ninaugurated in 1983 by the \nMunicipality of Thessaloniki. \nThe Centre hosts visual art \nexhibitions, theatre and \nmusic performances as well \nas discourse events. Other \nfacilities include three libraries \none of which is a Children’s \nlibrary which contains over \n14,500 volumes.\n2.3  Ouziel quarter.\nThis complex of very \npicturesque semi-detached \nhouses (defined within \nPapandreou, Ploutonos, \nChaironeias and Dimitrakopoulou \nstreets) were built to house \nthe workers employed in the \ntramway construction and \nwas named after the French \ncontractor Ouziel. In 1985 \nit was declared a protected \narchitectural monument and in \nrecent years a new generation \nof residents occupies the \narea.', '101\nand sports facilities.\nTour the suburban forests \nof Seich Sou (see p. 47) and \nChortiatis (see p. 66) where \nyou can follow the hiking trails \nor go mountain biking, find the \nspots designated for sports \nactivities or just relax by the \nDeltas of Gallikos river and \nAxios-Loudias-Aliakmonas \nrivers (see p. 63) or by the \nlakes Koroneia and Volvi  \n(see p. 93-94).\nThere are some quite \ninteresting educational \nprogrammes for children, \nrunning in most museums \n(see p. 70 - 81), particularly \nin the Children’s Museum \n(see p. 79) which is the only one  \nof its kind.\nHave fun and at the same  \ntime get familiar with science  \nand technology at the Noesis  \n– Science Centre and \nTechnology Museum (see p. \n67) or at the Nouvelle multi-\npurpose venue (7th km on the \nThessaloniki – Oraiokastro \nRoad) where you can visit the \nEnvironmental Dinosaur Theme \nPark and see the natural size \nreconstructions of animals, \nthe Mammoth Museum where \nfossils of the hairy mammoth \nare on display, the Cave where \nthere are depictions of creation \nand prehistoric life in caves  \nas well as the Interactive \nMuseum of Greek Traditional \nToys and Games  \n(www.parkodeinosauron.gr).   \nAnother option for you \nis to go swimming in the \nbeautiful beaches by the \nseaside suburbs and city \noutskirts (see p.', '109\nwebsite: www.helexpo.gr\nInternational Book Fair.  \nHeld every spring in the \nHELEXPO-TIF exhibition \ncentre, it is well known as \nthe annual rendezvous place \nfor professionals and book \nlovers alike. Greek and foreign \npublishers present their new \nwork and special tributes to \nwriters and types of literature \nare included in the happenings \nwhere new books are presented \nand open discussions take \nplace with writers; other events \ninclude the honoured country, \nprofessional meetings, the \nChildren’s corner, the Teenagers’ \ncorner and the Book lover’s corner. \nInformation: National Book \nCentre, 4, Athan. Diakou St, \nAthens \ntel.: 210 92.00.300, \nwebsite:  \nwww.thessalonikibookfair.com  \nand www.ekebi.gr\nSociety for Macedonian \nStudies (S.M.S.). \nIt is a major cultural institution \nin Thessaloniki aimed at \ncollecting, preserving, studying \nand promoting the linguistic, \nhistorical, traditional and \narchaeological archives \nconnected with the history  \nof Macedonia. It has a large \nlibrary and an Art Gallery  \n(see p. 76). A variety of events, \nscientific congresses and \nspecialised publications are  \npart of the activities organised. \nInformation:  \n4, Ethnikis Amynis St.,  \ntel.: 2310 271.195,  \nwebsite: www.ems.gr\nThessaloniki Concert Hall. \nIt is located on 25th Martiou St.', 'For information contact the \nVice-Mayor’s Office responsible \nfor Cultural, Educational and \nTourist Affairs of the City, at 25, \nTheofilou St., (Ano Poli),  \ntel.: 2310 228.243  \nDepartment of Event & Festival \nOrganization\ntel.: \x072313 318.214, \nwebsite: www.dimitria.thessaloniki.gr\nThessaloniki International \nFilm Festival. It takes place \nevery November and there is \nno match for it in southeastern \nEurope. It was inaugurated \nin 1960 as the Greek Film \nWeek and it has become an \ninternational festival since \n1992, with the following \nsections: The Competition \nSection where directors present \ntheir first or second film, The \nNon-Competitive section, The \nSpecial Screenings Section, \nthe special section showing \na selection of films from the \nBalkan region under the name \nBalkan Survey, The Greek \nSection where domestic films \nare shown, The Open Horizons \nSection involving independent \nfilm makers from around the \nworld and special Tributes \nto the work of leading Greek \nand foreign directors. Other \nevents include retrospectives, \nmasterclasses, discussions with \nthe audience and professionals \nand the annual Documentary \nFestival. Screenings take place \nin Olympion (see p. 15) and in \nfour movie theatres housed in \nwarehouses in the harbour  \n(see p. 18). \nInformation: \n10, Aristotelous square \ntel.', '52\n6th walk: \nNEA PARALIA – VASILISSIS OLGAS AVENUE\n1.5  Theme gardens.\nAlong Megalou Alexandrou \nAvenue towards the direction \nof the sea, 12 Theme Gardens \ncover an area of 76,657 m2 \nand are just the ideal place for \nspending your leisure time, \nstrolling or relaxing. They are as \nfollows: Garden of Alexander; \nGarden of the Afternoon Sun; \nGarden of Sand (with a café, \ntennis courts and a playground); \nGarden of the Seasons (includes \nan amphitheatre open for various \nevents and a café); Garden of \nOdysseas Fokas (playground \ninside); Garden of the \nMediterranean (café included); \nGarden of Sculptures (outdoor \ncontemporary art sculptures); \nGarden of Sound (with flowing \nwaters); Garden of Roses (with \nornamental flower beds and a \nplayground); Garden of Memory \n(with basketball grounds and \ntennis courts); Garden of Water \n(you will see lakes with plants \ngrowing in water, a small waterfall \nand a skatepark); and Garden of \nMusic with a space reserved for \nmusic events. You can also ride \nalong the area’s 3 km cycle path. \nThis is also the location of the \nNautical Club of Thessaloniki.\n1.6  Thessaloniki Concert \nHall.\nIt was inaugurated in 2000 on \na privileged location.', 'TO\nKYMIS\nMAKRYRACHIS\nARISTOFANOUS\nCHRYSOU\nTHERMA\nNIKO\nTRAP\nVASILEIADOU\nSIFILINON\nSOURMENON\nARGYROPOULOU\nNEAPOLEOS\nSTRAVONOS\nARGONAFTON\nKYDONION\nPAPADAKI\nSIGALA\nAKTAIOU\nANDRONIKOU\nPOLEMI\nPAP\nPANSELINOU\nADMITOU\nKASSANDREOS\nTSOUNTA\nPOULIOU\nKORNAROU\nNALTSA\nFRANT\nSIK\nA\nR\nH\nT\nO\nM\nA\nS\nLOGOTHETOU\nNIKOLAIDI\nTHEMELI\nSPETSON\nLASKARATOU\nTYPA\nYPSILANTOU\nDROSINI\nCHALK', 'It is now deserted. The stylish \nThemeli villa at no. 18 is  \nquite impressive and is also \nknown as Levi Modiano villa  \nand Michailidis residence.\n63.  \nYeni Mosque \nfeatures quite \na few eclectic \narchitectural \nelements.\n64.  \nModiano Villa \n(Vas. Olgas \nAve.) houses \nthe Folklife & \nEthnological \nMuseum of \nMacedonia - \nThrace.\n65.  \nThe imposing \nbuilding of the \nSchool for the \nBlind, on Vas. \nOlgas Ave.\n63\n64', 'A chapter \ntitled Byzantium after \nByzantium –Byzantine legacy \nin the years that followed the \nConquest unfolds in room 10.\n• Private collections. The D. \nPapastratos Collection in room \n8 includes 210 rare pieces of \nart - etchings with religious \n(orthodox) themes, and the D. \nOikonomopoulos Collection, in \nroom 9, counts 1,460 works of \nart of any type (coins, ceramics, \nicons and so on).\n82, 83 & 84. \nThe Jewish \nMuseum of \nThessaloniki: \n(left & middle) \npermanent \nexhibits from \nthe collection \nJewish \nNecropolis; \n(right) the \nJewish History \nexhibition.\n82\n83', 'ARTAKIS\nERATYRAS\nANTIGONIS\nVOULGAROKTONOU\nPARASKEVOPOULOU\nAPOSTOLOU\nPAVLOU\nFLEMING\nKONSTANTINOUPOLEOS\nKYFONIDI\nS\nA\nR\nE\nM\nI\nCHRYSOULIDI\nTHERMAIKOU\nPAPANIKOLA\nNIKOPOLEOS\nTRAPEZOUNTAS\nVASILEIADOU\nSIFILINON\nSOURMENON\nARGYROPOULOU\nNEAPOLEOS\nSTRAVONOS\nARGONAFTON\nKYDONION\nPAPADAKI\nSIGALA\nAKTAIOU\nANDRONIKOU\nPOLEMI\nPAPADAKI\nPANSELINOU\nADMITOU\nKASSANDREOS\nTSOUNTA\nPOULIOU\nKORNAROU\nNALTSA\nFRANTZI\nKRYSTALI\nAINOU\nSIK\nA\nR\nH\nT\nO\nM\nA\nS\nLOGOTHETOU\nNIKOLAIDI\nTHEMELI\nSPETSON\nLASKARATOU\nTYPA\nYPSILANTOU\nDROSINI\nCHALKIDIKIS\nTHERMOPYLON\nTHALITOS\nPITTAKOU\nGRAVIAS\nGRAVIAS\nFILELLINON\nOROMILA\nKRITIS\nPAPADIAMANTI\nNASTOU\nALKMINIS\nNATSINA\nGENNADIOU MITR.']",['']," Having no defined theme or context in a discussion can have several implications. Firstly, it can lead to confusion and ambiguity, making it challenging for participants to understand the topic or objective of the discussion. This can result in a lack of focus and direction, causing the discussion to meander or lose its purpose.

Secondly, without a clear theme or context, it can be difficult to establish a common ground or shared understanding among participants. This can lead to misunderstandings, miscommunications, and a lack of engagement.

Thirdly, a lack of theme or context can make it challenging to evaluate the effectiveness of the discussion. It can be difficult to determine what was accomplished, what was discussed, and what was agreed upon.

Lastly, without a defined theme or context, discussions can become ad hoc and lack a clear structure. This can lead to a lack of organization and a sense of chaos, making it difficult to summarize or follow up on the discussion.

In conclusion, having no defined theme or context in a discussion can lead to confusion, ambiguity, and a lack of focus. It can also make it challenging to evaluate the effectiveness of the discussion and can result in a lack of organization and structure.","Having no defined theme or context in a discussion can lead to confusion, miscommunication, and a lack of focus, making it difficult for participants to engage meaningfully.",0.0,0.33,0.0,0.8722709362698979,0.0,0.0,0.0,0.0,,0.9999996941456795
13,What frameworks arise from a lack of theme?,"['62\n7th walk: \nWEST OF THE CENTRE-STAVROUPOLI\nLazare church in Paris, which \nwas the seat of the order. \nAt times, the building was \nused as a hospital and a \nrefugee hospitality centre. \nIn 1980 it was declared a \nhistoric monument and a \nwork of art and in 1997 it \nwas fully renovated in order \nto accommodate the needs \narising from the European \nCapital of Culture events in \nThessaloniki. Since then it has \nbeen used as a multi-purpose \ncultural and entertainment \nvenue, as two halls of the \nNational Theatre of Northern \nGreece (N.T.N.G., see p. 109) \na Cultural Centre, a café-\nrestaurant and a bar are \nhoused here. Outdoor space \ntheatrical performances, \nconcerts and other events \nalso take place in the \npremises. The State Museum \nof Contemporary Art is \nhoused in one of the older \nstructures, covering an area \nof 3,270 m2 (for museum \ncollections, see p. 75). \n4.3  Kapnapothikes \n[Tobacco warehouses].\nFive old tobacco warehouses \n(tobacco shops) still stand \nin the area, as reminders of \nthe city’s booming tobacco \ntrade from the mid-19th c. \nuntil 1990. Most of them were \nbuilt in the Interwar Period and \nbear art deco and Bauhaus \narchitectural features.', 'A chapter \ntitled Byzantium after \nByzantium –Byzantine legacy \nin the years that followed the \nConquest unfolds in room 10.\n• Private collections. The D. \nPapastratos Collection in room \n8 includes 210 rare pieces of \nart - etchings with religious \n(orthodox) themes, and the D. \nOikonomopoulos Collection, in \nroom 9, counts 1,460 works of \nart of any type (coins, ceramics, \nicons and so on).\n82, 83 & 84. \nThe Jewish \nMuseum of \nThessaloniki: \n(left & middle) \npermanent \nexhibits from \nthe collection \nJewish \nNecropolis; \n(right) the \nJewish History \nexhibition.\n82\n83', '70\nARCHAEOLOGICAL MUSEUM \nOF THESSALONIKI\nWorks of art of outstanding \nvalue and excavated ensembles \nfrom the entire region of \nMacedonia are on display, \ncovering all the aspects of \nprivate and public life in the \narea, from the prehistoric era \nto the late antiquity period. \nExhibits are organised in six \nbasic categories:\n• Towards the birth of towns. \n(ground floor, room 4). The \nevidence on display shows \nthat there were settlements in \nMacedonia dating to the Iron \nAge, from 1100 to 700 BC.\n• Macedonia from the 7th c.  \nBC until Late Antiquity. \n(ground floor, room 5). Eight \nlarge theme sections cover \nvarious aspects of private \nand public life in Macedonia \nfrom the archaic years, when \nthe independent Macedonian \nkingdom was created, until \nthe 1st – 4th c. AD, when the \nentire region was a province \nof the Roman Empire. Finds \ncome mainly from excavations \ncarried out in areas of central \nMacedonia.\n• Thessaloniki, Metropolis \nof Macedonia. (ground \nfloor, room 6). Historical and \narchaeological information \nis presented, starting from \n315 BC when the town was \nfounded. There is also a \npartial reconstruction of an \narchaic temple of Ionic order, \nwhose original position is yet \nunknown; it was transported \nto the area of the Temples of \nThessaloniki during the Roman \noccupation.', 'The last part consists of \nwhat is believed to have \nbeen the tomb of Alexander \nIV, son of Alexander the \nGreat and Roxanne, who was \nassassinated by Cassander in \n310 BC; a silver urn containing \nthe bones of the dead person, \nframed with the ivory relief \nmotifs of the funeral bed. \nIn a separate room, visitors \ncan watch a video where M. \nAndronikos takes them on a \ntour of the monuments. Other \nexcavations in the wider area \nof the Aiges necropolis have \nunearthed archaic tombs, pit \nand cist tombs (6th and 5th c. \nBC), as well as temple-shaped \nmacedonian tombs one of \nwhich apparently belonged  \nto Queen Eurydice, the mother  \nof King Philip II\nPalace. It covers a 12,500 \nm2 area and it used to be \nthe largest and the most \nimportant construction (next \nto Parthenon, Athens) of the \nHellenic Classical Antiquity. \nThis two-storeyed edifice \nis presumed to be the work \nof Pytheos who was the \narchitect of the Mausoleum \nof Halicarnassos [modern-day \nBodrum, Turkey], one of the 7 \nwonders of the ancient world. \nThe palace’s architectural style \nis considered avant-garde for \nthat time and it was built of \nlimestone during the 2nd half \nof the 4th c. BC on a plateau; \n101, 102 & \n103.', 'Olgas Ave.).\nIt was built in 1896 as the \nresidence of a Turkish merchant \nand in 1908 it was purchased \nby the Bulgarian government. \nFrom 1922 until 1977, this \nwas the location of the Melissa \norphanage; since 1978 it \nhouses the Centre for Byzantine \nResearch of the Aristotle \nUniversity of Thessaloniki. It \nbears pronounced neoclassical \nand renaissance features \nand the ceiling paintings are \nparticularly interesting. There \nis a small garden around the \nbuilding.\n3.10 Building of the School for \nthe Blind (32, Vas. Olgas Ave.).\nIt was built in 1907 as a \nprivate residence (Hafiz Bey \nMansion) and it has been used \nas a business school and a day \nnursery. Eclectic architecture \nelements are combined with  \nmotifs relating to late \nRenaissance. Since 1948 it \nhouses the Ilios [meaning Sun] \nSchool for the Blind.\n3.11 Jeborga Villa  \n(20, Vas. Olgas Ave.).\nIt was built in 1878 as the \nresidence of Jeborga, a Jewish \nmerchant of French descent, \nand the architectural plans  \nare attributed to X. Paionidis. \nFrom 1901 until 1978 it  \nhoused the Italian Consulate. \nIt is now deserted. The stylish \nThemeli villa at no. 18 is  \nquite impressive and is also \nknown as Levi Modiano villa  \nand Michailidis residence.\n63.', '52\n6th walk: \nNEA PARALIA – VASILISSIS OLGAS AVENUE\n1.5  Theme gardens.\nAlong Megalou Alexandrou \nAvenue towards the direction \nof the sea, 12 Theme Gardens \ncover an area of 76,657 m2 \nand are just the ideal place for \nspending your leisure time, \nstrolling or relaxing. They are as \nfollows: Garden of Alexander; \nGarden of the Afternoon Sun; \nGarden of Sand (with a café, \ntennis courts and a playground); \nGarden of the Seasons (includes \nan amphitheatre open for various \nevents and a café); Garden of \nOdysseas Fokas (playground \ninside); Garden of the \nMediterranean (café included); \nGarden of Sculptures (outdoor \ncontemporary art sculptures); \nGarden of Sound (with flowing \nwaters); Garden of Roses (with \nornamental flower beds and a \nplayground); Garden of Memory \n(with basketball grounds and \ntennis courts); Garden of Water \n(you will see lakes with plants \ngrowing in water, a small waterfall \nand a skatepark); and Garden of \nMusic with a space reserved for \nmusic events. You can also ride \nalong the area’s 3 km cycle path. \nThis is also the location of the \nNautical Club of Thessaloniki.\n1.6  Thessaloniki Concert \nHall.\nIt was inaugurated in 2000 on \na privileged location.', 'TO\nKYMIS\nMAKRYRACHIS\nARISTOFANOUS\nCHRYSOU\nTHERMA\nNIKO\nTRAP\nVASILEIADOU\nSIFILINON\nSOURMENON\nARGYROPOULOU\nNEAPOLEOS\nSTRAVONOS\nARGONAFTON\nKYDONION\nPAPADAKI\nSIGALA\nAKTAIOU\nANDRONIKOU\nPOLEMI\nPAP\nPANSELINOU\nADMITOU\nKASSANDREOS\nTSOUNTA\nPOULIOU\nKORNAROU\nNALTSA\nFRANT\nSIK\nA\nR\nH\nT\nO\nM\nA\nS\nLOGOTHETOU\nNIKOLAIDI\nTHEMELI\nSPETSON\nLASKARATOU\nTYPA\nYPSILANTOU\nDROSINI\nCHALK', '79\nMUSEUMS\nfrom amateur stations in \ntown. Photographic material \nand voice archives comprising \nextracts from speeches of \nmajor personalities in the \nModern Greek history are also \non display. \nWATER MUSEUM\nThe museum is housed in \nthree restored buildings and \nthe surrounding grounds, \ncovering a total area of 3,000 \nm2. The main building (pump \nroom) contains pumping \nmachinery, motors and \npower-generating machines, \nold power distribution panels \nand a piece of steam-driven \nmachinery, in the multi-use \nroom (old boiler-room) \nthere is an impressive array \nof old steam boilers; in the \nmanagement building there \nis a library with specialised \nvolumes on water and hydraulic \nworks as well as an archive of \nrare historical maps, old water-\nsupply plans and photographs. \nIn the Water Park there are \nold pumping machinery and \npipelines on display.\nCHILDREN’S MUSEUM\nThis multi-theme museum \nopened in 1997 and it was \nhoused in a traditional building  \nin Ano Poli quarter (see p. 47),  \nuntil 2009 when it was destroyed  \nby fire. It is currently housed \nin the Cultural Centre of the \nMunicipality of Thessaloniki  \nand targets the 4-12 age group, \nthrough special programmes \non games, entertainment and \neducation; seminars addressed \nto students and teachers get \nalso organised there.\nNOESIS SCIENCE CENTRE \nAND TECHNOLOGY \nMUSEUM\nThe Centre’s core part is the \nTechnology Museum and the \nthree special education rooms.', 'It is now deserted. The stylish \nThemeli villa at no. 18 is  \nquite impressive and is also \nknown as Levi Modiano villa  \nand Michailidis residence.\n63.  \nYeni Mosque \nfeatures quite \na few eclectic \narchitectural \nelements.\n64.  \nModiano Villa \n(Vas. Olgas \nAve.) houses \nthe Folklife & \nEthnological \nMuseum of \nMacedonia - \nThrace.\n65.  \nThe imposing \nbuilding of the \nSchool for the \nBlind, on Vas. \nOlgas Ave.\n63\n64', '15) and in \nfour movie theatres housed in \nwarehouses in the harbour  \n(see p. 18). \nInformation: \n10, Aristotelous square \ntel.: 2310 378.400 \nwebsite: www.filmfestival.gr\nThessaloniki International \nFair (T.I.F.) - HELEXPO. \nSince 1926 this has been the \ntop trade fair in the Balkans \nand an institution as such in \nthe city. It takes place every \nSeptember and it is a major \ntrading and commercial event as \nthe achievements of the Greek \nindustry and entrepreneurship \nare presented to the world. The \nfirst radio station in southeast \nEurope broadcasted from \nthese grounds for the first \ntime in 1926, followed by the \nGreek television in the mid \nsixties. Since the 1960s T.I.F. \nestablished the Greek Film \nFestival (1960, see p. 108) and \nthe Thessaloniki Song Festival \nin 1962. In 1999 it was replaced \nby two companies: T.I.F. A.E. \nand HELEXPO A.E. responsible \nfor organising over 20 theme \nexhibitions held throughout \nthe year on clothing, furniture, \nenvironment, transport, tourism, \ntechnology, food industry, \nservices etc. Numerous Greek \nand foreign companies and \nagencies participate in the fair \nand over 2 million people visit it \nevery year.  \nInformation: 154, Egnatia St.  \ntel.']",['\n']," None. 
However, the query seems to be asking about frameworks that are related to theme, but not the lack of theme. In this case, the query seems to be asking about frameworks that arise from theme, but the query does not provide enough context to give a clear answer. However, based on the provided context information, the query seems to be asking about the Thessaloniki International Fair (T.I.F.) and the Film Festival. 

Based on the provided context information, the Thessaloniki International Fair (T.I.F.) is a major trading and commercial event that presents the achievements of the Greek industry and entrepreneurship to the world. The T.I.F. is organized by T.I.F. A.E. and HELEXPO A.E. and is held every September. The Greek Film Festival is another event held at the T.I.F. that showcases Greek cinema. 

Therefore, the frameworks that arise from theme in this context are the T.I.F. and the Film Festival, which are both related to the theme of film and commerce. 

However, it's worth noting that the query does not provide enough context to give a clear answer, and the answer may vary depending on the specific context and requirements of the query. 

In this case, the",The context does not provide any information regarding frameworks that arise from a lack of theme.,1.0,0.4,0.4375,0.5709149086583554,0.0,0.0,0.0,0.0,,0.0
14,What key events shaped Thessaloniki's history?,"['; in the \ncourse of time the collection \ngrew larger with donations \nby artists and collectors. The \nTelloglou donation is the \nkey collection and includes \nstatuettes of the Hellenistic \nperiod, Corinthian, Hellenistic \nand Roman vessels, Persian \nminiatures, objects of Arab and \nChinese art (vases, banners, \nplates) Thai woodcarved items \nas well as works of art by \nfamous Greek and European \npainters and sculptors of the \n19th and 20th c. It also hosts \ntemporary exhibitions, a \nvariety of cultural events and \neducational programmes.\nMUNICIPAL GALLERY\nOver 1,000 works of art \nare on display in the gallery \nand they are classified in 4 \ncollections as follows: The \nmost important one is titled \nThessalonian Artists and it \nincludes pieces of art by local \nvisual artists referring to the \nperiod from 1898 to 1967 \n(P. Reggos, N. Fotakis, Chr. \nLefakis, N. Gavriil Pentzikis,  \nK. Lachas, G. Svoronos among \nothers); the Modern Greek Art \n88.  \nThe Society for \nMacedonian \nStudies \nhouses a most \ninteresting \nGallery.\n89.  \nCasa Bianca \nhouses the \nMunicipal \nGallery of \nThessaloniki.\n90.  \nThe \nThessaloniki \nCinema \nMuseum.\n88\n89', 'The collection \nincludes approx. 250 pieces  \non painting, sculpture, pottery,  \nmosaics, murals and \nengraving.\nTHESSALONIKI CINEMA \nMUSEUM\nIt was created in 1997  \nand the opening coincided \nwith the European Capital  \nof Culture events which were \nhosted by Thessaloniki that \nyear. It is closely related \nto the city history, as the \nThessaloniki International Film \nFestival has been taking place \nin the city since 1960 (see p. \n108). Exhibits tell the history \nof the Greek cinema and are \nclassified in six timelines, \nnamely Manakia brothers, \n1900-1940, 1940-1960, \n1960-1970, 1970-1990,  \nand 1990 and beyond. Among \nthe items on display are rare \n90', '73\nMUSEUMS\n• Discovering the past. \nExcavated sites in the city and \nthe procedure for creating and \nmaintaining an archaeological \nmuseum are described in room 11.\n• Temporary exhibitions \nand events. At times the \nMuseum organises temporary \nexhibitions and cultural events, \nmost of which are associated \nwith Thessaloniki’s and \nNorthern Greece’s Byzantine \nlegacy.\nWHITE TOWER EXHIBITION\nStarting from the year it was \nfounded until the present day, \nthe history of Thessaloniki is \ndepicted through an array of \nmultimedia applications, special \nstructures, printed graphic \ndesign compositions and \narchaeological material. The \nexhibition is organised in seven \nthematic categories, each one \noccupying one floor, as follows: \nSpace and Time (ground floor), \nTransformations (1st floor), \nMonuments and History (2nd \nfloor), Homeland of the people \n(3rd floor), Along the trade \nroutes (4th floor), Leisure and \nCulture (5th floor), Thessaloniki \n– Flavours (6th floor). The \nmuseum’s shop is located on \nthe last floor.\nJEWISH MUSEUM OF \nTHESSALONIKI\nIt was created following \nan initiative of the Jewish \nCommunity of Thessaloniki  \nto promote the Sephardic \nlegacy in town, which dates  \nas far back as the 15th c. It has \nbeen open to visitors since \n1997.', 'The last part consists of \nwhat is believed to have \nbeen the tomb of Alexander \nIV, son of Alexander the \nGreat and Roxanne, who was \nassassinated by Cassander in \n310 BC; a silver urn containing \nthe bones of the dead person, \nframed with the ivory relief \nmotifs of the funeral bed. \nIn a separate room, visitors \ncan watch a video where M. \nAndronikos takes them on a \ntour of the monuments. Other \nexcavations in the wider area \nof the Aiges necropolis have \nunearthed archaic tombs, pit \nand cist tombs (6th and 5th c. \nBC), as well as temple-shaped \nmacedonian tombs one of \nwhich apparently belonged  \nto Queen Eurydice, the mother  \nof King Philip II\nPalace. It covers a 12,500 \nm2 area and it used to be \nthe largest and the most \nimportant construction (next \nto Parthenon, Athens) of the \nHellenic Classical Antiquity. \nThis two-storeyed edifice \nis presumed to be the work \nof Pytheos who was the \narchitect of the Mausoleum \nof Halicarnassos [modern-day \nBodrum, Turkey], one of the 7 \nwonders of the ancient world. \nThe palace’s architectural style \nis considered avant-garde for \nthat time and it was built of \nlimestone during the 2nd half \nof the 4th c. BC on a plateau; \n101, 102 & \n103.', 'Such evidence \nmakes this cave one of the \noldest archaeological sites in \nEurope. Findings from the cave \n(tools, animal bones etc) are  \non display at the Museum  \nand so are a cast of the skull  \n(the original is kept at the \nGeology-Palaeontology Museum  \nof the Aristotle University  \nof Thessaloniki, see p. 38) and  \na reconstruction of the place  \nit was found.\n4.1  Halkidiki (also \nChalcidice or Chalkidiki) – \nAgio Oros [Holy Mount].\nHomeland of Aristotle,  \nthe ancient Greek philosopher, \nHalkidiki is one of the best \nand most popular tourist \ndestinations in Greece with \nan important history, bustling \ntourist resorts, traditional \nvillages, enchanting beaches, \nverdant mountains and an \nintense night life. Located \nsouth of Thessaloniki, \nHalkidiki ends in the three \nleg-shaped peninsulas named \nKassandra, Sithonia and \nAthos. Thessalonians swarm \nin Kassandra and Sithonia for \n110.  \nOne of \nHalkidiki’s \nnumerous \nlovely beaches.\n111.  \nMount \nAthos: Agios \nPanteleimonas \nMonastery.\n110', '109\nwebsite: www.helexpo.gr\nInternational Book Fair.  \nHeld every spring in the \nHELEXPO-TIF exhibition \ncentre, it is well known as \nthe annual rendezvous place \nfor professionals and book \nlovers alike. Greek and foreign \npublishers present their new \nwork and special tributes to \nwriters and types of literature \nare included in the happenings \nwhere new books are presented \nand open discussions take \nplace with writers; other events \ninclude the honoured country, \nprofessional meetings, the \nChildren’s corner, the Teenagers’ \ncorner and the Book lover’s corner. \nInformation: National Book \nCentre, 4, Athan. Diakou St, \nAthens \ntel.: 210 92.00.300, \nwebsite:  \nwww.thessalonikibookfair.com  \nand www.ekebi.gr\nSociety for Macedonian \nStudies (S.M.S.). \nIt is a major cultural institution \nin Thessaloniki aimed at \ncollecting, preserving, studying \nand promoting the linguistic, \nhistorical, traditional and \narchaeological archives \nconnected with the history  \nof Macedonia. It has a large \nlibrary and an Art Gallery  \n(see p. 76). A variety of events, \nscientific congresses and \nspecialised publications are  \npart of the activities organised. \nInformation:  \n4, Ethnikis Amynis St.,  \ntel.: 2310 271.195,  \nwebsite: www.ems.gr\nThessaloniki Concert Hall. \nIt is located on 25th Martiou St.', 'It houses a Centre of \nResearch and Study of the \nJewish History in Thessaloniki, \nan extensive library and an \nAudiovisual Centre. Permanent \nexhibitions are divided in four \ncategories, as follows:\n• Jewish necropolis. \n(ground floor). Tombstones and \nstelae with epitaph inscriptions \nare on display, from the great \nJewish necropolis which \nused to lie east of the city \nwalls. Photographs show the \ncemetery as it was in 1914.\n• Jewish history. (1st floor). \nIt occupies the central area \nwith a narrative of the Jewish \npresence in Thessaloniki up  \nto World War II.\n• Folk Art and Life. (1st \nfloor). A large array of exhibits \npaints a vivid picture of the \n84', '77\nMUSEUMS\ncollection includes works of art \nby leading Greek Artists; the \nByzantine and Postbyzantine \nIcons collection is related to \nthe school of Thessaloniki \nand spans 5 centuries (14th \n-19th c.); and a collection of \n360 pieces of art on Greek \nEngraving. Retrospective \nexhibitions of Greek and \nforeign artists are frequently \narranged in collaboration with \nart foundations in Greece and \nabroad.\nGALLERY OF THE \nSOCIETY FOR \nMACEDONIAN STUDIES\nIt is housed on the top floor \nof the Theatre Building of \nthe S.M.S. and it is the first \nvisual arts museum in the city. \nIt encompasses 300 pieces \nof art (painting, sculpture \nand engraving) by famous \nGreek and foreign artists, \nmostly from northern Greece, \nwho represent the major art \nmovements of the 20th c.\nCULTURAL CENTRE OF \nTHESSALONIKI (NATIONAL \nBANK OF GREECE \nCULTURAL FOUNDATION)\nIt opened to the public in \n1989 and has, ever since,  \nbeen organising major painting,  \nsculpture, photography and \narchitecture exhibitions in \ncollaboration with other local \neducational and cultural \nagencies. Events related to  \nthe history of the city and  \nthe greater area also take  \nplace there. The collection \nincludes approx. 250 pieces  \non painting, sculpture, pottery,  \nmosaics, murals and \nengraving.', 'Greek revolts \nof that period in Macedonia are \ndescribed in Room A; exhibits \nrelated to the Macedonian \nsociety of the late 19th c. are \nin Room B; a reconstruction \nof the office of the Greek \nGeneral Consul is in Room C; \nthe process of recruitment in \nthe Greek guerilla forces of \nthose times is on display in \nRoom D; the role played by the \nclergy is depicted in Room E; \nthe Balkan Wars are described \nin Room F; the course of \nMacedonian history following \nthe Balkan Wars is in Room G. \nCostumes and authentic relics \nfrom the Balkan Wars Period \n(arms, uniforms among other \nitems), are exhibited in the \n1st floor, as is a collection of \nminiature vehicles of the Greek \narmy.\nWAR MUSEUM\nExhibits include objects \nsuch as uniforms, arms, maps, \nbattleship effigies, documents \nand military decorations, \nwhich are connected with the \nmost significant events of the \nmodern Greek history, from the \n1821 War of Independence \nuntil the 1944 liberation from \nthe German Occupation forces. \nIn the museum’s courtyard you \nwill see armoured vehicles, \nfighters and torpedoes used by \nthe Greek Army in the past.\nATATURK MUSEUM \nExhibits occupy two floors: \nThe 1st floor includes the \nparlour, the living room, the \n85 & 86. \n(left) The \nneoclassical \nbuilding of \nthe Museum \nfor the \nMacedonian \nStruggle and \n(right) one of \nits exhibits.', '32\n3rd walk: \nHISTORIC CENTRE (2)\nMUSEUM AREA\nand exhibits, see p. 76).\n10.2 OTE [Hellenic \nTelecommunications \nOrganisation] Tower.\nIt was built in 1969 to plans \nby architect Al. Anastasiadis, \nas the Organisation’s \nexhibition pavilion, and for \ncovering the city’s telecom \nneeds. It dominates against \nthe city’s horizon as it reaches \na 70-metre height – including \nthe antenna. Its storeys house \nradio stations and at a higher \nlevel there is a caffé with a \nrotating floor (completes a \nrevolution in 70 min.), where \nthe city and seafront views \nare amazing. At a very short \ndistance lies the Radio \nMuseum which is worth your \nvisit (see the exhibits on p. 78).\n10.3 Alexandreio \nMelathron.\nAlso known as Palais des \nSports, this sports arena is \nlocated on the NE side of the \nThessaloniki International Fair \ngrounds. Constructed in 1966, \nit has played an active part \nin Thessaloniki’s history ever \nsince, as major sporting, art \nas well as political events have \ntaken place in it over the years.  \nIt is a round edifice with a \nseating for 4,800, and it used \nto be the largest indoor sports \narena in Greece until 1985. \nToday, it is the home ground of \nAris basketball team.\n10.4 Angelaki Street.']",['The history of Thessaloniki\t\n6\n']," Thessaloniki's history has been shaped by several key events. The city has been an important cultural and economic center in Greece, and its history is marked by several significant events. The most notable ones include the founding of the city, its role in the Macedonian Wars, its significance in the Byzantine Empire, and its importance as a major port during the Roman Empire. Additionally, Thessaloniki has been an important center for the Jewish community, and its history has been shaped by the Sephardic legacy. The city has also been the site of several important archaeological sites, including the White Tower and the Palace. Furthermore, Thessaloniki has played a significant role in the Balkan Wars and has been an important center for the Greek military during World War II. Overall, Thessaloniki's history is a rich and complex tapestry of cultural, economic, and military events.",The context provided does not contain specific key events that shaped Thessaloniki's history.,1.0,0.0,0.5,0.6318031651998867,0.0,0.0,0.0,0.0,,0.955340947772548
15,How do historical cultural significance landmarks areas Historic Centre Thessaloniki compare traditional restaurants notable sites Bezesteni Stoa Saul impact modern developments preservation heritage?,"['24\n2nd walk: \nHISTORIC CENTRE (1)\nTRADITIONAL COMMERCIAL CENTRE\nVlali square you will find \ncoffee shops and traditional \nrestaurants. A memorial has \nbeen erected at the junction \nof Spandoni, Ermou and \nVenizelou streets, in memory \nof MP Gr. Lamprakis who was \nassassinated in May 1963. \nIn Vatikioti market as well \nas in Athonos square, east \nof Aristotelous street, there \nare shops selling produce, \nspices, songbirds, packaging \nand shoe-making ware; in \nAthonos square you will find \nworkshops selling wooden and \nwicker chairs as well as many \ntavernas and ouzo restaurants. \n7.3  Bezesteni.\nIt lies at the corner of \nSolomou and Venizelou \nstreets. It is a rectangular \nbuilding with four entrances \nand six lead-covered domes \nwith inscriptions of all of \nthe craftsmen’s names on \nthem. It was built in the late \n15th – early 16th c. as a textile \nmarket [bezesten] and a \nmarket of precious stones, \nwhich was guarded 24 hours \na day. It has kept most of its \ncharacter as there are over \n110 shops in the interior as \nwell as in the exterior – most \nof them selling textiles or \njewellery. \n7.4  Stoa Saul.', 'AG. SOFIAS\nMFEI\nSQ.\nSYNTRIVANIOU\nSQ.\nNAVARINOU\nSQ.\nSQ.\nLYSSIATREIO\nTHEA\nCANC\nGENERAL\nHOSPITAL\nOF THESSALONIKI\nG. GENNIMATAS\nUNIVERSITY\nGENERAL\nHOSPITAL\nOF THESSALONIKI\nAHEPA\n   INFECTIOUS\n  DISEASES\nHOSPITAL\n3rd walk: \nHISTORIC CENTRE (2)\nMUSEUM AREA\nThe area is considered  \nas one of the most privileged \nplaces downtown on account \nof its proximity to the beach;  \nit is traditionally regarded as \nthe residential area of the \nwell-to-do. There are many \nwell-known shops here, green \nspots, as well as some of the \nmost important museums  \nand cultural institutions.\n1 \t\x07\nTHE WHITE TOWER \nAREA\nThis central location is where \nmajor city roads meet (Nikis \nAve, Megalou Alexandrou Ave., \nPavlou Mela, Ethnikis Amynis, \nGermanou) and where the old \npart of the waterfront meets \nthe new one. It affords a lovely \nview of the sea; there are \ngreen areas and many shops, \ncafés and bars.\nMUST SEE:\n1.1  The White Tower.\nThis is the city’s most \nfamous landmark - \nmonument.', '7\n«…There is a homeland for everyone,  \nwhile there is Thessaloniki»\nNikiforos Choumnos, \n14thc. Byzantine dignitary and a scholar.\nNowadays, the historic capital -by right- of Macedonia, \nthe land of Alexander the Great, has evolved into a modern \nand particularly charming metropolis. A multitide of \nmonuments and cultural assets and the town’s traditional \nways exist in harmony with the modern aspects and the \nhigh standard infrastructure, the carefree mood, the spirit \nof hospitality, the vitality of the locals – particularly the \nyoung – setting the pace of town life, the diversity of \nartistic events, the long list of choices for entertainment, \nthe exceptional culinary tradition, and the fresh feel in \nthe atmosphere, coming from the seafront, as well as the \ncoolness of the northwest wind called Vardaris.   \nThessaloniki’s location is at the centre of a greater area \nwith incomparable historical monuments and natural assets \nas it offers the opportunity for a visit to archaeological \nsites known the world over (Ancient Pella, Vergina, Dion, \nPetralona Cave), to areas of exquisite nature (river deltas, \nlakes, Mt Olympus), to the monastic state of Agion Oros \n[the Holy Mountain] as well as to Halkidiki, a famous tourist \ndestination. And there is always an opportunity to practice \nsports (swimming, skiing, playing golf etc) or to indulge in \nwellness tourism (hot springs, spas)!\nIn short, Thessaloniki is a city that can cater for even the \nmost demanding needs, any time of the year.', '36\n4th walk: \nHISTORIC CENTRE (3)\nthat the place had been used \nby Christians as well, during \nthe late Roman period. South \nof the passageway there \nwere shops dating from the \n1st until the 13th century; the \nunderground Museum of the \nRoman Forum (see p. 71) was \nbuilt there as an extension. \nA 2nd - 4th c. AD Odeon [C] \nwas found behind the well-\npreserved eastern stoa. It  \nhas been restored and it is now \nused as a venue for cultural \nevents. A mint and an archive \noffice are right next to it. In the \nSE side, a round bath house \n[D] was unearthed which has \nbeen in use since the 1st c. BC. \nParts of a colonnade, mosaic \nfloors, marble stairs, a section \nof a stone-paved street, sewer \npipes, silver coins, stone and \nmarble sculptures were all \nfound in this archaeological \nsite. The forum is also where \nthe “Enchanted Ones” (las \nIncantadas) were discovered, \na two-storeyed colonnaded \narchway with Corinthian-order \ncolumns and pillars four of \nwhich have survived. They are \ndecorated with figures in relief \nin their interior as well as their \nexterior side (“Stoa of the \nStatuettes”).', 'Today, this is one of \nthe top places in Thessaloniki, \ncrossed daily by thousands of \nlocals and visitors. One side \nof the avenue is lined with \ncafés and cosy little bars and \nthe opposite wide pedestrian \narea next to the sea gets \nfilled with strollers, cyclists, \nstreet artists and vendors. \nAmong the modern blocks of \nflats, you will see some of the \ncity’s major landmarks: past \nEleftherias square, the three-\nstorey interwar period mansion \nwhere Olympos-Naousa a \nonce popular restaurant used \nto be; Aristotelous square; \nKoniordou Mansion (at the \ncorner with Kar. Dil street); \nTyroloi Mansion built during \nthe Interbellum (located \nbetween Kar. Dil and Agia Sofia \nStreets), where Tottis coffee \nshop used to be for many \nyears; Mandalideio Mansion \n(1931) and Exarchopoulos \nMansion (1935) - the two \nlast ones are situated at the \njunction with Vogatsikou \nstreet; at 63, Nikis Avenue \nyou will see the three-storey \nbuilding of the Thessaloniki \nClub (1926); at number 73, \nPallas, an old cinema theatre, \nhouses the State Orchestra of \nThessaloniki.\n2nd walk: \nHISTORIC CENTRE (1)\nTRADITIONAL COMMERCIAL CENTRE\n10.  \nBustling Nikis \nAvenue and \nthe White \nTower in the \nbackground.\n10', 'The monumental style of \narchitecture is shown in the \nbuildings’ facades, colonnades, \narcades and porticos, which \ncombine elements from the \ncity’s Byzantine tradition \nwith European interwar \nperiod motifs. The square is \nlandmarked by two identical \nconcave buildings: Electra \nPalace hotel (late sixties) - \nbuilt by GNTO architects -  \non the west side, and Olympion \non the east side, which was \nprogressively erected and \ncompleted by the late fifties \n(designed by J. Moshé) \nand is now the seat of the \nThessaloniki Film Festival  \n(see p. 108).\nMUST SEE:\n1.1  Aristotelous Street.\nPedestrianised historic \nboulevard, that ends in Egnatia \nStreet (see p. 34). According \nto the Hébrard plans, it would \n2nd walk: \nHISTORIC CENTRE (1) \nTRADITIONAL COMMERCIAL CENTRE\n4.1\n6.1\n6.3\n6.2\n6.5\n6.6\n6.7\n1.1\n1.2\n6.8\n7.5\n7.3\n7.2\n7.2\n7.1\n7.4\n6.4\n3.1\n1\n2\n3\n4\n5\n7', '97\nNIGHTLIFE\nNIGHTLIFE\nThessaloniki is well known \nfor the intense nightlife and \nthe diverse options offered \nto visitors. Some say that \nthis is the greek ‘capital’ of \nentertainment as many trends \nand new fashions spread \nout from this town in the \nlast decades and were later \nadopted across the country. \nRanking high in the list of \noptions are the numerous bars \n(most of them with an avant-\ngarde design), tavernas, ouzo \nrestaurants (called ouzeri), \nmodern cuisine restaurants, \nclubs with live greek music, \nparticularly those playing \nrebetiko - a typical genre of \ngreek popular music which \ngrew to new heights in this \ntown – seaside bars and music \nstages. \nIn the city centre, Ladadika \n(see p. 18) has been a \nfavourite nightlife area \nsince the early 1990s; the \nneighbouring Kalapothaki \nStreet (see p. 17), the cafés \nand bars by the old beachfront \n(see p. 16) and the modern \nrestaurants and bars housed \nin the historic city arcades all \nadd to the picture. Worthy of \nnotice are also the tavernas in \nthe traditional town market \nplaces (see p. 21), the bars and \nthe cosy, elegant restaurants \nlining the bustling city streets \n(see p. 27), as well as the area \nbetween Zefxidos and Iktinou \nStreets (see p. 28).', 'Notice the glass globe on \nthe top of the building, a point \nof reference in Eleftherias Sq. \nIn the neighbouring Komninon \nStreet it is worth noticing the \neclectic style on buildings \nsuch as Luxemburg Hotel as \nwell as Tourist and Excelsior \nHotels at the junction with \nMitropoleos streets.\n4 \tPORT\nThe area is one of the biggest \nports of the country and of the \nsoutheastern Mediterranean, \nwith a significant trade and \npassenger traffic. This is where \nthe first artificial harbour of \nthe town was constructed by \nConstantine the Great during \nhis short stay in Thessaloniki \n(322-323 AD); later on during \nthe Turkish Occupation it \nwas banked up with earth. \n2nd walk: \nHISTORIC CENTRE (1)\nTRADITIONAL COMMERCIAL CENTRE', '25\n2nd walk: \nHISTORIC CENTRE (1)\nTRADITIONAL COMMERCIAL CENTRE\nValaoritou Street and the \nneighbouring ones (Syngrou, \nVilara Streets and others) are \nlined with cafés, bars and \nrestaurants. In Syngrou Street, \nyou will find Chrimatistiriou \nSq. [Money-brokers sq.] and \nthe building of Stoa Malakopi \n[Malakopi Arcade] – of neo-\nrenaissance style- (1907, V. \nPoselli) which housed a bank \nuntil 1954 and commercial \nenterprises later on. The main \nfeature in the centre of the \npediment (in Vilara Street) \nis the clock which stopped \nat the time when the 1978 \nearthquake took place. In the \narcade’s interior you will find \namusement areas and shops.  \nAt a stone’s throw lies the \nCatholic Church (1898, V. \nPoselli), built on the location \nof an older church which \ngot destroyed in the 1917 \nfire. It lies in a serene yard \nand its 40 m. tall belfry is \nquite impressive. Notice the \nbuilding housing the State \nConservatory of Thessaloniki \n(1903), at the corner of Vas. \nIrakleiou and L. Sofou Streets; \nit was built in a neobaroque \nstyle by Turkish architects on \nthe location of an old mansion \nwhich was blown up that year \nby Bulgarian nationalists as it \nhoused the Ottoman Bank.', '5\nCONTENTS\nThessaloniki\t\n4\nThe history of Thessaloniki\t\n6\n1st walk: \n\t  UNESCO Byzantine Monuments\t\n8\n2nd walk: \n\t Historic Centre (1) - Traditional commercial centre\t\n15\n3rd walk:  \n\t Historic Centre (2) - Museum area\t\n24\n4th walk:   \n\t Historic Centre (3)\t\n34\n5th walk:  \n\t Ano Poli (Old Town)\t\n42\n6th walk: \n\t Nea Paralia – Vasilissis Olgas Avenue\t\n50\n7th walk: \n\t West of the Centre-Stavroupoli \t\n58\nSuburbs and city outskirts\t\n63\nMuseums\t\n70\nDay Excursions\t\n82\nBuys in Thessaloniki\t\n96\nNightlife \t\n97\nGastronomy and wines\t\n99\nTouring Thessaloniki with children\t\n100\nInformation\t\n102\nMaps\t\n112']","['The historic center of Thessaloniki features traditional commercial areas like Vlali Square, known for coffee shops and restaurants, and a memorial for MP Gr. Lamprakis. The Vatikioti market and Athonos Square offer shops selling produce, spices, and various goods, along with tavernas and ouzo restaurants. Bezesteni, a rectangular building from the late 15th century, serves as a textile and jewelry market with over 110 shops. Stoa Saul, completed in 1881 and rebuilt after a fire, combines neo-renaissance and art deco styles and is now an entertainment venue. Vas. Irakleiou, formerly known as Fragkomachalas, has transformed from a banking area to a commercial and entertainment hub, with popular tavernas and traditional marketplaces offering high-quality foodstuffs.', 'The input consists of the number 112 repeated twice.', 'The text describes notable landmarks in Thessaloniki, including the OTE Tower, built in 1969, which serves as a telecommunications hub and features a rotating café with stunning views. It also mentions the Alexandreio Melathron, a historic sports arena constructed in 1966, which has hosted various significant events and is now home to the Aris basketball team. Additionally, Angelaki Street is highlighted for its vibrant cafés and bars popular among university students, as well as the presence of several radio stations. The area surrounding the 3rd Army Corps is also noted, with its historical significance and architectural features.', 'Kalochori, located 5 km west of the city center, is a rapidly growing residential suburb known for its industrial character and local tavernas. The Gallikos River runs along its west edge, offering facilities for picnicking and relaxation. The river delta and Kalochori lagoon are home to diverse wildlife, including herons and flamingoes. The surrounding wetland area, protected by the Ramsar Convention, is part of the Natura 2000 network and offers free tours. Sindos, situated about 9 km northwest of Kalochori, has grown significantly due to the Thessaloniki Industrial Park.', 'The area features historical sites, including a World War II gun emplacement, and is home to diverse salt marshes and wetlands that shelter 178 bird species like flamingoes and cormorants. To reach the location, take the 71 or 71A bus from the Railway Station Stop to N. Michaniona, or use bus lines 02 and 02A to A.S. IKEA station and then transfer to buses 72, 72A, or 72B. If driving, follow Ethinikis Antistasis, Georgikis Scholis, and Michanionas avenues.', ""The text describes various museums in Thessaloniki, Greece, including a cinema museum showcasing projectors and films from 1910, a photography museum founded in 1997 with over 100,000 photographic objects from 1890-1980, and the Olympic Museum, which focuses on Olympic and Paralympic memorabilia. Additionally, it mentions the 'Christos Tsiggiridis' Radio Museum, featuring equipment from the founder of the first radio station in the Balkans. Each museum hosts educational programs and temporary exhibitions, contributing to the cultural landscape of the city."", 'The Jewish quarter in Europe retains its traditional character, featuring Roman, Ottoman, and Industrial age monuments in districts like Kyriotissa, Panagia Dexia, and Makariotissa. Visitors can explore the award-winning Public Central Library and enjoy local parks. Vergina, located 63 km SW of Thessaloniki, is accessible by car, intercity bus, or train. Dion, an archaeological site under the Olympus mountain range, was a sacred place for ancient Macedonians, dedicated to Zeus and the Muses. The site includes the Vafyras sacred springs, the temple of Demeter, and the Sanctuary of Zeus Hypsistos. Dion flourished until the 5th century AD when it was abandoned due to seismic activity.', 'The historic centre features Valaoritou Street and nearby streets filled with cafés, bars, and restaurants. Notable sites include the neo-renaissance Stoa Malakopi, which housed a bank until 1954, and a clock that stopped during the 1978 earthquake. The Catholic Church, built in 1898, stands in a serene yard with an impressive belfry. The State Conservatory of Thessaloniki, constructed in neobaroque style in 1903, is located at the corner of Vas. Irakleiou and L. Sofou Streets, featuring a garden with 19th-century statues. Ermou Street, running parallel to Vas. Irakleiou, serves as an interesting shopping centre.', 'The Hellenic Professional Yacht Owners Association is located in Piraeus, while the Thessaloniki Marina is in Aretsou Kalamaria. Various beaches are accessible, including Aretsou beach and those in Halkidiki, which are popular for swimming. Mineral springs and spas in the area include Lagkadas Spa, Nea Apollonia Spa, and Souroti Spring. The urban bus service in Thessaloniki covers all city areas, with main termini at key locations. Buses operate from 5 am to midnight, with options for purchasing tickets or passes. A cultural bus route highlights historical sites, and sightseeing tours are available in open-top buses. Makedonia International Airport is 15 km from the city center, with bus services connecting it to major stations. Information for airlines like Olympic Air and Aegean Airlines is also provided.', 'The site features a dark atmosphere with selective lighting highlighting various exhibits, including funerary steles and a 3rd century BC tomb. Notable structures include a memorial for distinguished individuals and the tomb of King Philip II, which showcases exquisite murals, a gold larnax containing his bones, and a decorated suit of armor. The site also contains the tomb of Alexander IV, featuring a silver urn with his remains. Visitors can watch a video tour by M. Andronikos. Excavations in the Aiges necropolis have revealed archaic tombs and a temple-shaped tomb believed to belong to Queen Eurydice. Additionally, the palace, covering 12,500 m2, is considered a significant construction of Hellenic Classical Antiquity, attributed to architect Pytheos.', 'Thessaloniki offers various transportation options including a passenger railway station, intercity bus services, and taxi services with regulated fares. Key contact information includes the railway station at 28 Monastiriou St. and the Macedonia Intercity Bus Station at 244 Giannitson St. Numerous museums and archaeological sites are available for visitors, such as the Archaeological Museum of Thessaloniki and the Museum of Byzantine Culture. Each museum has specific contact details and websites for more information. The city also features a range of cultural institutions, including the State Museum of Contemporary Art and the Jewish Museum of Thessaloniki.', ""The text describes several museums in Thessaloniki, including a Holocaust exhibition that memorializes the local Jewish community, particularly the 49,000 members sent to concentration camps. The Museum of the Macedonian Struggle showcases the history of Macedonia's fight for freedom against the Ottoman Turks, with various rooms dedicated to different aspects of this struggle. The War Museum features significant artifacts from modern Greek history, including uniforms and military decorations from the 1821 War of Independence to the 1944 liberation. Lastly, the Ataturk Museum displays exhibits across two floors, highlighting the life and legacy of Mustafa Kemal Ataturk."", ""The text describes notable Byzantine monuments in Thessaloniki, including Agios Panteleimonas Church, which was originally part of a monastery and later converted into a mosque, featuring murals from the 13th-14th centuries. It also highlights Agios Dimitrios Church, the city's patron saint, built in the 7th century on the ruins of a 5th-century basilica, which was converted into a mosque in 1493 and restored after a fire in 1917. The church contains significant mosaics and a basement Krypt, believed to be the site of Saint Demetrius's martyrdom, and has been used for cultural events since 1988."", 'Ano Poli, or Old Town, features notable areas like Tsinari, Terpsithea Square, and Romfei Square. Tsinari is named after a plane tree and is a central spot with an Ottoman fountain and the oldest restaurant in town. Terpsithea Square showcases remarkable buildings, a playground, and the Tϋrbe of Musha Baba, a late Ottoman monument. Romfei Square is the central square of Ano Poli, home to a Byzantine bath-house and a neoclassical building housing the municipal library. Nearby, the 14th-century Byzantine church of the Taxiarchs adds historical significance to the area.', ""Thessaloniki is a hub for archaeological, historical, and natural attractions, offering numerous outdoor activities and relaxation options. Visitors can explore significant archaeological sites, historical towns, and natural reserves. Ancient Pella, once the capital of Macedon, thrived under King Philip II and became a major cultural center before its decline after Roman conquest. Notable finds include exquisite mosaic floors in spacious townhouses, such as the House of Dionysus and the House of the Snatching of Helen, showcasing rich decorations and historical scenes. Pella's archaeological site features a restored peristyle, making it a must-see for visitors."", 'Kalamaria features popular areas like Aretsou and Krini along the seafront, with amenities such as a marina, open-air cinema, and numerous café-bars. Komninon Street, a pedestrian-only area, hosts shops, cafés, and the central square with the Town Hall and church. Panorama, a suburb 12 km from Thessaloniki, offers luxury villas and a small shopping area, with historical roots dating back to the early 20th century. Platanakia is a notable spot for relaxation, featuring a wooded ravine, a small zoo, and a scenic path leading to an artificial lake.', ""The text describes the connection between the town's civic center and various key locations, including Kassandrou Street, Aristotelous Square, and the seafront. It highlights the architectural features of buildings along the street, which house various businesses and institutions. The church of Agia Theodora is noted as a significant landmark at the junction of Aristotelous and Ermou Streets. Nikis Avenue, known as Palia Paralia, runs from the harbor to the White Tower and has historical significance due to its development in 1882. Today, it is a vibrant area frequented by locals and tourists, lined with cafés and bars, and features a wide pedestrian area by the sea. The avenue is also home to several notable landmarks, including various mansions and the State Orchestra of Thessaloniki."", 'The document outlines a guide to Thessaloniki, including its history, various walking tours of the city, information on museums, day excursions, nightlife, gastronomy, and tips for touring with children.', 'The text describes the historical significance of various structures in ancient Macedonia, including a palace with a peristyle, a monumental gateway, and a temple dedicated to Hercules. It mentions the theatre built around 340 BC, known for being one of the oldest stone theatres, where King Philip II was assassinated. Additionally, it details religious sites near the theatre, including temples dedicated to goddess Euclea and Kyveli, along with remnants of royal votive offerings. The Acropolis features five towers and thick fortification walls, with house foundations dating from the 5th to 1st century BC. The text also highlights Veroia, a historic town in Northern Greece, known for its Byzantine churches and as a site visited by Apostle Paul, earning it the nickname Little Jerusalem.', 'Thessaloniki, the historic capital of Macedonia, blends its rich cultural heritage with modernity, featuring numerous monuments and a vibrant atmosphere. The city is known for its hospitality, artistic events, and exceptional culinary traditions. Its strategic location allows easy access to renowned archaeological sites, natural wonders, and the monastic state of Agion Oros. Visitors can enjoy various sports and wellness tourism options throughout the year, making Thessaloniki a versatile destination for all.', ""Thessaloniki is a child-friendly city with numerous activities, including bicycle rides along waterfront bike lanes and visits to theme parks. The region is also known for its rich wine-making tradition, featuring a variety of grapes like Roditis, Asyrtiko, and Cabernet Sauvignon. The Wine Producers Association offers excursions through the 'Wine Roads of North Greece,' combining visits to wineries with historical sites. Families can enjoy various fun activities and games throughout the city."", ""The Lazare church in Paris, once a hospital and refugee center, was declared a historic monument in 1980 and renovated in 1997 for cultural events in Thessaloniki. It now serves as a multi-purpose venue, housing the National Theatre of Northern Greece, a café-restaurant, and hosting outdoor performances. The area also features five old tobacco warehouses, remnants of the city's tobacco trade, with one converted into a luxury hotel and others housing educational and commercial spaces. Additionally, the Stavroupoli Botanical Garden spans 0.5 hectares, showcasing over 1000 plant species and providing recreational facilities. The Serbian monument is located in the Zeitenlik allied military cemetery."", 'The number 114 is repeated twice.', ""Eleftherias Square, located near the harbor, served as a parking lot and was the site where 50,000 Jewish residents were gathered by German forces in 1943. A Holocaust Memorial was erected in 1997 to commemorate this event. The square is surrounded by notable buildings, including the National Bank of Greece and the Ionian and Popular Bank, showcasing late neoclassicism and eclectic styles. Kalapothaki Street, starting from the Ladadika area, features pedestrianized sections with neoclassical and Bauhaus-style buildings, popular cafés, and the historic Stein Building. The port area is one of the largest in the southeastern Mediterranean, with a rich history dating back to Constantine the Great's time."", ""The Orphanos Church, built in the 1310s as part of Vlatadon Monastery, features exquisite 14th-century murals and is one of Thessaloniki's best-preserved monuments. The city walls of Thessaloniki were established shortly after its founding and underwent significant changes under Theodosius I in 390 AD. Over the centuries, the walls were reinforced during Venetian and Turkish rule, resulting in a total length of 7 km, with only 3 km remaining today. The walls are notable for their impressive height and width, contributing to their archaeological and cultural significance. For a comprehensive understanding of Byzantine art in the city, visitors are encouraged to explore the Museum of Byzantine Culture."", ""Greece, a parliamentary republic and EU member since 1981, has a population of approximately 10.8 million. Thessaloniki, the second-largest city, is located 510 km north of Athens and has over 1 million residents. The euro has been the national currency since 2001, and the international calling code is +30. Thessaloniki experiences a temperate Mediterranean climate with average temperatures ranging from 5°C in January to 24°C in August. Key national holidays include New Year's Day, Independence Day, and Easter celebrations, which involve various religious and cultural traditions. Other notable festivals include Carnival and Pentecost. For consulate information, contact local authorities in Thessaloniki."", ""The text describes several museums, including the room of Kemal Ataturk's mother, which exhibits his personal items and documents. The Folklife & Ethnological Museum of Macedonia-Thrace, founded in 1957, displays 20,000 objects from 1860 to 1960, including folk costumes and musical instruments. The State Museum of Contemporary Art, inaugurated in 1997, houses the Kostakis Collection of Russian Avant-Garde art, featuring works by notable artists like K. Malevich and V. Kandinsky. This museum also has a collection of contemporary Greek art and hosts temporary exhibitions."", 'The historic centre of Thessaloniki, particularly the Ladadika area, has transformed from a downgraded region post-WWII to a vibrant hotspot filled with restaurants, clubs, and live music venues since the 1990s. Key starting points for exploration include Morichovou square and Petrakaki square, where notable sights like the Ottoman Post Office Mansion can be found. Tsimiski Street, a major thoroughfare constructed after the 1917 fire, is now a bustling commercial hub featuring shops, offices, and popular cafés. Significant buildings include the Kazes Building, designed by Xenophon Paionidis in 1924, and the Agios Minas Church, which has historical roots dating back to early Christianity.', 'Thessaloniki has historically been a key stopover for East-West trade. Today, its town center offers a vibrant shopping experience with traditional marketplaces and modern commercial areas. Visitors can find a variety of goods, including food, clothing, and antiques, at reasonable prices. Notable shopping spots include Bit-Pazar for second-hand items and the Mediterranean Cosmos Mall, which features over 200 shops and entertainment options. Other popular areas include the Hirsch Building Mall and Plateia Mall. For budget-friendly shopping, Venizelou St., Egnatia St., and Agiou Dimitriou St. are recommended. The city also has modern shopping centers in Kalamaria and its suburbs.', ""The Historic Centre features a blend of modern and traditional Macedonian architecture, including notable sites such as the Acheiropoiitos church, built in 1818, and the Nedelkou Building from 1909, which now houses the Mount Athos Centre. The Galerius Arch, a significant landmark from 295-305 AD, commemorates Galerius' victory over the Persians and is a popular meeting spot. Nearby, the Rotunda and Panagia Dexia church, which contains a rare icon of the Virgin Mary, add to the area's historical richness."", ""The text describes various museums in Thessaloniki, including the archaeological museum that showcases excavated sites and the process of maintaining an archaeological museum. It highlights temporary exhibitions related to Byzantine heritage. The White Tower Exhibition presents Thessaloniki's history through multimedia and is organized into seven thematic categories across different floors. Additionally, the Jewish Museum of Thessaloniki promotes Sephardic legacy and features a research center, library, and audiovisual center. Its permanent exhibitions cover topics such as the Jewish necropolis and the history of the Jewish community in Thessaloniki up to World War II."", ""Thessaloniki is renowned for its vibrant nightlife, often considered Greece's entertainment capital. The city offers a variety of options including avant-garde bars, tavernas, ouzo restaurants, and modern cuisine spots. Popular nightlife areas include Ladadika, Kalapothaki Street, and the beachfront cafés. Students frequent Navarinou square, Rotonda, and Bit-Pazar, while Ano Poli features alternative tavernas and café-bars. Recently, Valaoritou Street has emerged as a nightlife hotspot, especially in summer. The Slaughterhouse area hosts large venues for live Greek music and the biggest clubs in the city."", ""The text describes various locations and landmarks in Thessaloniki, including the historic center, the White Tower area, and notable streets. The historic center is recognized for its proximity to the beach and is a residential area for the affluent, featuring shops, green spaces, and cultural institutions. The White Tower is highlighted as the city's most famous landmark, built in the late 15th century, and serves as a significant historical monument. It stands 33.90 meters high and has a diameter of 22.70 meters, originally surrounded by fortifications. The area around the White Tower is a central hub where major roads converge, offering views of the sea and a vibrant atmosphere with shops and cafés."", 'The International Book Fair in Thessaloniki is an annual event held in the HELEXPO-TIF exhibition center, attracting professionals and book lovers. It features presentations from Greek and foreign publishers, discussions with writers, and various themed corners for children and teenagers. The Society for Macedonian Studies is a key cultural institution in Thessaloniki, focusing on the preservation and promotion of Macedonian history and culture. The National Theatre of Northern Greece, established in 1961, is the largest cultural organization in northern Greece, hosting various performances across multiple venues. Thessaloniki also offers a range of indoor and outdoor theatre stages, providing diverse entertainment options throughout the year.', 'The text describes various historical and archaeological sites in the region, including the Praetorium, public toilets, and the Hydraulis sector known for its copper items. It highlights the Villa of Dionysus, famous for its mosaic of Dionysus. The Archaeological Museum showcases artifacts from the Dion area and nearby ancient sites. Mt. Olympus, the highest mountain in Greece, is noted for its biodiversity and as a popular destination for hiking. Ancient Pydna, once an administrative center under Macedon, faced decline after Roman conquest and was eventually deserted.', 'The Greek National Tourism Organisation promotes tourism in Greece through its website, www.visitgreece.gr.', 'The 6th walk in Thessaloniki highlights several must-see landmarks along NEA PARALIA and VASILISSIS OLGAS AVENUE. Key attractions include the Monument of Alexander the Great, a large equestrian statue near the White Tower, and the statue of politician Konstantinos Karamanlis. The Makedonia Palace Hotel, a luxury accommodation, is noted for its historical significance and frequent patronage by political figures. The Umbrellas sculpture by George Zongolopoulos, a prominent art piece, is also featured, along with the Agioi Kyrillos and Methodios Church, dedicated to the saints who spread Christianity to the Slavs.', 'Ano Poli, an area of 3,000 hectares, features a small remnant of an old oak forest and has undergone reforestation since the 1930s. It remains a popular destination for outdoor activities like hiking and mountain biking, despite urban expansion and a significant fire in 1997. Key attractions include the Zoo, which houses various Greek wildlife, the Forest Theatre for summer concerts, and the Theatre of the Earth, a notable cultural venue. Visitors can access these sites via bus no. 24 from Eleftherias square. The nearby Sykees area retains its charm with Interwar Period houses amidst modern development.', 'The area includes historical sites such as the former Turkish army barracks and the War Museum, designed by V. Poselli. It also features the Papafeio Orphanage, a classical style building completed in 1903, which served various purposes including a male boarding school and military barracks. Nearby, the YFANET textile factory was once a major textile unit in Macedonia and is now a venue for events and a library. Additionally, visitors can explore a rare Macedonian tomb from the 3rd century BC and the neoclassical Ippokrateio Hospital built in 1891.', 'The text describes various museums in Macedonia, including sections on antiquities from the 2nd to 4th centuries AD, prehistoric items, and temporary exhibitions. The Roman Forum Museum, inaugurated in 2010, showcases local excavations and historical artifacts from the Hellenistic period to the 4th century AD, including a bathhouse and ancient brothel. The Museum of Byzantine Culture is highlighted as one of the best in Greece, featuring 2,900 exhibits that include murals, mosaics, icons, and everyday tools, providing a comprehensive view of Byzantine culture.', 'The 7th walk in Stavroupoli highlights notable cultural venues like Mylos, a former flour mill turned multi-purpose venue, and FIX Brewery, founded in 1893 and now mostly deserted except for concert halls. The Terpsithea District features well-planned urban spaces, including the old military camp and Lebet mosque, which will be transformed into a park. The Jewish cemetery, established in 1938, contains remnants from a previous cemetery destroyed during WWII. A must-see is the Allied Military Cemetery, the largest in Greece, housing over 21,000 soldiers from World War I. Additionally, the Moni Lazariston, built in 1886 by Lazarist monks, is an impressive historical site.', ""The text describes various streets and locations in Thessaloniki, highlighting their historical significance and current status. Dimokratias Square is noted as a key entry point to the city, serving as a transportation hub with hotels, shops, and a statue of King Constantine. The surrounding area features mostly unremarkable buildings but also historic sites, including sections of the city's west walls and archaeological monuments. The Railway Station, located on Monastiriou Street, is mentioned as a significant structure that began construction in 1939 and became operational in 1951."", ""The historic centre features the White Tower, originally known as the Tower of the Janissaries, which served as a jail and now hosts exhibitions on Thessaloniki's history. Visitors can enjoy panoramic views from the top and relax in the surrounding square, which is a hotspot for boat bars. The Royal Theatre, built in 1940 and renovated in 1996, has a capacity of 800 and is part of the State Theatre of Northern Greece. Ethnikis Amynis Street connects the White Tower to Syntrivaniou Square and was established after the demolition of city walls in 1889. Previously named Hamidiye Boulevard, it is now home to various cultural institutions, including the Theatre of the Society for Macedonian Studies and popular cafés and bars nearby."", 'The text describes various historical sites in a town, including Main Street, which was lined with shops and public buildings. The Great Thermae was a large public bath complex featuring marble floors and areas for worship and entertainment. The Houses of Zosa and Lida were decorated with mosaics and sculptures. The Roman Forum, dating back to the late 2nd to early 3rd century, included luxury houses and a temple for emperor worship. A polygonal building served as a roofed marketplace, while remnants of Early Christian Walls were found nearby. An episcopal basilica was rebuilt in the 5th century after its destruction in the 4th century. The Praetorium functioned as an inn for officials and travelers, with access to the Main Street Thermae. Additionally, the text mentions a climbing route in Olympus National Park and the Petralona Museum, showcasing prehistoric human activity.', 'The Agora, a 4th century BC building complex, served as the administrative and cultural hub of the town, featuring a large court and various commercial shops. Excavations have revealed several temples, including those dedicated to the Mother of Gods and Aphrodite. The Palace, located on a northern hill, dates back to the 4th century BC and includes a peristyle and royal quarters. The Eastern cemetery contains rock-hewn cist graves from the Copper Age to Classical times. The Alexander the Great Bathhouse, a Hellenistic facility, is also notable. The Archaeological Museum showcases five thematic categories, including daily life, public life, religious practices, cemetery finds, and the architectural design of the palace, along with information about Alexander the Great.', ""The text describes various museums, including the Water Museum, which features restored buildings showcasing pumping machinery and historical archives. The Children's Museum, targeting ages 4-12, offers educational programs and is currently located in Thessaloniki's Cultural Centre after a fire destroyed its previous location. The Noesis Science Centre and Technology Museum includes exhibitions on Ancient Greek technology and interactive exhibits on electricity and magnetism."", ""The 5th walk in Ano Poli (Old Town) connects Agios Pavlos area and Agiou Dimitriou Street, offering views of the city's eastern walls. The Gardens of the Pasha, built in 1904, feature eccentric architecture and an art nouveau fountain. Agios Pavlos church, named after a fountain where Apostle Paul drank, is located nearby. Agios Dimitrios Hospital, built around 1902-3, showcases classicist and baroque styles and is a listed monument. Evangelistria Cemetery, established in 1875, is the city's oldest Christian cemetery, housing notable figures. Nearby are the Armenian and Protestant cemeteries and a historic foundry now used for cultural events."", ""The text describes several significant Byzantine monuments in the Ano Poli area, including the 14th-century Agia Aikaterini Church, known for its elaborate brickwork and murals depicting saints and Gospel scenes. It was converted into a mosque during Ottoman rule but restored between 1947 and 1951. The Profitis Ilias Church, dating from the late 13th to mid-14th century, is noted for its architectural features and murals of Christ's life. Additionally, the Byzantine Baths, a 13th-century domed structure, is the only surviving bathhouse from that era, which was open to the public until 1940."", 'The text describes various locations in Ano Poli, Thessaloniki, including the historical significance of the eastern walls and the neoclassical G. Gennimatas hospital. It mentions Kallitheas Square, a picturesque area with a playground, and major streets leading out of the city walls. Additionally, it references the Seich Sou forest, the largest forested area near the city.', '', 'The text describes various historical buildings along Vas. Olgas Avenue in Thessaloniki, including the Folklife and Ethnological Museum of Macedonia – Thrace, which was once a residence of banker Jacob Modiano. Other notable buildings include a former private residence that now serves as a nursery school, the Melissa Building which housed an orphanage and now hosts the Centre for Byzantine Research, and the School for the Blind, originally built as a private residence. The Jeborga Villa, once the Italian Consulate, is now deserted. The Yeni Mosque and Modiano Villa are also mentioned for their eclectic architectural features.', 'Chortiatis is a small suburb located on Mt. Chortiatis, known for its hiking trails and historical significance, including remnants of a Byzantine aqueduct. Thermi, situated 15 km southeast of Thessaloniki, retains a countryside feel and was historically significant as the harbor of ancient Thermi, famous for its hot springs. The central square of Thermi, Paramana Square, is noted for its futuristic design and serves as a hub for local businesses. An artificial lake nearby offers recreational opportunities and hosts the Dam Music Festival in summer, while the Environmental Park provides various sports facilities.', ""Aristotelous Square in Thessaloniki is one of Greece's largest and most vibrant squares, operational 24/7. It was part of the Hébrard Committee's urban plan post-1917 fire, fully realized by the early 1960s. The square offers stunning views of the Thermaic Gulf and Olympus massif, featuring monumental architecture that blends Byzantine and European interwar styles. Key landmarks include the Electra Palace hotel and Olympion, the latter hosting the Thessaloniki Film Festival. Aristotelous Street, a pedestrianized historic boulevard, connects to Egnatia Street."", 'The text describes various historical sites in Thessaloniki, including the Hippodrome, which was a center of social activity until 390 AD when a massacre led to its closure. It highlights the Thessaloniki History Centre and the 18th-century Agios Antonios church nearby. The Arched Hall, located at the intersection of Gounari and Svolou streets, was used for symposia and had access to the imperial box in the Hippodrome. Additionally, remnants of a theatre-stadium on Apellou Street date back to the 1st to 4th centuries AD and are linked to the martyrdom of Agios Dimitrios. The text also mentions three notable churches on Egnatia Street, including the Panagouda Church, built in 1818 on the site of an older church destroyed by fire. The area is rich in history and cultural significance, making it a must-visit for tourists.', 'The number 116 is repeated twice.', 'The map of Thessaloniki highlights various public agencies and services, including the G.N.T.O. Information Office, Ministry of Macedonia – Thrace, and the Police Department. It also features significant Roman monuments such as the Roman Forum and the Arch of Galerius, alongside Byzantine churches like Agia Sofia and Agios Dimitrios. Ottoman monuments are represented by the White Tower and various hamams. Additionally, the map includes 19th to 20th-century landmarks like Aristotelous Square and the YMCA of Thessaloniki.', ""The text describes several significant Byzantine monuments, including their architectural features and historical transformations. The first is a tetrastyle cross-in-square church that became a mosque, obscuring its original murals. The Panagia Chalkeon Church, built in 1128, showcases the 'School of Constantinople' architecture and was also converted into a mosque. Acheiropoietos Church, founded in the 5th century, features a three-aisled basilica and was the first church turned into a mosque after the Turkish conquest. Lastly, Agia Sofia Church, built in the mid-7th century, is a replica of the Hagia Sophia in Constantinople, highlighting its historical significance."", 'The historic center of Thessaloniki features a shopping mall that was reshaped between 1995-1997, retaining its original exterior while now housing shops, cinemas, cafés, and restaurants around a central atrium. Notable buildings from the early 20th century are located at the junction of Tsimiski and Karolou Dil Streets, currently serving as shops and offices. The traditional market area, west of Aristotelous Street and south of Egnatia Street, is filled with small shops, malls, and arcades dating back to the Turkish Occupation, offering a variety of products including food, spices, and fabrics. Modiano Market, built in 1922, is a prominent glass-roofed structure with 140 food shops and popular restaurants. The Vlali-Kapani and Athonos-Vatikioti Markets, designed by Ernest Hébrard, feature two-storeyed malls with archways and are connected to Aristotelous Street.', 'The text describes notable buildings in the historic center of Thessaloniki, including the YMCA Building, which features a mix of neo-colonial and Byzantine architecture and houses various sports and cultural facilities. The Archaeological Museum, designed by P. Karantinos and inaugurated in 1962, showcases modernist architectural design and includes spaces for exhibitions and events. The Museum of Byzantine Culture, built between 1989 and 1993, combines modernism with Greek tradition and is recognized as a historic monument. It contains an amphitheater, a café-restaurant, and exhibition spaces, alongside the new Town Hall and a park.', 'Ano Poli, or Old Town, was established to house early 20th-century refugees, with historical settlements dating back to the 2nd century AD. The area features the Municipal Grove with a theatre for summer cultural events and an open-air cinema. A prominent church, Agioi Theodoroi, built on a 7th-century Byzantine site, offers stunning city views. Nearby, Elpidos Street has refugee houses being transformed into a Cultural Neighbourhood. Access to Sykees is available by walking from Ano Poli or taking bus no. 23 to Agios Charalampos stop.', 'The text describes various day excursions near Ancient Pella, including Aravissou springs, Platanopotamos Lake, and Dytiko plane-tree forest. It provides directions to Ancient Pella from Thessaloniki and mentions the military Museum of Balkan Wars. Additionally, it highlights the historical significance of Vergina (Aiges), the former capital of Macedon, detailing its importance from the 10th-8th century BC until its destruction by the Romans in 168 BC. The archaeological site is recognized as a UNESCO World Heritage Site, featuring the Royal Tombs discovered by archaeologist Manolis Andronikos in 1977.', 'The text describes a walking tour along Vasilissis Olgas Avenue, highlighting historical buildings and residences. Notable sites include the Hirsch villa, a former police department, and the Chatzilazarou Residence, built in 1890. The Marokou Residence, previously a boarding school, now houses a Traffic Police Department. The Mehmet Kapanci Villa, constructed in 1893, served various significant roles, including housing military leaders and high schools, and is now part of the Thessaloniki Cultural Centre. The Ahmet Kapanci Villa, built in 1905, features eclectic architectural styles and has housed various organizations over the years, including the Red Cross and NATO services.', ""The Historic Centre features Plateia Dikastirion, a green square where the Court House was planned but halted due to the discovery of the Ancient Roman Forum. The square has a bust of Eleftherios Venizelos, a significant Greek prime minister. Nearby, the Bey Hamami, built in 1444, is the largest Ottoman bathhouse in Greece, known as the Paradise Baths until 1968. The Roman Forum, a 2-hectare area, served as the city's social and religious center during the Roman period, with construction completed in the mid-2nd to mid-3rd centuries AD. The site includes a large square with traces of marble paving and a double underground Cryptoporticus, likely used as a public storehouse, featuring an early Christian mural."", ""The text describes various historical and architectural landmarks in Thessaloniki, including the West of the Centre-Stavroupoli inaugurated in 1962, which connects the city to Greece and the Balkans. The Old Railway Station, built in 1894, is now a cargo station and was historically significant during the German occupation. The Top Hane (Vardariou Tower), constructed by the Ottomans in 1546, served as a city stronghold and remains well-preserved. The De La Salle Complex, built in 1926, now houses the city's Administrative Courts, while the Vienni Hotel, established in 1925, reflects the eclectic architectural trends of its time and currently contains private offices."", 'Noesis is a unique science center and technology museum in Greece, completed in 2004, featuring exhibitions, a digital library, and an amphitheater. It can be accessed via public transport or car from Thessaloniki. The seaside areas of Peraia, Neoi Epivates, and Agia Triada, located 20 km from the city center, were settled by refugees in 1923 and have since developed into popular suburbs and resorts with Blue Flag beaches and various amenities. Buses connect these areas to the city, providing easy access for visitors.', 'The text describes various attractions in Thessaloniki, including the historic center, shopping streets, and museums. It highlights the eclectic-style building housing the local Greek Scouts and the upscale shopping areas with boutiques and art galleries. The Museum for the Macedonian Struggle, a neo-classical building, is noted for its historical significance and previous functions. Nearby, the metropolitan church of Agios Gregorios Palamas showcases Byzantine architecture, and the Ecclesiastical Museum offers a collection related to the church.', ""Dion, located 87 km SW of Thessaloniki, features a significant neolithic settlement, early-Christian basilicas, and a 10th-century basilica with impressive mosaics. Visitors can reach Dion via national roads or local buses from Katerini. The Petralona Cave, discovered in 1959, is notable for its prehistoric findings, including a 200,000-400,000-year-old skull, making it one of Europe's oldest archaeological sites. The cave showcases various prehistoric items and is partially open to visitors. Halkidiki, known for its beautiful beaches and rich history, is a popular tourist destination south of Thessaloniki, featuring three peninsulas: Kassandra, Sithonia, and Athos."", 'The museum features a collection of over 2,500 corkscrews from the 16th to 20th centuries, categorized by mechanical and non-mechanical types, as well as by gender usage. It includes explanatory texts and photographs. Additionally, touch screens display a glossary of viticulture and wine-making terms. Room B showcases the historical significance of wine through tools and vessels, along with scenes from films and photos related to wine production and consumption.', ""The text describes significant Byzantine monuments in Thessaloniki, including the UNESCO-listed church that was once a cathedral and later converted into a mosque, showcasing impressive mosaics and murals. It also highlights the Transfiguration of the Saviour Church, a typical example of Byzantine architecture from around 1340, adorned with depictions of Christ's Ascension. Additionally, the Rotunda, built in 306 AD, is noted for its massive dome and preserved mosaics, which were later converted into a mosque. The surrounding area includes the small church of Agios Georgios, further enriching the historical context of these monuments."", ""Thessaloniki, founded in the 4th century BC, has maintained its urban character as a civic center influenced by various empires and multicultural groups. Its rich history includes Roman, Byzantine, and Ottoman rule, with contributions from Jews, Latins, Armenians, and Greeks. The city's numerous historical monuments reflect its cosmopolitan nature. The White Tower area is a bustling part of Thessaloniki, where the old seafront meets the new waterfront."", 'The text describes various historical and cultural sites in Thessaloniki, including the impressive complex of 14 listed industrial buildings from 1854, originally owned by the French and later by the Allatini family. It mentions the Vafopouleio Cultural Centre, inaugurated in 1983, which hosts art exhibitions, performances, and has three libraries. The Ouziel quarter features picturesque semi-detached houses built for tramway workers, now a protected architectural monument. Sofouli Street connects eastern districts with Kalamaria, lined with trees, shops, and offering views of the city. Vasilissis Olgas Avenue, once a favorite promenade, is noted for its green surroundings along the waterfront.', ""Thessaloniki offers various outdoor activities such as hiking and mountain biking in the suburban forests of Seich Sou and Chortiatis, as well as relaxing by the Deltas of Gallikos and Axios-Loudias-Aliakmonas rivers. Educational programs for children are available in most museums, particularly at the unique Children's Museum. The Noesis Science Centre and Technology Museum provides fun and educational experiences related to science and technology. Visitors can also explore the Environmental Dinosaur Theme Park and the Mammoth Museum. For beach lovers, there are beautiful seaside options in Thessaloniki and Halkidiki. Families can enjoy the Magic Park, Greece's largest amusement park, and WaterLand, which features various water attractions."", 'The text describes various historical and cultural sites in a city, focusing on Agia Sofia Square, which features greenery and is shaped by the 1890 fire. It highlights the pedestrianized Agias Sofias Street, notable buildings like the Longos Building and Chatzidimitriou Building, and the monument commemorating the Genocide of Pontic Greeks. Navarinou Square is presented as a vibrant student area with cafés, bars, and cultural venues, along with a fountain and playground. The area also includes shops selling books, records, and antiques, and encourages visits to the nearby church of Nea Panagia, dating back to 1727.', 'The text describes day excursions from Thessaloniki, highlighting the monastic state of Mount Athos, which features 20 inhabited monasteries and is a UNESCO World Heritage site. It provides directions to Petralona Cave, located 53 km southeast of Thessaloniki, accessible by coach and taxi or by car. Additionally, it mentions the Lakes Area northeast of Thessaloniki, a National Park with diverse ecosystems ideal for outdoor activities. The area is managed by an agency that offers tours, and visitors are encouraged to try local fish dishes. Lastly, it notes the town of Lagadas, known for its fire-walking custom and modern spa facilities with historical Byzantine bathtubs.', 'The text describes two museums: Noesis and Gerovassiliou Wine Museum. Noesis focuses on interactive learning with exhibits like a car exhibition, a planetarium, a cosmotheatre, and a virtual reality simulator. It also offers educational programs on renewable energy and science. The Gerovassiliou Wine Museum, established in 2008, showcases the history of wine-making and features collections that illustrate the journey of wine, food pairings, and wine-making equipment. Both museums emphasize visitor engagement and education.', 'Thessaloniki offers various tourism services including an Info Point at Aristotelous Square, open Mon-Fri from 9 am to 5 pm. The Thessaloniki Tourism Organisation provides information and assistance, reachable at 2310 279.282 or via email at welcome@thessaloniki.travel. The Tourist Police, available at 1571, assists tourists with information and minor disputes. The city has over 130 hotels with a capacity of approximately 13,000 beds, and inquiries can be made through the Thessaloniki Hotels Association. For conferences, the Thessaloniki Convention Bureau can be contacted for well-equipped venues. Organized excursions can be arranged through local travel agencies, and car rental services are available through the Car Rental Agencies Association. Yacht charters can be organized via the Hellenic Yacht Brokers Association.', 'The text describes the historical and cultural significance of suburbs and outskirts of Thessaloniki, including ancient tombs and a Neolithic settlement. It provides directions to Kalochori via bus or car. Kalamaria, a prominent suburb, features green spaces and a shopping center, with a history of Greek refugees settling there in the 1920s. Key sites include Sofouli Street, the Little Palace (formerly a royal residence), and the Kodra former military camp, which is being transformed into a park. Excavations in Kodra revealed an ancient settlement, possibly linked to Ancient Thermi.', ""The Museum of Greek Children’s Art showcases the creativity of children, depicting Greek history, tradition, and culture through their artwork. It is one of the few museums worldwide dedicated to children's art."", ""Egnatia Street is a historic avenue in Thessaloniki, dating back to Roman times, connecting Dyrrhachium and Constantinople. It runs from Dimokratia Square to the TIF grounds and the Aristotle University, serving as a bustling shopping area with notable eclectic and art deco buildings. Key attractions include Kolomvou Square, a lively hub with cafés and bars, and the Hamza Bey Mosque, built in 1467, which is currently undergoing renovations for an exhibition. The street splits the city's historic center and features important monuments worth observing."", ""The text describes various cultural and historical sites in Thessaloniki, including a small museum dedicated to the founder of modern Turkey, the Teloglion Foundation of Art with its modern facilities, and the Kaftanzogleio Stadium, which was the largest in Greece until 1982 and is home to the city's oldest football team, Iraklis. The stadium also hosted events during the 2004 Athens Olympic Games and is near the Olympic Museum."", 'The area along NEA PARALIA features 12 Theme Gardens covering 76,657 m2, ideal for leisure activities. Notable gardens include the Garden of Alexander, Garden of the Seasons with an amphitheater, and the Garden of Music for events. A 3 km cycle path is available, along with the Nautical Club of Thessaloniki. The Thessaloniki Concert Hall, inaugurated in 2000, is inspired by Byzantine architecture and hosts various performances and conferences. It includes a main hall for 1464 attendees and a neighboring building with additional facilities. The Depot Area, named after historic tram depot buildings, retains traces of its older atmosphere. The Allatini Mills and the church of Saints Cyril and Methodius are also significant sites in the area.', ""The Historic Centre features archaeological sites from the late Roman period, including shops from the 1st to 13th century and the underground Museum of the Roman Forum. A restored Odeon from the 2nd-4th century AD is now used for cultural events, alongside a mint and archive office. A round bathhouse dating back to the 1st century BC was also discovered, along with various artifacts like mosaics, sculptures, and coins. The forum is notable for the 'Enchanted Ones,' a two-storeyed colonnaded archway with surviving Corinthian columns, which were relocated to the Louvre in 1864. Bit-Pazar, a vibrant market area with antique shops and restaurants, was built in the 1930s and has become popular among students. Nearby, the Jewish Monastirioton Synagogue is the only one to survive World War II. The Experimental School, designed by architect D. Pikionis, was constructed from 1936 to 1938."", ""The phrase 'Follow Greece Everywhere' suggests a strong interest or commitment to exploring and engaging with Greek culture, history, and lifestyle in various contexts."", ""Thessaloniki has a rich history marked by the settlement of various communities, particularly from the Iberian Peninsula, and a period of harmony among ethnic groups from the 16th to 18th centuries. The city evolved into a significant trade center by the 18th century and became more cosmopolitan with railway connections established in the late 19th century. Major events include a devastating fire in 1890, the Greek army's seizure of the city in 1912 after five centuries of Ottoman rule, and a significant fire in 1917 that led to extensive rebuilding. The city faced challenges during the Asia Minor Catastrophe in 1922-1923, receiving many Greek refugees. The German occupation in 1943 resulted in the tragic loss of a large portion of the Jewish population. Thessaloniki experienced a severe earthquake in 1978, and later, in 1997 and 2014, it was recognized as the European Capital of Culture and the European Youth Capital, respectively."", 'The Macedonian Museum of Contemporary Art features a permanent collection of 1,800 works by notable Greek and foreign artists and has hosted over 100 exhibitions. The museum also has a library with over 2,500 specialized titles. The Teloglion Foundation of Art, established in 1972, houses a significant collection including Hellenistic statuettes and works by renowned 19th and 20th-century artists, along with hosting temporary exhibitions and educational programs. The Municipal Gallery displays over 1,000 artworks, focusing on Thessalonian artists from 1898 to 1967, and is part of the cultural offerings in Thessaloniki, which also includes the Society for Macedonian Studies and the Thessaloniki Cinema Museum.', 'The text describes various historical sites, including the Sanctuary of Isis, which is half-sunk in water and dedicated to the Egyptian goddess. It also mentions the Sanctuary of Olympian Zeus, completed in the Hellenistic period, featuring a large altar and Roman theatre. The Hellenistic Theatre, built in the 3rd century BC, hosts modern events today. The Sanctuary of Asklipios, active until the 3rd century AD, is noted for a statue of the goddess Hygeia. Additionally, the Cemetery Basilica from the 5th century is described, along with fortified walls originally constructed by Cassander, which have been reconstructed over time.', 'The historic centre features a museum with exhibits of ancient human skulls, including those from the Axios river and Petralona Cave. Notable sites include the Observatory, built in 1954, and Agiou Dimitriou Street, one of the oldest roads in the city, surrounded by Interwar Period architecture. The area has seen an influx of Eastern European emigrants who have opened shops and restaurants, adding diversity. Key attractions include the Dioikitirio, a neoclassical building from 1891 that now houses the Ministry of Macedonia-Thrace, and the Agios Dimitrios church.', 'The text describes several historical sites in the historic center, including Yeni Hamam, built in 1531, which served as a bathing place until 1944-45. Alaca Imaret, constructed in 1484, features skilled masonry and is occasionally used for cultural events. The Profitis Ilias Church and Panagia Lagoudiani Church, a 14th-century Byzantine basilica, are also mentioned, with the latter honoring the Virgin Mary and Saint Demetrius. Additionally, the Ataturk Museum, located in the former residence of Kemal Ataturk, showcases his life and includes a café. Lastly, Kaftanzogleio Stadium is noted as the largest stadium in the city.', 'Epanomi is a picturesque town 25 km SE of Thessaloniki, known for its beautiful beaches and a wetland that hosts over 80 bird species. The Gerovassiliou Wine Museum, unique in northern Greece, is located nearby. Nea Michaniona, a major fishing center 32 km S of Thessaloniki, features the largest fleet of deep-sea fish boats in Greece and a vibrant seafront with cafés and tavernas. Angelochori, a small village near Nea Michaniona, offers stunning views of the Olympus massif and historical Ottoman architecture. The area is also recognized for its high-quality beaches, such as Tourbani and Angelochori, which have received Blue Flag awards.', 'This text provides essential information for visitors to Thessaloniki, Greece, including contact details for the Greek National Tourism Organisation (GNTO) and the Ministry of Foreign Affairs. It lists various Greek acronyms relevant to tourists, such as E.O.T. for the GNTO and K.T.E.L. for intercity bus services. The text mentions the use of 220V electric current in Greece and highlights free wireless internet access in public areas. It also details the operating hours and locations of post offices in the city. Emergency phone numbers for police, fire brigade, and medical services are provided, along with contact information for tourist information services.', ""Thessaloniki boasts a rich culinary tradition influenced by Byzantine, Ottoman, and various European cuisines, shaped by its multicultural history. The city's gastronomy features traditional tavernas and restaurants that creatively blend local dishes with gourmet elements. Notable delicacies include gyro, souvlaki, patsa, and a variety of seafood dishes. Desserts play a significant role, with popular items like bougatsa, galaktompoureko, and syrupy pastries originating from Istanbul. Koulouri Thessalonikis, a sesame-covered bread, is a common snack sold by street vendors. In winter, locals enjoy salep, a unique hot beverage."", 'Thessaloniki is a city in Greece known for its rich history, vibrant culture, and significant role in the Byzantine Empire. It is the second-largest city in Greece and features a mix of ancient and modern architecture, including Roman ruins and Ottoman-era structures. The city is also famous for its festivals, culinary scene, and lively waterfront.', 'The text mentions Thessaloniki and its neighboring areas, but does not provide further details or context.', 'Thessaloniki offers various sports facilities, including an 18-hole golf course at Porto Carras Grand Resort and proximity to several ski centers. Notable ski centers include Seli, Elatochori, 3-5 Pigadia, Lailias, Vora, and Falakro, each with different elevations, runs, and amenities. Information for each ski center, including contact details and websites, is provided. Additional resources for tourists include websites for the Municipality of Thessaloniki, archaeological sites, and weather forecasts.', ""The Thessaloniki State Symphony Orchestra, established in 1959, is one of Greece's premier orchestras, performing at the Thessaloniki Concert Hall. The city also offers summer open-air cinemas where films are screened with Greek subtitles. Thessaloniki has a rich sports tradition, hosting major events like the 2004 Olympic Games and various international competitions. Numerous sports facilities are available, including the Kaftanzogleio National Stadium and Poseidonio Sports Centre. The Megas Alexandros International Marathon occurs annually, starting in Ancient Pella and finishing in Thessaloniki. Information on local sports facilities and events can be obtained from the municipality's departments."", 'The text provides a comprehensive overview of Thessaloniki, detailing various church denominations, museums, cultural exhibitions, sports facilities, public transport options, and traditional markets. It lists notable churches such as the Orthodox Metropolitan Church and the Armenian Orthodox Church, alongside museums like the Archaeological Museum of Thessaloniki and the Jewish Museum. Cultural venues include the Thessaloniki International Trade Fair and several theaters. Sports facilities mentioned include the Alexandreio Sports Arena and various football grounds. Public transport options include a long-distance bus station and a new railway station, while traditional markets like Kapani and Modiano are also highlighted.', ""This publication by the Greek National Tourism Organisation, supervised by Angela Varela and coordinated by Eleni Mitraki, features contributions from various professionals including journalist Yannis Ragos and translator Angeliki Christopoulou. It includes photo credits from multiple photographers and is designed by Zoe Tzomentzidou. The publication is not for sale and is available through the Greek National Tourism Organisation's website."", 'Asprovalta and Nea Vrasna beaches offer marine sports and beach volleyball facilities, with Asprovalta beach being 10 km long and awarded a Blue Flag. Stavros is the largest harbor in the area, while the villages of Vrasna and Ano Stavros feature traditional architecture. To reach these locations from Thessaloniki, take bus lines 83, 83M, or 83N to Lagkadas, or travel by coach or car towards Panorama and Kavala. Pikrolimni, located in the Kilkis region, is a shallow lake known for its healing mud with properties three times more concentrated than the Dead Sea. The first Mud-therapy Centre in the Balkans is in nearby Xylokeratia, offering various wellness facilities. Visitors can enjoy mud therapy by the lake in summer, and the center includes a physiotherapy clinic, hotel, restaurant, and sports fields. Pikrolimni is accessible by car or a daily bus from Thessaloniki.', 'The Palace of Galerius is an open-air archaeological museum in the historic center, constructed in the late 3rd to early 4th century. It is part of the Galerian Complex, which included significant structures like the Hippodrome and Rotunda. The palace served as a residence for emperors until its destruction in the 7th century and is a major monument of Late Antiquity. Key features include the Octagon, an audience hall with elaborate decoration; a colonnaded yard; a two-storeyed tank for water collection; a monumental Basilica used for official gatherings; and a bathhouse with various bathing facilities.', ""Eptapyrgio, built in the 12th century on an older fortress, features ten towers and remnants of Early Christian walls. The structure underwent modifications by the Ottoman Turks in 1431 and later became a prison in 1890. In 1989, it was transformed into a monument for visitors. Nearby, Palaeologina's Gate, constructed in 1355, leads to Trigoniou Tower, built in the 16th century. This area, known for its breathtaking views, is a popular spot for both locals and tourists."", ""Thessaloniki's Old Town, untouched by the 1917 fire, features a mix of Macedonian and Ottoman architecture. It became populated in the mid-15th century when the Ottomans settled there due to its favorable climate and strategic location. The area retains its original town planning with narrow alleys and squares, attracting artists and students in recent years. Architectural styles include neoclassical and eclectic motifs, particularly in residences of the Dönmeh. Despite modern developments, the Old Town has preserved much of its historical character."", 'The 6th walk along NEA PARALIA – VASILISSIS OLGAS AVENUE showcases a busy street with impressive late 19th to early 20th-century buildings. Notable sites include Allatini Villa, built in 1898, which served various purposes over the years, including housing the University of Thessaloniki and a military hospital. Casa Bianca, constructed in 1912, features eclectic and art nouveau elements and now hosts a branch of the Municipal Art Gallery. The Nehama Villa, built in 1907, is another significant structure on the avenue. Lastly, the Mordoch Villa, established in 1905, has a rich history, including use as military barracks and a polyclinic, and currently houses the Municipal Art Gallery.', ""The Historic Centre, built in 1866 by Sultan Hamid, was originally outside the east walls and restored in 1977 after modifications during the Interwar Period. Aristotle University of Thessaloniki (AUTH) is Greece's first university campus, established on the site of an old Jewish cemetery, with construction starting in 1938 and resuming in the 1950s. The campus features modern architecture by prominent Greek architects and accommodates over 100,000 students, making it the largest in Greece. Notable sites include the Old Building of the Faculty of Philosophy, constructed in 1887, and various museums showcasing ancient sculptures and Byzantine art."", ""The Yeni Camii, built in 1902 by architect V. Poselli, served as a mosque for converted Jews and later housed the city's Archaeological Museum. It now functions as a municipal exhibition area with a collection of Roman and Early Christian sculptures. The Hatzimisef Villa, located on Vas. Olgas Ave., was the town's first high school, while the Joseph Modiano villa nearby is currently uninhabited. A bust of King George I, assassinated in 1913, stands at the corner of Vas. Olgas Ave. and Agias Triadas St., crafted by K. Dimitriadis in 1915. The Ivan Hatzimisef Villa, built in 1897, now hosts cultural events and an organic food market. Additionally, the building at 34-36 Evzonon Street features classical, baroque, and renaissance architectural styles."", ""Lake Koroneia, also known as Lake Agios Vasileios, has significantly decreased in size and depth due to climate conditions and water resource exploitation. Nea Apollonia, a historic village near Lake Volvi, features mineral springs with therapeutic properties and modern health facilities. Lake Volvi is Greece's second-largest natural lake and a Ramsar site, offering birdwatching and various water sports. The area around Volvi includes tourist attractions and communities like Megali Volvi, Mikri Volvi, and Rentina, which is known for its natural beauty and historical ruins."", ""The text describes various historical and cultural sites in Thessaloniki, including the Greek Highschool built in 1893 and the Transfiguration of Christ Church, established in 1840 on the site of a 1543 chapel. The church features an icon screen depicting the Annunciation, with elements dating back to 1843 and 1943. It also mentions the Thessaloniki International Fair (TIF), inaugurated in 1926 and relocated in 1940, which has modern convention centers designed by notable Greek architects. Additionally, the Macedonian Museum of Contemporary Art, established in 1979, is highlighted as Greece's first modern art museum, showcasing modern sculptures and ancient artifacts."", ""The historic centre of Thessaloniki features industrial architecture from the late 19th century, including six warehouses built in 1910, which were revamped in 1997 for cultural events. These warehouses now house various institutions such as the International Film Festival, the Thessaloniki Cinema Museum, and the Centre of Contemporary Art. The Customs House, built in 1910, serves as the city's passenger board station and showcases early 20th-century French architectural influence. The Ladadika area, spared from the 1917 fire, dates back to the 16th century and was known for its wholesale trade, particularly spices and olive oil. The street layout remains largely unchanged since the late 19th century, with many buildings constructed from industrial brick and wood."", ""The Military Museum of the Balkan Wars, located in Gefyra village near Thessaloniki, showcases the area's history with rare relics and authentic furniture from the time of the Greek army's headquarters in 1912. Giannitsa, a modern town with a population of 35,000, features significant Ottoman monuments, including the mausoleum of Gazi Evrenos and the 14th-century hamam. The town is known for its cultural heritage and outdoor activities in nearby green areas. Notable sites include the clock tower and various mosques, reflecting the rich history of the region."", 'Thessaloniki offers a vibrant nightlife with clubs and venues, especially in the summer when many move to open-air locations. Popular areas include Kalamaria and Peraia. The city hosts numerous artistic events year-round, featuring venues like the Thessaloniki Concert Hall and various theaters. Cultural activities include the International Film Festival and the Thessaloniki Book Fair. The Thessaloniki Regency Casino operates 24/7, requiring guests to be 25 or older. Additionally, traditional products like koulouri and trigona Panoramatos are notable in the region.', 'The exhibition showcases Byzantine life, art, and culture from the early to post-Byzantine periods, organized by thematic categories. It includes sections on the Early Christian period, Middle Byzantine period, Late Byzantine period, and Post Byzantine period, each with specific rooms dedicated to various aspects of life and culture. The exhibition also features private collections, including the D. Papastratos Collection with religious art and the D. Oikonomopoulos Collection with a diverse range of artworks. The Jewish Museum of Thessaloniki is mentioned, highlighting its permanent exhibits related to Jewish history.', ""The Archaeological Museum of Thessaloniki displays significant art and artifacts from Macedonia, spanning from prehistoric times to late antiquity. The exhibits are categorized into six sections, including the origins of towns, the evolution of Macedonia from the 7th century BC to late antiquity, and the historical significance of Thessaloniki. Notable displays include exceptional gold craftsmanship from cemeteries, a reconstruction of an archaic temple, and unique items like the Derveni papyrus. The museum highlights the region's rich cultural heritage and its transition through various historical periods."", ""Thessaloniki hosts several cultural institutions, including museums and galleries showcasing Greek art. The collection features works by prominent Greek artists, Byzantine icons spanning five centuries, and Greek engravings. The Gallery of the Society for Macedonian Studies is the city's first visual arts museum, displaying 300 pieces from major 20th-century art movements. The Cultural Centre of Thessaloniki organizes exhibitions in collaboration with local agencies, featuring around 250 pieces of various art forms. The Thessaloniki Cinema Museum, established in 1997, highlights the history of Greek cinema through exhibits categorized into six timelines."", ""The text describes various historical and cultural sites in Thessaloniki, including the Holy Twelve Apostles Church and the remnants of the city's west walls, particularly the Litaia Gate. It highlights the Pasha Hamam, an Ottoman bathhouse built in the 1520s, which was the last of its kind in the area until its closure in 1981. The west of the harbour area saw significant growth in the late 19th century due to the demolition of city walls and the development of industrial units, which have since been transformed into cultural and entertainment venues. Notable sites include the Vilka multi-purpose venue, formerly a textile factory, and the Mylos venue, popular for events. The Moni Lazariston complex houses the State Museum of Contemporary Art, showcasing the area's cultural evolution."", 'The text provides contact information and websites for various museums and cultural institutions in Thessaloniki, including the Thessaloniki Cinema Museum, Museum of Photography, Olympic Museum, and more. It lists their addresses, telephone numbers, and websites, facilitating access to cultural resources. Additionally, it mentions a collaboration among five museums in Thessaloniki aimed at promoting cultural activities and organizing exhibitions. This collaboration includes the Archaeological Museum, Museum of Byzantine Culture, State Museum of Contemporary Art, Macedonian Museum of Modern Art, and the Teloglion Foundation of Art.', 'The text describes various historical and architectural sites in Thessaloniki, including the Jewish Museum housed in a 1904 building, Venizelou Street known for its eclectic and art deco styles, and the Pazar (Yahudi) Hamami, a 16th-century bathhouse. It highlights the architectural significance of the Gategno-Florentin Building and the Chamber of Commerce & Industry, showcasing neoclassical design. The area is also noted for its vibrant marketplace, including an open-air flower market known as Louloudadika.', 'The text describes two significant Byzantine monuments in the city. The first is the Moni Latomou, an early cross-in-square domed church from the 5th or 6th century, notable for its ceiling mosaics depicting the Vision of Ezekiel and a minaret entrance from its later conversion to a mosque. The second is Moni Vlatadon, the only active Byzantine monastery in the city, founded in the 14th century, featuring a unique church structure and significant murals from the 14th and 17th centuries. It also has a large garden with views of the city and additional facilities like a library and a bookstore.', 'Thessaloniki is a city in Greece known for its rich history, vibrant culture, and significant role in the Byzantine Empire.', 'The text describes the historical development of the area known as Nea Paralia in Thessaloniki, which began to grow in the late 19th century after the demolition of city walls and the introduction of tramways. Initially named Exoches due to its rural character, it became a luxury residential area with diverse nationalities coexisting. However, from the 1930s, the area declined and transformed into a typical urban setting by the 1960s. Today, Nea Paralia stretches along Megalou Alexandrou Avenue and is popular for leisure activities, offering scenic views of the Thermaic Gulf and Mount Olympus, especially at sunset. Notable landmarks include the statue of Alexander the Great and the artistic installation of umbrellas by N. Zongolopoulos.', ""Thessaloniki, an early center of Christianity, was significant during the Byzantine period, housing numerous Christian monuments and churches. These structures, built between the 4th and 15th centuries, have been recognized as UNESCO World Heritage Monuments since 1988. The Holy Twelve Apostles Church, one of the oldest, was constructed between 1310 and 1314 and served as the main church of a monastery. The church features murals and iconography depicting the life of the Holy Virgin. A tour of Thessaloniki's Byzantine monuments offers a unique experience, showcasing the city's rich historical and cultural heritage."", 'The text describes various notable locations in Ano Poli, Thessaloniki. Tsitsani Square features a bust of composer V. Tsitsanis and is surrounded by well-tended houses. Eptapyrgiou Street runs along the northern city walls, showcasing traditional buildings and the old Zihne Camii mosque. Moni Vlatadon is mentioned as a point of interest. Portara is one of the main gates of the northern city walls, adorned with ceramics and inscriptions. The Acropolis, specifically Eptapyrgio (Yedi Kule), is highlighted as a significant fortified area within the city walls. The area is popular among both residents and tourists.', 'The text provides information about various churches in Thessaloniki, including their addresses and contact numbers. It also highlights cultural events such as Demetria, an autumn festival featuring theatrical and musical performances, and the Thessaloniki International Film Festival, which has been held since 1960 and showcases films from various sections. Additionally, it mentions the Thessaloniki International Fair (T.I.F.), a significant trade fair in the Balkans that has been taking place since 1926, presenting Greek industry and entrepreneurship. Contact information for cultural offices and event organizations is also included.', ""Thessaloniki was founded in 315 BC by Cassander, named after his wife, and became a significant city under Roman control by 168 BC. It served as the capital of the Roman province of Macedonia by 148 BC and was connected to the wider world through the Via Egnatia around 130 BC. The city was declared a 'free town' in 42 BC and hosted Apostle Paul's visits. In the late 3rd to early 4th century AD, it became the seat of the eastern Roman Empire under Galerius. The city faced various raids but was protected by its walls. It experienced a golden age from 1300 to 1430, marked by cultural and economic growth. Thessaloniki changed hands multiple times, falling to the Venetians in 1423 and the Ottoman Turks in 1430, while also having a significant Jewish population in the 15th century.""]"," Based on the provided context information, historical cultural significance landmarks areas in Historic Centre Thessaloniki are known for their traditional restaurants and notable sites such as Bezesteni and Stoa Saul. Bezesteni is a rectangular building with four entrances and six lead-covered domes, and is considered a textile market and a market of precious stones. Stoa Saul is an archway with Corinthian-order columns and pillars, and is decorated with figures in relief. Both of these sites are considered to be of great historical and cultural significance, and are still preserved today. The Historic Centre Thessaloniki is also home to many other notable sites, including the White Tower, the Museum of the Roman Forum, and the Thessaloniki Club. These sites are often mentioned in the context of the city's rich history and cultural heritage, and are considered to be important for preserving the city's heritage. Modern developments in the city have not seemed to detract from the historical cultural significance of these sites, and many of them continue to be used for their original purposes. Overall, the preservation of these sites is seen as important for maintaining Thessaloniki's cultural identity and heritage. 

Note: The query was written in a way that was not easy to understand, and it was necessary","The historical cultural significance of landmarks in the Historic Centre of Thessaloniki, such as Bezesteni and Stoa Saul, contrasts with traditional restaurants and notable sites, impacting modern developments and the preservation of heritage.",1.0,0.4,0.8235294117647058,0.8545504452425349,0.9704861110989801,0.968253968240136,0.0,0.3333333322222222,,0.744950393961792
16,How do museums in Thessaloniki compare?,"['AG. SOFIAS\nMFEI\nSQ.\nSYNTRIVANIOU\nSQ.\nNAVARINOU\nSQ.\nSQ.\nLYSSIATREIO\nTHEA\nCANC\nGENERAL\nHOSPITAL\nOF THESSALONIKI\nG. GENNIMATAS\nUNIVERSITY\nGENERAL\nHOSPITAL\nOF THESSALONIKI\nAHEPA\n   INFECTIOUS\n  DISEASES\nHOSPITAL\n3rd walk: \nHISTORIC CENTRE (2)\nMUSEUM AREA\nThe area is considered  \nas one of the most privileged \nplaces downtown on account \nof its proximity to the beach;  \nit is traditionally regarded as \nthe residential area of the \nwell-to-do. There are many \nwell-known shops here, green \nspots, as well as some of the \nmost important museums  \nand cultural institutions.\n1 \t\x07\nTHE WHITE TOWER \nAREA\nThis central location is where \nmajor city roads meet (Nikis \nAve, Megalou Alexandrou Ave., \nPavlou Mela, Ethnikis Amynis, \nGermanou) and where the old \npart of the waterfront meets \nthe new one. It affords a lovely \nview of the sea; there are \ngreen areas and many shops, \ncafés and bars.\nMUST SEE:\n1.1  The White Tower.\nThis is the city’s most \nfamous landmark - \nmonument.', '12)\n3.6  Panagia Lagoudiani \nChurch (Virgin Mary Guiding \nAll Men).\nThis small three-aisled \nByzantine basilica is located \non the outskirts of Ano Poli.  \nThis 14th c. monastery \nkatholikon [main church] \ntook its current shape in the \n19th c. It was named after \nLagoudatos, the man who \nfounded it, or –according  \nto another story- after a hare \n[Lagos in Greek – compare \nLagos with Lagoudiani] who \nled to the finding of the icon \nof Panagia. Odigitria (Virgin \nMary Guiding All Men) as \nwell as Saint Demetrius are \nhonoured as patron saints  \nof the city.\n3.7  Ataturk Museum.\nIt is adjacent to the building \nof the Turkish consulate (75, Ap. \nPavlou St.). This three-storey \nresidence was built in the late \n19th c. and it was the house  \nof Kemal Ataturk, born  \nin Thessaloniki (1880? - 1938). \nIn the yard, you will see  \na pomegranate tree his father  \nhad planted there. It is a building \nnow painted in its original colour \n- pink – and houses  \n40 & 41. \nKemal Atatϋrk’s \nhouse (left) \nis a museum \nnowadays and \nhouses an \natmospheric \ncafé (right).\n42. \nKaftanzogleio \nStadium is the \nlargest one in \nthe city.\n43.', '67\nSUBURBS AND CITY OUTSKIRTS\nNoesis –Science Centre \nand Technology Museum\nIt is the only one of its kind \nin Greece! Construction of \nthis 14,000-m2 impressive, \nmodern complex was \ncompleted in 2004 on a small \nhill affording a panoramic view \nof the area. It is considered \nas the modern successor of \nthe Technology Museum of \nThessaloniki. The premises \ninclude screening rooms, \npermanent exhibitions \n(Technology Museum), a \nconference centre, a digital \nlibrary, spaces reserved for \ntemporary exhibitions and \neducational programmes, \nan amphitheatre for carrying \nout Demonstrations and \nExperiments, a museum shop \nand a restaurant-café (for \ninfo about exhibitions and \nprogrammes see p. 79).\nHow to get there. Take \nthe bus No. 10 from the \nRailway Station Stop or from \nEgnatia Street and get off at \nthe terminus in Charilaou area, \nthen board the 66 or 66B bus \nand exit at Paramana square \nor Zoni Kainotomias stop, to \nreach Noesis. If you travel by \ncar, follow the Thessaloniki – \nThermi route.\n5 \t\x07\nPERAIA – NEOI \nEPIVATES – AGIA \nTRIADA\nThese seaside areas are \nlocated 20 km S of the city \ncentre. The area was inhabited \nfor the first time in 1923 \nwhen refugees from Minor \nAsia settled here.', '68\nSUBURBS AND CITY OUTSKIRTS\nbuses to N. Michaniona or  \nthe 76 bus to Angelochori.  \nIf you go by car, follow Ethnikis \nAntistasis, Georgikis Scholis \nand Michanionas Avenues.\n6 \tEPANOMI\nThis picturesque town \n(population: 7,500) is situated \n25 km SE of Thessaloniki. In \nthe vicinity there are beautiful \nbeaches, namely Ktima \nKaragiozi, Ormos, Palioura, \nAgeladariko, Mesimeri and \nPotamos; you will also see a \nhalf-sunken wreck of a small \nmerchant vessel lying there \nsince 1967. Tsairi (4 km S \nof Epanomi) is the location \nof a wetland, a refuge for \nover 80 species of birds. \nGerovassiliou Wine Museum \nis situated 2 km N. and is the \nonly one of its kind in northern \nGreece (for the museum see \np. 80).\nHow to get there. Take \nthe buses nos. 70 and 70A \nfrom the Railway Station \nStop during July and August. \nThroughout the year board \nany one of 69A, 69B, 69E, \n69K, 69N, 69R, 69T or 69X \nbuses at A.S. IKEA station. \nIf you travel by car, head for \nthe airport and then follow \nMichanionas, Miaouli and \nEpanomis country roads.', '85\nDAY EXCURSIONS\nAravissou springs (15 km \nNW) where you can enjoy a \nmeal at the local tavernas;  \nthe artificial Platanopotamos \nLake, near Agrosykia village, \n(17 km NE) where you \ncan visit the ruins of Pelit \nfortress, dating to the times \nof Alexander the Great, and \nProfitis Ilias country chapel; \nand the recreation area in \nDytiko plane-tree forest (3.5 \nkm NE of Agrosykia village).\nHow to get there. Ancient \nPella is located 40 km W of \nThessaloniki. If you go by car, \ntake the national road towards \nEdessa town and then follow \nthe signs that will lead you \nto the archaeological site. To \nreach the military Museum of \nBalkan Wars, take the 68 bus \ndeparting from the station at \nthe horseshoe-shaped point \non Aristotelous Street (where \nAristotelous and Egnatia \nStreets meet).\n2 \t\x07VERGINA  \n(AIGES or AIGAI)\nAs far back as the 10th -8th \nc. BC Aiges was already a great  \ntown and the capital of the \nMacedon state until the 5th BC  \nwhen King Archelaos moved \nthe capital to Pella. It was \nsituated in the centre of \nthe area which was called \n“Macedonian Land” by \nHerodotus [an ancient Greek \nHistorian].', 'MAP OF THESSALONIKI\n\t\tCHURCH DENOMINATIONS\n\t49.\tOrthodox Metropolitan Church\t\n\t50.\tCatholic Church\t\n\t51.\tGreek Evangelical Church\t\n\t52.\tArmenian Orthodox Church\t\n\t53.\tRussian Church\t\n\t54.\tYad Lezikaron Synagogue\t\n\t55.\tMonastiriotes’ Synagogue\t\n\t\tMUSEUMS\n\t56.\t\x07Cinema Museum – Photography Museum\n\t57.\tJewish Museum of Thessaloniki\t\n\t58.\tMuseum of the Macedonian Struggle\t\n\t59.\t\x07Archaeological Museum of Thessaloniki\t\n\t60.\tMuseum of Byzantine Culture\t\n\t61.\t\x07Macedonian Museum of Contemporary Art\n\t62.\tKemal Atatϋrk Museum\t\n\t63.\tTellogleion Foundation of Art\t\n\t64.\tOlympic Museum\t\n\t65.\tWar Museum\t\n\t66.\t\x07Folklife & Ethnological Museum  \nof Macedonia – Thrace\t\n\t67. \t\x07The Cultural Centre of M.I.E.T.  \n[the National Bank of Greece Cultural Foundation] \nin Thessaloniki (Villa Mehmet Kapantzi)\t\n\t68.\tMunicipal Gallery (Villa Mordoch)\t\n\t69.\tState Museum of Contemporary Art\t\n\t\tCULTURE – EXHIBITIONS\n\t70.\t\x07Thessaloniki International Trade Fair (HELEXPO)\n\t71.\t\x07Society for Macedonian Studies –  \nNational Theatre of Northern Greece\t\n\t72.\tGarden Theatre\t\n\t73.', '107\n108, Vasilissis Olgas st. \ntel.: 2310 295.170 \nwebsite: www.miet.gr\nThessaloniki Cinema \nMuseum:  \nWarehouse A (harbour) \ntel.: 2310 508.398 \nwebsite: www.cinemuseum.gr\nMuseum of Photography  \nof Thessaloniki: \nWarehouse A (harbour) \ntel.: 2310 566.716 \nwebsite: www.thmphoto.gr\nOlympic Museum:  \nAgiou Dimitriou & 3rd Septemvriou \nSts. \ntel.: 2310 968.531-2 \nwebsite: www.olympicmuseum-\nthessaloniki.org\nRadio Museum:  \nWithin the T.I.F. grounds (south \ngate Y.M.C.A. of Thessaloniki) \ntel.: 2310.299.445 \nwebsite: www.radiomuseum.gr\nWater Museum:  \n19, 26th Oktovriou St. \ntel.: \x072310 2310 514.029, 2310 \n966.600\nwebsite: www.eyath.gr\nChildren’s Museum:  \nCultural Centre of the Municipality \nof Thessaloniki, 57, Gr. Lampraki & \nKleanthous Sts. \ntel.: 2310 913.047 \nwebsite: www.paidikomouseio.gr\nYeni Mosque: \n30, Archaiologikou Mouseiou St. \ntel.: 2310 857.978\nCast Museum A.U.Th.', '73\nMUSEUMS\n• Discovering the past. \nExcavated sites in the city and \nthe procedure for creating and \nmaintaining an archaeological \nmuseum are described in room 11.\n• Temporary exhibitions \nand events. At times the \nMuseum organises temporary \nexhibitions and cultural events, \nmost of which are associated \nwith Thessaloniki’s and \nNorthern Greece’s Byzantine \nlegacy.\nWHITE TOWER EXHIBITION\nStarting from the year it was \nfounded until the present day, \nthe history of Thessaloniki is \ndepicted through an array of \nmultimedia applications, special \nstructures, printed graphic \ndesign compositions and \narchaeological material. The \nexhibition is organised in seven \nthematic categories, each one \noccupying one floor, as follows: \nSpace and Time (ground floor), \nTransformations (1st floor), \nMonuments and History (2nd \nfloor), Homeland of the people \n(3rd floor), Along the trade \nroutes (4th floor), Leisure and \nCulture (5th floor), Thessaloniki \n– Flavours (6th floor). The \nmuseum’s shop is located on \nthe last floor.\nJEWISH MUSEUM OF \nTHESSALONIKI\nIt was created following \nan initiative of the Jewish \nCommunity of Thessaloniki  \nto promote the Sephardic \nlegacy in town, which dates  \nas far back as the 15th c. It has \nbeen open to visitors since \n1997.', '93\nDAY EXCURSIONS\na day trip (it’s only a short \ndistance from the city) or \nfor a longer one; quite a few \nown country houses there. In \nthe Athos peninsula amidst \na beautiful and pristine \nnatural environment lies the \nglobally known monastic \nstate of Mount Athos which \nencompasses 20 -presently \ninhabited- monasteries \n(10th – 14th c.), sketes [small \nmonastic settlements] and \ncells for monks. UNESCO has \nincluded the ‘Holy Mount’ in its \nWorld Heritage Monument List \nin 1988, on grounds of the \noutstanding architecture and \nthe priceless cultural treasures \nof the monastic community.\nHow to get there. \nPetralona Cave is situated  \n53 km SE of Thessaloniki. Take \nthe coach to Halkidiki, get \noff at Nea Kallikrateia Village \nstop and then take a taxi to \nthe cave (approx. a 10-km \njourney). If you travel by car, \ngo along the Thessaloniki-\nHalkidiki national road and  \nthen follow the signs to \nPetralona village and the cave.\n5 \tLAKES AREA\nNortheast of Thessaloniki, in \nthe direction of Strymonas \n(also Strymonian) gulf \nstretches a 200,000 hectare-\narea around Lakes Koroneia \nand Volvi; the place is a \nNational Park.', 'In January 2008, \nthe International Olympic \nCommittee changed the \nname to Olympic Museum \nand since then collections \nfocus on objects related with \nthe Olympic and Paralympic \nGames such as costumes, \nequipment, torches, medals, \nsouvenirs and published items.\n‘CHRISTOS TSIGGIRIDIS’ \nRADIO MUSEUM\nExhibits include some of \nthe equipment used by Chr. \nTsiggiridis (1877 – 1947), \nthe founder of the first radio \nstation in the Balkans, old \nmaterial from Macedonia Radio \nStation, apparatus used by \nthe army as well as equipment \n91.  \nThe \nThessaloniki \nOlympic \nMuseum.\n92.  \nNOESIS – \nThessaloniki \nScience \nCentre and \nTechnology \nMuseum.\n91']","['The historic center of Thessaloniki features traditional commercial areas like Vlali Square, known for coffee shops and restaurants, and a memorial for MP Gr. Lamprakis. The Vatikioti market and Athonos Square offer shops selling produce, spices, and various goods, along with tavernas and ouzo restaurants. Bezesteni, a rectangular building from the late 15th century, serves as a textile and jewelry market with over 110 shops. Stoa Saul, completed in 1881 and rebuilt after a fire, combines neo-renaissance and art deco styles and is now an entertainment venue. Vas. Irakleiou, formerly known as Fragkomachalas, has transformed from a banking area to a commercial and entertainment hub, with popular tavernas and traditional marketplaces offering high-quality foodstuffs.', 'The input consists of the number 112 repeated twice.', 'The text describes notable landmarks in Thessaloniki, including the OTE Tower, built in 1969, which serves as a telecommunications hub and features a rotating café with stunning views. It also mentions the Alexandreio Melathron, a historic sports arena constructed in 1966, which has hosted various significant events and is now home to the Aris basketball team. Additionally, Angelaki Street is highlighted for its vibrant cafés and bars popular among university students, as well as the presence of several radio stations. The area surrounding the 3rd Army Corps is also noted, with its historical significance and architectural features.', 'Kalochori, located 5 km west of the city center, is a rapidly growing residential suburb known for its industrial character and local tavernas. The Gallikos River runs along its west edge, offering facilities for picnicking and relaxation. The river delta and Kalochori lagoon are home to diverse wildlife, including herons and flamingoes. The surrounding wetland area, protected by the Ramsar Convention, is part of the Natura 2000 network and offers free tours. Sindos, situated about 9 km northwest of Kalochori, has grown significantly due to the Thessaloniki Industrial Park.', 'The area features historical sites, including a World War II gun emplacement, and is home to diverse salt marshes and wetlands that shelter 178 bird species like flamingoes and cormorants. To reach the location, take the 71 or 71A bus from the Railway Station Stop to N. Michaniona, or use bus lines 02 and 02A to A.S. IKEA station and then transfer to buses 72, 72A, or 72B. If driving, follow Ethinikis Antistasis, Georgikis Scholis, and Michanionas avenues.', ""The text describes various museums in Thessaloniki, Greece, including a cinema museum showcasing projectors and films from 1910, a photography museum founded in 1997 with over 100,000 photographic objects from 1890-1980, and the Olympic Museum, which focuses on Olympic and Paralympic memorabilia. Additionally, it mentions the 'Christos Tsiggiridis' Radio Museum, featuring equipment from the founder of the first radio station in the Balkans. Each museum hosts educational programs and temporary exhibitions, contributing to the cultural landscape of the city."", 'The Jewish quarter in Europe retains its traditional character, featuring Roman, Ottoman, and Industrial age monuments in districts like Kyriotissa, Panagia Dexia, and Makariotissa. Visitors can explore the award-winning Public Central Library and enjoy local parks. Vergina, located 63 km SW of Thessaloniki, is accessible by car, intercity bus, or train. Dion, an archaeological site under the Olympus mountain range, was a sacred place for ancient Macedonians, dedicated to Zeus and the Muses. The site includes the Vafyras sacred springs, the temple of Demeter, and the Sanctuary of Zeus Hypsistos. Dion flourished until the 5th century AD when it was abandoned due to seismic activity.', 'The historic centre features Valaoritou Street and nearby streets filled with cafés, bars, and restaurants. Notable sites include the neo-renaissance Stoa Malakopi, which housed a bank until 1954, and a clock that stopped during the 1978 earthquake. The Catholic Church, built in 1898, stands in a serene yard with an impressive belfry. The State Conservatory of Thessaloniki, constructed in neobaroque style in 1903, is located at the corner of Vas. Irakleiou and L. Sofou Streets, featuring a garden with 19th-century statues. Ermou Street, running parallel to Vas. Irakleiou, serves as an interesting shopping centre.', 'The Hellenic Professional Yacht Owners Association is located in Piraeus, while the Thessaloniki Marina is in Aretsou Kalamaria. Various beaches are accessible, including Aretsou beach and those in Halkidiki, which are popular for swimming. Mineral springs and spas in the area include Lagkadas Spa, Nea Apollonia Spa, and Souroti Spring. The urban bus service in Thessaloniki covers all city areas, with main termini at key locations. Buses operate from 5 am to midnight, with options for purchasing tickets or passes. A cultural bus route highlights historical sites, and sightseeing tours are available in open-top buses. Makedonia International Airport is 15 km from the city center, with bus services connecting it to major stations. Information for airlines like Olympic Air and Aegean Airlines is also provided.', 'The site features a dark atmosphere with selective lighting highlighting various exhibits, including funerary steles and a 3rd century BC tomb. Notable structures include a memorial for distinguished individuals and the tomb of King Philip II, which showcases exquisite murals, a gold larnax containing his bones, and a decorated suit of armor. The site also contains the tomb of Alexander IV, featuring a silver urn with his remains. Visitors can watch a video tour by M. Andronikos. Excavations in the Aiges necropolis have revealed archaic tombs and a temple-shaped tomb believed to belong to Queen Eurydice. Additionally, the palace, covering 12,500 m2, is considered a significant construction of Hellenic Classical Antiquity, attributed to architect Pytheos.', 'Thessaloniki offers various transportation options including a passenger railway station, intercity bus services, and taxi services with regulated fares. Key contact information includes the railway station at 28 Monastiriou St. and the Macedonia Intercity Bus Station at 244 Giannitson St. Numerous museums and archaeological sites are available for visitors, such as the Archaeological Museum of Thessaloniki and the Museum of Byzantine Culture. Each museum has specific contact details and websites for more information. The city also features a range of cultural institutions, including the State Museum of Contemporary Art and the Jewish Museum of Thessaloniki.', ""The text describes several museums in Thessaloniki, including a Holocaust exhibition that memorializes the local Jewish community, particularly the 49,000 members sent to concentration camps. The Museum of the Macedonian Struggle showcases the history of Macedonia's fight for freedom against the Ottoman Turks, with various rooms dedicated to different aspects of this struggle. The War Museum features significant artifacts from modern Greek history, including uniforms and military decorations from the 1821 War of Independence to the 1944 liberation. Lastly, the Ataturk Museum displays exhibits across two floors, highlighting the life and legacy of Mustafa Kemal Ataturk."", ""The text describes notable Byzantine monuments in Thessaloniki, including Agios Panteleimonas Church, which was originally part of a monastery and later converted into a mosque, featuring murals from the 13th-14th centuries. It also highlights Agios Dimitrios Church, the city's patron saint, built in the 7th century on the ruins of a 5th-century basilica, which was converted into a mosque in 1493 and restored after a fire in 1917. The church contains significant mosaics and a basement Krypt, believed to be the site of Saint Demetrius's martyrdom, and has been used for cultural events since 1988."", 'Ano Poli, or Old Town, features notable areas like Tsinari, Terpsithea Square, and Romfei Square. Tsinari is named after a plane tree and is a central spot with an Ottoman fountain and the oldest restaurant in town. Terpsithea Square showcases remarkable buildings, a playground, and the Tϋrbe of Musha Baba, a late Ottoman monument. Romfei Square is the central square of Ano Poli, home to a Byzantine bath-house and a neoclassical building housing the municipal library. Nearby, the 14th-century Byzantine church of the Taxiarchs adds historical significance to the area.', ""Thessaloniki is a hub for archaeological, historical, and natural attractions, offering numerous outdoor activities and relaxation options. Visitors can explore significant archaeological sites, historical towns, and natural reserves. Ancient Pella, once the capital of Macedon, thrived under King Philip II and became a major cultural center before its decline after Roman conquest. Notable finds include exquisite mosaic floors in spacious townhouses, such as the House of Dionysus and the House of the Snatching of Helen, showcasing rich decorations and historical scenes. Pella's archaeological site features a restored peristyle, making it a must-see for visitors."", 'Kalamaria features popular areas like Aretsou and Krini along the seafront, with amenities such as a marina, open-air cinema, and numerous café-bars. Komninon Street, a pedestrian-only area, hosts shops, cafés, and the central square with the Town Hall and church. Panorama, a suburb 12 km from Thessaloniki, offers luxury villas and a small shopping area, with historical roots dating back to the early 20th century. Platanakia is a notable spot for relaxation, featuring a wooded ravine, a small zoo, and a scenic path leading to an artificial lake.', ""The text describes the connection between the town's civic center and various key locations, including Kassandrou Street, Aristotelous Square, and the seafront. It highlights the architectural features of buildings along the street, which house various businesses and institutions. The church of Agia Theodora is noted as a significant landmark at the junction of Aristotelous and Ermou Streets. Nikis Avenue, known as Palia Paralia, runs from the harbor to the White Tower and has historical significance due to its development in 1882. Today, it is a vibrant area frequented by locals and tourists, lined with cafés and bars, and features a wide pedestrian area by the sea. The avenue is also home to several notable landmarks, including various mansions and the State Orchestra of Thessaloniki."", 'The document outlines a guide to Thessaloniki, including its history, various walking tours of the city, information on museums, day excursions, nightlife, gastronomy, and tips for touring with children.', 'The text describes the historical significance of various structures in ancient Macedonia, including a palace with a peristyle, a monumental gateway, and a temple dedicated to Hercules. It mentions the theatre built around 340 BC, known for being one of the oldest stone theatres, where King Philip II was assassinated. Additionally, it details religious sites near the theatre, including temples dedicated to goddess Euclea and Kyveli, along with remnants of royal votive offerings. The Acropolis features five towers and thick fortification walls, with house foundations dating from the 5th to 1st century BC. The text also highlights Veroia, a historic town in Northern Greece, known for its Byzantine churches and as a site visited by Apostle Paul, earning it the nickname Little Jerusalem.', 'Thessaloniki, the historic capital of Macedonia, blends its rich cultural heritage with modernity, featuring numerous monuments and a vibrant atmosphere. The city is known for its hospitality, artistic events, and exceptional culinary traditions. Its strategic location allows easy access to renowned archaeological sites, natural wonders, and the monastic state of Agion Oros. Visitors can enjoy various sports and wellness tourism options throughout the year, making Thessaloniki a versatile destination for all.', ""Thessaloniki is a child-friendly city with numerous activities, including bicycle rides along waterfront bike lanes and visits to theme parks. The region is also known for its rich wine-making tradition, featuring a variety of grapes like Roditis, Asyrtiko, and Cabernet Sauvignon. The Wine Producers Association offers excursions through the 'Wine Roads of North Greece,' combining visits to wineries with historical sites. Families can enjoy various fun activities and games throughout the city."", ""The Lazare church in Paris, once a hospital and refugee center, was declared a historic monument in 1980 and renovated in 1997 for cultural events in Thessaloniki. It now serves as a multi-purpose venue, housing the National Theatre of Northern Greece, a café-restaurant, and hosting outdoor performances. The area also features five old tobacco warehouses, remnants of the city's tobacco trade, with one converted into a luxury hotel and others housing educational and commercial spaces. Additionally, the Stavroupoli Botanical Garden spans 0.5 hectares, showcasing over 1000 plant species and providing recreational facilities. The Serbian monument is located in the Zeitenlik allied military cemetery."", 'The number 114 is repeated twice.', ""Eleftherias Square, located near the harbor, served as a parking lot and was the site where 50,000 Jewish residents were gathered by German forces in 1943. A Holocaust Memorial was erected in 1997 to commemorate this event. The square is surrounded by notable buildings, including the National Bank of Greece and the Ionian and Popular Bank, showcasing late neoclassicism and eclectic styles. Kalapothaki Street, starting from the Ladadika area, features pedestrianized sections with neoclassical and Bauhaus-style buildings, popular cafés, and the historic Stein Building. The port area is one of the largest in the southeastern Mediterranean, with a rich history dating back to Constantine the Great's time."", ""The Orphanos Church, built in the 1310s as part of Vlatadon Monastery, features exquisite 14th-century murals and is one of Thessaloniki's best-preserved monuments. The city walls of Thessaloniki were established shortly after its founding and underwent significant changes under Theodosius I in 390 AD. Over the centuries, the walls were reinforced during Venetian and Turkish rule, resulting in a total length of 7 km, with only 3 km remaining today. The walls are notable for their impressive height and width, contributing to their archaeological and cultural significance. For a comprehensive understanding of Byzantine art in the city, visitors are encouraged to explore the Museum of Byzantine Culture."", ""Greece, a parliamentary republic and EU member since 1981, has a population of approximately 10.8 million. Thessaloniki, the second-largest city, is located 510 km north of Athens and has over 1 million residents. The euro has been the national currency since 2001, and the international calling code is +30. Thessaloniki experiences a temperate Mediterranean climate with average temperatures ranging from 5°C in January to 24°C in August. Key national holidays include New Year's Day, Independence Day, and Easter celebrations, which involve various religious and cultural traditions. Other notable festivals include Carnival and Pentecost. For consulate information, contact local authorities in Thessaloniki."", ""The text describes several museums, including the room of Kemal Ataturk's mother, which exhibits his personal items and documents. The Folklife & Ethnological Museum of Macedonia-Thrace, founded in 1957, displays 20,000 objects from 1860 to 1960, including folk costumes and musical instruments. The State Museum of Contemporary Art, inaugurated in 1997, houses the Kostakis Collection of Russian Avant-Garde art, featuring works by notable artists like K. Malevich and V. Kandinsky. This museum also has a collection of contemporary Greek art and hosts temporary exhibitions."", 'The historic centre of Thessaloniki, particularly the Ladadika area, has transformed from a downgraded region post-WWII to a vibrant hotspot filled with restaurants, clubs, and live music venues since the 1990s. Key starting points for exploration include Morichovou square and Petrakaki square, where notable sights like the Ottoman Post Office Mansion can be found. Tsimiski Street, a major thoroughfare constructed after the 1917 fire, is now a bustling commercial hub featuring shops, offices, and popular cafés. Significant buildings include the Kazes Building, designed by Xenophon Paionidis in 1924, and the Agios Minas Church, which has historical roots dating back to early Christianity.', 'Thessaloniki has historically been a key stopover for East-West trade. Today, its town center offers a vibrant shopping experience with traditional marketplaces and modern commercial areas. Visitors can find a variety of goods, including food, clothing, and antiques, at reasonable prices. Notable shopping spots include Bit-Pazar for second-hand items and the Mediterranean Cosmos Mall, which features over 200 shops and entertainment options. Other popular areas include the Hirsch Building Mall and Plateia Mall. For budget-friendly shopping, Venizelou St., Egnatia St., and Agiou Dimitriou St. are recommended. The city also has modern shopping centers in Kalamaria and its suburbs.', ""The Historic Centre features a blend of modern and traditional Macedonian architecture, including notable sites such as the Acheiropoiitos church, built in 1818, and the Nedelkou Building from 1909, which now houses the Mount Athos Centre. The Galerius Arch, a significant landmark from 295-305 AD, commemorates Galerius' victory over the Persians and is a popular meeting spot. Nearby, the Rotunda and Panagia Dexia church, which contains a rare icon of the Virgin Mary, add to the area's historical richness."", ""The text describes various museums in Thessaloniki, including the archaeological museum that showcases excavated sites and the process of maintaining an archaeological museum. It highlights temporary exhibitions related to Byzantine heritage. The White Tower Exhibition presents Thessaloniki's history through multimedia and is organized into seven thematic categories across different floors. Additionally, the Jewish Museum of Thessaloniki promotes Sephardic legacy and features a research center, library, and audiovisual center. Its permanent exhibitions cover topics such as the Jewish necropolis and the history of the Jewish community in Thessaloniki up to World War II."", ""Thessaloniki is renowned for its vibrant nightlife, often considered Greece's entertainment capital. The city offers a variety of options including avant-garde bars, tavernas, ouzo restaurants, and modern cuisine spots. Popular nightlife areas include Ladadika, Kalapothaki Street, and the beachfront cafés. Students frequent Navarinou square, Rotonda, and Bit-Pazar, while Ano Poli features alternative tavernas and café-bars. Recently, Valaoritou Street has emerged as a nightlife hotspot, especially in summer. The Slaughterhouse area hosts large venues for live Greek music and the biggest clubs in the city."", ""The text describes various locations and landmarks in Thessaloniki, including the historic center, the White Tower area, and notable streets. The historic center is recognized for its proximity to the beach and is a residential area for the affluent, featuring shops, green spaces, and cultural institutions. The White Tower is highlighted as the city's most famous landmark, built in the late 15th century, and serves as a significant historical monument. It stands 33.90 meters high and has a diameter of 22.70 meters, originally surrounded by fortifications. The area around the White Tower is a central hub where major roads converge, offering views of the sea and a vibrant atmosphere with shops and cafés."", 'The International Book Fair in Thessaloniki is an annual event held in the HELEXPO-TIF exhibition center, attracting professionals and book lovers. It features presentations from Greek and foreign publishers, discussions with writers, and various themed corners for children and teenagers. The Society for Macedonian Studies is a key cultural institution in Thessaloniki, focusing on the preservation and promotion of Macedonian history and culture. The National Theatre of Northern Greece, established in 1961, is the largest cultural organization in northern Greece, hosting various performances across multiple venues. Thessaloniki also offers a range of indoor and outdoor theatre stages, providing diverse entertainment options throughout the year.', 'The text describes various historical and archaeological sites in the region, including the Praetorium, public toilets, and the Hydraulis sector known for its copper items. It highlights the Villa of Dionysus, famous for its mosaic of Dionysus. The Archaeological Museum showcases artifacts from the Dion area and nearby ancient sites. Mt. Olympus, the highest mountain in Greece, is noted for its biodiversity and as a popular destination for hiking. Ancient Pydna, once an administrative center under Macedon, faced decline after Roman conquest and was eventually deserted.', 'The Greek National Tourism Organisation promotes tourism in Greece through its website, www.visitgreece.gr.', 'The 6th walk in Thessaloniki highlights several must-see landmarks along NEA PARALIA and VASILISSIS OLGAS AVENUE. Key attractions include the Monument of Alexander the Great, a large equestrian statue near the White Tower, and the statue of politician Konstantinos Karamanlis. The Makedonia Palace Hotel, a luxury accommodation, is noted for its historical significance and frequent patronage by political figures. The Umbrellas sculpture by George Zongolopoulos, a prominent art piece, is also featured, along with the Agioi Kyrillos and Methodios Church, dedicated to the saints who spread Christianity to the Slavs.', 'Ano Poli, an area of 3,000 hectares, features a small remnant of an old oak forest and has undergone reforestation since the 1930s. It remains a popular destination for outdoor activities like hiking and mountain biking, despite urban expansion and a significant fire in 1997. Key attractions include the Zoo, which houses various Greek wildlife, the Forest Theatre for summer concerts, and the Theatre of the Earth, a notable cultural venue. Visitors can access these sites via bus no. 24 from Eleftherias square. The nearby Sykees area retains its charm with Interwar Period houses amidst modern development.', 'The area includes historical sites such as the former Turkish army barracks and the War Museum, designed by V. Poselli. It also features the Papafeio Orphanage, a classical style building completed in 1903, which served various purposes including a male boarding school and military barracks. Nearby, the YFANET textile factory was once a major textile unit in Macedonia and is now a venue for events and a library. Additionally, visitors can explore a rare Macedonian tomb from the 3rd century BC and the neoclassical Ippokrateio Hospital built in 1891.', 'The text describes various museums in Macedonia, including sections on antiquities from the 2nd to 4th centuries AD, prehistoric items, and temporary exhibitions. The Roman Forum Museum, inaugurated in 2010, showcases local excavations and historical artifacts from the Hellenistic period to the 4th century AD, including a bathhouse and ancient brothel. The Museum of Byzantine Culture is highlighted as one of the best in Greece, featuring 2,900 exhibits that include murals, mosaics, icons, and everyday tools, providing a comprehensive view of Byzantine culture.', 'The 7th walk in Stavroupoli highlights notable cultural venues like Mylos, a former flour mill turned multi-purpose venue, and FIX Brewery, founded in 1893 and now mostly deserted except for concert halls. The Terpsithea District features well-planned urban spaces, including the old military camp and Lebet mosque, which will be transformed into a park. The Jewish cemetery, established in 1938, contains remnants from a previous cemetery destroyed during WWII. A must-see is the Allied Military Cemetery, the largest in Greece, housing over 21,000 soldiers from World War I. Additionally, the Moni Lazariston, built in 1886 by Lazarist monks, is an impressive historical site.', ""The text describes various streets and locations in Thessaloniki, highlighting their historical significance and current status. Dimokratias Square is noted as a key entry point to the city, serving as a transportation hub with hotels, shops, and a statue of King Constantine. The surrounding area features mostly unremarkable buildings but also historic sites, including sections of the city's west walls and archaeological monuments. The Railway Station, located on Monastiriou Street, is mentioned as a significant structure that began construction in 1939 and became operational in 1951."", ""The historic centre features the White Tower, originally known as the Tower of the Janissaries, which served as a jail and now hosts exhibitions on Thessaloniki's history. Visitors can enjoy panoramic views from the top and relax in the surrounding square, which is a hotspot for boat bars. The Royal Theatre, built in 1940 and renovated in 1996, has a capacity of 800 and is part of the State Theatre of Northern Greece. Ethnikis Amynis Street connects the White Tower to Syntrivaniou Square and was established after the demolition of city walls in 1889. Previously named Hamidiye Boulevard, it is now home to various cultural institutions, including the Theatre of the Society for Macedonian Studies and popular cafés and bars nearby."", 'The text describes various historical sites in a town, including Main Street, which was lined with shops and public buildings. The Great Thermae was a large public bath complex featuring marble floors and areas for worship and entertainment. The Houses of Zosa and Lida were decorated with mosaics and sculptures. The Roman Forum, dating back to the late 2nd to early 3rd century, included luxury houses and a temple for emperor worship. A polygonal building served as a roofed marketplace, while remnants of Early Christian Walls were found nearby. An episcopal basilica was rebuilt in the 5th century after its destruction in the 4th century. The Praetorium functioned as an inn for officials and travelers, with access to the Main Street Thermae. Additionally, the text mentions a climbing route in Olympus National Park and the Petralona Museum, showcasing prehistoric human activity.', 'The Agora, a 4th century BC building complex, served as the administrative and cultural hub of the town, featuring a large court and various commercial shops. Excavations have revealed several temples, including those dedicated to the Mother of Gods and Aphrodite. The Palace, located on a northern hill, dates back to the 4th century BC and includes a peristyle and royal quarters. The Eastern cemetery contains rock-hewn cist graves from the Copper Age to Classical times. The Alexander the Great Bathhouse, a Hellenistic facility, is also notable. The Archaeological Museum showcases five thematic categories, including daily life, public life, religious practices, cemetery finds, and the architectural design of the palace, along with information about Alexander the Great.', ""The text describes various museums, including the Water Museum, which features restored buildings showcasing pumping machinery and historical archives. The Children's Museum, targeting ages 4-12, offers educational programs and is currently located in Thessaloniki's Cultural Centre after a fire destroyed its previous location. The Noesis Science Centre and Technology Museum includes exhibitions on Ancient Greek technology and interactive exhibits on electricity and magnetism."", ""The 5th walk in Ano Poli (Old Town) connects Agios Pavlos area and Agiou Dimitriou Street, offering views of the city's eastern walls. The Gardens of the Pasha, built in 1904, feature eccentric architecture and an art nouveau fountain. Agios Pavlos church, named after a fountain where Apostle Paul drank, is located nearby. Agios Dimitrios Hospital, built around 1902-3, showcases classicist and baroque styles and is a listed monument. Evangelistria Cemetery, established in 1875, is the city's oldest Christian cemetery, housing notable figures. Nearby are the Armenian and Protestant cemeteries and a historic foundry now used for cultural events."", ""The text describes several significant Byzantine monuments in the Ano Poli area, including the 14th-century Agia Aikaterini Church, known for its elaborate brickwork and murals depicting saints and Gospel scenes. It was converted into a mosque during Ottoman rule but restored between 1947 and 1951. The Profitis Ilias Church, dating from the late 13th to mid-14th century, is noted for its architectural features and murals of Christ's life. Additionally, the Byzantine Baths, a 13th-century domed structure, is the only surviving bathhouse from that era, which was open to the public until 1940."", 'The text describes various locations in Ano Poli, Thessaloniki, including the historical significance of the eastern walls and the neoclassical G. Gennimatas hospital. It mentions Kallitheas Square, a picturesque area with a playground, and major streets leading out of the city walls. Additionally, it references the Seich Sou forest, the largest forested area near the city.', '', 'The text describes various historical buildings along Vas. Olgas Avenue in Thessaloniki, including the Folklife and Ethnological Museum of Macedonia – Thrace, which was once a residence of banker Jacob Modiano. Other notable buildings include a former private residence that now serves as a nursery school, the Melissa Building which housed an orphanage and now hosts the Centre for Byzantine Research, and the School for the Blind, originally built as a private residence. The Jeborga Villa, once the Italian Consulate, is now deserted. The Yeni Mosque and Modiano Villa are also mentioned for their eclectic architectural features.', 'Chortiatis is a small suburb located on Mt. Chortiatis, known for its hiking trails and historical significance, including remnants of a Byzantine aqueduct. Thermi, situated 15 km southeast of Thessaloniki, retains a countryside feel and was historically significant as the harbor of ancient Thermi, famous for its hot springs. The central square of Thermi, Paramana Square, is noted for its futuristic design and serves as a hub for local businesses. An artificial lake nearby offers recreational opportunities and hosts the Dam Music Festival in summer, while the Environmental Park provides various sports facilities.', ""Aristotelous Square in Thessaloniki is one of Greece's largest and most vibrant squares, operational 24/7. It was part of the Hébrard Committee's urban plan post-1917 fire, fully realized by the early 1960s. The square offers stunning views of the Thermaic Gulf and Olympus massif, featuring monumental architecture that blends Byzantine and European interwar styles. Key landmarks include the Electra Palace hotel and Olympion, the latter hosting the Thessaloniki Film Festival. Aristotelous Street, a pedestrianized historic boulevard, connects to Egnatia Street."", 'The text describes various historical sites in Thessaloniki, including the Hippodrome, which was a center of social activity until 390 AD when a massacre led to its closure. It highlights the Thessaloniki History Centre and the 18th-century Agios Antonios church nearby. The Arched Hall, located at the intersection of Gounari and Svolou streets, was used for symposia and had access to the imperial box in the Hippodrome. Additionally, remnants of a theatre-stadium on Apellou Street date back to the 1st to 4th centuries AD and are linked to the martyrdom of Agios Dimitrios. The text also mentions three notable churches on Egnatia Street, including the Panagouda Church, built in 1818 on the site of an older church destroyed by fire. The area is rich in history and cultural significance, making it a must-visit for tourists.', 'The number 116 is repeated twice.', 'The map of Thessaloniki highlights various public agencies and services, including the G.N.T.O. Information Office, Ministry of Macedonia – Thrace, and the Police Department. It also features significant Roman monuments such as the Roman Forum and the Arch of Galerius, alongside Byzantine churches like Agia Sofia and Agios Dimitrios. Ottoman monuments are represented by the White Tower and various hamams. Additionally, the map includes 19th to 20th-century landmarks like Aristotelous Square and the YMCA of Thessaloniki.', ""The text describes several significant Byzantine monuments, including their architectural features and historical transformations. The first is a tetrastyle cross-in-square church that became a mosque, obscuring its original murals. The Panagia Chalkeon Church, built in 1128, showcases the 'School of Constantinople' architecture and was also converted into a mosque. Acheiropoietos Church, founded in the 5th century, features a three-aisled basilica and was the first church turned into a mosque after the Turkish conquest. Lastly, Agia Sofia Church, built in the mid-7th century, is a replica of the Hagia Sophia in Constantinople, highlighting its historical significance."", 'The historic center of Thessaloniki features a shopping mall that was reshaped between 1995-1997, retaining its original exterior while now housing shops, cinemas, cafés, and restaurants around a central atrium. Notable buildings from the early 20th century are located at the junction of Tsimiski and Karolou Dil Streets, currently serving as shops and offices. The traditional market area, west of Aristotelous Street and south of Egnatia Street, is filled with small shops, malls, and arcades dating back to the Turkish Occupation, offering a variety of products including food, spices, and fabrics. Modiano Market, built in 1922, is a prominent glass-roofed structure with 140 food shops and popular restaurants. The Vlali-Kapani and Athonos-Vatikioti Markets, designed by Ernest Hébrard, feature two-storeyed malls with archways and are connected to Aristotelous Street.', 'The text describes notable buildings in the historic center of Thessaloniki, including the YMCA Building, which features a mix of neo-colonial and Byzantine architecture and houses various sports and cultural facilities. The Archaeological Museum, designed by P. Karantinos and inaugurated in 1962, showcases modernist architectural design and includes spaces for exhibitions and events. The Museum of Byzantine Culture, built between 1989 and 1993, combines modernism with Greek tradition and is recognized as a historic monument. It contains an amphitheater, a café-restaurant, and exhibition spaces, alongside the new Town Hall and a park.', 'Ano Poli, or Old Town, was established to house early 20th-century refugees, with historical settlements dating back to the 2nd century AD. The area features the Municipal Grove with a theatre for summer cultural events and an open-air cinema. A prominent church, Agioi Theodoroi, built on a 7th-century Byzantine site, offers stunning city views. Nearby, Elpidos Street has refugee houses being transformed into a Cultural Neighbourhood. Access to Sykees is available by walking from Ano Poli or taking bus no. 23 to Agios Charalampos stop.', 'The text describes various day excursions near Ancient Pella, including Aravissou springs, Platanopotamos Lake, and Dytiko plane-tree forest. It provides directions to Ancient Pella from Thessaloniki and mentions the military Museum of Balkan Wars. Additionally, it highlights the historical significance of Vergina (Aiges), the former capital of Macedon, detailing its importance from the 10th-8th century BC until its destruction by the Romans in 168 BC. The archaeological site is recognized as a UNESCO World Heritage Site, featuring the Royal Tombs discovered by archaeologist Manolis Andronikos in 1977.', 'The text describes a walking tour along Vasilissis Olgas Avenue, highlighting historical buildings and residences. Notable sites include the Hirsch villa, a former police department, and the Chatzilazarou Residence, built in 1890. The Marokou Residence, previously a boarding school, now houses a Traffic Police Department. The Mehmet Kapanci Villa, constructed in 1893, served various significant roles, including housing military leaders and high schools, and is now part of the Thessaloniki Cultural Centre. The Ahmet Kapanci Villa, built in 1905, features eclectic architectural styles and has housed various organizations over the years, including the Red Cross and NATO services.', ""The Historic Centre features Plateia Dikastirion, a green square where the Court House was planned but halted due to the discovery of the Ancient Roman Forum. The square has a bust of Eleftherios Venizelos, a significant Greek prime minister. Nearby, the Bey Hamami, built in 1444, is the largest Ottoman bathhouse in Greece, known as the Paradise Baths until 1968. The Roman Forum, a 2-hectare area, served as the city's social and religious center during the Roman period, with construction completed in the mid-2nd to mid-3rd centuries AD. The site includes a large square with traces of marble paving and a double underground Cryptoporticus, likely used as a public storehouse, featuring an early Christian mural."", ""The text describes various historical and architectural landmarks in Thessaloniki, including the West of the Centre-Stavroupoli inaugurated in 1962, which connects the city to Greece and the Balkans. The Old Railway Station, built in 1894, is now a cargo station and was historically significant during the German occupation. The Top Hane (Vardariou Tower), constructed by the Ottomans in 1546, served as a city stronghold and remains well-preserved. The De La Salle Complex, built in 1926, now houses the city's Administrative Courts, while the Vienni Hotel, established in 1925, reflects the eclectic architectural trends of its time and currently contains private offices."", 'Noesis is a unique science center and technology museum in Greece, completed in 2004, featuring exhibitions, a digital library, and an amphitheater. It can be accessed via public transport or car from Thessaloniki. The seaside areas of Peraia, Neoi Epivates, and Agia Triada, located 20 km from the city center, were settled by refugees in 1923 and have since developed into popular suburbs and resorts with Blue Flag beaches and various amenities. Buses connect these areas to the city, providing easy access for visitors.', 'The text describes various attractions in Thessaloniki, including the historic center, shopping streets, and museums. It highlights the eclectic-style building housing the local Greek Scouts and the upscale shopping areas with boutiques and art galleries. The Museum for the Macedonian Struggle, a neo-classical building, is noted for its historical significance and previous functions. Nearby, the metropolitan church of Agios Gregorios Palamas showcases Byzantine architecture, and the Ecclesiastical Museum offers a collection related to the church.', ""Dion, located 87 km SW of Thessaloniki, features a significant neolithic settlement, early-Christian basilicas, and a 10th-century basilica with impressive mosaics. Visitors can reach Dion via national roads or local buses from Katerini. The Petralona Cave, discovered in 1959, is notable for its prehistoric findings, including a 200,000-400,000-year-old skull, making it one of Europe's oldest archaeological sites. The cave showcases various prehistoric items and is partially open to visitors. Halkidiki, known for its beautiful beaches and rich history, is a popular tourist destination south of Thessaloniki, featuring three peninsulas: Kassandra, Sithonia, and Athos."", 'The museum features a collection of over 2,500 corkscrews from the 16th to 20th centuries, categorized by mechanical and non-mechanical types, as well as by gender usage. It includes explanatory texts and photographs. Additionally, touch screens display a glossary of viticulture and wine-making terms. Room B showcases the historical significance of wine through tools and vessels, along with scenes from films and photos related to wine production and consumption.', ""The text describes significant Byzantine monuments in Thessaloniki, including the UNESCO-listed church that was once a cathedral and later converted into a mosque, showcasing impressive mosaics and murals. It also highlights the Transfiguration of the Saviour Church, a typical example of Byzantine architecture from around 1340, adorned with depictions of Christ's Ascension. Additionally, the Rotunda, built in 306 AD, is noted for its massive dome and preserved mosaics, which were later converted into a mosque. The surrounding area includes the small church of Agios Georgios, further enriching the historical context of these monuments."", ""Thessaloniki, founded in the 4th century BC, has maintained its urban character as a civic center influenced by various empires and multicultural groups. Its rich history includes Roman, Byzantine, and Ottoman rule, with contributions from Jews, Latins, Armenians, and Greeks. The city's numerous historical monuments reflect its cosmopolitan nature. The White Tower area is a bustling part of Thessaloniki, where the old seafront meets the new waterfront."", 'The text describes various historical and cultural sites in Thessaloniki, including the impressive complex of 14 listed industrial buildings from 1854, originally owned by the French and later by the Allatini family. It mentions the Vafopouleio Cultural Centre, inaugurated in 1983, which hosts art exhibitions, performances, and has three libraries. The Ouziel quarter features picturesque semi-detached houses built for tramway workers, now a protected architectural monument. Sofouli Street connects eastern districts with Kalamaria, lined with trees, shops, and offering views of the city. Vasilissis Olgas Avenue, once a favorite promenade, is noted for its green surroundings along the waterfront.', ""Thessaloniki offers various outdoor activities such as hiking and mountain biking in the suburban forests of Seich Sou and Chortiatis, as well as relaxing by the Deltas of Gallikos and Axios-Loudias-Aliakmonas rivers. Educational programs for children are available in most museums, particularly at the unique Children's Museum. The Noesis Science Centre and Technology Museum provides fun and educational experiences related to science and technology. Visitors can also explore the Environmental Dinosaur Theme Park and the Mammoth Museum. For beach lovers, there are beautiful seaside options in Thessaloniki and Halkidiki. Families can enjoy the Magic Park, Greece's largest amusement park, and WaterLand, which features various water attractions."", 'The text describes various historical and cultural sites in a city, focusing on Agia Sofia Square, which features greenery and is shaped by the 1890 fire. It highlights the pedestrianized Agias Sofias Street, notable buildings like the Longos Building and Chatzidimitriou Building, and the monument commemorating the Genocide of Pontic Greeks. Navarinou Square is presented as a vibrant student area with cafés, bars, and cultural venues, along with a fountain and playground. The area also includes shops selling books, records, and antiques, and encourages visits to the nearby church of Nea Panagia, dating back to 1727.', 'The text describes day excursions from Thessaloniki, highlighting the monastic state of Mount Athos, which features 20 inhabited monasteries and is a UNESCO World Heritage site. It provides directions to Petralona Cave, located 53 km southeast of Thessaloniki, accessible by coach and taxi or by car. Additionally, it mentions the Lakes Area northeast of Thessaloniki, a National Park with diverse ecosystems ideal for outdoor activities. The area is managed by an agency that offers tours, and visitors are encouraged to try local fish dishes. Lastly, it notes the town of Lagadas, known for its fire-walking custom and modern spa facilities with historical Byzantine bathtubs.', 'The text describes two museums: Noesis and Gerovassiliou Wine Museum. Noesis focuses on interactive learning with exhibits like a car exhibition, a planetarium, a cosmotheatre, and a virtual reality simulator. It also offers educational programs on renewable energy and science. The Gerovassiliou Wine Museum, established in 2008, showcases the history of wine-making and features collections that illustrate the journey of wine, food pairings, and wine-making equipment. Both museums emphasize visitor engagement and education.', 'Thessaloniki offers various tourism services including an Info Point at Aristotelous Square, open Mon-Fri from 9 am to 5 pm. The Thessaloniki Tourism Organisation provides information and assistance, reachable at 2310 279.282 or via email at welcome@thessaloniki.travel. The Tourist Police, available at 1571, assists tourists with information and minor disputes. The city has over 130 hotels with a capacity of approximately 13,000 beds, and inquiries can be made through the Thessaloniki Hotels Association. For conferences, the Thessaloniki Convention Bureau can be contacted for well-equipped venues. Organized excursions can be arranged through local travel agencies, and car rental services are available through the Car Rental Agencies Association. Yacht charters can be organized via the Hellenic Yacht Brokers Association.', 'The text describes the historical and cultural significance of suburbs and outskirts of Thessaloniki, including ancient tombs and a Neolithic settlement. It provides directions to Kalochori via bus or car. Kalamaria, a prominent suburb, features green spaces and a shopping center, with a history of Greek refugees settling there in the 1920s. Key sites include Sofouli Street, the Little Palace (formerly a royal residence), and the Kodra former military camp, which is being transformed into a park. Excavations in Kodra revealed an ancient settlement, possibly linked to Ancient Thermi.', ""The Museum of Greek Children’s Art showcases the creativity of children, depicting Greek history, tradition, and culture through their artwork. It is one of the few museums worldwide dedicated to children's art."", ""Egnatia Street is a historic avenue in Thessaloniki, dating back to Roman times, connecting Dyrrhachium and Constantinople. It runs from Dimokratia Square to the TIF grounds and the Aristotle University, serving as a bustling shopping area with notable eclectic and art deco buildings. Key attractions include Kolomvou Square, a lively hub with cafés and bars, and the Hamza Bey Mosque, built in 1467, which is currently undergoing renovations for an exhibition. The street splits the city's historic center and features important monuments worth observing."", ""The text describes various cultural and historical sites in Thessaloniki, including a small museum dedicated to the founder of modern Turkey, the Teloglion Foundation of Art with its modern facilities, and the Kaftanzogleio Stadium, which was the largest in Greece until 1982 and is home to the city's oldest football team, Iraklis. The stadium also hosted events during the 2004 Athens Olympic Games and is near the Olympic Museum."", 'The area along NEA PARALIA features 12 Theme Gardens covering 76,657 m2, ideal for leisure activities. Notable gardens include the Garden of Alexander, Garden of the Seasons with an amphitheater, and the Garden of Music for events. A 3 km cycle path is available, along with the Nautical Club of Thessaloniki. The Thessaloniki Concert Hall, inaugurated in 2000, is inspired by Byzantine architecture and hosts various performances and conferences. It includes a main hall for 1464 attendees and a neighboring building with additional facilities. The Depot Area, named after historic tram depot buildings, retains traces of its older atmosphere. The Allatini Mills and the church of Saints Cyril and Methodius are also significant sites in the area.', ""The Historic Centre features archaeological sites from the late Roman period, including shops from the 1st to 13th century and the underground Museum of the Roman Forum. A restored Odeon from the 2nd-4th century AD is now used for cultural events, alongside a mint and archive office. A round bathhouse dating back to the 1st century BC was also discovered, along with various artifacts like mosaics, sculptures, and coins. The forum is notable for the 'Enchanted Ones,' a two-storeyed colonnaded archway with surviving Corinthian columns, which were relocated to the Louvre in 1864. Bit-Pazar, a vibrant market area with antique shops and restaurants, was built in the 1930s and has become popular among students. Nearby, the Jewish Monastirioton Synagogue is the only one to survive World War II. The Experimental School, designed by architect D. Pikionis, was constructed from 1936 to 1938."", ""The phrase 'Follow Greece Everywhere' suggests a strong interest or commitment to exploring and engaging with Greek culture, history, and lifestyle in various contexts."", ""Thessaloniki has a rich history marked by the settlement of various communities, particularly from the Iberian Peninsula, and a period of harmony among ethnic groups from the 16th to 18th centuries. The city evolved into a significant trade center by the 18th century and became more cosmopolitan with railway connections established in the late 19th century. Major events include a devastating fire in 1890, the Greek army's seizure of the city in 1912 after five centuries of Ottoman rule, and a significant fire in 1917 that led to extensive rebuilding. The city faced challenges during the Asia Minor Catastrophe in 1922-1923, receiving many Greek refugees. The German occupation in 1943 resulted in the tragic loss of a large portion of the Jewish population. Thessaloniki experienced a severe earthquake in 1978, and later, in 1997 and 2014, it was recognized as the European Capital of Culture and the European Youth Capital, respectively."", 'The Macedonian Museum of Contemporary Art features a permanent collection of 1,800 works by notable Greek and foreign artists and has hosted over 100 exhibitions. The museum also has a library with over 2,500 specialized titles. The Teloglion Foundation of Art, established in 1972, houses a significant collection including Hellenistic statuettes and works by renowned 19th and 20th-century artists, along with hosting temporary exhibitions and educational programs. The Municipal Gallery displays over 1,000 artworks, focusing on Thessalonian artists from 1898 to 1967, and is part of the cultural offerings in Thessaloniki, which also includes the Society for Macedonian Studies and the Thessaloniki Cinema Museum.', 'The text describes various historical sites, including the Sanctuary of Isis, which is half-sunk in water and dedicated to the Egyptian goddess. It also mentions the Sanctuary of Olympian Zeus, completed in the Hellenistic period, featuring a large altar and Roman theatre. The Hellenistic Theatre, built in the 3rd century BC, hosts modern events today. The Sanctuary of Asklipios, active until the 3rd century AD, is noted for a statue of the goddess Hygeia. Additionally, the Cemetery Basilica from the 5th century is described, along with fortified walls originally constructed by Cassander, which have been reconstructed over time.', 'The historic centre features a museum with exhibits of ancient human skulls, including those from the Axios river and Petralona Cave. Notable sites include the Observatory, built in 1954, and Agiou Dimitriou Street, one of the oldest roads in the city, surrounded by Interwar Period architecture. The area has seen an influx of Eastern European emigrants who have opened shops and restaurants, adding diversity. Key attractions include the Dioikitirio, a neoclassical building from 1891 that now houses the Ministry of Macedonia-Thrace, and the Agios Dimitrios church.', 'The text describes several historical sites in the historic center, including Yeni Hamam, built in 1531, which served as a bathing place until 1944-45. Alaca Imaret, constructed in 1484, features skilled masonry and is occasionally used for cultural events. The Profitis Ilias Church and Panagia Lagoudiani Church, a 14th-century Byzantine basilica, are also mentioned, with the latter honoring the Virgin Mary and Saint Demetrius. Additionally, the Ataturk Museum, located in the former residence of Kemal Ataturk, showcases his life and includes a café. Lastly, Kaftanzogleio Stadium is noted as the largest stadium in the city.', 'Epanomi is a picturesque town 25 km SE of Thessaloniki, known for its beautiful beaches and a wetland that hosts over 80 bird species. The Gerovassiliou Wine Museum, unique in northern Greece, is located nearby. Nea Michaniona, a major fishing center 32 km S of Thessaloniki, features the largest fleet of deep-sea fish boats in Greece and a vibrant seafront with cafés and tavernas. Angelochori, a small village near Nea Michaniona, offers stunning views of the Olympus massif and historical Ottoman architecture. The area is also recognized for its high-quality beaches, such as Tourbani and Angelochori, which have received Blue Flag awards.', 'This text provides essential information for visitors to Thessaloniki, Greece, including contact details for the Greek National Tourism Organisation (GNTO) and the Ministry of Foreign Affairs. It lists various Greek acronyms relevant to tourists, such as E.O.T. for the GNTO and K.T.E.L. for intercity bus services. The text mentions the use of 220V electric current in Greece and highlights free wireless internet access in public areas. It also details the operating hours and locations of post offices in the city. Emergency phone numbers for police, fire brigade, and medical services are provided, along with contact information for tourist information services.', ""Thessaloniki boasts a rich culinary tradition influenced by Byzantine, Ottoman, and various European cuisines, shaped by its multicultural history. The city's gastronomy features traditional tavernas and restaurants that creatively blend local dishes with gourmet elements. Notable delicacies include gyro, souvlaki, patsa, and a variety of seafood dishes. Desserts play a significant role, with popular items like bougatsa, galaktompoureko, and syrupy pastries originating from Istanbul. Koulouri Thessalonikis, a sesame-covered bread, is a common snack sold by street vendors. In winter, locals enjoy salep, a unique hot beverage."", 'Thessaloniki is a city in Greece known for its rich history, vibrant culture, and significant role in the Byzantine Empire. It is the second-largest city in Greece and features a mix of ancient and modern architecture, including Roman ruins and Ottoman-era structures. The city is also famous for its festivals, culinary scene, and lively waterfront.', 'The text mentions Thessaloniki and its neighboring areas, but does not provide further details or context.', 'Thessaloniki offers various sports facilities, including an 18-hole golf course at Porto Carras Grand Resort and proximity to several ski centers. Notable ski centers include Seli, Elatochori, 3-5 Pigadia, Lailias, Vora, and Falakro, each with different elevations, runs, and amenities. Information for each ski center, including contact details and websites, is provided. Additional resources for tourists include websites for the Municipality of Thessaloniki, archaeological sites, and weather forecasts.', ""The Thessaloniki State Symphony Orchestra, established in 1959, is one of Greece's premier orchestras, performing at the Thessaloniki Concert Hall. The city also offers summer open-air cinemas where films are screened with Greek subtitles. Thessaloniki has a rich sports tradition, hosting major events like the 2004 Olympic Games and various international competitions. Numerous sports facilities are available, including the Kaftanzogleio National Stadium and Poseidonio Sports Centre. The Megas Alexandros International Marathon occurs annually, starting in Ancient Pella and finishing in Thessaloniki. Information on local sports facilities and events can be obtained from the municipality's departments."", 'The text provides a comprehensive overview of Thessaloniki, detailing various church denominations, museums, cultural exhibitions, sports facilities, public transport options, and traditional markets. It lists notable churches such as the Orthodox Metropolitan Church and the Armenian Orthodox Church, alongside museums like the Archaeological Museum of Thessaloniki and the Jewish Museum. Cultural venues include the Thessaloniki International Trade Fair and several theaters. Sports facilities mentioned include the Alexandreio Sports Arena and various football grounds. Public transport options include a long-distance bus station and a new railway station, while traditional markets like Kapani and Modiano are also highlighted.', ""This publication by the Greek National Tourism Organisation, supervised by Angela Varela and coordinated by Eleni Mitraki, features contributions from various professionals including journalist Yannis Ragos and translator Angeliki Christopoulou. It includes photo credits from multiple photographers and is designed by Zoe Tzomentzidou. The publication is not for sale and is available through the Greek National Tourism Organisation's website."", 'Asprovalta and Nea Vrasna beaches offer marine sports and beach volleyball facilities, with Asprovalta beach being 10 km long and awarded a Blue Flag. Stavros is the largest harbor in the area, while the villages of Vrasna and Ano Stavros feature traditional architecture. To reach these locations from Thessaloniki, take bus lines 83, 83M, or 83N to Lagkadas, or travel by coach or car towards Panorama and Kavala. Pikrolimni, located in the Kilkis region, is a shallow lake known for its healing mud with properties three times more concentrated than the Dead Sea. The first Mud-therapy Centre in the Balkans is in nearby Xylokeratia, offering various wellness facilities. Visitors can enjoy mud therapy by the lake in summer, and the center includes a physiotherapy clinic, hotel, restaurant, and sports fields. Pikrolimni is accessible by car or a daily bus from Thessaloniki.', 'The Palace of Galerius is an open-air archaeological museum in the historic center, constructed in the late 3rd to early 4th century. It is part of the Galerian Complex, which included significant structures like the Hippodrome and Rotunda. The palace served as a residence for emperors until its destruction in the 7th century and is a major monument of Late Antiquity. Key features include the Octagon, an audience hall with elaborate decoration; a colonnaded yard; a two-storeyed tank for water collection; a monumental Basilica used for official gatherings; and a bathhouse with various bathing facilities.', ""Eptapyrgio, built in the 12th century on an older fortress, features ten towers and remnants of Early Christian walls. The structure underwent modifications by the Ottoman Turks in 1431 and later became a prison in 1890. In 1989, it was transformed into a monument for visitors. Nearby, Palaeologina's Gate, constructed in 1355, leads to Trigoniou Tower, built in the 16th century. This area, known for its breathtaking views, is a popular spot for both locals and tourists."", ""Thessaloniki's Old Town, untouched by the 1917 fire, features a mix of Macedonian and Ottoman architecture. It became populated in the mid-15th century when the Ottomans settled there due to its favorable climate and strategic location. The area retains its original town planning with narrow alleys and squares, attracting artists and students in recent years. Architectural styles include neoclassical and eclectic motifs, particularly in residences of the Dönmeh. Despite modern developments, the Old Town has preserved much of its historical character."", 'The 6th walk along NEA PARALIA – VASILISSIS OLGAS AVENUE showcases a busy street with impressive late 19th to early 20th-century buildings. Notable sites include Allatini Villa, built in 1898, which served various purposes over the years, including housing the University of Thessaloniki and a military hospital. Casa Bianca, constructed in 1912, features eclectic and art nouveau elements and now hosts a branch of the Municipal Art Gallery. The Nehama Villa, built in 1907, is another significant structure on the avenue. Lastly, the Mordoch Villa, established in 1905, has a rich history, including use as military barracks and a polyclinic, and currently houses the Municipal Art Gallery.', ""The Historic Centre, built in 1866 by Sultan Hamid, was originally outside the east walls and restored in 1977 after modifications during the Interwar Period. Aristotle University of Thessaloniki (AUTH) is Greece's first university campus, established on the site of an old Jewish cemetery, with construction starting in 1938 and resuming in the 1950s. The campus features modern architecture by prominent Greek architects and accommodates over 100,000 students, making it the largest in Greece. Notable sites include the Old Building of the Faculty of Philosophy, constructed in 1887, and various museums showcasing ancient sculptures and Byzantine art."", ""The Yeni Camii, built in 1902 by architect V. Poselli, served as a mosque for converted Jews and later housed the city's Archaeological Museum. It now functions as a municipal exhibition area with a collection of Roman and Early Christian sculptures. The Hatzimisef Villa, located on Vas. Olgas Ave., was the town's first high school, while the Joseph Modiano villa nearby is currently uninhabited. A bust of King George I, assassinated in 1913, stands at the corner of Vas. Olgas Ave. and Agias Triadas St., crafted by K. Dimitriadis in 1915. The Ivan Hatzimisef Villa, built in 1897, now hosts cultural events and an organic food market. Additionally, the building at 34-36 Evzonon Street features classical, baroque, and renaissance architectural styles."", ""Lake Koroneia, also known as Lake Agios Vasileios, has significantly decreased in size and depth due to climate conditions and water resource exploitation. Nea Apollonia, a historic village near Lake Volvi, features mineral springs with therapeutic properties and modern health facilities. Lake Volvi is Greece's second-largest natural lake and a Ramsar site, offering birdwatching and various water sports. The area around Volvi includes tourist attractions and communities like Megali Volvi, Mikri Volvi, and Rentina, which is known for its natural beauty and historical ruins."", ""The text describes various historical and cultural sites in Thessaloniki, including the Greek Highschool built in 1893 and the Transfiguration of Christ Church, established in 1840 on the site of a 1543 chapel. The church features an icon screen depicting the Annunciation, with elements dating back to 1843 and 1943. It also mentions the Thessaloniki International Fair (TIF), inaugurated in 1926 and relocated in 1940, which has modern convention centers designed by notable Greek architects. Additionally, the Macedonian Museum of Contemporary Art, established in 1979, is highlighted as Greece's first modern art museum, showcasing modern sculptures and ancient artifacts."", ""The historic centre of Thessaloniki features industrial architecture from the late 19th century, including six warehouses built in 1910, which were revamped in 1997 for cultural events. These warehouses now house various institutions such as the International Film Festival, the Thessaloniki Cinema Museum, and the Centre of Contemporary Art. The Customs House, built in 1910, serves as the city's passenger board station and showcases early 20th-century French architectural influence. The Ladadika area, spared from the 1917 fire, dates back to the 16th century and was known for its wholesale trade, particularly spices and olive oil. The street layout remains largely unchanged since the late 19th century, with many buildings constructed from industrial brick and wood."", ""The Military Museum of the Balkan Wars, located in Gefyra village near Thessaloniki, showcases the area's history with rare relics and authentic furniture from the time of the Greek army's headquarters in 1912. Giannitsa, a modern town with a population of 35,000, features significant Ottoman monuments, including the mausoleum of Gazi Evrenos and the 14th-century hamam. The town is known for its cultural heritage and outdoor activities in nearby green areas. Notable sites include the clock tower and various mosques, reflecting the rich history of the region."", 'Thessaloniki offers a vibrant nightlife with clubs and venues, especially in the summer when many move to open-air locations. Popular areas include Kalamaria and Peraia. The city hosts numerous artistic events year-round, featuring venues like the Thessaloniki Concert Hall and various theaters. Cultural activities include the International Film Festival and the Thessaloniki Book Fair. The Thessaloniki Regency Casino operates 24/7, requiring guests to be 25 or older. Additionally, traditional products like koulouri and trigona Panoramatos are notable in the region.', 'The exhibition showcases Byzantine life, art, and culture from the early to post-Byzantine periods, organized by thematic categories. It includes sections on the Early Christian period, Middle Byzantine period, Late Byzantine period, and Post Byzantine period, each with specific rooms dedicated to various aspects of life and culture. The exhibition also features private collections, including the D. Papastratos Collection with religious art and the D. Oikonomopoulos Collection with a diverse range of artworks. The Jewish Museum of Thessaloniki is mentioned, highlighting its permanent exhibits related to Jewish history.', ""The Archaeological Museum of Thessaloniki displays significant art and artifacts from Macedonia, spanning from prehistoric times to late antiquity. The exhibits are categorized into six sections, including the origins of towns, the evolution of Macedonia from the 7th century BC to late antiquity, and the historical significance of Thessaloniki. Notable displays include exceptional gold craftsmanship from cemeteries, a reconstruction of an archaic temple, and unique items like the Derveni papyrus. The museum highlights the region's rich cultural heritage and its transition through various historical periods."", ""Thessaloniki hosts several cultural institutions, including museums and galleries showcasing Greek art. The collection features works by prominent Greek artists, Byzantine icons spanning five centuries, and Greek engravings. The Gallery of the Society for Macedonian Studies is the city's first visual arts museum, displaying 300 pieces from major 20th-century art movements. The Cultural Centre of Thessaloniki organizes exhibitions in collaboration with local agencies, featuring around 250 pieces of various art forms. The Thessaloniki Cinema Museum, established in 1997, highlights the history of Greek cinema through exhibits categorized into six timelines."", ""The text describes various historical and cultural sites in Thessaloniki, including the Holy Twelve Apostles Church and the remnants of the city's west walls, particularly the Litaia Gate. It highlights the Pasha Hamam, an Ottoman bathhouse built in the 1520s, which was the last of its kind in the area until its closure in 1981. The west of the harbour area saw significant growth in the late 19th century due to the demolition of city walls and the development of industrial units, which have since been transformed into cultural and entertainment venues. Notable sites include the Vilka multi-purpose venue, formerly a textile factory, and the Mylos venue, popular for events. The Moni Lazariston complex houses the State Museum of Contemporary Art, showcasing the area's cultural evolution."", 'The text provides contact information and websites for various museums and cultural institutions in Thessaloniki, including the Thessaloniki Cinema Museum, Museum of Photography, Olympic Museum, and more. It lists their addresses, telephone numbers, and websites, facilitating access to cultural resources. Additionally, it mentions a collaboration among five museums in Thessaloniki aimed at promoting cultural activities and organizing exhibitions. This collaboration includes the Archaeological Museum, Museum of Byzantine Culture, State Museum of Contemporary Art, Macedonian Museum of Modern Art, and the Teloglion Foundation of Art.', 'The text describes various historical and architectural sites in Thessaloniki, including the Jewish Museum housed in a 1904 building, Venizelou Street known for its eclectic and art deco styles, and the Pazar (Yahudi) Hamami, a 16th-century bathhouse. It highlights the architectural significance of the Gategno-Florentin Building and the Chamber of Commerce & Industry, showcasing neoclassical design. The area is also noted for its vibrant marketplace, including an open-air flower market known as Louloudadika.', 'The text describes two significant Byzantine monuments in the city. The first is the Moni Latomou, an early cross-in-square domed church from the 5th or 6th century, notable for its ceiling mosaics depicting the Vision of Ezekiel and a minaret entrance from its later conversion to a mosque. The second is Moni Vlatadon, the only active Byzantine monastery in the city, founded in the 14th century, featuring a unique church structure and significant murals from the 14th and 17th centuries. It also has a large garden with views of the city and additional facilities like a library and a bookstore.', 'Thessaloniki is a city in Greece known for its rich history, vibrant culture, and significant role in the Byzantine Empire.', 'The text describes the historical development of the area known as Nea Paralia in Thessaloniki, which began to grow in the late 19th century after the demolition of city walls and the introduction of tramways. Initially named Exoches due to its rural character, it became a luxury residential area with diverse nationalities coexisting. However, from the 1930s, the area declined and transformed into a typical urban setting by the 1960s. Today, Nea Paralia stretches along Megalou Alexandrou Avenue and is popular for leisure activities, offering scenic views of the Thermaic Gulf and Mount Olympus, especially at sunset. Notable landmarks include the statue of Alexander the Great and the artistic installation of umbrellas by N. Zongolopoulos.', ""Thessaloniki, an early center of Christianity, was significant during the Byzantine period, housing numerous Christian monuments and churches. These structures, built between the 4th and 15th centuries, have been recognized as UNESCO World Heritage Monuments since 1988. The Holy Twelve Apostles Church, one of the oldest, was constructed between 1310 and 1314 and served as the main church of a monastery. The church features murals and iconography depicting the life of the Holy Virgin. A tour of Thessaloniki's Byzantine monuments offers a unique experience, showcasing the city's rich historical and cultural heritage."", 'The text describes various notable locations in Ano Poli, Thessaloniki. Tsitsani Square features a bust of composer V. Tsitsanis and is surrounded by well-tended houses. Eptapyrgiou Street runs along the northern city walls, showcasing traditional buildings and the old Zihne Camii mosque. Moni Vlatadon is mentioned as a point of interest. Portara is one of the main gates of the northern city walls, adorned with ceramics and inscriptions. The Acropolis, specifically Eptapyrgio (Yedi Kule), is highlighted as a significant fortified area within the city walls. The area is popular among both residents and tourists.', 'The text provides information about various churches in Thessaloniki, including their addresses and contact numbers. It also highlights cultural events such as Demetria, an autumn festival featuring theatrical and musical performances, and the Thessaloniki International Film Festival, which has been held since 1960 and showcases films from various sections. Additionally, it mentions the Thessaloniki International Fair (T.I.F.), a significant trade fair in the Balkans that has been taking place since 1926, presenting Greek industry and entrepreneurship. Contact information for cultural offices and event organizations is also included.', ""Thessaloniki was founded in 315 BC by Cassander, named after his wife, and became a significant city under Roman control by 168 BC. It served as the capital of the Roman province of Macedonia by 148 BC and was connected to the wider world through the Via Egnatia around 130 BC. The city was declared a 'free town' in 42 BC and hosted Apostle Paul's visits. In the late 3rd to early 4th century AD, it became the seat of the eastern Roman Empire under Galerius. The city faced various raids but was protected by its walls. It experienced a golden age from 1300 to 1430, marked by cultural and economic growth. Thessaloniki changed hands multiple times, falling to the Venetians in 1423 and the Ottoman Turks in 1430, while also having a significant Jewish population in the 15th century.""]"," Unfortunately, the context information doesn't provide a direct comparison between museums in Thessaloniki. However, based on the information provided, the following general observations can be made:

* The Thessaloniki Cinema Museum and the Museum of Photography of Thessaloniki are located in the same building, Warehouse A (harbour).
* The Olympic Museum is located in a specific building, Agiou Dimitriou & 3rd Septemvriou Sts.
* The Jewish Museum of Thessaloniki is a separate entity, with its own location (not specified).
* The Archaeological Museum of Thessaloniki and the Museum of Byzantine Culture are not directly compared in the context information.
* The Macedonian Museum of Contemporary Art is not directly compared in the context information.

A more detailed comparison between the museums is not possible based on the provided context information. However, it appears that the museums in Thessaloniki are spread across different locations and have different focuses.","The text describes various museums in Thessaloniki, highlighting their unique collections and contributions to the cultural landscape of the city. It mentions a cinema museum, a photography museum, the Olympic Museum, and the 'Christos Tsiggiridis' Radio Museum, each offering educational programs and temporary exhibitions.",1.0,0.35,1.0,0.737292644229559,0.0,0.23095238094468254,0.0,0.49999999916666665,,0.0
17,"How do the various cultural heritag sites and their historical significans in Thessaloniki compare across differnt reports, particularly focusin on landmarks like the Historic Centre, traditonal restaurants, and notable musems?","['AG. SOFIAS\nMFEI\nSQ.\nSYNTRIVANIOU\nSQ.\nNAVARINOU\nSQ.\nSQ.\nLYSSIATREIO\nTHEA\nCANC\nGENERAL\nHOSPITAL\nOF THESSALONIKI\nG. GENNIMATAS\nUNIVERSITY\nGENERAL\nHOSPITAL\nOF THESSALONIKI\nAHEPA\n   INFECTIOUS\n  DISEASES\nHOSPITAL\n3rd walk: \nHISTORIC CENTRE (2)\nMUSEUM AREA\nThe area is considered  \nas one of the most privileged \nplaces downtown on account \nof its proximity to the beach;  \nit is traditionally regarded as \nthe residential area of the \nwell-to-do. There are many \nwell-known shops here, green \nspots, as well as some of the \nmost important museums  \nand cultural institutions.\n1 \t\x07\nTHE WHITE TOWER \nAREA\nThis central location is where \nmajor city roads meet (Nikis \nAve, Megalou Alexandrou Ave., \nPavlou Mela, Ethnikis Amynis, \nGermanou) and where the old \npart of the waterfront meets \nthe new one. It affords a lovely \nview of the sea; there are \ngreen areas and many shops, \ncafés and bars.\nMUST SEE:\n1.1  The White Tower.\nThis is the city’s most \nfamous landmark - \nmonument.', '97\nNIGHTLIFE\nNIGHTLIFE\nThessaloniki is well known \nfor the intense nightlife and \nthe diverse options offered \nto visitors. Some say that \nthis is the greek ‘capital’ of \nentertainment as many trends \nand new fashions spread \nout from this town in the \nlast decades and were later \nadopted across the country. \nRanking high in the list of \noptions are the numerous bars \n(most of them with an avant-\ngarde design), tavernas, ouzo \nrestaurants (called ouzeri), \nmodern cuisine restaurants, \nclubs with live greek music, \nparticularly those playing \nrebetiko - a typical genre of \ngreek popular music which \ngrew to new heights in this \ntown – seaside bars and music \nstages. \nIn the city centre, Ladadika \n(see p. 18) has been a \nfavourite nightlife area \nsince the early 1990s; the \nneighbouring Kalapothaki \nStreet (see p. 17), the cafés \nand bars by the old beachfront \n(see p. 16) and the modern \nrestaurants and bars housed \nin the historic city arcades all \nadd to the picture. Worthy of \nnotice are also the tavernas in \nthe traditional town market \nplaces (see p. 21), the bars and \nthe cosy, elegant restaurants \nlining the bustling city streets \n(see p. 27), as well as the area \nbetween Zefxidos and Iktinou \nStreets (see p. 28).', '7\n«…There is a homeland for everyone,  \nwhile there is Thessaloniki»\nNikiforos Choumnos, \n14thc. Byzantine dignitary and a scholar.\nNowadays, the historic capital -by right- of Macedonia, \nthe land of Alexander the Great, has evolved into a modern \nand particularly charming metropolis. A multitide of \nmonuments and cultural assets and the town’s traditional \nways exist in harmony with the modern aspects and the \nhigh standard infrastructure, the carefree mood, the spirit \nof hospitality, the vitality of the locals – particularly the \nyoung – setting the pace of town life, the diversity of \nartistic events, the long list of choices for entertainment, \nthe exceptional culinary tradition, and the fresh feel in \nthe atmosphere, coming from the seafront, as well as the \ncoolness of the northwest wind called Vardaris.   \nThessaloniki’s location is at the centre of a greater area \nwith incomparable historical monuments and natural assets \nas it offers the opportunity for a visit to archaeological \nsites known the world over (Ancient Pella, Vergina, Dion, \nPetralona Cave), to areas of exquisite nature (river deltas, \nlakes, Mt Olympus), to the monastic state of Agion Oros \n[the Holy Mountain] as well as to Halkidiki, a famous tourist \ndestination. And there is always an opportunity to practice \nsports (swimming, skiing, playing golf etc) or to indulge in \nwellness tourism (hot springs, spas)!\nIn short, Thessaloniki is a city that can cater for even the \nmost demanding needs, any time of the year.', 'The monumental style of \narchitecture is shown in the \nbuildings’ facades, colonnades, \narcades and porticos, which \ncombine elements from the \ncity’s Byzantine tradition \nwith European interwar \nperiod motifs. The square is \nlandmarked by two identical \nconcave buildings: Electra \nPalace hotel (late sixties) - \nbuilt by GNTO architects -  \non the west side, and Olympion \non the east side, which was \nprogressively erected and \ncompleted by the late fifties \n(designed by J. Moshé) \nand is now the seat of the \nThessaloniki Film Festival  \n(see p. 108).\nMUST SEE:\n1.1  Aristotelous Street.\nPedestrianised historic \nboulevard, that ends in Egnatia \nStreet (see p. 34). According \nto the Hébrard plans, it would \n2nd walk: \nHISTORIC CENTRE (1) \nTRADITIONAL COMMERCIAL CENTRE\n4.1\n6.1\n6.3\n6.2\n6.5\n6.6\n6.7\n1.1\n1.2\n6.8\n7.5\n7.3\n7.2\n7.2\n7.1\n7.4\n6.4\n3.1\n1\n2\n3\n4\n5\n7', 'Today, this is one of \nthe top places in Thessaloniki, \ncrossed daily by thousands of \nlocals and visitors. One side \nof the avenue is lined with \ncafés and cosy little bars and \nthe opposite wide pedestrian \narea next to the sea gets \nfilled with strollers, cyclists, \nstreet artists and vendors. \nAmong the modern blocks of \nflats, you will see some of the \ncity’s major landmarks: past \nEleftherias square, the three-\nstorey interwar period mansion \nwhere Olympos-Naousa a \nonce popular restaurant used \nto be; Aristotelous square; \nKoniordou Mansion (at the \ncorner with Kar. Dil street); \nTyroloi Mansion built during \nthe Interbellum (located \nbetween Kar. Dil and Agia Sofia \nStreets), where Tottis coffee \nshop used to be for many \nyears; Mandalideio Mansion \n(1931) and Exarchopoulos \nMansion (1935) - the two \nlast ones are situated at the \njunction with Vogatsikou \nstreet; at 63, Nikis Avenue \nyou will see the three-storey \nbuilding of the Thessaloniki \nClub (1926); at number 73, \nPallas, an old cinema theatre, \nhouses the State Orchestra of \nThessaloniki.\n2nd walk: \nHISTORIC CENTRE (1)\nTRADITIONAL COMMERCIAL CENTRE\n10.  \nBustling Nikis \nAvenue and \nthe White \nTower in the \nbackground.\n10', '62\n7th walk: \nWEST OF THE CENTRE-STAVROUPOLI\nLazare church in Paris, which \nwas the seat of the order. \nAt times, the building was \nused as a hospital and a \nrefugee hospitality centre. \nIn 1980 it was declared a \nhistoric monument and a \nwork of art and in 1997 it \nwas fully renovated in order \nto accommodate the needs \narising from the European \nCapital of Culture events in \nThessaloniki. Since then it has \nbeen used as a multi-purpose \ncultural and entertainment \nvenue, as two halls of the \nNational Theatre of Northern \nGreece (N.T.N.G., see p. 109) \na Cultural Centre, a café-\nrestaurant and a bar are \nhoused here. Outdoor space \ntheatrical performances, \nconcerts and other events \nalso take place in the \npremises. The State Museum \nof Contemporary Art is \nhoused in one of the older \nstructures, covering an area \nof 3,270 m2 (for museum \ncollections, see p. 75). \n4.3  Kapnapothikes \n[Tobacco warehouses].\nFive old tobacco warehouses \n(tobacco shops) still stand \nin the area, as reminders of \nthe city’s booming tobacco \ntrade from the mid-19th c. \nuntil 1990. Most of them were \nbuilt in the Interwar Period and \nbear art deco and Bauhaus \narchitectural features.', '39\n4th walk: \nHISTORIC CENTRE (3)\nMuseum houses exhibits  \nof human skulls, known \nworldwide to have been found \nin the area of Axios river \n(aged 9.5 million years) and \nin the Petralona Cave (see p. \n92), aged approx. 200,000 – \n400,000 years. Other similar \nplaces are the Biblical, \nFolk Art, and Criminology \nMuseums, noteworthy theatre, \nModern Greek literature and \nEducation Academy archives, \nand also collections of \nmanuscripts, books etc.\n2.3  Observatory.\nOne of the finest buildings \nof the A.U.Th. complex is this \none, constructed in 1954 to \nplans by I. Triantafyllides; its \ncircular shape bears a direct \nreference to Rotunda.\n3 \t\x07\nAGIOU DIMITRIOU \nSTREET\nThis large road in the \nnorth section of the historic \ncentre is one of the oldest \nin the city. There are many \na beautiful block of flats \ndating to the Interwar Period \nin the surrounding area, that \nhave survived the postwar \nincreased building activities, \nparticularly on Pasteur, Profitis \nIlias and Kameniatou Streets. \nIn recent decades, emigrants \nsettled in Kassandrou Street \nand the neighbouring area, \nmostly coming from Eastern \nEurope, and opened shops and \nsmall restaurants, adding a \nmultinational colour to the area.\nMUST SEE:\n3.1  Dioikitirio.', ': \x0723210 58.783 (Ski Centre),  \n23210 62.400 (mountain hut)\nwebsite: www.katafigiolailias.gr \nVora Ski Centre \n(Kaimaktsalan).\nThis is the highest location \nfor a ski centre in Greece \n(elevation: 2,480 m.). There \nare 6 lifts, 13 runs (total \nlength: 15 km), 4 ski trails and \nsnowmaking machines. It lies \n118 km NW of Thessaloniki  \n(33 km NW of Edessa town).\nInformation: \ntel.: 23810 32.000 \nwebsite: www.kaimaktsalan.gr. \nFalakro Ski Centre.\nThere are 9 lifts and 20 runs \n(total length exceeds 20 km). It \nlies 190 km NE of Thessaloniki \n(43 km N of Drama town).\nInformation: \ntel.: 25220 41.822 \nwebsite: www.falakro.gr\nWEBSITES\n* Municipality of Thessaloniki: \nwww.thessaloniki.gr\n* Information on \narchaeological sites, \nhistorical monuments  \nand museums: \nhttp://odysseus.culture.gr\n* Virtual tourist guide for \nThessaloniki-Halkidiki:  \nwww.thessaloniki360.com\n* Hellenic National \nMeteorological Service \n(weather forecast):  \nwww.hnms.gr\n* Athenian-Macedonian  \nNews Agency: www.amna.gr\nINFORMATION', '5\nCONTENTS\nThessaloniki\t\n4\nThe history of Thessaloniki\t\n6\n1st walk: \n\t  UNESCO Byzantine Monuments\t\n8\n2nd walk: \n\t Historic Centre (1) - Traditional commercial centre\t\n15\n3rd walk:  \n\t Historic Centre (2) - Museum area\t\n24\n4th walk:   \n\t Historic Centre (3)\t\n34\n5th walk:  \n\t Ano Poli (Old Town)\t\n42\n6th walk: \n\t Nea Paralia – Vasilissis Olgas Avenue\t\n50\n7th walk: \n\t West of the Centre-Stavroupoli \t\n58\nSuburbs and city outskirts\t\n63\nMuseums\t\n70\nDay Excursions\t\n82\nBuys in Thessaloniki\t\n96\nNightlife \t\n97\nGastronomy and wines\t\n99\nTouring Thessaloniki with children\t\n100\nInformation\t\n102\nMaps\t\n112', '82\nThessaloniki lies in the \ncentre of a wide area that is \nextremely interesting from  \nan archaeological, historical \nand natural point of view; \nthere are countless options for \noutdoor activities, relaxing and \nentertainment. For instance, \nyou can combine your stay \nin town with a day excursion \nto renowned archaeological \nsites and places of historical \ninterest, to fascinating towns \nand great natural reserves  \nor to areas offering recreation \nor relaxation.\n1\n\t\nANCIENT PELLA\nInhabited since the Late \nHelladic period, the area \nflourished when Archelaos,  \nthe Macedon king, moved  \nthe capital of the Macedonian \nstate from Aiges (Vergina) to \nPella (late 5th – early 4th c. BC). \nThe then seaside town grew \nlarger during the reign of King \nPhilip II (his son, Alexander \nthe Great, was born here) \nand grew even larger later \nduring the rule of Cassander. \nBy the mid-2nd century BC it \nhad evolved into the greatest \npolitical, financial and cultural \ncentre among the Hellenic City \nStates. In 168 BC when the \nMacedonians were defeated in \nthe battle of Pydna, Pella was \nconquered by the Romans. \nIt gradually declined and got \neventually deserted in the 1st \ncentury BC. Among the finds \nof the greatest value are the \nexquisite mosaic floors in the \nbuildings, which manifest the \nhigh standard of living enjoyed \nby the residents.\nMUST SEE:\nHouses.']","['The historic center of Thessaloniki features traditional commercial areas like Vlali Square, known for coffee shops and restaurants, and a memorial for MP Gr. Lamprakis. The Vatikioti market and Athonos Square offer shops selling produce, spices, and various goods, along with tavernas and ouzo restaurants. Bezesteni, a rectangular building from the late 15th century, serves as a textile and jewelry market with over 110 shops. Stoa Saul, completed in 1881 and rebuilt after a fire, combines neo-renaissance and art deco styles and is now an entertainment venue. Vas. Irakleiou, formerly known as Fragkomachalas, has transformed from a banking area to a commercial and entertainment hub, with popular tavernas and traditional marketplaces offering high-quality foodstuffs.', 'The input consists of the number 112 repeated twice.', 'The text describes notable landmarks in Thessaloniki, including the OTE Tower, built in 1969, which serves as a telecommunications hub and features a rotating café with stunning views. It also mentions the Alexandreio Melathron, a historic sports arena constructed in 1966, which has hosted various significant events and is now home to the Aris basketball team. Additionally, Angelaki Street is highlighted for its vibrant cafés and bars popular among university students, as well as the presence of several radio stations. The area surrounding the 3rd Army Corps is also noted, with its historical significance and architectural features.', 'Kalochori, located 5 km west of the city center, is a rapidly growing residential suburb known for its industrial character and local tavernas. The Gallikos River runs along its west edge, offering facilities for picnicking and relaxation. The river delta and Kalochori lagoon are home to diverse wildlife, including herons and flamingoes. The surrounding wetland area, protected by the Ramsar Convention, is part of the Natura 2000 network and offers free tours. Sindos, situated about 9 km northwest of Kalochori, has grown significantly due to the Thessaloniki Industrial Park.', 'The area features historical sites, including a World War II gun emplacement, and is home to diverse salt marshes and wetlands that shelter 178 bird species like flamingoes and cormorants. To reach the location, take the 71 or 71A bus from the Railway Station Stop to N. Michaniona, or use bus lines 02 and 02A to A.S. IKEA station and then transfer to buses 72, 72A, or 72B. If driving, follow Ethinikis Antistasis, Georgikis Scholis, and Michanionas avenues.', ""The text describes various museums in Thessaloniki, Greece, including a cinema museum showcasing projectors and films from 1910, a photography museum founded in 1997 with over 100,000 photographic objects from 1890-1980, and the Olympic Museum, which focuses on Olympic and Paralympic memorabilia. Additionally, it mentions the 'Christos Tsiggiridis' Radio Museum, featuring equipment from the founder of the first radio station in the Balkans. Each museum hosts educational programs and temporary exhibitions, contributing to the cultural landscape of the city."", 'The Jewish quarter in Europe retains its traditional character, featuring Roman, Ottoman, and Industrial age monuments in districts like Kyriotissa, Panagia Dexia, and Makariotissa. Visitors can explore the award-winning Public Central Library and enjoy local parks. Vergina, located 63 km SW of Thessaloniki, is accessible by car, intercity bus, or train. Dion, an archaeological site under the Olympus mountain range, was a sacred place for ancient Macedonians, dedicated to Zeus and the Muses. The site includes the Vafyras sacred springs, the temple of Demeter, and the Sanctuary of Zeus Hypsistos. Dion flourished until the 5th century AD when it was abandoned due to seismic activity.', 'The historic centre features Valaoritou Street and nearby streets filled with cafés, bars, and restaurants. Notable sites include the neo-renaissance Stoa Malakopi, which housed a bank until 1954, and a clock that stopped during the 1978 earthquake. The Catholic Church, built in 1898, stands in a serene yard with an impressive belfry. The State Conservatory of Thessaloniki, constructed in neobaroque style in 1903, is located at the corner of Vas. Irakleiou and L. Sofou Streets, featuring a garden with 19th-century statues. Ermou Street, running parallel to Vas. Irakleiou, serves as an interesting shopping centre.', 'The Hellenic Professional Yacht Owners Association is located in Piraeus, while the Thessaloniki Marina is in Aretsou Kalamaria. Various beaches are accessible, including Aretsou beach and those in Halkidiki, which are popular for swimming. Mineral springs and spas in the area include Lagkadas Spa, Nea Apollonia Spa, and Souroti Spring. The urban bus service in Thessaloniki covers all city areas, with main termini at key locations. Buses operate from 5 am to midnight, with options for purchasing tickets or passes. A cultural bus route highlights historical sites, and sightseeing tours are available in open-top buses. Makedonia International Airport is 15 km from the city center, with bus services connecting it to major stations. Information for airlines like Olympic Air and Aegean Airlines is also provided.', 'The site features a dark atmosphere with selective lighting highlighting various exhibits, including funerary steles and a 3rd century BC tomb. Notable structures include a memorial for distinguished individuals and the tomb of King Philip II, which showcases exquisite murals, a gold larnax containing his bones, and a decorated suit of armor. The site also contains the tomb of Alexander IV, featuring a silver urn with his remains. Visitors can watch a video tour by M. Andronikos. Excavations in the Aiges necropolis have revealed archaic tombs and a temple-shaped tomb believed to belong to Queen Eurydice. Additionally, the palace, covering 12,500 m2, is considered a significant construction of Hellenic Classical Antiquity, attributed to architect Pytheos.', 'Thessaloniki offers various transportation options including a passenger railway station, intercity bus services, and taxi services with regulated fares. Key contact information includes the railway station at 28 Monastiriou St. and the Macedonia Intercity Bus Station at 244 Giannitson St. Numerous museums and archaeological sites are available for visitors, such as the Archaeological Museum of Thessaloniki and the Museum of Byzantine Culture. Each museum has specific contact details and websites for more information. The city also features a range of cultural institutions, including the State Museum of Contemporary Art and the Jewish Museum of Thessaloniki.', ""The text describes several museums in Thessaloniki, including a Holocaust exhibition that memorializes the local Jewish community, particularly the 49,000 members sent to concentration camps. The Museum of the Macedonian Struggle showcases the history of Macedonia's fight for freedom against the Ottoman Turks, with various rooms dedicated to different aspects of this struggle. The War Museum features significant artifacts from modern Greek history, including uniforms and military decorations from the 1821 War of Independence to the 1944 liberation. Lastly, the Ataturk Museum displays exhibits across two floors, highlighting the life and legacy of Mustafa Kemal Ataturk."", ""The text describes notable Byzantine monuments in Thessaloniki, including Agios Panteleimonas Church, which was originally part of a monastery and later converted into a mosque, featuring murals from the 13th-14th centuries. It also highlights Agios Dimitrios Church, the city's patron saint, built in the 7th century on the ruins of a 5th-century basilica, which was converted into a mosque in 1493 and restored after a fire in 1917. The church contains significant mosaics and a basement Krypt, believed to be the site of Saint Demetrius's martyrdom, and has been used for cultural events since 1988."", 'Ano Poli, or Old Town, features notable areas like Tsinari, Terpsithea Square, and Romfei Square. Tsinari is named after a plane tree and is a central spot with an Ottoman fountain and the oldest restaurant in town. Terpsithea Square showcases remarkable buildings, a playground, and the Tϋrbe of Musha Baba, a late Ottoman monument. Romfei Square is the central square of Ano Poli, home to a Byzantine bath-house and a neoclassical building housing the municipal library. Nearby, the 14th-century Byzantine church of the Taxiarchs adds historical significance to the area.', ""Thessaloniki is a hub for archaeological, historical, and natural attractions, offering numerous outdoor activities and relaxation options. Visitors can explore significant archaeological sites, historical towns, and natural reserves. Ancient Pella, once the capital of Macedon, thrived under King Philip II and became a major cultural center before its decline after Roman conquest. Notable finds include exquisite mosaic floors in spacious townhouses, such as the House of Dionysus and the House of the Snatching of Helen, showcasing rich decorations and historical scenes. Pella's archaeological site features a restored peristyle, making it a must-see for visitors."", 'Kalamaria features popular areas like Aretsou and Krini along the seafront, with amenities such as a marina, open-air cinema, and numerous café-bars. Komninon Street, a pedestrian-only area, hosts shops, cafés, and the central square with the Town Hall and church. Panorama, a suburb 12 km from Thessaloniki, offers luxury villas and a small shopping area, with historical roots dating back to the early 20th century. Platanakia is a notable spot for relaxation, featuring a wooded ravine, a small zoo, and a scenic path leading to an artificial lake.', ""The text describes the connection between the town's civic center and various key locations, including Kassandrou Street, Aristotelous Square, and the seafront. It highlights the architectural features of buildings along the street, which house various businesses and institutions. The church of Agia Theodora is noted as a significant landmark at the junction of Aristotelous and Ermou Streets. Nikis Avenue, known as Palia Paralia, runs from the harbor to the White Tower and has historical significance due to its development in 1882. Today, it is a vibrant area frequented by locals and tourists, lined with cafés and bars, and features a wide pedestrian area by the sea. The avenue is also home to several notable landmarks, including various mansions and the State Orchestra of Thessaloniki."", 'The document outlines a guide to Thessaloniki, including its history, various walking tours of the city, information on museums, day excursions, nightlife, gastronomy, and tips for touring with children.', 'The text describes the historical significance of various structures in ancient Macedonia, including a palace with a peristyle, a monumental gateway, and a temple dedicated to Hercules. It mentions the theatre built around 340 BC, known for being one of the oldest stone theatres, where King Philip II was assassinated. Additionally, it details religious sites near the theatre, including temples dedicated to goddess Euclea and Kyveli, along with remnants of royal votive offerings. The Acropolis features five towers and thick fortification walls, with house foundations dating from the 5th to 1st century BC. The text also highlights Veroia, a historic town in Northern Greece, known for its Byzantine churches and as a site visited by Apostle Paul, earning it the nickname Little Jerusalem.', 'Thessaloniki, the historic capital of Macedonia, blends its rich cultural heritage with modernity, featuring numerous monuments and a vibrant atmosphere. The city is known for its hospitality, artistic events, and exceptional culinary traditions. Its strategic location allows easy access to renowned archaeological sites, natural wonders, and the monastic state of Agion Oros. Visitors can enjoy various sports and wellness tourism options throughout the year, making Thessaloniki a versatile destination for all.', ""Thessaloniki is a child-friendly city with numerous activities, including bicycle rides along waterfront bike lanes and visits to theme parks. The region is also known for its rich wine-making tradition, featuring a variety of grapes like Roditis, Asyrtiko, and Cabernet Sauvignon. The Wine Producers Association offers excursions through the 'Wine Roads of North Greece,' combining visits to wineries with historical sites. Families can enjoy various fun activities and games throughout the city."", ""The Lazare church in Paris, once a hospital and refugee center, was declared a historic monument in 1980 and renovated in 1997 for cultural events in Thessaloniki. It now serves as a multi-purpose venue, housing the National Theatre of Northern Greece, a café-restaurant, and hosting outdoor performances. The area also features five old tobacco warehouses, remnants of the city's tobacco trade, with one converted into a luxury hotel and others housing educational and commercial spaces. Additionally, the Stavroupoli Botanical Garden spans 0.5 hectares, showcasing over 1000 plant species and providing recreational facilities. The Serbian monument is located in the Zeitenlik allied military cemetery."", 'The number 114 is repeated twice.', ""Eleftherias Square, located near the harbor, served as a parking lot and was the site where 50,000 Jewish residents were gathered by German forces in 1943. A Holocaust Memorial was erected in 1997 to commemorate this event. The square is surrounded by notable buildings, including the National Bank of Greece and the Ionian and Popular Bank, showcasing late neoclassicism and eclectic styles. Kalapothaki Street, starting from the Ladadika area, features pedestrianized sections with neoclassical and Bauhaus-style buildings, popular cafés, and the historic Stein Building. The port area is one of the largest in the southeastern Mediterranean, with a rich history dating back to Constantine the Great's time."", ""The Orphanos Church, built in the 1310s as part of Vlatadon Monastery, features exquisite 14th-century murals and is one of Thessaloniki's best-preserved monuments. The city walls of Thessaloniki were established shortly after its founding and underwent significant changes under Theodosius I in 390 AD. Over the centuries, the walls were reinforced during Venetian and Turkish rule, resulting in a total length of 7 km, with only 3 km remaining today. The walls are notable for their impressive height and width, contributing to their archaeological and cultural significance. For a comprehensive understanding of Byzantine art in the city, visitors are encouraged to explore the Museum of Byzantine Culture."", ""Greece, a parliamentary republic and EU member since 1981, has a population of approximately 10.8 million. Thessaloniki, the second-largest city, is located 510 km north of Athens and has over 1 million residents. The euro has been the national currency since 2001, and the international calling code is +30. Thessaloniki experiences a temperate Mediterranean climate with average temperatures ranging from 5°C in January to 24°C in August. Key national holidays include New Year's Day, Independence Day, and Easter celebrations, which involve various religious and cultural traditions. Other notable festivals include Carnival and Pentecost. For consulate information, contact local authorities in Thessaloniki."", ""The text describes several museums, including the room of Kemal Ataturk's mother, which exhibits his personal items and documents. The Folklife & Ethnological Museum of Macedonia-Thrace, founded in 1957, displays 20,000 objects from 1860 to 1960, including folk costumes and musical instruments. The State Museum of Contemporary Art, inaugurated in 1997, houses the Kostakis Collection of Russian Avant-Garde art, featuring works by notable artists like K. Malevich and V. Kandinsky. This museum also has a collection of contemporary Greek art and hosts temporary exhibitions."", 'The historic centre of Thessaloniki, particularly the Ladadika area, has transformed from a downgraded region post-WWII to a vibrant hotspot filled with restaurants, clubs, and live music venues since the 1990s. Key starting points for exploration include Morichovou square and Petrakaki square, where notable sights like the Ottoman Post Office Mansion can be found. Tsimiski Street, a major thoroughfare constructed after the 1917 fire, is now a bustling commercial hub featuring shops, offices, and popular cafés. Significant buildings include the Kazes Building, designed by Xenophon Paionidis in 1924, and the Agios Minas Church, which has historical roots dating back to early Christianity.', 'Thessaloniki has historically been a key stopover for East-West trade. Today, its town center offers a vibrant shopping experience with traditional marketplaces and modern commercial areas. Visitors can find a variety of goods, including food, clothing, and antiques, at reasonable prices. Notable shopping spots include Bit-Pazar for second-hand items and the Mediterranean Cosmos Mall, which features over 200 shops and entertainment options. Other popular areas include the Hirsch Building Mall and Plateia Mall. For budget-friendly shopping, Venizelou St., Egnatia St., and Agiou Dimitriou St. are recommended. The city also has modern shopping centers in Kalamaria and its suburbs.', ""The Historic Centre features a blend of modern and traditional Macedonian architecture, including notable sites such as the Acheiropoiitos church, built in 1818, and the Nedelkou Building from 1909, which now houses the Mount Athos Centre. The Galerius Arch, a significant landmark from 295-305 AD, commemorates Galerius' victory over the Persians and is a popular meeting spot. Nearby, the Rotunda and Panagia Dexia church, which contains a rare icon of the Virgin Mary, add to the area's historical richness."", ""The text describes various museums in Thessaloniki, including the archaeological museum that showcases excavated sites and the process of maintaining an archaeological museum. It highlights temporary exhibitions related to Byzantine heritage. The White Tower Exhibition presents Thessaloniki's history through multimedia and is organized into seven thematic categories across different floors. Additionally, the Jewish Museum of Thessaloniki promotes Sephardic legacy and features a research center, library, and audiovisual center. Its permanent exhibitions cover topics such as the Jewish necropolis and the history of the Jewish community in Thessaloniki up to World War II."", ""Thessaloniki is renowned for its vibrant nightlife, often considered Greece's entertainment capital. The city offers a variety of options including avant-garde bars, tavernas, ouzo restaurants, and modern cuisine spots. Popular nightlife areas include Ladadika, Kalapothaki Street, and the beachfront cafés. Students frequent Navarinou square, Rotonda, and Bit-Pazar, while Ano Poli features alternative tavernas and café-bars. Recently, Valaoritou Street has emerged as a nightlife hotspot, especially in summer. The Slaughterhouse area hosts large venues for live Greek music and the biggest clubs in the city."", ""The text describes various locations and landmarks in Thessaloniki, including the historic center, the White Tower area, and notable streets. The historic center is recognized for its proximity to the beach and is a residential area for the affluent, featuring shops, green spaces, and cultural institutions. The White Tower is highlighted as the city's most famous landmark, built in the late 15th century, and serves as a significant historical monument. It stands 33.90 meters high and has a diameter of 22.70 meters, originally surrounded by fortifications. The area around the White Tower is a central hub where major roads converge, offering views of the sea and a vibrant atmosphere with shops and cafés."", 'The International Book Fair in Thessaloniki is an annual event held in the HELEXPO-TIF exhibition center, attracting professionals and book lovers. It features presentations from Greek and foreign publishers, discussions with writers, and various themed corners for children and teenagers. The Society for Macedonian Studies is a key cultural institution in Thessaloniki, focusing on the preservation and promotion of Macedonian history and culture. The National Theatre of Northern Greece, established in 1961, is the largest cultural organization in northern Greece, hosting various performances across multiple venues. Thessaloniki also offers a range of indoor and outdoor theatre stages, providing diverse entertainment options throughout the year.', 'The text describes various historical and archaeological sites in the region, including the Praetorium, public toilets, and the Hydraulis sector known for its copper items. It highlights the Villa of Dionysus, famous for its mosaic of Dionysus. The Archaeological Museum showcases artifacts from the Dion area and nearby ancient sites. Mt. Olympus, the highest mountain in Greece, is noted for its biodiversity and as a popular destination for hiking. Ancient Pydna, once an administrative center under Macedon, faced decline after Roman conquest and was eventually deserted.', 'The Greek National Tourism Organisation promotes tourism in Greece through its website, www.visitgreece.gr.', 'The 6th walk in Thessaloniki highlights several must-see landmarks along NEA PARALIA and VASILISSIS OLGAS AVENUE. Key attractions include the Monument of Alexander the Great, a large equestrian statue near the White Tower, and the statue of politician Konstantinos Karamanlis. The Makedonia Palace Hotel, a luxury accommodation, is noted for its historical significance and frequent patronage by political figures. The Umbrellas sculpture by George Zongolopoulos, a prominent art piece, is also featured, along with the Agioi Kyrillos and Methodios Church, dedicated to the saints who spread Christianity to the Slavs.', 'Ano Poli, an area of 3,000 hectares, features a small remnant of an old oak forest and has undergone reforestation since the 1930s. It remains a popular destination for outdoor activities like hiking and mountain biking, despite urban expansion and a significant fire in 1997. Key attractions include the Zoo, which houses various Greek wildlife, the Forest Theatre for summer concerts, and the Theatre of the Earth, a notable cultural venue. Visitors can access these sites via bus no. 24 from Eleftherias square. The nearby Sykees area retains its charm with Interwar Period houses amidst modern development.', 'The area includes historical sites such as the former Turkish army barracks and the War Museum, designed by V. Poselli. It also features the Papafeio Orphanage, a classical style building completed in 1903, which served various purposes including a male boarding school and military barracks. Nearby, the YFANET textile factory was once a major textile unit in Macedonia and is now a venue for events and a library. Additionally, visitors can explore a rare Macedonian tomb from the 3rd century BC and the neoclassical Ippokrateio Hospital built in 1891.', 'The text describes various museums in Macedonia, including sections on antiquities from the 2nd to 4th centuries AD, prehistoric items, and temporary exhibitions. The Roman Forum Museum, inaugurated in 2010, showcases local excavations and historical artifacts from the Hellenistic period to the 4th century AD, including a bathhouse and ancient brothel. The Museum of Byzantine Culture is highlighted as one of the best in Greece, featuring 2,900 exhibits that include murals, mosaics, icons, and everyday tools, providing a comprehensive view of Byzantine culture.', 'The 7th walk in Stavroupoli highlights notable cultural venues like Mylos, a former flour mill turned multi-purpose venue, and FIX Brewery, founded in 1893 and now mostly deserted except for concert halls. The Terpsithea District features well-planned urban spaces, including the old military camp and Lebet mosque, which will be transformed into a park. The Jewish cemetery, established in 1938, contains remnants from a previous cemetery destroyed during WWII. A must-see is the Allied Military Cemetery, the largest in Greece, housing over 21,000 soldiers from World War I. Additionally, the Moni Lazariston, built in 1886 by Lazarist monks, is an impressive historical site.', ""The text describes various streets and locations in Thessaloniki, highlighting their historical significance and current status. Dimokratias Square is noted as a key entry point to the city, serving as a transportation hub with hotels, shops, and a statue of King Constantine. The surrounding area features mostly unremarkable buildings but also historic sites, including sections of the city's west walls and archaeological monuments. The Railway Station, located on Monastiriou Street, is mentioned as a significant structure that began construction in 1939 and became operational in 1951."", ""The historic centre features the White Tower, originally known as the Tower of the Janissaries, which served as a jail and now hosts exhibitions on Thessaloniki's history. Visitors can enjoy panoramic views from the top and relax in the surrounding square, which is a hotspot for boat bars. The Royal Theatre, built in 1940 and renovated in 1996, has a capacity of 800 and is part of the State Theatre of Northern Greece. Ethnikis Amynis Street connects the White Tower to Syntrivaniou Square and was established after the demolition of city walls in 1889. Previously named Hamidiye Boulevard, it is now home to various cultural institutions, including the Theatre of the Society for Macedonian Studies and popular cafés and bars nearby."", 'The text describes various historical sites in a town, including Main Street, which was lined with shops and public buildings. The Great Thermae was a large public bath complex featuring marble floors and areas for worship and entertainment. The Houses of Zosa and Lida were decorated with mosaics and sculptures. The Roman Forum, dating back to the late 2nd to early 3rd century, included luxury houses and a temple for emperor worship. A polygonal building served as a roofed marketplace, while remnants of Early Christian Walls were found nearby. An episcopal basilica was rebuilt in the 5th century after its destruction in the 4th century. The Praetorium functioned as an inn for officials and travelers, with access to the Main Street Thermae. Additionally, the text mentions a climbing route in Olympus National Park and the Petralona Museum, showcasing prehistoric human activity.', 'The Agora, a 4th century BC building complex, served as the administrative and cultural hub of the town, featuring a large court and various commercial shops. Excavations have revealed several temples, including those dedicated to the Mother of Gods and Aphrodite. The Palace, located on a northern hill, dates back to the 4th century BC and includes a peristyle and royal quarters. The Eastern cemetery contains rock-hewn cist graves from the Copper Age to Classical times. The Alexander the Great Bathhouse, a Hellenistic facility, is also notable. The Archaeological Museum showcases five thematic categories, including daily life, public life, religious practices, cemetery finds, and the architectural design of the palace, along with information about Alexander the Great.', ""The text describes various museums, including the Water Museum, which features restored buildings showcasing pumping machinery and historical archives. The Children's Museum, targeting ages 4-12, offers educational programs and is currently located in Thessaloniki's Cultural Centre after a fire destroyed its previous location. The Noesis Science Centre and Technology Museum includes exhibitions on Ancient Greek technology and interactive exhibits on electricity and magnetism."", ""The 5th walk in Ano Poli (Old Town) connects Agios Pavlos area and Agiou Dimitriou Street, offering views of the city's eastern walls. The Gardens of the Pasha, built in 1904, feature eccentric architecture and an art nouveau fountain. Agios Pavlos church, named after a fountain where Apostle Paul drank, is located nearby. Agios Dimitrios Hospital, built around 1902-3, showcases classicist and baroque styles and is a listed monument. Evangelistria Cemetery, established in 1875, is the city's oldest Christian cemetery, housing notable figures. Nearby are the Armenian and Protestant cemeteries and a historic foundry now used for cultural events."", ""The text describes several significant Byzantine monuments in the Ano Poli area, including the 14th-century Agia Aikaterini Church, known for its elaborate brickwork and murals depicting saints and Gospel scenes. It was converted into a mosque during Ottoman rule but restored between 1947 and 1951. The Profitis Ilias Church, dating from the late 13th to mid-14th century, is noted for its architectural features and murals of Christ's life. Additionally, the Byzantine Baths, a 13th-century domed structure, is the only surviving bathhouse from that era, which was open to the public until 1940."", 'The text describes various locations in Ano Poli, Thessaloniki, including the historical significance of the eastern walls and the neoclassical G. Gennimatas hospital. It mentions Kallitheas Square, a picturesque area with a playground, and major streets leading out of the city walls. Additionally, it references the Seich Sou forest, the largest forested area near the city.', '', 'The text describes various historical buildings along Vas. Olgas Avenue in Thessaloniki, including the Folklife and Ethnological Museum of Macedonia – Thrace, which was once a residence of banker Jacob Modiano. Other notable buildings include a former private residence that now serves as a nursery school, the Melissa Building which housed an orphanage and now hosts the Centre for Byzantine Research, and the School for the Blind, originally built as a private residence. The Jeborga Villa, once the Italian Consulate, is now deserted. The Yeni Mosque and Modiano Villa are also mentioned for their eclectic architectural features.', 'Chortiatis is a small suburb located on Mt. Chortiatis, known for its hiking trails and historical significance, including remnants of a Byzantine aqueduct. Thermi, situated 15 km southeast of Thessaloniki, retains a countryside feel and was historically significant as the harbor of ancient Thermi, famous for its hot springs. The central square of Thermi, Paramana Square, is noted for its futuristic design and serves as a hub for local businesses. An artificial lake nearby offers recreational opportunities and hosts the Dam Music Festival in summer, while the Environmental Park provides various sports facilities.', ""Aristotelous Square in Thessaloniki is one of Greece's largest and most vibrant squares, operational 24/7. It was part of the Hébrard Committee's urban plan post-1917 fire, fully realized by the early 1960s. The square offers stunning views of the Thermaic Gulf and Olympus massif, featuring monumental architecture that blends Byzantine and European interwar styles. Key landmarks include the Electra Palace hotel and Olympion, the latter hosting the Thessaloniki Film Festival. Aristotelous Street, a pedestrianized historic boulevard, connects to Egnatia Street."", 'The text describes various historical sites in Thessaloniki, including the Hippodrome, which was a center of social activity until 390 AD when a massacre led to its closure. It highlights the Thessaloniki History Centre and the 18th-century Agios Antonios church nearby. The Arched Hall, located at the intersection of Gounari and Svolou streets, was used for symposia and had access to the imperial box in the Hippodrome. Additionally, remnants of a theatre-stadium on Apellou Street date back to the 1st to 4th centuries AD and are linked to the martyrdom of Agios Dimitrios. The text also mentions three notable churches on Egnatia Street, including the Panagouda Church, built in 1818 on the site of an older church destroyed by fire. The area is rich in history and cultural significance, making it a must-visit for tourists.', 'The number 116 is repeated twice.', 'The map of Thessaloniki highlights various public agencies and services, including the G.N.T.O. Information Office, Ministry of Macedonia – Thrace, and the Police Department. It also features significant Roman monuments such as the Roman Forum and the Arch of Galerius, alongside Byzantine churches like Agia Sofia and Agios Dimitrios. Ottoman monuments are represented by the White Tower and various hamams. Additionally, the map includes 19th to 20th-century landmarks like Aristotelous Square and the YMCA of Thessaloniki.', ""The text describes several significant Byzantine monuments, including their architectural features and historical transformations. The first is a tetrastyle cross-in-square church that became a mosque, obscuring its original murals. The Panagia Chalkeon Church, built in 1128, showcases the 'School of Constantinople' architecture and was also converted into a mosque. Acheiropoietos Church, founded in the 5th century, features a three-aisled basilica and was the first church turned into a mosque after the Turkish conquest. Lastly, Agia Sofia Church, built in the mid-7th century, is a replica of the Hagia Sophia in Constantinople, highlighting its historical significance."", 'The historic center of Thessaloniki features a shopping mall that was reshaped between 1995-1997, retaining its original exterior while now housing shops, cinemas, cafés, and restaurants around a central atrium. Notable buildings from the early 20th century are located at the junction of Tsimiski and Karolou Dil Streets, currently serving as shops and offices. The traditional market area, west of Aristotelous Street and south of Egnatia Street, is filled with small shops, malls, and arcades dating back to the Turkish Occupation, offering a variety of products including food, spices, and fabrics. Modiano Market, built in 1922, is a prominent glass-roofed structure with 140 food shops and popular restaurants. The Vlali-Kapani and Athonos-Vatikioti Markets, designed by Ernest Hébrard, feature two-storeyed malls with archways and are connected to Aristotelous Street.', 'The text describes notable buildings in the historic center of Thessaloniki, including the YMCA Building, which features a mix of neo-colonial and Byzantine architecture and houses various sports and cultural facilities. The Archaeological Museum, designed by P. Karantinos and inaugurated in 1962, showcases modernist architectural design and includes spaces for exhibitions and events. The Museum of Byzantine Culture, built between 1989 and 1993, combines modernism with Greek tradition and is recognized as a historic monument. It contains an amphitheater, a café-restaurant, and exhibition spaces, alongside the new Town Hall and a park.', 'Ano Poli, or Old Town, was established to house early 20th-century refugees, with historical settlements dating back to the 2nd century AD. The area features the Municipal Grove with a theatre for summer cultural events and an open-air cinema. A prominent church, Agioi Theodoroi, built on a 7th-century Byzantine site, offers stunning city views. Nearby, Elpidos Street has refugee houses being transformed into a Cultural Neighbourhood. Access to Sykees is available by walking from Ano Poli or taking bus no. 23 to Agios Charalampos stop.', 'The text describes various day excursions near Ancient Pella, including Aravissou springs, Platanopotamos Lake, and Dytiko plane-tree forest. It provides directions to Ancient Pella from Thessaloniki and mentions the military Museum of Balkan Wars. Additionally, it highlights the historical significance of Vergina (Aiges), the former capital of Macedon, detailing its importance from the 10th-8th century BC until its destruction by the Romans in 168 BC. The archaeological site is recognized as a UNESCO World Heritage Site, featuring the Royal Tombs discovered by archaeologist Manolis Andronikos in 1977.', 'The text describes a walking tour along Vasilissis Olgas Avenue, highlighting historical buildings and residences. Notable sites include the Hirsch villa, a former police department, and the Chatzilazarou Residence, built in 1890. The Marokou Residence, previously a boarding school, now houses a Traffic Police Department. The Mehmet Kapanci Villa, constructed in 1893, served various significant roles, including housing military leaders and high schools, and is now part of the Thessaloniki Cultural Centre. The Ahmet Kapanci Villa, built in 1905, features eclectic architectural styles and has housed various organizations over the years, including the Red Cross and NATO services.', ""The Historic Centre features Plateia Dikastirion, a green square where the Court House was planned but halted due to the discovery of the Ancient Roman Forum. The square has a bust of Eleftherios Venizelos, a significant Greek prime minister. Nearby, the Bey Hamami, built in 1444, is the largest Ottoman bathhouse in Greece, known as the Paradise Baths until 1968. The Roman Forum, a 2-hectare area, served as the city's social and religious center during the Roman period, with construction completed in the mid-2nd to mid-3rd centuries AD. The site includes a large square with traces of marble paving and a double underground Cryptoporticus, likely used as a public storehouse, featuring an early Christian mural."", ""The text describes various historical and architectural landmarks in Thessaloniki, including the West of the Centre-Stavroupoli inaugurated in 1962, which connects the city to Greece and the Balkans. The Old Railway Station, built in 1894, is now a cargo station and was historically significant during the German occupation. The Top Hane (Vardariou Tower), constructed by the Ottomans in 1546, served as a city stronghold and remains well-preserved. The De La Salle Complex, built in 1926, now houses the city's Administrative Courts, while the Vienni Hotel, established in 1925, reflects the eclectic architectural trends of its time and currently contains private offices."", 'Noesis is a unique science center and technology museum in Greece, completed in 2004, featuring exhibitions, a digital library, and an amphitheater. It can be accessed via public transport or car from Thessaloniki. The seaside areas of Peraia, Neoi Epivates, and Agia Triada, located 20 km from the city center, were settled by refugees in 1923 and have since developed into popular suburbs and resorts with Blue Flag beaches and various amenities. Buses connect these areas to the city, providing easy access for visitors.', 'The text describes various attractions in Thessaloniki, including the historic center, shopping streets, and museums. It highlights the eclectic-style building housing the local Greek Scouts and the upscale shopping areas with boutiques and art galleries. The Museum for the Macedonian Struggle, a neo-classical building, is noted for its historical significance and previous functions. Nearby, the metropolitan church of Agios Gregorios Palamas showcases Byzantine architecture, and the Ecclesiastical Museum offers a collection related to the church.', ""Dion, located 87 km SW of Thessaloniki, features a significant neolithic settlement, early-Christian basilicas, and a 10th-century basilica with impressive mosaics. Visitors can reach Dion via national roads or local buses from Katerini. The Petralona Cave, discovered in 1959, is notable for its prehistoric findings, including a 200,000-400,000-year-old skull, making it one of Europe's oldest archaeological sites. The cave showcases various prehistoric items and is partially open to visitors. Halkidiki, known for its beautiful beaches and rich history, is a popular tourist destination south of Thessaloniki, featuring three peninsulas: Kassandra, Sithonia, and Athos."", 'The museum features a collection of over 2,500 corkscrews from the 16th to 20th centuries, categorized by mechanical and non-mechanical types, as well as by gender usage. It includes explanatory texts and photographs. Additionally, touch screens display a glossary of viticulture and wine-making terms. Room B showcases the historical significance of wine through tools and vessels, along with scenes from films and photos related to wine production and consumption.', ""The text describes significant Byzantine monuments in Thessaloniki, including the UNESCO-listed church that was once a cathedral and later converted into a mosque, showcasing impressive mosaics and murals. It also highlights the Transfiguration of the Saviour Church, a typical example of Byzantine architecture from around 1340, adorned with depictions of Christ's Ascension. Additionally, the Rotunda, built in 306 AD, is noted for its massive dome and preserved mosaics, which were later converted into a mosque. The surrounding area includes the small church of Agios Georgios, further enriching the historical context of these monuments."", ""Thessaloniki, founded in the 4th century BC, has maintained its urban character as a civic center influenced by various empires and multicultural groups. Its rich history includes Roman, Byzantine, and Ottoman rule, with contributions from Jews, Latins, Armenians, and Greeks. The city's numerous historical monuments reflect its cosmopolitan nature. The White Tower area is a bustling part of Thessaloniki, where the old seafront meets the new waterfront."", 'The text describes various historical and cultural sites in Thessaloniki, including the impressive complex of 14 listed industrial buildings from 1854, originally owned by the French and later by the Allatini family. It mentions the Vafopouleio Cultural Centre, inaugurated in 1983, which hosts art exhibitions, performances, and has three libraries. The Ouziel quarter features picturesque semi-detached houses built for tramway workers, now a protected architectural monument. Sofouli Street connects eastern districts with Kalamaria, lined with trees, shops, and offering views of the city. Vasilissis Olgas Avenue, once a favorite promenade, is noted for its green surroundings along the waterfront.', ""Thessaloniki offers various outdoor activities such as hiking and mountain biking in the suburban forests of Seich Sou and Chortiatis, as well as relaxing by the Deltas of Gallikos and Axios-Loudias-Aliakmonas rivers. Educational programs for children are available in most museums, particularly at the unique Children's Museum. The Noesis Science Centre and Technology Museum provides fun and educational experiences related to science and technology. Visitors can also explore the Environmental Dinosaur Theme Park and the Mammoth Museum. For beach lovers, there are beautiful seaside options in Thessaloniki and Halkidiki. Families can enjoy the Magic Park, Greece's largest amusement park, and WaterLand, which features various water attractions."", 'The text describes various historical and cultural sites in a city, focusing on Agia Sofia Square, which features greenery and is shaped by the 1890 fire. It highlights the pedestrianized Agias Sofias Street, notable buildings like the Longos Building and Chatzidimitriou Building, and the monument commemorating the Genocide of Pontic Greeks. Navarinou Square is presented as a vibrant student area with cafés, bars, and cultural venues, along with a fountain and playground. The area also includes shops selling books, records, and antiques, and encourages visits to the nearby church of Nea Panagia, dating back to 1727.', 'The text describes day excursions from Thessaloniki, highlighting the monastic state of Mount Athos, which features 20 inhabited monasteries and is a UNESCO World Heritage site. It provides directions to Petralona Cave, located 53 km southeast of Thessaloniki, accessible by coach and taxi or by car. Additionally, it mentions the Lakes Area northeast of Thessaloniki, a National Park with diverse ecosystems ideal for outdoor activities. The area is managed by an agency that offers tours, and visitors are encouraged to try local fish dishes. Lastly, it notes the town of Lagadas, known for its fire-walking custom and modern spa facilities with historical Byzantine bathtubs.', 'The text describes two museums: Noesis and Gerovassiliou Wine Museum. Noesis focuses on interactive learning with exhibits like a car exhibition, a planetarium, a cosmotheatre, and a virtual reality simulator. It also offers educational programs on renewable energy and science. The Gerovassiliou Wine Museum, established in 2008, showcases the history of wine-making and features collections that illustrate the journey of wine, food pairings, and wine-making equipment. Both museums emphasize visitor engagement and education.', 'Thessaloniki offers various tourism services including an Info Point at Aristotelous Square, open Mon-Fri from 9 am to 5 pm. The Thessaloniki Tourism Organisation provides information and assistance, reachable at 2310 279.282 or via email at welcome@thessaloniki.travel. The Tourist Police, available at 1571, assists tourists with information and minor disputes. The city has over 130 hotels with a capacity of approximately 13,000 beds, and inquiries can be made through the Thessaloniki Hotels Association. For conferences, the Thessaloniki Convention Bureau can be contacted for well-equipped venues. Organized excursions can be arranged through local travel agencies, and car rental services are available through the Car Rental Agencies Association. Yacht charters can be organized via the Hellenic Yacht Brokers Association.', 'The text describes the historical and cultural significance of suburbs and outskirts of Thessaloniki, including ancient tombs and a Neolithic settlement. It provides directions to Kalochori via bus or car. Kalamaria, a prominent suburb, features green spaces and a shopping center, with a history of Greek refugees settling there in the 1920s. Key sites include Sofouli Street, the Little Palace (formerly a royal residence), and the Kodra former military camp, which is being transformed into a park. Excavations in Kodra revealed an ancient settlement, possibly linked to Ancient Thermi.', ""The Museum of Greek Children’s Art showcases the creativity of children, depicting Greek history, tradition, and culture through their artwork. It is one of the few museums worldwide dedicated to children's art."", ""Egnatia Street is a historic avenue in Thessaloniki, dating back to Roman times, connecting Dyrrhachium and Constantinople. It runs from Dimokratia Square to the TIF grounds and the Aristotle University, serving as a bustling shopping area with notable eclectic and art deco buildings. Key attractions include Kolomvou Square, a lively hub with cafés and bars, and the Hamza Bey Mosque, built in 1467, which is currently undergoing renovations for an exhibition. The street splits the city's historic center and features important monuments worth observing."", ""The text describes various cultural and historical sites in Thessaloniki, including a small museum dedicated to the founder of modern Turkey, the Teloglion Foundation of Art with its modern facilities, and the Kaftanzogleio Stadium, which was the largest in Greece until 1982 and is home to the city's oldest football team, Iraklis. The stadium also hosted events during the 2004 Athens Olympic Games and is near the Olympic Museum."", 'The area along NEA PARALIA features 12 Theme Gardens covering 76,657 m2, ideal for leisure activities. Notable gardens include the Garden of Alexander, Garden of the Seasons with an amphitheater, and the Garden of Music for events. A 3 km cycle path is available, along with the Nautical Club of Thessaloniki. The Thessaloniki Concert Hall, inaugurated in 2000, is inspired by Byzantine architecture and hosts various performances and conferences. It includes a main hall for 1464 attendees and a neighboring building with additional facilities. The Depot Area, named after historic tram depot buildings, retains traces of its older atmosphere. The Allatini Mills and the church of Saints Cyril and Methodius are also significant sites in the area.', ""The Historic Centre features archaeological sites from the late Roman period, including shops from the 1st to 13th century and the underground Museum of the Roman Forum. A restored Odeon from the 2nd-4th century AD is now used for cultural events, alongside a mint and archive office. A round bathhouse dating back to the 1st century BC was also discovered, along with various artifacts like mosaics, sculptures, and coins. The forum is notable for the 'Enchanted Ones,' a two-storeyed colonnaded archway with surviving Corinthian columns, which were relocated to the Louvre in 1864. Bit-Pazar, a vibrant market area with antique shops and restaurants, was built in the 1930s and has become popular among students. Nearby, the Jewish Monastirioton Synagogue is the only one to survive World War II. The Experimental School, designed by architect D. Pikionis, was constructed from 1936 to 1938."", ""The phrase 'Follow Greece Everywhere' suggests a strong interest or commitment to exploring and engaging with Greek culture, history, and lifestyle in various contexts."", ""Thessaloniki has a rich history marked by the settlement of various communities, particularly from the Iberian Peninsula, and a period of harmony among ethnic groups from the 16th to 18th centuries. The city evolved into a significant trade center by the 18th century and became more cosmopolitan with railway connections established in the late 19th century. Major events include a devastating fire in 1890, the Greek army's seizure of the city in 1912 after five centuries of Ottoman rule, and a significant fire in 1917 that led to extensive rebuilding. The city faced challenges during the Asia Minor Catastrophe in 1922-1923, receiving many Greek refugees. The German occupation in 1943 resulted in the tragic loss of a large portion of the Jewish population. Thessaloniki experienced a severe earthquake in 1978, and later, in 1997 and 2014, it was recognized as the European Capital of Culture and the European Youth Capital, respectively."", 'The Macedonian Museum of Contemporary Art features a permanent collection of 1,800 works by notable Greek and foreign artists and has hosted over 100 exhibitions. The museum also has a library with over 2,500 specialized titles. The Teloglion Foundation of Art, established in 1972, houses a significant collection including Hellenistic statuettes and works by renowned 19th and 20th-century artists, along with hosting temporary exhibitions and educational programs. The Municipal Gallery displays over 1,000 artworks, focusing on Thessalonian artists from 1898 to 1967, and is part of the cultural offerings in Thessaloniki, which also includes the Society for Macedonian Studies and the Thessaloniki Cinema Museum.', 'The text describes various historical sites, including the Sanctuary of Isis, which is half-sunk in water and dedicated to the Egyptian goddess. It also mentions the Sanctuary of Olympian Zeus, completed in the Hellenistic period, featuring a large altar and Roman theatre. The Hellenistic Theatre, built in the 3rd century BC, hosts modern events today. The Sanctuary of Asklipios, active until the 3rd century AD, is noted for a statue of the goddess Hygeia. Additionally, the Cemetery Basilica from the 5th century is described, along with fortified walls originally constructed by Cassander, which have been reconstructed over time.', 'The historic centre features a museum with exhibits of ancient human skulls, including those from the Axios river and Petralona Cave. Notable sites include the Observatory, built in 1954, and Agiou Dimitriou Street, one of the oldest roads in the city, surrounded by Interwar Period architecture. The area has seen an influx of Eastern European emigrants who have opened shops and restaurants, adding diversity. Key attractions include the Dioikitirio, a neoclassical building from 1891 that now houses the Ministry of Macedonia-Thrace, and the Agios Dimitrios church.', 'The text describes several historical sites in the historic center, including Yeni Hamam, built in 1531, which served as a bathing place until 1944-45. Alaca Imaret, constructed in 1484, features skilled masonry and is occasionally used for cultural events. The Profitis Ilias Church and Panagia Lagoudiani Church, a 14th-century Byzantine basilica, are also mentioned, with the latter honoring the Virgin Mary and Saint Demetrius. Additionally, the Ataturk Museum, located in the former residence of Kemal Ataturk, showcases his life and includes a café. Lastly, Kaftanzogleio Stadium is noted as the largest stadium in the city.', 'Epanomi is a picturesque town 25 km SE of Thessaloniki, known for its beautiful beaches and a wetland that hosts over 80 bird species. The Gerovassiliou Wine Museum, unique in northern Greece, is located nearby. Nea Michaniona, a major fishing center 32 km S of Thessaloniki, features the largest fleet of deep-sea fish boats in Greece and a vibrant seafront with cafés and tavernas. Angelochori, a small village near Nea Michaniona, offers stunning views of the Olympus massif and historical Ottoman architecture. The area is also recognized for its high-quality beaches, such as Tourbani and Angelochori, which have received Blue Flag awards.', 'This text provides essential information for visitors to Thessaloniki, Greece, including contact details for the Greek National Tourism Organisation (GNTO) and the Ministry of Foreign Affairs. It lists various Greek acronyms relevant to tourists, such as E.O.T. for the GNTO and K.T.E.L. for intercity bus services. The text mentions the use of 220V electric current in Greece and highlights free wireless internet access in public areas. It also details the operating hours and locations of post offices in the city. Emergency phone numbers for police, fire brigade, and medical services are provided, along with contact information for tourist information services.', ""Thessaloniki boasts a rich culinary tradition influenced by Byzantine, Ottoman, and various European cuisines, shaped by its multicultural history. The city's gastronomy features traditional tavernas and restaurants that creatively blend local dishes with gourmet elements. Notable delicacies include gyro, souvlaki, patsa, and a variety of seafood dishes. Desserts play a significant role, with popular items like bougatsa, galaktompoureko, and syrupy pastries originating from Istanbul. Koulouri Thessalonikis, a sesame-covered bread, is a common snack sold by street vendors. In winter, locals enjoy salep, a unique hot beverage."", 'Thessaloniki is a city in Greece known for its rich history, vibrant culture, and significant role in the Byzantine Empire. It is the second-largest city in Greece and features a mix of ancient and modern architecture, including Roman ruins and Ottoman-era structures. The city is also famous for its festivals, culinary scene, and lively waterfront.', 'The text mentions Thessaloniki and its neighboring areas, but does not provide further details or context.', 'Thessaloniki offers various sports facilities, including an 18-hole golf course at Porto Carras Grand Resort and proximity to several ski centers. Notable ski centers include Seli, Elatochori, 3-5 Pigadia, Lailias, Vora, and Falakro, each with different elevations, runs, and amenities. Information for each ski center, including contact details and websites, is provided. Additional resources for tourists include websites for the Municipality of Thessaloniki, archaeological sites, and weather forecasts.', ""The Thessaloniki State Symphony Orchestra, established in 1959, is one of Greece's premier orchestras, performing at the Thessaloniki Concert Hall. The city also offers summer open-air cinemas where films are screened with Greek subtitles. Thessaloniki has a rich sports tradition, hosting major events like the 2004 Olympic Games and various international competitions. Numerous sports facilities are available, including the Kaftanzogleio National Stadium and Poseidonio Sports Centre. The Megas Alexandros International Marathon occurs annually, starting in Ancient Pella and finishing in Thessaloniki. Information on local sports facilities and events can be obtained from the municipality's departments."", 'The text provides a comprehensive overview of Thessaloniki, detailing various church denominations, museums, cultural exhibitions, sports facilities, public transport options, and traditional markets. It lists notable churches such as the Orthodox Metropolitan Church and the Armenian Orthodox Church, alongside museums like the Archaeological Museum of Thessaloniki and the Jewish Museum. Cultural venues include the Thessaloniki International Trade Fair and several theaters. Sports facilities mentioned include the Alexandreio Sports Arena and various football grounds. Public transport options include a long-distance bus station and a new railway station, while traditional markets like Kapani and Modiano are also highlighted.', ""This publication by the Greek National Tourism Organisation, supervised by Angela Varela and coordinated by Eleni Mitraki, features contributions from various professionals including journalist Yannis Ragos and translator Angeliki Christopoulou. It includes photo credits from multiple photographers and is designed by Zoe Tzomentzidou. The publication is not for sale and is available through the Greek National Tourism Organisation's website."", 'Asprovalta and Nea Vrasna beaches offer marine sports and beach volleyball facilities, with Asprovalta beach being 10 km long and awarded a Blue Flag. Stavros is the largest harbor in the area, while the villages of Vrasna and Ano Stavros feature traditional architecture. To reach these locations from Thessaloniki, take bus lines 83, 83M, or 83N to Lagkadas, or travel by coach or car towards Panorama and Kavala. Pikrolimni, located in the Kilkis region, is a shallow lake known for its healing mud with properties three times more concentrated than the Dead Sea. The first Mud-therapy Centre in the Balkans is in nearby Xylokeratia, offering various wellness facilities. Visitors can enjoy mud therapy by the lake in summer, and the center includes a physiotherapy clinic, hotel, restaurant, and sports fields. Pikrolimni is accessible by car or a daily bus from Thessaloniki.', 'The Palace of Galerius is an open-air archaeological museum in the historic center, constructed in the late 3rd to early 4th century. It is part of the Galerian Complex, which included significant structures like the Hippodrome and Rotunda. The palace served as a residence for emperors until its destruction in the 7th century and is a major monument of Late Antiquity. Key features include the Octagon, an audience hall with elaborate decoration; a colonnaded yard; a two-storeyed tank for water collection; a monumental Basilica used for official gatherings; and a bathhouse with various bathing facilities.', ""Eptapyrgio, built in the 12th century on an older fortress, features ten towers and remnants of Early Christian walls. The structure underwent modifications by the Ottoman Turks in 1431 and later became a prison in 1890. In 1989, it was transformed into a monument for visitors. Nearby, Palaeologina's Gate, constructed in 1355, leads to Trigoniou Tower, built in the 16th century. This area, known for its breathtaking views, is a popular spot for both locals and tourists."", ""Thessaloniki's Old Town, untouched by the 1917 fire, features a mix of Macedonian and Ottoman architecture. It became populated in the mid-15th century when the Ottomans settled there due to its favorable climate and strategic location. The area retains its original town planning with narrow alleys and squares, attracting artists and students in recent years. Architectural styles include neoclassical and eclectic motifs, particularly in residences of the Dönmeh. Despite modern developments, the Old Town has preserved much of its historical character."", 'The 6th walk along NEA PARALIA – VASILISSIS OLGAS AVENUE showcases a busy street with impressive late 19th to early 20th-century buildings. Notable sites include Allatini Villa, built in 1898, which served various purposes over the years, including housing the University of Thessaloniki and a military hospital. Casa Bianca, constructed in 1912, features eclectic and art nouveau elements and now hosts a branch of the Municipal Art Gallery. The Nehama Villa, built in 1907, is another significant structure on the avenue. Lastly, the Mordoch Villa, established in 1905, has a rich history, including use as military barracks and a polyclinic, and currently houses the Municipal Art Gallery.', ""The Historic Centre, built in 1866 by Sultan Hamid, was originally outside the east walls and restored in 1977 after modifications during the Interwar Period. Aristotle University of Thessaloniki (AUTH) is Greece's first university campus, established on the site of an old Jewish cemetery, with construction starting in 1938 and resuming in the 1950s. The campus features modern architecture by prominent Greek architects and accommodates over 100,000 students, making it the largest in Greece. Notable sites include the Old Building of the Faculty of Philosophy, constructed in 1887, and various museums showcasing ancient sculptures and Byzantine art."", ""The Yeni Camii, built in 1902 by architect V. Poselli, served as a mosque for converted Jews and later housed the city's Archaeological Museum. It now functions as a municipal exhibition area with a collection of Roman and Early Christian sculptures. The Hatzimisef Villa, located on Vas. Olgas Ave., was the town's first high school, while the Joseph Modiano villa nearby is currently uninhabited. A bust of King George I, assassinated in 1913, stands at the corner of Vas. Olgas Ave. and Agias Triadas St., crafted by K. Dimitriadis in 1915. The Ivan Hatzimisef Villa, built in 1897, now hosts cultural events and an organic food market. Additionally, the building at 34-36 Evzonon Street features classical, baroque, and renaissance architectural styles."", ""Lake Koroneia, also known as Lake Agios Vasileios, has significantly decreased in size and depth due to climate conditions and water resource exploitation. Nea Apollonia, a historic village near Lake Volvi, features mineral springs with therapeutic properties and modern health facilities. Lake Volvi is Greece's second-largest natural lake and a Ramsar site, offering birdwatching and various water sports. The area around Volvi includes tourist attractions and communities like Megali Volvi, Mikri Volvi, and Rentina, which is known for its natural beauty and historical ruins."", ""The text describes various historical and cultural sites in Thessaloniki, including the Greek Highschool built in 1893 and the Transfiguration of Christ Church, established in 1840 on the site of a 1543 chapel. The church features an icon screen depicting the Annunciation, with elements dating back to 1843 and 1943. It also mentions the Thessaloniki International Fair (TIF), inaugurated in 1926 and relocated in 1940, which has modern convention centers designed by notable Greek architects. Additionally, the Macedonian Museum of Contemporary Art, established in 1979, is highlighted as Greece's first modern art museum, showcasing modern sculptures and ancient artifacts."", ""The historic centre of Thessaloniki features industrial architecture from the late 19th century, including six warehouses built in 1910, which were revamped in 1997 for cultural events. These warehouses now house various institutions such as the International Film Festival, the Thessaloniki Cinema Museum, and the Centre of Contemporary Art. The Customs House, built in 1910, serves as the city's passenger board station and showcases early 20th-century French architectural influence. The Ladadika area, spared from the 1917 fire, dates back to the 16th century and was known for its wholesale trade, particularly spices and olive oil. The street layout remains largely unchanged since the late 19th century, with many buildings constructed from industrial brick and wood."", ""The Military Museum of the Balkan Wars, located in Gefyra village near Thessaloniki, showcases the area's history with rare relics and authentic furniture from the time of the Greek army's headquarters in 1912. Giannitsa, a modern town with a population of 35,000, features significant Ottoman monuments, including the mausoleum of Gazi Evrenos and the 14th-century hamam. The town is known for its cultural heritage and outdoor activities in nearby green areas. Notable sites include the clock tower and various mosques, reflecting the rich history of the region."", 'Thessaloniki offers a vibrant nightlife with clubs and venues, especially in the summer when many move to open-air locations. Popular areas include Kalamaria and Peraia. The city hosts numerous artistic events year-round, featuring venues like the Thessaloniki Concert Hall and various theaters. Cultural activities include the International Film Festival and the Thessaloniki Book Fair. The Thessaloniki Regency Casino operates 24/7, requiring guests to be 25 or older. Additionally, traditional products like koulouri and trigona Panoramatos are notable in the region.', 'The exhibition showcases Byzantine life, art, and culture from the early to post-Byzantine periods, organized by thematic categories. It includes sections on the Early Christian period, Middle Byzantine period, Late Byzantine period, and Post Byzantine period, each with specific rooms dedicated to various aspects of life and culture. The exhibition also features private collections, including the D. Papastratos Collection with religious art and the D. Oikonomopoulos Collection with a diverse range of artworks. The Jewish Museum of Thessaloniki is mentioned, highlighting its permanent exhibits related to Jewish history.', ""The Archaeological Museum of Thessaloniki displays significant art and artifacts from Macedonia, spanning from prehistoric times to late antiquity. The exhibits are categorized into six sections, including the origins of towns, the evolution of Macedonia from the 7th century BC to late antiquity, and the historical significance of Thessaloniki. Notable displays include exceptional gold craftsmanship from cemeteries, a reconstruction of an archaic temple, and unique items like the Derveni papyrus. The museum highlights the region's rich cultural heritage and its transition through various historical periods."", ""Thessaloniki hosts several cultural institutions, including museums and galleries showcasing Greek art. The collection features works by prominent Greek artists, Byzantine icons spanning five centuries, and Greek engravings. The Gallery of the Society for Macedonian Studies is the city's first visual arts museum, displaying 300 pieces from major 20th-century art movements. The Cultural Centre of Thessaloniki organizes exhibitions in collaboration with local agencies, featuring around 250 pieces of various art forms. The Thessaloniki Cinema Museum, established in 1997, highlights the history of Greek cinema through exhibits categorized into six timelines."", ""The text describes various historical and cultural sites in Thessaloniki, including the Holy Twelve Apostles Church and the remnants of the city's west walls, particularly the Litaia Gate. It highlights the Pasha Hamam, an Ottoman bathhouse built in the 1520s, which was the last of its kind in the area until its closure in 1981. The west of the harbour area saw significant growth in the late 19th century due to the demolition of city walls and the development of industrial units, which have since been transformed into cultural and entertainment venues. Notable sites include the Vilka multi-purpose venue, formerly a textile factory, and the Mylos venue, popular for events. The Moni Lazariston complex houses the State Museum of Contemporary Art, showcasing the area's cultural evolution."", 'The text provides contact information and websites for various museums and cultural institutions in Thessaloniki, including the Thessaloniki Cinema Museum, Museum of Photography, Olympic Museum, and more. It lists their addresses, telephone numbers, and websites, facilitating access to cultural resources. Additionally, it mentions a collaboration among five museums in Thessaloniki aimed at promoting cultural activities and organizing exhibitions. This collaboration includes the Archaeological Museum, Museum of Byzantine Culture, State Museum of Contemporary Art, Macedonian Museum of Modern Art, and the Teloglion Foundation of Art.', 'The text describes various historical and architectural sites in Thessaloniki, including the Jewish Museum housed in a 1904 building, Venizelou Street known for its eclectic and art deco styles, and the Pazar (Yahudi) Hamami, a 16th-century bathhouse. It highlights the architectural significance of the Gategno-Florentin Building and the Chamber of Commerce & Industry, showcasing neoclassical design. The area is also noted for its vibrant marketplace, including an open-air flower market known as Louloudadika.', 'The text describes two significant Byzantine monuments in the city. The first is the Moni Latomou, an early cross-in-square domed church from the 5th or 6th century, notable for its ceiling mosaics depicting the Vision of Ezekiel and a minaret entrance from its later conversion to a mosque. The second is Moni Vlatadon, the only active Byzantine monastery in the city, founded in the 14th century, featuring a unique church structure and significant murals from the 14th and 17th centuries. It also has a large garden with views of the city and additional facilities like a library and a bookstore.', 'Thessaloniki is a city in Greece known for its rich history, vibrant culture, and significant role in the Byzantine Empire.', 'The text describes the historical development of the area known as Nea Paralia in Thessaloniki, which began to grow in the late 19th century after the demolition of city walls and the introduction of tramways. Initially named Exoches due to its rural character, it became a luxury residential area with diverse nationalities coexisting. However, from the 1930s, the area declined and transformed into a typical urban setting by the 1960s. Today, Nea Paralia stretches along Megalou Alexandrou Avenue and is popular for leisure activities, offering scenic views of the Thermaic Gulf and Mount Olympus, especially at sunset. Notable landmarks include the statue of Alexander the Great and the artistic installation of umbrellas by N. Zongolopoulos.', ""Thessaloniki, an early center of Christianity, was significant during the Byzantine period, housing numerous Christian monuments and churches. These structures, built between the 4th and 15th centuries, have been recognized as UNESCO World Heritage Monuments since 1988. The Holy Twelve Apostles Church, one of the oldest, was constructed between 1310 and 1314 and served as the main church of a monastery. The church features murals and iconography depicting the life of the Holy Virgin. A tour of Thessaloniki's Byzantine monuments offers a unique experience, showcasing the city's rich historical and cultural heritage."", 'The text describes various notable locations in Ano Poli, Thessaloniki. Tsitsani Square features a bust of composer V. Tsitsanis and is surrounded by well-tended houses. Eptapyrgiou Street runs along the northern city walls, showcasing traditional buildings and the old Zihne Camii mosque. Moni Vlatadon is mentioned as a point of interest. Portara is one of the main gates of the northern city walls, adorned with ceramics and inscriptions. The Acropolis, specifically Eptapyrgio (Yedi Kule), is highlighted as a significant fortified area within the city walls. The area is popular among both residents and tourists.', 'The text provides information about various churches in Thessaloniki, including their addresses and contact numbers. It also highlights cultural events such as Demetria, an autumn festival featuring theatrical and musical performances, and the Thessaloniki International Film Festival, which has been held since 1960 and showcases films from various sections. Additionally, it mentions the Thessaloniki International Fair (T.I.F.), a significant trade fair in the Balkans that has been taking place since 1926, presenting Greek industry and entrepreneurship. Contact information for cultural offices and event organizations is also included.', ""Thessaloniki was founded in 315 BC by Cassander, named after his wife, and became a significant city under Roman control by 168 BC. It served as the capital of the Roman province of Macedonia by 148 BC and was connected to the wider world through the Via Egnatia around 130 BC. The city was declared a 'free town' in 42 BC and hosted Apostle Paul's visits. In the late 3rd to early 4th century AD, it became the seat of the eastern Roman Empire under Galerius. The city faced various raids but was protected by its walls. It experienced a golden age from 1300 to 1430, marked by cultural and economic growth. Thessaloniki changed hands multiple times, falling to the Venetians in 1423 and the Ottoman Turks in 1430, while also having a significant Jewish population in the 15th century.""]"," Thessaloniki's cultural heritage sites and historical significance are described in different reports, with some variations in emphasis and detail. The Historic Centre is highlighted in some reports as a major landmark, while other reports focus on archaeological sites, natural reserves, and historical monuments. Traditional restaurants and notable museums, such as the Biblical, Folk Art, and Criminology Museums, are also mentioned.

In the report from source 7, Thessaloniki is described as a city with rich history and cultural significance, with a focus on its archaeological sites and natural reserves.

In the report from source 18, the Historic Centre is highlighted as a major landmark, with mentions of modern blocks of flats, landmarks such as the three-storey interwar period mansion, and notable restaurants and cafes.

In the report from source 41, the 4th walk is described as Historic Centre (3), which houses exhibits of human skulls found in the area of Axios river (aged 9.5 million years) and in the Petralona Cave (see p. 92). The report also mentions the presence of other similar places, such as the Biblical, Folk Art, and Criminology Museums.

In the report from source 64, the 7th walk is described as","The various cultural heritage sites and their historical significance in Thessaloniki, particularly landmarks like the Historic Centre, traditional restaurants, and notable museums, showcase a blend of architectural styles and rich history, reflecting the city's evolution from a significant trade center to a vibrant cultural hub.",1.0,0.1,0.5625,0.7841520600573944,0.6656084655973721,0.7861904761747525,0.0,0.12499999984374999,,0.0
