,user_input,retrieved_contexts,reference_contexts,response,reference,context_recall,factual_correctness,faithfulness,semantic_similarity,llm_context_precision_without_reference,llm_context_precision_with_reference,non_llm_context_recall,context_entity_recall,noise_sensitivity_relevant,answer_relevancy
0,What are some notable Byzantine monuments in Thessaloniki?,"['The road \ndistances (in km) where \nThessaloniki is the starting \npoint get calculated from  \nthis square.\n2 \t\n\x07AROUND DIMOKRATIAS \nSQUARE\nThere are mostly faceless \nbuildings in the area – \namong them you will find \nsmall manufactures or old \nindustries. However there are \nalso historic sites, as there \nare sections of the city’s west \nwalls here, Byzantine and \nottoman monuments and other \narchaeological sites (temple  \nof Aphrodite, 6th c. BC).\nMUST SEE:\n2.1  Railway Station.\nIt is on Monastiriou Street \nwhich is renamed at some \npoint Egnatia Street (see p. 34). \nConstruction began in 1939 \nand it became fully operational \nin 1951, but it was officially \n66.  \nVardariou \nTower (Top \nHane).\n67.  \nOld steam \nengine \nfronting \nThessaloniki’s \nRailway \nStation.', '10\n1st walk: \nUNESCO BYZANTINE MONUMENTS\nThessaloniki has been  \none of the first towns to \nknow the Christian religion by \nthe Apostle Paul; during the \nByzantine period it used to be \nthe second most important \ncity of the empire (co-reigning \ncity) after Constantinople. \nAt that time (4th – 15th c.), \nChristian monuments and \nchurches were constructed in \nthe town, and these make up \na diachronic typology with a \ndecisive influence on the entire \nByzantine world. The following \nearly-Christian and Byzantine \nmonuments of the town are \nconsidered to be excellent \nspecimens of the Byzantine \nchurch-building and art, and \nfor this reason UNESCO \ndeclared them to be World \nHeritage Monuments, in 1988. \nA tour across this unique \nopen-air Byzantine museum  \nis truly a special experience.\n1 \t\x07HOLY TWELVE  \nAPOSTLES CHURCH\nOne of the town’s oldest \nchurches was built in 1310 – \n1314 under the sponsorship  \nof Patriarch Nephon I. It used \nto be a katholicon [main church] \nof a monastery dedicated to \nTheotokos [Mother of God] as \nshown by the mural depicting \nTheotokos and the Founder, \nas well as by the iconography \non the aisle with images of \nthe Holy Virgin’s life.', 'Note: To get a complete \npicture of the town’s Byzantine art \nmonuments make sure you visit  \nthe Museum of Byzantine Culture  \n(see p. 26 and p. 71).\n9. \nView of the \neastern walls  \nof Thessaloniki.\n9', 'George] whence \nthe monument took its \n4. \nThe church of the \nTransfiguration \nof the Saviour.\n5. \nThe impressive \nRotunda \nmonument \n(Agios Georgios).\n6. \nThe byzantine \nchurch of Agios \nDimitrios, \npatron saint of \nThessaloniki.\n5\n4', 'The last part consists of \nwhat is believed to have \nbeen the tomb of Alexander \nIV, son of Alexander the \nGreat and Roxanne, who was \nassassinated by Cassander in \n310 BC; a silver urn containing \nthe bones of the dead person, \nframed with the ivory relief \nmotifs of the funeral bed. \nIn a separate room, visitors \ncan watch a video where M. \nAndronikos takes them on a \ntour of the monuments. Other \nexcavations in the wider area \nof the Aiges necropolis have \nunearthed archaic tombs, pit \nand cist tombs (6th and 5th c. \nBC), as well as temple-shaped \nmacedonian tombs one of \nwhich apparently belonged  \nto Queen Eurydice, the mother  \nof King Philip II\nPalace. It covers a 12,500 \nm2 area and it used to be \nthe largest and the most \nimportant construction (next \nto Parthenon, Athens) of the \nHellenic Classical Antiquity. \nThis two-storeyed edifice \nis presumed to be the work \nof Pytheos who was the \narchitect of the Mausoleum \nof Halicarnassos [modern-day \nBodrum, Turkey], one of the 7 \nwonders of the ancient world. \nThe palace’s architectural style \nis considered avant-garde for \nthat time and it was built of \nlimestone during the 2nd half \nof the 4th c. BC on a plateau; \n101, 102 & \n103.']","[""UNESCO BYZANTINE MONUMENTS Thessaloniki has been one of the first towns to know the Christian religion by the Apostle Paul; during the Byzantine period it used to be the second most important city of the empire (co-reigning city) after Constantinople. At that time (4th – 15th c.), Christian monuments and churches were constructed in the town, and these make up a diachronic typology with a decisive influence on the entire Byzantine world. The following early-Christian and Byzantine monuments of the town are considered to be excellent specimens of the Byzantine church-building and art, and for this reason UNESCO declared them to be World Heritage Monuments, in 1988. A tour across this unique open-air Byzantine museum is truly a special experience. 1 \x07HOLY TWELVE APOSTLES CHURCH One of the town’s oldest churches was built in 1310 – 1314 under the sponsorship of Patriarch Nephon I. It used to be a katholicon [main church] of a monastery dedicated to Theotokos [Mother of God] as shown by the mural depicting Theotokos and the Founder, as well as by the iconography on the aisle with images of the Holy Virgin’s life. Out of the original monastery complex, -apart from the katholicon – there remain the NIKIS NIKIS GERMANOU SVOLOU IASONIDOU TSIMISKI VAS. IRAKLEIOU FILIPPOU AKROPOLEOS THEOTOKOPOULOU AKROPOLEOS OCHI AVENUE EPTAPYRGIOU SOFOKLEOUS OLYMPOU MONASTIRIOU KAZANTZAKI A N A G E NN I S E OS DAMONOS KALOU DRAGOUMANOU POLYTECHNIOU MITROPOLEOS ARISTOTELOUS DODEKANISOU LANGADA SALAMINOS ERMOU ANGELAKI ETHNIKIS AMYNAS AG. ANTONIOS AGIA THEODORA AG. ATHANASIOS AG. KONSTANTINOU YPAPANTI AGIOS STYLIANOS LAODI GITRIA TAXIARCHES AGIOS PAVLOS FANEROMENI AG. THEODOROI KALARI TSOPELA ISAVRON DELIOU IOANNI VELLIDI MAKRYGIANNI MITR. GENADIOU MODI PETROPOULAKIDON ARIANOU ARIANOU KLEISTHENOUS VIZYINOU KASTRON PANORMOU KES AMPATZOGLOU SKOPELOU PETRAS VASILIKO IRAKLEIAS SK SK KAVAFI ADRIANOUPOLEOS AIANT AGATHOUPOLEOS NG ROAD REDAISTO VYZOUKIDI VIZYINO THETIDOS AFXENTIOU MOUDANION PANEPISTIMIOU KALELPIDOS KONSTANTINOUPOLEOS SMYRNIS PYRGOU VRYANDOU KITROUS MELENIKOU PATR. IOAKEIM PALAION PATRON GERMANOU MICHAIL IO. ARMENOPOULOU IKTINOU KOMNINON SOLOMOU VLALI BALANOU ASKITOU VOGATSIKOU PLOUTARCHOU LASSANI MORKENTAOU TATI DRAGOUMI KYRIAKOU IOULIANOU SOKRATOUS EVRIPIDOU GYZI VLACHAVA AISCHYLOU ATHINAS MOREAS GKRATZIOU ATHONOS THEOFILOU PILEOS ANTIOCHOU VLATADON KASTOROS IGOUMENOU PERIANDROU POLYDOROU KLAFTHMONOS DRAGATSANIOU ACHTARI KARADIMOU DIONYSIOU EPIMENIDOU EVRYMEDONTOS AREOS ARTIS IRAKLIOU SYRAKOUSON PYDNAS KARAVANGELI TSAKALOF KIMONOS FLORINAS PLASTIRA FILIPPOU KLISTHENOUS FERON EVROU GKRATZIOU RAKTIVAN LAMPOUSIDI PASTER MAK KAMENIATOU PROFITI ILIA ATHINAS IFIKRATOUS PRASAKAKI STAVROU DIMOSTHENOUS KASTRITSIOU MENELAOU AMYNTA PELOPONNISOU PLATONOS DELMOUZOU AVDELA OUGKO KARATASOU KOUNTOURIOTI MIONIS CH. IATROU PAPANASTASIOU KLEISOURAS LAMPRAKI OLYMPIOU FEIDIOU FINTIA DAIDALOU VOULGAR THASO FREIDERIK NIKITARA IATRIDON THYRON KOZANIS KILKIS PONTOU NAFPLIOU VALTETSIOU KALPAKIOU LORDOU ELEFSINAS DELTA KONITSIS PLATONOS IPPOKRATOUS AGIOU DIMITRIOU VERMIOU SOUFLIOU BIZANIOU LECHO VOREIOU IPEIROU ARAP BOUBOUL KANARI KA AKI SOLOMOU LACHANA AGRAFON PSARON MIAOULI KAVALAS KRITIS LEVENTI KANARI GRAVIAS KYPROU FILIATRON ARACHTHOU TSACHILA AGRAFON KARVOUNIDI ERASMOU ELENIS KAPETAN NIKOLAOU PELOPONNISOU AGIOU PAVLOU MAKEDONOMACHON KONITSIS IKARON EL. VENIZELOU OMIROU IPEIROU KONTOSOGLOU PAPANIKOLI TEPELENIOU MEGARON VITSI KASTORIAS ARGYROKASTROU DIMITRIOU THASSOU FOKA PAPAFLESSA KOMNINON KONDYLI PANGKALOU KRITIS KRITIS EPIDAVROU LAMPRAKI CHORTIATI ELLIS ELPIDOS MAVROKORDATOU EPTAPYRGIOU EPTAPYRGIOU EPTAPYRGIOU EPTAPYRGIOU ANTHEON ATHANASIOU DIAKOU YPATROU GIALOUROU OU DODEKANISOU VAS. KONSTANTINOU MARKOU BOTSARI ANATOLIKIS ROMYLIAS U OI M R E V RIOU OPOS AISTOU DERMETZI APOLLONIADOS TYROLOIS BOROU PRIAMOU VORONOF OREIOU IPEIROU LATOMEION KATSONI ZALONGOU PAPANASTASIOU KAFKASOU METEORON KASSANDROU OLYMPIADOS A L. P A P A D O P O U L OU KASSANDROU OLYMPIADOS OLYMPOU POLYZOIDI AGIOU DIMITRIOU AGIOU DIMITRIOU AVRILIANIS ARKADIOUPOLEOS IFAISTIONOS ELPIDOS EL. VE NI ZE L O U NAVARINOU TYRNAVOU KOLOKOTRONI ARISTARCHOU KARAOLI PAPAGOU KASTAMONIS KARAVANGELI MATROZOU EVDOKIOU KESANIS KALLIKRATIAS VOULGAROKTONOU THEMISTOKLEOUS A R O G A X A N A KYPROU 28 OKTOVRIOU M. ASIAS ELLISPONTOU IT OIR U O T N U O K PARASKEVA NIGDIS ARAVYSSOU ALEXIOU TRANOU MOUSCHOUNTI KALAMPAKAS ROUZVELT ONOS SIOU OUMAN THOUKYDIDI ZARIFI SACHTOURI AKRITA KLIOS PERSEOS PYTHEOS RAKTIVAN ODYSSEOS SARAFI ETHN. ANTISTASEOS U O TIR K O M ID PARASKEVA PANIDOU OINOIS KARAOLI OLYMPOU ROMANIDI ARISTEIDOU SOULINI KRITIS DEXAMENI DIOS KALVOU EIRINIS PAPARIGOPOULOU PALAMA ZEFYRON MAVILI PINIOU GLADSTONOS THALIAS PRONOIAS SACHINI KRATEROU FILOTA SOURI ANTON SOUTSOU SYNGROU PTOLEMAION IOUSTINIANOU KARBOLA TOSITSA ZALIKI CHALKEON AMVROSIOU KRYSTALI ANTIGONIDON S T O U R N A R A MAKEDON O MACHON ELLISPONTOU LEFKOSIAS THER M OPYLON RIG A FE RAI O U KAFKASOU PANAGIAS FANEROMENIS EOS KAVAKION KORYDALLOU HMOU VOUTYRA YRILLOU PATR. FINTIA SANTAROZA SAPFOUS KARIOFYLLI AVEROF PANGAIOU AXIOU VAIOU PINDOU DOXIS VOTSI KALAPOTHAKI KATOUNI AIGYPTOU FRANGON DANAIDON AISOPOU ENOTIKON AFRODITIS NTEKA PAPATHANASIOU PAPADIMA GALANAKI IVANOF KAPATOU GDON HOUNTI CHATZITSIROU VAKCHOU STEFANAKI FARMAKI ODYSSEOS ODYSSEOS TANTALOU PROMITHEOS SAPFOUS NAVM. CHAPSA LIMNOU VALAORITI ORPHANIDI TANTALIDI OLYMPIOU DIAMANTI LOUI IPPODROMIOU NIKIFOROU DESPERE GOUNARI DIALETI DANGLI FILIKIS ETAIRIAS CHR. SMYRNIS MITR. IOSIF FOKA PANAGIA KARATZA KREMASTIS POLIORKITI SYNGROU VYRONOS AGIOS DIMITRIOS RIGA FERAIOU A R C H A I O T I T O N S E L E F K I D O N M E L E N I K O U PROX. KOROMILA PARASCHOU EPTAPYRGIO ANO POLI 40 EKKLISIES EVANGELISTRIA RIGAS FERAIOS KALLITHEA AXIOS MUNICIPAL PARK RODOCHORI EVANGELISTRIA'S CEMETERY KOLOKOTRONI TYROLOI VARNAS SQ. MOUSHOUNTI SQ. FANARIOTON SQ. ELEFTHERIAS SQ. EMPORIOU SQ. DIMOKRATIAS VARDARI SQ. KYPRION AGONISTON SQ. ARCHAIAS AG. SOFIAS AGORAS SQ. DIMITRION SQ. TERPSITHEA SQ. ROMFEI SQ. RAILWAY STATION SQ. RAILWAY ATION SQ. GALANOPOULOU SQ. SYNTRIVANIOU SQ. NAVARINOU SQ. SQ. SYKIES EAPOLI CHNI ZIDROU SQ. LYSSIATREIO AGIOS DIMITRIOS HOSPITAL GENERAL HOSPITAL OF THESSALONIKI G. GENNIMATAS U G O A 1 2 3 4 5 7 6 8 9 12 15 15 15 15 13 14 10 11 2. Southern view of Panagia Chalkeon Church. 3. Agia Sofia Church surrounded by a small garden.""]","Thessaloniki is rich in Byzantine heritage, making it a perfect destination for sightseeing. Here are some notable Byzantine monuments you should not miss:

1. **Holy Twelve Apostles Church**: Built between 1310 and 1314, this church is one of the oldest in the city. It features stunning murals and iconography, showcasing the artistry of Byzantine architecture.

2. **Agios Dimitrios Church**: This is the patron saint of Thessaloniki and a significant Byzantine monument. The church is renowned for its beautiful mosaics and historical importance, making it a must-visit.

3. **Rotunda (Agios Georgios)**: Originally built as a mausoleum for Emperor Galerius, the Rotunda later became a church. Its impressive structure and intricate mosaics reflect the grandeur of Byzantine art.

4. **Byzantine Walls**: The remnants of the city’s ancient walls offer a glimpse into Thessaloniki's past. Walking along these walls provides stunning views of the city and the sea.

5. **Museum of Byzantine Culture**: While not a monument per se, this museum houses an extensive collection of artifacts from the Byzantine era, providing context and depth to your exploration of the city’s monuments.

6. **Church of the Transfiguration of the Saviour**: This church is another excellent example of Byzantine architecture, known for its beautiful frescoes and serene atmosphere.

7. **Apostle Paul’s Church**: This church commemorates the Apostle Paul’s visit to Thessaloniki and features beautiful mosaics and a peaceful ambiance.

These sites not only highlight the architectural beauty of the Byzantine period but also offer opportunities for photography and local interaction, enriching your travel experience in Thessaloniki.","Thessaloniki is home to several notable Byzantine monuments, including the Holy Twelve Apostles Church, which was built between 1310 and 1314 and served as the main church of a monastery dedicated to Theotokos. These monuments are recognized for their architectural significance and were declared UNESCO World Heritage Monuments in 1988.",1.0,0.32,0.6451612903225806,0.7575189233101004,0.499999999975,0.49999999995,0.0,0.37499999953124996,,0.9759240112785452
1,What is Byzantine church-building and why is it important in Thessaloniki?,"['10\n1st walk: \nUNESCO BYZANTINE MONUMENTS\nThessaloniki has been  \none of the first towns to \nknow the Christian religion by \nthe Apostle Paul; during the \nByzantine period it used to be \nthe second most important \ncity of the empire (co-reigning \ncity) after Constantinople. \nAt that time (4th – 15th c.), \nChristian monuments and \nchurches were constructed in \nthe town, and these make up \na diachronic typology with a \ndecisive influence on the entire \nByzantine world. The following \nearly-Christian and Byzantine \nmonuments of the town are \nconsidered to be excellent \nspecimens of the Byzantine \nchurch-building and art, and \nfor this reason UNESCO \ndeclared them to be World \nHeritage Monuments, in 1988. \nA tour across this unique \nopen-air Byzantine museum  \nis truly a special experience.\n1 \t\x07HOLY TWELVE  \nAPOSTLES CHURCH\nOne of the town’s oldest \nchurches was built in 1310 – \n1314 under the sponsorship  \nof Patriarch Nephon I. It used \nto be a katholicon [main church] \nof a monastery dedicated to \nTheotokos [Mother of God] as \nshown by the mural depicting \nTheotokos and the Founder, \nas well as by the iconography \non the aisle with images of \nthe Holy Virgin’s life.', '42) is \nthought to have been the \nmain church of Nea Moni [New \nMonastery] or Moni Akapniou \n[Akapniou Monastery]. It was \nsituated in the area of the \nByzantine palaces and this \nis why the Turks had named \nthe area Balat (Palace) and \nthe church Eski Saray Camii \n(Old Palace mosque). It is a \ntetrastyle cross-in-square \ndomed church with features \nrelated to the monasterial \narchitecture of Mount Athos. \nThe central dome is supported \nby granite columns in the \nshape of a cross, the building’s \ncentral part was enlarged by \nthe addition of two conchs \n[semi-domes] whereas in \nthe west section there is a \nrectangular cupolaed narthex. \nThe murals (14th c.) depict \nimages of saints and scenes \nfrom the life and miracles of \nChrist. Also, at the junction of \nOlympiados and Amfilochias \nSts. there is a surviving \nottoman fountain.\n11\t\x07BYZANTINE BATHS  \n(KULE KAFE)\nIt is located on Romfei Sq. (see \np. 43) in Ano Poli and it is the \nonly surviving Byzantine bath \nhouse, a domed 13th c. building \nmade of brick, which was \nopen to the public until 1940. \n7. \nProfitis Ilias \nChurch.\n8. \nMoni Vlatadon \nis right in the \nheart of Upper \n(Old) City.\n7', '4 \tROMFEI SQUARE\nThis is Ano Poli’s central \nsquare. To reach it, take \nTheofilou Street where \nthe neoclassical building \nhousing the Vice-Mayor’s \noffice for Culture is located. \nIn the square, you will see a \nByzantine bath-house known \nas Koule Kafe (see p. 12); the \nentire area has been named \nafter it. On the NE side of the \nsquare (7, Krispou st.) you \nwill notice the architectural \nmasterpiece of a 19th c. \nneoclassical building which \nhouses the municipal Library of \nAno Poli. On Theotokopoulou \nStreet, near the square lies \nthe 14th c. Byzantine church \nof the Taxiarchs [Archangels] \nwhich used to be a monastery \nkatholikon [main church] and \nhas undergone later changes.\n5 \t\x07HOSIOS [VENERABLE] \nDAVID Church\n(Moni Latomou, see p. 13)\n44\n45', 'MAP OF THESSALONIKI\n\t\tPUBLIC AGENCIES – SERVICES\n\t 1.\tG.N.T.O. Information Office\t\n\t 2.\tMinistry of Macedonia – Thrace\t\n\t 3.\t\x07Region of Central Macedonia (Villa Allatini)\n\t 4.\tNew Town Hall\t\n\t 5.\tPolice Department – Aliens Office\t\n\t6.\tTourist Police Station\t\n\t 7.\tCentral Post Office\t\n\t8.\tCustoms (harbour)\t\n\t9.\tLaw Court\t\n\t10.\t\x07Aristotle University of Thessaloniki – Campus\n\t11.\tMarina\t\n\t\tROMAN MONUMENTS\n\t12.\tRoman Forum\t\n\t13.\tRotunda (Agios Georgios)\t\n\t14.\tArch of Galerius (Kamara)\t\n\t15.\tPalace of Galerius\t\n\t16.\tHippodrome\t\n\t\tBYZANTINE MONUMENTS\n\t17.\tHoly Twelve Apostles Church\t\n\t18.\tPanagia [Our Lady] Chalkeon Church\t\n\t19.\tAcheiropoiitos Church\t\n\t20.\tAgia Sofia Church\t\n\t21.\tMetamorfosi Sotiros Church\t\n\t22.\tAgios Panteleimonas Church\t\n\t23.\tAgios Dimitrios Church\t\n\t24.\tAgia Aikaterini Church\t\n\t25.\tProfitis Ilias Church\t\n\t26.\tByzantine Bath-house (Kule Kafe)\t\n\t27.', 'Acropolis. Excavations have \nbrought to light five towers \nthat were part of the Acropolis, \nand at a short distance there \nare ruins of the 3-metre \nthick fortification walls; in \nthe vicinity you will see the \nremains of house foundations \ndating to the period from the \n5th to the 1st c. BC.\n2.1  Veroia.\nThis beautiful and historic \ntown in the North of Greece  \nis located 8 km NW of Vergina. \nIt used to be the second most \nimportant town for ancient \nMacedonians, after Aiges; \nprosperity times went on \nduring the Roman and the \nByzantine period. Veroia was \none of the places visited by \nApostle Paul and a Podium  \nwas constructed in 1995  \nto commemorate this event. \nIn the past the town was also \nknown as Little Jerusalem \nbecause of the numerous \nByzantine and post-byzantine \nchurches out of which more \nthan 50 have survived. There \nis also a centuries-old Jewish \npresence in town; Barbouta \n(on the banks of Tripotamos \nRiver) is today the only \n102\n103']","[""UNESCO BYZANTINE MONUMENTS Thessaloniki has been one of the first towns to know the Christian religion by the Apostle Paul; during the Byzantine period it used to be the second most important city of the empire (co-reigning city) after Constantinople. At that time (4th – 15th c.), Christian monuments and churches were constructed in the town, and these make up a diachronic typology with a decisive influence on the entire Byzantine world. The following early-Christian and Byzantine monuments of the town are considered to be excellent specimens of the Byzantine church-building and art, and for this reason UNESCO declared them to be World Heritage Monuments, in 1988. A tour across this unique open-air Byzantine museum is truly a special experience. 1 \x07HOLY TWELVE APOSTLES CHURCH One of the town’s oldest churches was built in 1310 – 1314 under the sponsorship of Patriarch Nephon I. It used to be a katholicon [main church] of a monastery dedicated to Theotokos [Mother of God] as shown by the mural depicting Theotokos and the Founder, as well as by the iconography on the aisle with images of the Holy Virgin’s life. Out of the original monastery complex, -apart from the katholicon – there remain the NIKIS NIKIS GERMANOU SVOLOU IASONIDOU TSIMISKI VAS. IRAKLEIOU FILIPPOU AKROPOLEOS THEOTOKOPOULOU AKROPOLEOS OCHI AVENUE EPTAPYRGIOU SOFOKLEOUS OLYMPOU MONASTIRIOU KAZANTZAKI A N A G E NN I S E OS DAMONOS KALOU DRAGOUMANOU POLYTECHNIOU MITROPOLEOS ARISTOTELOUS DODEKANISOU LANGADA SALAMINOS ERMOU ANGELAKI ETHNIKIS AMYNAS AG. ANTONIOS AGIA THEODORA AG. ATHANASIOS AG. KONSTANTINOU YPAPANTI AGIOS STYLIANOS LAODI GITRIA TAXIARCHES AGIOS PAVLOS FANEROMENI AG. THEODOROI KALARI TSOPELA ISAVRON DELIOU IOANNI VELLIDI MAKRYGIANNI MITR. GENADIOU MODI PETROPOULAKIDON ARIANOU ARIANOU KLEISTHENOUS VIZYINOU KASTRON PANORMOU KES AMPATZOGLOU SKOPELOU PETRAS VASILIKO IRAKLEIAS SK SK KAVAFI ADRIANOUPOLEOS AIANT AGATHOUPOLEOS NG ROAD REDAISTO VYZOUKIDI VIZYINO THETIDOS AFXENTIOU MOUDANION PANEPISTIMIOU KALELPIDOS KONSTANTINOUPOLEOS SMYRNIS PYRGOU VRYANDOU KITROUS MELENIKOU PATR. IOAKEIM PALAION PATRON GERMANOU MICHAIL IO. ARMENOPOULOU IKTINOU KOMNINON SOLOMOU VLALI BALANOU ASKITOU VOGATSIKOU PLOUTARCHOU LASSANI MORKENTAOU TATI DRAGOUMI KYRIAKOU IOULIANOU SOKRATOUS EVRIPIDOU GYZI VLACHAVA AISCHYLOU ATHINAS MOREAS GKRATZIOU ATHONOS THEOFILOU PILEOS ANTIOCHOU VLATADON KASTOROS IGOUMENOU PERIANDROU POLYDOROU KLAFTHMONOS DRAGATSANIOU ACHTARI KARADIMOU DIONYSIOU EPIMENIDOU EVRYMEDONTOS AREOS ARTIS IRAKLIOU SYRAKOUSON PYDNAS KARAVANGELI TSAKALOF KIMONOS FLORINAS PLASTIRA FILIPPOU KLISTHENOUS FERON EVROU GKRATZIOU RAKTIVAN LAMPOUSIDI PASTER MAK KAMENIATOU PROFITI ILIA ATHINAS IFIKRATOUS PRASAKAKI STAVROU DIMOSTHENOUS KASTRITSIOU MENELAOU AMYNTA PELOPONNISOU PLATONOS DELMOUZOU AVDELA OUGKO KARATASOU KOUNTOURIOTI MIONIS CH. IATROU PAPANASTASIOU KLEISOURAS LAMPRAKI OLYMPIOU FEIDIOU FINTIA DAIDALOU VOULGAR THASO FREIDERIK NIKITARA IATRIDON THYRON KOZANIS KILKIS PONTOU NAFPLIOU VALTETSIOU KALPAKIOU LORDOU ELEFSINAS DELTA KONITSIS PLATONOS IPPOKRATOUS AGIOU DIMITRIOU VERMIOU SOUFLIOU BIZANIOU LECHO VOREIOU IPEIROU ARAP BOUBOUL KANARI KA AKI SOLOMOU LACHANA AGRAFON PSARON MIAOULI KAVALAS KRITIS LEVENTI KANARI GRAVIAS KYPROU FILIATRON ARACHTHOU TSACHILA AGRAFON KARVOUNIDI ERASMOU ELENIS KAPETAN NIKOLAOU PELOPONNISOU AGIOU PAVLOU MAKEDONOMACHON KONITSIS IKARON EL. VENIZELOU OMIROU IPEIROU KONTOSOGLOU PAPANIKOLI TEPELENIOU MEGARON VITSI KASTORIAS ARGYROKASTROU DIMITRIOU THASSOU FOKA PAPAFLESSA KOMNINON KONDYLI PANGKALOU KRITIS KRITIS EPIDAVROU LAMPRAKI CHORTIATI ELLIS ELPIDOS MAVROKORDATOU EPTAPYRGIOU EPTAPYRGIOU EPTAPYRGIOU EPTAPYRGIOU ANTHEON ATHANASIOU DIAKOU YPATROU GIALOUROU OU DODEKANISOU VAS. KONSTANTINOU MARKOU BOTSARI ANATOLIKIS ROMYLIAS U OI M R E V RIOU OPOS AISTOU DERMETZI APOLLONIADOS TYROLOIS BOROU PRIAMOU VORONOF OREIOU IPEIROU LATOMEION KATSONI ZALONGOU PAPANASTASIOU KAFKASOU METEORON KASSANDROU OLYMPIADOS A L. P A P A D O P O U L OU KASSANDROU OLYMPIADOS OLYMPOU POLYZOIDI AGIOU DIMITRIOU AGIOU DIMITRIOU AVRILIANIS ARKADIOUPOLEOS IFAISTIONOS ELPIDOS EL. VE NI ZE L O U NAVARINOU TYRNAVOU KOLOKOTRONI ARISTARCHOU KARAOLI PAPAGOU KASTAMONIS KARAVANGELI MATROZOU EVDOKIOU KESANIS KALLIKRATIAS VOULGAROKTONOU THEMISTOKLEOUS A R O G A X A N A KYPROU 28 OKTOVRIOU M. ASIAS ELLISPONTOU IT OIR U O T N U O K PARASKEVA NIGDIS ARAVYSSOU ALEXIOU TRANOU MOUSCHOUNTI KALAMPAKAS ROUZVELT ONOS SIOU OUMAN THOUKYDIDI ZARIFI SACHTOURI AKRITA KLIOS PERSEOS PYTHEOS RAKTIVAN ODYSSEOS SARAFI ETHN. ANTISTASEOS U O TIR K O M ID PARASKEVA PANIDOU OINOIS KARAOLI OLYMPOU ROMANIDI ARISTEIDOU SOULINI KRITIS DEXAMENI DIOS KALVOU EIRINIS PAPARIGOPOULOU PALAMA ZEFYRON MAVILI PINIOU GLADSTONOS THALIAS PRONOIAS SACHINI KRATEROU FILOTA SOURI ANTON SOUTSOU SYNGROU PTOLEMAION IOUSTINIANOU KARBOLA TOSITSA ZALIKI CHALKEON AMVROSIOU KRYSTALI ANTIGONIDON S T O U R N A R A MAKEDON O MACHON ELLISPONTOU LEFKOSIAS THER M OPYLON RIG A FE RAI O U KAFKASOU PANAGIAS FANEROMENIS EOS KAVAKION KORYDALLOU HMOU VOUTYRA YRILLOU PATR. FINTIA SANTAROZA SAPFOUS KARIOFYLLI AVEROF PANGAIOU AXIOU VAIOU PINDOU DOXIS VOTSI KALAPOTHAKI KATOUNI AIGYPTOU FRANGON DANAIDON AISOPOU ENOTIKON AFRODITIS NTEKA PAPATHANASIOU PAPADIMA GALANAKI IVANOF KAPATOU GDON HOUNTI CHATZITSIROU VAKCHOU STEFANAKI FARMAKI ODYSSEOS ODYSSEOS TANTALOU PROMITHEOS SAPFOUS NAVM. CHAPSA LIMNOU VALAORITI ORPHANIDI TANTALIDI OLYMPIOU DIAMANTI LOUI IPPODROMIOU NIKIFOROU DESPERE GOUNARI DIALETI DANGLI FILIKIS ETAIRIAS CHR. SMYRNIS MITR. IOSIF FOKA PANAGIA KARATZA KREMASTIS POLIORKITI SYNGROU VYRONOS AGIOS DIMITRIOS RIGA FERAIOU A R C H A I O T I T O N S E L E F K I D O N M E L E N I K O U PROX. KOROMILA PARASCHOU EPTAPYRGIO ANO POLI 40 EKKLISIES EVANGELISTRIA RIGAS FERAIOS KALLITHEA AXIOS MUNICIPAL PARK RODOCHORI EVANGELISTRIA'S CEMETERY KOLOKOTRONI TYROLOI VARNAS SQ. MOUSHOUNTI SQ. FANARIOTON SQ. ELEFTHERIAS SQ. EMPORIOU SQ. DIMOKRATIAS VARDARI SQ. KYPRION AGONISTON SQ. ARCHAIAS AG. SOFIAS AGORAS SQ. DIMITRION SQ. TERPSITHEA SQ. ROMFEI SQ. RAILWAY STATION SQ. RAILWAY ATION SQ. GALANOPOULOU SQ. SYNTRIVANIOU SQ. NAVARINOU SQ. SQ. SYKIES EAPOLI CHNI ZIDROU SQ. LYSSIATREIO AGIOS DIMITRIOS HOSPITAL GENERAL HOSPITAL OF THESSALONIKI G. GENNIMATAS U G O A 1 2 3 4 5 7 6 8 9 12 15 15 15 15 13 14 10 11 2. Southern view of Panagia Chalkeon Church. 3. Agia Sofia Church surrounded by a small garden.""]","Byzantine church-building refers to the architectural and artistic practices associated with the construction of churches during the Byzantine Empire, which lasted from the 4th to the 15th century. This style is characterized by its grand domes, intricate mosaics, and the use of cross-in-square designs. In Thessaloniki, Byzantine church-building holds significant historical and cultural importance, as the city was a major center of Christianity and a key location during the Byzantine period.

Thessaloniki is home to several UNESCO World Heritage Sites, showcasing some of the finest examples of Byzantine architecture. These churches not only served as places of worship but also as symbols of the city’s religious and political significance within the empire. Notable examples include the Holy Twelve Apostles Church, built in the early 14th century, and the Panagia Chalkeon Church, both of which exhibit the distinctive features of Byzantine design.

The importance of these monuments lies in their role as cultural artifacts that reflect the artistic and spiritual values of the time. They provide insight into the evolution of Christian architecture and the influence of Byzantine art on subsequent architectural styles. Additionally, these churches are integral to Thessaloniki's identity, attracting visitors who seek to explore the city’s rich history and heritage.

For a solo traveler interested in sightseeing, the Byzantine churches of Thessaloniki offer not only stunning visuals for photography but also opportunities to engage with local culture. Visiting these sites allows for a deeper understanding of the city’s past and its significance in the broader context of Byzantine history. Overall, Byzantine church-building is a vital aspect of Thessaloniki’s cultural landscape, making it a must-see for anyone exploring the city.","Byzantine church-building refers to the construction of Christian monuments and churches during the Byzantine period, particularly in Thessaloniki, which was the second most important city of the empire after Constantinople. This period, spanning from the 4th to the 15th century, saw the creation of significant Christian monuments that have a decisive influence on the entire Byzantine world. These monuments are recognized for their architectural and artistic value, leading UNESCO to declare them World Heritage Monuments in 1988.",1.0,0.7,0.8,0.8108956980867551,0.999999999975,0.9999999999,0.0,0.5555555549382716,,0.9300421430489294
2,What was Constantinople's role in the Byzantine Empire?,"['• Middle Byzantine \nperiod (8th – 12th c.). It \nincludes the chapters: i) From \nIconomachy to the splendour \nof the Macedonian and the \nKomnenian Dynasties (room 4) \nwhere the art and culture of \nthe middle Byzantine period \nis shown, ii) Dynasties of the \nByzantine emperors (room \n5) where visitors can use \nlearning resources to explore \nthe imperial dynasties from \nemperor Heraclius (610 – 641) \nuntil the Palaiologan Dynasty \n(1261 – 1453) and iii) The \nByzantine Castle (room 6) \ndealing with the creation and \nstructuring of a castle in those \ntimes.\n• Late Byzantine period \n(1204-1453). The chapter \nThe twilight of Byzantium \n(room 7) describes the last \ncenturies of the empire i.e.  \nthe period between 1204 \nwhen Constantinople was \nseized by the Crusaders and \n1453 when it was conquered \nby the Ottoman Turks.\n• Post Byzantine period \n(1453 – 19th c.). A chapter \ntitled Byzantium after \nByzantium –Byzantine legacy \nin the years that followed the \nConquest unfolds in room 10.\n• Private collections.', '10\n1st walk: \nUNESCO BYZANTINE MONUMENTS\nThessaloniki has been  \none of the first towns to \nknow the Christian religion by \nthe Apostle Paul; during the \nByzantine period it used to be \nthe second most important \ncity of the empire (co-reigning \ncity) after Constantinople. \nAt that time (4th – 15th c.), \nChristian monuments and \nchurches were constructed in \nthe town, and these make up \na diachronic typology with a \ndecisive influence on the entire \nByzantine world. The following \nearly-Christian and Byzantine \nmonuments of the town are \nconsidered to be excellent \nspecimens of the Byzantine \nchurch-building and art, and \nfor this reason UNESCO \ndeclared them to be World \nHeritage Monuments, in 1988. \nA tour across this unique \nopen-air Byzantine museum  \nis truly a special experience.\n1 \t\x07HOLY TWELVE  \nAPOSTLES CHURCH\nOne of the town’s oldest \nchurches was built in 1310 – \n1314 under the sponsorship  \nof Patriarch Nephon I. It used \nto be a katholicon [main church] \nof a monastery dedicated to \nTheotokos [Mother of God] as \nshown by the mural depicting \nTheotokos and the Founder, \nas well as by the iconography \non the aisle with images of \nthe Holy Virgin’s life.', '6\nEver since the 4th c. BC when it was founded, \nThessaloniki has kept its urban character and has \nremained a civic centre and the hub of that region. \nThe city’s centuries-old multicultural history has been \nassociated with great empires, as it has known the \nRoman, Byzantine and Ottoman Rule. The town was also \ngreatly influenced by many ethnic and religious groups \n(Jews, Latins, Armenians and others) as well as Greeks \nfrom Constantinople, Pontus [modern-day northeastern \nTurkey] and Asia Minor [a.k.a. Anatolia]. The numerous \nmonuments, dating to many historical periods, coexist in \na singular and charming way and manifest Thessaloniki’s \nhistorical multicultural and cosmopolitan nature.\n1. \nThe White Tower \narea is one of the \nbusiest parts of \nthe city, where \nthe old seafront \n(Nikis Ave.) meets \nthe new (eastern) \nwaterfront area \nof Thessaloniki.\nDION – VERGINA – ANCIENT PELLA\nPETRALONA CAVE – LAKES AREA\nTHESSALONIKI', '9\nT H E S S A LO N I K I\nsettles in town, chased out  \nof European countries – \nmostly of the Iberian pninsula. \nTheir role in Thessaloniki’s \nhistory will be a significant \none until the mid-20th century.\n 16th-18th c.:\t\nThessaloniki grows,  \nand the various ethnic and \nreligious communities live  \nin harmony. In the 18th c.  \nthe town acquires the features  \nof a large trade centre.\n Late 19th c.:\t\nA railway connection is \nestablished with Europe and \nConstantinople. Infrastructure \ngets streamlined and \nThessaloniki acquires the feel \nof a cosmopolitan European \ncity. The Greeks become at \nthis point in time the largest \npart of the population.\n 1890:\t\nFire incinerates a considerable \npart of the town’s seafront \nzone.\n 1912:\t\nDuring the 1st Balkan War, \nthe Greek army seizes the \ntown on October 26th; after \nfive centuries of ottoman \noccupation, Thessaloniki \nbecomes part of Greece.\n 1916:\t\nFollowing a clash with \nKing Constantine, Eleftherios \nVenizelos forms the \ntemporary “National Defence \nGovernment” in Thessaloniki, \nwhich remained there for \nseveral months.\n 1917:\t\nThe biggest part of the \ntown is destroyed by a fire \nthat breaks out on August \n18th and lasts for 32 hours.', '11\n1st walk: \nUNESCO BYZANTINE MONUMENTS\nportal to the southwest and \nthe cistern to the northwest. \nIt is a complex tetrastyle \ncross-in-square church with \na narthex and a peristyle on \nthe three sides and extremely \nsymmetrical proportions. \nWhen it was converted into \na mosque, during the Turkish \nrule, the murals and mosaics – \noutstanding specimens  \nof Palaeologan art dating  \nto the 14th c. – were covered  \nby plaster and a minaret was \nadded to the southwestern side.\n2 \t\n\x07PANAGIA CHALKEON \nCHURCH\nIt is located on the SW side \nof Dikastirion Sq. [Law Courts \nSq.]. It was built in 1128 on \nthe site of an ancient temple \nof Hephaestus or Kaveiros.  \nIt is a representative specimen \nof the architecture of the \n“School of Constantinople” and \nwas thus named because of \nthe area it was built on, known \nas the district of coppersmiths \n(masters of copper – chalkos). \nThe most prominent feature \nis the level above the narthex. \nIn 1430 it was converted into \na mosque and was named \nKazancilar Camii.\n3 \t\x07\nACHEIROPOIITOS \nCHURCH\nIt was founded in the second \nhalf of the 5th c. on the site \nof the roman public baths \nand it was dedicated to \nPanagia (Virgin Mary).']","[""UNESCO BYZANTINE MONUMENTS Thessaloniki has been one of the first towns to know the Christian religion by the Apostle Paul; during the Byzantine period it used to be the second most important city of the empire (co-reigning city) after Constantinople. At that time (4th – 15th c.), Christian monuments and churches were constructed in the town, and these make up a diachronic typology with a decisive influence on the entire Byzantine world. The following early-Christian and Byzantine monuments of the town are considered to be excellent specimens of the Byzantine church-building and art, and for this reason UNESCO declared them to be World Heritage Monuments, in 1988. A tour across this unique open-air Byzantine museum is truly a special experience. 1 \x07HOLY TWELVE APOSTLES CHURCH One of the town’s oldest churches was built in 1310 – 1314 under the sponsorship of Patriarch Nephon I. It used to be a katholicon [main church] of a monastery dedicated to Theotokos [Mother of God] as shown by the mural depicting Theotokos and the Founder, as well as by the iconography on the aisle with images of the Holy Virgin’s life. Out of the original monastery complex, -apart from the katholicon – there remain the NIKIS NIKIS GERMANOU SVOLOU IASONIDOU TSIMISKI VAS. IRAKLEIOU FILIPPOU AKROPOLEOS THEOTOKOPOULOU AKROPOLEOS OCHI AVENUE EPTAPYRGIOU SOFOKLEOUS OLYMPOU MONASTIRIOU KAZANTZAKI A N A G E NN I S E OS DAMONOS KALOU DRAGOUMANOU POLYTECHNIOU MITROPOLEOS ARISTOTELOUS DODEKANISOU LANGADA SALAMINOS ERMOU ANGELAKI ETHNIKIS AMYNAS AG. ANTONIOS AGIA THEODORA AG. ATHANASIOS AG. KONSTANTINOU YPAPANTI AGIOS STYLIANOS LAODI GITRIA TAXIARCHES AGIOS PAVLOS FANEROMENI AG. THEODOROI KALARI TSOPELA ISAVRON DELIOU IOANNI VELLIDI MAKRYGIANNI MITR. GENADIOU MODI PETROPOULAKIDON ARIANOU ARIANOU KLEISTHENOUS VIZYINOU KASTRON PANORMOU KES AMPATZOGLOU SKOPELOU PETRAS VASILIKO IRAKLEIAS SK SK KAVAFI ADRIANOUPOLEOS AIANT AGATHOUPOLEOS NG ROAD REDAISTO VYZOUKIDI VIZYINO THETIDOS AFXENTIOU MOUDANION PANEPISTIMIOU KALELPIDOS KONSTANTINOUPOLEOS SMYRNIS PYRGOU VRYANDOU KITROUS MELENIKOU PATR. IOAKEIM PALAION PATRON GERMANOU MICHAIL IO. ARMENOPOULOU IKTINOU KOMNINON SOLOMOU VLALI BALANOU ASKITOU VOGATSIKOU PLOUTARCHOU LASSANI MORKENTAOU TATI DRAGOUMI KYRIAKOU IOULIANOU SOKRATOUS EVRIPIDOU GYZI VLACHAVA AISCHYLOU ATHINAS MOREAS GKRATZIOU ATHONOS THEOFILOU PILEOS ANTIOCHOU VLATADON KASTOROS IGOUMENOU PERIANDROU POLYDOROU KLAFTHMONOS DRAGATSANIOU ACHTARI KARADIMOU DIONYSIOU EPIMENIDOU EVRYMEDONTOS AREOS ARTIS IRAKLIOU SYRAKOUSON PYDNAS KARAVANGELI TSAKALOF KIMONOS FLORINAS PLASTIRA FILIPPOU KLISTHENOUS FERON EVROU GKRATZIOU RAKTIVAN LAMPOUSIDI PASTER MAK KAMENIATOU PROFITI ILIA ATHINAS IFIKRATOUS PRASAKAKI STAVROU DIMOSTHENOUS KASTRITSIOU MENELAOU AMYNTA PELOPONNISOU PLATONOS DELMOUZOU AVDELA OUGKO KARATASOU KOUNTOURIOTI MIONIS CH. IATROU PAPANASTASIOU KLEISOURAS LAMPRAKI OLYMPIOU FEIDIOU FINTIA DAIDALOU VOULGAR THASO FREIDERIK NIKITARA IATRIDON THYRON KOZANIS KILKIS PONTOU NAFPLIOU VALTETSIOU KALPAKIOU LORDOU ELEFSINAS DELTA KONITSIS PLATONOS IPPOKRATOUS AGIOU DIMITRIOU VERMIOU SOUFLIOU BIZANIOU LECHO VOREIOU IPEIROU ARAP BOUBOUL KANARI KA AKI SOLOMOU LACHANA AGRAFON PSARON MIAOULI KAVALAS KRITIS LEVENTI KANARI GRAVIAS KYPROU FILIATRON ARACHTHOU TSACHILA AGRAFON KARVOUNIDI ERASMOU ELENIS KAPETAN NIKOLAOU PELOPONNISOU AGIOU PAVLOU MAKEDONOMACHON KONITSIS IKARON EL. VENIZELOU OMIROU IPEIROU KONTOSOGLOU PAPANIKOLI TEPELENIOU MEGARON VITSI KASTORIAS ARGYROKASTROU DIMITRIOU THASSOU FOKA PAPAFLESSA KOMNINON KONDYLI PANGKALOU KRITIS KRITIS EPIDAVROU LAMPRAKI CHORTIATI ELLIS ELPIDOS MAVROKORDATOU EPTAPYRGIOU EPTAPYRGIOU EPTAPYRGIOU EPTAPYRGIOU ANTHEON ATHANASIOU DIAKOU YPATROU GIALOUROU OU DODEKANISOU VAS. KONSTANTINOU MARKOU BOTSARI ANATOLIKIS ROMYLIAS U OI M R E V RIOU OPOS AISTOU DERMETZI APOLLONIADOS TYROLOIS BOROU PRIAMOU VORONOF OREIOU IPEIROU LATOMEION KATSONI ZALONGOU PAPANASTASIOU KAFKASOU METEORON KASSANDROU OLYMPIADOS A L. P A P A D O P O U L OU KASSANDROU OLYMPIADOS OLYMPOU POLYZOIDI AGIOU DIMITRIOU AGIOU DIMITRIOU AVRILIANIS ARKADIOUPOLEOS IFAISTIONOS ELPIDOS EL. VE NI ZE L O U NAVARINOU TYRNAVOU KOLOKOTRONI ARISTARCHOU KARAOLI PAPAGOU KASTAMONIS KARAVANGELI MATROZOU EVDOKIOU KESANIS KALLIKRATIAS VOULGAROKTONOU THEMISTOKLEOUS A R O G A X A N A KYPROU 28 OKTOVRIOU M. ASIAS ELLISPONTOU IT OIR U O T N U O K PARASKEVA NIGDIS ARAVYSSOU ALEXIOU TRANOU MOUSCHOUNTI KALAMPAKAS ROUZVELT ONOS SIOU OUMAN THOUKYDIDI ZARIFI SACHTOURI AKRITA KLIOS PERSEOS PYTHEOS RAKTIVAN ODYSSEOS SARAFI ETHN. ANTISTASEOS U O TIR K O M ID PARASKEVA PANIDOU OINOIS KARAOLI OLYMPOU ROMANIDI ARISTEIDOU SOULINI KRITIS DEXAMENI DIOS KALVOU EIRINIS PAPARIGOPOULOU PALAMA ZEFYRON MAVILI PINIOU GLADSTONOS THALIAS PRONOIAS SACHINI KRATEROU FILOTA SOURI ANTON SOUTSOU SYNGROU PTOLEMAION IOUSTINIANOU KARBOLA TOSITSA ZALIKI CHALKEON AMVROSIOU KRYSTALI ANTIGONIDON S T O U R N A R A MAKEDON O MACHON ELLISPONTOU LEFKOSIAS THER M OPYLON RIG A FE RAI O U KAFKASOU PANAGIAS FANEROMENIS EOS KAVAKION KORYDALLOU HMOU VOUTYRA YRILLOU PATR. FINTIA SANTAROZA SAPFOUS KARIOFYLLI AVEROF PANGAIOU AXIOU VAIOU PINDOU DOXIS VOTSI KALAPOTHAKI KATOUNI AIGYPTOU FRANGON DANAIDON AISOPOU ENOTIKON AFRODITIS NTEKA PAPATHANASIOU PAPADIMA GALANAKI IVANOF KAPATOU GDON HOUNTI CHATZITSIROU VAKCHOU STEFANAKI FARMAKI ODYSSEOS ODYSSEOS TANTALOU PROMITHEOS SAPFOUS NAVM. CHAPSA LIMNOU VALAORITI ORPHANIDI TANTALIDI OLYMPIOU DIAMANTI LOUI IPPODROMIOU NIKIFOROU DESPERE GOUNARI DIALETI DANGLI FILIKIS ETAIRIAS CHR. SMYRNIS MITR. IOSIF FOKA PANAGIA KARATZA KREMASTIS POLIORKITI SYNGROU VYRONOS AGIOS DIMITRIOS RIGA FERAIOU A R C H A I O T I T O N S E L E F K I D O N M E L E N I K O U PROX. KOROMILA PARASCHOU EPTAPYRGIO ANO POLI 40 EKKLISIES EVANGELISTRIA RIGAS FERAIOS KALLITHEA AXIOS MUNICIPAL PARK RODOCHORI EVANGELISTRIA'S CEMETERY KOLOKOTRONI TYROLOI VARNAS SQ. MOUSHOUNTI SQ. FANARIOTON SQ. ELEFTHERIAS SQ. EMPORIOU SQ. DIMOKRATIAS VARDARI SQ. KYPRION AGONISTON SQ. ARCHAIAS AG. SOFIAS AGORAS SQ. DIMITRION SQ. TERPSITHEA SQ. ROMFEI SQ. RAILWAY STATION SQ. RAILWAY ATION SQ. GALANOPOULOU SQ. SYNTRIVANIOU SQ. NAVARINOU SQ. SQ. SYKIES EAPOLI CHNI ZIDROU SQ. LYSSIATREIO AGIOS DIMITRIOS HOSPITAL GENERAL HOSPITAL OF THESSALONIKI G. GENNIMATAS U G O A 1 2 3 4 5 7 6 8 9 12 15 15 15 15 13 14 10 11 2. Southern view of Panagia Chalkeon Church. 3. Agia Sofia Church surrounded by a small garden.""]","Constantinople, founded by Emperor Constantine the Great in 330 AD, served as the capital of the Byzantine Empire and was pivotal to its political, economic, and cultural life. Strategically located at the crossroads of Europe and Asia, it became a vital hub for trade and military operations, facilitating the exchange of goods, ideas, and cultures.

As the heart of the Byzantine Empire, Constantinople was not only a political center but also a religious one. It housed significant Christian institutions and was the seat of the Patriarch of Constantinople, making it a focal point for Orthodox Christianity. The city was adorned with magnificent churches, such as Hagia Sophia, which symbolized the empire's wealth and devotion.

Throughout its history, Constantinople was a melting pot of diverse cultures and ethnicities, reflecting the empire's expansive reach. This multicultural environment fostered a rich artistic and intellectual life, leading to advancements in art, architecture, and philosophy. The city's architectural innovations, particularly in church design, influenced Byzantine art and culture throughout the empire.

Constantinople also played a crucial role during times of conflict. It was the last bastion of the Byzantine Empire against external threats, including invasions by the Crusaders and later the Ottoman Turks. The city's fall in 1453 marked the end of the Byzantine Empire, but its legacy continued to influence the region's culture and history.

In summary, Constantinople was the epicenter of the Byzantine Empire, shaping its political, religious, and cultural landscape. Its strategic location, architectural grandeur, and diverse population made it a symbol of Byzantine strength and resilience, leaving an indelible mark on history.","Constantinople was the most important city of the Byzantine Empire, serving as its capital and co-reigning city during the Byzantine period.",1.0,0.17,0.5333333333333333,0.7287029117581638,0.0,0.0,0.0,0.249999999375,,0.8348299502437847
3,"Can you provide detailed information about the Holy Twelve Apostles Church in Thessaloniki, including its history and significance?","['MAP OF THESSALONIKI\n\t\tPUBLIC AGENCIES – SERVICES\n\t 1.\tG.N.T.O. Information Office\t\n\t 2.\tMinistry of Macedonia – Thrace\t\n\t 3.\t\x07Region of Central Macedonia (Villa Allatini)\n\t 4.\tNew Town Hall\t\n\t 5.\tPolice Department – Aliens Office\t\n\t6.\tTourist Police Station\t\n\t 7.\tCentral Post Office\t\n\t8.\tCustoms (harbour)\t\n\t9.\tLaw Court\t\n\t10.\t\x07Aristotle University of Thessaloniki – Campus\n\t11.\tMarina\t\n\t\tROMAN MONUMENTS\n\t12.\tRoman Forum\t\n\t13.\tRotunda (Agios Georgios)\t\n\t14.\tArch of Galerius (Kamara)\t\n\t15.\tPalace of Galerius\t\n\t16.\tHippodrome\t\n\t\tBYZANTINE MONUMENTS\n\t17.\tHoly Twelve Apostles Church\t\n\t18.\tPanagia [Our Lady] Chalkeon Church\t\n\t19.\tAcheiropoiitos Church\t\n\t20.\tAgia Sofia Church\t\n\t21.\tMetamorfosi Sotiros Church\t\n\t22.\tAgios Panteleimonas Church\t\n\t23.\tAgios Dimitrios Church\t\n\t24.\tAgia Aikaterini Church\t\n\t25.\tProfitis Ilias Church\t\n\t26.\tByzantine Bath-house (Kule Kafe)\t\n\t27.', '60\n7th walk: \nWEST OF THE CENTRE-STAVROUPOLI\n2.6  Holy Twelve Apostles \nChurch\n(see p. 8).\n2.7  West City Walls.\nSections of the city’s west walls  \nremain along Arkadioupoleos and \nEirinis Streets and finds related \nto Litaia Gate have recently \nbeen located at the corner \nof Agiou Dimitriou and Agiou \nNestoros Streets. This gate \nused to be one of the seven \ngreat gates of the fortified city \nand formed part of the Early \nChristian period walls; it was \nnamed after Liti, a Byzantine \ntown to which the gate led. \nThe Golden Gate was also \nlocated on the Egnatia  \nStreet level.\n2.8  Pasha Hamam  \n[Paşa Hamami] (Phoenix  \nBath house).\nIt was built during the \n1520s by Cezeri Kasim Paşa. \nAlso known as Phoenix Bath \nhouse, this used to be the \nlast ottoman bath house open \nin town, as it closed down in \nas late as 1981. It is located \nat the corner of Kalvou and \nPineiou Streets, near the west \nwalls and the church of the \nHoly Twelve Apostles, and the \nstructure of the building was \nplanned with great care.', 'It is located \nat the corner of Kalvou and \nPineiou Streets, near the west \nwalls and the church of the \nHoly Twelve Apostles, and the \nstructure of the building was \nplanned with great care.\n3 \t \x07\nWEST OF THE \nHARBOUR\nThe area began to grow in \nthe late 19th century, after the \ndemolition of the seafront city \nwall and the ensuing pulling \ndown of large sections of the \ncity’s west and east walls. \nThe short distance to the \nharbour and the rail system \nconstruction were two decisive \nfactors which led to large \nindustrial unit installations  \nin the area. In recent decades \nmany of these buildings \nwere changed into culture \nand entertainment venues, \nwhile others are scheduled \nto become sports or cultural \ncentres. An example would be \nthe listed building of the old \nMunicipal Slaughterhouse (early \n20th c.), near the FIX factory, \nafter which the entire district \nwas named. \nMUST SEE:\n3.1  Vilka multi purpose \nvenue.\nThis is the old textile factory \nof Torres and Co., renamed \nVilka, which closed down in \n1988 and is now restructured \ninto a space reserved for various \nevents and entertainment, as it \nincludes a theatre, concert halls, \ncafés and bars.\n68\n68.  \nMylos multi-\npurpose \nvenue is one \nof the most \npopular places \nfor hosting \nevents and \nentertainments \nin Thessaloniki.\n69.', '10\n1st walk: \nUNESCO BYZANTINE MONUMENTS\nThessaloniki has been  \none of the first towns to \nknow the Christian religion by \nthe Apostle Paul; during the \nByzantine period it used to be \nthe second most important \ncity of the empire (co-reigning \ncity) after Constantinople. \nAt that time (4th – 15th c.), \nChristian monuments and \nchurches were constructed in \nthe town, and these make up \na diachronic typology with a \ndecisive influence on the entire \nByzantine world. The following \nearly-Christian and Byzantine \nmonuments of the town are \nconsidered to be excellent \nspecimens of the Byzantine \nchurch-building and art, and \nfor this reason UNESCO \ndeclared them to be World \nHeritage Monuments, in 1988. \nA tour across this unique \nopen-air Byzantine museum  \nis truly a special experience.\n1 \t\x07HOLY TWELVE  \nAPOSTLES CHURCH\nOne of the town’s oldest \nchurches was built in 1310 – \n1314 under the sponsorship  \nof Patriarch Nephon I. It used \nto be a katholicon [main church] \nof a monastery dedicated to \nTheotokos [Mother of God] as \nshown by the mural depicting \nTheotokos and the Founder, \nas well as by the iconography \non the aisle with images of \nthe Holy Virgin’s life.', 'This is also the location of the \nNautical Club of Thessaloniki.\n1.6  Thessaloniki Concert \nHall.\nIt was inaugurated in 2000 on \na privileged location. The town’s \nByzantine history was the source \nof inspiration for its architectural \nplanning and it is one of the \nbest equipped concert halls in \nEurope. The facilities include a \nhall providing seating for 1464 \nwhere concerts, dance and \nopera performances as well as \nconferences are held, and  \na restaurant. The neighbouring \n2nd building of the Concert \nHall (designed by Japanese \nA. Isozaki) includes halls for \nconcerts and conferences, a \nMuseum of Musical Instruments \nand a Music Library. The \nPoseidonio Sports Centre  \nis located nearby.\n2 \tDEPOT AREA\nThe area was named after the \nsite of the tram depot buildings \nand this complex has been \nlisted as a Historic Monument, \nsituated at the corner of Vas. \nOlgas and Typa Streets. The \ntram used to connect the city \ncentre with this area from 1893 \nuntil 1957. It is the easternmost \npart of the Exoches area \n[meaning Countryside] where \ntraces of its older atmosphere \nstill remain in several places.\nMUST SEE: \n2.1  Allatini Mills.\nDeserted since 1990, this \n57.  \nThe church \nof Saints \nCyril and \nMethodius.\n58.  \nThe \nThessaloniki \nConcert Hall.\n59.  \nAllatini Villa in \nDepot area.']","[""UNESCO BYZANTINE MONUMENTS Thessaloniki has been one of the first towns to know the Christian religion by the Apostle Paul; during the Byzantine period it used to be the second most important city of the empire (co-reigning city) after Constantinople. At that time (4th – 15th c.), Christian monuments and churches were constructed in the town, and these make up a diachronic typology with a decisive influence on the entire Byzantine world. The following early-Christian and Byzantine monuments of the town are considered to be excellent specimens of the Byzantine church-building and art, and for this reason UNESCO declared them to be World Heritage Monuments, in 1988. A tour across this unique open-air Byzantine museum is truly a special experience. 1 \x07HOLY TWELVE APOSTLES CHURCH One of the town’s oldest churches was built in 1310 – 1314 under the sponsorship of Patriarch Nephon I. It used to be a katholicon [main church] of a monastery dedicated to Theotokos [Mother of God] as shown by the mural depicting Theotokos and the Founder, as well as by the iconography on the aisle with images of the Holy Virgin’s life. Out of the original monastery complex, -apart from the katholicon – there remain the NIKIS NIKIS GERMANOU SVOLOU IASONIDOU TSIMISKI VAS. IRAKLEIOU FILIPPOU AKROPOLEOS THEOTOKOPOULOU AKROPOLEOS OCHI AVENUE EPTAPYRGIOU SOFOKLEOUS OLYMPOU MONASTIRIOU KAZANTZAKI A N A G E NN I S E OS DAMONOS KALOU DRAGOUMANOU POLYTECHNIOU MITROPOLEOS ARISTOTELOUS DODEKANISOU LANGADA SALAMINOS ERMOU ANGELAKI ETHNIKIS AMYNAS AG. ANTONIOS AGIA THEODORA AG. ATHANASIOS AG. KONSTANTINOU YPAPANTI AGIOS STYLIANOS LAODI GITRIA TAXIARCHES AGIOS PAVLOS FANEROMENI AG. THEODOROI KALARI TSOPELA ISAVRON DELIOU IOANNI VELLIDI MAKRYGIANNI MITR. GENADIOU MODI PETROPOULAKIDON ARIANOU ARIANOU KLEISTHENOUS VIZYINOU KASTRON PANORMOU KES AMPATZOGLOU SKOPELOU PETRAS VASILIKO IRAKLEIAS SK SK KAVAFI ADRIANOUPOLEOS AIANT AGATHOUPOLEOS NG ROAD REDAISTO VYZOUKIDI VIZYINO THETIDOS AFXENTIOU MOUDANION PANEPISTIMIOU KALELPIDOS KONSTANTINOUPOLEOS SMYRNIS PYRGOU VRYANDOU KITROUS MELENIKOU PATR. IOAKEIM PALAION PATRON GERMANOU MICHAIL IO. ARMENOPOULOU IKTINOU KOMNINON SOLOMOU VLALI BALANOU ASKITOU VOGATSIKOU PLOUTARCHOU LASSANI MORKENTAOU TATI DRAGOUMI KYRIAKOU IOULIANOU SOKRATOUS EVRIPIDOU GYZI VLACHAVA AISCHYLOU ATHINAS MOREAS GKRATZIOU ATHONOS THEOFILOU PILEOS ANTIOCHOU VLATADON KASTOROS IGOUMENOU PERIANDROU POLYDOROU KLAFTHMONOS DRAGATSANIOU ACHTARI KARADIMOU DIONYSIOU EPIMENIDOU EVRYMEDONTOS AREOS ARTIS IRAKLIOU SYRAKOUSON PYDNAS KARAVANGELI TSAKALOF KIMONOS FLORINAS PLASTIRA FILIPPOU KLISTHENOUS FERON EVROU GKRATZIOU RAKTIVAN LAMPOUSIDI PASTER MAK KAMENIATOU PROFITI ILIA ATHINAS IFIKRATOUS PRASAKAKI STAVROU DIMOSTHENOUS KASTRITSIOU MENELAOU AMYNTA PELOPONNISOU PLATONOS DELMOUZOU AVDELA OUGKO KARATASOU KOUNTOURIOTI MIONIS CH. IATROU PAPANASTASIOU KLEISOURAS LAMPRAKI OLYMPIOU FEIDIOU FINTIA DAIDALOU VOULGAR THASO FREIDERIK NIKITARA IATRIDON THYRON KOZANIS KILKIS PONTOU NAFPLIOU VALTETSIOU KALPAKIOU LORDOU ELEFSINAS DELTA KONITSIS PLATONOS IPPOKRATOUS AGIOU DIMITRIOU VERMIOU SOUFLIOU BIZANIOU LECHO VOREIOU IPEIROU ARAP BOUBOUL KANARI KA AKI SOLOMOU LACHANA AGRAFON PSARON MIAOULI KAVALAS KRITIS LEVENTI KANARI GRAVIAS KYPROU FILIATRON ARACHTHOU TSACHILA AGRAFON KARVOUNIDI ERASMOU ELENIS KAPETAN NIKOLAOU PELOPONNISOU AGIOU PAVLOU MAKEDONOMACHON KONITSIS IKARON EL. VENIZELOU OMIROU IPEIROU KONTOSOGLOU PAPANIKOLI TEPELENIOU MEGARON VITSI KASTORIAS ARGYROKASTROU DIMITRIOU THASSOU FOKA PAPAFLESSA KOMNINON KONDYLI PANGKALOU KRITIS KRITIS EPIDAVROU LAMPRAKI CHORTIATI ELLIS ELPIDOS MAVROKORDATOU EPTAPYRGIOU EPTAPYRGIOU EPTAPYRGIOU EPTAPYRGIOU ANTHEON ATHANASIOU DIAKOU YPATROU GIALOUROU OU DODEKANISOU VAS. KONSTANTINOU MARKOU BOTSARI ANATOLIKIS ROMYLIAS U OI M R E V RIOU OPOS AISTOU DERMETZI APOLLONIADOS TYROLOIS BOROU PRIAMOU VORONOF OREIOU IPEIROU LATOMEION KATSONI ZALONGOU PAPANASTASIOU KAFKASOU METEORON KASSANDROU OLYMPIADOS A L. P A P A D O P O U L OU KASSANDROU OLYMPIADOS OLYMPOU POLYZOIDI AGIOU DIMITRIOU AGIOU DIMITRIOU AVRILIANIS ARKADIOUPOLEOS IFAISTIONOS ELPIDOS EL. VE NI ZE L O U NAVARINOU TYRNAVOU KOLOKOTRONI ARISTARCHOU KARAOLI PAPAGOU KASTAMONIS KARAVANGELI MATROZOU EVDOKIOU KESANIS KALLIKRATIAS VOULGAROKTONOU THEMISTOKLEOUS A R O G A X A N A KYPROU 28 OKTOVRIOU M. ASIAS ELLISPONTOU IT OIR U O T N U O K PARASKEVA NIGDIS ARAVYSSOU ALEXIOU TRANOU MOUSCHOUNTI KALAMPAKAS ROUZVELT ONOS SIOU OUMAN THOUKYDIDI ZARIFI SACHTOURI AKRITA KLIOS PERSEOS PYTHEOS RAKTIVAN ODYSSEOS SARAFI ETHN. ANTISTASEOS U O TIR K O M ID PARASKEVA PANIDOU OINOIS KARAOLI OLYMPOU ROMANIDI ARISTEIDOU SOULINI KRITIS DEXAMENI DIOS KALVOU EIRINIS PAPARIGOPOULOU PALAMA ZEFYRON MAVILI PINIOU GLADSTONOS THALIAS PRONOIAS SACHINI KRATEROU FILOTA SOURI ANTON SOUTSOU SYNGROU PTOLEMAION IOUSTINIANOU KARBOLA TOSITSA ZALIKI CHALKEON AMVROSIOU KRYSTALI ANTIGONIDON S T O U R N A R A MAKEDON O MACHON ELLISPONTOU LEFKOSIAS THER M OPYLON RIG A FE RAI O U KAFKASOU PANAGIAS FANEROMENIS EOS KAVAKION KORYDALLOU HMOU VOUTYRA YRILLOU PATR. FINTIA SANTAROZA SAPFOUS KARIOFYLLI AVEROF PANGAIOU AXIOU VAIOU PINDOU DOXIS VOTSI KALAPOTHAKI KATOUNI AIGYPTOU FRANGON DANAIDON AISOPOU ENOTIKON AFRODITIS NTEKA PAPATHANASIOU PAPADIMA GALANAKI IVANOF KAPATOU GDON HOUNTI CHATZITSIROU VAKCHOU STEFANAKI FARMAKI ODYSSEOS ODYSSEOS TANTALOU PROMITHEOS SAPFOUS NAVM. CHAPSA LIMNOU VALAORITI ORPHANIDI TANTALIDI OLYMPIOU DIAMANTI LOUI IPPODROMIOU NIKIFOROU DESPERE GOUNARI DIALETI DANGLI FILIKIS ETAIRIAS CHR. SMYRNIS MITR. IOSIF FOKA PANAGIA KARATZA KREMASTIS POLIORKITI SYNGROU VYRONOS AGIOS DIMITRIOS RIGA FERAIOU A R C H A I O T I T O N S E L E F K I D O N M E L E N I K O U PROX. KOROMILA PARASCHOU EPTAPYRGIO ANO POLI 40 EKKLISIES EVANGELISTRIA RIGAS FERAIOS KALLITHEA AXIOS MUNICIPAL PARK RODOCHORI EVANGELISTRIA'S CEMETERY KOLOKOTRONI TYROLOI VARNAS SQ. MOUSHOUNTI SQ. FANARIOTON SQ. ELEFTHERIAS SQ. EMPORIOU SQ. DIMOKRATIAS VARDARI SQ. KYPRION AGONISTON SQ. ARCHAIAS AG. SOFIAS AGORAS SQ. DIMITRION SQ. TERPSITHEA SQ. ROMFEI SQ. RAILWAY STATION SQ. RAILWAY ATION SQ. GALANOPOULOU SQ. SYNTRIVANIOU SQ. NAVARINOU SQ. SQ. SYKIES EAPOLI CHNI ZIDROU SQ. LYSSIATREIO AGIOS DIMITRIOS HOSPITAL GENERAL HOSPITAL OF THESSALONIKI G. GENNIMATAS U G O A 1 2 3 4 5 7 6 8 9 12 15 15 15 15 13 14 10 11 2. Southern view of Panagia Chalkeon Church. 3. Agia Sofia Church surrounded by a small garden.""]","The Holy Twelve Apostles Church, located in Thessaloniki, is one of the city's oldest and most significant Byzantine monuments. Built between 1310 and 1314, it was commissioned under the sponsorship of Patriarch Nephon I and served as the katholicon (main church) of a monastery dedicated to the Theotokos (Mother of God). The church is renowned for its exquisite architecture and rich iconography, which reflects the artistic achievements of the Byzantine era.

The church features a unique cross-in-square design, typical of Byzantine architecture, with a dome that adds to its grandeur. Inside, visitors can admire stunning frescoes and mosaics that depict scenes from the life of the Holy Virgin and various saints, showcasing the artistic style of the period. The mural of Theotokos and the Founder is particularly noteworthy, illustrating the church's dedication and historical significance.

In 1988, the Holy Twelve Apostles Church was designated a UNESCO World Heritage Site, recognizing its importance as a representative of early Christian and Byzantine architecture. This designation highlights its role in the cultural and religious history of Thessaloniki, which was a major center of Christianity during the Byzantine Empire.

For visitors, the church not only offers a glimpse into the past but also serves as a serene spot for reflection amidst the bustling city. Its location near the West City Walls and other historical sites makes it an ideal stop for sightseeing. The church's rich history and stunning architecture provide ample opportunities for photography, making it a perfect Instagrammable spot.

Overall, the Holy Twelve Apostles Church stands as a testament to Thessaloniki's rich Byzantine heritage and is a must-visit for anyone interested in the city's history and culture.","The Holy Twelve Apostles Church is one of the oldest churches in Thessaloniki, built between 1310 and 1314 under the sponsorship of Patriarch Nephon I. It served as the main church of a monastery dedicated to Theotokos (Mother of God), which is evident from the mural depicting Theotokos and the Founder, as well as the iconography on the aisle illustrating the life of the Holy Virgin. The church is part of the early-Christian and Byzantine monuments in Thessaloniki, which were recognized by UNESCO as World Heritage Monuments in 1988 due to their exceptional representation of Byzantine church-building and art. This makes a visit to the Holy Twelve Apostles Church a significant experience for those interested in the history and architecture of the Byzantine period.",0.75,0.45,0.5,0.9055309311366144,0.249999999975,0.249999999975,0.0,0.28571428551020406,,0.8879470136519941
4,What is the historical significance of Albania in relation to Egnatia Street?,"['34\n1 \tEGNATIA STREET\nThis central avenue has \nbeen there practically since \nThessaloniki’s founding,  \nas it is a section of the road \nconstructed by the Romans  \nin the 2nd c. BC, and connected \nDyrrhachium (Durrës, in \nmodern day Albania) with \nConstantinople. It starts at \nDimokratia square (see p. 58) \nand ends at the TIF grounds \n(see p. 31) and the Aristotle \nUniversity of Thessaloniki, \nsplitting in two the town’s \nhistoric centre. It is a busy \nshopping area with numerous \nremarkable buildings of \neclectic and art deco style \ndating to the early 20th c. \n(mostly old hotels) that are \nabsolutely worth observing,  \nas well as some of the city’s \nmost important monuments.\nMUST SEE:\n1.1  Kolomvou Square.\nThe crossroads where \nEgnatia Street meets \nAntigonidon Street is indeed \na bustling one! It was named \nafter G. Colombo, an Italian \nwho opened a hotel there  \nin the early 20th century. This \nis the location of Kolomvou \nArchway (31, Egnatia St.) \nwhich has become a leisure \nhub with cafés, bars and \nrestaurants inside.\n1.2  Hamza Bey Mosque.\nIt was built in 1467 by the \ndaughter of Hamza Bey, the \nmilitary commander of Sultan \nMurad II.', 'The monumental style of \narchitecture is shown in the \nbuildings’ facades, colonnades, \narcades and porticos, which \ncombine elements from the \ncity’s Byzantine tradition \nwith European interwar \nperiod motifs. The square is \nlandmarked by two identical \nconcave buildings: Electra \nPalace hotel (late sixties) - \nbuilt by GNTO architects -  \non the west side, and Olympion \non the east side, which was \nprogressively erected and \ncompleted by the late fifties \n(designed by J. Moshé) \nand is now the seat of the \nThessaloniki Film Festival  \n(see p. 108).\nMUST SEE:\n1.1  Aristotelous Street.\nPedestrianised historic \nboulevard, that ends in Egnatia \nStreet (see p. 34). According \nto the Hébrard plans, it would \n2nd walk: \nHISTORIC CENTRE (1) \nTRADITIONAL COMMERCIAL CENTRE\n4.1\n6.1\n6.3\n6.2\n6.5\n6.6\n6.7\n1.1\n1.2\n6.8\n7.5\n7.3\n7.2\n7.2\n7.1\n7.4\n6.4\n3.1\n1\n2\n3\n4\n5\n7', 'Notice the glass globe on \nthe top of the building, a point \nof reference in Eleftherias Sq. \nIn the neighbouring Komninon \nStreet it is worth noticing the \neclectic style on buildings \nsuch as Luxemburg Hotel as \nwell as Tourist and Excelsior \nHotels at the junction with \nMitropoleos streets.\n4 \tPORT\nThe area is one of the biggest \nports of the country and of the \nsoutheastern Mediterranean, \nwith a significant trade and \npassenger traffic. This is where \nthe first artificial harbour of \nthe town was constructed by \nConstantine the Great during \nhis short stay in Thessaloniki \n(322-323 AD); later on during \nthe Turkish Occupation it \nwas banked up with earth. \n2nd walk: \nHISTORIC CENTRE (1)\nTRADITIONAL COMMERCIAL CENTRE', '60\n7th walk: \nWEST OF THE CENTRE-STAVROUPOLI\n2.6  Holy Twelve Apostles \nChurch\n(see p. 8).\n2.7  West City Walls.\nSections of the city’s west walls  \nremain along Arkadioupoleos and \nEirinis Streets and finds related \nto Litaia Gate have recently \nbeen located at the corner \nof Agiou Dimitriou and Agiou \nNestoros Streets. This gate \nused to be one of the seven \ngreat gates of the fortified city \nand formed part of the Early \nChristian period walls; it was \nnamed after Liti, a Byzantine \ntown to which the gate led. \nThe Golden Gate was also \nlocated on the Egnatia  \nStreet level.\n2.8  Pasha Hamam  \n[Paşa Hamami] (Phoenix  \nBath house).\nIt was built during the \n1520s by Cezeri Kasim Paşa. \nAlso known as Phoenix Bath \nhouse, this used to be the \nlast ottoman bath house open \nin town, as it closed down in \nas late as 1981. It is located \nat the corner of Kalvou and \nPineiou Streets, near the west \nwalls and the church of the \nHoly Twelve Apostles, and the \nstructure of the building was \nplanned with great care.', 'The road \ndistances (in km) where \nThessaloniki is the starting \npoint get calculated from  \nthis square.\n2 \t\n\x07AROUND DIMOKRATIAS \nSQUARE\nThere are mostly faceless \nbuildings in the area – \namong them you will find \nsmall manufactures or old \nindustries. However there are \nalso historic sites, as there \nare sections of the city’s west \nwalls here, Byzantine and \nottoman monuments and other \narchaeological sites (temple  \nof Aphrodite, 6th c. BC).\nMUST SEE:\n2.1  Railway Station.\nIt is on Monastiriou Street \nwhich is renamed at some \npoint Egnatia Street (see p. 34). \nConstruction began in 1939 \nand it became fully operational \nin 1951, but it was officially \n66.  \nVardariou \nTower (Top \nHane).\n67.  \nOld steam \nengine \nfronting \nThessaloniki’s \nRailway \nStation.']","['34 1 EGNATIA STREET This central avenue has been there practically since Thessaloniki’s founding, as it is a section of the road constructed by the Romans in the 2nd c. BC, and connected Dyrrhachium (Durrës, in modern day Albania) with Constantinople. It starts at Dimokratia square (see p. 58) and ends at the TIF grounds (see p. 31) and the Aristotle University of Thessaloniki, splitting in two the town’s historic centre. It is a busy shopping area with numerous remarkable buildings of eclectic and art deco style dating to the early 20th c. (mostly old hotels) that are absolutely worth observing, as well as some of the city’s most important monuments. MUST SEE: 1.1 Kolomvou Square. The crossroads where Egnatia Street meets Antigonidon Street is indeed a bustling one! It was named after G. Colombo, an Italian who opened a hotel there in the early 20th century. This is the location of Kolomvou Archway (31, Egnatia St.) which has become a leisure hub with cafés, bars and restaurants inside. 1.2 Hamza Bey Mosque. It was built in 1467 by the daughter of Hamza Bey, the military commander of Sultan Murad II. It is the only mosque in Greece with a peristyle (a colonnaded yard). For many decades it housed a cinema named Alkazar. Currently there are renovation works under way. Once they are finished, it will house an exhibition of finds unearthed during the metro excavations. Right behind it you will see the City Manor which housed the Town Hall until recently. It is known at Karavan Serai as there used to be an ottoman inn here. (early 16th c.). 4th walk:']","Egnatia Street holds historical significance as it is a remnant of the ancient Roman road system, originally constructed in the 2nd century BC. This road connected Dyrrhachium, known today as Durrës in Albania, with Constantinople (modern-day Istanbul). The route facilitated trade and cultural exchange between the regions, making it a vital artery for commerce and communication in antiquity.

The connection to Albania is particularly noteworthy because Dyrrhachium was one of the key ports on the Adriatic Sea, serving as a gateway for goods and travelers moving between the eastern and western parts of the Roman Empire. This strategic location allowed for the flow of resources, ideas, and cultural influences, contributing to the development of both Thessaloniki and the surrounding areas.

Egnatia Street itself has evolved over the centuries, transforming from a Roman thoroughfare into a bustling modern avenue that splits Thessaloniki's historic center. Today, it is lined with eclectic and art deco buildings, reflecting the city’s architectural heritage and vibrant commercial life. The street remains a focal point for visitors, offering access to significant landmarks, shopping areas, and cultural sites.

For a solo traveler interested in history and local culture, exploring Egnatia Street provides an opportunity to appreciate the layers of history that have shaped Thessaloniki. The street not only serves as a reminder of the city's Roman past but also highlights its ongoing connection to neighboring regions, including Albania. This historical context enriches the experience of sightseeing, making it an Instagrammable spot where one can capture the essence of Thessaloniki's rich heritage while enjoying the lively atmosphere of the area.","Egnatia Street is historically significant as it was part of the road constructed by the Romans in the 2nd century BC, connecting Dyrrhachium (modern-day Durrës in Albania) with Constantinople.",1.0,0.55,0.5185185185185185,0.8214635959845262,0.6999999999766667,0.9999999999,1.0,0.8571428559183674,,0.841302752846206
5,Can you tell me more about the TIF grounds and what is around it in Thessaloniki?,"['Moreover, the TIF grounds \nhouse two modern convention \ncentres, namely Ioannis \nVellidis offering seating for \n2,100 and Nikolaos Germanos \nwith seating for 400. You  \ncan enter through the gate  \non the YMCA square, the one  \non Angelaki street or through \nthe two gates on Egnatia \nstreet (for TIF, see p. 108).\nMUST SEE:\n10.1 Macedonian Museum \nof Contemporary Art.\nIt was established in 1979 \nand it is the first museum of \nmodern art in Greece. Since \n2001, it has been housed in a \nbuilding that covers a 4,000m2 \narea. In the courtyard there \nare modern sculptures, such \nas “Umbrellas”, a construction \nof moveable parts with water. \n(1995, G. Zongolopoulos, \nsee also p. 51); there are also \nroman graves and a road on \ndisplay dating to the 2nd – 3rd \nc. AD (for museum collections \n29\n30', 'It is about an excursion taken \nto the most interesting parts \nof the viticultural zone; this is \ncombined with a visit to the \narchaeological and historical \nassets of those areas, with \ncountryside activities, as \nwell as a visit to wineries \nand degustation. Make sure \nyou visit the impressive \nGerovassiliou Wine Museum  \nin Epanomi (see p. 68 & 80). \nFor more information, \ncontact the Wine Roads \nof North Greece: tel: 2310 \n281.617 and 2310 281.632, \nwww.winesofnorthgreece.gr\n121, 122 & \n123.  \nThessaloniki \noffers its little \nvisitors a host \nof fun activities \nand games to \nchoose from.\n121\n122', ': 2310 454.111 \nwebsite: www.naokth.gr\nTheme Park Fields \n(see p. --)\nMegas Alexandros \nInternational Marathon \nrace. \nIt takes place every spring;  \nthe starting point is in Ancient \nPella and the finish is in \nThessaloniki town. 5 and 10 \nkm races get also organised. \nFor more information: \ntel.: \x072310 200.360,  \n2310 725.775\nwebsite: www.atgm.gr\nDepartment of Municipal \nGyms, Swimming Pools \nand Sport Grounds of \nthe Municipality of \nThessaloniki \nGr. Lampraki & 57, Kleanthous Sts.\ntel.: 2310 317.636\nDepartment of Sporting \nEvents & Programms \nof the Municipality of \nThessaloniki \nGr. Lampraki & 57, Kleanthous Sts. \ntel.: 2310 317.636\nYou can get information on \nmunicipal gyms, the municipal \nINFORMATION', '98\nNIGHTLIFE\nfacilities. During the summer \nmonths though, most of \nthose clubs and venues move \nto open-air grounds in the \nairport area (see p. 106). \nAnother favourite area to \nThessalonians is Kalamaria \n(see p. 64) and, a bit further \noff, Peraia (see p. 67).   \nApart from the \nentertainment options, \na host of artistic events \nget organised in the city \nthroughout the entire \nyear: choose among the \nThessaloniki Concert Hall \n[Megaro] (see p. 52), the \nVasiliko [Royal] Theatre  \n(see p. 25), the Theatre of \nthe Society for Macedonian \nStudies (see p. 25 & 109), \nMoni Lazariston (see p. 61),  \nthe Forest Theatre [Theatro \nDasous] and the Theatre  \nof the Earth [Theatro Gis] \n(see p. 48); or you can opt for a \nvisit to museums (see p. 70-81) \nand smaller cultural venues. Last \nbut not least, you can visit the \nInternational Film Festival, \nthe Thessaloniki Book Fair, the \nDemetria Festival (see p. 108-\n109), and other venues housing \nevents on a smaller scale by  \nprivate companies or city \nagencies.\nFinally, the Thessaloniki \nRegency Casino is located \nat the 12th km on the \nThessaloniki – Airport Road \nand is open around the clock.', '88\nDAY EXCURSIONS\nJewish quarter in Europe, \nwhich maintains a traditional \ncharacter in its entirety. It \nis worth taking a walk and \nvisiting the Roman, Ottoman \nand Industrial age monuments \nin the traditional districts of \nKyriotissa, Panagia Dexia, and \nMakariotissa; you can also visit \nthe Public Central Library which \nhas earned an international \naward, or relax in the parks  \nand squares.\nHow to get there.  \nVergina is about 63 km SW  \nof Thessaloniki. If you travel by \ncar, follow the signs to Veroia \nand after that to Vergina. You \ncan also take the intercity bus \nor the train to reach Veroia  \nand then take the local bus  \nto Vergina.\n3 \tDION\nThis most enchanting \narchaeological site is  \nlocated under the imposing \nOlympus mountain range, in  \na 150-hectare green area amid \nflowing waters coming from \nVafyras River and from other \nsprings; it is the habitat of \nmany species of birds, reptiles \nand amphibians. This used to \nbe a sacred place to ancient \nMacedonians who worshipped \nOlympian Zeus and the Muses \n[daughters of Zeus] here.']","['34 1 EGNATIA STREET This central avenue has been there practically since Thessaloniki’s founding, as it is a section of the road constructed by the Romans in the 2nd c. BC, and connected Dyrrhachium (Durrës, in modern day Albania) with Constantinople. It starts at Dimokratia square (see p. 58) and ends at the TIF grounds (see p. 31) and the Aristotle University of Thessaloniki, splitting in two the town’s historic centre. It is a busy shopping area with numerous remarkable buildings of eclectic and art deco style dating to the early 20th c. (mostly old hotels) that are absolutely worth observing, as well as some of the city’s most important monuments. MUST SEE: 1.1 Kolomvou Square. The crossroads where Egnatia Street meets Antigonidon Street is indeed a bustling one! It was named after G. Colombo, an Italian who opened a hotel there in the early 20th century. This is the location of Kolomvou Archway (31, Egnatia St.) which has become a leisure hub with cafés, bars and restaurants inside. 1.2 Hamza Bey Mosque. It was built in 1467 by the daughter of Hamza Bey, the military commander of Sultan Murad II. It is the only mosque in Greece with a peristyle (a colonnaded yard). For many decades it housed a cinema named Alkazar. Currently there are renovation works under way. Once they are finished, it will house an exhibition of finds unearthed during the metro excavations. Right behind it you will see the City Manor which housed the Town Hall until recently. It is known at Karavan Serai as there used to be an ottoman inn here. (early 16th c.). 4th walk:']","The TIF (Thessaloniki International Fair) grounds are a vibrant hub located in the heart of Thessaloniki, featuring two modern convention centers: Ioannis Vellidis, which accommodates 2,100 people, and Nikolaos Germanos, with a capacity of 400. These venues host various events throughout the year, making them a focal point for both locals and visitors.

Surrounding the TIF grounds, you’ll find several attractions that enhance your experience. Just a short walk away is the Macedonian Museum of Contemporary Art, established in 1979. This museum is the first of its kind in Greece and showcases a diverse collection of modern art, including notable sculptures like “Umbrellas” by G. Zongolopoulos. The museum's courtyard also features Roman graves and ancient roads, providing a glimpse into the region's rich history.

Additionally, the area is well-connected, with multiple access points via Angelaki Street and Egnatia Street, making it easy to explore nearby attractions. The vibrant neighborhoods of Kalamaria and Peraia are also within reach, offering a variety of dining and entertainment options, especially during the summer months when many venues transition to open-air settings.

For those interested in local culture, the TIF grounds often host festivals and events that celebrate Thessaloniki's heritage, providing opportunities to interact with locals and experience the city's lively atmosphere. Don't miss the chance to capture Instagram-worthy moments at the nearby parks and squares, which are perfect for leisurely strolls.

Overall, the TIF grounds serve as an excellent starting point for your weekend adventure in Thessaloniki, combining modern amenities with cultural richness and accessibility to various attractions.","The TIF grounds are located at the end of Egnatia Street, which is a central avenue in Thessaloniki that has been there since the city's founding. This area is part of a busy shopping district filled with remarkable buildings of eclectic and art deco style from the early 20th century. Nearby, you can find Kolomvou Square, a bustling crossroads with cafés, bars, and restaurants, as well as the Hamza Bey Mosque, built in 1467, which is notable for its peristyle. The mosque is currently undergoing renovations and will soon house an exhibition of finds from metro excavations.",0.0,0.51,0.3333333333333333,0.7661564297587913,0.9999999999,0.9999999999,0.0,0.24999999968749997,,0.9449240096004606
6,"Wut r sum of the most intresting places to visit in Thessaloniki, and can u tell me about their history?","['The collection \nincludes approx. 250 pieces  \non painting, sculpture, pottery,  \nmosaics, murals and \nengraving.\nTHESSALONIKI CINEMA \nMUSEUM\nIt was created in 1997  \nand the opening coincided \nwith the European Capital  \nof Culture events which were \nhosted by Thessaloniki that \nyear. It is closely related \nto the city history, as the \nThessaloniki International Film \nFestival has been taking place \nin the city since 1960 (see p. \n108). Exhibits tell the history \nof the Greek cinema and are \nclassified in six timelines, \nnamely Manakia brothers, \n1900-1940, 1940-1960, \n1960-1970, 1970-1990,  \nand 1990 and beyond. Among \nthe items on display are rare \n90', '88\nDAY EXCURSIONS\nJewish quarter in Europe, \nwhich maintains a traditional \ncharacter in its entirety. It \nis worth taking a walk and \nvisiting the Roman, Ottoman \nand Industrial age monuments \nin the traditional districts of \nKyriotissa, Panagia Dexia, and \nMakariotissa; you can also visit \nthe Public Central Library which \nhas earned an international \naward, or relax in the parks  \nand squares.\nHow to get there.  \nVergina is about 63 km SW  \nof Thessaloniki. If you travel by \ncar, follow the signs to Veroia \nand after that to Vergina. You \ncan also take the intercity bus \nor the train to reach Veroia  \nand then take the local bus  \nto Vergina.\n3 \tDION\nThis most enchanting \narchaeological site is  \nlocated under the imposing \nOlympus mountain range, in  \na 150-hectare green area amid \nflowing waters coming from \nVafyras River and from other \nsprings; it is the habitat of \nmany species of birds, reptiles \nand amphibians. This used to \nbe a sacred place to ancient \nMacedonians who worshipped \nOlympian Zeus and the Muses \n[daughters of Zeus] here.', 'It is about an excursion taken \nto the most interesting parts \nof the viticultural zone; this is \ncombined with a visit to the \narchaeological and historical \nassets of those areas, with \ncountryside activities, as \nwell as a visit to wineries \nand degustation. Make sure \nyou visit the impressive \nGerovassiliou Wine Museum  \nin Epanomi (see p. 68 & 80). \nFor more information, \ncontact the Wine Roads \nof North Greece: tel: 2310 \n281.617 and 2310 281.632, \nwww.winesofnorthgreece.gr\n121, 122 & \n123.  \nThessaloniki \noffers its little \nvisitors a host \nof fun activities \nand games to \nchoose from.\n121\n122', '84\non the area’s history is shown \nin a special room.\n1.1  Military Museum  \nof the Balkan Wars.\nIt is located in Gefyra village, \n25km NW of Thessaloniki, and \nit is housed in the mansion \nof J. Modiano (1906, P. \nArrigoni). This is where the \nGreek army headquarters were \nset up by Constantine, the \nthen heir to the Greek throne, \non October 24-27, 1912; \nthe final negotiations with \nthe Turks about surrendering \nThessaloniki took place on that \nspot. Rare relics are on display \nsuch as maps, uniforms, arms, \nmedals, documents, items of \ndaily use, and so on, as well \nas photos and paintings with \nsimilar subjects. The mansion \ngrounds are decorated with \nauthentic furniture of that \ntime so as to provide a faithful \ndepiction of the then style. \n1.2  Giannitsa.\nThis modern town has a \npopulation of 35,000 and lies \n10 km W of Ancient Pella. \nThe place used to be a sacred \ntown for the Muslims since \nthis is the burial place of Gazi \nEvrenos [Gazi Evren Bey], one \nof the major Ottoman army \ncommanders, as well as of \nSeyh Abdullah al Ilahi, his \nteacher and spiritual father. \nSome of the greatest ottoman \nmonuments in Greece are  \nto be found in Giannitsa. \nVisit the mausoleum of Gazi \nEvrenos (1417, reconstructed \nin the 19th c.', '80\nMUSEUMS\nmechanics and so on, which \nlay emphasis on the visitor’s \nactive participation as well as \non learning and having fun  \nat the same time.\n• Car Exhibition. \nOld car models that have \nbeen the most popular \nproductions in the history of \nthe automobile industry can  \nbe seen here.\nThe education rooms are \nthe following:\n• Planetarium. This \n160-seat room has a domed \nscreen (the dome is visible on \nthe outside as well). Visitors \ncan watch educational and \nrecreational films such as The \nEarth and me, Wonders of the \nUniverse and others.\n• Cosmotheatre. This film \ntheatre features the largest flat \nscreen in Southeast Europe \n(23X17 m.). Movies such as \nDinosaurs and Beyond the skies \nare screened here\n• Virtual Reality Simulator. \nThe spectator wears 3-D \nglasses, boards a small wagon \nand enjoys an on-the-go \nsimulation experience of \nvarious types such as flight, \ndeep-sea voyage and tours  \nin imaginary worlds.\nFurthermore, Noesis \norganises educational \nprogrammes on Renewable \nSources of Energy and \nScience Shows to further \nexplicate the laws of Physics \nand Chemistry.\nGEROVASSILIOU WINE \nMUSEUM\nThis outstanding museum \nhas been open since 2008  \nin the winery’s grounds where \nthe vineyards spread in a \n56-hectare area, affording \na fine view of the greater \narea and Thermaic Gulf. The \nmuseum collections are \narranged in seven categories:\n• Introduction.']","['34 1 EGNATIA STREET This central avenue has been there practically since Thessaloniki’s founding, as it is a section of the road constructed by the Romans in the 2nd c. BC, and connected Dyrrhachium (Durrës, in modern day Albania) with Constantinople. It starts at Dimokratia square (see p. 58) and ends at the TIF grounds (see p. 31) and the Aristotle University of Thessaloniki, splitting in two the town’s historic centre. It is a busy shopping area with numerous remarkable buildings of eclectic and art deco style dating to the early 20th c. (mostly old hotels) that are absolutely worth observing, as well as some of the city’s most important monuments. MUST SEE: 1.1 Kolomvou Square. The crossroads where Egnatia Street meets Antigonidon Street is indeed a bustling one! It was named after G. Colombo, an Italian who opened a hotel there in the early 20th century. This is the location of Kolomvou Archway (31, Egnatia St.) which has become a leisure hub with cafés, bars and restaurants inside. 1.2 Hamza Bey Mosque. It was built in 1467 by the daughter of Hamza Bey, the military commander of Sultan Murad II. It is the only mosque in Greece with a peristyle (a colonnaded yard). For many decades it housed a cinema named Alkazar. Currently there are renovation works under way. Once they are finished, it will house an exhibition of finds unearthed during the metro excavations. Right behind it you will see the City Manor which housed the Town Hall until recently. It is known at Karavan Serai as there used to be an ottoman inn here. (early 16th c.). 4th walk:']","Thessaloniki is a vibrant city rich in history and culture, making it an excellent destination for sightseeing. Here are some must-visit places:

1. **Thessaloniki Cinema Museum**: Established in 1997, this museum showcases the history of Greek cinema, featuring exhibits categorized into six timelines, including the influential Manakia brothers and the evolution of film from 1900 to the present. It’s a great spot to appreciate the city’s cinematic heritage.

2. **Jewish Quarter**: This area retains a traditional character and is perfect for a leisurely walk. You can explore Roman, Ottoman, and Industrial age monuments in the districts of Kyriotissa, Panagia Dexia, and Makariotissa. The Public Central Library, known for its international awards, is also located here.

3. **Dion**: Located near the Olympus mountain range, this archaeological site was sacred to ancient Macedonians who worshipped Olympian Zeus. The lush 150-hectare area is home to diverse wildlife and flowing waters, making it a serene spot for nature lovers and history enthusiasts alike.

4. **Military Museum of the Balkan Wars**: Situated in Gefyra village, this museum is housed in the historic mansion of J. Modiano. It showcases relics from the Balkan Wars, including maps, uniforms, and personal items, providing insight into the military history of the region.

5. **Gerovassiliou Wine Museum**: Located in Epanomi, this museum offers a unique experience combining viticulture with history. You can learn about winemaking and enjoy tastings, making it a delightful stop for those interested in local flavors.

These sites not only offer a glimpse into Thessaloniki's rich past but also provide opportunities for engaging with the local culture, perfect for a first-time visitor looking to explore the city.","In Thessaloniki, one must visit Egnatia Street, a central avenue that has existed since the city's founding, originally constructed by the Romans in the 2nd century BC. It connects Dyrrhachium with Constantinople and is a busy shopping area featuring remarkable buildings of eclectic and art deco style from the early 20th century. Another highlight is Kolomvou Square, a bustling crossroads named after G. Colombo, where you can find the Kolomvou Archway, a leisure hub with cafés and restaurants. Additionally, the Hamza Bey Mosque, built in 1467, is notable for being the only mosque in Greece with a peristyle and is currently undergoing renovations to house an exhibition of archaeological finds. Nearby is the City Manor, known as Karavan Serai, which served as the Town Hall until recently.",0.0,0.19,0.9090909090909091,0.665754739808909,0.8874999999778125,0.0,0.0,0.0624999999609375,,0.7130081122358854
7,What is the historical significance of Constantinople in relation to Egnatia Street?,"['34\n1 \tEGNATIA STREET\nThis central avenue has \nbeen there practically since \nThessaloniki’s founding,  \nas it is a section of the road \nconstructed by the Romans  \nin the 2nd c. BC, and connected \nDyrrhachium (Durrës, in \nmodern day Albania) with \nConstantinople. It starts at \nDimokratia square (see p. 58) \nand ends at the TIF grounds \n(see p. 31) and the Aristotle \nUniversity of Thessaloniki, \nsplitting in two the town’s \nhistoric centre. It is a busy \nshopping area with numerous \nremarkable buildings of \neclectic and art deco style \ndating to the early 20th c. \n(mostly old hotels) that are \nabsolutely worth observing,  \nas well as some of the city’s \nmost important monuments.\nMUST SEE:\n1.1  Kolomvou Square.\nThe crossroads where \nEgnatia Street meets \nAntigonidon Street is indeed \na bustling one! It was named \nafter G. Colombo, an Italian \nwho opened a hotel there  \nin the early 20th century. This \nis the location of Kolomvou \nArchway (31, Egnatia St.) \nwhich has become a leisure \nhub with cafés, bars and \nrestaurants inside.\n1.2  Hamza Bey Mosque.\nIt was built in 1467 by the \ndaughter of Hamza Bey, the \nmilitary commander of Sultan \nMurad II.', 'The monumental style of \narchitecture is shown in the \nbuildings’ facades, colonnades, \narcades and porticos, which \ncombine elements from the \ncity’s Byzantine tradition \nwith European interwar \nperiod motifs. The square is \nlandmarked by two identical \nconcave buildings: Electra \nPalace hotel (late sixties) - \nbuilt by GNTO architects -  \non the west side, and Olympion \non the east side, which was \nprogressively erected and \ncompleted by the late fifties \n(designed by J. Moshé) \nand is now the seat of the \nThessaloniki Film Festival  \n(see p. 108).\nMUST SEE:\n1.1  Aristotelous Street.\nPedestrianised historic \nboulevard, that ends in Egnatia \nStreet (see p. 34). According \nto the Hébrard plans, it would \n2nd walk: \nHISTORIC CENTRE (1) \nTRADITIONAL COMMERCIAL CENTRE\n4.1\n6.1\n6.3\n6.2\n6.5\n6.6\n6.7\n1.1\n1.2\n6.8\n7.5\n7.3\n7.2\n7.2\n7.1\n7.4\n6.4\n3.1\n1\n2\n3\n4\n5\n7', 'Notice the glass globe on \nthe top of the building, a point \nof reference in Eleftherias Sq. \nIn the neighbouring Komninon \nStreet it is worth noticing the \neclectic style on buildings \nsuch as Luxemburg Hotel as \nwell as Tourist and Excelsior \nHotels at the junction with \nMitropoleos streets.\n4 \tPORT\nThe area is one of the biggest \nports of the country and of the \nsoutheastern Mediterranean, \nwith a significant trade and \npassenger traffic. This is where \nthe first artificial harbour of \nthe town was constructed by \nConstantine the Great during \nhis short stay in Thessaloniki \n(322-323 AD); later on during \nthe Turkish Occupation it \nwas banked up with earth. \n2nd walk: \nHISTORIC CENTRE (1)\nTRADITIONAL COMMERCIAL CENTRE', '60\n7th walk: \nWEST OF THE CENTRE-STAVROUPOLI\n2.6  Holy Twelve Apostles \nChurch\n(see p. 8).\n2.7  West City Walls.\nSections of the city’s west walls  \nremain along Arkadioupoleos and \nEirinis Streets and finds related \nto Litaia Gate have recently \nbeen located at the corner \nof Agiou Dimitriou and Agiou \nNestoros Streets. This gate \nused to be one of the seven \ngreat gates of the fortified city \nand formed part of the Early \nChristian period walls; it was \nnamed after Liti, a Byzantine \ntown to which the gate led. \nThe Golden Gate was also \nlocated on the Egnatia  \nStreet level.\n2.8  Pasha Hamam  \n[Paşa Hamami] (Phoenix  \nBath house).\nIt was built during the \n1520s by Cezeri Kasim Paşa. \nAlso known as Phoenix Bath \nhouse, this used to be the \nlast ottoman bath house open \nin town, as it closed down in \nas late as 1981. It is located \nat the corner of Kalvou and \nPineiou Streets, near the west \nwalls and the church of the \nHoly Twelve Apostles, and the \nstructure of the building was \nplanned with great care.', '9\nT H E S S A LO N I K I\nsettles in town, chased out  \nof European countries – \nmostly of the Iberian pninsula. \nTheir role in Thessaloniki’s \nhistory will be a significant \none until the mid-20th century.\n 16th-18th c.:\t\nThessaloniki grows,  \nand the various ethnic and \nreligious communities live  \nin harmony. In the 18th c.  \nthe town acquires the features  \nof a large trade centre.\n Late 19th c.:\t\nA railway connection is \nestablished with Europe and \nConstantinople. Infrastructure \ngets streamlined and \nThessaloniki acquires the feel \nof a cosmopolitan European \ncity. The Greeks become at \nthis point in time the largest \npart of the population.\n 1890:\t\nFire incinerates a considerable \npart of the town’s seafront \nzone.\n 1912:\t\nDuring the 1st Balkan War, \nthe Greek army seizes the \ntown on October 26th; after \nfive centuries of ottoman \noccupation, Thessaloniki \nbecomes part of Greece.\n 1916:\t\nFollowing a clash with \nKing Constantine, Eleftherios \nVenizelos forms the \ntemporary “National Defence \nGovernment” in Thessaloniki, \nwhich remained there for \nseveral months.\n 1917:\t\nThe biggest part of the \ntown is destroyed by a fire \nthat breaks out on August \n18th and lasts for 32 hours.']","['34 1 EGNATIA STREET This central avenue has been there practically since Thessaloniki’s founding, as it is a section of the road constructed by the Romans in the 2nd c. BC, and connected Dyrrhachium (Durrës, in modern day Albania) with Constantinople. It starts at Dimokratia square (see p. 58) and ends at the TIF grounds (see p. 31) and the Aristotle University of Thessaloniki, splitting in two the town’s historic centre. It is a busy shopping area with numerous remarkable buildings of eclectic and art deco style dating to the early 20th c. (mostly old hotels) that are absolutely worth observing, as well as some of the city’s most important monuments. MUST SEE: 1.1 Kolomvou Square. The crossroads where Egnatia Street meets Antigonidon Street is indeed a bustling one! It was named after G. Colombo, an Italian who opened a hotel there in the early 20th century. This is the location of Kolomvou Archway (31, Egnatia St.) which has become a leisure hub with cafés, bars and restaurants inside. 1.2 Hamza Bey Mosque. It was built in 1467 by the daughter of Hamza Bey, the military commander of Sultan Murad II. It is the only mosque in Greece with a peristyle (a colonnaded yard). For many decades it housed a cinema named Alkazar. Currently there are renovation works under way. Once they are finished, it will house an exhibition of finds unearthed during the metro excavations. Right behind it you will see the City Manor which housed the Town Hall until recently. It is known at Karavan Serai as there used to be an ottoman inn here. (early 16th c.). 4th walk:']","Egnatia Street holds historical significance as a vital artery connecting the ancient city of Thessaloniki to Constantinople (modern-day Istanbul). Constructed by the Romans in the 2nd century BC, this road facilitated trade and communication between the two cities, playing a crucial role in the economic and cultural exchanges of the time. Egnatia Street was part of a larger network of Roman roads that linked various regions of the empire, enhancing Thessaloniki's status as a significant trade hub.

The street begins at Dimokratia Square and extends to the TIF grounds and the Aristotle University of Thessaloniki, effectively splitting the historic center of the city. As a bustling commercial area, Egnatia Street is lined with remarkable buildings from the early 20th century, showcasing eclectic and art deco architectural styles. This blend of history and modernity makes it a must-see for visitors interested in both the past and the vibrant life of contemporary Thessaloniki.

Moreover, Egnatia Street's connection to Constantinople symbolizes the historical ties between Greece and the Byzantine Empire, of which Thessaloniki was a prominent city. The road not only served as a physical link but also as a conduit for cultural and religious influences that shaped the region's identity over centuries.

Today, Egnatia Street remains a focal point for tourists and locals alike, offering a glimpse into the city's rich history while providing access to various attractions, cafés, and shops. Its significance as a historical route connecting Thessaloniki to Constantinople continues to resonate, making it an essential part of the city's heritage and a key attraction for those exploring its past.","Egnatia Street is a section of the road constructed by the Romans in the 2nd century BC, which connected Dyrrhachium (modern-day Durrës, Albania) with Constantinople, highlighting its historical significance as a vital route in ancient times.",0.5,0.07,0.7037037037037037,0.7426382645769578,0.699999999965,0.6999999999766667,1.0,0.8571428559183674,,0.8426535162418028
8,Can you provide detailed information about the Ancient Roman Forum and its historical significance as discovered in the excavations at Plateia Dikastirion?,"['35\n4th walk: \nHISTORIC CENTRE (3)\n1.3  Plateia Dikastirion \n[Court house square]. \nA spacious green square \nsituated towards the end \nof Aristotelous Street. \nThe Hébrard plans placed \nconstruction of the Court \nHouse as well as of other  \nstate buildings on this location \n(to create a civic centre);  \nin 1966, however, excavations \non the spot revealed the \nAncient Roman Forum and  \nthe process was halted. In  \nthe centre of the square stands \nthe imposing bust of Eleftherios \nVenizelos (1977, G. Pappas), \nwho remained a prime minister \nof Greece for more than 12 \nyears during the period 1910 – \n1932. There are small copper \nworkshops in the adjacent \nChalkeon and Kleisouras \nStreets, and their business has \nbeen an ongoing tradition since \nthe byzantine period.\n1.4  Panagia [Virgin Mary] \nChalkeon.\n(see p. 9)\n1.5  Bey Hamami.\nIt lies on the SE side of  \nPlateia Dikastirion. This impressive \nedifice was built in 1444 and  \nit is the country’s largest \nottoman bath house, a multi-\ndomed construction with \nseparate rooms for males and \nfemales, structured along two \nparallel ways. It is divided in \nthree sections (cold, tepid \nand hot areas) and there is \nalso a vaulted tank for heating \nwater.', '36\n4th walk: \nHISTORIC CENTRE (3)\nthat the place had been used \nby Christians as well, during \nthe late Roman period. South \nof the passageway there \nwere shops dating from the \n1st until the 13th century; the \nunderground Museum of the \nRoman Forum (see p. 71) was \nbuilt there as an extension. \nA 2nd - 4th c. AD Odeon [C] \nwas found behind the well-\npreserved eastern stoa. It  \nhas been restored and it is now \nused as a venue for cultural \nevents. A mint and an archive \noffice are right next to it. In the \nSE side, a round bath house \n[D] was unearthed which has \nbeen in use since the 1st c. BC. \nParts of a colonnade, mosaic \nfloors, marble stairs, a section \nof a stone-paved street, sewer \npipes, silver coins, stone and \nmarble sculptures were all \nfound in this archaeological \nsite. The forum is also where \nthe “Enchanted Ones” (las \nIncantadas) were discovered, \na two-storeyed colonnaded \narchway with Corinthian-order \ncolumns and pillars four of \nwhich have survived. They are \ndecorated with figures in relief \nin their interior as well as their \nexterior side (“Stoa of the \nStatuettes”).', '88\nDAY EXCURSIONS\nJewish quarter in Europe, \nwhich maintains a traditional \ncharacter in its entirety. It \nis worth taking a walk and \nvisiting the Roman, Ottoman \nand Industrial age monuments \nin the traditional districts of \nKyriotissa, Panagia Dexia, and \nMakariotissa; you can also visit \nthe Public Central Library which \nhas earned an international \naward, or relax in the parks  \nand squares.\nHow to get there.  \nVergina is about 63 km SW  \nof Thessaloniki. If you travel by \ncar, follow the signs to Veroia \nand after that to Vergina. You \ncan also take the intercity bus \nor the train to reach Veroia  \nand then take the local bus  \nto Vergina.\n3 \tDION\nThis most enchanting \narchaeological site is  \nlocated under the imposing \nOlympus mountain range, in  \na 150-hectare green area amid \nflowing waters coming from \nVafyras River and from other \nsprings; it is the habitat of \nmany species of birds, reptiles \nand amphibians. This used to \nbe a sacred place to ancient \nMacedonians who worshipped \nOlympian Zeus and the Muses \n[daughters of Zeus] here.', 'It is divided in \nthree sections (cold, tepid \nand hot areas) and there is \nalso a vaulted tank for heating \nwater. It is widely known as the \nParadise Baths and it went by \nthat name until 1968. Right next \nto it there is a roman platform \nthat is indicative of the ground \nlevel 2000 years ago.\n1.6  Roman (Ancient) Forum\nDuring the roman period, \nthis 2-hectare area used to be \nthe social and religious centre \nof the city. Construction was \ncompleted in two phases  \n(in the mid-2nd and mid-  \n3rd centuries AD) and it was \ngradually abandoned after the \n7th century. The NW section \nof the archaeological site is \ncovered by a large rectangular \nsquare [Α] with traces of \nmarble paving. In the S section \nof the square lies the largest \npart of the double underground \nCryptoporticus [covered \npassageway] [Β] which was \nmost probably used as a public \nstorehouse.', '66\nSUBURBS AND CITY OUTSKIRTS\n3.1  Chortiatis.\nNamed after the mountain, \nthis small suburb on Mt \nChortiatis (elev.: 1,201 m.), \nstretches approx. 10 km NE  \nof Panorama. Since the Roman \ntimes, Thessaloniki’s water \nsupply came from this place \nvia Vlatadon Monastery (see \np. 44); this is why you will \nsee fragments of a Byzantine \naqueduct at the suburb’s \nborder. The mountain is covered \nwith chestnut, oak, beech and \nfir trees, there is a mountain \nrefuge (Kissos location, elev. \n1,201 m.) and it is the ideal \nplace for hiking (there are 32 \ncharted paths), for mountain \nbiking and off-roading.\nHow to get there. Board \nthe 58 bus on Egnatia Street \nand get off at Dimarchio \n[Town Hall], Astynomia [Police \nStation] or at Platanakia stop.\n4 \tTHERMI\nThis suburb is located a bit \nfurther away from town (15 km \nSE of the city centre) and more \nor less still keeps a countryside \nair about it. On-site excavations \nhave shown that this was the \nlocation of the harbour of \nancient Thermi, a major one  \nin antiquity. The place was also \nknown for its hot springs – \nthermae – hence the name  \nof the gulf (Thermaikos).']","['35 4th walk: HISTORIC CENTRE (3) 1.3 Plateia Dikastirion [Court house square]. A spacious green square situated towards the end of Aristotelous Street. The Hébrard plans placed construction of the Court House as well as of other state buildings on this location (to create a civic centre); in 1966, however, excavations on the spot revealed the Ancient Roman Forum and the process was halted. In the centre of the square stands the imposing bust of Eleftherios Venizelos (1977, G. Pappas), who remained a prime minister of Greece for more than 12 years during the period 1910 – 1932. There are small copper workshops in the adjacent Chalkeon and Kleisouras Streets, and their business has been an ongoing tradition since the byzantine period. 1.4 Panagia [Virgin Mary] Chalkeon. (see p. 9) 1.5 Bey Hamami. It lies on the SE side of Plateia Dikastirion. This impressive edifice was built in 1444 and it is the country’s largest ottoman bath house, a multi- domed construction with separate rooms for males and females, structured along two parallel ways. It is divided in three sections (cold, tepid and hot areas) and there is also a vaulted tank for heating water. It is widely known as the Paradise Baths and it went by that name until 1968. Right next to it there is a roman platform that is indicative of the ground level 2000 years ago. 1.6']","The Ancient Roman Forum, located near Plateia Dikastirion in Thessaloniki, serves as a significant archaeological site that highlights the city's historical importance during the Roman period. Excavations conducted in the 1960s revealed this area, which was once the social and religious center of Thessaloniki, showcasing its rich heritage.

The forum spans approximately 2 hectares and was constructed in two main phases during the mid-2nd and mid-3rd centuries AD. It gradually fell into disuse after the 7th century. The site features a large rectangular square, which contains remnants of marble paving, indicating its grandeur. Notably, the northwest section is dominated by a double underground Cryptoporticus, a covered passageway likely used as a public storehouse, showcasing the architectural sophistication of the time.

Among the remarkable findings at the forum are parts of a colonnade, mosaic floors, and marble stairs, which provide insight into the aesthetic and functional aspects of Roman urban design. Additionally, a round bathhouse, in use since the 1st century BC, was uncovered, illustrating the importance of public bathing in Roman culture.

The forum is also home to the ""Enchanted Ones"" (las Incantadas), a two-storeyed colonnaded archway adorned with Corinthian-order columns, some of which have survived. These columns are decorated with intricate relief figures, enhancing the site's historical allure.

Visiting the Ancient Roman Forum offers a unique opportunity to connect with Thessaloniki's past, making it an ideal spot for sightseeing. The combination of its archaeological significance and the remnants of Roman life provides a captivating experience for those interested in history and culture. The site is also accessible for photography, making it a perfect location for capturing Instagrammable moments while exploring the city's rich heritage.","The Ancient Roman Forum was revealed during excavations at Plateia Dikastirion in 1966, which halted the construction of the Court House and other state buildings intended to create a civic center. This discovery highlights the historical significance of the site, as it reflects the urban planning and architectural practices of ancient Rome. The forum served as a central public space in Roman cities, where various activities, including political, social, and commercial events, took place.",0.3333333333333333,0.35,0.6176470588235294,0.7466738144412204,0.9166666666361111,0.9166666666361111,1.0,0.14285714265306124,,0.6984212283392864
9,Who is Eleftherios Venizelos and why is he important?,"['35\n4th walk: \nHISTORIC CENTRE (3)\n1.3  Plateia Dikastirion \n[Court house square]. \nA spacious green square \nsituated towards the end \nof Aristotelous Street. \nThe Hébrard plans placed \nconstruction of the Court \nHouse as well as of other  \nstate buildings on this location \n(to create a civic centre);  \nin 1966, however, excavations \non the spot revealed the \nAncient Roman Forum and  \nthe process was halted. In  \nthe centre of the square stands \nthe imposing bust of Eleftherios \nVenizelos (1977, G. Pappas), \nwho remained a prime minister \nof Greece for more than 12 \nyears during the period 1910 – \n1932. There are small copper \nworkshops in the adjacent \nChalkeon and Kleisouras \nStreets, and their business has \nbeen an ongoing tradition since \nthe byzantine period.\n1.4  Panagia [Virgin Mary] \nChalkeon.\n(see p. 9)\n1.5  Bey Hamami.\nIt lies on the SE side of  \nPlateia Dikastirion. This impressive \nedifice was built in 1444 and  \nit is the country’s largest \nottoman bath house, a multi-\ndomed construction with \nseparate rooms for males and \nfemales, structured along two \nparallel ways. It is divided in \nthree sections (cold, tepid \nand hot areas) and there is \nalso a vaulted tank for heating \nwater.', '9\nT H E S S A LO N I K I\nsettles in town, chased out  \nof European countries – \nmostly of the Iberian pninsula. \nTheir role in Thessaloniki’s \nhistory will be a significant \none until the mid-20th century.\n 16th-18th c.:\t\nThessaloniki grows,  \nand the various ethnic and \nreligious communities live  \nin harmony. In the 18th c.  \nthe town acquires the features  \nof a large trade centre.\n Late 19th c.:\t\nA railway connection is \nestablished with Europe and \nConstantinople. Infrastructure \ngets streamlined and \nThessaloniki acquires the feel \nof a cosmopolitan European \ncity. The Greeks become at \nthis point in time the largest \npart of the population.\n 1890:\t\nFire incinerates a considerable \npart of the town’s seafront \nzone.\n 1912:\t\nDuring the 1st Balkan War, \nthe Greek army seizes the \ntown on October 26th; after \nfive centuries of ottoman \noccupation, Thessaloniki \nbecomes part of Greece.\n 1916:\t\nFollowing a clash with \nKing Constantine, Eleftherios \nVenizelos forms the \ntemporary “National Defence \nGovernment” in Thessaloniki, \nwhich remained there for \nseveral months.\n 1917:\t\nThe biggest part of the \ntown is destroyed by a fire \nthat breaks out on August \n18th and lasts for 32 hours.', '33\nto be used as the Turkish \narmy barracks. In 1916 - \n1917 it served for several \nmonths as the seat of the \ntemporary “Government of \nNational Defence” led by El. \nVenizelos. The War Museum \nis housed in a building, \ndesigned by V. Poselli during \nthe same period, in Lampraki \nStreet, (see p. – for museum \nexhibits). Under the west \nside of 3rd Septemvriou Ave. \npaved surface there are \nvisible remains of a cemetery \nbasilica (4th -7th c.) as well as \nof a grave of a Christian martyr.\n12 \tPAPAFI AREA\nIt extends east of the grounds \nof the 3rd Army Corps and it \nwas named after Papafeio \nOrphanage that once dominated  \nthe area.\nMUST SEE:\nO Melitefs Papafeio \nOrphanage (33, Papafi and \nKatsimidou Sts.). Construction \nwas completed in 1903  \n(to plans by Xen. Paionidis), \nafter a bequest made by  \na Thessalonian called I. Papafis \n(1792 – 1866) who lived \nand died in Malta (former \nname: Meliti). This is a typical \nclassical style building with \nthree floors and a propulaeum \nin the main entrance. It served \nas a male boarding school and \nit was also used as military \nbarracks and hospital. It is \nsurrounded by impressive \ngardens with a small church \nbuilt there of late.', 'The last part consists of \nwhat is believed to have \nbeen the tomb of Alexander \nIV, son of Alexander the \nGreat and Roxanne, who was \nassassinated by Cassander in \n310 BC; a silver urn containing \nthe bones of the dead person, \nframed with the ivory relief \nmotifs of the funeral bed. \nIn a separate room, visitors \ncan watch a video where M. \nAndronikos takes them on a \ntour of the monuments. Other \nexcavations in the wider area \nof the Aiges necropolis have \nunearthed archaic tombs, pit \nand cist tombs (6th and 5th c. \nBC), as well as temple-shaped \nmacedonian tombs one of \nwhich apparently belonged  \nto Queen Eurydice, the mother  \nof King Philip II\nPalace. It covers a 12,500 \nm2 area and it used to be \nthe largest and the most \nimportant construction (next \nto Parthenon, Athens) of the \nHellenic Classical Antiquity. \nThis two-storeyed edifice \nis presumed to be the work \nof Pytheos who was the \narchitect of the Mausoleum \nof Halicarnassos [modern-day \nBodrum, Turkey], one of the 7 \nwonders of the ancient world. \nThe palace’s architectural style \nis considered avant-garde for \nthat time and it was built of \nlimestone during the 2nd half \nof the 4th c. BC on a plateau; \n101, 102 & \n103.', 'ARC\nAG\nDIMIT\nTERPSITHEA\nSQ.\nRAILWAY STATION\nSQ.\nOLD RAILWAY\nSTATION SQ.\nGALANOPOULOU\nSQ.\nSYKIES\nNEAPOLI\nAMPELOKIPOI\nMENEMENI\nMAKEDONOMACHON\nSQ.\nKARAOLI-DIMITRIOU SQ.\nELEFTHERIAS\nSQ.\nDROPOTAMOS\n7th walk: \nWEST OF THE CENTRE-STAVROUPOLI\n2\n3\n1\n4\n3.2\n2.2\n2.1\n4.1\n4.2\n4.3\n4.3\n4.4\n2.3\n2.4\n2.5\n2.8\n2.7 2.6\n3.1\n3.3\n1 \t\x07DIMOKRATIAS SQUARE \n(VARDARI)\nSince ancient times, this  \nhas been the most important \nentry point to Thessaloniki. \nThis relatively disadvantaged \narea is a transportation hub \nconnecting the west and \nnorthwest suburbs with the \ncity centre; there are also \nseveral hotels, small shops, \ntavernas and cafés in the \narea. In the centre of the \nsquare you will see the statue \nof King Constantine (1868-\n1923), who entered the \ncity in 1912 in his capacity \nas commander-in-chief of \nthe Greek Army. The road \ndistances (in km) where \nThessaloniki is the starting \npoint get calculated from  \nthis square.']","['35 4th walk: HISTORIC CENTRE (3) 1.3 Plateia Dikastirion [Court house square]. A spacious green square situated towards the end of Aristotelous Street. The Hébrard plans placed construction of the Court House as well as of other state buildings on this location (to create a civic centre); in 1966, however, excavations on the spot revealed the Ancient Roman Forum and the process was halted. In the centre of the square stands the imposing bust of Eleftherios Venizelos (1977, G. Pappas), who remained a prime minister of Greece for more than 12 years during the period 1910 – 1932. There are small copper workshops in the adjacent Chalkeon and Kleisouras Streets, and their business has been an ongoing tradition since the byzantine period. 1.4 Panagia [Virgin Mary] Chalkeon. (see p. 9) 1.5 Bey Hamami. It lies on the SE side of Plateia Dikastirion. This impressive edifice was built in 1444 and it is the country’s largest ottoman bath house, a multi- domed construction with separate rooms for males and females, structured along two parallel ways. It is divided in three sections (cold, tepid and hot areas) and there is also a vaulted tank for heating water. It is widely known as the Paradise Baths and it went by that name until 1968. Right next to it there is a roman platform that is indicative of the ground level 2000 years ago. 1.6']","Eleftherios Venizelos was a prominent Greek statesman and politician, serving as Prime Minister of Greece multiple times between 1910 and 1932. He is widely regarded as one of the most significant figures in modern Greek history due to his pivotal role in shaping the country's political landscape and his contributions to its territorial expansion.

Born in 1864 on the island of Crete, Venizelos initially became involved in politics during the Cretan struggle for autonomy from Ottoman rule. His political career gained momentum when he became a key advocate for the unification of Crete with Greece. His leadership during the Balkan Wars (1912-1913) was instrumental in securing significant territorial gains for Greece, including Thessaloniki, which was liberated from Ottoman control in 1912.

Venizelos was also a proponent of modernization and reform in Greece. He focused on improving the country's infrastructure, education, and military, which helped transform Greece into a more modern state. His vision for a greater Greece included not only territorial expansion but also the promotion of democracy and social progress.

In 1916, during a period of political turmoil, he established the temporary ""National Defence Government"" in Thessaloniki, opposing King Constantine I. This government played a crucial role in aligning Greece with the Allies during World War I, further solidifying Venizelos's influence in Greek politics.

His legacy is commemorated in various ways, including the prominent statue of him located in Plateia Dikastirion, Thessaloniki. Venizelos's contributions to Greece's national identity and his efforts to modernize the country have left a lasting impact, making him a key figure in the history of Greece. For visitors to Thessaloniki, exploring sites associated with Venizelos offers insight into his significant role in shaping modern Greece.","Eleftherios Venizelos was a prime minister of Greece for more than 12 years during the period 1910 – 1932. His bust stands in the centre of Plateia Dikastirion, which is a spacious green square in the historic centre.",1.0,0.39,0.5517241379310345,0.857976708758539,0.99999999995,0.9999999999,1.0,0.9999999980000001,,0.8881023545194147
10,What is Paradise Baths?,"['It is divided in \nthree sections (cold, tepid \nand hot areas) and there is \nalso a vaulted tank for heating \nwater. It is widely known as the \nParadise Baths and it went by \nthat name until 1968. Right next \nto it there is a roman platform \nthat is indicative of the ground \nlevel 2000 years ago.\n1.6  Roman (Ancient) Forum\nDuring the roman period, \nthis 2-hectare area used to be \nthe social and religious centre \nof the city. Construction was \ncompleted in two phases  \n(in the mid-2nd and mid-  \n3rd centuries AD) and it was \ngradually abandoned after the \n7th century. The NW section \nof the archaeological site is \ncovered by a large rectangular \nsquare [Α] with traces of \nmarble paving. In the S section \nof the square lies the largest \npart of the double underground \nCryptoporticus [covered \npassageway] [Β] which was \nmost probably used as a public \nstorehouse.', '72\nMUSEUMS\nby tradesmen. Aspects of \nthe Byzantine everyday life, \nart and culture are depicted, \ncovering the times from \nthe early Byzantine until \nthe post Byzantine period. \nThe exhibition is structured \nby dates, in the following \nthematic categories:\n• Early Christian or Early \nByzantine period (4th–7th c.).  \nIt includes the chapters: i. The \nEarly Christian church (room \n1) where the general shape \nand the particular elements \nof churches of that period are \ndescribed, ii) Early christian \ntown and house (room 2), \noffering some insight into \nthe public and private life of \npeople in those times and iii) \nFrom the Elysian Fields to the \nChristian Paradise (room 3) \ndealing with the burial of the \ndead and the cemeteries of \nthe early Christian period.\n• Middle Byzantine \nperiod (8th – 12th c.).', 'Agios Dimitrios Church\t\n\t24.\tAgia Aikaterini Church\t\n\t25.\tProfitis Ilias Church\t\n\t26.\tByzantine Bath-house (Kule Kafe)\t\n\t27.\t\x07Osios David Church  \n(Latomou Monastery)\t\n\t28.\t\x07Vlatadon Monastery (Patriarchal  \nFoundation for Theological Studies)\t\n\t29.\tAgios Nikolaos Orfanos\t\n\t30.\tCity Walls\t\n\tOTTOMAN MONUMENTS\n\t31.\tWhite Tower\t\n\t32.\tVardariou Tower (Top Hane)\t\n\t33.\tPasha Hamam (“Phoenix”)\t\n\t34.\tHamza Bey Mosque (“Alkazar”)\t\n\t35.\tPazar Hamam (Flower Shops)\t\n\t36.\tBey Hamam (“Paradise”)\t\n\t37.\tYeni Hamam (“Aigli”)\t\n\t38.\tAlatza Imaret\t\n\t39.\tTrigoniou Tower\t\n\t40.\tEptapyrgio (Yedi Kule)\t\n\t41.\tYeni Mosque (exhibition area)\t\n\t\t19th – 20th c. MONUMENTS\n\t42.\tAristotelous Square\t\n\t43.\t\x07YMCA of Thessaloniki  \n(Sports Centre – Library)\t\n\t44.\t\x07Greek Telecommunications [OTE] Tower\t\n\t45.\tPasha Gardens\t\n\t46.\tVilla Bianca\t\n\t47.\tVilla Ahmet Kapantzi\t\n\t48.\tGovernor’s House (Little Palace)\t\n113', '70). \n8.2  Colonnaded yard.\nThere were rooms on \nits three sides. Stoas with \ntessellated floors isolated \nthe atrium from other \nconstructions.\n8.3  Tank.\nThis two-storeyed building \nwas used as a cistern for \ncollecting water from the roofs \nof the palace and the Basilica.\n8.4  Basilica.\nThis monumental building \ntoo was used as an official \naudience hall. The outstanding \ntessellated floors in the arcade \nare particularly interesting. \n8.5  Bath house.\nLocated next to Basilica, the \nconstruction included rooms \nfor bathing with cold, tepid and \nhot water and an entrance hall \nwith a fountain.\n8.6  Hippodrome.\nFragments of the construction \nremain under the blocks of \n27\n7\n8\n8.2\n8.3\n8.6\n8.4\n8.7\n8.8\n8.5\n8.1', '60\n7th walk: \nWEST OF THE CENTRE-STAVROUPOLI\n2.6  Holy Twelve Apostles \nChurch\n(see p. 8).\n2.7  West City Walls.\nSections of the city’s west walls  \nremain along Arkadioupoleos and \nEirinis Streets and finds related \nto Litaia Gate have recently \nbeen located at the corner \nof Agiou Dimitriou and Agiou \nNestoros Streets. This gate \nused to be one of the seven \ngreat gates of the fortified city \nand formed part of the Early \nChristian period walls; it was \nnamed after Liti, a Byzantine \ntown to which the gate led. \nThe Golden Gate was also \nlocated on the Egnatia  \nStreet level.\n2.8  Pasha Hamam  \n[Paşa Hamami] (Phoenix  \nBath house).\nIt was built during the \n1520s by Cezeri Kasim Paşa. \nAlso known as Phoenix Bath \nhouse, this used to be the \nlast ottoman bath house open \nin town, as it closed down in \nas late as 1981. It is located \nat the corner of Kalvou and \nPineiou Streets, near the west \nwalls and the church of the \nHoly Twelve Apostles, and the \nstructure of the building was \nplanned with great care.']","['35 4th walk: HISTORIC CENTRE (3) 1.3 Plateia Dikastirion [Court house square]. A spacious green square situated towards the end of Aristotelous Street. The Hébrard plans placed construction of the Court House as well as of other state buildings on this location (to create a civic centre); in 1966, however, excavations on the spot revealed the Ancient Roman Forum and the process was halted. In the centre of the square stands the imposing bust of Eleftherios Venizelos (1977, G. Pappas), who remained a prime minister of Greece for more than 12 years during the period 1910 – 1932. There are small copper workshops in the adjacent Chalkeon and Kleisouras Streets, and their business has been an ongoing tradition since the byzantine period. 1.4 Panagia [Virgin Mary] Chalkeon. (see p. 9) 1.5 Bey Hamami. It lies on the SE side of Plateia Dikastirion. This impressive edifice was built in 1444 and it is the country’s largest ottoman bath house, a multi- domed construction with separate rooms for males and females, structured along two parallel ways. It is divided in three sections (cold, tepid and hot areas) and there is also a vaulted tank for heating water. It is widely known as the Paradise Baths and it went by that name until 1968. Right next to it there is a roman platform that is indicative of the ground level 2000 years ago. 1.6']","Paradise Baths, known historically by that name until 1968, is a significant archaeological site located in Thessaloniki. This ancient Roman bath complex is divided into three sections: cold, tepid, and hot areas, which were typical features of Roman bathhouses. The baths also include a vaulted tank used for heating water, showcasing the advanced engineering of the time.

Adjacent to the Paradise Baths is a Roman platform that provides insight into the ground level of the city approximately 2000 years ago. This site not only reflects the bathing culture of the Romans but also serves as a reminder of the social and communal aspects of life during that period.

Visiting Paradise Baths offers a unique opportunity to explore the remnants of ancient Roman architecture and understand the historical context of Thessaloniki. As a first-time visitor, you can appreciate the blend of history and culture while capturing Instagrammable moments of the ruins and the surrounding area. The site is accessible for sightseeing, allowing you to immerse yourself in the local heritage and connect with the city's past.

In addition to the baths, the nearby Roman (Ancient) Forum and Cryptoporticus further enrich your experience, providing a broader understanding of the city's historical significance. This combination of ancient structures makes Paradise Baths a must-visit for anyone interested in the rich history of Thessaloniki.","Paradise Baths, also known as Bey Hamami, is the country’s largest Ottoman bath house, built in 1444. It features a multi-domed construction with separate rooms for males and females, divided into cold, tepid, and hot areas, and includes a vaulted tank for heating water.",0.5,0.08,0.45454545454545453,0.5799309883686721,0.99999999998,0.8333333332916666,0.0,0.249999999375,,0.7128258401133434
11,What can you tell me about Kleisouras Streets and its significance in the historic center?,"['35\n4th walk: \nHISTORIC CENTRE (3)\n1.3  Plateia Dikastirion \n[Court house square]. \nA spacious green square \nsituated towards the end \nof Aristotelous Street. \nThe Hébrard plans placed \nconstruction of the Court \nHouse as well as of other  \nstate buildings on this location \n(to create a civic centre);  \nin 1966, however, excavations \non the spot revealed the \nAncient Roman Forum and  \nthe process was halted. In  \nthe centre of the square stands \nthe imposing bust of Eleftherios \nVenizelos (1977, G. Pappas), \nwho remained a prime minister \nof Greece for more than 12 \nyears during the period 1910 – \n1932. There are small copper \nworkshops in the adjacent \nChalkeon and Kleisouras \nStreets, and their business has \nbeen an ongoing tradition since \nthe byzantine period.\n1.4  Panagia [Virgin Mary] \nChalkeon.\n(see p. 9)\n1.5  Bey Hamami.\nIt lies on the SE side of  \nPlateia Dikastirion. This impressive \nedifice was built in 1444 and  \nit is the country’s largest \nottoman bath house, a multi-\ndomed construction with \nseparate rooms for males and \nfemales, structured along two \nparallel ways. It is divided in \nthree sections (cold, tepid \nand hot areas) and there is \nalso a vaulted tank for heating \nwater.', 'It is about an excursion taken \nto the most interesting parts \nof the viticultural zone; this is \ncombined with a visit to the \narchaeological and historical \nassets of those areas, with \ncountryside activities, as \nwell as a visit to wineries \nand degustation. Make sure \nyou visit the impressive \nGerovassiliou Wine Museum  \nin Epanomi (see p. 68 & 80). \nFor more information, \ncontact the Wine Roads \nof North Greece: tel: 2310 \n281.617 and 2310 281.632, \nwww.winesofnorthgreece.gr\n121, 122 & \n123.  \nThessaloniki \noffers its little \nvisitors a host \nof fun activities \nand games to \nchoose from.\n121\n122', '88\nDAY EXCURSIONS\nJewish quarter in Europe, \nwhich maintains a traditional \ncharacter in its entirety. It \nis worth taking a walk and \nvisiting the Roman, Ottoman \nand Industrial age monuments \nin the traditional districts of \nKyriotissa, Panagia Dexia, and \nMakariotissa; you can also visit \nthe Public Central Library which \nhas earned an international \naward, or relax in the parks  \nand squares.\nHow to get there.  \nVergina is about 63 km SW  \nof Thessaloniki. If you travel by \ncar, follow the signs to Veroia \nand after that to Vergina. You \ncan also take the intercity bus \nor the train to reach Veroia  \nand then take the local bus  \nto Vergina.\n3 \tDION\nThis most enchanting \narchaeological site is  \nlocated under the imposing \nOlympus mountain range, in  \na 150-hectare green area amid \nflowing waters coming from \nVafyras River and from other \nsprings; it is the habitat of \nmany species of birds, reptiles \nand amphibians. This used to \nbe a sacred place to ancient \nMacedonians who worshipped \nOlympian Zeus and the Muses \n[daughters of Zeus] here.', '21\n2nd walk: \nHISTORIC CENTRE (1)\nTRADITIONAL COMMERCIAL CENTRE\nWWII the area was gradually \ndowngraded; in 1985 it was \nproclaimed a historic area with \nlisted buildings. Since the early \n1990s, steps were taken to \nupgrade Ladadika, turning it \ninto a hotspot area in town \nwith numerous restaurants, \nclubs, cafés and venues where \nlive Greek music is performed. \nA central spot where you can \nstart your tour is Morichovou \nsq.; it is worth stopping by \nPetrakaki sq. where you will see \nthe Mansion of the Ottoman \nPost Office (today a hotel) \n–among other sights. Other \nplaces of interest are Aigyptou, \nKatouni, Lykourgou, and Edessis \nstreets (in Emporiou sq. or \nAno Ladadika, past Tsimiski \nstreet) where you will see two \nsurviving inns. There are still \ntraces of smoke dating to \nthe 1917 fire on the facades \nof buildings fronting on the \nharbour!\n6 \tTSIMISKI STREET\nThis main street is among the \nbusiest downtown places and \nconnects YMCA square (see \np. 26) with Ladadika.', '23\n2nd walk: \nHISTORIC CENTRE (1)\nTRADITIONAL COMMERCIAL CENTRE\nwarehouses in Thessaloniki see \nalso p. 62). To change it into \na shopping mall (Plateia) in \n1995-1997, it was completely \nreshaped with only the exterior \nremaining unchanged. Today it \nhouses shops, cinemas, cafés \nand restaurants, all of which \nsurround the central atrium.\n6.8  Buildings on Karolou \nDil [Charles Diehl] street.\nAt the junction of Tsimiski \nand Karolou Dil Streets lie \nimpressive buildings that \ndate to the early 20th c., now \nhousing shops and offices; \nthey are absolutely worth your \nattention. \n7 \t\x07TRADITIONAL \nMARKETS\nThe area west of Aristotelous \nstreet and south of Egnatia \nStreet encompasses the \ntown’s traditional market; it \nis dotted with small shops, \nmalls and arcades, most of \nwhich date back to the time \nof the Turkish Occupation. \nToday, in these much visited \nmarketplaces, you can find all \nkinds of products – food and \nspices, fabrics, jewellery, small \nboutiques and also tavernas, \nouzo restaurants and coffee \nshops.\nMUST SEE:\n7.1  Modiano Market.\nIt was built in 1922 by \nengineer E. Modiano, and it is \nknown as Modiano Market. It \nis a glass-roofed rectangular \nedifice containing 140 food \nshops inside its three arcades.']","['35 4th walk: HISTORIC CENTRE (3) 1.3 Plateia Dikastirion [Court house square]. A spacious green square situated towards the end of Aristotelous Street. The Hébrard plans placed construction of the Court House as well as of other state buildings on this location (to create a civic centre); in 1966, however, excavations on the spot revealed the Ancient Roman Forum and the process was halted. In the centre of the square stands the imposing bust of Eleftherios Venizelos (1977, G. Pappas), who remained a prime minister of Greece for more than 12 years during the period 1910 – 1932. There are small copper workshops in the adjacent Chalkeon and Kleisouras Streets, and their business has been an ongoing tradition since the byzantine period. 1.4 Panagia [Virgin Mary] Chalkeon. (see p. 9) 1.5 Bey Hamami. It lies on the SE side of Plateia Dikastirion. This impressive edifice was built in 1444 and it is the country’s largest ottoman bath house, a multi- domed construction with separate rooms for males and females, structured along two parallel ways. It is divided in three sections (cold, tepid and hot areas) and there is also a vaulted tank for heating water. It is widely known as the Paradise Baths and it went by that name until 1968. Right next to it there is a roman platform that is indicative of the ground level 2000 years ago. 1.6']","Kleisouras Street is located in the historic center of Thessaloniki, adjacent to the vibrant Plateia Dikastirion (Court House Square). This area is rich in cultural heritage and offers a glimpse into the city's past, making it an ideal spot for sightseeing. The street is known for its small copper workshops, which have been a part of the local tradition since the Byzantine period. These workshops not only showcase traditional craftsmanship but also provide an opportunity to interact with local artisans, enhancing your experience of the city's culture.

As you stroll along Kleisouras Street, you'll find yourself immersed in the historical ambiance of the area, characterized by its charming architecture and bustling atmosphere. The proximity to significant landmarks, such as the imposing bust of Eleftherios Venizelos in the nearby square, adds to the street's importance. Venizelos was a prominent figure in Greek history, serving as Prime Minister for over a decade, and his legacy is celebrated in this central location.

Kleisouras Street is also a gateway to exploring other nearby attractions, including the Ancient Roman Forum, which was uncovered during excavations in the 1960s. This archaeological site offers insights into Thessaloniki's ancient history and is a must-visit for anyone interested in the city's past.

For a solo traveler seeking budget-friendly experiences, Kleisouras Street provides a perfect blend of sightseeing and local culture. You can enjoy the vibrant atmosphere, capture Instagram-worthy moments, and perhaps even engage in conversations with locals, all while appreciating the historical significance of this charming street. Overall, a visit to Kleisouras Street is a rewarding experience that encapsulates the essence of Thessaloniki's historic center.","Kleisouras Streets is located adjacent to the Court House square, known as Plateia Dikastirion, in the historic center. This area features small copper workshops that have been part of the local tradition since the Byzantine period, highlighting the street's historical significance and ongoing craftsmanship.",0.6666666666666666,0.33,0.8518518518518519,0.7394628800158658,0.9999999999,0.9999999999,1.0,0.49999999875,,0.7987787548270614
12,What was the Roman Forum in Thessaloniki used for during ancient times?,"['It is divided in \nthree sections (cold, tepid \nand hot areas) and there is \nalso a vaulted tank for heating \nwater. It is widely known as the \nParadise Baths and it went by \nthat name until 1968. Right next \nto it there is a roman platform \nthat is indicative of the ground \nlevel 2000 years ago.\n1.6  Roman (Ancient) Forum\nDuring the roman period, \nthis 2-hectare area used to be \nthe social and religious centre \nof the city. Construction was \ncompleted in two phases  \n(in the mid-2nd and mid-  \n3rd centuries AD) and it was \ngradually abandoned after the \n7th century. The NW section \nof the archaeological site is \ncovered by a large rectangular \nsquare [Α] with traces of \nmarble paving. In the S section \nof the square lies the largest \npart of the double underground \nCryptoporticus [covered \npassageway] [Β] which was \nmost probably used as a public \nstorehouse.', '36\n4th walk: \nHISTORIC CENTRE (3)\nthat the place had been used \nby Christians as well, during \nthe late Roman period. South \nof the passageway there \nwere shops dating from the \n1st until the 13th century; the \nunderground Museum of the \nRoman Forum (see p. 71) was \nbuilt there as an extension. \nA 2nd - 4th c. AD Odeon [C] \nwas found behind the well-\npreserved eastern stoa. It  \nhas been restored and it is now \nused as a venue for cultural \nevents. A mint and an archive \noffice are right next to it. In the \nSE side, a round bath house \n[D] was unearthed which has \nbeen in use since the 1st c. BC. \nParts of a colonnade, mosaic \nfloors, marble stairs, a section \nof a stone-paved street, sewer \npipes, silver coins, stone and \nmarble sculptures were all \nfound in this archaeological \nsite. The forum is also where \nthe “Enchanted Ones” (las \nIncantadas) were discovered, \na two-storeyed colonnaded \narchway with Corinthian-order \ncolumns and pillars four of \nwhich have survived. They are \ndecorated with figures in relief \nin their interior as well as their \nexterior side (“Stoa of the \nStatuettes”).', '35\n4th walk: \nHISTORIC CENTRE (3)\n1.3  Plateia Dikastirion \n[Court house square]. \nA spacious green square \nsituated towards the end \nof Aristotelous Street. \nThe Hébrard plans placed \nconstruction of the Court \nHouse as well as of other  \nstate buildings on this location \n(to create a civic centre);  \nin 1966, however, excavations \non the spot revealed the \nAncient Roman Forum and  \nthe process was halted. In  \nthe centre of the square stands \nthe imposing bust of Eleftherios \nVenizelos (1977, G. Pappas), \nwho remained a prime minister \nof Greece for more than 12 \nyears during the period 1910 – \n1932. There are small copper \nworkshops in the adjacent \nChalkeon and Kleisouras \nStreets, and their business has \nbeen an ongoing tradition since \nthe byzantine period.\n1.4  Panagia [Virgin Mary] \nChalkeon.\n(see p. 9)\n1.5  Bey Hamami.\nIt lies on the SE side of  \nPlateia Dikastirion. This impressive \nedifice was built in 1444 and  \nit is the country’s largest \nottoman bath house, a multi-\ndomed construction with \nseparate rooms for males and \nfemales, structured along two \nparallel ways. It is divided in \nthree sections (cold, tepid \nand hot areas) and there is \nalso a vaulted tank for heating \nwater.', 'TERPSITHEA\nSQ.\nROMFEI\nSQ.\nN\nSYNTRIVANIOU\nSQ.\nNAVARINOU\nSQ.\nSQ.\nSYKIES\nZIDROU\nSQ.\nLYSSIATREIO\nFOREST\n(SEICH SOU\nAGIOS\nDIMITRIOS\nHOSPITAL\nGENERAL\nHOSPITAL\nOF THESSALONIKI\nG. GENNIMATAS\nUNIVERSITY\nGENERAL\nHOSPITAL\nOF THESSAL\nAHEPA\n1\n2\n2\n3\n3.5\n3.4\n3.6\n3.7\n2.1\n2.2 2.3\n3.8\n1.8\n1.9\n3.3\n1.3\n1.4\n1.2\n1.7\n1.6\n1.1\n1.5\n3.2\n3.1\n1.10\n1.11 1.12\n1.15\n1.13\n1.14\n33.  \nA plan of \nthe Roman \n(Ancient) \nForum of \nThessaloniki.', '90\nDAY EXCURSIONS\nMain street.\nThis wide stone-paved \nstreet used to cross the town \nin the north-south direction. \nThe marketplace, shops, public \nbuildings and houses flanked \nthe street all along.\nGreat Thermae.\nThis complex of public bath \nhouses covers a 4,000 m2 \narea. The facilities were paved \nwith marble and mosaic floors, \nthere were Vespasian urinals, \nentertainment areas, a courtyard, \nshops, a hall for the worship \nof god Asklipios, and a roofed \nOdeon for cultural events.\nThe Houses of Zosa and \nLida.\nLocated in the SE section \nof the town, the two houses \nused to be decorated with \nmosaic floors and sculpted \nbusts.\nRoman Forum.\nIt dates back to the late 2nd \n– early 3rd c. and comprises  \na slab-paved square surrounded  \nby arcades and public buildings.  \nIn the West side there were \nthe luxury houses of Epigenis \nand Evvoulos, decorated with \nexquisite mosaics; Sevasteio, \na temple dedicated to \nthe worship of the Roman \nemperors was situated in \nbetween the houses. In the \nEast side, there is a roman \nbasilica, an area for trade  \nand banking transactions,  \nthe Monument of the Shields \n(with shield and cuirass \ndepictions) and the Forum \nThermae.\nPolygonal building.']","['Roman (Ancient) Forum During the roman period, this 2-hectare area used to be the social and religious centre of the city. Construction was completed in two phases (in the mid-2nd and mid- 3rd centuries AD) and it was gradually abandoned after the 7th century. The NW section of the archaeological site is covered by a large rectangular square [Α] with traces of marble paving. In the S section of the square lies the largest part of the double underground Cryptoporticus [covered passageway] [Β] which was most probably used as a public storehouse. On one of its walls a valuable early Christian mural was uncovered and this shows 9 10 11 12 PARASKEVOPOULOU KONSTANTINOUPOLEOS DELFO KAFTANTZOGLOU PAPAFI PAPAFI PAPAFI KLEANTHOUS MARKOU BOTSARI PAPANASTASIOU PAPANASTASIOU ANATOLIKIS THRAKIS KANARI KANARI KARAKA MARATHONOS GRIGORIOU LAMPRAKI KONSTANTINOU KARAMANLI STRATOU AVE. PAPANASTASIOU AGIOS IOANNIS CHRYSOSTOMOS AGIA FOTEINI SARANTAPOROU BIZANIOU AGIAS TRIADAS BIZANIOU CHATZI FILOPOIMENOS LYTRA EDISON S NOTARA KAIRI SKOUFA XANTHOU TSAKALOF PATMOU PIGIS KYRIAKIDI ELEFTHERON ONA INIDI MATSI U OIT N E X F A PLITHONOS GEMISTOU GKYZI RIADI VYZANTIOU VELISSARIOU AETORACHIS EFZONON CHARISI CHARISI ILIADOS ZAIMI U DOUSMA ALKMINIS SINA ADIOU MITR. PLATAION DANIOLOU AGIOU VASILEIOU GENNADIOU MITR. THINEAS DELIGI PRAXITELOUS PAPAF FLEMING ARCHAIOLOGIKOU MOUSEIOU NASIOU DIAKOU CHIRS DIONOS GAMVETA DELIGIANNI IAKOVOU GALIVALDI MIAOULI XENOFONTOS KYVELIS CHARISI PERDIKA PASALIDI KIMONOS OSTROVOU PESTON PESTON ANDROU ALONNISOU MYKONOU AMOLIANIS SKYROU PARNITHAS SKALTSOUNI LYDIAS NIOVIS YMMITOU ASKLIPIOU PELIS PINDAROU LAMIAS IPEIROU PERDIKA IOANNINON EVVOIAS LITOCHOROU KRESNAS NEVROKOPIOU LITOCHOROU KORYTSAS TROIAS SERRON OMIROU PSAROU KRITONOS YDRAS EVRYVIADOU VALTETSIOU PELIAS ARGENTI KILKISSIOU LACHANA U O D AIT LI M ARCHIMIDOUS ELEFTHEROTON DOIRANIS DOIRANIS KARPATHOU TZOVAROPOULOU KERKYRAS RODIOU RIGOPOULOU NAOUSSIS AMYNTAIOU KATSIMIDI DANGLI KOUNTOURIOTI ELEFTHERIAS ELEFTHERIAS THRAKIS YPSILANTOU KOLOKOTRONI KANARI MIAOULI MIAOULI FILOTHEIS RODODAFNIS YAKINTHOU FILOMILAS OLYNTHOU LOTOU IVYSKOU ELEAS DRIOS EVAGORA PAPAILIAKI KLEANTHOUS MARONIAS CHOLOMONTOS ISIDOROU IPATIAS KISSOU KARIATIDAS KAVIRON AGAMEMNONOS ARIONOS STOVAIOU FILONOS ARGAIOU FOINIKOS EFESSOU KAISAREIAS KALLIPOLEOS VRYOULON KYZIKOU NIKOMIDEIAS NEAPOLEOS MIDEIAS PROUSIS IKONIOU KROMNIS PYRGOU MALAKOPIS KAPADDOKIAS LYKAONIAS SINIOSOGLOU NIKAIAS KAROLIDOU SARANTI CHEIMARRAS PSARON PRIAMOU MITSAKI MITROPOULOU IONIAS SANTAS PAPOULA YPARCHOU FOKYLIDOU KERAMIKOU EPIDAVROU TSELIOU PRAXAGORA OLYMPIAS VOSPOROU AMFIPOLEOS MIKRAS ASIAS PONTOU VITHYNIAS PAPAGEORGIOU IOANNOU KAISAREIAS METRON IMVROU AGRIANON CHIOU CHOURMOUZI APOLLONOS SYROU FAIAKON LARNAKOS AMMOCHOSTOU NAFPLIOU NAFPLIOU DERKON KORDELIOU VIZYIS DORYLAIOU TINOU TENEDOU DARDANELLION DIMITSANAS EPIDAVROU EFSTATHIOU MITROPOLITOU CHANDR KARANIVA ATLANTID SVOL VOSPO ZACH ZIRIN ZONARA ANAXIME ANATOLIKIS ROMYLIAS ISO TOUSSA SPEFSIPOU MYSTAKID DYSTOMOU MIKROU ANTISTHENOUS STEFANOU DIMOCHAROUS MISIRLI PILEAS AEROPOU PAFSILYPOU TRIANTAFYLLOPOULOU GRIGORIOU LAMPRAKI (KONIT SLI OSIAS XENIS TSELEPI TSIAPANOU TSAMI STRATIGI VISTA ANGELOPOULOU DIVOLI GKOURA GRIGORIOU STEFANOU ATHINA ANTHEMOUNTOS LEFAKI PAFSANIA SEMELIS AETIONOS PANTAZIDI PERRAIVOU PERRAIVOU SPANOU IPPO ARTAKIS PONTOU EPTALOFOU PARMENIDI ANAVRYTON FILIMONOS TPIKALON AGIAS MARINAS TIROLOIS TIROLOIS TRITONOS TRIPTOLEMOU POLYGNOTOU IPPODROMIOU POLIVIOU PROTOGENOUS DIAGORA LISSIPOU ANTIFANOS MEGAKLEOUS POLYKLEITOU EMPEDOKLEOUS ANDRIOTI VIANDROU VARNALI ADAMIDOU ZAIMI ORTANSIAS IRIDOS MAKEDONIAS ANAFIS SAMOU POROU AIGINIS KYTHIRON LACHANA MIKRAS ASIAS TRIKOUPI GYMNASTIRIOU ANAPAFSEOS ELEFTHERIAS AMORGOU SERIFOU MILOU MESOLONGIOU AG. SPYRIDONA SERRON SERRON KASTORIAS GRIGORIOU LAMPRAKI KATSIMDIDI SIDIROKASTROU SPARTIS KONSTANTINIDI AMALIAS ZERVA AGIOS FANOURIOS AGIA MARINA AGIA VARVARA AGIOS THERAPON AGIOS SPYRIDONAS K Y K L A M I N O N DOXA ANO TOUMPA MALAKOPI CHA KATO TOUMPA TOUMPA CEMETERY MAKEDONIA GOVATZIDAKI SQ. TRIANDRIA PAPAFIO U) THEAGENEIO CANCER HOSPITAL IPPOKRATEIO GENERAL HOSPITAL OF THESSALONIKI Y LONIKI INFECTIOUS DISEASES HOSPITAL RETIREMENT HOME 3 3.9 A B Γ Δ 33']","The Roman Forum in Thessaloniki served as the social and religious center of the city during the Roman period. Spanning approximately 2 hectares, it was constructed in two phases during the mid-2nd and mid-3rd centuries AD and gradually fell into disuse after the 7th century. 

The forum featured a large rectangular square, which was likely paved with marble, and included various public buildings and spaces for social interaction. It was a hub for commerce, culture, and community gatherings, reflecting the vibrant life of the city at that time. Shops lined the area, indicating its role as a marketplace where goods were exchanged and local businesses thrived.

One of the notable structures within the forum was the double underground Cryptoporticus, which functioned as a covered passageway, possibly used for storage. This architectural feature highlights the forum's importance as a multifunctional space, accommodating both public and private activities.

Additionally, the forum housed the Odeon, a venue for cultural events, and remnants of a round bathhouse that dates back to the 1st century BC, showcasing the leisure activities of the citizens. The discovery of various artifacts, including coins, sculptures, and mosaic floors, further emphasizes the forum's significance as a center of daily life and religious practices, including the worship of Roman emperors.

Overall, the Roman Forum was a vital part of Thessaloniki's urban landscape, facilitating social interaction, commerce, and cultural expression, making it an essential site for understanding the city's ancient history.","During the Roman period, the Roman Forum was the social and religious centre of the city. It was constructed in two phases, completed in the mid-2nd and mid-3rd centuries AD, and was gradually abandoned after the 7th century.",1.0,0.19,1.0,0.7285356573384025,0.8666666666377778,0.699999999965,0.0,0.3999999992,,0.8871247125417377
13,What historical significance does Macedonia hold in relation to the Roman Forum?,"['36\n4th walk: \nHISTORIC CENTRE (3)\nthat the place had been used \nby Christians as well, during \nthe late Roman period. South \nof the passageway there \nwere shops dating from the \n1st until the 13th century; the \nunderground Museum of the \nRoman Forum (see p. 71) was \nbuilt there as an extension. \nA 2nd - 4th c. AD Odeon [C] \nwas found behind the well-\npreserved eastern stoa. It  \nhas been restored and it is now \nused as a venue for cultural \nevents. A mint and an archive \noffice are right next to it. In the \nSE side, a round bath house \n[D] was unearthed which has \nbeen in use since the 1st c. BC. \nParts of a colonnade, mosaic \nfloors, marble stairs, a section \nof a stone-paved street, sewer \npipes, silver coins, stone and \nmarble sculptures were all \nfound in this archaeological \nsite. The forum is also where \nthe “Enchanted Ones” (las \nIncantadas) were discovered, \na two-storeyed colonnaded \narchway with Corinthian-order \ncolumns and pillars four of \nwhich have survived. They are \ndecorated with figures in relief \nin their interior as well as their \nexterior side (“Stoa of the \nStatuettes”).', '71\ncourtyard). Antiquities dating to \nthe 2nd – 4th c. AD are divided in \ntwo sections: in the first one a \nreconstruction is attempted of \na cemetery segment containing \nfinds, sarcophagi and altars; \nthe second one involves the \nre-creation of a Greco-roman \nhouse with mosaic floors on \ndisplay and items of daily use.\n• Prehistoric Macedonia. \n(basement, room 11). The \nitems exhibited refer to Man’s \nfirst productive stages in \nMacedonia (with activities such \nas hunting, fishing, agriculture, \nstock farming, weaving, \nmetallurgy). There are also \ncasts of skulls belonging to \nOuranopithecus Macedoniensis, \nan early hominid primate, as \nwell as of the Man found in \nPetralona cave (see p. 92).\n• Temporary exhibitions. \nThe museum organises each \nyear a major thematic exhibition \nand 2-5 minor ones, where \nparticular aspects of every day \nlife in Macedonia are treated in \nconnection with the Greek and \nthe Mediterranean area.\nTHE ROMAN FORUM \nMUSEUM\nSmall yet very interesting, \nthis museum was inaugurated \nin 2010. A narrative of local \nexcavations and information \non the museum’s building \nstages is on display in the \nvestibule; in the main hall, \nvisitors will see a depiction \nof the area’s history from the \nHellenistic years until the 4th \nc. AD.', 'MAP OF THESSALONIKI\n\t\tPUBLIC AGENCIES – SERVICES\n\t 1.\tG.N.T.O. Information Office\t\n\t 2.\tMinistry of Macedonia – Thrace\t\n\t 3.\t\x07Region of Central Macedonia (Villa Allatini)\n\t 4.\tNew Town Hall\t\n\t 5.\tPolice Department – Aliens Office\t\n\t6.\tTourist Police Station\t\n\t 7.\tCentral Post Office\t\n\t8.\tCustoms (harbour)\t\n\t9.\tLaw Court\t\n\t10.\t\x07Aristotle University of Thessaloniki – Campus\n\t11.\tMarina\t\n\t\tROMAN MONUMENTS\n\t12.\tRoman Forum\t\n\t13.\tRotunda (Agios Georgios)\t\n\t14.\tArch of Galerius (Kamara)\t\n\t15.\tPalace of Galerius\t\n\t16.\tHippodrome\t\n\t\tBYZANTINE MONUMENTS\n\t17.\tHoly Twelve Apostles Church\t\n\t18.\tPanagia [Our Lady] Chalkeon Church\t\n\t19.\tAcheiropoiitos Church\t\n\t20.\tAgia Sofia Church\t\n\t21.\tMetamorfosi Sotiros Church\t\n\t22.\tAgios Panteleimonas Church\t\n\t23.\tAgios Dimitrios Church\t\n\t24.\tAgia Aikaterini Church\t\n\t25.\tProfitis Ilias Church\t\n\t26.\tByzantine Bath-house (Kule Kafe)\t\n\t27.', 'Radio Taxi:  \n«Taxiway» (tel.: 18300), \n«Mercedes» (tel.: 18180), \n«Macedonia» (tel.: 18288) \nMUSEUMS – \nARCHAEOLOGICAL SITES\nA large number of museums and \narchaeological sites are open to \nvisitors in the suburbs and city \noutskirts. A number of them are \nlisted below. For more info visit \nhttp://odysseus.culture.gr\nArchaeological Museum  \nof Thessaloniki: \n6, Manoli Andronikou St. \ntel.: 2313 310.201 \nwebsite: www.amth.gr\nMuseum of the Roman Forum:  \nOlympou and Filippou Sts. \ntel.: \x072313 310.400 \n2310 221.266\nMuseum of Byzantine Culture: \n2, Stratou Ave \ntel.: 2313 306.400 \nwebsite: www.mbp.gr\nWhite Tower Museum: \ntel.: 2310 267.832 \nwebsite: www.lpth.gr\nSaint Demetrius  \n[Agios Dimitrios] Crypt: \n83, Agiou Dimitriou St. \ntel.: 2310 270.591 \nwebsite: www.inad.gr\nJewish Museum of Thessaloniki: \n13, Agiou Mina St. \ntel.: 2310 250.406 \nwebsite: www.jmth.gr\nMuseum for the Macedonian \nStruggle: \n23, Proxenou Koromila St. \ntel.', '70\nARCHAEOLOGICAL MUSEUM \nOF THESSALONIKI\nWorks of art of outstanding \nvalue and excavated ensembles \nfrom the entire region of \nMacedonia are on display, \ncovering all the aspects of \nprivate and public life in the \narea, from the prehistoric era \nto the late antiquity period. \nExhibits are organised in six \nbasic categories:\n• Towards the birth of towns. \n(ground floor, room 4). The \nevidence on display shows \nthat there were settlements in \nMacedonia dating to the Iron \nAge, from 1100 to 700 BC.\n• Macedonia from the 7th c.  \nBC until Late Antiquity. \n(ground floor, room 5). Eight \nlarge theme sections cover \nvarious aspects of private \nand public life in Macedonia \nfrom the archaic years, when \nthe independent Macedonian \nkingdom was created, until \nthe 1st – 4th c. AD, when the \nentire region was a province \nof the Roman Empire. Finds \ncome mainly from excavations \ncarried out in areas of central \nMacedonia.\n• Thessaloniki, Metropolis \nof Macedonia. (ground \nfloor, room 6). Historical and \narchaeological information \nis presented, starting from \n315 BC when the town was \nfounded. There is also a \npartial reconstruction of an \narchaic temple of Ionic order, \nwhose original position is yet \nunknown; it was transported \nto the area of the Temples of \nThessaloniki during the Roman \noccupation.']","['Roman (Ancient) Forum During the roman period, this 2-hectare area used to be the social and religious centre of the city. Construction was completed in two phases (in the mid-2nd and mid- 3rd centuries AD) and it was gradually abandoned after the 7th century. The NW section of the archaeological site is covered by a large rectangular square [Α] with traces of marble paving. In the S section of the square lies the largest part of the double underground Cryptoporticus [covered passageway] [Β] which was most probably used as a public storehouse. On one of its walls a valuable early Christian mural was uncovered and this shows 9 10 11 12 PARASKEVOPOULOU KONSTANTINOUPOLEOS DELFO KAFTANTZOGLOU PAPAFI PAPAFI PAPAFI KLEANTHOUS MARKOU BOTSARI PAPANASTASIOU PAPANASTASIOU ANATOLIKIS THRAKIS KANARI KANARI KARAKA MARATHONOS GRIGORIOU LAMPRAKI KONSTANTINOU KARAMANLI STRATOU AVE. PAPANASTASIOU AGIOS IOANNIS CHRYSOSTOMOS AGIA FOTEINI SARANTAPOROU BIZANIOU AGIAS TRIADAS BIZANIOU CHATZI FILOPOIMENOS LYTRA EDISON S NOTARA KAIRI SKOUFA XANTHOU TSAKALOF PATMOU PIGIS KYRIAKIDI ELEFTHERON ONA INIDI MATSI U OIT N E X F A PLITHONOS GEMISTOU GKYZI RIADI VYZANTIOU VELISSARIOU AETORACHIS EFZONON CHARISI CHARISI ILIADOS ZAIMI U DOUSMA ALKMINIS SINA ADIOU MITR. PLATAION DANIOLOU AGIOU VASILEIOU GENNADIOU MITR. THINEAS DELIGI PRAXITELOUS PAPAF FLEMING ARCHAIOLOGIKOU MOUSEIOU NASIOU DIAKOU CHIRS DIONOS GAMVETA DELIGIANNI IAKOVOU GALIVALDI MIAOULI XENOFONTOS KYVELIS CHARISI PERDIKA PASALIDI KIMONOS OSTROVOU PESTON PESTON ANDROU ALONNISOU MYKONOU AMOLIANIS SKYROU PARNITHAS SKALTSOUNI LYDIAS NIOVIS YMMITOU ASKLIPIOU PELIS PINDAROU LAMIAS IPEIROU PERDIKA IOANNINON EVVOIAS LITOCHOROU KRESNAS NEVROKOPIOU LITOCHOROU KORYTSAS TROIAS SERRON OMIROU PSAROU KRITONOS YDRAS EVRYVIADOU VALTETSIOU PELIAS ARGENTI KILKISSIOU LACHANA U O D AIT LI M ARCHIMIDOUS ELEFTHEROTON DOIRANIS DOIRANIS KARPATHOU TZOVAROPOULOU KERKYRAS RODIOU RIGOPOULOU NAOUSSIS AMYNTAIOU KATSIMIDI DANGLI KOUNTOURIOTI ELEFTHERIAS ELEFTHERIAS THRAKIS YPSILANTOU KOLOKOTRONI KANARI MIAOULI MIAOULI FILOTHEIS RODODAFNIS YAKINTHOU FILOMILAS OLYNTHOU LOTOU IVYSKOU ELEAS DRIOS EVAGORA PAPAILIAKI KLEANTHOUS MARONIAS CHOLOMONTOS ISIDOROU IPATIAS KISSOU KARIATIDAS KAVIRON AGAMEMNONOS ARIONOS STOVAIOU FILONOS ARGAIOU FOINIKOS EFESSOU KAISAREIAS KALLIPOLEOS VRYOULON KYZIKOU NIKOMIDEIAS NEAPOLEOS MIDEIAS PROUSIS IKONIOU KROMNIS PYRGOU MALAKOPIS KAPADDOKIAS LYKAONIAS SINIOSOGLOU NIKAIAS KAROLIDOU SARANTI CHEIMARRAS PSARON PRIAMOU MITSAKI MITROPOULOU IONIAS SANTAS PAPOULA YPARCHOU FOKYLIDOU KERAMIKOU EPIDAVROU TSELIOU PRAXAGORA OLYMPIAS VOSPOROU AMFIPOLEOS MIKRAS ASIAS PONTOU VITHYNIAS PAPAGEORGIOU IOANNOU KAISAREIAS METRON IMVROU AGRIANON CHIOU CHOURMOUZI APOLLONOS SYROU FAIAKON LARNAKOS AMMOCHOSTOU NAFPLIOU NAFPLIOU DERKON KORDELIOU VIZYIS DORYLAIOU TINOU TENEDOU DARDANELLION DIMITSANAS EPIDAVROU EFSTATHIOU MITROPOLITOU CHANDR KARANIVA ATLANTID SVOL VOSPO ZACH ZIRIN ZONARA ANAXIME ANATOLIKIS ROMYLIAS ISO TOUSSA SPEFSIPOU MYSTAKID DYSTOMOU MIKROU ANTISTHENOUS STEFANOU DIMOCHAROUS MISIRLI PILEAS AEROPOU PAFSILYPOU TRIANTAFYLLOPOULOU GRIGORIOU LAMPRAKI (KONIT SLI OSIAS XENIS TSELEPI TSIAPANOU TSAMI STRATIGI VISTA ANGELOPOULOU DIVOLI GKOURA GRIGORIOU STEFANOU ATHINA ANTHEMOUNTOS LEFAKI PAFSANIA SEMELIS AETIONOS PANTAZIDI PERRAIVOU PERRAIVOU SPANOU IPPO ARTAKIS PONTOU EPTALOFOU PARMENIDI ANAVRYTON FILIMONOS TPIKALON AGIAS MARINAS TIROLOIS TIROLOIS TRITONOS TRIPTOLEMOU POLYGNOTOU IPPODROMIOU POLIVIOU PROTOGENOUS DIAGORA LISSIPOU ANTIFANOS MEGAKLEOUS POLYKLEITOU EMPEDOKLEOUS ANDRIOTI VIANDROU VARNALI ADAMIDOU ZAIMI ORTANSIAS IRIDOS MAKEDONIAS ANAFIS SAMOU POROU AIGINIS KYTHIRON LACHANA MIKRAS ASIAS TRIKOUPI GYMNASTIRIOU ANAPAFSEOS ELEFTHERIAS AMORGOU SERIFOU MILOU MESOLONGIOU AG. SPYRIDONA SERRON SERRON KASTORIAS GRIGORIOU LAMPRAKI KATSIMDIDI SIDIROKASTROU SPARTIS KONSTANTINIDI AMALIAS ZERVA AGIOS FANOURIOS AGIA MARINA AGIA VARVARA AGIOS THERAPON AGIOS SPYRIDONAS K Y K L A M I N O N DOXA ANO TOUMPA MALAKOPI CHA KATO TOUMPA TOUMPA CEMETERY MAKEDONIA GOVATZIDAKI SQ. TRIANDRIA PAPAFIO U) THEAGENEIO CANCER HOSPITAL IPPOKRATEIO GENERAL HOSPITAL OF THESSALONIKI Y LONIKI INFECTIOUS DISEASES HOSPITAL RETIREMENT HOME 3 3.9 A B Γ Δ 33']","Macedonia holds significant historical importance in relation to the Roman Forum, particularly in the context of its archaeological and cultural heritage. The Roman Forum, located in Thessaloniki, was a central hub during the Roman period, showcasing the region's transition from Hellenistic influences to Roman governance. This site reflects the rich tapestry of life in Macedonia, where various structures, such as the Odeon and the underground Museum of the Roman Forum, reveal layers of history from the 1st to the 4th century AD.

The archaeological findings at the Roman Forum include remnants of shops, public baths, and a colonnade, which highlight the daily life and social interactions of the time. The discovery of the ""Enchanted Ones,"" a two-storeyed colonnaded archway, exemplifies the architectural sophistication and artistic expression prevalent in Macedonia during the Roman era. These structures not only served practical purposes but also played a role in the cultural and civic life of the city.

Moreover, the Museum of the Roman Forum, inaugurated in 2010, provides insights into local excavations and the historical narrative of the area from the Hellenistic period to Late Antiquity. Exhibits include artifacts that illustrate the evolution of urban life and the integration of Roman culture into Macedonian society.

Overall, the Roman Forum serves as a testament to Macedonia's historical significance, showcasing its role as a vital center of commerce, culture, and governance during the Roman Empire. For a first-time visitor, exploring these sites offers a unique opportunity to connect with the region's rich past while enjoying the vibrant atmosphere of Thessaloniki.","During the Roman period, Macedonia was home to a 2-hectare area that served as the social and religious center of the city, known as the Roman Forum. This site was constructed in two phases during the mid-2nd and mid-3rd centuries AD and was gradually abandoned after the 7th century.",0.6666666666666666,0.4,0.7083333333333334,0.7773660912870466,0.99999999998,0.4499999999775,0.0,0.33333333277777777,,0.9826059062518696
14,Wht is the significance of the Christian mural found in the Roman Forum?,"['36\n4th walk: \nHISTORIC CENTRE (3)\nthat the place had been used \nby Christians as well, during \nthe late Roman period. South \nof the passageway there \nwere shops dating from the \n1st until the 13th century; the \nunderground Museum of the \nRoman Forum (see p. 71) was \nbuilt there as an extension. \nA 2nd - 4th c. AD Odeon [C] \nwas found behind the well-\npreserved eastern stoa. It  \nhas been restored and it is now \nused as a venue for cultural \nevents. A mint and an archive \noffice are right next to it. In the \nSE side, a round bath house \n[D] was unearthed which has \nbeen in use since the 1st c. BC. \nParts of a colonnade, mosaic \nfloors, marble stairs, a section \nof a stone-paved street, sewer \npipes, silver coins, stone and \nmarble sculptures were all \nfound in this archaeological \nsite. The forum is also where \nthe “Enchanted Ones” (las \nIncantadas) were discovered, \na two-storeyed colonnaded \narchway with Corinthian-order \ncolumns and pillars four of \nwhich have survived. They are \ndecorated with figures in relief \nin their interior as well as their \nexterior side (“Stoa of the \nStatuettes”).', '12\n1st walk: \nUNESCO BYZANTINE MONUMENTS\nChristian monuments in the \nOrthodox world. It is a cross-\ndomed basilica and used to \nbe the Metropolitan Church \n(Cathedral) until 1523 when it \nwas converted into a mosque; \nit was restored to Christian \nworship after 1912. The \ncapitals date to the 5th – 6th \nc. (they were part of the older \nchurch); the wonderful mosaics \nare an absolute must-see, \nparticularly the ones on the \ndome with the image of the \nAscension of Christ, as are \nthe murals crafted in different \nstages from the 8th to the \n11th c. In the church’s south \nside, amid green surroundings \nyou will find the church of \nAgios Ioannis Prodromos [St. \nJohn the Forerunner] (1940); \nfrom this point you will enter \nthe early-Christian baptistery \n(catacomb) of Agia Sofia, built \non the ruins of roman baths.\n5 \t\x07TRANSFIGURATION OF \nTHE SAVIOUR CHURCH \n[METAMORFOSI SOTIROS]\nIt is located on Egnatia Street \n(see p. 34) almost between \nKamara (see p. 37) and the \nPalace of Galerius (see p. 29). \nConstruction took place possibly \naround 1340 and it is a typical \nexample of the transitional type \nin Byzantine church-building, \nfound particularly in Macedonia.', '90\nDAY EXCURSIONS\nMain street.\nThis wide stone-paved \nstreet used to cross the town \nin the north-south direction. \nThe marketplace, shops, public \nbuildings and houses flanked \nthe street all along.\nGreat Thermae.\nThis complex of public bath \nhouses covers a 4,000 m2 \narea. The facilities were paved \nwith marble and mosaic floors, \nthere were Vespasian urinals, \nentertainment areas, a courtyard, \nshops, a hall for the worship \nof god Asklipios, and a roofed \nOdeon for cultural events.\nThe Houses of Zosa and \nLida.\nLocated in the SE section \nof the town, the two houses \nused to be decorated with \nmosaic floors and sculpted \nbusts.\nRoman Forum.\nIt dates back to the late 2nd \n– early 3rd c. and comprises  \na slab-paved square surrounded  \nby arcades and public buildings.  \nIn the West side there were \nthe luxury houses of Epigenis \nand Evvoulos, decorated with \nexquisite mosaics; Sevasteio, \na temple dedicated to \nthe worship of the Roman \nemperors was situated in \nbetween the houses. In the \nEast side, there is a roman \nbasilica, an area for trade  \nand banking transactions,  \nthe Monument of the Shields \n(with shield and cuirass \ndepictions) and the Forum \nThermae.\nPolygonal building.', '57\n6th walk: \nNEA PARALIA – VASILISSIS OLGAS AVENUE\n3.12 Yeni Camii  \n(New Mosque).\nIt is located at 30, Archaeolo-\ngikou Mouseiou Street. It was \nbuilt in 1902 by the Italian \narchitect V. Poselli as the \nmosque for Jews converted  \nto Islam (Donmeh). It combines \nfeatures of the Muslim \narchitectural tradition and \neclecticism. In 1922 the building \nprovided accommodation for \nrefugees and during the period \n1925–1963 it housed the city’s \nArchaeological Museum. It is now \na municipal exhibition area; in the \nyard there is a collection of marble \nsculptures dating to Roman and \nEarly Christian times (sarcophagi, \nstelae and others), collected from \nthe wider urban area. \n3.13 Hatzimisef Villa  \n(3, Vas. Olgas Ave.)\nThis is yet another building \ntypical of the style found in \nthe area, housing the town’s \n1st High School. At no. 5, lies \nthe Joseph Modiano villa, \ntoday uninhabited and barely \ndiscernible behind the fencing. \nA branch of the town’s 1st High \nSchool was once located here.\n3.14 Bust of George I.\nIt is found at the corner \nof Vas. Olgas Ave. and Agias \nTriadas St. This is the spot \nwhere King George I was \nassassinated on March 5, 1913 \nby Al.', 'It is divided in \nthree sections (cold, tepid \nand hot areas) and there is \nalso a vaulted tank for heating \nwater. It is widely known as the \nParadise Baths and it went by \nthat name until 1968. Right next \nto it there is a roman platform \nthat is indicative of the ground \nlevel 2000 years ago.\n1.6  Roman (Ancient) Forum\nDuring the roman period, \nthis 2-hectare area used to be \nthe social and religious centre \nof the city. Construction was \ncompleted in two phases  \n(in the mid-2nd and mid-  \n3rd centuries AD) and it was \ngradually abandoned after the \n7th century. The NW section \nof the archaeological site is \ncovered by a large rectangular \nsquare [Α] with traces of \nmarble paving. In the S section \nof the square lies the largest \npart of the double underground \nCryptoporticus [covered \npassageway] [Β] which was \nmost probably used as a public \nstorehouse.']","['Roman (Ancient) Forum During the roman period, this 2-hectare area used to be the social and religious centre of the city. Construction was completed in two phases (in the mid-2nd and mid- 3rd centuries AD) and it was gradually abandoned after the 7th century. The NW section of the archaeological site is covered by a large rectangular square [Α] with traces of marble paving. In the S section of the square lies the largest part of the double underground Cryptoporticus [covered passageway] [Β] which was most probably used as a public storehouse. On one of its walls a valuable early Christian mural was uncovered and this shows 9 10 11 12 PARASKEVOPOULOU KONSTANTINOUPOLEOS DELFO KAFTANTZOGLOU PAPAFI PAPAFI PAPAFI KLEANTHOUS MARKOU BOTSARI PAPANASTASIOU PAPANASTASIOU ANATOLIKIS THRAKIS KANARI KANARI KARAKA MARATHONOS GRIGORIOU LAMPRAKI KONSTANTINOU KARAMANLI STRATOU AVE. PAPANASTASIOU AGIOS IOANNIS CHRYSOSTOMOS AGIA FOTEINI SARANTAPOROU BIZANIOU AGIAS TRIADAS BIZANIOU CHATZI FILOPOIMENOS LYTRA EDISON S NOTARA KAIRI SKOUFA XANTHOU TSAKALOF PATMOU PIGIS KYRIAKIDI ELEFTHERON ONA INIDI MATSI U OIT N E X F A PLITHONOS GEMISTOU GKYZI RIADI VYZANTIOU VELISSARIOU AETORACHIS EFZONON CHARISI CHARISI ILIADOS ZAIMI U DOUSMA ALKMINIS SINA ADIOU MITR. PLATAION DANIOLOU AGIOU VASILEIOU GENNADIOU MITR. THINEAS DELIGI PRAXITELOUS PAPAF FLEMING ARCHAIOLOGIKOU MOUSEIOU NASIOU DIAKOU CHIRS DIONOS GAMVETA DELIGIANNI IAKOVOU GALIVALDI MIAOULI XENOFONTOS KYVELIS CHARISI PERDIKA PASALIDI KIMONOS OSTROVOU PESTON PESTON ANDROU ALONNISOU MYKONOU AMOLIANIS SKYROU PARNITHAS SKALTSOUNI LYDIAS NIOVIS YMMITOU ASKLIPIOU PELIS PINDAROU LAMIAS IPEIROU PERDIKA IOANNINON EVVOIAS LITOCHOROU KRESNAS NEVROKOPIOU LITOCHOROU KORYTSAS TROIAS SERRON OMIROU PSAROU KRITONOS YDRAS EVRYVIADOU VALTETSIOU PELIAS ARGENTI KILKISSIOU LACHANA U O D AIT LI M ARCHIMIDOUS ELEFTHEROTON DOIRANIS DOIRANIS KARPATHOU TZOVAROPOULOU KERKYRAS RODIOU RIGOPOULOU NAOUSSIS AMYNTAIOU KATSIMIDI DANGLI KOUNTOURIOTI ELEFTHERIAS ELEFTHERIAS THRAKIS YPSILANTOU KOLOKOTRONI KANARI MIAOULI MIAOULI FILOTHEIS RODODAFNIS YAKINTHOU FILOMILAS OLYNTHOU LOTOU IVYSKOU ELEAS DRIOS EVAGORA PAPAILIAKI KLEANTHOUS MARONIAS CHOLOMONTOS ISIDOROU IPATIAS KISSOU KARIATIDAS KAVIRON AGAMEMNONOS ARIONOS STOVAIOU FILONOS ARGAIOU FOINIKOS EFESSOU KAISAREIAS KALLIPOLEOS VRYOULON KYZIKOU NIKOMIDEIAS NEAPOLEOS MIDEIAS PROUSIS IKONIOU KROMNIS PYRGOU MALAKOPIS KAPADDOKIAS LYKAONIAS SINIOSOGLOU NIKAIAS KAROLIDOU SARANTI CHEIMARRAS PSARON PRIAMOU MITSAKI MITROPOULOU IONIAS SANTAS PAPOULA YPARCHOU FOKYLIDOU KERAMIKOU EPIDAVROU TSELIOU PRAXAGORA OLYMPIAS VOSPOROU AMFIPOLEOS MIKRAS ASIAS PONTOU VITHYNIAS PAPAGEORGIOU IOANNOU KAISAREIAS METRON IMVROU AGRIANON CHIOU CHOURMOUZI APOLLONOS SYROU FAIAKON LARNAKOS AMMOCHOSTOU NAFPLIOU NAFPLIOU DERKON KORDELIOU VIZYIS DORYLAIOU TINOU TENEDOU DARDANELLION DIMITSANAS EPIDAVROU EFSTATHIOU MITROPOLITOU CHANDR KARANIVA ATLANTID SVOL VOSPO ZACH ZIRIN ZONARA ANAXIME ANATOLIKIS ROMYLIAS ISO TOUSSA SPEFSIPOU MYSTAKID DYSTOMOU MIKROU ANTISTHENOUS STEFANOU DIMOCHAROUS MISIRLI PILEAS AEROPOU PAFSILYPOU TRIANTAFYLLOPOULOU GRIGORIOU LAMPRAKI (KONIT SLI OSIAS XENIS TSELEPI TSIAPANOU TSAMI STRATIGI VISTA ANGELOPOULOU DIVOLI GKOURA GRIGORIOU STEFANOU ATHINA ANTHEMOUNTOS LEFAKI PAFSANIA SEMELIS AETIONOS PANTAZIDI PERRAIVOU PERRAIVOU SPANOU IPPO ARTAKIS PONTOU EPTALOFOU PARMENIDI ANAVRYTON FILIMONOS TPIKALON AGIAS MARINAS TIROLOIS TIROLOIS TRITONOS TRIPTOLEMOU POLYGNOTOU IPPODROMIOU POLIVIOU PROTOGENOUS DIAGORA LISSIPOU ANTIFANOS MEGAKLEOUS POLYKLEITOU EMPEDOKLEOUS ANDRIOTI VIANDROU VARNALI ADAMIDOU ZAIMI ORTANSIAS IRIDOS MAKEDONIAS ANAFIS SAMOU POROU AIGINIS KYTHIRON LACHANA MIKRAS ASIAS TRIKOUPI GYMNASTIRIOU ANAPAFSEOS ELEFTHERIAS AMORGOU SERIFOU MILOU MESOLONGIOU AG. SPYRIDONA SERRON SERRON KASTORIAS GRIGORIOU LAMPRAKI KATSIMDIDI SIDIROKASTROU SPARTIS KONSTANTINIDI AMALIAS ZERVA AGIOS FANOURIOS AGIA MARINA AGIA VARVARA AGIOS THERAPON AGIOS SPYRIDONAS K Y K L A M I N O N DOXA ANO TOUMPA MALAKOPI CHA KATO TOUMPA TOUMPA CEMETERY MAKEDONIA GOVATZIDAKI SQ. TRIANDRIA PAPAFIO U) THEAGENEIO CANCER HOSPITAL IPPOKRATEIO GENERAL HOSPITAL OF THESSALONIKI Y LONIKI INFECTIOUS DISEASES HOSPITAL RETIREMENT HOME 3 3.9 A B Γ Δ 33']","The Christian mural found in the Roman Forum holds significant historical and cultural value, reflecting the transition of Thessaloniki from a Roman city to a center of early Christianity. This mural, along with other artifacts in the forum, illustrates the rich tapestry of religious and social life during the late Roman and early Byzantine periods.

The Roman Forum itself was a vital social and religious hub, showcasing the architectural and artistic achievements of its time. The presence of Christian murals within this context signifies the gradual acceptance and integration of Christianity into the fabric of daily life, particularly after the Edict of Milan in 313 AD, which granted religious tolerance to Christians. This shift is emblematic of the broader changes occurring in the Roman Empire, where pagan practices were increasingly supplanted by Christian beliefs.

Moreover, the mural serves as a testament to the artistic styles and techniques of the period, providing insight into the iconography that was prevalent in early Christian art. It reflects the theological themes and narratives that were important to the community, offering a glimpse into the spiritual life of the city's inhabitants.

For a solo traveler interested in sightseeing, the mural not only represents a historical artifact but also an Instagrammable spot that captures the essence of Thessaloniki's layered history. Engaging with such a site allows for a deeper understanding of the city's evolution and its significance in the Orthodox Christian world.

In summary, the Christian mural in the Roman Forum is significant as it embodies the transition from paganism to Christianity, showcases early Christian artistic expression, and highlights Thessaloniki's role as a pivotal center for Christian worship and culture.","The Christian mural uncovered in the Roman Forum is significant as it represents an early example of Christian art, highlighting the transition of the site from a social and religious center of the Roman period to one that incorporated Christian elements. This mural was found on one of the walls of the double underground Cryptoporticus, which was likely used as a public storehouse.",0.0,0.17,0.13333333333333333,0.7754838136031433,0.0,0.0,0.0,0.1999999996,,0.9887970267382759
15,What was the Roman Forum in Thessaloniki used for?,"['36\n4th walk: \nHISTORIC CENTRE (3)\nthat the place had been used \nby Christians as well, during \nthe late Roman period. South \nof the passageway there \nwere shops dating from the \n1st until the 13th century; the \nunderground Museum of the \nRoman Forum (see p. 71) was \nbuilt there as an extension. \nA 2nd - 4th c. AD Odeon [C] \nwas found behind the well-\npreserved eastern stoa. It  \nhas been restored and it is now \nused as a venue for cultural \nevents. A mint and an archive \noffice are right next to it. In the \nSE side, a round bath house \n[D] was unearthed which has \nbeen in use since the 1st c. BC. \nParts of a colonnade, mosaic \nfloors, marble stairs, a section \nof a stone-paved street, sewer \npipes, silver coins, stone and \nmarble sculptures were all \nfound in this archaeological \nsite. The forum is also where \nthe “Enchanted Ones” (las \nIncantadas) were discovered, \na two-storeyed colonnaded \narchway with Corinthian-order \ncolumns and pillars four of \nwhich have survived. They are \ndecorated with figures in relief \nin their interior as well as their \nexterior side (“Stoa of the \nStatuettes”).', 'It is divided in \nthree sections (cold, tepid \nand hot areas) and there is \nalso a vaulted tank for heating \nwater. It is widely known as the \nParadise Baths and it went by \nthat name until 1968. Right next \nto it there is a roman platform \nthat is indicative of the ground \nlevel 2000 years ago.\n1.6  Roman (Ancient) Forum\nDuring the roman period, \nthis 2-hectare area used to be \nthe social and religious centre \nof the city. Construction was \ncompleted in two phases  \n(in the mid-2nd and mid-  \n3rd centuries AD) and it was \ngradually abandoned after the \n7th century. The NW section \nof the archaeological site is \ncovered by a large rectangular \nsquare [Α] with traces of \nmarble paving. In the S section \nof the square lies the largest \npart of the double underground \nCryptoporticus [covered \npassageway] [Β] which was \nmost probably used as a public \nstorehouse.', '90\nDAY EXCURSIONS\nMain street.\nThis wide stone-paved \nstreet used to cross the town \nin the north-south direction. \nThe marketplace, shops, public \nbuildings and houses flanked \nthe street all along.\nGreat Thermae.\nThis complex of public bath \nhouses covers a 4,000 m2 \narea. The facilities were paved \nwith marble and mosaic floors, \nthere were Vespasian urinals, \nentertainment areas, a courtyard, \nshops, a hall for the worship \nof god Asklipios, and a roofed \nOdeon for cultural events.\nThe Houses of Zosa and \nLida.\nLocated in the SE section \nof the town, the two houses \nused to be decorated with \nmosaic floors and sculpted \nbusts.\nRoman Forum.\nIt dates back to the late 2nd \n– early 3rd c. and comprises  \na slab-paved square surrounded  \nby arcades and public buildings.  \nIn the West side there were \nthe luxury houses of Epigenis \nand Evvoulos, decorated with \nexquisite mosaics; Sevasteio, \na temple dedicated to \nthe worship of the Roman \nemperors was situated in \nbetween the houses. In the \nEast side, there is a roman \nbasilica, an area for trade  \nand banking transactions,  \nthe Monument of the Shields \n(with shield and cuirass \ndepictions) and the Forum \nThermae.\nPolygonal building.', 'TERPSITHEA\nSQ.\nROMFEI\nSQ.\nN\nSYNTRIVANIOU\nSQ.\nNAVARINOU\nSQ.\nSQ.\nSYKIES\nZIDROU\nSQ.\nLYSSIATREIO\nFOREST\n(SEICH SOU\nAGIOS\nDIMITRIOS\nHOSPITAL\nGENERAL\nHOSPITAL\nOF THESSALONIKI\nG. GENNIMATAS\nUNIVERSITY\nGENERAL\nHOSPITAL\nOF THESSAL\nAHEPA\n1\n2\n2\n3\n3.5\n3.4\n3.6\n3.7\n2.1\n2.2 2.3\n3.8\n1.8\n1.9\n3.3\n1.3\n1.4\n1.2\n1.7\n1.6\n1.1\n1.5\n3.2\n3.1\n1.10\n1.11 1.12\n1.15\n1.13\n1.14\n33.  \nA plan of \nthe Roman \n(Ancient) \nForum of \nThessaloniki.', 'Radio Taxi:  \n«Taxiway» (tel.: 18300), \n«Mercedes» (tel.: 18180), \n«Macedonia» (tel.: 18288) \nMUSEUMS – \nARCHAEOLOGICAL SITES\nA large number of museums and \narchaeological sites are open to \nvisitors in the suburbs and city \noutskirts. A number of them are \nlisted below. For more info visit \nhttp://odysseus.culture.gr\nArchaeological Museum  \nof Thessaloniki: \n6, Manoli Andronikou St. \ntel.: 2313 310.201 \nwebsite: www.amth.gr\nMuseum of the Roman Forum:  \nOlympou and Filippou Sts. \ntel.: \x072313 310.400 \n2310 221.266\nMuseum of Byzantine Culture: \n2, Stratou Ave \ntel.: 2313 306.400 \nwebsite: www.mbp.gr\nWhite Tower Museum: \ntel.: 2310 267.832 \nwebsite: www.lpth.gr\nSaint Demetrius  \n[Agios Dimitrios] Crypt: \n83, Agiou Dimitriou St. \ntel.: 2310 270.591 \nwebsite: www.inad.gr\nJewish Museum of Thessaloniki: \n13, Agiou Mina St. \ntel.: 2310 250.406 \nwebsite: www.jmth.gr\nMuseum for the Macedonian \nStruggle: \n23, Proxenou Koromila St. \ntel.']","['Roman (Ancient) Forum During the roman period, this 2-hectare area used to be the social and religious centre of the city. Construction was completed in two phases (in the mid-2nd and mid- 3rd centuries AD) and it was gradually abandoned after the 7th century. The NW section of the archaeological site is covered by a large rectangular square [Α] with traces of marble paving. In the S section of the square lies the largest part of the double underground Cryptoporticus [covered passageway] [Β] which was most probably used as a public storehouse. On one of its walls a valuable early Christian mural was uncovered and this shows 9 10 11 12 PARASKEVOPOULOU KONSTANTINOUPOLEOS DELFO KAFTANTZOGLOU PAPAFI PAPAFI PAPAFI KLEANTHOUS MARKOU BOTSARI PAPANASTASIOU PAPANASTASIOU ANATOLIKIS THRAKIS KANARI KANARI KARAKA MARATHONOS GRIGORIOU LAMPRAKI KONSTANTINOU KARAMANLI STRATOU AVE. PAPANASTASIOU AGIOS IOANNIS CHRYSOSTOMOS AGIA FOTEINI SARANTAPOROU BIZANIOU AGIAS TRIADAS BIZANIOU CHATZI FILOPOIMENOS LYTRA EDISON S NOTARA KAIRI SKOUFA XANTHOU TSAKALOF PATMOU PIGIS KYRIAKIDI ELEFTHERON ONA INIDI MATSI U OIT N E X F A PLITHONOS GEMISTOU GKYZI RIADI VYZANTIOU VELISSARIOU AETORACHIS EFZONON CHARISI CHARISI ILIADOS ZAIMI U DOUSMA ALKMINIS SINA ADIOU MITR. PLATAION DANIOLOU AGIOU VASILEIOU GENNADIOU MITR. THINEAS DELIGI PRAXITELOUS PAPAF FLEMING ARCHAIOLOGIKOU MOUSEIOU NASIOU DIAKOU CHIRS DIONOS GAMVETA DELIGIANNI IAKOVOU GALIVALDI MIAOULI XENOFONTOS KYVELIS CHARISI PERDIKA PASALIDI KIMONOS OSTROVOU PESTON PESTON ANDROU ALONNISOU MYKONOU AMOLIANIS SKYROU PARNITHAS SKALTSOUNI LYDIAS NIOVIS YMMITOU ASKLIPIOU PELIS PINDAROU LAMIAS IPEIROU PERDIKA IOANNINON EVVOIAS LITOCHOROU KRESNAS NEVROKOPIOU LITOCHOROU KORYTSAS TROIAS SERRON OMIROU PSAROU KRITONOS YDRAS EVRYVIADOU VALTETSIOU PELIAS ARGENTI KILKISSIOU LACHANA U O D AIT LI M ARCHIMIDOUS ELEFTHEROTON DOIRANIS DOIRANIS KARPATHOU TZOVAROPOULOU KERKYRAS RODIOU RIGOPOULOU NAOUSSIS AMYNTAIOU KATSIMIDI DANGLI KOUNTOURIOTI ELEFTHERIAS ELEFTHERIAS THRAKIS YPSILANTOU KOLOKOTRONI KANARI MIAOULI MIAOULI FILOTHEIS RODODAFNIS YAKINTHOU FILOMILAS OLYNTHOU LOTOU IVYSKOU ELEAS DRIOS EVAGORA PAPAILIAKI KLEANTHOUS MARONIAS CHOLOMONTOS ISIDOROU IPATIAS KISSOU KARIATIDAS KAVIRON AGAMEMNONOS ARIONOS STOVAIOU FILONOS ARGAIOU FOINIKOS EFESSOU KAISAREIAS KALLIPOLEOS VRYOULON KYZIKOU NIKOMIDEIAS NEAPOLEOS MIDEIAS PROUSIS IKONIOU KROMNIS PYRGOU MALAKOPIS KAPADDOKIAS LYKAONIAS SINIOSOGLOU NIKAIAS KAROLIDOU SARANTI CHEIMARRAS PSARON PRIAMOU MITSAKI MITROPOULOU IONIAS SANTAS PAPOULA YPARCHOU FOKYLIDOU KERAMIKOU EPIDAVROU TSELIOU PRAXAGORA OLYMPIAS VOSPOROU AMFIPOLEOS MIKRAS ASIAS PONTOU VITHYNIAS PAPAGEORGIOU IOANNOU KAISAREIAS METRON IMVROU AGRIANON CHIOU CHOURMOUZI APOLLONOS SYROU FAIAKON LARNAKOS AMMOCHOSTOU NAFPLIOU NAFPLIOU DERKON KORDELIOU VIZYIS DORYLAIOU TINOU TENEDOU DARDANELLION DIMITSANAS EPIDAVROU EFSTATHIOU MITROPOLITOU CHANDR KARANIVA ATLANTID SVOL VOSPO ZACH ZIRIN ZONARA ANAXIME ANATOLIKIS ROMYLIAS ISO TOUSSA SPEFSIPOU MYSTAKID DYSTOMOU MIKROU ANTISTHENOUS STEFANOU DIMOCHAROUS MISIRLI PILEAS AEROPOU PAFSILYPOU TRIANTAFYLLOPOULOU GRIGORIOU LAMPRAKI (KONIT SLI OSIAS XENIS TSELEPI TSIAPANOU TSAMI STRATIGI VISTA ANGELOPOULOU DIVOLI GKOURA GRIGORIOU STEFANOU ATHINA ANTHEMOUNTOS LEFAKI PAFSANIA SEMELIS AETIONOS PANTAZIDI PERRAIVOU PERRAIVOU SPANOU IPPO ARTAKIS PONTOU EPTALOFOU PARMENIDI ANAVRYTON FILIMONOS TPIKALON AGIAS MARINAS TIROLOIS TIROLOIS TRITONOS TRIPTOLEMOU POLYGNOTOU IPPODROMIOU POLIVIOU PROTOGENOUS DIAGORA LISSIPOU ANTIFANOS MEGAKLEOUS POLYKLEITOU EMPEDOKLEOUS ANDRIOTI VIANDROU VARNALI ADAMIDOU ZAIMI ORTANSIAS IRIDOS MAKEDONIAS ANAFIS SAMOU POROU AIGINIS KYTHIRON LACHANA MIKRAS ASIAS TRIKOUPI GYMNASTIRIOU ANAPAFSEOS ELEFTHERIAS AMORGOU SERIFOU MILOU MESOLONGIOU AG. SPYRIDONA SERRON SERRON KASTORIAS GRIGORIOU LAMPRAKI KATSIMDIDI SIDIROKASTROU SPARTIS KONSTANTINIDI AMALIAS ZERVA AGIOS FANOURIOS AGIA MARINA AGIA VARVARA AGIOS THERAPON AGIOS SPYRIDONAS K Y K L A M I N O N DOXA ANO TOUMPA MALAKOPI CHA KATO TOUMPA TOUMPA CEMETERY MAKEDONIA GOVATZIDAKI SQ. TRIANDRIA PAPAFIO U) THEAGENEIO CANCER HOSPITAL IPPOKRATEIO GENERAL HOSPITAL OF THESSALONIKI Y LONIKI INFECTIOUS DISEASES HOSPITAL RETIREMENT HOME 3 3.9 A B Γ Δ 33']","The Roman Forum in Thessaloniki served as the social and religious center of the city during the Roman period. This expansive area, covering approximately 2 hectares, was constructed in two phases during the mid-2nd and mid-3rd centuries AD and remained in use until its gradual abandonment after the 7th century.

The Forum featured a slab-paved square surrounded by arcades and public buildings, making it a bustling hub for various activities. It included luxury houses adorned with exquisite mosaics, a temple dedicated to the worship of Roman emperors, and a basilica that facilitated trade and banking transactions. The architectural layout reflected the importance of public life, with spaces designed for gatherings, commerce, and religious practices.

In addition to its role as a marketplace, the Forum housed significant structures such as the Great Thermae, a complex of public bathhouses that provided leisure and social interaction for the citizens. The presence of the Odeon, a venue for cultural events, further highlights the Forum's function as a center for entertainment and community engagement.

Overall, the Roman Forum was not only a place for economic activities but also a vital location for social interaction, cultural events, and religious worship, embodying the essence of life in ancient Thessaloniki.","During the Roman period, the Roman Forum was the social and religious centre of the city.",1.0,0.17,1.0,0.7214893748724809,0.6388888888675925,0.5833333333041666,0.0,0.3333333322222222,,0.8768401638795201
16,What can you tell me about AG. ATHANASIOS in Thessaloniki?,"['17\nNIKIS\nNIKIS\nSVOLOU\nASONIDOU\nTSIMISKI\nVAS. IRAKLEIOU\nFILIPPOU\nOLYMPOU\nMITROPOLEOS\nARISTOTELOUS\nDODEKANISOU\nSALAMINOS\nERMOU\nETHNIKIS A\nAG.\nANTONIOS\nAGIA\nTHEODORA\nAG.\nATHANASIOS\nAG.\nKONSTANTINOU\nYPAPANTI\nAG\nKALARI\nISAVRON\nDELIOU\nMAKRYGIANNI\nMITR. GENADIOU\nMODI\nKIDON\nNOU\nROUS\nPATR. IOAKEIM\nPALAION PATRON GERMANOU\nMICHAIL IO.', '1\n\t \x07AGIA AIKATERINI \n[SAINT CATHERINE] \nCHURCH\n(see p. 12)\nNIKIS\nNIKIS\nGERMANOU\nSVOLOU\nIASONIDOU\nTSIMISKI\nVAS. IRAKLEIOU\nFILIPPOU\nAKROPOLEOS\nTHEOTOKOPOULOU\nAKROPOLEOS\nOCHI AVENUE\nEPTAPYRGIOU\nSOFOKLEOUS\nOLYMPOU\nAZANTZAKI\nDAMONOS\nPOLYTECHNIOU\nMITROPOLEOS\nARISTOTELOUS\nDODEKANISOU\nSALAMINOS\nERMOU\nANGELAKI\nETHNIKIS AMYNAS\nAG.\nANTONIOS\nAGIA\nTHEODORA\nAG.\nATHANASIOS\nAG.\nKONSTANTINOU\nYPAPANTI\nAGIOS STYLIANOS\nLAODI\nGITRIA\nTAXIARCHES\nAGIOS PAVLOS\nFANEROMENI\nAG.\nTHEODOROI\nKALARI\nTSOPELA\nISAVRON\nDELIOU\nIOANNI VELLIDI\nMAKRYGIANNI\nMITR.', 'Out \nof the original monastery \ncomplex, -apart from the \nkatholicon – there remain the \nNIKIS\nNIKIS\nGERMANOU\nSVOLOU\nIASONIDOU\nTSIMISKI\nVAS. IRAKLEIOU\nFILIPPOU\nAKROPOLEOS\nTHEOTOKOPOULOU\nAKROPOLEOS\nOCHI AVENUE\nEPTAPYRGIOU\nSOFOKLEOUS\nOLYMPOU\nMONASTIRIOU\nKAZANTZAKI\nA\nN\nA\nG\nE\nNN\nI\nS\nE\nOS\nDAMONOS\nKALOU\nDRAGOUMANOU\nPOLYTECHNIOU\nMITROPOLEOS\nARISTOTELOUS\nDODEKANISOU\nLANGADA\nSALAMINOS\nERMOU\nANGELAKI\nETHNIKIS AMYNAS\nAG.\nANTONIOS\nAGIA\nTHEODORA\nAG.\nATHANASIOS\nAG.\nKONSTANTINOU\nYPAPANTI\nAGIOS STYLIANOS\nLAODI\nGITRIA\nTAXIARCHES\nAGIOS PAVLOS\nFANEROMENI\nAG.\nTHEODOROI\nKALARI\nTSOPELA\nISAVRON\nDELIOU\nIOANNI VELLIDI\nMAKRYGIANNI\nMITR.', 'ANTONIOS\nAGIA\nTHEODORA\nAG.\nATHANASIOS\nAG.\nKONSTANTINOU\nYPAPANTI\nAGIOS STYLIANOS\nLAODI\nGITRIA\nTAXIARCHES\nAGIOS PAVLOS\nFANEROMENI\nAG.\nTHEODOROI\nKALARI\nTSOPELA\nISAVRON\nDELIOU\nIOANNI VELLIDI\nMAKRYGIANNI\nMITR. GENADIOU\nMODI\nPETROPOULAKIDON\nARIANOU\nARIANOU\nKLEISTHENOUS\nVIZYINOU\nKASTRON\nPANORMOU\nKESANLI\nAMPATZOGLOU\nSKOPELOU\nPETRAS\nILIADOS\nVASILIKOU\nIRAKLEIAS\nSKEPASTOU\nSKOPOU\nKAVAFI\nADRIANOUPOLEOS\nAIANTOS\nAGATHOUPOLEOS\nRING ROAD\nMYLON\nKONSTANTIN\nKESSANIS\nREDAISTOU\nVYZOUKIDI\nVIZYINOU\nANAKTORIOU\nTHETIDOS\nAFXENTIOU\nMOUDANION\nPANEPISTIMIOU\nKALELPIDOS\nKONSTANTINOUPOLEOS\nSMYRNIS\nPYRGOU\nVRYANDOU\nKITROUS\nMELENIKOU\nPATR. IOAKEIM\nPALAION PATRON GERMANOU\nMICHAIL IO.', '88\nDAY EXCURSIONS\nJewish quarter in Europe, \nwhich maintains a traditional \ncharacter in its entirety. It \nis worth taking a walk and \nvisiting the Roman, Ottoman \nand Industrial age monuments \nin the traditional districts of \nKyriotissa, Panagia Dexia, and \nMakariotissa; you can also visit \nthe Public Central Library which \nhas earned an international \naward, or relax in the parks  \nand squares.\nHow to get there.  \nVergina is about 63 km SW  \nof Thessaloniki. If you travel by \ncar, follow the signs to Veroia \nand after that to Vergina. You \ncan also take the intercity bus \nor the train to reach Veroia  \nand then take the local bus  \nto Vergina.\n3 \tDION\nThis most enchanting \narchaeological site is  \nlocated under the imposing \nOlympus mountain range, in  \na 150-hectare green area amid \nflowing waters coming from \nVafyras River and from other \nsprings; it is the habitat of \nmany species of birds, reptiles \nand amphibians. This used to \nbe a sacred place to ancient \nMacedonians who worshipped \nOlympian Zeus and the Muses \n[daughters of Zeus] here.']","[""42 Thessaloniki’s Old Town is full of atmosphere. It covers the area in between the city walls (to the north and east) and Olympiados Street (to the south), and has had the luck to remain untouched by the 1917 great fire. It was virtually uninhabited until the mid-15th century, when it was conquered by the Ottomans who selected it for settlement on account of its fine climate, panoramic views and strategic position. The two and three-storey houses bear mixed Macedonian and Ottoman architectural elements (sachnisia) [Şahniş in turkish]; there are also residences with neoclassical and eclectic style motifs where the Dönmeh lived, i.e. converts to Islam who secretly remained Jews. After 1922 many refugees settled in the area. Despite the construction of newer buildings and the opening up of new streets in recent decades, it has kept its original town planning, to a large extent, with narrow alleys and scant squares, as well as its original architectural features, particularly in the west and east part of the town. This particular atmosphere has lured intellects, artists and students who chose it for settlement in recent years. 1 \x07AGIA AIKATERINI [SAINT CATHERINE] CHURCH (see p. 12) NIKIS NIKIS GERMANOU SVOLOU IASONIDOU TSIMISKI VAS. IRAKLEIOU FILIPPOU AKROPOLEOS THEOTOKOPOULOU AKROPOLEOS OCHI AVENUE EPTAPYRGIOU SOFOKLEOUS OLYMPOU AZANTZAKI DAMONOS POLYTECHNIOU MITROPOLEOS ARISTOTELOUS DODEKANISOU SALAMINOS ERMOU ANGELAKI ETHNIKIS AMYNAS AG. ANTONIOS AGIA THEODORA AG. ATHANASIOS AG. KONSTANTINOU YPAPANTI AGIOS STYLIANOS LAODI GITRIA TAXIARCHES AGIOS PAVLOS FANEROMENI AG. THEODOROI KALARI TSOPELA ISAVRON DELIOU IOANNI VELLIDI MAKRYGIANNI MITR. GENADIOU MODI PETROPOULAKIDON ARIANOU ARIANOU KLEISTHENOUS VIZYINOU KASTRON PANORMOU KESANLI AMPATZOGLOU SKOPELOU PETRAS ILIADOS VASILIKOU IRAKLEIAS SKEPASTOU SKOPOU KAVAFI ADRIANOUPOLEOS AIANTOS AGATHOUPOLEOS RING ROAD KY ELEFTHERO MYLONA KONSTANTINIDI KESSANIS REDAISTOU VYZOUKIDI VIZYINOU ANAKTORIOU THETIDOS AFXENTIOU MOUDANION PANEPISTIMIOU KALELPIDOS KONSTANTINOUPOLEOS SMYRNIS PYRGOU VRYANDOU KITROUS MELENIKOU PATR. IOAKEIM PALAION PATRON GERMANOU MICHAIL IO. ARMENOPOULOU IKTINOU KOMNINON SOLOMOU VLALI BALANOU ASKITOU VOGATSIKOU PLOUTARCHOU LASSANI MORKENTAOU TATI DRAGOUMI KYRIAKOU IOULIANOU SOKRATOUS EVRIPIDOU GYZI VLACHAVA AISCHYLOU ATHINAS MOREAS GKRATZIOU ATHONOS THEOFILOU PILEOS ANTIOCHOU VLATADON KASTOROS IGOUMENOU PERIANDROU POLYDOROU KLAFTHMONOS DRAGATSANIOU ACHTARI KARADIMOU DIONYSIOU EPIMENIDOU EVRYMEDONTOS AREOS ARTIS IRAKLIOU SYRAKOUSON PYDNAS KARAVANGELI TSAKALOF KIMONOS FLORINAS PLASTIRA FILIPPOU KLISTHENOUS FERON EVROU GKRATZIOU RAKTIVAN LAMPOUSIDI PASTER MAK KAMENIATOU PROFITI ILIA ATHINAS IFIKRATOUS PRASAKAKI STAVROU DIMOSTHENOUS KASTRITSIOU MENELAOU AMYNTA PELOPONNISOU PLATONOS DELMOUZOU AVDELA OUGKO KARATASOU KOUNTOURIOTI AS U DERIKIS ZANIS LKIS PONTOU NAFPLIOU VALTETSIOU KALPAKIOU LORDOU ELEFSINAS DELTA KONITSIS PLATONOS IPPOKRATOUS AGIOU DIMITRIOU VERMIOU SOUFLIOU BIZANIOU LECHOVOU LECHOVOU VOREIOU IPEIROU ARAPITSIS BOUBOULINAS KANARI KAPODISTRIOU KARAISKAKI SOLOMOU LACHANA AGRAFON PSARON MIAOULI KAVALAS KRITIS LEVENTI KANARI GRAVIAS KYPROU FILIATRON ARACHTHOU TSACHILA AGRAFON KARVOUNIDI ERASMOU ELENIS KAPETAN NIKOLAOU PELOPONNISOU AGIOU PAVLOU MAKEDONOMACHON KONITSIS IKARON EL. VENIZELOU OMIROU IPEIROU KONTOSOGLOU PAPANIKOLI TEPELENIOU MEGARON VITSI KASTORIAS DIMITSANAS ARGYROKASTROU DIMITRIOU THASSOU FOKA PAPAFLESSA KOMNINON KRITIS RITIS EPIDAVROU CHORTIATI ELLIS IOANNINON KRYSTALI ATTALOU GRANIKOU KYRIAKOPOULOU BOUBOULINAS MARKOU BOTSARI EPTAPYRGIOU EPTAPYRGIOU EPTAPYRGIOU EPTAPYRGIOU ANTHEON ATHANASIOU DIAKOU YPATROU GIALOUROU ROU ONGOU PAPANASTASIOU KAFKASOU METEORON KASSANDROU OLYMPIADOS A L. P A P A D O P O U L OU KASSANDROU OLYMPIADOS OLYMPOU POLYZOIDI AGIOU DIMITRIOU AGIOU DIMITRIOU AVRILIANIS ARKADIOUPOLEOS IFAISTIONOS ELPIDOS EL. VE NI ZE L O U NAVARINOU TYRNAVOU ONI ARISTARCHOU VOULGAROKTONOU THEMISTOKLEOUS A R O G A X A N A KYPROU 28 OKTOVRIOU M. ASIAS PARASKEVA NIGDIS ARAVYSSOU ALEXIOU TRANOU MOUSCHOUNTI KALAMPAKAS THOUKYDIDI ZARIFI SACHTOURI AKRITA KLIOS PERSEOS PYTHEOS RAKTIVAN ODYSSEOS SARAFI ETHN. ANTISTASEOS U O TIR K O M ID PARASKEVA PANIDOU OINOIS KARAOLI OLYMPOU ROMANIDI ARISTEIDOU ULINI KRITIS DEXAMENI DIOS KALVOU EIRINIS PAPARIGOPOULOU PALAMA ZEFYRON MAVILI PINIOU GLADSTONOS THALIAS PRONOIAS SACHINI KRATEROU FILOTA SOURI ANTON SOUTSOU SYNGROU PTOLEMAION IOUSTINIANOU KARBOLA TOSITSA ZALIKI CHALKEON AMVROSIOU KRYSTALI ANTIGONIDON S T O U R N A R A MAKEDON O MACHON ON ANEROMENIS AVEROF PANGAIOU AXIOU VAIOU PINDOU DOXIS VOTSI KALAPOTHAKI KATOUNI AIGYPTOU FRANGON DANAIDON AISOPOU ENOTIKON AFRODITIS KA CHOU ANAKI MAKI ODYSSEOS ODYSSEOS TANTALOU PROMITHEOS SAPFOUS NAVM. CHAPSA LIMNOU VALAORITI ORPHANIDI TANTALIDI OLYMPIOU DIAMANTI LOUI IPPODROMIOU NIKIFOROU DESPERE GOUNARI DIALETI DANGLI FILIKIS ETAIRIAS CHR. SMYRNIS MITR. IOSIF FOKA PANAGIA KARATZA POLIORKITI SYNGROU VYRONOS AGIOS DIMITRIOS RIGA FERAIOU A R C H A I O T I T O N S E L E F K I D O N M E L E N I K O U PROX. KOROMILA PARASCHOU EPTAPYRGIO ANO POLI 40 EKKLISIES EVANGELISTRIA THEA MUNICIPAL PARK RODOCHORI EVANGELISTRIA'S CEMETERY KOTRONI VARNAS SQ. MOUSHOUNTI SQ. FANARIOTON SQ. ELEFTHERIAS SQ. EMPORIOU SQ. DIMOKRATIAS VARDARI SQ. KYPRION AGONISTON SQ. ARCHAIAS AG. SOFIAS AGORAS SQ. DIMITRION SQ. TERPSITHEA SQ. ROMFEI SQ. SYNTRIVANIOU SQ. NAVARINOU SQ. SQ. SYKIES ZIDROU SQ. LYSSIATREIO (SEICH SOU) AGIOS DIMITRIOS HOSPITAL GENERAL HOSPITAL OF THESSALONIKI G. GENNIMATAS UNIVERSITY GENERAL HOSPITAL OF THESSALONIKI AHEPA 5th walk:""]","AG. ATHANASIOS is a notable area in Thessaloniki that offers a blend of cultural and historical experiences, making it an appealing destination for leisure travelers. This location is characterized by its vibrant atmosphere, with a mix of traditional and modern elements that reflect the city's rich heritage.

One of the highlights of AG. ATHANASIOS is the presence of the Agios Athanasios Church, which is a significant religious site. The church features beautiful architecture and provides insight into the local Orthodox Christian traditions. Visitors often appreciate the serene environment and the opportunity to observe local worship practices.

The surrounding streets are lined with charming cafes and shops, perfect for leisurely strolls. You can enjoy a coffee while soaking in the local ambiance or explore small boutiques that offer unique souvenirs. The area is also known for its accessibility to other attractions in Thessaloniki, making it easy to incorporate into a sightseeing itinerary.

For those interested in photography, AG. ATHANASIOS presents numerous Instagrammable spots, including picturesque streets and the church itself. The vibrant colors and historical architecture provide excellent backdrops for capturing memorable moments.

Additionally, the neighborhood is a great place to interact with locals. Many residents are friendly and open to sharing stories about the area, enhancing your travel experience. Engaging with the community can provide a deeper understanding of Thessaloniki's culture and traditions.

Overall, AG. ATHANASIOS is a must-visit for anyone looking to experience the charm of Thessaloniki. Its combination of historical significance, local culture, and inviting atmosphere makes it an ideal spot for a weekend getaway. Whether you’re exploring the church, enjoying local cuisine, or simply wandering the streets, AG. ATHANASIOS offers a fulfilling experience that captures the essence of this vibrant city.","AG. ATHANASIOS is one of the many churches located in Thessaloniki’s Old Town, an area rich in atmosphere and history. The Old Town has remained largely untouched since the 1917 great fire and features a mix of Macedonian and Ottoman architectural elements. The area has narrow alleys and scant squares, preserving its original town planning and architectural features.",0.0,0.52,0.05555555555555555,0.8222271416742994,0.8333333332916666,0.0,0.0,0.16666666638888888,,0.9999994845137751
17,What can you tell me about Thessaloniki's Old Town and its history?,"['The collection \nincludes approx. 250 pieces  \non painting, sculpture, pottery,  \nmosaics, murals and \nengraving.\nTHESSALONIKI CINEMA \nMUSEUM\nIt was created in 1997  \nand the opening coincided \nwith the European Capital  \nof Culture events which were \nhosted by Thessaloniki that \nyear. It is closely related \nto the city history, as the \nThessaloniki International Film \nFestival has been taking place \nin the city since 1960 (see p. \n108). Exhibits tell the history \nof the Greek cinema and are \nclassified in six timelines, \nnamely Manakia brothers, \n1900-1940, 1940-1960, \n1960-1970, 1970-1990,  \nand 1990 and beyond. Among \nthe items on display are rare \n90', '80\nMUSEUMS\nmechanics and so on, which \nlay emphasis on the visitor’s \nactive participation as well as \non learning and having fun  \nat the same time.\n• Car Exhibition. \nOld car models that have \nbeen the most popular \nproductions in the history of \nthe automobile industry can  \nbe seen here.\nThe education rooms are \nthe following:\n• Planetarium. This \n160-seat room has a domed \nscreen (the dome is visible on \nthe outside as well). Visitors \ncan watch educational and \nrecreational films such as The \nEarth and me, Wonders of the \nUniverse and others.\n• Cosmotheatre. This film \ntheatre features the largest flat \nscreen in Southeast Europe \n(23X17 m.). Movies such as \nDinosaurs and Beyond the skies \nare screened here\n• Virtual Reality Simulator. \nThe spectator wears 3-D \nglasses, boards a small wagon \nand enjoys an on-the-go \nsimulation experience of \nvarious types such as flight, \ndeep-sea voyage and tours  \nin imaginary worlds.\nFurthermore, Noesis \norganises educational \nprogrammes on Renewable \nSources of Energy and \nScience Shows to further \nexplicate the laws of Physics \nand Chemistry.\nGEROVASSILIOU WINE \nMUSEUM\nThis outstanding museum \nhas been open since 2008  \nin the winery’s grounds where \nthe vineyards spread in a \n56-hectare area, affording \na fine view of the greater \narea and Thermaic Gulf. The \nmuseum collections are \narranged in seven categories:\n• Introduction.', '88\nDAY EXCURSIONS\nJewish quarter in Europe, \nwhich maintains a traditional \ncharacter in its entirety. It \nis worth taking a walk and \nvisiting the Roman, Ottoman \nand Industrial age monuments \nin the traditional districts of \nKyriotissa, Panagia Dexia, and \nMakariotissa; you can also visit \nthe Public Central Library which \nhas earned an international \naward, or relax in the parks  \nand squares.\nHow to get there.  \nVergina is about 63 km SW  \nof Thessaloniki. If you travel by \ncar, follow the signs to Veroia \nand after that to Vergina. You \ncan also take the intercity bus \nor the train to reach Veroia  \nand then take the local bus  \nto Vergina.\n3 \tDION\nThis most enchanting \narchaeological site is  \nlocated under the imposing \nOlympus mountain range, in  \na 150-hectare green area amid \nflowing waters coming from \nVafyras River and from other \nsprings; it is the habitat of \nmany species of birds, reptiles \nand amphibians. This used to \nbe a sacred place to ancient \nMacedonians who worshipped \nOlympian Zeus and the Muses \n[daughters of Zeus] here.', '6\nEver since the 4th c. BC when it was founded, \nThessaloniki has kept its urban character and has \nremained a civic centre and the hub of that region. \nThe city’s centuries-old multicultural history has been \nassociated with great empires, as it has known the \nRoman, Byzantine and Ottoman Rule. The town was also \ngreatly influenced by many ethnic and religious groups \n(Jews, Latins, Armenians and others) as well as Greeks \nfrom Constantinople, Pontus [modern-day northeastern \nTurkey] and Asia Minor [a.k.a. Anatolia]. The numerous \nmonuments, dating to many historical periods, coexist in \na singular and charming way and manifest Thessaloniki’s \nhistorical multicultural and cosmopolitan nature.\n1. \nThe White Tower \narea is one of the \nbusiest parts of \nthe city, where \nthe old seafront \n(Nikis Ave.) meets \nthe new (eastern) \nwaterfront area \nof Thessaloniki.\nDION – VERGINA – ANCIENT PELLA\nPETRALONA CAVE – LAKES AREA\nTHESSALONIKI', '59\n7th walk: \nWEST OF THE CENTRE-STAVROUPOLI\ninaugurated in 1962 (S. Molfesis, \nTh. Papagiannis). Its exterior \nside combines modern and \nclassical elements with wings \nadded on the sides. It connects \nThessaloniki with the rest of \nGreece, the Balkans and Istanbul; \nit is also the bus terminus \ntowards most of the city areas. \nThis will be the location of the \nwest metro line terminus under \nconstruction in Thessaloniki.\n2.2  Old Railway Station.\nIt was built in 1894 near the \nharbour (Old Station Street) \nin the neoclassical style, \nand it gradually connected \nThessaloniki with Skopje, \nBelgrade, Monastir and \nConstantinople (modern-day \nIstanbul). Today it is exclusively \nused as a cargo train station. \nThis is where the German \noccupation forces mustered \nabout 50,000 Jewish residents, \nfrom March until August 1943, \nin order to send them by train \noff to concentration camps.\n2.3  Top Hane (Vardariou \nTower).\nSituated where the west \nand seafront city walls used \nto meet, this Tower was built \nby the Ottomans in 1546 and \nit was known as the Armoury \nTower. It is a six-sided, three-\nstorey and 10-metre high tower \nwhich used to be the main city \nstronghold.']","[""42 Thessaloniki’s Old Town is full of atmosphere. It covers the area in between the city walls (to the north and east) and Olympiados Street (to the south), and has had the luck to remain untouched by the 1917 great fire. It was virtually uninhabited until the mid-15th century, when it was conquered by the Ottomans who selected it for settlement on account of its fine climate, panoramic views and strategic position. The two and three-storey houses bear mixed Macedonian and Ottoman architectural elements (sachnisia) [Şahniş in turkish]; there are also residences with neoclassical and eclectic style motifs where the Dönmeh lived, i.e. converts to Islam who secretly remained Jews. After 1922 many refugees settled in the area. Despite the construction of newer buildings and the opening up of new streets in recent decades, it has kept its original town planning, to a large extent, with narrow alleys and scant squares, as well as its original architectural features, particularly in the west and east part of the town. This particular atmosphere has lured intellects, artists and students who chose it for settlement in recent years. 1 \x07AGIA AIKATERINI [SAINT CATHERINE] CHURCH (see p. 12) NIKIS NIKIS GERMANOU SVOLOU IASONIDOU TSIMISKI VAS. IRAKLEIOU FILIPPOU AKROPOLEOS THEOTOKOPOULOU AKROPOLEOS OCHI AVENUE EPTAPYRGIOU SOFOKLEOUS OLYMPOU AZANTZAKI DAMONOS POLYTECHNIOU MITROPOLEOS ARISTOTELOUS DODEKANISOU SALAMINOS ERMOU ANGELAKI ETHNIKIS AMYNAS AG. ANTONIOS AGIA THEODORA AG. ATHANASIOS AG. KONSTANTINOU YPAPANTI AGIOS STYLIANOS LAODI GITRIA TAXIARCHES AGIOS PAVLOS FANEROMENI AG. THEODOROI KALARI TSOPELA ISAVRON DELIOU IOANNI VELLIDI MAKRYGIANNI MITR. GENADIOU MODI PETROPOULAKIDON ARIANOU ARIANOU KLEISTHENOUS VIZYINOU KASTRON PANORMOU KESANLI AMPATZOGLOU SKOPELOU PETRAS ILIADOS VASILIKOU IRAKLEIAS SKEPASTOU SKOPOU KAVAFI ADRIANOUPOLEOS AIANTOS AGATHOUPOLEOS RING ROAD KY ELEFTHERO MYLONA KONSTANTINIDI KESSANIS REDAISTOU VYZOUKIDI VIZYINOU ANAKTORIOU THETIDOS AFXENTIOU MOUDANION PANEPISTIMIOU KALELPIDOS KONSTANTINOUPOLEOS SMYRNIS PYRGOU VRYANDOU KITROUS MELENIKOU PATR. IOAKEIM PALAION PATRON GERMANOU MICHAIL IO. ARMENOPOULOU IKTINOU KOMNINON SOLOMOU VLALI BALANOU ASKITOU VOGATSIKOU PLOUTARCHOU LASSANI MORKENTAOU TATI DRAGOUMI KYRIAKOU IOULIANOU SOKRATOUS EVRIPIDOU GYZI VLACHAVA AISCHYLOU ATHINAS MOREAS GKRATZIOU ATHONOS THEOFILOU PILEOS ANTIOCHOU VLATADON KASTOROS IGOUMENOU PERIANDROU POLYDOROU KLAFTHMONOS DRAGATSANIOU ACHTARI KARADIMOU DIONYSIOU EPIMENIDOU EVRYMEDONTOS AREOS ARTIS IRAKLIOU SYRAKOUSON PYDNAS KARAVANGELI TSAKALOF KIMONOS FLORINAS PLASTIRA FILIPPOU KLISTHENOUS FERON EVROU GKRATZIOU RAKTIVAN LAMPOUSIDI PASTER MAK KAMENIATOU PROFITI ILIA ATHINAS IFIKRATOUS PRASAKAKI STAVROU DIMOSTHENOUS KASTRITSIOU MENELAOU AMYNTA PELOPONNISOU PLATONOS DELMOUZOU AVDELA OUGKO KARATASOU KOUNTOURIOTI AS U DERIKIS ZANIS LKIS PONTOU NAFPLIOU VALTETSIOU KALPAKIOU LORDOU ELEFSINAS DELTA KONITSIS PLATONOS IPPOKRATOUS AGIOU DIMITRIOU VERMIOU SOUFLIOU BIZANIOU LECHOVOU LECHOVOU VOREIOU IPEIROU ARAPITSIS BOUBOULINAS KANARI KAPODISTRIOU KARAISKAKI SOLOMOU LACHANA AGRAFON PSARON MIAOULI KAVALAS KRITIS LEVENTI KANARI GRAVIAS KYPROU FILIATRON ARACHTHOU TSACHILA AGRAFON KARVOUNIDI ERASMOU ELENIS KAPETAN NIKOLAOU PELOPONNISOU AGIOU PAVLOU MAKEDONOMACHON KONITSIS IKARON EL. VENIZELOU OMIROU IPEIROU KONTOSOGLOU PAPANIKOLI TEPELENIOU MEGARON VITSI KASTORIAS DIMITSANAS ARGYROKASTROU DIMITRIOU THASSOU FOKA PAPAFLESSA KOMNINON KRITIS RITIS EPIDAVROU CHORTIATI ELLIS IOANNINON KRYSTALI ATTALOU GRANIKOU KYRIAKOPOULOU BOUBOULINAS MARKOU BOTSARI EPTAPYRGIOU EPTAPYRGIOU EPTAPYRGIOU EPTAPYRGIOU ANTHEON ATHANASIOU DIAKOU YPATROU GIALOUROU ROU ONGOU PAPANASTASIOU KAFKASOU METEORON KASSANDROU OLYMPIADOS A L. P A P A D O P O U L OU KASSANDROU OLYMPIADOS OLYMPOU POLYZOIDI AGIOU DIMITRIOU AGIOU DIMITRIOU AVRILIANIS ARKADIOUPOLEOS IFAISTIONOS ELPIDOS EL. VE NI ZE L O U NAVARINOU TYRNAVOU ONI ARISTARCHOU VOULGAROKTONOU THEMISTOKLEOUS A R O G A X A N A KYPROU 28 OKTOVRIOU M. ASIAS PARASKEVA NIGDIS ARAVYSSOU ALEXIOU TRANOU MOUSCHOUNTI KALAMPAKAS THOUKYDIDI ZARIFI SACHTOURI AKRITA KLIOS PERSEOS PYTHEOS RAKTIVAN ODYSSEOS SARAFI ETHN. ANTISTASEOS U O TIR K O M ID PARASKEVA PANIDOU OINOIS KARAOLI OLYMPOU ROMANIDI ARISTEIDOU ULINI KRITIS DEXAMENI DIOS KALVOU EIRINIS PAPARIGOPOULOU PALAMA ZEFYRON MAVILI PINIOU GLADSTONOS THALIAS PRONOIAS SACHINI KRATEROU FILOTA SOURI ANTON SOUTSOU SYNGROU PTOLEMAION IOUSTINIANOU KARBOLA TOSITSA ZALIKI CHALKEON AMVROSIOU KRYSTALI ANTIGONIDON S T O U R N A R A MAKEDON O MACHON ON ANEROMENIS AVEROF PANGAIOU AXIOU VAIOU PINDOU DOXIS VOTSI KALAPOTHAKI KATOUNI AIGYPTOU FRANGON DANAIDON AISOPOU ENOTIKON AFRODITIS KA CHOU ANAKI MAKI ODYSSEOS ODYSSEOS TANTALOU PROMITHEOS SAPFOUS NAVM. CHAPSA LIMNOU VALAORITI ORPHANIDI TANTALIDI OLYMPIOU DIAMANTI LOUI IPPODROMIOU NIKIFOROU DESPERE GOUNARI DIALETI DANGLI FILIKIS ETAIRIAS CHR. SMYRNIS MITR. IOSIF FOKA PANAGIA KARATZA POLIORKITI SYNGROU VYRONOS AGIOS DIMITRIOS RIGA FERAIOU A R C H A I O T I T O N S E L E F K I D O N M E L E N I K O U PROX. KOROMILA PARASCHOU EPTAPYRGIO ANO POLI 40 EKKLISIES EVANGELISTRIA THEA MUNICIPAL PARK RODOCHORI EVANGELISTRIA'S CEMETERY KOTRONI VARNAS SQ. MOUSHOUNTI SQ. FANARIOTON SQ. ELEFTHERIAS SQ. EMPORIOU SQ. DIMOKRATIAS VARDARI SQ. KYPRION AGONISTON SQ. ARCHAIAS AG. SOFIAS AGORAS SQ. DIMITRION SQ. TERPSITHEA SQ. ROMFEI SQ. SYNTRIVANIOU SQ. NAVARINOU SQ. SQ. SYKIES ZIDROU SQ. LYSSIATREIO (SEICH SOU) AGIOS DIMITRIOS HOSPITAL GENERAL HOSPITAL OF THESSALONIKI G. GENNIMATAS UNIVERSITY GENERAL HOSPITAL OF THESSALONIKI AHEPA 5th walk:""]","Thessaloniki's Old Town, known as Ano Poli, is a captivating area that showcases the city's rich history and multicultural heritage. Perched on a hill, it offers stunning views of the city and the Thermaic Gulf. The Old Town is characterized by its narrow, winding streets, traditional houses, and remnants of Byzantine and Ottoman architecture, making it a perfect spot for sightseeing and photography.

Historically, Ano Poli has been a significant part of Thessaloniki since its founding in the 4th century BC. It has witnessed the rise and fall of various empires, including the Roman, Byzantine, and Ottoman periods. This diverse history is reflected in the area's architecture and monuments. Notable sites include the Byzantine walls, which date back to the 4th century and provide a glimpse into the city's defensive past, and the Vardariou Tower, built by the Ottomans in 1546.

As you explore the Old Town, you'll encounter charming squares and local tavernas where you can experience authentic Greek culture. The area is also home to several churches, such as the Church of St. Nicholas Orphanos, showcasing exquisite frescoes and Byzantine art. The blend of historical significance and vibrant local life makes Ano Poli an ideal place for a leisurely stroll.

For a first-time visitor, the Old Town offers a unique opportunity to connect with Thessaloniki's past while enjoying the present. The friendly locals are often eager to share stories about their city, enhancing your experience. Don't forget to capture the picturesque views and traditional architecture for your Instagram feed. Overall, Ano Poli is a must-visit destination that beautifully encapsulates the essence of Thessaloniki's historical and cultural landscape.","Thessaloniki’s Old Town is full of atmosphere and covers the area between the city walls and Olympiados Street. It remained untouched by the 1917 great fire and was virtually uninhabited until the mid-15th century when the Ottomans conquered it for its fine climate and strategic position. The architecture features mixed Macedonian and Ottoman elements, with neoclassical and eclectic styles where the Dönmeh lived. After 1922, many refugees settled in the area, which has kept its original town planning with narrow alleys and scant squares, particularly in the west and east parts. This unique atmosphere has attracted artists and students in recent years.",0.8,0.3,0.08888888888888889,0.71733076975024,0.249999999975,0.0,0.0,0.0624999999609375,,0.8187078088078906
18,What can you tell me about AGIA THEODORA in Thessaloniki's Old Town?,"['18\nlink the town’s civic centre \n(Dikastirion Square, see p. 35) \nand Kassandrou Street with \nAristotelous Square and the \nseafront. All along the street \nthere are buildings the facades \nof which all follow specific \narchitectural patterns with \ncolonnades and arcades, and \nthey house offices, bookshops, \nstores, hotels, state agencies, \nresidencies etc. The junction of \nAristotelous and Ermou Streets \nis the location of the church of \nAgia [Saint] Theodora (1937) \nbuilt on an old monastery site \nnow housing a community of \nmonks; facing north you will \nsee upper Aristotelous square.\n1.2  Shopping streets\n(see p. 27)\n2 \tNIKIS AVENUE\nIt starts at the harbour from \nthe west and goes eastward \nto the White Tower (see p. 24) \nand it is known as Palia Paralia \n[Old Seafront]. The Turks \nopened it up in 1882, following \nan urban plan for modernising \nthe city, after the seafront city \nwalls were demolished. For \nmany decades, traders and \nwarships, fishing boats and \nyachts would dock along the \nwharf. Today, this is one of \nthe top places in Thessaloniki, \ncrossed daily by thousands of \nlocals and visitors.', 'Since 2001, the \nWater Museum (see p. 79) is \nhoused in the adjacent old main \npumping station of the Water \nCompany (1890-94), which was \nrunning until 1978.\n4 \t\x07TERPSITHEA DISTRICT \n(STAVROUPOLI)\nThis is a relatively quiet area  \nin Stavroupoli Municipality near \nthe city centre; the urban and \nfree space arrangement shows \na good town planning. Along \ndowntown Lagkada Street, \nyou will see the old military \ncamp and Lebet mosque, \nwhich will be changed into a \npark. Since 1938, the Jewish \ncemetery has been located \nin the space between Karaoli \nDimitriou and Dendropotamou \nStreets; a number of marble \npieces have been carried from \nthe old cemetery which used \nto be within the grounds of \nthe Aristotle University of \nThessaloniki, (see p. 38) and \nwas destroyed by the Germans \nduring World War II. Once \nyou’ve completed your tour you \ncan return to the city centre \ntaking the 27 and 29 bus lines \n(in the direction from Lagkada \nSt. to Egnatia St.).\nMUST SEE:\n4.1  Allied Military \nCemetery (Zeitenlik).\nThis is the largest military \nnecropolis in Greece.', '44\n5th walk: \nANO POLI (OLD TOWN)\n6 \tTSITSANI SQUARE\nThis small square with beautiful,  \nwell-tended houses is located \nin between Moni Vlatadon and \nHosios David where you can go \nif you take Timotheou Street \n(notice the ottoman fountain) \nand Dimitriou Poliorkitou Street. \nIn the square centre you will see \nthe bust of V. Tsitsanis (1915 – \n1984) a leading Greek popular \ncomposer who lived and worked \nin the town during World War II.\n7 \tEPTAPYRGIOU STREET\nThis is one of the most \ninteresting roads of Ano Poli \nquarter. It follows the interior \nline of the northern city walls \nwhich used to be the ramparts \nof the Acropolis (see also p. – \nfor the city walls). It is worth \ntaking a walk from the corner \nof Eptapyrgiou and Palamidiou \nStreets (to the west) where \nthe 3rd Gate is - also known \nas “Eski Delik” – and head \nfor the main Gate. Besides the \ninteresting traditional buildings \nand the deserted Zihne Camii \n[Mosque] (1902) you will pass \nby the old refugee houses called \n“kastroplikta”; these were built \nalong the line of the city walls or \nadjoining them – as far back as \nthe early 1920’s. Similar houses \ncan be seen also on the eastern \nand western walls.', '88\nDAY EXCURSIONS\nJewish quarter in Europe, \nwhich maintains a traditional \ncharacter in its entirety. It \nis worth taking a walk and \nvisiting the Roman, Ottoman \nand Industrial age monuments \nin the traditional districts of \nKyriotissa, Panagia Dexia, and \nMakariotissa; you can also visit \nthe Public Central Library which \nhas earned an international \naward, or relax in the parks  \nand squares.\nHow to get there.  \nVergina is about 63 km SW  \nof Thessaloniki. If you travel by \ncar, follow the signs to Veroia \nand after that to Vergina. You \ncan also take the intercity bus \nor the train to reach Veroia  \nand then take the local bus  \nto Vergina.\n3 \tDION\nThis most enchanting \narchaeological site is  \nlocated under the imposing \nOlympus mountain range, in  \na 150-hectare green area amid \nflowing waters coming from \nVafyras River and from other \nsprings; it is the habitat of \nmany species of birds, reptiles \nand amphibians. This used to \nbe a sacred place to ancient \nMacedonians who worshipped \nOlympian Zeus and the Muses \n[daughters of Zeus] here.', '80\nMUSEUMS\nmechanics and so on, which \nlay emphasis on the visitor’s \nactive participation as well as \non learning and having fun  \nat the same time.\n• Car Exhibition. \nOld car models that have \nbeen the most popular \nproductions in the history of \nthe automobile industry can  \nbe seen here.\nThe education rooms are \nthe following:\n• Planetarium. This \n160-seat room has a domed \nscreen (the dome is visible on \nthe outside as well). Visitors \ncan watch educational and \nrecreational films such as The \nEarth and me, Wonders of the \nUniverse and others.\n• Cosmotheatre. This film \ntheatre features the largest flat \nscreen in Southeast Europe \n(23X17 m.). Movies such as \nDinosaurs and Beyond the skies \nare screened here\n• Virtual Reality Simulator. \nThe spectator wears 3-D \nglasses, boards a small wagon \nand enjoys an on-the-go \nsimulation experience of \nvarious types such as flight, \ndeep-sea voyage and tours  \nin imaginary worlds.\nFurthermore, Noesis \norganises educational \nprogrammes on Renewable \nSources of Energy and \nScience Shows to further \nexplicate the laws of Physics \nand Chemistry.\nGEROVASSILIOU WINE \nMUSEUM\nThis outstanding museum \nhas been open since 2008  \nin the winery’s grounds where \nthe vineyards spread in a \n56-hectare area, affording \na fine view of the greater \narea and Thermaic Gulf. The \nmuseum collections are \narranged in seven categories:\n• Introduction.']","[""42 Thessaloniki’s Old Town is full of atmosphere. It covers the area in between the city walls (to the north and east) and Olympiados Street (to the south), and has had the luck to remain untouched by the 1917 great fire. It was virtually uninhabited until the mid-15th century, when it was conquered by the Ottomans who selected it for settlement on account of its fine climate, panoramic views and strategic position. The two and three-storey houses bear mixed Macedonian and Ottoman architectural elements (sachnisia) [Şahniş in turkish]; there are also residences with neoclassical and eclectic style motifs where the Dönmeh lived, i.e. converts to Islam who secretly remained Jews. After 1922 many refugees settled in the area. Despite the construction of newer buildings and the opening up of new streets in recent decades, it has kept its original town planning, to a large extent, with narrow alleys and scant squares, as well as its original architectural features, particularly in the west and east part of the town. This particular atmosphere has lured intellects, artists and students who chose it for settlement in recent years. 1 \x07AGIA AIKATERINI [SAINT CATHERINE] CHURCH (see p. 12) NIKIS NIKIS GERMANOU SVOLOU IASONIDOU TSIMISKI VAS. IRAKLEIOU FILIPPOU AKROPOLEOS THEOTOKOPOULOU AKROPOLEOS OCHI AVENUE EPTAPYRGIOU SOFOKLEOUS OLYMPOU AZANTZAKI DAMONOS POLYTECHNIOU MITROPOLEOS ARISTOTELOUS DODEKANISOU SALAMINOS ERMOU ANGELAKI ETHNIKIS AMYNAS AG. ANTONIOS AGIA THEODORA AG. ATHANASIOS AG. KONSTANTINOU YPAPANTI AGIOS STYLIANOS LAODI GITRIA TAXIARCHES AGIOS PAVLOS FANEROMENI AG. THEODOROI KALARI TSOPELA ISAVRON DELIOU IOANNI VELLIDI MAKRYGIANNI MITR. GENADIOU MODI PETROPOULAKIDON ARIANOU ARIANOU KLEISTHENOUS VIZYINOU KASTRON PANORMOU KESANLI AMPATZOGLOU SKOPELOU PETRAS ILIADOS VASILIKOU IRAKLEIAS SKEPASTOU SKOPOU KAVAFI ADRIANOUPOLEOS AIANTOS AGATHOUPOLEOS RING ROAD KY ELEFTHERO MYLONA KONSTANTINIDI KESSANIS REDAISTOU VYZOUKIDI VIZYINOU ANAKTORIOU THETIDOS AFXENTIOU MOUDANION PANEPISTIMIOU KALELPIDOS KONSTANTINOUPOLEOS SMYRNIS PYRGOU VRYANDOU KITROUS MELENIKOU PATR. IOAKEIM PALAION PATRON GERMANOU MICHAIL IO. ARMENOPOULOU IKTINOU KOMNINON SOLOMOU VLALI BALANOU ASKITOU VOGATSIKOU PLOUTARCHOU LASSANI MORKENTAOU TATI DRAGOUMI KYRIAKOU IOULIANOU SOKRATOUS EVRIPIDOU GYZI VLACHAVA AISCHYLOU ATHINAS MOREAS GKRATZIOU ATHONOS THEOFILOU PILEOS ANTIOCHOU VLATADON KASTOROS IGOUMENOU PERIANDROU POLYDOROU KLAFTHMONOS DRAGATSANIOU ACHTARI KARADIMOU DIONYSIOU EPIMENIDOU EVRYMEDONTOS AREOS ARTIS IRAKLIOU SYRAKOUSON PYDNAS KARAVANGELI TSAKALOF KIMONOS FLORINAS PLASTIRA FILIPPOU KLISTHENOUS FERON EVROU GKRATZIOU RAKTIVAN LAMPOUSIDI PASTER MAK KAMENIATOU PROFITI ILIA ATHINAS IFIKRATOUS PRASAKAKI STAVROU DIMOSTHENOUS KASTRITSIOU MENELAOU AMYNTA PELOPONNISOU PLATONOS DELMOUZOU AVDELA OUGKO KARATASOU KOUNTOURIOTI AS U DERIKIS ZANIS LKIS PONTOU NAFPLIOU VALTETSIOU KALPAKIOU LORDOU ELEFSINAS DELTA KONITSIS PLATONOS IPPOKRATOUS AGIOU DIMITRIOU VERMIOU SOUFLIOU BIZANIOU LECHOVOU LECHOVOU VOREIOU IPEIROU ARAPITSIS BOUBOULINAS KANARI KAPODISTRIOU KARAISKAKI SOLOMOU LACHANA AGRAFON PSARON MIAOULI KAVALAS KRITIS LEVENTI KANARI GRAVIAS KYPROU FILIATRON ARACHTHOU TSACHILA AGRAFON KARVOUNIDI ERASMOU ELENIS KAPETAN NIKOLAOU PELOPONNISOU AGIOU PAVLOU MAKEDONOMACHON KONITSIS IKARON EL. VENIZELOU OMIROU IPEIROU KONTOSOGLOU PAPANIKOLI TEPELENIOU MEGARON VITSI KASTORIAS DIMITSANAS ARGYROKASTROU DIMITRIOU THASSOU FOKA PAPAFLESSA KOMNINON KRITIS RITIS EPIDAVROU CHORTIATI ELLIS IOANNINON KRYSTALI ATTALOU GRANIKOU KYRIAKOPOULOU BOUBOULINAS MARKOU BOTSARI EPTAPYRGIOU EPTAPYRGIOU EPTAPYRGIOU EPTAPYRGIOU ANTHEON ATHANASIOU DIAKOU YPATROU GIALOUROU ROU ONGOU PAPANASTASIOU KAFKASOU METEORON KASSANDROU OLYMPIADOS A L. P A P A D O P O U L OU KASSANDROU OLYMPIADOS OLYMPOU POLYZOIDI AGIOU DIMITRIOU AGIOU DIMITRIOU AVRILIANIS ARKADIOUPOLEOS IFAISTIONOS ELPIDOS EL. VE NI ZE L O U NAVARINOU TYRNAVOU ONI ARISTARCHOU VOULGAROKTONOU THEMISTOKLEOUS A R O G A X A N A KYPROU 28 OKTOVRIOU M. ASIAS PARASKEVA NIGDIS ARAVYSSOU ALEXIOU TRANOU MOUSCHOUNTI KALAMPAKAS THOUKYDIDI ZARIFI SACHTOURI AKRITA KLIOS PERSEOS PYTHEOS RAKTIVAN ODYSSEOS SARAFI ETHN. ANTISTASEOS U O TIR K O M ID PARASKEVA PANIDOU OINOIS KARAOLI OLYMPOU ROMANIDI ARISTEIDOU ULINI KRITIS DEXAMENI DIOS KALVOU EIRINIS PAPARIGOPOULOU PALAMA ZEFYRON MAVILI PINIOU GLADSTONOS THALIAS PRONOIAS SACHINI KRATEROU FILOTA SOURI ANTON SOUTSOU SYNGROU PTOLEMAION IOUSTINIANOU KARBOLA TOSITSA ZALIKI CHALKEON AMVROSIOU KRYSTALI ANTIGONIDON S T O U R N A R A MAKEDON O MACHON ON ANEROMENIS AVEROF PANGAIOU AXIOU VAIOU PINDOU DOXIS VOTSI KALAPOTHAKI KATOUNI AIGYPTOU FRANGON DANAIDON AISOPOU ENOTIKON AFRODITIS KA CHOU ANAKI MAKI ODYSSEOS ODYSSEOS TANTALOU PROMITHEOS SAPFOUS NAVM. CHAPSA LIMNOU VALAORITI ORPHANIDI TANTALIDI OLYMPIOU DIAMANTI LOUI IPPODROMIOU NIKIFOROU DESPERE GOUNARI DIALETI DANGLI FILIKIS ETAIRIAS CHR. SMYRNIS MITR. IOSIF FOKA PANAGIA KARATZA POLIORKITI SYNGROU VYRONOS AGIOS DIMITRIOS RIGA FERAIOU A R C H A I O T I T O N S E L E F K I D O N M E L E N I K O U PROX. KOROMILA PARASCHOU EPTAPYRGIO ANO POLI 40 EKKLISIES EVANGELISTRIA THEA MUNICIPAL PARK RODOCHORI EVANGELISTRIA'S CEMETERY KOTRONI VARNAS SQ. MOUSHOUNTI SQ. FANARIOTON SQ. ELEFTHERIAS SQ. EMPORIOU SQ. DIMOKRATIAS VARDARI SQ. KYPRION AGONISTON SQ. ARCHAIAS AG. SOFIAS AGORAS SQ. DIMITRION SQ. TERPSITHEA SQ. ROMFEI SQ. SYNTRIVANIOU SQ. NAVARINOU SQ. SQ. SYKIES ZIDROU SQ. LYSSIATREIO (SEICH SOU) AGIOS DIMITRIOS HOSPITAL GENERAL HOSPITAL OF THESSALONIKI G. GENNIMATAS UNIVERSITY GENERAL HOSPITAL OF THESSALONIKI AHEPA 5th walk:""]","Agia Theodora is a notable church located in Thessaloniki's Old Town, specifically at the junction of Aristotelous and Ermou Streets. Built in 1937 on the site of an old monastery, it serves as a significant landmark in the area. The church is dedicated to Saint Theodora and is an excellent example of the city's rich religious heritage.

The surrounding area is characterized by its vibrant atmosphere, with Kassandrou Street and Aristotelous Square nearby, making it a convenient stop during your sightseeing. The architecture along these streets features beautiful facades with colonnades and arcades, housing various shops, cafes, and local businesses, perfect for a leisurely stroll or a quick coffee break.

Visiting Agia Theodora offers a chance to appreciate both the spiritual and historical aspects of Thessaloniki. The church is not only a place of worship but also a cultural touchpoint, reflecting the city's Byzantine influences. The serene environment around the church provides a nice contrast to the bustling streets, allowing for moments of reflection and photography.

As a first-time visitor, you’ll find that the area is accessible and welcoming, with locals often engaging with visitors. This makes it an ideal spot for those interested in immersing themselves in the local culture. The church's location also makes it easy to explore other nearby attractions, such as the White Tower and the waterfront promenade.

For an Instagrammable moment, consider capturing the church's exterior against the backdrop of the lively streets or the picturesque views from the nearby upper Aristotelous Square. Overall, Agia Theodora is a must-visit for anyone looking to experience the charm and history of Thessaloniki's Old Town.","AGIA THEODORA is one of the streets located in Thessaloniki’s Old Town, an area rich in atmosphere and history. The Old Town has remained largely untouched by the 1917 great fire and features a mix of Macedonian and Ottoman architectural elements. This area has attracted many artists and students in recent years due to its unique charm and historical significance.",0.0,0.22,0.28125,0.7582705170381496,0.9999999999,0.9999999999,0.0,0.0,,0.846124704317547
19,Who were the Dönmeh and where did they live in Thessaloniki?,"['42\nThessaloniki’s Old Town is \nfull of atmosphere. It covers \nthe area in between the city \nwalls (to the north and east) \nand Olympiados Street (to \nthe south), and has had the \nluck to remain untouched by \nthe 1917 great fire. It was \nvirtually uninhabited until \nthe mid-15th century, when \nit was conquered by the \nOttomans who selected it for \nsettlement on account of its \nfine climate, panoramic views \nand strategic position. The \ntwo and three-storey houses \nbear mixed Macedonian \nand Ottoman architectural \nelements (sachnisia) [Şahniş \nin turkish]; there are also \nresidences with neoclassical \nand eclectic style motifs \nwhere the Dönmeh lived, i.e. \nconverts to Islam who secretly \nremained Jews. After 1922 \nmany refugees settled in the \narea. Despite the construction \nof newer buildings and the \nopening up of new streets in \nrecent decades, it has kept \nits original town planning, to \na large extent, with narrow \nalleys and scant squares, as \nwell as its original architectural \nfeatures, particularly in the \nwest and east part of the town. \nThis particular atmosphere has \nlured intellects, artists \nand students who chose it  \nfor settlement in recent years.\n1\n\t \x07AGIA AIKATERINI \n[SAINT CATHERINE] \nCHURCH\n(see p.', '44\n5th walk: \nANO POLI (OLD TOWN)\n6 \tTSITSANI SQUARE\nThis small square with beautiful,  \nwell-tended houses is located \nin between Moni Vlatadon and \nHosios David where you can go \nif you take Timotheou Street \n(notice the ottoman fountain) \nand Dimitriou Poliorkitou Street. \nIn the square centre you will see \nthe bust of V. Tsitsanis (1915 – \n1984) a leading Greek popular \ncomposer who lived and worked \nin the town during World War II.\n7 \tEPTAPYRGIOU STREET\nThis is one of the most \ninteresting roads of Ano Poli \nquarter. It follows the interior \nline of the northern city walls \nwhich used to be the ramparts \nof the Acropolis (see also p. – \nfor the city walls). It is worth \ntaking a walk from the corner \nof Eptapyrgiou and Palamidiou \nStreets (to the west) where \nthe 3rd Gate is - also known \nas “Eski Delik” – and head \nfor the main Gate. Besides the \ninteresting traditional buildings \nand the deserted Zihne Camii \n[Mosque] (1902) you will pass \nby the old refugee houses called \n“kastroplikta”; these were built \nalong the line of the city walls or \nadjoining them – as far back as \nthe early 1920’s. Similar houses \ncan be seen also on the eastern \nand western walls.', '21\n2nd walk: \nHISTORIC CENTRE (1)\nTRADITIONAL COMMERCIAL CENTRE\nWWII the area was gradually \ndowngraded; in 1985 it was \nproclaimed a historic area with \nlisted buildings. Since the early \n1990s, steps were taken to \nupgrade Ladadika, turning it \ninto a hotspot area in town \nwith numerous restaurants, \nclubs, cafés and venues where \nlive Greek music is performed. \nA central spot where you can \nstart your tour is Morichovou \nsq.; it is worth stopping by \nPetrakaki sq. where you will see \nthe Mansion of the Ottoman \nPost Office (today a hotel) \n–among other sights. Other \nplaces of interest are Aigyptou, \nKatouni, Lykourgou, and Edessis \nstreets (in Emporiou sq. or \nAno Ladadika, past Tsimiski \nstreet) where you will see two \nsurviving inns. There are still \ntraces of smoke dating to \nthe 1917 fire on the facades \nof buildings fronting on the \nharbour!\n6 \tTSIMISKI STREET\nThis main street is among the \nbusiest downtown places and \nconnects YMCA square (see \np. 26) with Ladadika.', '27), as well as the area \nbetween Zefxidos and Iktinou \nStreets (see p. 28). The \nnumerous students living in \ntown prefer to hang out in the \narea about Navarinou square \n(see p. 28), Rotonta [Rotunda] \n(see p. 37) and Angelaki \nStreet (see p. 32) as well as \nin Bit-Pazar area and the \nstreets around it (see p. 36). \nTavernas, ouzo-restaurants, \nand small café-bars, located in \nAno Poli (see p. 42), are some \nof the alternative places where \nThessalonians love to hang \nout. In recent years, the area \naround Valaoritou Street (see \np. 23) has become a nightlife \nhotspot; in the evening - \nparticularly during the summer \nmonths – people swarm the \narea, the restaurants, and \nmusic venues!  \nWest of the harbour \n(Slaughterhouse area, see  \np. 60), there are huge venues \nfor live Greek music (also \nknown as bouzoukia) and the \nbiggest clubs in town, as well \nas multi-purpose cultural \n116\n117', '74\nMUSEUMS\nreligious and everyday life  \nof local Jews.\n• Holocaust. A special \nexhibition area depicts the \ngenocide of the approx. 49,000 \nmembers of Thessaloniki’s \nJewish Community, who were \nsent off to Auschwitz and \nBergen Belsen concentration \ncamps to be exterminated.\n• Photography exhibits. \nThe museum hosts interesting \nexhibitions, such as the one \ntitled Thessaloniki, a Metropolis \nof the Sephardi Jews by S. \nMarks.\nMUSEUM OF THE \nMACEDONIAN STRUGGLE\nThe museum exhibits are \non display in seven rooms on \nthe ground floor, and show the \nmain aspects of the history \nof Macedonia in the 19th and \nearly 20th c. during the struggle \nfor freedom against the \nOttoman Turks.']","[""42 Thessaloniki’s Old Town is full of atmosphere. It covers the area in between the city walls (to the north and east) and Olympiados Street (to the south), and has had the luck to remain untouched by the 1917 great fire. It was virtually uninhabited until the mid-15th century, when it was conquered by the Ottomans who selected it for settlement on account of its fine climate, panoramic views and strategic position. The two and three-storey houses bear mixed Macedonian and Ottoman architectural elements (sachnisia) [Şahniş in turkish]; there are also residences with neoclassical and eclectic style motifs where the Dönmeh lived, i.e. converts to Islam who secretly remained Jews. After 1922 many refugees settled in the area. Despite the construction of newer buildings and the opening up of new streets in recent decades, it has kept its original town planning, to a large extent, with narrow alleys and scant squares, as well as its original architectural features, particularly in the west and east part of the town. This particular atmosphere has lured intellects, artists and students who chose it for settlement in recent years. 1 \x07AGIA AIKATERINI [SAINT CATHERINE] CHURCH (see p. 12) NIKIS NIKIS GERMANOU SVOLOU IASONIDOU TSIMISKI VAS. IRAKLEIOU FILIPPOU AKROPOLEOS THEOTOKOPOULOU AKROPOLEOS OCHI AVENUE EPTAPYRGIOU SOFOKLEOUS OLYMPOU AZANTZAKI DAMONOS POLYTECHNIOU MITROPOLEOS ARISTOTELOUS DODEKANISOU SALAMINOS ERMOU ANGELAKI ETHNIKIS AMYNAS AG. ANTONIOS AGIA THEODORA AG. ATHANASIOS AG. KONSTANTINOU YPAPANTI AGIOS STYLIANOS LAODI GITRIA TAXIARCHES AGIOS PAVLOS FANEROMENI AG. THEODOROI KALARI TSOPELA ISAVRON DELIOU IOANNI VELLIDI MAKRYGIANNI MITR. GENADIOU MODI PETROPOULAKIDON ARIANOU ARIANOU KLEISTHENOUS VIZYINOU KASTRON PANORMOU KESANLI AMPATZOGLOU SKOPELOU PETRAS ILIADOS VASILIKOU IRAKLEIAS SKEPASTOU SKOPOU KAVAFI ADRIANOUPOLEOS AIANTOS AGATHOUPOLEOS RING ROAD KY ELEFTHERO MYLONA KONSTANTINIDI KESSANIS REDAISTOU VYZOUKIDI VIZYINOU ANAKTORIOU THETIDOS AFXENTIOU MOUDANION PANEPISTIMIOU KALELPIDOS KONSTANTINOUPOLEOS SMYRNIS PYRGOU VRYANDOU KITROUS MELENIKOU PATR. IOAKEIM PALAION PATRON GERMANOU MICHAIL IO. ARMENOPOULOU IKTINOU KOMNINON SOLOMOU VLALI BALANOU ASKITOU VOGATSIKOU PLOUTARCHOU LASSANI MORKENTAOU TATI DRAGOUMI KYRIAKOU IOULIANOU SOKRATOUS EVRIPIDOU GYZI VLACHAVA AISCHYLOU ATHINAS MOREAS GKRATZIOU ATHONOS THEOFILOU PILEOS ANTIOCHOU VLATADON KASTOROS IGOUMENOU PERIANDROU POLYDOROU KLAFTHMONOS DRAGATSANIOU ACHTARI KARADIMOU DIONYSIOU EPIMENIDOU EVRYMEDONTOS AREOS ARTIS IRAKLIOU SYRAKOUSON PYDNAS KARAVANGELI TSAKALOF KIMONOS FLORINAS PLASTIRA FILIPPOU KLISTHENOUS FERON EVROU GKRATZIOU RAKTIVAN LAMPOUSIDI PASTER MAK KAMENIATOU PROFITI ILIA ATHINAS IFIKRATOUS PRASAKAKI STAVROU DIMOSTHENOUS KASTRITSIOU MENELAOU AMYNTA PELOPONNISOU PLATONOS DELMOUZOU AVDELA OUGKO KARATASOU KOUNTOURIOTI AS U DERIKIS ZANIS LKIS PONTOU NAFPLIOU VALTETSIOU KALPAKIOU LORDOU ELEFSINAS DELTA KONITSIS PLATONOS IPPOKRATOUS AGIOU DIMITRIOU VERMIOU SOUFLIOU BIZANIOU LECHOVOU LECHOVOU VOREIOU IPEIROU ARAPITSIS BOUBOULINAS KANARI KAPODISTRIOU KARAISKAKI SOLOMOU LACHANA AGRAFON PSARON MIAOULI KAVALAS KRITIS LEVENTI KANARI GRAVIAS KYPROU FILIATRON ARACHTHOU TSACHILA AGRAFON KARVOUNIDI ERASMOU ELENIS KAPETAN NIKOLAOU PELOPONNISOU AGIOU PAVLOU MAKEDONOMACHON KONITSIS IKARON EL. VENIZELOU OMIROU IPEIROU KONTOSOGLOU PAPANIKOLI TEPELENIOU MEGARON VITSI KASTORIAS DIMITSANAS ARGYROKASTROU DIMITRIOU THASSOU FOKA PAPAFLESSA KOMNINON KRITIS RITIS EPIDAVROU CHORTIATI ELLIS IOANNINON KRYSTALI ATTALOU GRANIKOU KYRIAKOPOULOU BOUBOULINAS MARKOU BOTSARI EPTAPYRGIOU EPTAPYRGIOU EPTAPYRGIOU EPTAPYRGIOU ANTHEON ATHANASIOU DIAKOU YPATROU GIALOUROU ROU ONGOU PAPANASTASIOU KAFKASOU METEORON KASSANDROU OLYMPIADOS A L. P A P A D O P O U L OU KASSANDROU OLYMPIADOS OLYMPOU POLYZOIDI AGIOU DIMITRIOU AGIOU DIMITRIOU AVRILIANIS ARKADIOUPOLEOS IFAISTIONOS ELPIDOS EL. VE NI ZE L O U NAVARINOU TYRNAVOU ONI ARISTARCHOU VOULGAROKTONOU THEMISTOKLEOUS A R O G A X A N A KYPROU 28 OKTOVRIOU M. ASIAS PARASKEVA NIGDIS ARAVYSSOU ALEXIOU TRANOU MOUSCHOUNTI KALAMPAKAS THOUKYDIDI ZARIFI SACHTOURI AKRITA KLIOS PERSEOS PYTHEOS RAKTIVAN ODYSSEOS SARAFI ETHN. ANTISTASEOS U O TIR K O M ID PARASKEVA PANIDOU OINOIS KARAOLI OLYMPOU ROMANIDI ARISTEIDOU ULINI KRITIS DEXAMENI DIOS KALVOU EIRINIS PAPARIGOPOULOU PALAMA ZEFYRON MAVILI PINIOU GLADSTONOS THALIAS PRONOIAS SACHINI KRATEROU FILOTA SOURI ANTON SOUTSOU SYNGROU PTOLEMAION IOUSTINIANOU KARBOLA TOSITSA ZALIKI CHALKEON AMVROSIOU KRYSTALI ANTIGONIDON S T O U R N A R A MAKEDON O MACHON ON ANEROMENIS AVEROF PANGAIOU AXIOU VAIOU PINDOU DOXIS VOTSI KALAPOTHAKI KATOUNI AIGYPTOU FRANGON DANAIDON AISOPOU ENOTIKON AFRODITIS KA CHOU ANAKI MAKI ODYSSEOS ODYSSEOS TANTALOU PROMITHEOS SAPFOUS NAVM. CHAPSA LIMNOU VALAORITI ORPHANIDI TANTALIDI OLYMPIOU DIAMANTI LOUI IPPODROMIOU NIKIFOROU DESPERE GOUNARI DIALETI DANGLI FILIKIS ETAIRIAS CHR. SMYRNIS MITR. IOSIF FOKA PANAGIA KARATZA POLIORKITI SYNGROU VYRONOS AGIOS DIMITRIOS RIGA FERAIOU A R C H A I O T I T O N S E L E F K I D O N M E L E N I K O U PROX. KOROMILA PARASCHOU EPTAPYRGIO ANO POLI 40 EKKLISIES EVANGELISTRIA THEA MUNICIPAL PARK RODOCHORI EVANGELISTRIA'S CEMETERY KOTRONI VARNAS SQ. MOUSHOUNTI SQ. FANARIOTON SQ. ELEFTHERIAS SQ. EMPORIOU SQ. DIMOKRATIAS VARDARI SQ. KYPRION AGONISTON SQ. ARCHAIAS AG. SOFIAS AGORAS SQ. DIMITRION SQ. TERPSITHEA SQ. ROMFEI SQ. SYNTRIVANIOU SQ. NAVARINOU SQ. SQ. SYKIES ZIDROU SQ. LYSSIATREIO (SEICH SOU) AGIOS DIMITRIOS HOSPITAL GENERAL HOSPITAL OF THESSALONIKI G. GENNIMATAS UNIVERSITY GENERAL HOSPITAL OF THESSALONIKI AHEPA 5th walk:""]","The Dönmeh were a group of converts to Islam from Judaism, primarily of Sephardic descent, who emerged in the late 17th century in the Ottoman Empire. They practiced a form of Islam that retained some Jewish customs and beliefs, often keeping their Jewish identity secret. This unique cultural and religious background made them a distinct community within the broader Ottoman society.

In Thessaloniki, the Dönmeh lived in the Old Town area, particularly in residences that showcased a blend of Macedonian and Ottoman architectural styles. The excerpt mentions that their homes featured neoclassical and eclectic motifs, reflecting their cultural heritage. The Old Town, which remained largely untouched by the great fire of 1917, provided a historical backdrop for the Dönmeh community, allowing them to maintain their traditions and lifestyle.

The Dönmeh were known for their contributions to the cultural and social fabric of Thessaloniki, particularly during the Ottoman period. Their presence in the city added to its rich tapestry of diverse communities, which included Greeks, Jews, and other ethnic groups. Today, the remnants of their architectural legacy can still be seen in the Old Town, making it an interesting area for visitors who wish to explore the historical influences that shaped Thessaloniki.

For a solo traveler interested in sightseeing and local culture, exploring the Old Town offers a glimpse into the city's multifaceted history, including the story of the Dönmeh. The narrow alleys and original architectural features provide numerous Instagrammable spots, allowing for a blend of leisure and cultural engagement during your visit.",The Dönmeh were converts to Islam who secretly remained Jews. They lived in residences with neoclassical and eclectic style motifs in Thessaloniki's Old Town.,1.0,0.33,0.391304347826087,0.8350037539051562,0.9999999999666667,0.9999999999,0.0,0.9999999980000001,,0.9242221671851493
20,Can you provide details about the significance of Vasilis Tsitsanis in Ano Poli and where I might find a tribute to him?,"['44\n5th walk: \nANO POLI (OLD TOWN)\n6 \tTSITSANI SQUARE\nThis small square with beautiful,  \nwell-tended houses is located \nin between Moni Vlatadon and \nHosios David where you can go \nif you take Timotheou Street \n(notice the ottoman fountain) \nand Dimitriou Poliorkitou Street. \nIn the square centre you will see \nthe bust of V. Tsitsanis (1915 – \n1984) a leading Greek popular \ncomposer who lived and worked \nin the town during World War II.\n7 \tEPTAPYRGIOU STREET\nThis is one of the most \ninteresting roads of Ano Poli \nquarter. It follows the interior \nline of the northern city walls \nwhich used to be the ramparts \nof the Acropolis (see also p. – \nfor the city walls). It is worth \ntaking a walk from the corner \nof Eptapyrgiou and Palamidiou \nStreets (to the west) where \nthe 3rd Gate is - also known \nas “Eski Delik” – and head \nfor the main Gate. Besides the \ninteresting traditional buildings \nand the deserted Zihne Camii \n[Mosque] (1902) you will pass \nby the old refugee houses called \n“kastroplikta”; these were built \nalong the line of the city walls or \nadjoining them – as far back as \nthe early 1920’s. Similar houses \ncan be seen also on the eastern \nand western walls.', 'DIMOKRATIAS\nVARDARI\nSQ.\nKYPRION\nAGONISTON\nSQ.\nARCHAIAS\nAG. SOFIAS\nAGORAS\nSQ.\nDIMITRION\nSQ.\nTERPSITHEA\nSQ.\nROMFEI\nSQ.\nSYNTRIVANIOU\nSQ.\nNAVARINOU\nSQ.\nSQ.\nSYKIES\nZIDROU\nSQ.\nLYSSIATREIO\n(SEICH SOU)\nAGIOS\nDIMITRIOS\nHOSPITAL\nGENERAL\nHOSPITAL\nOF THESSALONIKI\nG. GENNIMATAS\nUNIVERSITY\nGENERAL\nHOSPITAL\nOF THESSALONIKI\nAHEPA\n5th walk: \nANO POLI (OLD TOWN)\n9\n7\n7\n1\n2\n3\n8\n6\n5\n4\n10\n11 12\n13\n14\n15\n16\n17\n18\n19\n20\n19.2\n19.1\n19.3\n44.  \nThe bust \nof Vasilis \nTsitsanis has \nbeen placed \nin the square \nnamed after \nthe composer, \nin Ano Poli.\n45.  \nOne of the \nrefugee \nhouses built \nalong the line \nof the city walls \n(Ano Poli).', '49\n5th walk: \nANO POLI (OLD TOWN)\nThe quarter was created mainly \nto provide housing for the \nrefugees who settled there \nin the early 20th c.; however \ntraces of settlements exist \nwhich date as far back as the \n2nd c. AD. In the lush greenery \nof the Municipal Grove there \nis a Municipal Theatre, where \nmajor cultural events are held \nduring the summer months, \nand an open-air cinema. \nFurther south, on a low hill, you \nwill see the imposing church \nof Agioi Theodoroi, built on \nruins of a 7th c. Byzantine \nchurch, where the view of the \nentire city is amazing. In the \nneighbouring Elpidos Street \ntowards the city walls you will \nsee a group of refugee houses \n– the area is in the process of \nbeing changed into a “Cultural \nNeighbourhood”.\nHow to get there: To \nreach Sykees, you can either \nwalk from Ano Poli or take \nthe bus no. 23 (terminus at \nEleftherias sq.) and get off at \nAgios Charalampos stop.\n54\n53', '43\n5th walk: \nANO POLI (OLD TOWN)\n2 \tTSINARI\nThis area was named after \nthe plane tree which was \nplanted there in the early 20th \nc. (çınar is turkish for plane \ntree). You can reach it through \nAl. Papadopoulou Street, one \nof Ano Poli’s hallmark areas \nas are Tsamadou, Sachtouri \nand Isminis Streets. In Isminis \nStreet you will find the House \nof Pontian Greeks. This is  \nAno Poli’s downtown spot \nand people who want to reach \nthe neighbouring Sykies \narea go through here. In the \ncentre, there is an ottoman \nfountain with a marble Roman \nsarcophagus; this is also \nwhere you will find the oldest \nrestaurant in town (open since \n1885), a café and small shops.\n3 \tTERPSITHEA SQUARE\nTake a good look at the \nremarkable listed buildings and \nthe more recent ones as you \nwalk along Pileos Street and \nhead for Terpsithea Square. \nThe buildings surrounding \nthe square are amazing and \noffer a wonderful view of the \ntown and the seafront; in the \ncentre there is a playground \nand a small open-air theatre. \nAnother impressive monument \nis the Tϋrbe (Tomb) of Musha  \nBaba (1543), one of the late  \nottoman monuments  \nof Thessaloniki, shaped  \nas an octagon with decorative \npointed frames on windows \nand a once lead-covered dome.', '27), as well as the area \nbetween Zefxidos and Iktinou \nStreets (see p. 28). The \nnumerous students living in \ntown prefer to hang out in the \narea about Navarinou square \n(see p. 28), Rotonta [Rotunda] \n(see p. 37) and Angelaki \nStreet (see p. 32) as well as \nin Bit-Pazar area and the \nstreets around it (see p. 36). \nTavernas, ouzo-restaurants, \nand small café-bars, located in \nAno Poli (see p. 42), are some \nof the alternative places where \nThessalonians love to hang \nout. In recent years, the area \naround Valaoritou Street (see \np. 23) has become a nightlife \nhotspot; in the evening - \nparticularly during the summer \nmonths – people swarm the \narea, the restaurants, and \nmusic venues!  \nWest of the harbour \n(Slaughterhouse area, see  \np. 60), there are huge venues \nfor live Greek music (also \nknown as bouzoukia) and the \nbiggest clubs in town, as well \nas multi-purpose cultural \n116\n117']","['ANO POLI (OLD TOWN) 9 7 7 1 2 3 8 6 5 4 10 11 12 13 14 15 16 17 18 19 20 19.2 19.1 19.3 44. The bust of Vasilis Tsitsanis has been placed in the square named after the composer, in Ano Poli. 45. One of the refugee houses built along the line of the city walls (Ano Poli).']","Vasilis Tsitsanis is a celebrated figure in Greek music, known for his contributions as a popular composer and musician. He was particularly influential during the World War II era and is regarded as a key figure in the development of modern Greek music. His work resonates deeply with the cultural identity of Thessaloniki, where he lived and created much of his music.

In Ano Poli, you can find a tribute to Tsitsanis at Tsitsani Square, which is named in his honor. The square features a bust of the composer, serving as a focal point for visitors and locals alike. This small, picturesque square is surrounded by beautiful, well-maintained houses and is located between Moni Vlatadon and Hosios David. To reach the square, you can take Timotheou Street, where you’ll also notice an Ottoman fountain, adding to the historical charm of the area.

Visiting Tsitsani Square not only allows you to pay homage to this iconic musician but also provides an opportunity to immerse yourself in the vibrant atmosphere of Ano Poli. The square is a great spot for photography, offering Instagrammable views of the surrounding architecture and the bust itself. Additionally, the area is rich in history, with traditional buildings and remnants of the city walls nearby, making it an ideal location for sightseeing.

As a first-time visitor, exploring Ano Poli and its cultural landmarks, including the tribute to Vasilis Tsitsanis, will enhance your experience of Thessaloniki's local culture and history. Enjoy your time in this charming neighborhood, where you can connect with the local community and appreciate the legacy of one of Greece's most beloved musicians.","In Ano Poli, the bust of Vasilis Tsitsanis has been placed in the square named after the composer, serving as a tribute to his significance.",1.0,0.44,0.7407407407407407,0.8051546830000702,0.99999999995,0.99999999995,0.0,0.3333333322222222,,0.6918790701437919
21,What notable features can be found in Ano Poli?,"['44\n5th walk: \nANO POLI (OLD TOWN)\n6 \tTSITSANI SQUARE\nThis small square with beautiful,  \nwell-tended houses is located \nin between Moni Vlatadon and \nHosios David where you can go \nif you take Timotheou Street \n(notice the ottoman fountain) \nand Dimitriou Poliorkitou Street. \nIn the square centre you will see \nthe bust of V. Tsitsanis (1915 – \n1984) a leading Greek popular \ncomposer who lived and worked \nin the town during World War II.\n7 \tEPTAPYRGIOU STREET\nThis is one of the most \ninteresting roads of Ano Poli \nquarter. It follows the interior \nline of the northern city walls \nwhich used to be the ramparts \nof the Acropolis (see also p. – \nfor the city walls). It is worth \ntaking a walk from the corner \nof Eptapyrgiou and Palamidiou \nStreets (to the west) where \nthe 3rd Gate is - also known \nas “Eski Delik” – and head \nfor the main Gate. Besides the \ninteresting traditional buildings \nand the deserted Zihne Camii \n[Mosque] (1902) you will pass \nby the old refugee houses called \n“kastroplikta”; these were built \nalong the line of the city walls or \nadjoining them – as far back as \nthe early 1920’s. Similar houses \ncan be seen also on the eastern \nand western walls.', '43\n5th walk: \nANO POLI (OLD TOWN)\n2 \tTSINARI\nThis area was named after \nthe plane tree which was \nplanted there in the early 20th \nc. (çınar is turkish for plane \ntree). You can reach it through \nAl. Papadopoulou Street, one \nof Ano Poli’s hallmark areas \nas are Tsamadou, Sachtouri \nand Isminis Streets. In Isminis \nStreet you will find the House \nof Pontian Greeks. This is  \nAno Poli’s downtown spot \nand people who want to reach \nthe neighbouring Sykies \narea go through here. In the \ncentre, there is an ottoman \nfountain with a marble Roman \nsarcophagus; this is also \nwhere you will find the oldest \nrestaurant in town (open since \n1885), a café and small shops.\n3 \tTERPSITHEA SQUARE\nTake a good look at the \nremarkable listed buildings and \nthe more recent ones as you \nwalk along Pileos Street and \nhead for Terpsithea Square. \nThe buildings surrounding \nthe square are amazing and \noffer a wonderful view of the \ntown and the seafront; in the \ncentre there is a playground \nand a small open-air theatre. \nAnother impressive monument \nis the Tϋrbe (Tomb) of Musha  \nBaba (1543), one of the late  \nottoman monuments  \nof Thessaloniki, shaped  \nas an octagon with decorative \npointed frames on windows \nand a once lead-covered dome.', '49\n5th walk: \nANO POLI (OLD TOWN)\nThe quarter was created mainly \nto provide housing for the \nrefugees who settled there \nin the early 20th c.; however \ntraces of settlements exist \nwhich date as far back as the \n2nd c. AD. In the lush greenery \nof the Municipal Grove there \nis a Municipal Theatre, where \nmajor cultural events are held \nduring the summer months, \nand an open-air cinema. \nFurther south, on a low hill, you \nwill see the imposing church \nof Agioi Theodoroi, built on \nruins of a 7th c. Byzantine \nchurch, where the view of the \nentire city is amazing. In the \nneighbouring Elpidos Street \ntowards the city walls you will \nsee a group of refugee houses \n– the area is in the process of \nbeing changed into a “Cultural \nNeighbourhood”.\nHow to get there: To \nreach Sykees, you can either \nwalk from Ano Poli or take \nthe bus no. 23 (terminus at \nEleftherias sq.) and get off at \nAgios Charalampos stop.\n54\n53', '19.3 Theatre of the Earth.\n[Theatro Gis] This impressive \nopen-air theatre (with a \nseating for 4,300 spectators) \nis located in the area of \nTriandria (north of Kaftanzoglio \nStadium, see p. 41). It was \ninaugurated in 1997 in view \nof that year’s celebrations for \nThessaloniki as the European \nCapital of Culture. It is \nconsidered as one of the best \nvenues for cultural events  \nin Greece.\nHow to get there: Take \nthe bus no. 24 on Eleftherias \nsq. stop. The terminus is  \nat the Zoo’s car park.\n20\tSYKEES\nThis beautiful area is to be \nfound NW of Ano Poli, outside \nthe city walls. Despite the \nrising trend in house-building \nin recent decades, it is still \ndotted with detached houses \ndating to the Interwar Period. \n52.  \nThe zoo \nentrance in \nSeich Sou \nforest.\n53.  \nView over \nAgios Pavlos \ndistrict from \nthe Seich Sou \nforest.\n54.  \nSeich Sou  \nis very popular \nwith locals \nwho enjoy \ncoming for \na walk, for \nleisure and \nrelaxing.\n52', 'DIMOKRATIAS\nVARDARI\nSQ.\nKYPRION\nAGONISTON\nSQ.\nARCHAIAS\nAG. SOFIAS\nAGORAS\nSQ.\nDIMITRION\nSQ.\nTERPSITHEA\nSQ.\nROMFEI\nSQ.\nSYNTRIVANIOU\nSQ.\nNAVARINOU\nSQ.\nSQ.\nSYKIES\nZIDROU\nSQ.\nLYSSIATREIO\n(SEICH SOU)\nAGIOS\nDIMITRIOS\nHOSPITAL\nGENERAL\nHOSPITAL\nOF THESSALONIKI\nG. GENNIMATAS\nUNIVERSITY\nGENERAL\nHOSPITAL\nOF THESSALONIKI\nAHEPA\n5th walk: \nANO POLI (OLD TOWN)\n9\n7\n7\n1\n2\n3\n8\n6\n5\n4\n10\n11 12\n13\n14\n15\n16\n17\n18\n19\n20\n19.2\n19.1\n19.3\n44.  \nThe bust \nof Vasilis \nTsitsanis has \nbeen placed \nin the square \nnamed after \nthe composer, \nin Ano Poli.\n45.  \nOne of the \nrefugee \nhouses built \nalong the line \nof the city walls \n(Ano Poli).']","['ANO POLI (OLD TOWN) 9 7 7 1 2 3 8 6 5 4 10 11 12 13 14 15 16 17 18 19 20 19.2 19.1 19.3 44. The bust of Vasilis Tsitsanis has been placed in the square named after the composer, in Ano Poli. 45. One of the refugee houses built along the line of the city walls (Ano Poli).']","Ano Poli, the Old Town of Thessaloniki, is rich in history and charm, making it an ideal destination for sightseeing. Here are some notable features to explore:

1. **Tsitsani Square**: This quaint square is home to the bust of V. Tsitsanis, a renowned Greek composer. The surrounding well-preserved houses and the nearby Ottoman fountain create a picturesque setting perfect for photography.

2. **Eptapyrgiou Street**: A stroll along this street offers a glimpse of the northern city walls, remnants of the Acropolis. The area is dotted with traditional buildings and the historic Zihne Camii Mosque, providing a unique backdrop for your Instagram feed.

3. **Moni Vlatadon and Hosios David**: These nearby monasteries are steeped in history and offer serene spots for reflection. The architecture and tranquil atmosphere make them worthwhile stops.

4. **Terpsithea Square**: This square features remarkable listed buildings and a playground, making it a lively area to relax. The view of the city and seafront from here is stunning, especially during sunset.

5. **Municipal Grove**: A lush green area perfect for a leisurely walk, it houses the Municipal Theatre, where cultural events take place in summer. The open-air cinema adds to the vibrant atmosphere.

6. **Agioi Theodoroi Church**: Located on a hill, this church is built on the ruins of a Byzantine structure. The panoramic views of Thessaloniki from here are breathtaking.

7. **Cultural Neighborhoods**: The area is undergoing transformation into a cultural hub, with refugee houses reflecting the history of the city. Exploring these neighborhoods offers insights into local life and history.

8. **Local Cuisine**: Don’t miss the chance to visit the oldest restaurant in town, located in Isminis Street, where you can enjoy traditional Greek dishes.

These features not only highlight the historical significance of Ano Poli but also provide ample opportunities for social interaction and cultural immersion, making your visit memorable.","In Ano Poli, one can find the bust of Vasilis Tsitsanis placed in the square named after the composer, as well as one of the refugee houses built along the line of the city walls.",1.0,0.42,0.9534883720930233,0.5996886738000364,0.94999999997625,0.699999999965,0.0,0.249999999375,,0.7943786349162846
22,Can you tell me more about the bust of Vasilis Tsitsanis and its significance in Ano Poli?,"['DIMOKRATIAS\nVARDARI\nSQ.\nKYPRION\nAGONISTON\nSQ.\nARCHAIAS\nAG. SOFIAS\nAGORAS\nSQ.\nDIMITRION\nSQ.\nTERPSITHEA\nSQ.\nROMFEI\nSQ.\nSYNTRIVANIOU\nSQ.\nNAVARINOU\nSQ.\nSQ.\nSYKIES\nZIDROU\nSQ.\nLYSSIATREIO\n(SEICH SOU)\nAGIOS\nDIMITRIOS\nHOSPITAL\nGENERAL\nHOSPITAL\nOF THESSALONIKI\nG. GENNIMATAS\nUNIVERSITY\nGENERAL\nHOSPITAL\nOF THESSALONIKI\nAHEPA\n5th walk: \nANO POLI (OLD TOWN)\n9\n7\n7\n1\n2\n3\n8\n6\n5\n4\n10\n11 12\n13\n14\n15\n16\n17\n18\n19\n20\n19.2\n19.1\n19.3\n44.  \nThe bust \nof Vasilis \nTsitsanis has \nbeen placed \nin the square \nnamed after \nthe composer, \nin Ano Poli.\n45.  \nOne of the \nrefugee \nhouses built \nalong the line \nof the city walls \n(Ano Poli).', '44\n5th walk: \nANO POLI (OLD TOWN)\n6 \tTSITSANI SQUARE\nThis small square with beautiful,  \nwell-tended houses is located \nin between Moni Vlatadon and \nHosios David where you can go \nif you take Timotheou Street \n(notice the ottoman fountain) \nand Dimitriou Poliorkitou Street. \nIn the square centre you will see \nthe bust of V. Tsitsanis (1915 – \n1984) a leading Greek popular \ncomposer who lived and worked \nin the town during World War II.\n7 \tEPTAPYRGIOU STREET\nThis is one of the most \ninteresting roads of Ano Poli \nquarter. It follows the interior \nline of the northern city walls \nwhich used to be the ramparts \nof the Acropolis (see also p. – \nfor the city walls). It is worth \ntaking a walk from the corner \nof Eptapyrgiou and Palamidiou \nStreets (to the west) where \nthe 3rd Gate is - also known \nas “Eski Delik” – and head \nfor the main Gate. Besides the \ninteresting traditional buildings \nand the deserted Zihne Camii \n[Mosque] (1902) you will pass \nby the old refugee houses called \n“kastroplikta”; these were built \nalong the line of the city walls or \nadjoining them – as far back as \nthe early 1920’s. Similar houses \ncan be seen also on the eastern \nand western walls.', '43\n5th walk: \nANO POLI (OLD TOWN)\n2 \tTSINARI\nThis area was named after \nthe plane tree which was \nplanted there in the early 20th \nc. (çınar is turkish for plane \ntree). You can reach it through \nAl. Papadopoulou Street, one \nof Ano Poli’s hallmark areas \nas are Tsamadou, Sachtouri \nand Isminis Streets. In Isminis \nStreet you will find the House \nof Pontian Greeks. This is  \nAno Poli’s downtown spot \nand people who want to reach \nthe neighbouring Sykies \narea go through here. In the \ncentre, there is an ottoman \nfountain with a marble Roman \nsarcophagus; this is also \nwhere you will find the oldest \nrestaurant in town (open since \n1885), a café and small shops.\n3 \tTERPSITHEA SQUARE\nTake a good look at the \nremarkable listed buildings and \nthe more recent ones as you \nwalk along Pileos Street and \nhead for Terpsithea Square. \nThe buildings surrounding \nthe square are amazing and \noffer a wonderful view of the \ntown and the seafront; in the \ncentre there is a playground \nand a small open-air theatre. \nAnother impressive monument \nis the Tϋrbe (Tomb) of Musha  \nBaba (1543), one of the late  \nottoman monuments  \nof Thessaloniki, shaped  \nas an octagon with decorative \npointed frames on windows \nand a once lead-covered dome.', '49\n5th walk: \nANO POLI (OLD TOWN)\nThe quarter was created mainly \nto provide housing for the \nrefugees who settled there \nin the early 20th c.; however \ntraces of settlements exist \nwhich date as far back as the \n2nd c. AD. In the lush greenery \nof the Municipal Grove there \nis a Municipal Theatre, where \nmajor cultural events are held \nduring the summer months, \nand an open-air cinema. \nFurther south, on a low hill, you \nwill see the imposing church \nof Agioi Theodoroi, built on \nruins of a 7th c. Byzantine \nchurch, where the view of the \nentire city is amazing. In the \nneighbouring Elpidos Street \ntowards the city walls you will \nsee a group of refugee houses \n– the area is in the process of \nbeing changed into a “Cultural \nNeighbourhood”.\nHow to get there: To \nreach Sykees, you can either \nwalk from Ano Poli or take \nthe bus no. 23 (terminus at \nEleftherias sq.) and get off at \nAgios Charalampos stop.\n54\n53', 'It is about an excursion taken \nto the most interesting parts \nof the viticultural zone; this is \ncombined with a visit to the \narchaeological and historical \nassets of those areas, with \ncountryside activities, as \nwell as a visit to wineries \nand degustation. Make sure \nyou visit the impressive \nGerovassiliou Wine Museum  \nin Epanomi (see p. 68 & 80). \nFor more information, \ncontact the Wine Roads \nof North Greece: tel: 2310 \n281.617 and 2310 281.632, \nwww.winesofnorthgreece.gr\n121, 122 & \n123.  \nThessaloniki \noffers its little \nvisitors a host \nof fun activities \nand games to \nchoose from.\n121\n122']","['ANO POLI (OLD TOWN) 9 7 7 1 2 3 8 6 5 4 10 11 12 13 14 15 16 17 18 19 20 19.2 19.1 19.3 44. The bust of Vasilis Tsitsanis has been placed in the square named after the composer, in Ano Poli. 45. One of the refugee houses built along the line of the city walls (Ano Poli).']","The bust of Vasilis Tsitsanis is a notable landmark located in Tsitsani Square, situated in Ano Poli, the Old Town of Thessaloniki. Tsitsanis, a prominent Greek composer and musician, is celebrated for his contributions to Greek popular music, particularly during the tumultuous period of World War II. His works resonate deeply with the cultural heritage of Thessaloniki, making the bust a significant tribute to his legacy.

The square itself is characterized by its charming, well-maintained houses and serves as a peaceful spot for visitors to relax and soak in the local atmosphere. It is conveniently located between Moni Vlatadon and Hosios David, making it easily accessible for those exploring the area. The bust stands at the center of the square, inviting passersby to pause and reflect on Tsitsanis's impact on Greek music and culture.

Visiting the bust offers an opportunity to appreciate not only Tsitsanis's artistic contributions but also the historical context of the era in which he lived. The surrounding area features traditional architecture and an Ottoman fountain, enhancing the cultural experience. This makes it an ideal spot for photography, especially for those interested in capturing Instagrammable moments that reflect the rich history of Thessaloniki.

In addition to its artistic significance, Tsitsani Square is a gathering place for locals and tourists alike, fostering a sense of community and interaction. Engaging with the local culture here can provide insights into the city's vibrant musical heritage and the stories of its people. Overall, the bust of Vasilis Tsitsanis is not just a monument; it is a symbol of Thessaloniki's enduring spirit and a must-visit for anyone looking to connect with the city's cultural roots.","The bust of Vasilis Tsitsanis is located in the square named after the composer in Ano Poli. This placement highlights the cultural significance of Tsitsanis in the area, as he is a notable figure in Greek music history.",0.5,0.54,0.36666666666666664,0.8681799276342198,0.9999999999666667,0.99999999995,0.0,0.0,,0.7728649426051293
23,Who is Vasilis Tsitsanis?,"['DIMOKRATIAS\nVARDARI\nSQ.\nKYPRION\nAGONISTON\nSQ.\nARCHAIAS\nAG. SOFIAS\nAGORAS\nSQ.\nDIMITRION\nSQ.\nTERPSITHEA\nSQ.\nROMFEI\nSQ.\nSYNTRIVANIOU\nSQ.\nNAVARINOU\nSQ.\nSQ.\nSYKIES\nZIDROU\nSQ.\nLYSSIATREIO\n(SEICH SOU)\nAGIOS\nDIMITRIOS\nHOSPITAL\nGENERAL\nHOSPITAL\nOF THESSALONIKI\nG. GENNIMATAS\nUNIVERSITY\nGENERAL\nHOSPITAL\nOF THESSALONIKI\nAHEPA\n5th walk: \nANO POLI (OLD TOWN)\n9\n7\n7\n1\n2\n3\n8\n6\n5\n4\n10\n11 12\n13\n14\n15\n16\n17\n18\n19\n20\n19.2\n19.1\n19.3\n44.  \nThe bust \nof Vasilis \nTsitsanis has \nbeen placed \nin the square \nnamed after \nthe composer, \nin Ano Poli.\n45.  \nOne of the \nrefugee \nhouses built \nalong the line \nof the city walls \n(Ano Poli).', '44\n5th walk: \nANO POLI (OLD TOWN)\n6 \tTSITSANI SQUARE\nThis small square with beautiful,  \nwell-tended houses is located \nin between Moni Vlatadon and \nHosios David where you can go \nif you take Timotheou Street \n(notice the ottoman fountain) \nand Dimitriou Poliorkitou Street. \nIn the square centre you will see \nthe bust of V. Tsitsanis (1915 – \n1984) a leading Greek popular \ncomposer who lived and worked \nin the town during World War II.\n7 \tEPTAPYRGIOU STREET\nThis is one of the most \ninteresting roads of Ano Poli \nquarter. It follows the interior \nline of the northern city walls \nwhich used to be the ramparts \nof the Acropolis (see also p. – \nfor the city walls). It is worth \ntaking a walk from the corner \nof Eptapyrgiou and Palamidiou \nStreets (to the west) where \nthe 3rd Gate is - also known \nas “Eski Delik” – and head \nfor the main Gate. Besides the \ninteresting traditional buildings \nand the deserted Zihne Camii \n[Mosque] (1902) you will pass \nby the old refugee houses called \n“kastroplikta”; these were built \nalong the line of the city walls or \nadjoining them – as far back as \nthe early 1920’s. Similar houses \ncan be seen also on the eastern \nand western walls.', '42\nThessaloniki’s Old Town is \nfull of atmosphere. It covers \nthe area in between the city \nwalls (to the north and east) \nand Olympiados Street (to \nthe south), and has had the \nluck to remain untouched by \nthe 1917 great fire. It was \nvirtually uninhabited until \nthe mid-15th century, when \nit was conquered by the \nOttomans who selected it for \nsettlement on account of its \nfine climate, panoramic views \nand strategic position. The \ntwo and three-storey houses \nbear mixed Macedonian \nand Ottoman architectural \nelements (sachnisia) [Şahniş \nin turkish]; there are also \nresidences with neoclassical \nand eclectic style motifs \nwhere the Dönmeh lived, i.e. \nconverts to Islam who secretly \nremained Jews. After 1922 \nmany refugees settled in the \narea. Despite the construction \nof newer buildings and the \nopening up of new streets in \nrecent decades, it has kept \nits original town planning, to \na large extent, with narrow \nalleys and scant squares, as \nwell as its original architectural \nfeatures, particularly in the \nwest and east part of the town. \nThis particular atmosphere has \nlured intellects, artists \nand students who chose it  \nfor settlement in recent years.\n1\n\t \x07AGIA AIKATERINI \n[SAINT CATHERINE] \nCHURCH\n(see p.', '12)\n3.6  Panagia Lagoudiani \nChurch (Virgin Mary Guiding \nAll Men).\nThis small three-aisled \nByzantine basilica is located \non the outskirts of Ano Poli.  \nThis 14th c. monastery \nkatholikon [main church] \ntook its current shape in the \n19th c. It was named after \nLagoudatos, the man who \nfounded it, or –according  \nto another story- after a hare \n[Lagos in Greek – compare \nLagos with Lagoudiani] who \nled to the finding of the icon \nof Panagia. Odigitria (Virgin \nMary Guiding All Men) as \nwell as Saint Demetrius are \nhonoured as patron saints  \nof the city.\n3.7  Ataturk Museum.\nIt is adjacent to the building \nof the Turkish consulate (75, Ap. \nPavlou St.). This three-storey \nresidence was built in the late \n19th c. and it was the house  \nof Kemal Ataturk, born  \nin Thessaloniki (1880? - 1938). \nIn the yard, you will see  \na pomegranate tree his father  \nhad planted there. It is a building \nnow painted in its original colour \n- pink – and houses  \n40 & 41. \nKemal Atatϋrk’s \nhouse (left) \nis a museum \nnowadays and \nhouses an \natmospheric \ncafé (right).\n42. \nKaftanzogleio \nStadium is the \nlargest one in \nthe city.\n43.', 'The last part consists of \nwhat is believed to have \nbeen the tomb of Alexander \nIV, son of Alexander the \nGreat and Roxanne, who was \nassassinated by Cassander in \n310 BC; a silver urn containing \nthe bones of the dead person, \nframed with the ivory relief \nmotifs of the funeral bed. \nIn a separate room, visitors \ncan watch a video where M. \nAndronikos takes them on a \ntour of the monuments. Other \nexcavations in the wider area \nof the Aiges necropolis have \nunearthed archaic tombs, pit \nand cist tombs (6th and 5th c. \nBC), as well as temple-shaped \nmacedonian tombs one of \nwhich apparently belonged  \nto Queen Eurydice, the mother  \nof King Philip II\nPalace. It covers a 12,500 \nm2 area and it used to be \nthe largest and the most \nimportant construction (next \nto Parthenon, Athens) of the \nHellenic Classical Antiquity. \nThis two-storeyed edifice \nis presumed to be the work \nof Pytheos who was the \narchitect of the Mausoleum \nof Halicarnassos [modern-day \nBodrum, Turkey], one of the 7 \nwonders of the ancient world. \nThe palace’s architectural style \nis considered avant-garde for \nthat time and it was built of \nlimestone during the 2nd half \nof the 4th c. BC on a plateau; \n101, 102 & \n103.']","['ANO POLI (OLD TOWN) 9 7 7 1 2 3 8 6 5 4 10 11 12 13 14 15 16 17 18 19 20 19.2 19.1 19.3 44. The bust of Vasilis Tsitsanis has been placed in the square named after the composer, in Ano Poli. 45. One of the refugee houses built along the line of the city walls (Ano Poli).']","Vasilis Tsitsanis was a prominent Greek composer and musician, widely regarded as one of the most influential figures in the development of modern Greek music. Born in 1915 in the town of Trikala, he became a leading figure in the rebetiko genre, which is often described as the Greek equivalent of the blues, reflecting the struggles and experiences of the urban working class.

Tsitsanis's music is characterized by its emotional depth and lyrical storytelling, often addressing themes of love, loss, and social issues. He played a significant role in popularizing the bouzouki, a traditional Greek string instrument, and his compositions have left a lasting impact on Greek music culture. His work during World War II, particularly in Thessaloniki, where he lived and worked, further solidified his legacy.

In Ano Poli, Thessaloniki, a square is named after him, featuring a bust that commemorates his contributions to music. This area, rich in history and culture, is a great spot for visitors interested in exploring local heritage and enjoying the vibrant atmosphere of the old town. Tsitsanis's music continues to resonate with many, making him a beloved figure in Greece and among those who appreciate Greek culture. 

For a solo traveler interested in local experiences, visiting Tsitsani Square and learning about his life and music can provide a deeper understanding of Thessaloniki's cultural landscape. Engaging with locals about Tsitsanis's influence can also enhance your travel experience, offering insights into the city's artistic heritage.","Vasilis Tsitsanis is a composer, and a bust of him has been placed in the square named after him in Ano Poli.",1.0,0.21,0.27586206896551724,0.7624330022313508,0.99999999995,0.99999999995,0.0,0.0,,0.7794158632117946
24,Wha is the Vardariou Tower and where can I find it?,"['The road \ndistances (in km) where \nThessaloniki is the starting \npoint get calculated from  \nthis square.\n2 \t\n\x07AROUND DIMOKRATIAS \nSQUARE\nThere are mostly faceless \nbuildings in the area – \namong them you will find \nsmall manufactures or old \nindustries. However there are \nalso historic sites, as there \nare sections of the city’s west \nwalls here, Byzantine and \nottoman monuments and other \narchaeological sites (temple  \nof Aphrodite, 6th c. BC).\nMUST SEE:\n2.1  Railway Station.\nIt is on Monastiriou Street \nwhich is renamed at some \npoint Egnatia Street (see p. 34). \nConstruction began in 1939 \nand it became fully operational \nin 1951, but it was officially \n66.  \nVardariou \nTower (Top \nHane).\n67.  \nOld steam \nengine \nfronting \nThessaloniki’s \nRailway \nStation.', 'This is \nthe location of the double gate \nof Anna Palaiologina (the one \nlying west is also called Gate of \nAgioi Anargyroi), constructed by \nthe Byzantine empress in 1355, \nduring her stay in the city.\n12 \tTRIGONIOU TOWER\nAlso known as Alyseos [Chain] \nTower, this building stands \non the spot where the north \nand east walls meet. It was \nbuilt in the 16th c. possibly in \nthe place of an earlier tower \ndating to the Venetian period; \nthe White Tower (see p. 24), \nVardariou Tower (see p. 59) \nand Trigoniou Tower formed \npart of the construction works \ncompleted by the Turks for the \nfortification of Thessaloniki. \nKnown as Kastra [meaning \nTowers], this is a popular \nsightseeing area for locals and \nvisitors alike since the view of \nthe eastern walls as well as of \nthe entire city is breathtaking \nfrom this location.\n13 \t\x07MAIANDROUPOLEOS  \nSTREET\nCentral Maiandroupoleos \nStreet and El. Zografou Street \n48', '25\n3rd walk: \nHISTORIC CENTRE (2)\nMUSEUM AREA\nvarious names; in the 19th \nc. it was called Tower of the \nJanissaries or Blood Tower  \nas it served as jail for \nprisoners on death row \nwhose life was eventually \ntaken by the Janissaries on \nthe ramparts. In 1890 it was \npainted white thus acquiring \nits current name. A particularly \ninteresting exhibition is held \nin the Tower on the history \nof Thessaloniki (see p. 73); \nfrom the top of the Tower \nyou can enjoy the panoramic \nview. The small square around \nthe monument is one of the \nhotspots in town; this is where \nsmall boat bars leave for a \nshort run within the Thermaic \nGulf, serving coffee or a drink. \nOpposite lies the Park of the \nWhite Tower where you will \nfind the open air Municipal \nGarden Theatre,  \na bar, a playground and  \na skate spot.\n1.2  Royal [Vasiliko] \nTheatre.\nIt was built in 1940, got \nrenovated in 1996, and it has \na seating capacity of 800. \nThis is one of the winter halls \n(Melina Merkouri Hall) of the \nState Theatre of Northern \nGreece (S.T.N.G., see p. 110). \n1.3  Ethnikis Amynis \nStreet.\nIt leads from the White \nTower to Syntrivaniou Square \n(see p. 37) and to Agiou \nDimitriou Street (see p.', '44). During the Venetian Rule \n(1st half of the 15th c.) there \nwere efforts to boost it in the \nlight of the Turkish threat; this \nis why certain scholars support \nthat the Trigoniou Tower (see p. \n45) and the White Tower (see p. \n24) were built during that period. \nIn the following centuries, the \nTurks completed reinforcement \nworks in various places. The \nwall inscriptions describe the \ninterventions and restorations \nthat took place over time. The \nwalls followed the shape of an \nirregular trapezium and ended \nto the west in Vardariou Tower \n(see p. 59) and to the east in \nthe White Tower (see p. 24), \nreaching a total length of 7 km. \nAfter 1870, demolition of the \nseafront walls as well as of parts \nof the western and eastern walls \nbegan, in order to sanitise the \nplains and also to expand the \ncity. Today there are 3 remaining \nkm of city walls (mainly on Ano \nPoli, see p. 42); their height \nranges from 8.30 to 10.50 m. \nand their width may measure \nup to 4.50 m, making them \nan impressive monument and \none of great archaeological and \ncultural value.\n\t Note: To get a complete \npicture of the town’s Byzantine art \nmonuments make sure you visit  \nthe Museum of Byzantine Culture  \n(see p. 26 and p. 71).\n9.', '59\n7th walk: \nWEST OF THE CENTRE-STAVROUPOLI\ninaugurated in 1962 (S. Molfesis, \nTh. Papagiannis). Its exterior \nside combines modern and \nclassical elements with wings \nadded on the sides. It connects \nThessaloniki with the rest of \nGreece, the Balkans and Istanbul; \nit is also the bus terminus \ntowards most of the city areas. \nThis will be the location of the \nwest metro line terminus under \nconstruction in Thessaloniki.\n2.2  Old Railway Station.\nIt was built in 1894 near the \nharbour (Old Station Street) \nin the neoclassical style, \nand it gradually connected \nThessaloniki with Skopje, \nBelgrade, Monastir and \nConstantinople (modern-day \nIstanbul). Today it is exclusively \nused as a cargo train station. \nThis is where the German \noccupation forces mustered \nabout 50,000 Jewish residents, \nfrom March until August 1943, \nin order to send them by train \noff to concentration camps.\n2.3  Top Hane (Vardariou \nTower).\nSituated where the west \nand seafront city walls used \nto meet, this Tower was built \nby the Ottomans in 1546 and \nit was known as the Armoury \nTower. It is a six-sided, three-\nstorey and 10-metre high tower \nwhich used to be the main city \nstronghold.']","['MUST SEE: 2.1 Railway Station. It is on Monastiriou Street which is renamed at some point Egnatia Street (see p. 34). Construction began in 1939 and it became fully operational in 1951, but it was officially 66. Vardariou Tower (Top Hane). 67. Old steam engine fronting Thessaloniki’s Railway Station.']","Vardariou Tower, also known as Top Hane, is a historic Ottoman-era structure located in Thessaloniki. Built in 1546, this six-sided, three-storey tower stands approximately 10 meters high and was originally known as the Armoury Tower. It served as a significant stronghold for the city, situated at the junction where the west and seafront city walls once met.

You can find Vardariou Tower near the Old Railway Station, which is located on Old Station Street. The tower is part of the city's fortifications and offers a glimpse into Thessaloniki's rich history, particularly during the Ottoman period. The area surrounding the tower is also known for its scenic views, making it a great spot for photography, especially during the summer when the weather is pleasant.

Visiting Vardariou Tower is an excellent opportunity for sightseeing, as it is part of a larger historical context that includes other nearby landmarks such as the White Tower and Trigoniou Tower. The tower is easily accessible and is a popular destination for both locals and tourists, providing a chance to engage with the city's culture and history.

While exploring the area, you can also enjoy the vibrant atmosphere of Thessaloniki, with its mix of modern and historical elements. The tower's location makes it convenient for a leisurely weekend visit, allowing you to soak in the local culture and perhaps meet some locals who can share more about the city's heritage. Don't forget to capture some Instagram-worthy photos of the tower and its surroundings!","Vardariou Tower, also known as Top Hane, is located near Thessaloniki’s Railway Station. It is a notable landmark that is part of the area surrounding the station.",1.0,0.17,0.7931034482758621,0.8292029450255123,0.8874999999778125,0.6999999999766667,0.0,0.9999999975,,0.7959700747465014
25,What important thing happen in 1939 for Railway Station?,"['The road \ndistances (in km) where \nThessaloniki is the starting \npoint get calculated from  \nthis square.\n2 \t\n\x07AROUND DIMOKRATIAS \nSQUARE\nThere are mostly faceless \nbuildings in the area – \namong them you will find \nsmall manufactures or old \nindustries. However there are \nalso historic sites, as there \nare sections of the city’s west \nwalls here, Byzantine and \nottoman monuments and other \narchaeological sites (temple  \nof Aphrodite, 6th c. BC).\nMUST SEE:\n2.1  Railway Station.\nIt is on Monastiriou Street \nwhich is renamed at some \npoint Egnatia Street (see p. 34). \nConstruction began in 1939 \nand it became fully operational \nin 1951, but it was officially \n66.  \nVardariou \nTower (Top \nHane).\n67.  \nOld steam \nengine \nfronting \nThessaloniki’s \nRailway \nStation.', 'ARC\nAG\nDIMIT\nTERPSITHEA\nSQ.\nRAILWAY STATION\nSQ.\nOLD RAILWAY\nSTATION SQ.\nGALANOPOULOU\nSQ.\nSYKIES\nNEAPOLI\nAMPELOKIPOI\nMENEMENI\nMAKEDONOMACHON\nSQ.\nKARAOLI-DIMITRIOU SQ.\nELEFTHERIAS\nSQ.\nDROPOTAMOS\n7th walk: \nWEST OF THE CENTRE-STAVROUPOLI\n2\n3\n1\n4\n3.2\n2.2\n2.1\n4.1\n4.2\n4.3\n4.3\n4.4\n2.3\n2.4\n2.5\n2.8\n2.7 2.6\n3.1\n3.3\n1 \t\x07DIMOKRATIAS SQUARE \n(VARDARI)\nSince ancient times, this  \nhas been the most important \nentry point to Thessaloniki. \nThis relatively disadvantaged \narea is a transportation hub \nconnecting the west and \nnorthwest suburbs with the \ncity centre; there are also \nseveral hotels, small shops, \ntavernas and cafés in the \narea. In the centre of the \nsquare you will see the statue \nof King Constantine (1868-\n1923), who entered the \ncity in 1912 in his capacity \nas commander-in-chief of \nthe Greek Army. The road \ndistances (in km) where \nThessaloniki is the starting \npoint get calculated from  \nthis square.', 'It is a \nthree-aisled, timber-roofed \nbasilica with a narthex and a \ngallery. The nave is separated \nby the side aisles with \ncolonnades of Theodosian-\nstyle pillars and impost \ncapitals made of marble \nas is made the floor of the \nnave. The preserved mosaic \ndecorations date to the 5th \nc. whereas the murals on the \nsouth aisle date to the 13th \nc. After the city was captured \nby the Turks, this was the \nfirst church to be turned into \na mosque. In 1922-1923 it \nhoused refugees from Asia \nMinor and in 1939 Christian \nworship was once again \npracticed in it.\n4 \t\x07\nAGIA SOFIA CHURCH \n[or ΗAGIA SOPHIA]\nIt was built in the mid-7th c.  \non the ruins of a 5th c. basilica, \nas a copy of Hagia Sophia \n[Holy Wisdom of God] in \nConstantinople, and is one  \nof the most important early-\n3\n2', '69\nSUBURBS AND CITY OUTSKIRTS\n(1864); and a World War II \ngun emplacement. Further \nsouth there are salt marshes \nand a wetland where 178 \nbird species find refuge such \nas flamingoes, cormorants, \nherons, and black-headed \ngulls, to name but a few.\nHow to get there. Take \nthe 71 or 71A bus from \nthe Railway Station Stop. \nThe route goes through \nAngelochori and you will \nget off at the N. Michaniona \nterminus. Alternatively, bus \nlines 02 and 02A will get you \nto A.S. IKEA station where you \nwill board any of the 72, 72A \nor 72B bus for N. Michaniona. \nIf you go by car, follow Ethinikis \nAntistasis, Georgikis Scholis \nand Michanionas avenues.\n76\n78\n77', 'CHAPSA\nLIMNOU\nVALAORITI\nORPHANIDI\nTANTALIDI\nOLYMPIOU\nDIAMANTI\nKARATZA\nKREMASTIS\nPOLIORKITI\nSYNGROU\nNIKIS\nDISTRIOU\nTANTINIDI\nOLYTECHNIOU\nKONITSIS\nPARASKEVI\nAGIAS PARASKEVIS\nZOODOCHOS PIGI\nAGIOS DIMITRIOS\nRIGA FERAIOU\nA\nR\nC\nH\nA\nI\nO\nT\nI\nT\nO\nN\nS\nE\nL\nE\nF\nK\nI\nD\nO\nN\nPARASCHOU\nANAGENNISI\nRIGAS FERAIOS\nKALLITHEA\nAXIOS\nXIROKRINI\nRODOCHORI\nVOSPOROS\nIPOI\nTERPSITHEA\nEPTALOFOS\nKOLOKOTRONI\nTYROLOI\nJEWISH\nCEMETERY\nZEITENLIK\nCEMETERY\nCEMETERY\nVARNAS\nSQ.\nMOUSHOUNTI\nSQ.\nELEFTHERIAS\nSQ.\nEMPORIOU\nSQ.\nDIMOKRATIAS\nVARDARI\nSQ.\nKYPRION\nAGONISTON\nSQ.\nARC\nAG\nDIMIT\nTERPSITHEA\nSQ.\nRAILWAY STATION\nSQ.\nOLD RAILWAY\nSTATION SQ.\nGALANOPOULOU\nSQ.']","['MUST SEE: 2.1 Railway Station. It is on Monastiriou Street which is renamed at some point Egnatia Street (see p. 34). Construction began in 1939 and it became fully operational in 1951, but it was officially 66. Vardariou Tower (Top Hane). 67. Old steam engine fronting Thessaloniki’s Railway Station.']","In 1939, the construction of Thessaloniki's Railway Station began. This station is significant as it serves as a key transportation hub in the city, connecting various regions and facilitating travel for both locals and visitors. The station was designed to accommodate the growing needs of the city and its surrounding areas, reflecting the importance of rail travel during that period. 

Although the station became fully operational in 1951, its construction marked the beginning of a modern era for Thessaloniki's transportation infrastructure. The Railway Station is located on Monastiriou Street, which later becomes Egnatia Street, a major thoroughfare in the city. This location enhances its accessibility and importance as a central point for travelers.

The station not only serves practical purposes but also holds historical significance, as it has witnessed various events and changes in the city over the decades. It stands as a symbol of Thessaloniki's development and modernization, making it a noteworthy site for visitors interested in the city's history and architecture. 

For a first-time visitor, especially one interested in sightseeing and capturing Instagrammable moments, the Railway Station offers a glimpse into the city's past while serving as a gateway to explore Thessaloniki and its surroundings.",Construction of the Railway Station began in 1939.,1.0,0.29,0.2916666666666667,0.511250767990084,0.699999999965,0.9999999999,0.0,0.999999995,,0.4830882876016913
26,What significant event related to the Railway Station occurred in 1939?,"['The road \ndistances (in km) where \nThessaloniki is the starting \npoint get calculated from  \nthis square.\n2 \t\n\x07AROUND DIMOKRATIAS \nSQUARE\nThere are mostly faceless \nbuildings in the area – \namong them you will find \nsmall manufactures or old \nindustries. However there are \nalso historic sites, as there \nare sections of the city’s west \nwalls here, Byzantine and \nottoman monuments and other \narchaeological sites (temple  \nof Aphrodite, 6th c. BC).\nMUST SEE:\n2.1  Railway Station.\nIt is on Monastiriou Street \nwhich is renamed at some \npoint Egnatia Street (see p. 34). \nConstruction began in 1939 \nand it became fully operational \nin 1951, but it was officially \n66.  \nVardariou \nTower (Top \nHane).\n67.  \nOld steam \nengine \nfronting \nThessaloniki’s \nRailway \nStation.', 'ARC\nAG\nDIMIT\nTERPSITHEA\nSQ.\nRAILWAY STATION\nSQ.\nOLD RAILWAY\nSTATION SQ.\nGALANOPOULOU\nSQ.\nSYKIES\nNEAPOLI\nAMPELOKIPOI\nMENEMENI\nMAKEDONOMACHON\nSQ.\nKARAOLI-DIMITRIOU SQ.\nELEFTHERIAS\nSQ.\nDROPOTAMOS\n7th walk: \nWEST OF THE CENTRE-STAVROUPOLI\n2\n3\n1\n4\n3.2\n2.2\n2.1\n4.1\n4.2\n4.3\n4.3\n4.4\n2.3\n2.4\n2.5\n2.8\n2.7 2.6\n3.1\n3.3\n1 \t\x07DIMOKRATIAS SQUARE \n(VARDARI)\nSince ancient times, this  \nhas been the most important \nentry point to Thessaloniki. \nThis relatively disadvantaged \narea is a transportation hub \nconnecting the west and \nnorthwest suburbs with the \ncity centre; there are also \nseveral hotels, small shops, \ntavernas and cafés in the \narea. In the centre of the \nsquare you will see the statue \nof King Constantine (1868-\n1923), who entered the \ncity in 1912 in his capacity \nas commander-in-chief of \nthe Greek Army. The road \ndistances (in km) where \nThessaloniki is the starting \npoint get calculated from  \nthis square.', '64\nSUBURBS AND CITY OUTSKIRTS\nsituated nearby. The small \nmounds in the field are ancient \ntombs; a Neolithic settlement \nwas excavated in one of them \nwith a cemetery dating to the \nGeometric and Archaic period. \nAn impressive Macedonian \ntomb was also unearthed in \nAgios Athanasios area.\nHow to get there. Bus \nlines 40, 40A and 40K leave \nfor Kalochori from the Railway \nStation Stop. If you travel by \ncar, take the Athens direction \non the national road and turn \ntowards Kalochori.\n2 \tKALAMARIA\nThis is practically an eastward \n‘extension’ of Thessaloniki and \nthe city’s best known suburb, \nstretching along the waterfront, \nwith many green spaces and \na self-contained shopping \ncentre. The first inhabitants are \nrecorded in the early 20th c. and \nduring the 1920’s significant \nnumbers of Greek refugee \npopulations settled here and \nbuilt their small houses. They \ncame from Caucasus, Minor \nAsia and Pontus [modern- \nday northeast Turkey]. Today,  \ndespite the rising building trend  \nin the area, several refugee \nhouses remain, still keeping  \na flavour of times goneby.\nMUST SEΕ: \n2.1  Sofouli Street\n(see p. 53).\n2.2  Kyverneio [Government \nHouse] (Little Palace).', '69\nSUBURBS AND CITY OUTSKIRTS\n(1864); and a World War II \ngun emplacement. Further \nsouth there are salt marshes \nand a wetland where 178 \nbird species find refuge such \nas flamingoes, cormorants, \nherons, and black-headed \ngulls, to name but a few.\nHow to get there. Take \nthe 71 or 71A bus from \nthe Railway Station Stop. \nThe route goes through \nAngelochori and you will \nget off at the N. Michaniona \nterminus. Alternatively, bus \nlines 02 and 02A will get you \nto A.S. IKEA station where you \nwill board any of the 72, 72A \nor 72B bus for N. Michaniona. \nIf you go by car, follow Ethinikis \nAntistasis, Georgikis Scholis \nand Michanionas avenues.\n76\n78\n77', 'CHAPSA\nLIMNOU\nVALAORITI\nORPHANIDI\nTANTALIDI\nOLYMPIOU\nDIAMANTI\nKARATZA\nKREMASTIS\nPOLIORKITI\nSYNGROU\nNIKIS\nDISTRIOU\nTANTINIDI\nOLYTECHNIOU\nKONITSIS\nPARASKEVI\nAGIAS PARASKEVIS\nZOODOCHOS PIGI\nAGIOS DIMITRIOS\nRIGA FERAIOU\nA\nR\nC\nH\nA\nI\nO\nT\nI\nT\nO\nN\nS\nE\nL\nE\nF\nK\nI\nD\nO\nN\nPARASCHOU\nANAGENNISI\nRIGAS FERAIOS\nKALLITHEA\nAXIOS\nXIROKRINI\nRODOCHORI\nVOSPOROS\nIPOI\nTERPSITHEA\nEPTALOFOS\nKOLOKOTRONI\nTYROLOI\nJEWISH\nCEMETERY\nZEITENLIK\nCEMETERY\nCEMETERY\nVARNAS\nSQ.\nMOUSHOUNTI\nSQ.\nELEFTHERIAS\nSQ.\nEMPORIOU\nSQ.\nDIMOKRATIAS\nVARDARI\nSQ.\nKYPRION\nAGONISTON\nSQ.\nARC\nAG\nDIMIT\nTERPSITHEA\nSQ.\nRAILWAY STATION\nSQ.\nOLD RAILWAY\nSTATION SQ.\nGALANOPOULOU\nSQ.']","['MUST SEE: 2.1 Railway Station. It is on Monastiriou Street which is renamed at some point Egnatia Street (see p. 34). Construction began in 1939 and it became fully operational in 1951, but it was officially 66. Vardariou Tower (Top Hane). 67. Old steam engine fronting Thessaloniki’s Railway Station.']","The significant event related to the Railway Station in Thessaloniki that occurred in 1939 was the beginning of its construction. This project marked an important development in the city's transportation infrastructure. The Railway Station, located on Monastiriou Street, was designed to enhance connectivity and facilitate travel in and out of Thessaloniki. Although it became fully operational in 1951, the initiation of its construction in 1939 laid the groundwork for what would become a vital hub for both local and international travel.

The station's architecture reflects the historical and cultural significance of Thessaloniki, serving as a gateway for travelers and a symbol of the city's growth. It is situated in a bustling area that connects various neighborhoods, making it a convenient starting point for exploring the city. The Railway Station is not only functional but also a point of interest for visitors, offering a glimpse into the city's past and its evolution over the decades.

For a first-time visitor, especially one interested in sightseeing and capturing Instagrammable moments, the Railway Station presents an opportunity to appreciate both its historical context and architectural beauty. The surrounding area, including Monastiriou Street and nearby attractions, provides a rich experience of Thessaloniki's vibrant culture and history.","Construction of the Railway Station began in 1939, and it became fully operational in 1951.",1.0,0.5,0.2857142857142857,0.572593797686354,0.9999999999,0.9999999999,0.0,0.9999999966666667,,0.8204031136843778
27,What are some notable features of the Railway Station in Thessaloniki?,"['The road \ndistances (in km) where \nThessaloniki is the starting \npoint get calculated from  \nthis square.\n2 \t\n\x07AROUND DIMOKRATIAS \nSQUARE\nThere are mostly faceless \nbuildings in the area – \namong them you will find \nsmall manufactures or old \nindustries. However there are \nalso historic sites, as there \nare sections of the city’s west \nwalls here, Byzantine and \nottoman monuments and other \narchaeological sites (temple  \nof Aphrodite, 6th c. BC).\nMUST SEE:\n2.1  Railway Station.\nIt is on Monastiriou Street \nwhich is renamed at some \npoint Egnatia Street (see p. 34). \nConstruction began in 1939 \nand it became fully operational \nin 1951, but it was officially \n66.  \nVardariou \nTower (Top \nHane).\n67.  \nOld steam \nengine \nfronting \nThessaloniki’s \nRailway \nStation.', '59\n7th walk: \nWEST OF THE CENTRE-STAVROUPOLI\ninaugurated in 1962 (S. Molfesis, \nTh. Papagiannis). Its exterior \nside combines modern and \nclassical elements with wings \nadded on the sides. It connects \nThessaloniki with the rest of \nGreece, the Balkans and Istanbul; \nit is also the bus terminus \ntowards most of the city areas. \nThis will be the location of the \nwest metro line terminus under \nconstruction in Thessaloniki.\n2.2  Old Railway Station.\nIt was built in 1894 near the \nharbour (Old Station Street) \nin the neoclassical style, \nand it gradually connected \nThessaloniki with Skopje, \nBelgrade, Monastir and \nConstantinople (modern-day \nIstanbul). Today it is exclusively \nused as a cargo train station. \nThis is where the German \noccupation forces mustered \nabout 50,000 Jewish residents, \nfrom March until August 1943, \nin order to send them by train \noff to concentration camps.\n2.3  Top Hane (Vardariou \nTower).\nSituated where the west \nand seafront city walls used \nto meet, this Tower was built \nby the Ottomans in 1546 and \nit was known as the Armoury \nTower. It is a six-sided, three-\nstorey and 10-metre high tower \nwhich used to be the main city \nstronghold.', 'ARC\nAG\nDIMIT\nTERPSITHEA\nSQ.\nRAILWAY STATION\nSQ.\nOLD RAILWAY\nSTATION SQ.\nGALANOPOULOU\nSQ.\nSYKIES\nNEAPOLI\nAMPELOKIPOI\nMENEMENI\nMAKEDONOMACHON\nSQ.\nKARAOLI-DIMITRIOU SQ.\nELEFTHERIAS\nSQ.\nDROPOTAMOS\n7th walk: \nWEST OF THE CENTRE-STAVROUPOLI\n2\n3\n1\n4\n3.2\n2.2\n2.1\n4.1\n4.2\n4.3\n4.3\n4.4\n2.3\n2.4\n2.5\n2.8\n2.7 2.6\n3.1\n3.3\n1 \t\x07DIMOKRATIAS SQUARE \n(VARDARI)\nSince ancient times, this  \nhas been the most important \nentry point to Thessaloniki. \nThis relatively disadvantaged \narea is a transportation hub \nconnecting the west and \nnorthwest suburbs with the \ncity centre; there are also \nseveral hotels, small shops, \ntavernas and cafés in the \narea. In the centre of the \nsquare you will see the statue \nof King Constantine (1868-\n1923), who entered the \ncity in 1912 in his capacity \nas commander-in-chief of \nthe Greek Army. The road \ndistances (in km) where \nThessaloniki is the starting \npoint get calculated from  \nthis square.', 'ROMFEI\nSQ.\nRAILWAY STATION\nSQ.\nRAILWAY\nATION SQ.\nGALANOPOULOU\nSQ.\nSYNTRIVANIOU\nSQ.\nNAVARINOU\nSQ.\nSQ.\nSYKIES\nEAPOLI\nCHNI\nZIDROU\nSQ.\nLYSSIATREIO\nAGIOS\nDIMITRIOS\nHOSPITAL\nGENERAL\nHOSPITAL\nOF THESSALONIKI\nG. GENNIMATAS\nU\nG\nO\nA\n1\n2\n3\n4\n5\n7\n6\n8\n9\n12\n15\n15\n15\n15\n13\n14\n10\n11\n2. \nSouthern view \nof Panagia \nChalkeon \nChurch.\n3. \nAgia Sofia \nChurch \nsurrounded \nby a small \ngarden.', '69\nSUBURBS AND CITY OUTSKIRTS\n(1864); and a World War II \ngun emplacement. Further \nsouth there are salt marshes \nand a wetland where 178 \nbird species find refuge such \nas flamingoes, cormorants, \nherons, and black-headed \ngulls, to name but a few.\nHow to get there. Take \nthe 71 or 71A bus from \nthe Railway Station Stop. \nThe route goes through \nAngelochori and you will \nget off at the N. Michaniona \nterminus. Alternatively, bus \nlines 02 and 02A will get you \nto A.S. IKEA station where you \nwill board any of the 72, 72A \nor 72B bus for N. Michaniona. \nIf you go by car, follow Ethinikis \nAntistasis, Georgikis Scholis \nand Michanionas avenues.\n76\n78\n77']","['MUST SEE: 2.1 Railway Station. It is on Monastiriou Street which is renamed at some point Egnatia Street (see p. 34). Construction began in 1939 and it became fully operational in 1951, but it was officially 66. Vardariou Tower (Top Hane). 67. Old steam engine fronting Thessaloniki’s Railway Station.']","The Railway Station in Thessaloniki, inaugurated in 1962, is a significant transportation hub that connects the city with various destinations across Greece, the Balkans, and Istanbul. Its exterior showcases a blend of modern and classical architectural elements, making it visually appealing for photography enthusiasts.

Originally built in 1894 near the harbor, the Old Railway Station, located on Old Station Street, features neoclassical design and played a crucial role in connecting Thessaloniki with cities like Skopje, Belgrade, Monastir, and Constantinople (now Istanbul). Although it is now primarily a cargo station, its historical significance is profound, as it was a site where approximately 50,000 Jewish residents were gathered during World War II before being deported to concentration camps.

Nearby, the Vardariou Tower, also known as Top Hane, is a notable landmark situated where the city’s west and seafront walls once met. Built by the Ottomans in 1546, this six-sided, three-storey tower served as a stronghold and adds to the historical ambiance of the area.

For those interested in local culture, the Railway Station area is bustling with activity, featuring small shops, tavernas, and cafés, providing opportunities for interaction with locals. The station is also a starting point for various bus routes, making it convenient for exploring the city and its surroundings.

Overall, the Railway Station and its vicinity offer a mix of historical significance, architectural beauty, and vibrant local culture, making it a must-visit spot for anyone looking to experience Thessaloniki.","The Railway Station in Thessaloniki, located on Monastiriou Street (which was renamed Egnatia Street), began construction in 1939 and became fully operational in 1951. Notable features include the old steam engine that is situated in front of the station and the Vardariou Tower, also known as Top Hane.",1.0,0.24,0.7307692307692307,0.8081291426199522,0.6791666666496875,0.9999999999,0.0,0.8888888879012344,,0.8934400866217999
28,Can you tell me how to get to the central square from the seafront using I. Passalidis Street?,"['65\nSUBURBS AND CITY OUTSKIRTS\n2.4  Aretsou – Krini.\nThese two most popular \nareas of Kalamaria stretch \nalong the seafront. The \nfacilities of the local marine \nsports club are here, next to \nAretsou-Krini beach; there is \nalso an open air cinema and a \nmarina (the only one in town) \nwith a 242-berth capacity \n(there are power, water and \ntelephone services). The \nwaterfront N. Plastira Street  \nis lined with café-bars and \nfish tavernas which get filled \nto capacity all year round.\n2.5  Komninon Street.\nThe longest part of the \ntown’s main street is for \npedestrian use only and you \nwill find shops, cafés, small \nbars and restaurants along \nthe way. This is also where \nyou will find the area’s central \nsquare where the Town \nHall and the church of the \nTransfiguration of Christ are. \nFrom the direction of the \nseafront, you can reach the \narea via I. Passalidis Street. \nHow to get there. Bus \nlines 5 and 5A leave from \nEleftherias square. Get off at \nNaftikos Omilos [Marine Club] \nstop or at Chamodrakas stop \nin Aretsou area.', '88\nDAY EXCURSIONS\nJewish quarter in Europe, \nwhich maintains a traditional \ncharacter in its entirety. It \nis worth taking a walk and \nvisiting the Roman, Ottoman \nand Industrial age monuments \nin the traditional districts of \nKyriotissa, Panagia Dexia, and \nMakariotissa; you can also visit \nthe Public Central Library which \nhas earned an international \naward, or relax in the parks  \nand squares.\nHow to get there.  \nVergina is about 63 km SW  \nof Thessaloniki. If you travel by \ncar, follow the signs to Veroia \nand after that to Vergina. You \ncan also take the intercity bus \nor the train to reach Veroia  \nand then take the local bus  \nto Vergina.\n3 \tDION\nThis most enchanting \narchaeological site is  \nlocated under the imposing \nOlympus mountain range, in  \na 150-hectare green area amid \nflowing waters coming from \nVafyras River and from other \nsprings; it is the habitat of \nmany species of birds, reptiles \nand amphibians. This used to \nbe a sacred place to ancient \nMacedonians who worshipped \nOlympian Zeus and the Muses \n[daughters of Zeus] here.', 'In the \nneighbouring Xylokeratia \nvillage you can visit the first \nMud-therapy (Spa) Centre \nin the Balkans. There are \nswimming pools for men \nand women, 10 personal \nhydromassage areas where \nmineral spring water is used, \nsaunas, a gym and areas \nfor mud treatment. In the \nsummer, visitors can enjoy \na special mud therapy by \nthe lake shore which gets \nusually dried up during the \nwarmest season of the year. \nIn the grounds you will find \na physiotherapy centre and \na medical clinic, a hotel, a \nrestaurant, a bar, basketball \nand football fields.\nHow to get there. \nPikrolimni is located 23 \nkm N of Thessaloniki. If \nyou travel by car, follow the \nsigns to Kilkis and after that, \nfrom Galliko village head \nfor Xylokeratia (Pikrolimni). \nAlternatively there is a bus \nfrom Dimokratias square \n(Vardari) leaving daily at 9 am, \nwhich will take you to the Mud \nTherapy Centre for free.\nDAY EXCURSIONS\n114', 'The area was inhabited \nfor the first time in 1923 \nwhen refugees from Minor \nAsia settled here. Until then \nPeraia was the property of a \nTurkish Bey [a dignitary], Neoi \nEpivates was a Turkish estate \n(Bahçe Çiflik in Turkish) and \nAgia Triada was called White \nFountain. Today, these areas \nhave evolved into suburbs \nand seaside resorts. Along \nthe entire waterfront you will \nfind beaches, awarded the \nBlue Flag for beach quality, \nwith facilities for water \nsports, beach volleyball and \nso on. There are fish tavernas, \ncafés and bars bordering \nthe seafront pedestrian way, \noffering a fine seaview.\nHow to get there. You  \ncan take the buses Nos. 71 \nand 71A for N. Michaniona \nfrom the Railway Station Stop \nin July and August (get off at  \nany stop from Paralia Peraias  \nto Agia Triada). Throughout  \nthe year, bus lines 02 and  \n02A will get you to A.S. IKEA  \nstation where you can board  \nany one of the 72, 72A, 72B  \n74', '49\n5th walk: \nANO POLI (OLD TOWN)\nThe quarter was created mainly \nto provide housing for the \nrefugees who settled there \nin the early 20th c.; however \ntraces of settlements exist \nwhich date as far back as the \n2nd c. AD. In the lush greenery \nof the Municipal Grove there \nis a Municipal Theatre, where \nmajor cultural events are held \nduring the summer months, \nand an open-air cinema. \nFurther south, on a low hill, you \nwill see the imposing church \nof Agioi Theodoroi, built on \nruins of a 7th c. Byzantine \nchurch, where the view of the \nentire city is amazing. In the \nneighbouring Elpidos Street \ntowards the city walls you will \nsee a group of refugee houses \n– the area is in the process of \nbeing changed into a “Cultural \nNeighbourhood”.\nHow to get there: To \nreach Sykees, you can either \nwalk from Ano Poli or take \nthe bus no. 23 (terminus at \nEleftherias sq.) and get off at \nAgios Charalampos stop.\n54\n53']","['65 SUBURBS AND CITY OUTSKIRTS 2.4 Aretsou – Krini. These two most popular areas of Kalamaria stretch along the seafront. The facilities of the local marine sports club are here, next to Aretsou-Krini beach; there is also an open air cinema and a marina (the only one in town) with a 242-berth capacity (there are power, water and telephone services). The waterfront N. Plastira Street is lined with café-bars and fish tavernas which get filled to capacity all year round. 2.5 Komninon Street. The longest part of the town’s main street is for pedestrian use only and you will find shops, cafés, small bars and restaurants along the way. This is also where you will find the area’s central square where the Town Hall and the church of the Transfiguration of Christ are. From the direction of the seafront, you can reach the area via I. Passalidis Street. How to get there. Bus lines 5 and 5A leave from Eleftherias square. Get off at Naftikos Omilos [Marine Club] stop or at Chamodrakas stop in Aretsou area. 3']","To reach the central square from the seafront using I. Passalidis Street, follow these simple directions:

1. **Start at the Seafront**: Begin your journey at the waterfront area near the beach, specifically around Aretsou-Krini.

2. **Locate I. Passalidis Street**: Head towards I. Passalidis Street, which is accessible from the seafront. This street will lead you inland.

3. **Walk Along I. Passalidis Street**: Continue walking along I. Passalidis Street. This street is well-marked and pedestrian-friendly, making it easy to navigate.

4. **Reach Komninon Street**: As you walk, you will eventually reach the intersection with Komninon Street. This area is lively, with shops, cafés, and bars lining the street.

5. **Proceed to the Central Square**: From Komninon Street, continue towards the central square. You will find the Town Hall and the church of the Transfiguration of Christ in this area, which is the heart of the town.

6. **Enjoy the Surroundings**: The central square is a great spot to relax, take photos, and enjoy the local atmosphere. There are plenty of cafés and shops where you can interact with locals and experience the culture.

**Transportation Option**: If you prefer not to walk, you can take bus lines 5 or 5A from Eleftherias Square, which will drop you off near the central square. However, walking allows you to soak in the sights and sounds of the area.

This route is straightforward and offers a chance to enjoy the vibrant local scene along the way. Enjoy your visit!","To reach the central square from the seafront via I. Passalidis Street, you can take bus lines 5 and 5A that leave from Eleftherias square. You should get off at either the Naftikos Omilos [Marine Club] stop or at the Chamodrakas stop in the Aretsou area.",1.0,0.17,0.5555555555555556,0.7489858881908522,0.9999999999,0.9999999999,1.0,0.49999999937499995,,0.9673727754686707
29,How I can go to the central square from Eleftherias square?,"['65\nSUBURBS AND CITY OUTSKIRTS\n2.4  Aretsou – Krini.\nThese two most popular \nareas of Kalamaria stretch \nalong the seafront. The \nfacilities of the local marine \nsports club are here, next to \nAretsou-Krini beach; there is \nalso an open air cinema and a \nmarina (the only one in town) \nwith a 242-berth capacity \n(there are power, water and \ntelephone services). The \nwaterfront N. Plastira Street  \nis lined with café-bars and \nfish tavernas which get filled \nto capacity all year round.\n2.5  Komninon Street.\nThe longest part of the \ntown’s main street is for \npedestrian use only and you \nwill find shops, cafés, small \nbars and restaurants along \nthe way. This is also where \nyou will find the area’s central \nsquare where the Town \nHall and the church of the \nTransfiguration of Christ are. \nFrom the direction of the \nseafront, you can reach the \narea via I. Passalidis Street. \nHow to get there. Bus \nlines 5 and 5A leave from \nEleftherias square. Get off at \nNaftikos Omilos [Marine Club] \nstop or at Chamodrakas stop \nin Aretsou area.', '88\nDAY EXCURSIONS\nJewish quarter in Europe, \nwhich maintains a traditional \ncharacter in its entirety. It \nis worth taking a walk and \nvisiting the Roman, Ottoman \nand Industrial age monuments \nin the traditional districts of \nKyriotissa, Panagia Dexia, and \nMakariotissa; you can also visit \nthe Public Central Library which \nhas earned an international \naward, or relax in the parks  \nand squares.\nHow to get there.  \nVergina is about 63 km SW  \nof Thessaloniki. If you travel by \ncar, follow the signs to Veroia \nand after that to Vergina. You \ncan also take the intercity bus \nor the train to reach Veroia  \nand then take the local bus  \nto Vergina.\n3 \tDION\nThis most enchanting \narchaeological site is  \nlocated under the imposing \nOlympus mountain range, in  \na 150-hectare green area amid \nflowing waters coming from \nVafyras River and from other \nsprings; it is the habitat of \nmany species of birds, reptiles \nand amphibians. This used to \nbe a sacred place to ancient \nMacedonians who worshipped \nOlympian Zeus and the Muses \n[daughters of Zeus] here.', 'SMYRNIS\nMITR. IOSIF\nFOKA\nPANAGIA\nS\nE\nL\nE\nF\nK\nI\nD\nO\nN\nPROX.\nKOROMILA\nI\nFANARIOTON\nSQ.\nELEFTHERIAS\nSQ.\nEMPORIOU\nSQ.\nKYPRION\nAGONISTON\nSQ.\nARCHAIAS\nAG. SOFIAS\nAGORAS\nSQ.\nSYNTRIVAN\nSQ.\nNAVARINOU\nSQ.\nSQ.\n1\n\t\n\x07ARISTOTELOUS \nSQUARE\nThessaloniki’s central square \nis one of the largest and most \nimpressive in Greece, and  \na bustling place twenty four \nhours a day. It is one of the \nfew sections of the Hébrard \nCommittee urban plan, which \ncame to be realised after the \n1917 fire, although it became \nfully shaped in as late as the \nearly 1960s. It is a square \non the seafront, with a 100 \nm. opening, that affords an \namazing view of the Thermaic \nGulf and the Olympus massif. \nThe monumental style of \narchitecture is shown in the \nbuildings’ facades, colonnades, \narcades and porticos, which \ncombine elements from the \ncity’s Byzantine tradition \nwith European interwar \nperiod motifs.', '44\n5th walk: \nANO POLI (OLD TOWN)\n6 \tTSITSANI SQUARE\nThis small square with beautiful,  \nwell-tended houses is located \nin between Moni Vlatadon and \nHosios David where you can go \nif you take Timotheou Street \n(notice the ottoman fountain) \nand Dimitriou Poliorkitou Street. \nIn the square centre you will see \nthe bust of V. Tsitsanis (1915 – \n1984) a leading Greek popular \ncomposer who lived and worked \nin the town during World War II.\n7 \tEPTAPYRGIOU STREET\nThis is one of the most \ninteresting roads of Ano Poli \nquarter. It follows the interior \nline of the northern city walls \nwhich used to be the ramparts \nof the Acropolis (see also p. – \nfor the city walls). It is worth \ntaking a walk from the corner \nof Eptapyrgiou and Palamidiou \nStreets (to the west) where \nthe 3rd Gate is - also known \nas “Eski Delik” – and head \nfor the main Gate. Besides the \ninteresting traditional buildings \nand the deserted Zihne Camii \n[Mosque] (1902) you will pass \nby the old refugee houses called \n“kastroplikta”; these were built \nalong the line of the city walls or \nadjoining them – as far back as \nthe early 1920’s. Similar houses \ncan be seen also on the eastern \nand western walls.', '43\n5th walk: \nANO POLI (OLD TOWN)\n2 \tTSINARI\nThis area was named after \nthe plane tree which was \nplanted there in the early 20th \nc. (çınar is turkish for plane \ntree). You can reach it through \nAl. Papadopoulou Street, one \nof Ano Poli’s hallmark areas \nas are Tsamadou, Sachtouri \nand Isminis Streets. In Isminis \nStreet you will find the House \nof Pontian Greeks. This is  \nAno Poli’s downtown spot \nand people who want to reach \nthe neighbouring Sykies \narea go through here. In the \ncentre, there is an ottoman \nfountain with a marble Roman \nsarcophagus; this is also \nwhere you will find the oldest \nrestaurant in town (open since \n1885), a café and small shops.\n3 \tTERPSITHEA SQUARE\nTake a good look at the \nremarkable listed buildings and \nthe more recent ones as you \nwalk along Pileos Street and \nhead for Terpsithea Square. \nThe buildings surrounding \nthe square are amazing and \noffer a wonderful view of the \ntown and the seafront; in the \ncentre there is a playground \nand a small open-air theatre. \nAnother impressive monument \nis the Tϋrbe (Tomb) of Musha  \nBaba (1543), one of the late  \nottoman monuments  \nof Thessaloniki, shaped  \nas an octagon with decorative \npointed frames on windows \nand a once lead-covered dome.']","['65 SUBURBS AND CITY OUTSKIRTS 2.4 Aretsou – Krini. These two most popular areas of Kalamaria stretch along the seafront. The facilities of the local marine sports club are here, next to Aretsou-Krini beach; there is also an open air cinema and a marina (the only one in town) with a 242-berth capacity (there are power, water and telephone services). The waterfront N. Plastira Street is lined with café-bars and fish tavernas which get filled to capacity all year round. 2.5 Komninon Street. The longest part of the town’s main street is for pedestrian use only and you will find shops, cafés, small bars and restaurants along the way. This is also where you will find the area’s central square where the Town Hall and the church of the Transfiguration of Christ are. From the direction of the seafront, you can reach the area via I. Passalidis Street. How to get there. Bus lines 5 and 5A leave from Eleftherias square. Get off at Naftikos Omilos [Marine Club] stop or at Chamodrakas stop in Aretsou area. 3']","To get to Aristotelous Square, the central square of Thessaloniki, from Eleftherias Square, you have a couple of convenient options. 

1. **Walking**: The distance between Eleftherias Square and Aristotelous Square is approximately 1.5 kilometers, making it a pleasant walk. Head northwest from Eleftherias Square along Egnatia Street, which is a main thoroughfare. Continue straight until you reach the intersection with Aristotelous Square. This route will take you through the vibrant city center, allowing you to enjoy the local atmosphere, shops, and cafés along the way.

2. **Public Transport**: If you prefer not to walk, you can take a bus. Look for bus lines that stop at Eleftherias Square and head towards the city center. Buses are frequent, and you can ask locals for the best line to take. Make sure to get off at a stop near Aristotelous Square, such as the one at the intersection of Egnatia and Aristotelous.

3. **Taxi or Ride-Sharing**: For a more comfortable option, consider taking a taxi or using a ride-sharing app. This will provide a direct and quick route to Aristotelous Square, especially if you’re carrying luggage or prefer not to walk.

Once you arrive at Aristotelous Square, you’ll find it to be a bustling hub with stunning views of the Thermaic Gulf and the surrounding architecture, perfect for capturing Instagrammable moments. Enjoy your time exploring the square and the nearby attractions!",You can take bus lines 5 and 5A from Eleftherias square. Get off at Naftikos Omilos [Marine Club] stop or at Chamodrakas stop in Aretsou area to reach the central square.,1.0,0.0,0.23809523809523808,0.646400884826174,0.8333333332916666,0.9999999999,1.0,0.37499999953124996,,0.7641654944326471
30,What can you tell me about the Naftikos Omilos area in Kalamaria?,"['65\nSUBURBS AND CITY OUTSKIRTS\n2.4  Aretsou – Krini.\nThese two most popular \nareas of Kalamaria stretch \nalong the seafront. The \nfacilities of the local marine \nsports club are here, next to \nAretsou-Krini beach; there is \nalso an open air cinema and a \nmarina (the only one in town) \nwith a 242-berth capacity \n(there are power, water and \ntelephone services). The \nwaterfront N. Plastira Street  \nis lined with café-bars and \nfish tavernas which get filled \nto capacity all year round.\n2.5  Komninon Street.\nThe longest part of the \ntown’s main street is for \npedestrian use only and you \nwill find shops, cafés, small \nbars and restaurants along \nthe way. This is also where \nyou will find the area’s central \nsquare where the Town \nHall and the church of the \nTransfiguration of Christ are. \nFrom the direction of the \nseafront, you can reach the \narea via I. Passalidis Street. \nHow to get there. Bus \nlines 5 and 5A leave from \nEleftherias square. Get off at \nNaftikos Omilos [Marine Club] \nstop or at Chamodrakas stop \nin Aretsou area.', 'Get off at \nNaftikos Omilos [Marine Club] \nstop or at Chamodrakas stop \nin Aretsou area.\n3 \tPANORAMA\nOne of the best suburbs of \nThessaloniki is situated at  \na 12 km distance S of the \ncity centre and was built on \nthe slope of Mt Chortiatis, \noffering a panoramic city view. \nIt was uninhabited until the \nearly 20th c., although traces \nof a prehistoric settlement \nhave been located on the area. \nThe first inhabitants were \nrefugees from Asia Minor and \nPontus. Today its largest part \nis covered by luxury villas and \nimpressive detached homes; \nthere is a small shopping \narea in the centre. Trigona \nPanoramatos [a cream puff \npastry] – one of the city’s best \nknown sweet delicacies – were \ncreated at a local confectionery \nin the 1950’s.\nMUST SEE:\nPlatanakia.\nIt is a nice place for relaxing, \nin a wooded ravine, with a \nsmall Zoo and a café. A 6 km \npath begins here and leads \nup to the artificial lake (dam) \nof Thermi. Along the way you \nwill come across spots for a \nbrief rest, short waterfalls and \nfragments of eight Byzantine \nwatermills.', '105\nHellenic Professional Yacht \nOwners Association:  \nMarina Zeas  \n(Administration Building), \n185 36 – Piraeus\ntel.: 210 45.26.335\nfax: 210 42.80.465\nwebsite: www.hpyoa.gr\nMARINA\nThe Thessaloniki Marina is \nlocated in Aretsou Kalamaria, \ntel.: \x072310 444.598,  \n2310 444.541  \n(Port Authority)\nfax: 2310 444.585 \nVHF: Channel 9 (24-hour service) \nwebsite:  \nwww.thessaloniki-marina.gr\nBEACHES\nGo for a swim in Aretsou beach \n(Kalamaria, see p. 64) and \nthe nearby beaches of Peraia, \nNeoi Epivates, Agia Triada (see \np. 67) or in Nea Michaniona, \nAngelochori (see p. 68) and the \nbeaches in Epanomi (see p. 68). \nA bit farther away, you can try the \nbeaches in Asprovalta area, Nea \nVrasna and Stavros (see p. 94). \nAt a 60 – 90 min. distance from \nthe city you will reach the very \npopular and absolutely beautiful \nbeaches of Halkidiki (see p. 92).\nMINERAL SPRINGS – SPAS\nLagkadas Spa: \nLocation: Lagkadas, Thessaloniki \ntel.', '98\nNIGHTLIFE\nfacilities. During the summer \nmonths though, most of \nthose clubs and venues move \nto open-air grounds in the \nairport area (see p. 106). \nAnother favourite area to \nThessalonians is Kalamaria \n(see p. 64) and, a bit further \noff, Peraia (see p. 67).   \nApart from the \nentertainment options, \na host of artistic events \nget organised in the city \nthroughout the entire \nyear: choose among the \nThessaloniki Concert Hall \n[Megaro] (see p. 52), the \nVasiliko [Royal] Theatre  \n(see p. 25), the Theatre of \nthe Society for Macedonian \nStudies (see p. 25 & 109), \nMoni Lazariston (see p. 61),  \nthe Forest Theatre [Theatro \nDasous] and the Theatre  \nof the Earth [Theatro Gis] \n(see p. 48); or you can opt for a \nvisit to museums (see p. 70-81) \nand smaller cultural venues. Last \nbut not least, you can visit the \nInternational Film Festival, \nthe Thessaloniki Book Fair, the \nDemetria Festival (see p. 108-\n109), and other venues housing \nevents on a smaller scale by  \nprivate companies or city \nagencies.\nFinally, the Thessaloniki \nRegency Casino is located \nat the 12th km on the \nThessaloniki – Airport Road \nand is open around the clock.', '88\nDAY EXCURSIONS\nJewish quarter in Europe, \nwhich maintains a traditional \ncharacter in its entirety. It \nis worth taking a walk and \nvisiting the Roman, Ottoman \nand Industrial age monuments \nin the traditional districts of \nKyriotissa, Panagia Dexia, and \nMakariotissa; you can also visit \nthe Public Central Library which \nhas earned an international \naward, or relax in the parks  \nand squares.\nHow to get there.  \nVergina is about 63 km SW  \nof Thessaloniki. If you travel by \ncar, follow the signs to Veroia \nand after that to Vergina. You \ncan also take the intercity bus \nor the train to reach Veroia  \nand then take the local bus  \nto Vergina.\n3 \tDION\nThis most enchanting \narchaeological site is  \nlocated under the imposing \nOlympus mountain range, in  \na 150-hectare green area amid \nflowing waters coming from \nVafyras River and from other \nsprings; it is the habitat of \nmany species of birds, reptiles \nand amphibians. This used to \nbe a sacred place to ancient \nMacedonians who worshipped \nOlympian Zeus and the Muses \n[daughters of Zeus] here.']","['65 SUBURBS AND CITY OUTSKIRTS 2.4 Aretsou – Krini. These two most popular areas of Kalamaria stretch along the seafront. The facilities of the local marine sports club are here, next to Aretsou-Krini beach; there is also an open air cinema and a marina (the only one in town) with a 242-berth capacity (there are power, water and telephone services). The waterfront N. Plastira Street is lined with café-bars and fish tavernas which get filled to capacity all year round. 2.5 Komninon Street. The longest part of the town’s main street is for pedestrian use only and you will find shops, cafés, small bars and restaurants along the way. This is also where you will find the area’s central square where the Town Hall and the church of the Transfiguration of Christ are. From the direction of the seafront, you can reach the area via I. Passalidis Street. How to get there. Bus lines 5 and 5A leave from Eleftherias square. Get off at Naftikos Omilos [Marine Club] stop or at Chamodrakas stop in Aretsou area. 3']","Naftikos Omilos, also known as the Marine Club, is a vibrant area located in Kalamaria, Thessaloniki, perfect for a leisurely weekend visit. This seaside neighborhood offers a blend of relaxation and local culture, making it an ideal spot for solo travelers seeking familiar experiences.

The area is known for its picturesque waterfront along N. Plastira Street, which is lined with charming café-bars and traditional fish tavernas. These establishments are popular year-round, providing a great opportunity to enjoy local cuisine while soaking in the lively atmosphere. The open-air cinema nearby adds a unique touch to the area, especially during the summer months.

For those interested in marine activities, the local marine sports club and marina are key attractions. The marina, the only one in Thessaloniki, has a 242-berth capacity and offers various services, making it a hub for boating enthusiasts. You can take a leisurely stroll along the waterfront, enjoying the views of the sea and the surrounding landscape.

Accessing Naftikos Omilos is convenient, with bus lines 5 and 5A departing from Eleftherias Square. You can easily get off at the Marine Club stop or the Chamodrakas stop, both of which are close to the main attractions in the area.

In addition to its scenic beauty, Naftikos Omilos is a great place to meet locals and engage with the community. The friendly atmosphere and the presence of various shops and cafés encourage interaction, making it easy to connect with residents and other visitors.

Overall, Naftikos Omilos in Kalamaria offers a delightful mix of leisure, local culture, and scenic beauty, making it a must-visit destination for anyone looking to experience Thessaloniki's coastal charm.","Naftikos Omilos is a stop in the Aretsou area of Kalamaria, which is known for its local marine sports club located next to Aretsou-Krini beach. This area features a marina with a 242-berth capacity and offers power, water, and telephone services. The waterfront N. Plastira Street is lined with café-bars and fish tavernas, making it a popular spot throughout the year.",1.0,0.81,0.36666666666666664,0.7632912859127526,0.99999999995,0.8333333332916666,1.0,0.4444444439506172,,0.8612033329264733
31,Where is the Town Hall located in Kalamaria?,"['65\nSUBURBS AND CITY OUTSKIRTS\n2.4  Aretsou – Krini.\nThese two most popular \nareas of Kalamaria stretch \nalong the seafront. The \nfacilities of the local marine \nsports club are here, next to \nAretsou-Krini beach; there is \nalso an open air cinema and a \nmarina (the only one in town) \nwith a 242-berth capacity \n(there are power, water and \ntelephone services). The \nwaterfront N. Plastira Street  \nis lined with café-bars and \nfish tavernas which get filled \nto capacity all year round.\n2.5  Komninon Street.\nThe longest part of the \ntown’s main street is for \npedestrian use only and you \nwill find shops, cafés, small \nbars and restaurants along \nthe way. This is also where \nyou will find the area’s central \nsquare where the Town \nHall and the church of the \nTransfiguration of Christ are. \nFrom the direction of the \nseafront, you can reach the \narea via I. Passalidis Street. \nHow to get there. Bus \nlines 5 and 5A leave from \nEleftherias square. Get off at \nNaftikos Omilos [Marine Club] \nstop or at Chamodrakas stop \nin Aretsou area.', 'This is also the location of the \nNautical Club of Thessaloniki.\n1.6  Thessaloniki Concert \nHall.\nIt was inaugurated in 2000 on \na privileged location. The town’s \nByzantine history was the source \nof inspiration for its architectural \nplanning and it is one of the \nbest equipped concert halls in \nEurope. The facilities include a \nhall providing seating for 1464 \nwhere concerts, dance and \nopera performances as well as \nconferences are held, and  \na restaurant. The neighbouring \n2nd building of the Concert \nHall (designed by Japanese \nA. Isozaki) includes halls for \nconcerts and conferences, a \nMuseum of Musical Instruments \nand a Music Library. The \nPoseidonio Sports Centre  \nis located nearby.\n2 \tDEPOT AREA\nThe area was named after the \nsite of the tram depot buildings \nand this complex has been \nlisted as a Historic Monument, \nsituated at the corner of Vas. \nOlgas and Typa Streets. The \ntram used to connect the city \ncentre with this area from 1893 \nuntil 1957. It is the easternmost \npart of the Exoches area \n[meaning Countryside] where \ntraces of its older atmosphere \nstill remain in several places.\nMUST SEE: \n2.1  Allatini Mills.\nDeserted since 1990, this \n57.  \nThe church \nof Saints \nCyril and \nMethodius.\n58.  \nThe \nThessaloniki \nConcert Hall.\n59.  \nAllatini Villa in \nDepot area.', '\x07Thessaloniki International Trade Fair (HELEXPO)\n\t71.\t\x07Society for Macedonian Studies –  \nNational Theatre of Northern Greece\t\n\t72.\tGarden Theatre\t\n\t73.\tRoyal Theatre\t\n\t74.\tThessaloniki Concert Hall\t\n\t75.\tVafopouleio Cultural Centre – Library\t\n\t76.\tKalamaria Municipal Theatre\t\n\t77.\tForest Theatre\t\n\t78.\tTheatre of the Earth\t\n\t\tSPORTS FACILITIES\n\t79.\tIndoor Sports Hall (Byzantine Sports Club)\t\n\t80.\t\x07Alexandreio Sports Arena (Palais des Sports)\n\t81.\tKaftanzogleio stadium\t\n\t82.\tThe National Swimming Pool\t\n\t83.\tPoseidonio Sports Centre\t\n\t84.\tToumpa Football ground\t\n\t85.\t“Kleanthis Vikelidis” Football ground\t\n\t86.\tKalamaria Football ground\t\n\t87.\tNautical Club of Thessaloniki\t\n\t88.\tWater Sports Club of Kalamaria\t\n\t\tPUBLIC TRANSPORT\n\t89.\tLong Distance Bus Station\t\n\t90.\tNew Railway Station\t\n\t91.\tMain Port\t\n\t\tTRADITIONAL MARKETS\n\t92.\tKapani (Vlali Marketplace)\t\n\t93.\tModiano Marketplace\t\n\t94.\tBezesteni\t\n115', 'MUST SEΕ: \n2.1  Sofouli Street\n(see p. 53).\n2.2  Kyverneio [Government \nHouse] (Little Palace).\nSituated on cape Mikro \nEmvolo or Karampournaki, \nLittle Palace was built in the \n1950’s and used to be the \ncountry residence of the greek \nroyal family; today the minister \nof Macedonia-Thrace and \nthe President of the Hellenic \nRepublic stay here when \nvisiting the city. The ground \nfloor includes the lounges,  \na dance hall and an atrium;  \nthe first floor includes two \nsuites and secondary rooms. \nIt is surrounded by a garden \nand it affords an amazing \nview of the city as well as Mts \nChortiatis and Olympus.\n2.3  Kodra former military \ncamp.\nBuilding works are under way \nto change it into a park. The \nMunicipality of Kalamaria often \nhosts cultural events and visual \nart exhibitions there. On-site \nexcavations brought to light a \nsettlement dating to the archaic \nand classical times (9th – 5th \nc. BC), which some scientists \nbelieve it is identified as the \nlocation of Ancient Thermi.\n71.  \nKyverneio \n(Palataki) \noverlooks cape \nKarampournaki \n(Kalamaria).\n72.  \nPanorama \narea offers a \nfine view of \nthe city and its \nenvirons.\n71', '98\nNIGHTLIFE\nfacilities. During the summer \nmonths though, most of \nthose clubs and venues move \nto open-air grounds in the \nairport area (see p. 106). \nAnother favourite area to \nThessalonians is Kalamaria \n(see p. 64) and, a bit further \noff, Peraia (see p. 67).   \nApart from the \nentertainment options, \na host of artistic events \nget organised in the city \nthroughout the entire \nyear: choose among the \nThessaloniki Concert Hall \n[Megaro] (see p. 52), the \nVasiliko [Royal] Theatre  \n(see p. 25), the Theatre of \nthe Society for Macedonian \nStudies (see p. 25 & 109), \nMoni Lazariston (see p. 61),  \nthe Forest Theatre [Theatro \nDasous] and the Theatre  \nof the Earth [Theatro Gis] \n(see p. 48); or you can opt for a \nvisit to museums (see p. 70-81) \nand smaller cultural venues. Last \nbut not least, you can visit the \nInternational Film Festival, \nthe Thessaloniki Book Fair, the \nDemetria Festival (see p. 108-\n109), and other venues housing \nevents on a smaller scale by  \nprivate companies or city \nagencies.\nFinally, the Thessaloniki \nRegency Casino is located \nat the 12th km on the \nThessaloniki – Airport Road \nand is open around the clock.']","['65 SUBURBS AND CITY OUTSKIRTS 2.4 Aretsou – Krini. These two most popular areas of Kalamaria stretch along the seafront. The facilities of the local marine sports club are here, next to Aretsou-Krini beach; there is also an open air cinema and a marina (the only one in town) with a 242-berth capacity (there are power, water and telephone services). The waterfront N. Plastira Street is lined with café-bars and fish tavernas which get filled to capacity all year round. 2.5 Komninon Street. The longest part of the town’s main street is for pedestrian use only and you will find shops, cafés, small bars and restaurants along the way. This is also where you will find the area’s central square where the Town Hall and the church of the Transfiguration of Christ are. From the direction of the seafront, you can reach the area via I. Passalidis Street. How to get there. Bus lines 5 and 5A leave from Eleftherias square. Get off at Naftikos Omilos [Marine Club] stop or at Chamodrakas stop in Aretsou area. 3']","The Town Hall in Kalamaria is located on Komninon Street, which is the longest part of the town’s main street designated for pedestrian use. This area is vibrant, featuring a variety of shops, cafés, small bars, and restaurants. The Town Hall is situated near the central square, alongside the church of the Transfiguration of Christ. 

To reach this area from the seafront, you can take I. Passalidis Street. Public transportation is also available; bus lines 5 and 5A depart from Eleftherias Square. You can get off at either the Naftikos Omilos (Marine Club) stop or the Chamodrakas stop in the Aretsou area, which is close to Komninon Street.

Exploring this part of Kalamaria offers a great opportunity to experience local culture and enjoy the lively atmosphere, especially during the summer months when the area is bustling with activity. The waterfront along N. Plastira Street, lined with café-bars and fish tavernas, is also nearby, making it a perfect spot for leisure and sightseeing.","The Town Hall is located in the central square of Kalamaria, along Komninon Street, which is the longest part of the town’s main street designated for pedestrian use.",1.0,0.43,0.5263157894736842,0.862956394657302,0.9999999999,0.9999999999,1.0,0.6666666644444444,,0.8758083014030446
32,"What historical significance does Pontus have in relation to the early inhabitants of Panorama, Thessaloniki?","['Get off at \nNaftikos Omilos [Marine Club] \nstop or at Chamodrakas stop \nin Aretsou area.\n3 \tPANORAMA\nOne of the best suburbs of \nThessaloniki is situated at  \na 12 km distance S of the \ncity centre and was built on \nthe slope of Mt Chortiatis, \noffering a panoramic city view. \nIt was uninhabited until the \nearly 20th c., although traces \nof a prehistoric settlement \nhave been located on the area. \nThe first inhabitants were \nrefugees from Asia Minor and \nPontus. Today its largest part \nis covered by luxury villas and \nimpressive detached homes; \nthere is a small shopping \narea in the centre. Trigona \nPanoramatos [a cream puff \npastry] – one of the city’s best \nknown sweet delicacies – were \ncreated at a local confectionery \nin the 1950’s.\nMUST SEE:\nPlatanakia.\nIt is a nice place for relaxing, \nin a wooded ravine, with a \nsmall Zoo and a café. A 6 km \npath begins here and leads \nup to the artificial lake (dam) \nof Thermi. Along the way you \nwill come across spots for a \nbrief rest, short waterfalls and \nfragments of eight Byzantine \nwatermills.', '64\nSUBURBS AND CITY OUTSKIRTS\nsituated nearby. The small \nmounds in the field are ancient \ntombs; a Neolithic settlement \nwas excavated in one of them \nwith a cemetery dating to the \nGeometric and Archaic period. \nAn impressive Macedonian \ntomb was also unearthed in \nAgios Athanasios area.\nHow to get there. Bus \nlines 40, 40A and 40K leave \nfor Kalochori from the Railway \nStation Stop. If you travel by \ncar, take the Athens direction \non the national road and turn \ntowards Kalochori.\n2 \tKALAMARIA\nThis is practically an eastward \n‘extension’ of Thessaloniki and \nthe city’s best known suburb, \nstretching along the waterfront, \nwith many green spaces and \na self-contained shopping \ncentre. The first inhabitants are \nrecorded in the early 20th c. and \nduring the 1920’s significant \nnumbers of Greek refugee \npopulations settled here and \nbuilt their small houses. They \ncame from Caucasus, Minor \nAsia and Pontus [modern- \nday northeast Turkey]. Today,  \ndespite the rising building trend  \nin the area, several refugee \nhouses remain, still keeping  \na flavour of times goneby.\nMUST SEΕ: \n2.1  Sofouli Street\n(see p. 53).\n2.2  Kyverneio [Government \nHouse] (Little Palace).', '6\nEver since the 4th c. BC when it was founded, \nThessaloniki has kept its urban character and has \nremained a civic centre and the hub of that region. \nThe city’s centuries-old multicultural history has been \nassociated with great empires, as it has known the \nRoman, Byzantine and Ottoman Rule. The town was also \ngreatly influenced by many ethnic and religious groups \n(Jews, Latins, Armenians and others) as well as Greeks \nfrom Constantinople, Pontus [modern-day northeastern \nTurkey] and Asia Minor [a.k.a. Anatolia]. The numerous \nmonuments, dating to many historical periods, coexist in \na singular and charming way and manifest Thessaloniki’s \nhistorical multicultural and cosmopolitan nature.\n1. \nThe White Tower \narea is one of the \nbusiest parts of \nthe city, where \nthe old seafront \n(Nikis Ave.) meets \nthe new (eastern) \nwaterfront area \nof Thessaloniki.\nDION – VERGINA – ANCIENT PELLA\nPETRALONA CAVE – LAKES AREA\nTHESSALONIKI', '66\nSUBURBS AND CITY OUTSKIRTS\n3.1  Chortiatis.\nNamed after the mountain, \nthis small suburb on Mt \nChortiatis (elev.: 1,201 m.), \nstretches approx. 10 km NE  \nof Panorama. Since the Roman \ntimes, Thessaloniki’s water \nsupply came from this place \nvia Vlatadon Monastery (see \np. 44); this is why you will \nsee fragments of a Byzantine \naqueduct at the suburb’s \nborder. The mountain is covered \nwith chestnut, oak, beech and \nfir trees, there is a mountain \nrefuge (Kissos location, elev. \n1,201 m.) and it is the ideal \nplace for hiking (there are 32 \ncharted paths), for mountain \nbiking and off-roading.\nHow to get there. Board \nthe 58 bus on Egnatia Street \nand get off at Dimarchio \n[Town Hall], Astynomia [Police \nStation] or at Platanakia stop.\n4 \tTHERMI\nThis suburb is located a bit \nfurther away from town (15 km \nSE of the city centre) and more \nor less still keeps a countryside \nair about it. On-site excavations \nhave shown that this was the \nlocation of the harbour of \nancient Thermi, a major one  \nin antiquity. The place was also \nknown for its hot springs – \nthermae – hence the name  \nof the gulf (Thermaikos).', '82\nThessaloniki lies in the \ncentre of a wide area that is \nextremely interesting from  \nan archaeological, historical \nand natural point of view; \nthere are countless options for \noutdoor activities, relaxing and \nentertainment. For instance, \nyou can combine your stay \nin town with a day excursion \nto renowned archaeological \nsites and places of historical \ninterest, to fascinating towns \nand great natural reserves  \nor to areas offering recreation \nor relaxation.\n1\n\t\nANCIENT PELLA\nInhabited since the Late \nHelladic period, the area \nflourished when Archelaos,  \nthe Macedon king, moved  \nthe capital of the Macedonian \nstate from Aiges (Vergina) to \nPella (late 5th – early 4th c. BC). \nThe then seaside town grew \nlarger during the reign of King \nPhilip II (his son, Alexander \nthe Great, was born here) \nand grew even larger later \nduring the rule of Cassander. \nBy the mid-2nd century BC it \nhad evolved into the greatest \npolitical, financial and cultural \ncentre among the Hellenic City \nStates. In 168 BC when the \nMacedonians were defeated in \nthe battle of Pydna, Pella was \nconquered by the Romans. \nIt gradually declined and got \neventually deserted in the 1st \ncentury BC. Among the finds \nof the greatest value are the \nexquisite mosaic floors in the \nbuildings, which manifest the \nhigh standard of living enjoyed \nby the residents.\nMUST SEE:\nHouses.']","['PANORAMA One of the best suburbs of Thessaloniki is situated at a 12 km distance S of the city centre and was built on the slope of Mt Chortiatis, offering a panoramic city view. It was uninhabited until the early 20th c., although traces of a prehistoric settlement have been located on the area. The first inhabitants were refugees from Asia Minor and Pontus. Today its largest part is covered by luxury villas and impressive detached homes; there is a small shopping area in the centre. Trigona Panoramatos [a cream puff pastry] – one of the city’s best known sweet delicacies – were created at a local confectionery in the 1950’s. MUST SEE: Platanakia. It is a nice place for relaxing, in a wooded ravine, with a small Zoo and a café. A 6 km path begins here and leads up to the artificial lake (dam) of Thermi. Along the way you will come across spots for a brief rest, short waterfalls and fragments of eight Byzantine watermills. 11 12 13 14 KONSTANTINOUPOLEOS SSIS OLGAS GIOU PAPANDREOU ROSIDI ROSIDI GEORGIOU PAPANDREOU APAFI MARKOU BOTSARI PAPANASTASIOU ANATOLIKIS THRAKIS PAPANASTASIOU VOULGARI KANARI KANARI KARAKASI KARAKASI DELFON GAVRIILIDI TH. SAKELLARIDI GAVRIILIDI KARAOLI VOULGARI KOURTIDI YPSILANTOU PLASTIRA KORAI SMYRNIS MIAOULI PLASTIRA PLASTIRA KERASOUNTOS THEMISTOKLI SOFOULI KALYVA METAMORFOSEOS KOMNINON PONTOU PONTOU AIGAIOU AIGAIOU ADRIANOUPOLEOS EL. VENIZELOU ETHNIKIS ANTISTASIS KOLOTOUROU THICHIS PAPAFLESSA MERKOURIOU KIFISIAS KIFISIAS PSELOU SOLONOS MANTINEIAS GAMVETA METAMORFOSI AGIOS NIKOLAOS NATHANAIL MALAKASI POLYLA PARASCHOU TYPALDOU GRYPARI ROIDI GAMVETA MAKEDONIAS STROMNITSIS MELENIKOU MOUSOURI PAPANTONIOU CHRISTOVASILI PORFYRA SKIATHOU ANINOU KRITIS CHAIRONEIAS PARNASSOU KOUSKOURA PAPADIMITRIOU TAKI OIKONOMIDI DODEKANISOU MITROPOLITI AMVROSIOU MITROPOLITI KALIDI MITROPOLITI GRIGORIOU KYDONION MOSCHONISION THEMISTOKLI SOFOULI KROMNIS PLOUTONOS KASSOMOULI SANGARIOU VISSARIONOS KAPETANIDI NAVARINOU KOLCHIDAS PAPAGOU KIOU POULANTZAKI KALIDOU KAVASITON XENOFONTOS IL E TIR G A NIKOMIDEIAS TRIPOLEOS CHILIS MARMARA CHALKIS VITHYNIAS MIKROULEA KONITSIS SARATSI THERAPEION NIKAIAS AGIAS ELENIS AGIOU IOANNOU VOSPOROU ELLISPONTOU MAKROCHORIOU KARAMAOUNA KARATASOU PAPANASTASIOU LEVANTI KAZIKA IRAKLEIAS IOAKEIM G’ CHRYSOSTOMOU SMYRNIS ADRAMITIOU METRON ANDROUTSOU EFESOU PASALIDI TAXIARCHON MYSTAKIDI MOUDANION EVELPIDOU AGIOU NIKOLAOU PROUSAS DALIPI BALA PAPAPETROU AVDELA KOMNINON KOTYORON ARGYROUPOLEOS SANTAS MYRION AKRITIDI EPANOMIS PAPAKYRITSI AMISSOU LEROU KYPROU PATMOU YPSILANTOU KYMIS MAKRYRACHIS SOUMELA PARANIKA VAZELONOS IASONIDI KYRIAKIDI FOKAIAS DAVAKI AGIOU VASILEIOU DIOGENOUS LEFKOSIAS ARISTOFANOUS FANARIOU PALAMA PANORMOU GRIGORIADI KALANTIDI ANATOLIKIS THRAKIS SOULIOU OMIROU ZALONGOU IONIAS PARIDOS FILADELFEIAS KAPADDOKIAS PROMITHEOS XENOPOULOU IKONIOU IPPOKRATOUS RANGAVI DIOS SOKRATOUS SOLOMOU PLOUTARCHOU EVRIPIDOU SOURI PAPANTONIOU THOUKYDIDI IOUSTINIANOU ALKIONOS ZIRGANOU IRAS LOUI SEVASTEIAS KARAVANGELI ERYTHROU STAVROU MEGALOU ALEXANDROU KAZAZI KAISAREIAS LAODIKIAS IEROSOLYMON AIANTOS AIVATZIDI AGIOU PANTELEIMONOS ANEMONAS PASTER FILELLINON KERAMOPOULOU KALAVRYTON PAPADIAMANTI FILIPPOU V. IPEIROU KOLOKOTRONI VLACHERNON KORYTSAS RODOU IRODOTOU LASANI ARISTOTELOUS ARISTEIDOU PERIKLEOUS TATAOULON DORILEOU POKIOUPTSIDI KYZIKOU KAFKASOU TSINGIRIDI AGIOU ZACHARIA CHERIANON CHALDEIAS KAROLIDI CHEIMONIDI AIMILIANOU MITR. ARTAKIS ERATYRAS ANTIGONIS VOULGAROKTONOU PARASKEVOPOULOU APOSTOLOU PAVLOU FLEMING KONSTANTINOUPOLEOS KYFONIDI S A R E M I CHRYSOULIDI THERMAIKOU PAPANIKOLA NIKOPOLEOS TRAPEZOUNTAS VASILEIADOU SIFILINON SOURMENON ARGYROPOULOU NEAPOLEOS STRAVONOS ARGONAFTON KYDONION PAPADAKI SIGALA AKTAIOU ANDRONIKOU POLEMI PAPADAKI PANSELINOU ADMITOU KASSANDREOS TSOUNTA POULIOU KORNAROU NALTSA FRANTZI KRYSTALI AINOU SIK A R H T O M A S LOGOTHETOU NIKOLAIDI THEMELI SPETSON LASKARATOU TYPA YPSILANTOU DROSINI CHALKIDIKIS THERMOPYLON THALITOS PITTAKOU GRAVIAS GRAVIAS FILELLINON OROMILA KRITIS PAPADIAMANTI NASTOU ALKMINIS NATSINA GENNADIOU MITR. NEMEAS PLATAION DANIOLOU AGIOU VASILEIOU GENNADIOU MITR. PAPAKYRIAZI KARKAVITSA AVROKORDATOU VOGA US IPATIAS KISSOU KARIATIDAS KAVIRON AGAMEMNONOS U S ARGAIOU FOINIKOS EFESSOU KAISAREIAS KALLIPOLEOS VRYOULON KYZIKOU NIKOMIDEIAS NEAPOLEOS MIDEIAS APADDOKIAS KAONIAS INIOSOGLOU NIKAIAS KAROLIDOU RANTI AS KI NIAS SANTAS POULA YPARCHOU FOKYLIDOU KERAMIKOU EPIDAVROU TSELIOU TSELIOU PRAXAGORA OLYMPIAS VOSPOROU AMFIPOLEOS MIKRAS ASIAS PONTOU VITHYNIAS PAPAGEORGIOU IOANNOU KAISAREIAS METRON IMVROU AGRIANON CHIOU CHOURMOUZI APOLLONOS SYROU FAIAKON LARNAKOS AMMOCHOSTOU NAFPLIOU NAFPLIOU DERKON KORDELIOU VIZYIS DORYLAIOU TINOU TENEDOU DARDANELLION DIMITSANAS EPIDAVROU EFSTATHIOU MITROPOLITOU PILEAS CHANDRINOU FILINTA DORYLAIOU KARANIVALOU ATLANTIDAS SVOLOU VOSPOROU ZACHOU ZIRINI ZONARA ANAXIMENOUS ANATOLIKIS ROMYLIAS ISOKRATOUS TOUSSA SPEFSIPOU MYSTAKIDI DYSTOMOU MIKROU ANTISTHENOUS STEFANOU DIMOCHAROUS MISIRLI PILEAS AEROPOU PAFSILYPOU TRIANTAFYLLOPOULOU AGALIANOU PRAIDI STAMATELOU FILI STAGIRITI STADIOU IPEIROU KYPROU KARAVANGELI MARATHONOS MAKEDONIAS ETHNIKIS CHRΥSOSTOMOU AGRA NEARCHOU IFAISTIONOS OLYMPOU KORYTSAS PTOLEMAIOU PERDIKA OLYMPIADOS OLYMPIADOS THER MOPYLON KENEDY PLASTIRA PLASTIRA PROFITI ILIA MEGALOU ALEXANDROU VAS. KONSTANTINOU GRIGORIOU LAMPRAKI (KONITSIS) FLEMING NIKIS AMFOTEROU ETEOKLI DIGKA ETEOKLI IGILOCHOU NIKANOROS EVMENOUS VASIKYROU KARATHEODORI GAZI ANAKREONTOS ANTAIOU NOUKA SEFERI POSEIDONOS MELEAGROU ANGELOU ALKAMENOUS ANAXIMANDROU ANAXIMANDROU LEONIDOU KARDITSIS IRAKLEOUS KORAI MELENIKOU ALKMINIS PARALI GLYNOU TZAVELA TZAVELA RIGA FERAIOU CHORN ZOUMETIKOU MARASLI MARSLI XENOU MAVROMICHALI ADRIANOUPOLEOS ATREIDON XYNGOPOULOU ARKADIOU OSIAS XENIS STROMNITSIS OKEANIDON DEINOKRATOUS VAMVA AGISILAOU NEOPTOLEMOU PAPA PAVLOU MELA VENIZELOU ARISTOTELOUS EIRINIS FILIKIS ETAIRIAS FILIPPOU PRASSAKAKI SCHOLEION OMIROU KOLOKOTRONI PALAIOLOGOU LAOGR. MOUSEIOU DAVAKI SELEFKOU TSELEPI TSIAPANOU TSAMI STRATIGI STRATIGI VISTA ANGELOPOULOU DIVOLI GKOURA GRIGORIOU STEFANOU ATHINA ANTHEMOUNTOS LEFAKI PAFSANIA SEMELIS AETIONOS PANTAZIDI PERRAIVOU PERRAIVOU SPANOU IPPOKRATOUS IPPOKRATOUS DIMOKRITOU VOSPOROU GLYNOU GLYNOU THEOFILOU PAPANASTASIOU VYZANTIOU PAPAFLESSA ANOIXIS VARNALI SPYROU LOUI KALVOU SYMEONIDI PROTOMAGIAS PALAMA DIMOKRATIAS VISVIZI ARTAKIS U EPTALOFOU PARMENIDI TIROLOIS EMOU POLYGNOTOU DROMIOU LISSIPOU ANTIFANOS MEGAKLEOUS EMMANOUIL EFTALIOTI EFTALIOTI DOMPOLI DOUKA ANAXIMENOUS NEARCHOU RIGA FERAIOU SEFERI MENANDROU PAPANIKOLAOU ANAPAFSEOS ZORBA ANAPAFSEOS KAFANTARI POSEIDONOS ALATSATON ANTISTASEOS AGIOS THERAPON PROFITIS ILIAS AGIOS ELEFTHERIOS TREIS IERARCHES OSIA XENI MALAKOPI CHARILAOU ARETSOU TROCHIODROMIKON DEPO ALATINI CHEN KOURI VOTSI KIFISIA VYZANTIO KATIRLI DERKON KARAMPOURNAKI EXOCHES KONSTANTINOUPOLITON KATO TOUMPA TOUMPA CEMETERY ENGLISH CEMETERY KALAMARIA CEMETERY PILEA CEMETERY THERMI - CHALKIDIKI MIKRA CHALKIDIKI PANORAMA GOVATZIDAKI SQ. AINOU SQ. KAOUDI SQ. PATRIKIOU AILIDI SQ. SQ. SKRA SQ. PILEA KALAMARIA THESSALONIKI KERAMEIA ALATINI ARISTOTELIS AGIOU ELEFTHERIOU SQ. RETIREMENT HOME 2.2 2.3 2.4 2.5 2.1 2.4 72']","Pontus, a region located in modern-day northeastern Turkey, holds historical significance as it was one of the primary areas from which early inhabitants of Panorama, a suburb of Thessaloniki, originated. In the early 20th century, following the population exchanges and upheavals resulting from the Greco-Turkish War and the broader context of the Balkan Wars, many Greek refugees from Pontus settled in this area. These refugees brought with them their cultural heritage, traditions, and architectural styles, which contributed to the development of Panorama.

The suburb of Panorama, situated on the slopes of Mt. Chortiatis, was largely uninhabited until these refugees arrived. Their settlement marked a significant demographic shift, transforming the area into a vibrant community characterized by luxury villas and a blend of historical influences. The influx of these populations from Pontus and Asia Minor enriched the cultural tapestry of Thessaloniki, making it a hub of multicultural interactions.

Moreover, the historical connection to Pontus is reflected in the local cuisine, customs, and community life, which often celebrate the heritage of these early inhabitants. The legacy of Pontus is evident in the preservation of traditional practices and the establishment of social networks among the descendants of these refugees, fostering a sense of identity and continuity.

In summary, the historical significance of Pontus in relation to the early inhabitants of Panorama lies in its role as a source of migration that shaped the suburb's demographic and cultural landscape, contributing to Thessaloniki's rich multicultural identity. This connection offers a unique opportunity for visitors to explore the historical narratives and cultural influences that define the area today.","The first inhabitants of Panorama were refugees from Asia Minor and Pontus, indicating the historical significance of Pontus in the region's early settlement.",0.5,0.2,0.5714285714285714,0.7594776748523453,0.9999999999666667,0.9999999999666667,0.0,0.6666666644444444,,0.8931922858535435
33,What historical significance does Kalamaria hold in relation to its early inhabitants?,"['64\nSUBURBS AND CITY OUTSKIRTS\nsituated nearby. The small \nmounds in the field are ancient \ntombs; a Neolithic settlement \nwas excavated in one of them \nwith a cemetery dating to the \nGeometric and Archaic period. \nAn impressive Macedonian \ntomb was also unearthed in \nAgios Athanasios area.\nHow to get there. Bus \nlines 40, 40A and 40K leave \nfor Kalochori from the Railway \nStation Stop. If you travel by \ncar, take the Athens direction \non the national road and turn \ntowards Kalochori.\n2 \tKALAMARIA\nThis is practically an eastward \n‘extension’ of Thessaloniki and \nthe city’s best known suburb, \nstretching along the waterfront, \nwith many green spaces and \na self-contained shopping \ncentre. The first inhabitants are \nrecorded in the early 20th c. and \nduring the 1920’s significant \nnumbers of Greek refugee \npopulations settled here and \nbuilt their small houses. They \ncame from Caucasus, Minor \nAsia and Pontus [modern- \nday northeast Turkey]. Today,  \ndespite the rising building trend  \nin the area, several refugee \nhouses remain, still keeping  \na flavour of times goneby.\nMUST SEΕ: \n2.1  Sofouli Street\n(see p. 53).\n2.2  Kyverneio [Government \nHouse] (Little Palace).', 'Greek revolts \nof that period in Macedonia are \ndescribed in Room A; exhibits \nrelated to the Macedonian \nsociety of the late 19th c. are \nin Room B; a reconstruction \nof the office of the Greek \nGeneral Consul is in Room C; \nthe process of recruitment in \nthe Greek guerilla forces of \nthose times is on display in \nRoom D; the role played by the \nclergy is depicted in Room E; \nthe Balkan Wars are described \nin Room F; the course of \nMacedonian history following \nthe Balkan Wars is in Room G. \nCostumes and authentic relics \nfrom the Balkan Wars Period \n(arms, uniforms among other \nitems), are exhibited in the \n1st floor, as is a collection of \nminiature vehicles of the Greek \narmy.\nWAR MUSEUM\nExhibits include objects \nsuch as uniforms, arms, maps, \nbattleship effigies, documents \nand military decorations, \nwhich are connected with the \nmost significant events of the \nmodern Greek history, from the \n1821 War of Independence \nuntil the 1944 liberation from \nthe German Occupation forces. \nIn the museum’s courtyard you \nwill see armoured vehicles, \nfighters and torpedoes used by \nthe Greek Army in the past.\nATATURK MUSEUM \nExhibits occupy two floors: \nThe 1st floor includes the \nparlour, the living room, the \n85 & 86. \n(left) The \nneoclassical \nbuilding of \nthe Museum \nfor the \nMacedonian \nStruggle and \n(right) one of \nits exhibits.', 'The place was also \nknown for its hot springs – \nthermae – hence the name  \nof the gulf (Thermaikos). During \nthe Byzantine and Ottoman \nperiod it was known as Sedes; \nin modern times, refugees \ninhabited the area in the early \n20th c.\nMUST SEE:\nParamana Square.\nIn 2009 Thermi’s central \nsquare was awarded a prize \nfor its futuristic design, in an \narchitectural contest. The Town \nHall and the two St. Nicholas \nchurches (older and new one) \nare located here. This is where \nKaraoli-Dimitriou Street begins, \nthe area’s business hub, where \nyou will also find café-bars and \nrestaurants.\nArtificial lake.\nBordering on the suburb, \nthe lake was created when \na dam was built to contain \nthe water running through \na gully. It is the ideal place \nto make you feel refreshed \nand relaxed; in the summer \nthe Dam Music Festival takes \nplace there. Further north, \nwithin a short distance you \nwill see the Environmental \nPark with a playground, tennis \ncourts, basketball and football \ngrounds.\n73.  \nOn the slopes of  \nMt. Chortiatis, \ntowards Thermi.\n74.  \nFuturistic \nParamana Sq. \n(Thermi).\n73', '82\nThessaloniki lies in the \ncentre of a wide area that is \nextremely interesting from  \nan archaeological, historical \nand natural point of view; \nthere are countless options for \noutdoor activities, relaxing and \nentertainment. For instance, \nyou can combine your stay \nin town with a day excursion \nto renowned archaeological \nsites and places of historical \ninterest, to fascinating towns \nand great natural reserves  \nor to areas offering recreation \nor relaxation.\n1\n\t\nANCIENT PELLA\nInhabited since the Late \nHelladic period, the area \nflourished when Archelaos,  \nthe Macedon king, moved  \nthe capital of the Macedonian \nstate from Aiges (Vergina) to \nPella (late 5th – early 4th c. BC). \nThe then seaside town grew \nlarger during the reign of King \nPhilip II (his son, Alexander \nthe Great, was born here) \nand grew even larger later \nduring the rule of Cassander. \nBy the mid-2nd century BC it \nhad evolved into the greatest \npolitical, financial and cultural \ncentre among the Hellenic City \nStates. In 168 BC when the \nMacedonians were defeated in \nthe battle of Pydna, Pella was \nconquered by the Romans. \nIt gradually declined and got \neventually deserted in the 1st \ncentury BC. Among the finds \nof the greatest value are the \nexquisite mosaic floors in the \nbuildings, which manifest the \nhigh standard of living enjoyed \nby the residents.\nMUST SEE:\nHouses.', 'Other exhibits of great \ninterest are the Hellenistic \nBathhouse, the ancient brothel, \nand the fountain associated \nwith the Stoa of the Statuettes \n(Las Incantadas). There are \nalso finds related to the period \nfrom the Turkish Occupation \nuntil the 1917 fire. Next to \nexhibited items, there are \ndescriptive texts and photos.\nMUSEUM OF BYZANTINE \nCULTURE\nIt is considered one of the \nbest museums in Greece and \nranks high among its peers \nacross the globe, offering \na detailed picture of the \nByzantine culture. Among \nthe 2,900 masterpieces of \nexhibits, there are murals, \nmosaics, icons, marble \narchitectural members, whole \nEarly Christian tombs, church \nvessels, items of personal \ndress, as well as objects of \neveryday use and tools used \nMUSEUMS\n80\n81']","['PANORAMA One of the best suburbs of Thessaloniki is situated at a 12 km distance S of the city centre and was built on the slope of Mt Chortiatis, offering a panoramic city view. It was uninhabited until the early 20th c., although traces of a prehistoric settlement have been located on the area. The first inhabitants were refugees from Asia Minor and Pontus. Today its largest part is covered by luxury villas and impressive detached homes; there is a small shopping area in the centre. Trigona Panoramatos [a cream puff pastry] – one of the city’s best known sweet delicacies – were created at a local confectionery in the 1950’s. MUST SEE: Platanakia. It is a nice place for relaxing, in a wooded ravine, with a small Zoo and a café. A 6 km path begins here and leads up to the artificial lake (dam) of Thermi. Along the way you will come across spots for a brief rest, short waterfalls and fragments of eight Byzantine watermills. 11 12 13 14 KONSTANTINOUPOLEOS SSIS OLGAS GIOU PAPANDREOU ROSIDI ROSIDI GEORGIOU PAPANDREOU APAFI MARKOU BOTSARI PAPANASTASIOU ANATOLIKIS THRAKIS PAPANASTASIOU VOULGARI KANARI KANARI KARAKASI KARAKASI DELFON GAVRIILIDI TH. SAKELLARIDI GAVRIILIDI KARAOLI VOULGARI KOURTIDI YPSILANTOU PLASTIRA KORAI SMYRNIS MIAOULI PLASTIRA PLASTIRA KERASOUNTOS THEMISTOKLI SOFOULI KALYVA METAMORFOSEOS KOMNINON PONTOU PONTOU AIGAIOU AIGAIOU ADRIANOUPOLEOS EL. VENIZELOU ETHNIKIS ANTISTASIS KOLOTOUROU THICHIS PAPAFLESSA MERKOURIOU KIFISIAS KIFISIAS PSELOU SOLONOS MANTINEIAS GAMVETA METAMORFOSI AGIOS NIKOLAOS NATHANAIL MALAKASI POLYLA PARASCHOU TYPALDOU GRYPARI ROIDI GAMVETA MAKEDONIAS STROMNITSIS MELENIKOU MOUSOURI PAPANTONIOU CHRISTOVASILI PORFYRA SKIATHOU ANINOU KRITIS CHAIRONEIAS PARNASSOU KOUSKOURA PAPADIMITRIOU TAKI OIKONOMIDI DODEKANISOU MITROPOLITI AMVROSIOU MITROPOLITI KALIDI MITROPOLITI GRIGORIOU KYDONION MOSCHONISION THEMISTOKLI SOFOULI KROMNIS PLOUTONOS KASSOMOULI SANGARIOU VISSARIONOS KAPETANIDI NAVARINOU KOLCHIDAS PAPAGOU KIOU POULANTZAKI KALIDOU KAVASITON XENOFONTOS IL E TIR G A NIKOMIDEIAS TRIPOLEOS CHILIS MARMARA CHALKIS VITHYNIAS MIKROULEA KONITSIS SARATSI THERAPEION NIKAIAS AGIAS ELENIS AGIOU IOANNOU VOSPOROU ELLISPONTOU MAKROCHORIOU KARAMAOUNA KARATASOU PAPANASTASIOU LEVANTI KAZIKA IRAKLEIAS IOAKEIM G’ CHRYSOSTOMOU SMYRNIS ADRAMITIOU METRON ANDROUTSOU EFESOU PASALIDI TAXIARCHON MYSTAKIDI MOUDANION EVELPIDOU AGIOU NIKOLAOU PROUSAS DALIPI BALA PAPAPETROU AVDELA KOMNINON KOTYORON ARGYROUPOLEOS SANTAS MYRION AKRITIDI EPANOMIS PAPAKYRITSI AMISSOU LEROU KYPROU PATMOU YPSILANTOU KYMIS MAKRYRACHIS SOUMELA PARANIKA VAZELONOS IASONIDI KYRIAKIDI FOKAIAS DAVAKI AGIOU VASILEIOU DIOGENOUS LEFKOSIAS ARISTOFANOUS FANARIOU PALAMA PANORMOU GRIGORIADI KALANTIDI ANATOLIKIS THRAKIS SOULIOU OMIROU ZALONGOU IONIAS PARIDOS FILADELFEIAS KAPADDOKIAS PROMITHEOS XENOPOULOU IKONIOU IPPOKRATOUS RANGAVI DIOS SOKRATOUS SOLOMOU PLOUTARCHOU EVRIPIDOU SOURI PAPANTONIOU THOUKYDIDI IOUSTINIANOU ALKIONOS ZIRGANOU IRAS LOUI SEVASTEIAS KARAVANGELI ERYTHROU STAVROU MEGALOU ALEXANDROU KAZAZI KAISAREIAS LAODIKIAS IEROSOLYMON AIANTOS AIVATZIDI AGIOU PANTELEIMONOS ANEMONAS PASTER FILELLINON KERAMOPOULOU KALAVRYTON PAPADIAMANTI FILIPPOU V. IPEIROU KOLOKOTRONI VLACHERNON KORYTSAS RODOU IRODOTOU LASANI ARISTOTELOUS ARISTEIDOU PERIKLEOUS TATAOULON DORILEOU POKIOUPTSIDI KYZIKOU KAFKASOU TSINGIRIDI AGIOU ZACHARIA CHERIANON CHALDEIAS KAROLIDI CHEIMONIDI AIMILIANOU MITR. ARTAKIS ERATYRAS ANTIGONIS VOULGAROKTONOU PARASKEVOPOULOU APOSTOLOU PAVLOU FLEMING KONSTANTINOUPOLEOS KYFONIDI S A R E M I CHRYSOULIDI THERMAIKOU PAPANIKOLA NIKOPOLEOS TRAPEZOUNTAS VASILEIADOU SIFILINON SOURMENON ARGYROPOULOU NEAPOLEOS STRAVONOS ARGONAFTON KYDONION PAPADAKI SIGALA AKTAIOU ANDRONIKOU POLEMI PAPADAKI PANSELINOU ADMITOU KASSANDREOS TSOUNTA POULIOU KORNAROU NALTSA FRANTZI KRYSTALI AINOU SIK A R H T O M A S LOGOTHETOU NIKOLAIDI THEMELI SPETSON LASKARATOU TYPA YPSILANTOU DROSINI CHALKIDIKIS THERMOPYLON THALITOS PITTAKOU GRAVIAS GRAVIAS FILELLINON OROMILA KRITIS PAPADIAMANTI NASTOU ALKMINIS NATSINA GENNADIOU MITR. NEMEAS PLATAION DANIOLOU AGIOU VASILEIOU GENNADIOU MITR. PAPAKYRIAZI KARKAVITSA AVROKORDATOU VOGA US IPATIAS KISSOU KARIATIDAS KAVIRON AGAMEMNONOS U S ARGAIOU FOINIKOS EFESSOU KAISAREIAS KALLIPOLEOS VRYOULON KYZIKOU NIKOMIDEIAS NEAPOLEOS MIDEIAS APADDOKIAS KAONIAS INIOSOGLOU NIKAIAS KAROLIDOU RANTI AS KI NIAS SANTAS POULA YPARCHOU FOKYLIDOU KERAMIKOU EPIDAVROU TSELIOU TSELIOU PRAXAGORA OLYMPIAS VOSPOROU AMFIPOLEOS MIKRAS ASIAS PONTOU VITHYNIAS PAPAGEORGIOU IOANNOU KAISAREIAS METRON IMVROU AGRIANON CHIOU CHOURMOUZI APOLLONOS SYROU FAIAKON LARNAKOS AMMOCHOSTOU NAFPLIOU NAFPLIOU DERKON KORDELIOU VIZYIS DORYLAIOU TINOU TENEDOU DARDANELLION DIMITSANAS EPIDAVROU EFSTATHIOU MITROPOLITOU PILEAS CHANDRINOU FILINTA DORYLAIOU KARANIVALOU ATLANTIDAS SVOLOU VOSPOROU ZACHOU ZIRINI ZONARA ANAXIMENOUS ANATOLIKIS ROMYLIAS ISOKRATOUS TOUSSA SPEFSIPOU MYSTAKIDI DYSTOMOU MIKROU ANTISTHENOUS STEFANOU DIMOCHAROUS MISIRLI PILEAS AEROPOU PAFSILYPOU TRIANTAFYLLOPOULOU AGALIANOU PRAIDI STAMATELOU FILI STAGIRITI STADIOU IPEIROU KYPROU KARAVANGELI MARATHONOS MAKEDONIAS ETHNIKIS CHRΥSOSTOMOU AGRA NEARCHOU IFAISTIONOS OLYMPOU KORYTSAS PTOLEMAIOU PERDIKA OLYMPIADOS OLYMPIADOS THER MOPYLON KENEDY PLASTIRA PLASTIRA PROFITI ILIA MEGALOU ALEXANDROU VAS. KONSTANTINOU GRIGORIOU LAMPRAKI (KONITSIS) FLEMING NIKIS AMFOTEROU ETEOKLI DIGKA ETEOKLI IGILOCHOU NIKANOROS EVMENOUS VASIKYROU KARATHEODORI GAZI ANAKREONTOS ANTAIOU NOUKA SEFERI POSEIDONOS MELEAGROU ANGELOU ALKAMENOUS ANAXIMANDROU ANAXIMANDROU LEONIDOU KARDITSIS IRAKLEOUS KORAI MELENIKOU ALKMINIS PARALI GLYNOU TZAVELA TZAVELA RIGA FERAIOU CHORN ZOUMETIKOU MARASLI MARSLI XENOU MAVROMICHALI ADRIANOUPOLEOS ATREIDON XYNGOPOULOU ARKADIOU OSIAS XENIS STROMNITSIS OKEANIDON DEINOKRATOUS VAMVA AGISILAOU NEOPTOLEMOU PAPA PAVLOU MELA VENIZELOU ARISTOTELOUS EIRINIS FILIKIS ETAIRIAS FILIPPOU PRASSAKAKI SCHOLEION OMIROU KOLOKOTRONI PALAIOLOGOU LAOGR. MOUSEIOU DAVAKI SELEFKOU TSELEPI TSIAPANOU TSAMI STRATIGI STRATIGI VISTA ANGELOPOULOU DIVOLI GKOURA GRIGORIOU STEFANOU ATHINA ANTHEMOUNTOS LEFAKI PAFSANIA SEMELIS AETIONOS PANTAZIDI PERRAIVOU PERRAIVOU SPANOU IPPOKRATOUS IPPOKRATOUS DIMOKRITOU VOSPOROU GLYNOU GLYNOU THEOFILOU PAPANASTASIOU VYZANTIOU PAPAFLESSA ANOIXIS VARNALI SPYROU LOUI KALVOU SYMEONIDI PROTOMAGIAS PALAMA DIMOKRATIAS VISVIZI ARTAKIS U EPTALOFOU PARMENIDI TIROLOIS EMOU POLYGNOTOU DROMIOU LISSIPOU ANTIFANOS MEGAKLEOUS EMMANOUIL EFTALIOTI EFTALIOTI DOMPOLI DOUKA ANAXIMENOUS NEARCHOU RIGA FERAIOU SEFERI MENANDROU PAPANIKOLAOU ANAPAFSEOS ZORBA ANAPAFSEOS KAFANTARI POSEIDONOS ALATSATON ANTISTASEOS AGIOS THERAPON PROFITIS ILIAS AGIOS ELEFTHERIOS TREIS IERARCHES OSIA XENI MALAKOPI CHARILAOU ARETSOU TROCHIODROMIKON DEPO ALATINI CHEN KOURI VOTSI KIFISIA VYZANTIO KATIRLI DERKON KARAMPOURNAKI EXOCHES KONSTANTINOUPOLITON KATO TOUMPA TOUMPA CEMETERY ENGLISH CEMETERY KALAMARIA CEMETERY PILEA CEMETERY THERMI - CHALKIDIKI MIKRA CHALKIDIKI PANORAMA GOVATZIDAKI SQ. AINOU SQ. KAOUDI SQ. PATRIKIOU AILIDI SQ. SQ. SKRA SQ. PILEA KALAMARIA THESSALONIKI KERAMEIA ALATINI ARISTOTELIS AGIOU ELEFTHERIOU SQ. RETIREMENT HOME 2.2 2.3 2.4 2.5 2.1 2.4 72']","Kalamaria, a prominent suburb of Thessaloniki, holds historical significance primarily due to its early 20th-century development and the influx of Greek refugees. The area began to be populated in the early 1900s, particularly during the 1920s when significant numbers of refugees from regions such as Caucasus, Minor Asia, and Pontus (modern-day northeast Turkey) settled here. These refugees brought with them their cultural heritage, which influenced the architectural and social landscape of Kalamaria.

The settlement of these refugees is a poignant chapter in Kalamaria's history, as they constructed small houses that reflect their traditional lifestyles and customs. Despite the ongoing urban development and rising building trends in the area, several of these original refugee houses remain, preserving a sense of nostalgia and connection to the past. This blend of historical and modern elements contributes to Kalamaria's unique character, making it a fascinating place for visitors interested in the cultural evolution of Thessaloniki.

Additionally, Kalamaria's waterfront location and green spaces enhance its appeal, offering a picturesque setting that contrasts with its historical roots. The area is not only a residential hub but also a vibrant community with a self-contained shopping center, cafes, and restaurants, making it an ideal spot for leisure activities.

For those interested in history and culture, Kalamaria provides an opportunity to explore the remnants of its past while enjoying the modern amenities of a bustling suburb. The juxtaposition of historical refugee houses against contemporary developments serves as a reminder of the resilience and adaptability of its early inhabitants, making Kalamaria a significant site for understanding the broader narrative of Greek history and migration.","Kalamaria was uninhabited until the early 20th century, although traces of a prehistoric settlement have been located in the area. The first inhabitants were refugees from Asia Minor and Pontus.",0.5,0.28,0.5483870967741935,0.6984530547461292,0.8333333332916666,0.8333333332916666,0.0,0.3999999992,,0.8489266852078168
34,What is Mt Chortiatis?,"['66\nSUBURBS AND CITY OUTSKIRTS\n3.1  Chortiatis.\nNamed after the mountain, \nthis small suburb on Mt \nChortiatis (elev.: 1,201 m.), \nstretches approx. 10 km NE  \nof Panorama. Since the Roman \ntimes, Thessaloniki’s water \nsupply came from this place \nvia Vlatadon Monastery (see \np. 44); this is why you will \nsee fragments of a Byzantine \naqueduct at the suburb’s \nborder. The mountain is covered \nwith chestnut, oak, beech and \nfir trees, there is a mountain \nrefuge (Kissos location, elev. \n1,201 m.) and it is the ideal \nplace for hiking (there are 32 \ncharted paths), for mountain \nbiking and off-roading.\nHow to get there. Board \nthe 58 bus on Egnatia Street \nand get off at Dimarchio \n[Town Hall], Astynomia [Police \nStation] or at Platanakia stop.\n4 \tTHERMI\nThis suburb is located a bit \nfurther away from town (15 km \nSE of the city centre) and more \nor less still keeps a countryside \nair about it. On-site excavations \nhave shown that this was the \nlocation of the harbour of \nancient Thermi, a major one  \nin antiquity. The place was also \nknown for its hot springs – \nthermae – hence the name  \nof the gulf (Thermaikos).', 'Get off at \nNaftikos Omilos [Marine Club] \nstop or at Chamodrakas stop \nin Aretsou area.\n3 \tPANORAMA\nOne of the best suburbs of \nThessaloniki is situated at  \na 12 km distance S of the \ncity centre and was built on \nthe slope of Mt Chortiatis, \noffering a panoramic city view. \nIt was uninhabited until the \nearly 20th c., although traces \nof a prehistoric settlement \nhave been located on the area. \nThe first inhabitants were \nrefugees from Asia Minor and \nPontus. Today its largest part \nis covered by luxury villas and \nimpressive detached homes; \nthere is a small shopping \narea in the centre. Trigona \nPanoramatos [a cream puff \npastry] – one of the city’s best \nknown sweet delicacies – were \ncreated at a local confectionery \nin the 1950’s.\nMUST SEE:\nPlatanakia.\nIt is a nice place for relaxing, \nin a wooded ravine, with a \nsmall Zoo and a café. A 6 km \npath begins here and leads \nup to the artificial lake (dam) \nof Thermi. Along the way you \nwill come across spots for a \nbrief rest, short waterfalls and \nfragments of eight Byzantine \nwatermills.', '95\ngulf. You will find a marine \nsports and a beach volleyball \nfacility on Asprovalta beach \n(10 km long and awarded a \nBlue Flag) and on Nea Vrasna \nbeach; Stavros is the biggest \nharbour in the gulf. Vrasna \nand Ano Stavros villages \nare situated at the foot of \nMt Kerdylia; their traditional \narchitecture makes them \nabsolutely worth visiting.\nHow to get there. From \nThessaloniki, take the 83, \n83M or 83N bus line to reach \nLagkadas. For the other areas, \ntravel by coach. If you go \nby car, head for Panorama, \nChortiatis and Agios Vasileios \n(to reach Lake Koroneia) \nand from that point go east \ntowards Kavala (to visit Lake \nVolvi and the Strymonian gulf).\n6 \tPIKROLIMNI \nIt is located in the \nneighbouring Kilkis regional \nunit, to the south. It is a \nshallow lake (covering a \n450-hectare area) and in \nthe lake floor mud there are \nchemical combinations such \nas sulphides and nitric salts \nwith healing and cosmetic \nproperties known across the \ncountry - the concentration \nis three times higher than \nthat in the Dead Sea. In the \nneighbouring Xylokeratia \nvillage you can visit the first \nMud-therapy (Spa) Centre \nin the Balkans.', 'The place was also \nknown for its hot springs – \nthermae – hence the name  \nof the gulf (Thermaikos). During \nthe Byzantine and Ottoman \nperiod it was known as Sedes; \nin modern times, refugees \ninhabited the area in the early \n20th c.\nMUST SEE:\nParamana Square.\nIn 2009 Thermi’s central \nsquare was awarded a prize \nfor its futuristic design, in an \narchitectural contest. The Town \nHall and the two St. Nicholas \nchurches (older and new one) \nare located here. This is where \nKaraoli-Dimitriou Street begins, \nthe area’s business hub, where \nyou will also find café-bars and \nrestaurants.\nArtificial lake.\nBordering on the suburb, \nthe lake was created when \na dam was built to contain \nthe water running through \na gully. It is the ideal place \nto make you feel refreshed \nand relaxed; in the summer \nthe Dam Music Festival takes \nplace there. Further north, \nwithin a short distance you \nwill see the Environmental \nPark with a playground, tennis \ncourts, basketball and football \ngrounds.\n73.  \nOn the slopes of  \nMt. Chortiatis, \ntowards Thermi.\n74.  \nFuturistic \nParamana Sq. \n(Thermi).\n73', '91\nDAY EXCURSIONS\nPraetorium and the public \ntoilets (called Vespasians) \nwhich were located to the east.\nThe Hydraulis sector.\nThis was a complex of \nbuildings named after the \ncopper hydraulis [a type of pipe \norgan] found here along with \na multitude of other copper \nitems.\nVilla of Dionysus.\nThis urban area house (2nd c.  \nAD) is where an amazing mosaic  \nwas found, depicting Dionysus \non a chariot coming out  \nof the sea.\nArchaeological Museum.\nHoused in a brand new \nbuilding, the Archaeological \nMuseum showcases finds \nfrom the Dion area (statues, \ninscriptions, artefacts \netc) classified in thematic \ngroups (public buildings, \nhouses, sanctuaries, ancient \ntechnology etc), and also finds \nfrom the foot of Mt Olympus \nand ancient Pydna. The Ancient \nRelics House lies opposite and \nshowcases more recent finds \nfrom ongoing excavations.\n3.1  Mt. Olympus.\nThe highest Greek mountain \n(2,918 m.) is globally known  \nas the residence of the 12 gods \nof ancient Greek mythology. \nIt is the first National Park of \nGreece (1938); in 1981 it was \ndesignated a World Biosphere \nReserve area by UNESCO.']","['PANORAMA One of the best suburbs of Thessaloniki is situated at a 12 km distance S of the city centre and was built on the slope of Mt Chortiatis, offering a panoramic city view. It was uninhabited until the early 20th c., although traces of a prehistoric settlement have been located on the area. The first inhabitants were refugees from Asia Minor and Pontus. Today its largest part is covered by luxury villas and impressive detached homes; there is a small shopping area in the centre. Trigona Panoramatos [a cream puff pastry] – one of the city’s best known sweet delicacies – were created at a local confectionery in the 1950’s. MUST SEE: Platanakia. It is a nice place for relaxing, in a wooded ravine, with a small Zoo and a café. A 6 km path begins here and leads up to the artificial lake (dam) of Thermi. Along the way you will come across spots for a brief rest, short waterfalls and fragments of eight Byzantine watermills. 11 12 13 14 KONSTANTINOUPOLEOS SSIS OLGAS GIOU PAPANDREOU ROSIDI ROSIDI GEORGIOU PAPANDREOU APAFI MARKOU BOTSARI PAPANASTASIOU ANATOLIKIS THRAKIS PAPANASTASIOU VOULGARI KANARI KANARI KARAKASI KARAKASI DELFON GAVRIILIDI TH. SAKELLARIDI GAVRIILIDI KARAOLI VOULGARI KOURTIDI YPSILANTOU PLASTIRA KORAI SMYRNIS MIAOULI PLASTIRA PLASTIRA KERASOUNTOS THEMISTOKLI SOFOULI KALYVA METAMORFOSEOS KOMNINON PONTOU PONTOU AIGAIOU AIGAIOU ADRIANOUPOLEOS EL. VENIZELOU ETHNIKIS ANTISTASIS KOLOTOUROU THICHIS PAPAFLESSA MERKOURIOU KIFISIAS KIFISIAS PSELOU SOLONOS MANTINEIAS GAMVETA METAMORFOSI AGIOS NIKOLAOS NATHANAIL MALAKASI POLYLA PARASCHOU TYPALDOU GRYPARI ROIDI GAMVETA MAKEDONIAS STROMNITSIS MELENIKOU MOUSOURI PAPANTONIOU CHRISTOVASILI PORFYRA SKIATHOU ANINOU KRITIS CHAIRONEIAS PARNASSOU KOUSKOURA PAPADIMITRIOU TAKI OIKONOMIDI DODEKANISOU MITROPOLITI AMVROSIOU MITROPOLITI KALIDI MITROPOLITI GRIGORIOU KYDONION MOSCHONISION THEMISTOKLI SOFOULI KROMNIS PLOUTONOS KASSOMOULI SANGARIOU VISSARIONOS KAPETANIDI NAVARINOU KOLCHIDAS PAPAGOU KIOU POULANTZAKI KALIDOU KAVASITON XENOFONTOS IL E TIR G A NIKOMIDEIAS TRIPOLEOS CHILIS MARMARA CHALKIS VITHYNIAS MIKROULEA KONITSIS SARATSI THERAPEION NIKAIAS AGIAS ELENIS AGIOU IOANNOU VOSPOROU ELLISPONTOU MAKROCHORIOU KARAMAOUNA KARATASOU PAPANASTASIOU LEVANTI KAZIKA IRAKLEIAS IOAKEIM G’ CHRYSOSTOMOU SMYRNIS ADRAMITIOU METRON ANDROUTSOU EFESOU PASALIDI TAXIARCHON MYSTAKIDI MOUDANION EVELPIDOU AGIOU NIKOLAOU PROUSAS DALIPI BALA PAPAPETROU AVDELA KOMNINON KOTYORON ARGYROUPOLEOS SANTAS MYRION AKRITIDI EPANOMIS PAPAKYRITSI AMISSOU LEROU KYPROU PATMOU YPSILANTOU KYMIS MAKRYRACHIS SOUMELA PARANIKA VAZELONOS IASONIDI KYRIAKIDI FOKAIAS DAVAKI AGIOU VASILEIOU DIOGENOUS LEFKOSIAS ARISTOFANOUS FANARIOU PALAMA PANORMOU GRIGORIADI KALANTIDI ANATOLIKIS THRAKIS SOULIOU OMIROU ZALONGOU IONIAS PARIDOS FILADELFEIAS KAPADDOKIAS PROMITHEOS XENOPOULOU IKONIOU IPPOKRATOUS RANGAVI DIOS SOKRATOUS SOLOMOU PLOUTARCHOU EVRIPIDOU SOURI PAPANTONIOU THOUKYDIDI IOUSTINIANOU ALKIONOS ZIRGANOU IRAS LOUI SEVASTEIAS KARAVANGELI ERYTHROU STAVROU MEGALOU ALEXANDROU KAZAZI KAISAREIAS LAODIKIAS IEROSOLYMON AIANTOS AIVATZIDI AGIOU PANTELEIMONOS ANEMONAS PASTER FILELLINON KERAMOPOULOU KALAVRYTON PAPADIAMANTI FILIPPOU V. IPEIROU KOLOKOTRONI VLACHERNON KORYTSAS RODOU IRODOTOU LASANI ARISTOTELOUS ARISTEIDOU PERIKLEOUS TATAOULON DORILEOU POKIOUPTSIDI KYZIKOU KAFKASOU TSINGIRIDI AGIOU ZACHARIA CHERIANON CHALDEIAS KAROLIDI CHEIMONIDI AIMILIANOU MITR. ARTAKIS ERATYRAS ANTIGONIS VOULGAROKTONOU PARASKEVOPOULOU APOSTOLOU PAVLOU FLEMING KONSTANTINOUPOLEOS KYFONIDI S A R E M I CHRYSOULIDI THERMAIKOU PAPANIKOLA NIKOPOLEOS TRAPEZOUNTAS VASILEIADOU SIFILINON SOURMENON ARGYROPOULOU NEAPOLEOS STRAVONOS ARGONAFTON KYDONION PAPADAKI SIGALA AKTAIOU ANDRONIKOU POLEMI PAPADAKI PANSELINOU ADMITOU KASSANDREOS TSOUNTA POULIOU KORNAROU NALTSA FRANTZI KRYSTALI AINOU SIK A R H T O M A S LOGOTHETOU NIKOLAIDI THEMELI SPETSON LASKARATOU TYPA YPSILANTOU DROSINI CHALKIDIKIS THERMOPYLON THALITOS PITTAKOU GRAVIAS GRAVIAS FILELLINON OROMILA KRITIS PAPADIAMANTI NASTOU ALKMINIS NATSINA GENNADIOU MITR. NEMEAS PLATAION DANIOLOU AGIOU VASILEIOU GENNADIOU MITR. PAPAKYRIAZI KARKAVITSA AVROKORDATOU VOGA US IPATIAS KISSOU KARIATIDAS KAVIRON AGAMEMNONOS U S ARGAIOU FOINIKOS EFESSOU KAISAREIAS KALLIPOLEOS VRYOULON KYZIKOU NIKOMIDEIAS NEAPOLEOS MIDEIAS APADDOKIAS KAONIAS INIOSOGLOU NIKAIAS KAROLIDOU RANTI AS KI NIAS SANTAS POULA YPARCHOU FOKYLIDOU KERAMIKOU EPIDAVROU TSELIOU TSELIOU PRAXAGORA OLYMPIAS VOSPOROU AMFIPOLEOS MIKRAS ASIAS PONTOU VITHYNIAS PAPAGEORGIOU IOANNOU KAISAREIAS METRON IMVROU AGRIANON CHIOU CHOURMOUZI APOLLONOS SYROU FAIAKON LARNAKOS AMMOCHOSTOU NAFPLIOU NAFPLIOU DERKON KORDELIOU VIZYIS DORYLAIOU TINOU TENEDOU DARDANELLION DIMITSANAS EPIDAVROU EFSTATHIOU MITROPOLITOU PILEAS CHANDRINOU FILINTA DORYLAIOU KARANIVALOU ATLANTIDAS SVOLOU VOSPOROU ZACHOU ZIRINI ZONARA ANAXIMENOUS ANATOLIKIS ROMYLIAS ISOKRATOUS TOUSSA SPEFSIPOU MYSTAKIDI DYSTOMOU MIKROU ANTISTHENOUS STEFANOU DIMOCHAROUS MISIRLI PILEAS AEROPOU PAFSILYPOU TRIANTAFYLLOPOULOU AGALIANOU PRAIDI STAMATELOU FILI STAGIRITI STADIOU IPEIROU KYPROU KARAVANGELI MARATHONOS MAKEDONIAS ETHNIKIS CHRΥSOSTOMOU AGRA NEARCHOU IFAISTIONOS OLYMPOU KORYTSAS PTOLEMAIOU PERDIKA OLYMPIADOS OLYMPIADOS THER MOPYLON KENEDY PLASTIRA PLASTIRA PROFITI ILIA MEGALOU ALEXANDROU VAS. KONSTANTINOU GRIGORIOU LAMPRAKI (KONITSIS) FLEMING NIKIS AMFOTEROU ETEOKLI DIGKA ETEOKLI IGILOCHOU NIKANOROS EVMENOUS VASIKYROU KARATHEODORI GAZI ANAKREONTOS ANTAIOU NOUKA SEFERI POSEIDONOS MELEAGROU ANGELOU ALKAMENOUS ANAXIMANDROU ANAXIMANDROU LEONIDOU KARDITSIS IRAKLEOUS KORAI MELENIKOU ALKMINIS PARALI GLYNOU TZAVELA TZAVELA RIGA FERAIOU CHORN ZOUMETIKOU MARASLI MARSLI XENOU MAVROMICHALI ADRIANOUPOLEOS ATREIDON XYNGOPOULOU ARKADIOU OSIAS XENIS STROMNITSIS OKEANIDON DEINOKRATOUS VAMVA AGISILAOU NEOPTOLEMOU PAPA PAVLOU MELA VENIZELOU ARISTOTELOUS EIRINIS FILIKIS ETAIRIAS FILIPPOU PRASSAKAKI SCHOLEION OMIROU KOLOKOTRONI PALAIOLOGOU LAOGR. MOUSEIOU DAVAKI SELEFKOU TSELEPI TSIAPANOU TSAMI STRATIGI STRATIGI VISTA ANGELOPOULOU DIVOLI GKOURA GRIGORIOU STEFANOU ATHINA ANTHEMOUNTOS LEFAKI PAFSANIA SEMELIS AETIONOS PANTAZIDI PERRAIVOU PERRAIVOU SPANOU IPPOKRATOUS IPPOKRATOUS DIMOKRITOU VOSPOROU GLYNOU GLYNOU THEOFILOU PAPANASTASIOU VYZANTIOU PAPAFLESSA ANOIXIS VARNALI SPYROU LOUI KALVOU SYMEONIDI PROTOMAGIAS PALAMA DIMOKRATIAS VISVIZI ARTAKIS U EPTALOFOU PARMENIDI TIROLOIS EMOU POLYGNOTOU DROMIOU LISSIPOU ANTIFANOS MEGAKLEOUS EMMANOUIL EFTALIOTI EFTALIOTI DOMPOLI DOUKA ANAXIMENOUS NEARCHOU RIGA FERAIOU SEFERI MENANDROU PAPANIKOLAOU ANAPAFSEOS ZORBA ANAPAFSEOS KAFANTARI POSEIDONOS ALATSATON ANTISTASEOS AGIOS THERAPON PROFITIS ILIAS AGIOS ELEFTHERIOS TREIS IERARCHES OSIA XENI MALAKOPI CHARILAOU ARETSOU TROCHIODROMIKON DEPO ALATINI CHEN KOURI VOTSI KIFISIA VYZANTIO KATIRLI DERKON KARAMPOURNAKI EXOCHES KONSTANTINOUPOLITON KATO TOUMPA TOUMPA CEMETERY ENGLISH CEMETERY KALAMARIA CEMETERY PILEA CEMETERY THERMI - CHALKIDIKI MIKRA CHALKIDIKI PANORAMA GOVATZIDAKI SQ. AINOU SQ. KAOUDI SQ. PATRIKIOU AILIDI SQ. SQ. SKRA SQ. PILEA KALAMARIA THESSALONIKI KERAMEIA ALATINI ARISTOTELIS AGIOU ELEFTHERIOU SQ. RETIREMENT HOME 2.2 2.3 2.4 2.5 2.1 2.4 72']","Mt Chortiatis is a prominent mountain located near Thessaloniki, Greece, with an elevation of 1,201 meters. It is situated approximately 10 kilometers northeast of the suburb of Panorama and is known for its natural beauty and outdoor recreational opportunities. The mountain is covered with diverse vegetation, including chestnut, oak, beech, and fir trees, making it an ideal destination for hiking, mountain biking, and off-roading, with 32 charted paths available for exploration.

Historically, Mt Chortiatis has played a significant role in the water supply of Thessaloniki since Roman times, with water sourced from the area flowing through the Vlatadon Monastery. Visitors can find remnants of a Byzantine aqueduct at the mountain's border, adding a historical dimension to the natural landscape.

For those looking to visit, access is convenient via public transportation. You can take the 58 bus on Egnatia Street and disembark at stops such as Dimarchio (Town Hall) or Astynomia (Police Station). This makes it easy for solo travelers to explore the area without the need for a car.

In addition to its outdoor activities, Mt Chortiatis offers stunning panoramic views of Thessaloniki, making it a perfect spot for photography enthusiasts seeking Instagrammable moments. The nearby suburb of Panorama is known for its luxury villas and small shopping area, providing a charming atmosphere for visitors.

Overall, Mt Chortiatis is a must-visit destination for anyone looking to enjoy nature, engage in outdoor activities, and appreciate the historical significance of the region while experiencing the local culture.","Mt Chortiatis is a mountain located near Panorama, one of the best suburbs of Thessaloniki, situated 12 km south of the city center. It offers a panoramic view of the city and has traces of a prehistoric settlement.",0.6666666666666666,0.34,0.7272727272727273,0.8505295560018861,0.9999999999,0.99999999995,0.0,0.49999999875,,0.8373211015912517
35,What is Mt Chortiatis and what can I see there?,"['66\nSUBURBS AND CITY OUTSKIRTS\n3.1  Chortiatis.\nNamed after the mountain, \nthis small suburb on Mt \nChortiatis (elev.: 1,201 m.), \nstretches approx. 10 km NE  \nof Panorama. Since the Roman \ntimes, Thessaloniki’s water \nsupply came from this place \nvia Vlatadon Monastery (see \np. 44); this is why you will \nsee fragments of a Byzantine \naqueduct at the suburb’s \nborder. The mountain is covered \nwith chestnut, oak, beech and \nfir trees, there is a mountain \nrefuge (Kissos location, elev. \n1,201 m.) and it is the ideal \nplace for hiking (there are 32 \ncharted paths), for mountain \nbiking and off-roading.\nHow to get there. Board \nthe 58 bus on Egnatia Street \nand get off at Dimarchio \n[Town Hall], Astynomia [Police \nStation] or at Platanakia stop.\n4 \tTHERMI\nThis suburb is located a bit \nfurther away from town (15 km \nSE of the city centre) and more \nor less still keeps a countryside \nair about it. On-site excavations \nhave shown that this was the \nlocation of the harbour of \nancient Thermi, a major one  \nin antiquity. The place was also \nknown for its hot springs – \nthermae – hence the name  \nof the gulf (Thermaikos).', 'The last part consists of \nwhat is believed to have \nbeen the tomb of Alexander \nIV, son of Alexander the \nGreat and Roxanne, who was \nassassinated by Cassander in \n310 BC; a silver urn containing \nthe bones of the dead person, \nframed with the ivory relief \nmotifs of the funeral bed. \nIn a separate room, visitors \ncan watch a video where M. \nAndronikos takes them on a \ntour of the monuments. Other \nexcavations in the wider area \nof the Aiges necropolis have \nunearthed archaic tombs, pit \nand cist tombs (6th and 5th c. \nBC), as well as temple-shaped \nmacedonian tombs one of \nwhich apparently belonged  \nto Queen Eurydice, the mother  \nof King Philip II\nPalace. It covers a 12,500 \nm2 area and it used to be \nthe largest and the most \nimportant construction (next \nto Parthenon, Athens) of the \nHellenic Classical Antiquity. \nThis two-storeyed edifice \nis presumed to be the work \nof Pytheos who was the \narchitect of the Mausoleum \nof Halicarnassos [modern-day \nBodrum, Turkey], one of the 7 \nwonders of the ancient world. \nThe palace’s architectural style \nis considered avant-garde for \nthat time and it was built of \nlimestone during the 2nd half \nof the 4th c. BC on a plateau; \n101, 102 & \n103.', '95\ngulf. You will find a marine \nsports and a beach volleyball \nfacility on Asprovalta beach \n(10 km long and awarded a \nBlue Flag) and on Nea Vrasna \nbeach; Stavros is the biggest \nharbour in the gulf. Vrasna \nand Ano Stavros villages \nare situated at the foot of \nMt Kerdylia; their traditional \narchitecture makes them \nabsolutely worth visiting.\nHow to get there. From \nThessaloniki, take the 83, \n83M or 83N bus line to reach \nLagkadas. For the other areas, \ntravel by coach. If you go \nby car, head for Panorama, \nChortiatis and Agios Vasileios \n(to reach Lake Koroneia) \nand from that point go east \ntowards Kavala (to visit Lake \nVolvi and the Strymonian gulf).\n6 \tPIKROLIMNI \nIt is located in the \nneighbouring Kilkis regional \nunit, to the south. It is a \nshallow lake (covering a \n450-hectare area) and in \nthe lake floor mud there are \nchemical combinations such \nas sulphides and nitric salts \nwith healing and cosmetic \nproperties known across the \ncountry - the concentration \nis three times higher than \nthat in the Dead Sea. In the \nneighbouring Xylokeratia \nvillage you can visit the first \nMud-therapy (Spa) Centre \nin the Balkans.', 'Get off at \nNaftikos Omilos [Marine Club] \nstop or at Chamodrakas stop \nin Aretsou area.\n3 \tPANORAMA\nOne of the best suburbs of \nThessaloniki is situated at  \na 12 km distance S of the \ncity centre and was built on \nthe slope of Mt Chortiatis, \noffering a panoramic city view. \nIt was uninhabited until the \nearly 20th c., although traces \nof a prehistoric settlement \nhave been located on the area. \nThe first inhabitants were \nrefugees from Asia Minor and \nPontus. Today its largest part \nis covered by luxury villas and \nimpressive detached homes; \nthere is a small shopping \narea in the centre. Trigona \nPanoramatos [a cream puff \npastry] – one of the city’s best \nknown sweet delicacies – were \ncreated at a local confectionery \nin the 1950’s.\nMUST SEE:\nPlatanakia.\nIt is a nice place for relaxing, \nin a wooded ravine, with a \nsmall Zoo and a café. A 6 km \npath begins here and leads \nup to the artificial lake (dam) \nof Thermi. Along the way you \nwill come across spots for a \nbrief rest, short waterfalls and \nfragments of eight Byzantine \nwatermills.', '101\nand sports facilities.\nTour the suburban forests \nof Seich Sou (see p. 47) and \nChortiatis (see p. 66) where \nyou can follow the hiking trails \nor go mountain biking, find the \nspots designated for sports \nactivities or just relax by the \nDeltas of Gallikos river and \nAxios-Loudias-Aliakmonas \nrivers (see p. 63) or by the \nlakes Koroneia and Volvi  \n(see p. 93-94).\nThere are some quite \ninteresting educational \nprogrammes for children, \nrunning in most museums \n(see p. 70 - 81), particularly \nin the Children’s Museum \n(see p. 79) which is the only one  \nof its kind.\nHave fun and at the same  \ntime get familiar with science  \nand technology at the Noesis  \n– Science Centre and \nTechnology Museum (see p. \n67) or at the Nouvelle multi-\npurpose venue (7th km on the \nThessaloniki – Oraiokastro \nRoad) where you can visit the \nEnvironmental Dinosaur Theme \nPark and see the natural size \nreconstructions of animals, \nthe Mammoth Museum where \nfossils of the hairy mammoth \nare on display, the Cave where \nthere are depictions of creation \nand prehistoric life in caves  \nas well as the Interactive \nMuseum of Greek Traditional \nToys and Games  \n(www.parkodeinosauron.gr).   \nAnother option for you \nis to go swimming in the \nbeautiful beaches by the \nseaside suburbs and city \noutskirts (see p.']","['PANORAMA One of the best suburbs of Thessaloniki is situated at a 12 km distance S of the city centre and was built on the slope of Mt Chortiatis, offering a panoramic city view. It was uninhabited until the early 20th c., although traces of a prehistoric settlement have been located on the area. The first inhabitants were refugees from Asia Minor and Pontus. Today its largest part is covered by luxury villas and impressive detached homes; there is a small shopping area in the centre. Trigona Panoramatos [a cream puff pastry] – one of the city’s best known sweet delicacies – were created at a local confectionery in the 1950’s. MUST SEE: Platanakia. It is a nice place for relaxing, in a wooded ravine, with a small Zoo and a café. A 6 km path begins here and leads up to the artificial lake (dam) of Thermi. Along the way you will come across spots for a brief rest, short waterfalls and fragments of eight Byzantine watermills. 11 12 13 14 KONSTANTINOUPOLEOS SSIS OLGAS GIOU PAPANDREOU ROSIDI ROSIDI GEORGIOU PAPANDREOU APAFI MARKOU BOTSARI PAPANASTASIOU ANATOLIKIS THRAKIS PAPANASTASIOU VOULGARI KANARI KANARI KARAKASI KARAKASI DELFON GAVRIILIDI TH. SAKELLARIDI GAVRIILIDI KARAOLI VOULGARI KOURTIDI YPSILANTOU PLASTIRA KORAI SMYRNIS MIAOULI PLASTIRA PLASTIRA KERASOUNTOS THEMISTOKLI SOFOULI KALYVA METAMORFOSEOS KOMNINON PONTOU PONTOU AIGAIOU AIGAIOU ADRIANOUPOLEOS EL. VENIZELOU ETHNIKIS ANTISTASIS KOLOTOUROU THICHIS PAPAFLESSA MERKOURIOU KIFISIAS KIFISIAS PSELOU SOLONOS MANTINEIAS GAMVETA METAMORFOSI AGIOS NIKOLAOS NATHANAIL MALAKASI POLYLA PARASCHOU TYPALDOU GRYPARI ROIDI GAMVETA MAKEDONIAS STROMNITSIS MELENIKOU MOUSOURI PAPANTONIOU CHRISTOVASILI PORFYRA SKIATHOU ANINOU KRITIS CHAIRONEIAS PARNASSOU KOUSKOURA PAPADIMITRIOU TAKI OIKONOMIDI DODEKANISOU MITROPOLITI AMVROSIOU MITROPOLITI KALIDI MITROPOLITI GRIGORIOU KYDONION MOSCHONISION THEMISTOKLI SOFOULI KROMNIS PLOUTONOS KASSOMOULI SANGARIOU VISSARIONOS KAPETANIDI NAVARINOU KOLCHIDAS PAPAGOU KIOU POULANTZAKI KALIDOU KAVASITON XENOFONTOS IL E TIR G A NIKOMIDEIAS TRIPOLEOS CHILIS MARMARA CHALKIS VITHYNIAS MIKROULEA KONITSIS SARATSI THERAPEION NIKAIAS AGIAS ELENIS AGIOU IOANNOU VOSPOROU ELLISPONTOU MAKROCHORIOU KARAMAOUNA KARATASOU PAPANASTASIOU LEVANTI KAZIKA IRAKLEIAS IOAKEIM G’ CHRYSOSTOMOU SMYRNIS ADRAMITIOU METRON ANDROUTSOU EFESOU PASALIDI TAXIARCHON MYSTAKIDI MOUDANION EVELPIDOU AGIOU NIKOLAOU PROUSAS DALIPI BALA PAPAPETROU AVDELA KOMNINON KOTYORON ARGYROUPOLEOS SANTAS MYRION AKRITIDI EPANOMIS PAPAKYRITSI AMISSOU LEROU KYPROU PATMOU YPSILANTOU KYMIS MAKRYRACHIS SOUMELA PARANIKA VAZELONOS IASONIDI KYRIAKIDI FOKAIAS DAVAKI AGIOU VASILEIOU DIOGENOUS LEFKOSIAS ARISTOFANOUS FANARIOU PALAMA PANORMOU GRIGORIADI KALANTIDI ANATOLIKIS THRAKIS SOULIOU OMIROU ZALONGOU IONIAS PARIDOS FILADELFEIAS KAPADDOKIAS PROMITHEOS XENOPOULOU IKONIOU IPPOKRATOUS RANGAVI DIOS SOKRATOUS SOLOMOU PLOUTARCHOU EVRIPIDOU SOURI PAPANTONIOU THOUKYDIDI IOUSTINIANOU ALKIONOS ZIRGANOU IRAS LOUI SEVASTEIAS KARAVANGELI ERYTHROU STAVROU MEGALOU ALEXANDROU KAZAZI KAISAREIAS LAODIKIAS IEROSOLYMON AIANTOS AIVATZIDI AGIOU PANTELEIMONOS ANEMONAS PASTER FILELLINON KERAMOPOULOU KALAVRYTON PAPADIAMANTI FILIPPOU V. IPEIROU KOLOKOTRONI VLACHERNON KORYTSAS RODOU IRODOTOU LASANI ARISTOTELOUS ARISTEIDOU PERIKLEOUS TATAOULON DORILEOU POKIOUPTSIDI KYZIKOU KAFKASOU TSINGIRIDI AGIOU ZACHARIA CHERIANON CHALDEIAS KAROLIDI CHEIMONIDI AIMILIANOU MITR. ARTAKIS ERATYRAS ANTIGONIS VOULGAROKTONOU PARASKEVOPOULOU APOSTOLOU PAVLOU FLEMING KONSTANTINOUPOLEOS KYFONIDI S A R E M I CHRYSOULIDI THERMAIKOU PAPANIKOLA NIKOPOLEOS TRAPEZOUNTAS VASILEIADOU SIFILINON SOURMENON ARGYROPOULOU NEAPOLEOS STRAVONOS ARGONAFTON KYDONION PAPADAKI SIGALA AKTAIOU ANDRONIKOU POLEMI PAPADAKI PANSELINOU ADMITOU KASSANDREOS TSOUNTA POULIOU KORNAROU NALTSA FRANTZI KRYSTALI AINOU SIK A R H T O M A S LOGOTHETOU NIKOLAIDI THEMELI SPETSON LASKARATOU TYPA YPSILANTOU DROSINI CHALKIDIKIS THERMOPYLON THALITOS PITTAKOU GRAVIAS GRAVIAS FILELLINON OROMILA KRITIS PAPADIAMANTI NASTOU ALKMINIS NATSINA GENNADIOU MITR. NEMEAS PLATAION DANIOLOU AGIOU VASILEIOU GENNADIOU MITR. PAPAKYRIAZI KARKAVITSA AVROKORDATOU VOGA US IPATIAS KISSOU KARIATIDAS KAVIRON AGAMEMNONOS U S ARGAIOU FOINIKOS EFESSOU KAISAREIAS KALLIPOLEOS VRYOULON KYZIKOU NIKOMIDEIAS NEAPOLEOS MIDEIAS APADDOKIAS KAONIAS INIOSOGLOU NIKAIAS KAROLIDOU RANTI AS KI NIAS SANTAS POULA YPARCHOU FOKYLIDOU KERAMIKOU EPIDAVROU TSELIOU TSELIOU PRAXAGORA OLYMPIAS VOSPOROU AMFIPOLEOS MIKRAS ASIAS PONTOU VITHYNIAS PAPAGEORGIOU IOANNOU KAISAREIAS METRON IMVROU AGRIANON CHIOU CHOURMOUZI APOLLONOS SYROU FAIAKON LARNAKOS AMMOCHOSTOU NAFPLIOU NAFPLIOU DERKON KORDELIOU VIZYIS DORYLAIOU TINOU TENEDOU DARDANELLION DIMITSANAS EPIDAVROU EFSTATHIOU MITROPOLITOU PILEAS CHANDRINOU FILINTA DORYLAIOU KARANIVALOU ATLANTIDAS SVOLOU VOSPOROU ZACHOU ZIRINI ZONARA ANAXIMENOUS ANATOLIKIS ROMYLIAS ISOKRATOUS TOUSSA SPEFSIPOU MYSTAKIDI DYSTOMOU MIKROU ANTISTHENOUS STEFANOU DIMOCHAROUS MISIRLI PILEAS AEROPOU PAFSILYPOU TRIANTAFYLLOPOULOU AGALIANOU PRAIDI STAMATELOU FILI STAGIRITI STADIOU IPEIROU KYPROU KARAVANGELI MARATHONOS MAKEDONIAS ETHNIKIS CHRΥSOSTOMOU AGRA NEARCHOU IFAISTIONOS OLYMPOU KORYTSAS PTOLEMAIOU PERDIKA OLYMPIADOS OLYMPIADOS THER MOPYLON KENEDY PLASTIRA PLASTIRA PROFITI ILIA MEGALOU ALEXANDROU VAS. KONSTANTINOU GRIGORIOU LAMPRAKI (KONITSIS) FLEMING NIKIS AMFOTEROU ETEOKLI DIGKA ETEOKLI IGILOCHOU NIKANOROS EVMENOUS VASIKYROU KARATHEODORI GAZI ANAKREONTOS ANTAIOU NOUKA SEFERI POSEIDONOS MELEAGROU ANGELOU ALKAMENOUS ANAXIMANDROU ANAXIMANDROU LEONIDOU KARDITSIS IRAKLEOUS KORAI MELENIKOU ALKMINIS PARALI GLYNOU TZAVELA TZAVELA RIGA FERAIOU CHORN ZOUMETIKOU MARASLI MARSLI XENOU MAVROMICHALI ADRIANOUPOLEOS ATREIDON XYNGOPOULOU ARKADIOU OSIAS XENIS STROMNITSIS OKEANIDON DEINOKRATOUS VAMVA AGISILAOU NEOPTOLEMOU PAPA PAVLOU MELA VENIZELOU ARISTOTELOUS EIRINIS FILIKIS ETAIRIAS FILIPPOU PRASSAKAKI SCHOLEION OMIROU KOLOKOTRONI PALAIOLOGOU LAOGR. MOUSEIOU DAVAKI SELEFKOU TSELEPI TSIAPANOU TSAMI STRATIGI STRATIGI VISTA ANGELOPOULOU DIVOLI GKOURA GRIGORIOU STEFANOU ATHINA ANTHEMOUNTOS LEFAKI PAFSANIA SEMELIS AETIONOS PANTAZIDI PERRAIVOU PERRAIVOU SPANOU IPPOKRATOUS IPPOKRATOUS DIMOKRITOU VOSPOROU GLYNOU GLYNOU THEOFILOU PAPANASTASIOU VYZANTIOU PAPAFLESSA ANOIXIS VARNALI SPYROU LOUI KALVOU SYMEONIDI PROTOMAGIAS PALAMA DIMOKRATIAS VISVIZI ARTAKIS U EPTALOFOU PARMENIDI TIROLOIS EMOU POLYGNOTOU DROMIOU LISSIPOU ANTIFANOS MEGAKLEOUS EMMANOUIL EFTALIOTI EFTALIOTI DOMPOLI DOUKA ANAXIMENOUS NEARCHOU RIGA FERAIOU SEFERI MENANDROU PAPANIKOLAOU ANAPAFSEOS ZORBA ANAPAFSEOS KAFANTARI POSEIDONOS ALATSATON ANTISTASEOS AGIOS THERAPON PROFITIS ILIAS AGIOS ELEFTHERIOS TREIS IERARCHES OSIA XENI MALAKOPI CHARILAOU ARETSOU TROCHIODROMIKON DEPO ALATINI CHEN KOURI VOTSI KIFISIA VYZANTIO KATIRLI DERKON KARAMPOURNAKI EXOCHES KONSTANTINOUPOLITON KATO TOUMPA TOUMPA CEMETERY ENGLISH CEMETERY KALAMARIA CEMETERY PILEA CEMETERY THERMI - CHALKIDIKI MIKRA CHALKIDIKI PANORAMA GOVATZIDAKI SQ. AINOU SQ. KAOUDI SQ. PATRIKIOU AILIDI SQ. SQ. SKRA SQ. PILEA KALAMARIA THESSALONIKI KERAMEIA ALATINI ARISTOTELIS AGIOU ELEFTHERIOU SQ. RETIREMENT HOME 2.2 2.3 2.4 2.5 2.1 2.4 72']","Mt Chortiatis is a picturesque mountain located approximately 10 km northeast of Panorama, Thessaloniki, standing at an elevation of 1,201 meters. It is a popular destination for outdoor enthusiasts, offering a variety of activities such as hiking, mountain biking, and off-roading, with 32 charted paths to explore. The mountain is adorned with lush forests of chestnut, oak, beech, and fir trees, providing a serene backdrop for nature lovers.

One of the notable historical features of Mt Chortiatis is the remnants of a Byzantine aqueduct, which can be found at the suburb's border. This aqueduct was part of Thessaloniki's ancient water supply system, drawing water from this area since Roman times, and is a testament to the region's rich history.

For those looking to relax, the area offers scenic spots for picnicking and enjoying the natural beauty. The mountain refuge at Kissos, located at the same elevation, serves as a great starting point for your adventures. Here, you can take in breathtaking views of the surrounding landscape and the city of Thessaloniki below.

To reach Mt Chortiatis, you can take the 58 bus from Egnatia Street and disembark at stops such as Dimarchio (Town Hall) or Astynomia (Police Station). This accessibility makes it easy for solo travelers to enjoy a day of exploration without the need for a car.

Overall, Mt Chortiatis is an ideal destination for sightseeing, offering a blend of natural beauty, outdoor activities, and historical significance, making it a perfect spot for a weekend getaway. Don't forget to capture the stunning views for your Instagram feed!","Mt Chortiatis is located near Panorama, a suburb of Thessaloniki, which is built on its slope. It offers a panoramic view of the city. The area has traces of prehistoric settlements and was first inhabited by refugees from Asia Minor and Pontus in the early 20th century. You can visit Platanakia, a nice place for relaxing with a small zoo and café, and a 6 km path that leads to the artificial lake of Thermi, featuring spots for rest, short waterfalls, and remnants of eight Byzantine watermills.",1.0,0.39,0.6666666666666666,0.8389470387772298,0.6999999999766667,0.249999999975,0.0,0.2222222219753086,,0.9184386044260021
36,"What is the historical significance of the Railway Station on Monastiriou Street in Thessaloniki, and how does it relate to the city's transportation development?","['The road \ndistances (in km) where \nThessaloniki is the starting \npoint get calculated from  \nthis square.\n2 \t\n\x07AROUND DIMOKRATIAS \nSQUARE\nThere are mostly faceless \nbuildings in the area – \namong them you will find \nsmall manufactures or old \nindustries. However there are \nalso historic sites, as there \nare sections of the city’s west \nwalls here, Byzantine and \nottoman monuments and other \narchaeological sites (temple  \nof Aphrodite, 6th c. BC).\nMUST SEE:\n2.1  Railway Station.\nIt is on Monastiriou Street \nwhich is renamed at some \npoint Egnatia Street (see p. 34). \nConstruction began in 1939 \nand it became fully operational \nin 1951, but it was officially \n66.  \nVardariou \nTower (Top \nHane).\n67.  \nOld steam \nengine \nfronting \nThessaloniki’s \nRailway \nStation.', 'ARC\nAG\nDIMIT\nTERPSITHEA\nSQ.\nRAILWAY STATION\nSQ.\nOLD RAILWAY\nSTATION SQ.\nGALANOPOULOU\nSQ.\nSYKIES\nNEAPOLI\nAMPELOKIPOI\nMENEMENI\nMAKEDONOMACHON\nSQ.\nKARAOLI-DIMITRIOU SQ.\nELEFTHERIAS\nSQ.\nDROPOTAMOS\n7th walk: \nWEST OF THE CENTRE-STAVROUPOLI\n2\n3\n1\n4\n3.2\n2.2\n2.1\n4.1\n4.2\n4.3\n4.3\n4.4\n2.3\n2.4\n2.5\n2.8\n2.7 2.6\n3.1\n3.3\n1 \t\x07DIMOKRATIAS SQUARE \n(VARDARI)\nSince ancient times, this  \nhas been the most important \nentry point to Thessaloniki. \nThis relatively disadvantaged \narea is a transportation hub \nconnecting the west and \nnorthwest suburbs with the \ncity centre; there are also \nseveral hotels, small shops, \ntavernas and cafés in the \narea. In the centre of the \nsquare you will see the statue \nof King Constantine (1868-\n1923), who entered the \ncity in 1912 in his capacity \nas commander-in-chief of \nthe Greek Army. The road \ndistances (in km) where \nThessaloniki is the starting \npoint get calculated from  \nthis square.', '64\nSUBURBS AND CITY OUTSKIRTS\nsituated nearby. The small \nmounds in the field are ancient \ntombs; a Neolithic settlement \nwas excavated in one of them \nwith a cemetery dating to the \nGeometric and Archaic period. \nAn impressive Macedonian \ntomb was also unearthed in \nAgios Athanasios area.\nHow to get there. Bus \nlines 40, 40A and 40K leave \nfor Kalochori from the Railway \nStation Stop. If you travel by \ncar, take the Athens direction \non the national road and turn \ntowards Kalochori.\n2 \tKALAMARIA\nThis is practically an eastward \n‘extension’ of Thessaloniki and \nthe city’s best known suburb, \nstretching along the waterfront, \nwith many green spaces and \na self-contained shopping \ncentre. The first inhabitants are \nrecorded in the early 20th c. and \nduring the 1920’s significant \nnumbers of Greek refugee \npopulations settled here and \nbuilt their small houses. They \ncame from Caucasus, Minor \nAsia and Pontus [modern- \nday northeast Turkey]. Today,  \ndespite the rising building trend  \nin the area, several refugee \nhouses remain, still keeping  \na flavour of times goneby.\nMUST SEΕ: \n2.1  Sofouli Street\n(see p. 53).\n2.2  Kyverneio [Government \nHouse] (Little Palace).', '67\nSUBURBS AND CITY OUTSKIRTS\nNoesis –Science Centre \nand Technology Museum\nIt is the only one of its kind \nin Greece! Construction of \nthis 14,000-m2 impressive, \nmodern complex was \ncompleted in 2004 on a small \nhill affording a panoramic view \nof the area. It is considered \nas the modern successor of \nthe Technology Museum of \nThessaloniki. The premises \ninclude screening rooms, \npermanent exhibitions \n(Technology Museum), a \nconference centre, a digital \nlibrary, spaces reserved for \ntemporary exhibitions and \neducational programmes, \nan amphitheatre for carrying \nout Demonstrations and \nExperiments, a museum shop \nand a restaurant-café (for \ninfo about exhibitions and \nprogrammes see p. 79).\nHow to get there. Take \nthe bus No. 10 from the \nRailway Station Stop or from \nEgnatia Street and get off at \nthe terminus in Charilaou area, \nthen board the 66 or 66B bus \nand exit at Paramana square \nor Zoni Kainotomias stop, to \nreach Noesis. If you travel by \ncar, follow the Thessaloniki – \nThermi route.\n5 \t\x07\nPERAIA – NEOI \nEPIVATES – AGIA \nTRIADA\nThese seaside areas are \nlocated 20 km S of the city \ncentre. The area was inhabited \nfor the first time in 1923 \nwhen refugees from Minor \nAsia settled here.', '106\nPassenger Railway Station.\n28, Monastiriou St, information \non domestic and international \ntimetables: \ntel.: 14511 \nwebsite: www.ose.gr\nThessaloniki Central Port \nAuthority (at the harbour). \nFor info on passenger ship \ntimetables,  \ntel.: 2313 325.821-4\nStavros Port Station: \ntel.: 23970 61.280\nIntercity bus service \n(K.T.E.L.).\nThere is a coach service to \nregional areas beyond the city \nlimits, and to most areas of \ncontinental Greece as well as \nthe islands of Corfu, Zante and \nCrete; buses leave from the \nMacedonia Intercity Bus Station, \nat 244, Giannitson St. (5 km W \nof the centre) \ntel.: 2310 595.400 \nwebsite: www.ktelmacedonia.gr\nTaxi Service.\nTaxis carry taximeters which \ncalculate the fare that must be \npaid and the driver must turn \nthe meter on as soon as the \npassenger is picked up. Fare 1 \nis on from 05.00-24.00; it is \nchanged to Fare 2 from 24.00 \nto 05.00. Every taxi driver \nmust have the updated charge \nrates on display as well as any \nadditional charges.  \nRadio Taxi:  \n«Taxiway» (tel.: 18300), \n«Mercedes» (tel.: 18180), \n«Macedonia» (tel.']","['<1-hop>\n\nMUST SEE: 2.1 Railway Station. It is on Monastiriou Street which is renamed at some point Egnatia Street (see p. 34). Construction began in 1939 and it became fully operational in 1951, but it was officially 66. Vardariou Tower (Top Hane). 67. Old steam engine fronting Thessaloniki’s Railway Station.']","The Railway Station on Monastiriou Street in Thessaloniki holds significant historical importance as a key transportation hub that has shaped the city's connectivity and development. Construction of the station began in 1939 and it became fully operational in 1951, marking a pivotal moment in Thessaloniki's transportation history. This station not only facilitated domestic travel but also served as a gateway for international connections, enhancing the city’s role as a major transit point in the region.

Historically, the station symbolizes the modernization of Thessaloniki's infrastructure during the mid-20th century, reflecting the broader trends of urban development and industrialization in Greece. Its strategic location on Monastiriou Street, which later transitions into Egnatia Street, underscores its importance in linking various parts of the city and connecting the suburbs to the urban center. This accessibility has made it a vital point for both locals and visitors, contributing to the economic and social dynamics of the area.

The Railway Station is also situated near significant historical sites, including sections of the city’s west walls and various Byzantine and Ottoman monuments. This proximity allows travelers to easily explore Thessaloniki's rich cultural heritage, making the station not just a transit point but also a starting point for sightseeing adventures.

For a first-time visitor, the Railway Station offers a glimpse into the city's past while serving as a practical resource for navigating Thessaloniki. Its historical significance is intertwined with the city’s ongoing evolution, making it an essential landmark for understanding Thessaloniki's transportation development and urban landscape.","The Railway Station on Monastiriou Street, which was later renamed Egnatia Street, holds historical significance as its construction began in 1939 and it became fully operational in 1951. This station is a key part of Thessaloniki's transportation development, symbolizing the city's connectivity and progress in the mid-20th century. Additionally, the presence of the old steam engine in front of the station highlights the historical evolution of transportation in the area.",1.0,0.43,0.3076923076923077,0.8778384063869826,0.9999999999,0.9999999999,0.0,0.7499999990624999,,0.9316067108153283
37,"What historical significance does Egnatia Street hold in Thessaloniki, and what notable landmarks can be found along this avenue?","['The monumental style of \narchitecture is shown in the \nbuildings’ facades, colonnades, \narcades and porticos, which \ncombine elements from the \ncity’s Byzantine tradition \nwith European interwar \nperiod motifs. The square is \nlandmarked by two identical \nconcave buildings: Electra \nPalace hotel (late sixties) - \nbuilt by GNTO architects -  \non the west side, and Olympion \non the east side, which was \nprogressively erected and \ncompleted by the late fifties \n(designed by J. Moshé) \nand is now the seat of the \nThessaloniki Film Festival  \n(see p. 108).\nMUST SEE:\n1.1  Aristotelous Street.\nPedestrianised historic \nboulevard, that ends in Egnatia \nStreet (see p. 34). According \nto the Hébrard plans, it would \n2nd walk: \nHISTORIC CENTRE (1) \nTRADITIONAL COMMERCIAL CENTRE\n4.1\n6.1\n6.3\n6.2\n6.5\n6.6\n6.7\n1.1\n1.2\n6.8\n7.5\n7.3\n7.2\n7.2\n7.1\n7.4\n6.4\n3.1\n1\n2\n3\n4\n5\n7', '34\n1 \tEGNATIA STREET\nThis central avenue has \nbeen there practically since \nThessaloniki’s founding,  \nas it is a section of the road \nconstructed by the Romans  \nin the 2nd c. BC, and connected \nDyrrhachium (Durrës, in \nmodern day Albania) with \nConstantinople. It starts at \nDimokratia square (see p. 58) \nand ends at the TIF grounds \n(see p. 31) and the Aristotle \nUniversity of Thessaloniki, \nsplitting in two the town’s \nhistoric centre. It is a busy \nshopping area with numerous \nremarkable buildings of \neclectic and art deco style \ndating to the early 20th c. \n(mostly old hotels) that are \nabsolutely worth observing,  \nas well as some of the city’s \nmost important monuments.\nMUST SEE:\n1.1  Kolomvou Square.\nThe crossroads where \nEgnatia Street meets \nAntigonidon Street is indeed \na bustling one! It was named \nafter G. Colombo, an Italian \nwho opened a hotel there  \nin the early 20th century. This \nis the location of Kolomvou \nArchway (31, Egnatia St.) \nwhich has become a leisure \nhub with cafés, bars and \nrestaurants inside.\n1.2  Hamza Bey Mosque.\nIt was built in 1467 by the \ndaughter of Hamza Bey, the \nmilitary commander of Sultan \nMurad II.', 'Today, this is one of \nthe top places in Thessaloniki, \ncrossed daily by thousands of \nlocals and visitors. One side \nof the avenue is lined with \ncafés and cosy little bars and \nthe opposite wide pedestrian \narea next to the sea gets \nfilled with strollers, cyclists, \nstreet artists and vendors. \nAmong the modern blocks of \nflats, you will see some of the \ncity’s major landmarks: past \nEleftherias square, the three-\nstorey interwar period mansion \nwhere Olympos-Naousa a \nonce popular restaurant used \nto be; Aristotelous square; \nKoniordou Mansion (at the \ncorner with Kar. Dil street); \nTyroloi Mansion built during \nthe Interbellum (located \nbetween Kar. Dil and Agia Sofia \nStreets), where Tottis coffee \nshop used to be for many \nyears; Mandalideio Mansion \n(1931) and Exarchopoulos \nMansion (1935) - the two \nlast ones are situated at the \njunction with Vogatsikou \nstreet; at 63, Nikis Avenue \nyou will see the three-storey \nbuilding of the Thessaloniki \nClub (1926); at number 73, \nPallas, an old cinema theatre, \nhouses the State Orchestra of \nThessaloniki.\n2nd walk: \nHISTORIC CENTRE (1)\nTRADITIONAL COMMERCIAL CENTRE\n10.  \nBustling Nikis \nAvenue and \nthe White \nTower in the \nbackground.\n10', 'In 1985 \nit was declared a protected \narchitectural monument and in \nrecent years a new generation \nof residents occupies the \narea. Built in the early 20th c. \nas a private residence, the \nneighbouring Zardinidi Villa \n(or Morpourgo) houses the \nSchool of Music Studies, the \nConservatoire of Northern \nGreece and an open air bar\n2.4  Sofouli Street.\nThis main road connects \nthe eastern districts of the \nMunicipality of Thessaloniki with \nthe district of Kalamaria (see \np. 64). Along most of the way \nit is lined with trees in front of \nshops, cafés and restaurants \n– a hotspot for the locals; the \nseafront section of the road \naffords a lovely view of the \ncity and you will also find cozy \nlittle bars and ouzo tavernas \nthere. Between Logothetou \nand Rossidi Streets notice the \ncomplex of four detached houses \nwith a garden, which bear a \ndirect reference to that area’s \npast countryside atmosphere.\n3 \t\x07VASILISSIS OLGAS \nAVENUE\nIt used to be called the \nCountryside [Exochon] avenue or \nthe Villas [Pyrgon] avenue and it \nwas a favourite promenade area \nfor the Thessalonians as it was \nbuilt along the waterfront amid \ngreen surroundings. Nowadays, \n59', '30\n3rd walk: \nHISTORIC CENTRE (2)\nMUSEUM AREA\nflats facing the adjacent \nIppodromiou square. This was \na 450 m. long and a 95 m. \nwide structure and it used to \nbe the centre of social activity \nfor citizens until 390 AD, \nwhen emperor Theodosius \nordered the massacre of \n7,000 Thessalonians there; \nthe event led to the close-\ndown of the Hippodrome. It is \nworth visiting the Thessaloniki \nHistory Centre, situated in the \nsquare’s south side as well as \nthe remarkable 18th c. Agios \nAntonios church in Margariti \nstreet nearby. \n8.7  Arched Hall.\nIt lies at the intersection  \nof Gounari and Svolou streets. \nThis was a place with heating \ninstallations for holding \nsymposia and ceremonies. \nIt had a direct access to \nthe imperial box in the \nHippodrome.\n8.8  Theatre - stadium  \nin Apellou Street.\nThe remains of a building \nhave been located at 5 & \n7 Apellou St., and they are \nconsidered to have been part \nof the theatre-stadium of the \ntown, which was in use from \nthe 1st until the 4th c. AD.  \nThere are references connecting \nthis place with the martyrdom \nof Agios Dimitrios, the city’s \npatron saint.\n9 \tTHREE CHURCHES\nOn the south side of Egnatia \nStreet, between K. Palaiologou \nSt.']","['<1-hop>\n\n34 1 EGNATIA STREET This central avenue has been there practically since Thessaloniki’s founding, as it is a section of the road constructed by the Romans in the 2nd c. BC, and connected Dyrrhachium (Durrës, in modern day Albania) with Constantinople. It starts at Dimokratia square (see p. 58) and ends at the TIF grounds (see p. 31) and the Aristotle University of Thessaloniki, splitting in two the town’s historic centre. It is a busy shopping area with numerous remarkable buildings of eclectic and art deco style dating to the early 20th c. (mostly old hotels) that are absolutely worth observing, as well as some of the city’s most important monuments. MUST SEE: 1.1 Kolomvou Square. The crossroads where Egnatia Street meets Antigonidon Street is indeed a bustling one! It was named after G. Colombo, an Italian who opened a hotel there in the early 20th century. This is the location of Kolomvou Archway (31, Egnatia St.) which has become a leisure hub with cafés, bars and restaurants inside. 1.2 Hamza Bey Mosque. It was built in 1467 by the daughter of Hamza Bey, the military commander of Sultan Murad II. It is the only mosque in Greece with a peristyle (a colonnaded yard). For many decades it housed a cinema named Alkazar. Currently there are renovation works under way. Once they are finished, it will house an exhibition of finds unearthed during the metro excavations. Right behind it you will see the City Manor which housed the Town Hall until recently. It is known at Karavan Serai as there used to be an ottoman inn here. (early 16th c.). 4th walk:']","Egnatia Street is a historically significant avenue in Thessaloniki, tracing its origins back to the 2nd century BC when it was part of a Roman road connecting Dyrrhachium (modern Durrës, Albania) to Constantinople. This central thoroughfare has been a vital artery for the city since its founding, effectively splitting the historic center and serving as a bustling shopping area filled with eclectic and art deco architecture from the early 20th century.

Notable landmarks along Egnatia Street include:

1. **Kolomvou Square**: A lively crossroads where Egnatia meets Antigonidon Street, known for its cafés, bars, and the Kolomvou Archway, making it a popular leisure hub.

2. **Hamza Bey Mosque**: Built in 1467, this mosque is a significant historical site reflecting the city’s Ottoman heritage.

3. **Aristotle University of Thessaloniki**: Located at the eastern end of Egnatia, this prestigious university adds a vibrant academic atmosphere to the area.

4. **Dimokratia Square**: The starting point of Egnatia Street, this square is a focal point for local gatherings and events.

5. **Various Eclectic Buildings**: The avenue is lined with remarkable buildings, including old hotels that showcase the city’s architectural diversity.

Egnatia Street not only offers a glimpse into Thessaloniki's rich history but also provides numerous opportunities for sightseeing and local interaction. As a first-time visitor, you can enjoy the blend of historical significance and modern vibrancy, making it an ideal spot for capturing Instagrammable moments while immersing yourself in the local culture.","Egnatia Street is historically significant as it has been a central avenue since the founding of Thessaloniki, originally constructed by the Romans in the 2nd century BC to connect Dyrrhachium with Constantinople. Along this busy shopping area, notable landmarks include Kolomvou Square, which features the Kolomvou Archway, a leisure hub with cafés and restaurants, and the Hamza Bey Mosque, built in 1467, which is unique for its peristyle and is currently undergoing renovations to house an exhibition of archaeological finds.",0.3333333333333333,0.55,0.8620689655172413,0.8532561304566602,0.5888888888692593,0.49999999995,1.0,0.6363636357851239,,0.9070360736280253
38,What is the historical significance of the Railway Station in Thessaloniki and its transportation role?,"['ARC\nAG\nDIMIT\nTERPSITHEA\nSQ.\nRAILWAY STATION\nSQ.\nOLD RAILWAY\nSTATION SQ.\nGALANOPOULOU\nSQ.\nSYKIES\nNEAPOLI\nAMPELOKIPOI\nMENEMENI\nMAKEDONOMACHON\nSQ.\nKARAOLI-DIMITRIOU SQ.\nELEFTHERIAS\nSQ.\nDROPOTAMOS\n7th walk: \nWEST OF THE CENTRE-STAVROUPOLI\n2\n3\n1\n4\n3.2\n2.2\n2.1\n4.1\n4.2\n4.3\n4.3\n4.4\n2.3\n2.4\n2.5\n2.8\n2.7 2.6\n3.1\n3.3\n1 \t\x07DIMOKRATIAS SQUARE \n(VARDARI)\nSince ancient times, this  \nhas been the most important \nentry point to Thessaloniki. \nThis relatively disadvantaged \narea is a transportation hub \nconnecting the west and \nnorthwest suburbs with the \ncity centre; there are also \nseveral hotels, small shops, \ntavernas and cafés in the \narea. In the centre of the \nsquare you will see the statue \nof King Constantine (1868-\n1923), who entered the \ncity in 1912 in his capacity \nas commander-in-chief of \nthe Greek Army. The road \ndistances (in km) where \nThessaloniki is the starting \npoint get calculated from  \nthis square.', '9\nT H E S S A LO N I K I\nsettles in town, chased out  \nof European countries – \nmostly of the Iberian pninsula. \nTheir role in Thessaloniki’s \nhistory will be a significant \none until the mid-20th century.\n 16th-18th c.:\t\nThessaloniki grows,  \nand the various ethnic and \nreligious communities live  \nin harmony. In the 18th c.  \nthe town acquires the features  \nof a large trade centre.\n Late 19th c.:\t\nA railway connection is \nestablished with Europe and \nConstantinople. Infrastructure \ngets streamlined and \nThessaloniki acquires the feel \nof a cosmopolitan European \ncity. The Greeks become at \nthis point in time the largest \npart of the population.\n 1890:\t\nFire incinerates a considerable \npart of the town’s seafront \nzone.\n 1912:\t\nDuring the 1st Balkan War, \nthe Greek army seizes the \ntown on October 26th; after \nfive centuries of ottoman \noccupation, Thessaloniki \nbecomes part of Greece.\n 1916:\t\nFollowing a clash with \nKing Constantine, Eleftherios \nVenizelos forms the \ntemporary “National Defence \nGovernment” in Thessaloniki, \nwhich remained there for \nseveral months.\n 1917:\t\nThe biggest part of the \ntown is destroyed by a fire \nthat breaks out on August \n18th and lasts for 32 hours.', '64\nSUBURBS AND CITY OUTSKIRTS\nsituated nearby. The small \nmounds in the field are ancient \ntombs; a Neolithic settlement \nwas excavated in one of them \nwith a cemetery dating to the \nGeometric and Archaic period. \nAn impressive Macedonian \ntomb was also unearthed in \nAgios Athanasios area.\nHow to get there. Bus \nlines 40, 40A and 40K leave \nfor Kalochori from the Railway \nStation Stop. If you travel by \ncar, take the Athens direction \non the national road and turn \ntowards Kalochori.\n2 \tKALAMARIA\nThis is practically an eastward \n‘extension’ of Thessaloniki and \nthe city’s best known suburb, \nstretching along the waterfront, \nwith many green spaces and \na self-contained shopping \ncentre. The first inhabitants are \nrecorded in the early 20th c. and \nduring the 1920’s significant \nnumbers of Greek refugee \npopulations settled here and \nbuilt their small houses. They \ncame from Caucasus, Minor \nAsia and Pontus [modern- \nday northeast Turkey]. Today,  \ndespite the rising building trend  \nin the area, several refugee \nhouses remain, still keeping  \na flavour of times goneby.\nMUST SEΕ: \n2.1  Sofouli Street\n(see p. 53).\n2.2  Kyverneio [Government \nHouse] (Little Palace).', 'The road \ndistances (in km) where \nThessaloniki is the starting \npoint get calculated from  \nthis square.\n2 \t\n\x07AROUND DIMOKRATIAS \nSQUARE\nThere are mostly faceless \nbuildings in the area – \namong them you will find \nsmall manufactures or old \nindustries. However there are \nalso historic sites, as there \nare sections of the city’s west \nwalls here, Byzantine and \nottoman monuments and other \narchaeological sites (temple  \nof Aphrodite, 6th c. BC).\nMUST SEE:\n2.1  Railway Station.\nIt is on Monastiriou Street \nwhich is renamed at some \npoint Egnatia Street (see p. 34). \nConstruction began in 1939 \nand it became fully operational \nin 1951, but it was officially \n66.  \nVardariou \nTower (Top \nHane).\n67.  \nOld steam \nengine \nfronting \nThessaloniki’s \nRailway \nStation.', '59\n7th walk: \nWEST OF THE CENTRE-STAVROUPOLI\ninaugurated in 1962 (S. Molfesis, \nTh. Papagiannis). Its exterior \nside combines modern and \nclassical elements with wings \nadded on the sides. It connects \nThessaloniki with the rest of \nGreece, the Balkans and Istanbul; \nit is also the bus terminus \ntowards most of the city areas. \nThis will be the location of the \nwest metro line terminus under \nconstruction in Thessaloniki.\n2.2  Old Railway Station.\nIt was built in 1894 near the \nharbour (Old Station Street) \nin the neoclassical style, \nand it gradually connected \nThessaloniki with Skopje, \nBelgrade, Monastir and \nConstantinople (modern-day \nIstanbul). Today it is exclusively \nused as a cargo train station. \nThis is where the German \noccupation forces mustered \nabout 50,000 Jewish residents, \nfrom March until August 1943, \nin order to send them by train \noff to concentration camps.\n2.3  Top Hane (Vardariou \nTower).\nSituated where the west \nand seafront city walls used \nto meet, this Tower was built \nby the Ottomans in 1546 and \nit was known as the Armoury \nTower. It is a six-sided, three-\nstorey and 10-metre high tower \nwhich used to be the main city \nstronghold.']","['<1-hop>\n\nMUST SEE: 2.1 Railway Station. It is on Monastiriou Street which is renamed at some point Egnatia Street (see p. 34). Construction began in 1939 and it became fully operational in 1951, but it was officially 66. Vardariou Tower (Top Hane). 67. Old steam engine fronting Thessaloniki’s Railway Station.']","The Railway Station in Thessaloniki holds significant historical and transportation importance. Built in 1894 in a neoclassical style, it initially served as a vital connection point for Thessaloniki with major cities in the Balkans, including Skopje, Belgrade, and Constantinople (modern-day Istanbul). This connectivity was crucial during a time when Thessaloniki was evolving into a cosmopolitan trade center, especially after the establishment of a railway link with Europe in the late 19th century.

The station's role extended beyond mere transportation; it became a symbol of the city’s integration into the broader European landscape. It facilitated the movement of people and goods, contributing to the economic and cultural exchange that characterized Thessaloniki during this period. The station was also a hub for various ethnic communities, reflecting the city’s diverse population.

During World War II, the Railway Station gained notoriety for its darker history. It was here that approximately 50,000 Jewish residents were gathered by German occupation forces before being deported to concentration camps. This tragic event underscores the station's role in the city's historical narrative, marking it as a site of both connection and sorrow.

Today, the Railway Station continues to serve as a transportation hub, linking Thessaloniki with the rest of Greece and the Balkans. It is also the terminus for the west metro line currently under construction, ensuring its ongoing relevance in the city's infrastructure. For visitors, the station is not only a point of departure but also a place to appreciate the architectural blend of modern and classical elements, making it an interesting stop for sightseeing and photography.","The Railway Station in Thessaloniki, located on Monastiriou Street (renamed Egnatia Street), began construction in 1939 and became fully operational in 1951. It serves as a significant transportation hub in the city, symbolized by the old steam engine that fronts the station, reflecting its historical importance in facilitating travel and commerce.",0.75,0.67,1.0,0.8083880075858167,0.8666666666377778,0.249999999975,0.0,0.8571428559183674,,0.9399803811517655
39,What is the historical significance of the Railway Station in Thessaloniki and its transportation role?,"['ARC\nAG\nDIMIT\nTERPSITHEA\nSQ.\nRAILWAY STATION\nSQ.\nOLD RAILWAY\nSTATION SQ.\nGALANOPOULOU\nSQ.\nSYKIES\nNEAPOLI\nAMPELOKIPOI\nMENEMENI\nMAKEDONOMACHON\nSQ.\nKARAOLI-DIMITRIOU SQ.\nELEFTHERIAS\nSQ.\nDROPOTAMOS\n7th walk: \nWEST OF THE CENTRE-STAVROUPOLI\n2\n3\n1\n4\n3.2\n2.2\n2.1\n4.1\n4.2\n4.3\n4.3\n4.4\n2.3\n2.4\n2.5\n2.8\n2.7 2.6\n3.1\n3.3\n1 \t\x07DIMOKRATIAS SQUARE \n(VARDARI)\nSince ancient times, this  \nhas been the most important \nentry point to Thessaloniki. \nThis relatively disadvantaged \narea is a transportation hub \nconnecting the west and \nnorthwest suburbs with the \ncity centre; there are also \nseveral hotels, small shops, \ntavernas and cafés in the \narea. In the centre of the \nsquare you will see the statue \nof King Constantine (1868-\n1923), who entered the \ncity in 1912 in his capacity \nas commander-in-chief of \nthe Greek Army. The road \ndistances (in km) where \nThessaloniki is the starting \npoint get calculated from  \nthis square.', '9\nT H E S S A LO N I K I\nsettles in town, chased out  \nof European countries – \nmostly of the Iberian pninsula. \nTheir role in Thessaloniki’s \nhistory will be a significant \none until the mid-20th century.\n 16th-18th c.:\t\nThessaloniki grows,  \nand the various ethnic and \nreligious communities live  \nin harmony. In the 18th c.  \nthe town acquires the features  \nof a large trade centre.\n Late 19th c.:\t\nA railway connection is \nestablished with Europe and \nConstantinople. Infrastructure \ngets streamlined and \nThessaloniki acquires the feel \nof a cosmopolitan European \ncity. The Greeks become at \nthis point in time the largest \npart of the population.\n 1890:\t\nFire incinerates a considerable \npart of the town’s seafront \nzone.\n 1912:\t\nDuring the 1st Balkan War, \nthe Greek army seizes the \ntown on October 26th; after \nfive centuries of ottoman \noccupation, Thessaloniki \nbecomes part of Greece.\n 1916:\t\nFollowing a clash with \nKing Constantine, Eleftherios \nVenizelos forms the \ntemporary “National Defence \nGovernment” in Thessaloniki, \nwhich remained there for \nseveral months.\n 1917:\t\nThe biggest part of the \ntown is destroyed by a fire \nthat breaks out on August \n18th and lasts for 32 hours.', '64\nSUBURBS AND CITY OUTSKIRTS\nsituated nearby. The small \nmounds in the field are ancient \ntombs; a Neolithic settlement \nwas excavated in one of them \nwith a cemetery dating to the \nGeometric and Archaic period. \nAn impressive Macedonian \ntomb was also unearthed in \nAgios Athanasios area.\nHow to get there. Bus \nlines 40, 40A and 40K leave \nfor Kalochori from the Railway \nStation Stop. If you travel by \ncar, take the Athens direction \non the national road and turn \ntowards Kalochori.\n2 \tKALAMARIA\nThis is practically an eastward \n‘extension’ of Thessaloniki and \nthe city’s best known suburb, \nstretching along the waterfront, \nwith many green spaces and \na self-contained shopping \ncentre. The first inhabitants are \nrecorded in the early 20th c. and \nduring the 1920’s significant \nnumbers of Greek refugee \npopulations settled here and \nbuilt their small houses. They \ncame from Caucasus, Minor \nAsia and Pontus [modern- \nday northeast Turkey]. Today,  \ndespite the rising building trend  \nin the area, several refugee \nhouses remain, still keeping  \na flavour of times goneby.\nMUST SEΕ: \n2.1  Sofouli Street\n(see p. 53).\n2.2  Kyverneio [Government \nHouse] (Little Palace).', 'The road \ndistances (in km) where \nThessaloniki is the starting \npoint get calculated from  \nthis square.\n2 \t\n\x07AROUND DIMOKRATIAS \nSQUARE\nThere are mostly faceless \nbuildings in the area – \namong them you will find \nsmall manufactures or old \nindustries. However there are \nalso historic sites, as there \nare sections of the city’s west \nwalls here, Byzantine and \nottoman monuments and other \narchaeological sites (temple  \nof Aphrodite, 6th c. BC).\nMUST SEE:\n2.1  Railway Station.\nIt is on Monastiriou Street \nwhich is renamed at some \npoint Egnatia Street (see p. 34). \nConstruction began in 1939 \nand it became fully operational \nin 1951, but it was officially \n66.  \nVardariou \nTower (Top \nHane).\n67.  \nOld steam \nengine \nfronting \nThessaloniki’s \nRailway \nStation.', '59\n7th walk: \nWEST OF THE CENTRE-STAVROUPOLI\ninaugurated in 1962 (S. Molfesis, \nTh. Papagiannis). Its exterior \nside combines modern and \nclassical elements with wings \nadded on the sides. It connects \nThessaloniki with the rest of \nGreece, the Balkans and Istanbul; \nit is also the bus terminus \ntowards most of the city areas. \nThis will be the location of the \nwest metro line terminus under \nconstruction in Thessaloniki.\n2.2  Old Railway Station.\nIt was built in 1894 near the \nharbour (Old Station Street) \nin the neoclassical style, \nand it gradually connected \nThessaloniki with Skopje, \nBelgrade, Monastir and \nConstantinople (modern-day \nIstanbul). Today it is exclusively \nused as a cargo train station. \nThis is where the German \noccupation forces mustered \nabout 50,000 Jewish residents, \nfrom March until August 1943, \nin order to send them by train \noff to concentration camps.\n2.3  Top Hane (Vardariou \nTower).\nSituated where the west \nand seafront city walls used \nto meet, this Tower was built \nby the Ottomans in 1546 and \nit was known as the Armoury \nTower. It is a six-sided, three-\nstorey and 10-metre high tower \nwhich used to be the main city \nstronghold.']","['<1-hop>\n\nMUST SEE: 2.1 Railway Station. It is on Monastiriou Street which is renamed at some point Egnatia Street (see p. 34). Construction began in 1939 and it became fully operational in 1951, but it was officially 66. Vardariou Tower (Top Hane). 67. Old steam engine fronting Thessaloniki’s Railway Station.']","The Railway Station in Thessaloniki holds significant historical and transportation value. Built in 1894 in a neoclassical style, it was strategically located near the harbor, facilitating connections between Thessaloniki and key cities such as Skopje, Belgrade, Monastir, and Constantinople (modern-day Istanbul). This station played a crucial role in the development of Thessaloniki as a major trade and transportation hub in the late 19th and early 20th centuries, enhancing its cosmopolitan character.

During the early 20th century, the establishment of a railway connection with Europe marked a pivotal moment for Thessaloniki, streamlining infrastructure and contributing to its growth as a bustling urban center. The station became a vital point for both passenger and cargo transport, linking the city to the broader Balkan region and beyond.

In addition to its transportation functions, the Railway Station is steeped in poignant historical events. Notably, during the German occupation in World War II, it served as a gathering point for approximately 50,000 Jewish residents, who were deported to concentration camps. This dark chapter adds a layer of historical significance to the site, making it a place of remembrance as well as transit.

Today, the Railway Station continues to serve as a bus terminus, connecting Thessaloniki with various city areas and enhancing local mobility. Its architectural blend of modern and classical elements reflects the city’s evolving identity while preserving its historical roots. For visitors, the station is not only a functional transport hub but also a site that encapsulates the rich tapestry of Thessaloniki’s past, making it an essential stop for those interested in the city’s history and culture.","The Railway Station in Thessaloniki, located on Monastiriou Street (renamed Egnatia Street), began construction in 1939 and became fully operational in 1951. It serves as a significant transportation hub in the city, reflecting the development of railway infrastructure in the region.",1.0,0.64,1.0,0.797954496163103,0.8666666666377778,0.249999999975,0.0,0.49999999937499995,,0.9399864890676707
40,What is the historical significance of the Railway Station in Thessaloniki and its location?,"['59\n7th walk: \nWEST OF THE CENTRE-STAVROUPOLI\ninaugurated in 1962 (S. Molfesis, \nTh. Papagiannis). Its exterior \nside combines modern and \nclassical elements with wings \nadded on the sides. It connects \nThessaloniki with the rest of \nGreece, the Balkans and Istanbul; \nit is also the bus terminus \ntowards most of the city areas. \nThis will be the location of the \nwest metro line terminus under \nconstruction in Thessaloniki.\n2.2  Old Railway Station.\nIt was built in 1894 near the \nharbour (Old Station Street) \nin the neoclassical style, \nand it gradually connected \nThessaloniki with Skopje, \nBelgrade, Monastir and \nConstantinople (modern-day \nIstanbul). Today it is exclusively \nused as a cargo train station. \nThis is where the German \noccupation forces mustered \nabout 50,000 Jewish residents, \nfrom March until August 1943, \nin order to send them by train \noff to concentration camps.\n2.3  Top Hane (Vardariou \nTower).\nSituated where the west \nand seafront city walls used \nto meet, this Tower was built \nby the Ottomans in 1546 and \nit was known as the Armoury \nTower. It is a six-sided, three-\nstorey and 10-metre high tower \nwhich used to be the main city \nstronghold.', '64\nSUBURBS AND CITY OUTSKIRTS\nsituated nearby. The small \nmounds in the field are ancient \ntombs; a Neolithic settlement \nwas excavated in one of them \nwith a cemetery dating to the \nGeometric and Archaic period. \nAn impressive Macedonian \ntomb was also unearthed in \nAgios Athanasios area.\nHow to get there. Bus \nlines 40, 40A and 40K leave \nfor Kalochori from the Railway \nStation Stop. If you travel by \ncar, take the Athens direction \non the national road and turn \ntowards Kalochori.\n2 \tKALAMARIA\nThis is practically an eastward \n‘extension’ of Thessaloniki and \nthe city’s best known suburb, \nstretching along the waterfront, \nwith many green spaces and \na self-contained shopping \ncentre. The first inhabitants are \nrecorded in the early 20th c. and \nduring the 1920’s significant \nnumbers of Greek refugee \npopulations settled here and \nbuilt their small houses. They \ncame from Caucasus, Minor \nAsia and Pontus [modern- \nday northeast Turkey]. Today,  \ndespite the rising building trend  \nin the area, several refugee \nhouses remain, still keeping  \na flavour of times goneby.\nMUST SEΕ: \n2.1  Sofouli Street\n(see p. 53).\n2.2  Kyverneio [Government \nHouse] (Little Palace).', 'The road \ndistances (in km) where \nThessaloniki is the starting \npoint get calculated from  \nthis square.\n2 \t\n\x07AROUND DIMOKRATIAS \nSQUARE\nThere are mostly faceless \nbuildings in the area – \namong them you will find \nsmall manufactures or old \nindustries. However there are \nalso historic sites, as there \nare sections of the city’s west \nwalls here, Byzantine and \nottoman monuments and other \narchaeological sites (temple  \nof Aphrodite, 6th c. BC).\nMUST SEE:\n2.1  Railway Station.\nIt is on Monastiriou Street \nwhich is renamed at some \npoint Egnatia Street (see p. 34). \nConstruction began in 1939 \nand it became fully operational \nin 1951, but it was officially \n66.  \nVardariou \nTower (Top \nHane).\n67.  \nOld steam \nengine \nfronting \nThessaloniki’s \nRailway \nStation.', '67\nSUBURBS AND CITY OUTSKIRTS\nNoesis –Science Centre \nand Technology Museum\nIt is the only one of its kind \nin Greece! Construction of \nthis 14,000-m2 impressive, \nmodern complex was \ncompleted in 2004 on a small \nhill affording a panoramic view \nof the area. It is considered \nas the modern successor of \nthe Technology Museum of \nThessaloniki. The premises \ninclude screening rooms, \npermanent exhibitions \n(Technology Museum), a \nconference centre, a digital \nlibrary, spaces reserved for \ntemporary exhibitions and \neducational programmes, \nan amphitheatre for carrying \nout Demonstrations and \nExperiments, a museum shop \nand a restaurant-café (for \ninfo about exhibitions and \nprogrammes see p. 79).\nHow to get there. Take \nthe bus No. 10 from the \nRailway Station Stop or from \nEgnatia Street and get off at \nthe terminus in Charilaou area, \nthen board the 66 or 66B bus \nand exit at Paramana square \nor Zoni Kainotomias stop, to \nreach Noesis. If you travel by \ncar, follow the Thessaloniki – \nThermi route.\n5 \t\x07\nPERAIA – NEOI \nEPIVATES – AGIA \nTRIADA\nThese seaside areas are \nlocated 20 km S of the city \ncentre. The area was inhabited \nfor the first time in 1923 \nwhen refugees from Minor \nAsia settled here.', '68\nSUBURBS AND CITY OUTSKIRTS\nbuses to N. Michaniona or  \nthe 76 bus to Angelochori.  \nIf you go by car, follow Ethnikis \nAntistasis, Georgikis Scholis \nand Michanionas Avenues.\n6 \tEPANOMI\nThis picturesque town \n(population: 7,500) is situated \n25 km SE of Thessaloniki. In \nthe vicinity there are beautiful \nbeaches, namely Ktima \nKaragiozi, Ormos, Palioura, \nAgeladariko, Mesimeri and \nPotamos; you will also see a \nhalf-sunken wreck of a small \nmerchant vessel lying there \nsince 1967. Tsairi (4 km S \nof Epanomi) is the location \nof a wetland, a refuge for \nover 80 species of birds. \nGerovassiliou Wine Museum \nis situated 2 km N. and is the \nonly one of its kind in northern \nGreece (for the museum see \np. 80).\nHow to get there. Take \nthe buses nos. 70 and 70A \nfrom the Railway Station \nStop during July and August. \nThroughout the year board \nany one of 69A, 69B, 69E, \n69K, 69N, 69R, 69T or 69X \nbuses at A.S. IKEA station. \nIf you travel by car, head for \nthe airport and then follow \nMichanionas, Miaouli and \nEpanomis country roads.']","['<1-hop>\n\nMUST SEE: 2.1 Railway Station. It is on Monastiriou Street which is renamed at some point Egnatia Street (see p. 34). Construction began in 1939 and it became fully operational in 1951, but it was officially 66. Vardariou Tower (Top Hane). 67. Old steam engine fronting Thessaloniki’s Railway Station.']","The Railway Station in Thessaloniki, built in 1951 after construction began in 1939, serves as a significant historical landmark reflecting the city's development and connectivity. Located on Monastiriou Street, which later became Egnatia Street, the station was pivotal in linking Thessaloniki with major cities in the Balkans, including Skopje, Belgrade, and Istanbul (formerly Constantinople). This connection facilitated trade, travel, and cultural exchange, contributing to Thessaloniki's role as a regional hub.

Historically, the station also bears a somber legacy. During the German occupation in World War II, it was a site of tragedy where approximately 50,000 Jewish residents were gathered and deported to concentration camps from March to August 1943. This dark chapter highlights the station's role not only in transportation but also in the historical narrative of the city and its communities.

The station's architectural style is a blend of modern and neoclassical elements, making it an interesting subject for photography, especially for those seeking Instagrammable spots. Its location near the harbor and the city center makes it easily accessible for visitors, providing a convenient starting point for exploring Thessaloniki's rich history and vibrant culture.

In addition to its historical significance, the Railway Station is a bustling terminus for various bus lines, connecting travelers to suburbs and attractions around the city. This accessibility enhances its importance as a gateway for first-time visitors looking to experience the local culture and sights. Overall, the Railway Station stands as a testament to Thessaloniki's past and present, embodying both the city's resilience and its ongoing evolution.","The Railway Station in Thessaloniki, located on Monastiriou Street (renamed Egnatia Street), has historical significance as its construction began in 1939 and it became fully operational in 1951. Additionally, it features the Old steam engine fronting the station, which adds to its historical charm.",1.0,0.23,0.5925925925925926,0.8381494630031597,0.94999999997625,0.3333333333,0.0,0.4285714279591837,,0.9693293179311105
41,What cultural heritage does the UNESCO World Heritage site of Byzantine monuments in Thessaloniki represent?,"['10\n1st walk: \nUNESCO BYZANTINE MONUMENTS\nThessaloniki has been  \none of the first towns to \nknow the Christian religion by \nthe Apostle Paul; during the \nByzantine period it used to be \nthe second most important \ncity of the empire (co-reigning \ncity) after Constantinople. \nAt that time (4th – 15th c.), \nChristian monuments and \nchurches were constructed in \nthe town, and these make up \na diachronic typology with a \ndecisive influence on the entire \nByzantine world. The following \nearly-Christian and Byzantine \nmonuments of the town are \nconsidered to be excellent \nspecimens of the Byzantine \nchurch-building and art, and \nfor this reason UNESCO \ndeclared them to be World \nHeritage Monuments, in 1988. \nA tour across this unique \nopen-air Byzantine museum  \nis truly a special experience.\n1 \t\x07HOLY TWELVE  \nAPOSTLES CHURCH\nOne of the town’s oldest \nchurches was built in 1310 – \n1314 under the sponsorship  \nof Patriarch Nephon I. It used \nto be a katholicon [main church] \nof a monastery dedicated to \nTheotokos [Mother of God] as \nshown by the mural depicting \nTheotokos and the Founder, \nas well as by the iconography \non the aisle with images of \nthe Holy Virgin’s life.', 'It was \nsituated in the centre of \nthe area which was called \n“Macedonian Land” by \nHerodotus [an ancient Greek \nHistorian]. The first magnificent \npalaces of the Macedonian \nKings were built here and \nthe foundations of the great \nMacedon State were laid at \nthat time. It was the sacred \ntown of the Macedonians \nand remained so after the \n5th c. BC as Aiges was the \nplace of origin of the Royal \nHouse of Argeades whose \nmembers were thought to be \ndescendants of the House \nof Timenides and Hercules. \nIn 168 BC the town was \ndestroyed by the Romans and \nfinally got deserted in the 1st \nc. AD. On the grounds of its \nimportance, the archaeological \nsite has been included in the \nUNESCO World Heritage List \nas a Multiple Thematic Focus \nMuseum.\nMUST SEE:\nRoyal Tombs. In 1977, \nthe archaeologist Manolis \nAndronikos unearthed the \nroyal tombs inside a big earth \nmound (Megali Toumpa - \nGreat Tumulus). The tombs \nand the mound interior have \nbeen restructured into an \namazing museum where the \n99\n100', '93\nDAY EXCURSIONS\na day trip (it’s only a short \ndistance from the city) or \nfor a longer one; quite a few \nown country houses there. In \nthe Athos peninsula amidst \na beautiful and pristine \nnatural environment lies the \nglobally known monastic \nstate of Mount Athos which \nencompasses 20 -presently \ninhabited- monasteries \n(10th – 14th c.), sketes [small \nmonastic settlements] and \ncells for monks. UNESCO has \nincluded the ‘Holy Mount’ in its \nWorld Heritage Monument List \nin 1988, on grounds of the \noutstanding architecture and \nthe priceless cultural treasures \nof the monastic community.\nHow to get there. \nPetralona Cave is situated  \n53 km SE of Thessaloniki. Take \nthe coach to Halkidiki, get \noff at Nea Kallikrateia Village \nstop and then take a taxi to \nthe cave (approx. a 10-km \njourney). If you travel by car, \ngo along the Thessaloniki-\nHalkidiki national road and  \nthen follow the signs to \nPetralona village and the cave.\n5 \tLAKES AREA\nNortheast of Thessaloniki, in \nthe direction of Strymonas \n(also Strymonian) gulf \nstretches a 200,000 hectare-\narea around Lakes Koroneia \nand Volvi; the place is a \nNational Park.', '11\n1st walk: \nUNESCO BYZANTINE MONUMENTS\nportal to the southwest and \nthe cistern to the northwest. \nIt is a complex tetrastyle \ncross-in-square church with \na narthex and a peristyle on \nthe three sides and extremely \nsymmetrical proportions. \nWhen it was converted into \na mosque, during the Turkish \nrule, the murals and mosaics – \noutstanding specimens  \nof Palaeologan art dating  \nto the 14th c. – were covered  \nby plaster and a minaret was \nadded to the southwestern side.\n2 \t\n\x07PANAGIA CHALKEON \nCHURCH\nIt is located on the SW side \nof Dikastirion Sq. [Law Courts \nSq.]. It was built in 1128 on \nthe site of an ancient temple \nof Hephaestus or Kaveiros.  \nIt is a representative specimen \nof the architecture of the \n“School of Constantinople” and \nwas thus named because of \nthe area it was built on, known \nas the district of coppersmiths \n(masters of copper – chalkos). \nThe most prominent feature \nis the level above the narthex. \nIn 1430 it was converted into \na mosque and was named \nKazancilar Camii.\n3 \t\x07\nACHEIROPOIITOS \nCHURCH\nIt was founded in the second \nhalf of the 5th c. on the site \nof the roman public baths \nand it was dedicated to \nPanagia (Virgin Mary).', '7\n«…There is a homeland for everyone,  \nwhile there is Thessaloniki»\nNikiforos Choumnos, \n14thc. Byzantine dignitary and a scholar.\nNowadays, the historic capital -by right- of Macedonia, \nthe land of Alexander the Great, has evolved into a modern \nand particularly charming metropolis. A multitide of \nmonuments and cultural assets and the town’s traditional \nways exist in harmony with the modern aspects and the \nhigh standard infrastructure, the carefree mood, the spirit \nof hospitality, the vitality of the locals – particularly the \nyoung – setting the pace of town life, the diversity of \nartistic events, the long list of choices for entertainment, \nthe exceptional culinary tradition, and the fresh feel in \nthe atmosphere, coming from the seafront, as well as the \ncoolness of the northwest wind called Vardaris.   \nThessaloniki’s location is at the centre of a greater area \nwith incomparable historical monuments and natural assets \nas it offers the opportunity for a visit to archaeological \nsites known the world over (Ancient Pella, Vergina, Dion, \nPetralona Cave), to areas of exquisite nature (river deltas, \nlakes, Mt Olympus), to the monastic state of Agion Oros \n[the Holy Mountain] as well as to Halkidiki, a famous tourist \ndestination. And there is always an opportunity to practice \nsports (swimming, skiing, playing golf etc) or to indulge in \nwellness tourism (hot springs, spas)!\nIn short, Thessaloniki is a city that can cater for even the \nmost demanding needs, any time of the year.']","[""<1-hop>\n\nUNESCO BYZANTINE MONUMENTS Thessaloniki has been one of the first towns to know the Christian religion by the Apostle Paul; during the Byzantine period it used to be the second most important city of the empire (co-reigning city) after Constantinople. At that time (4th – 15th c.), Christian monuments and churches were constructed in the town, and these make up a diachronic typology with a decisive influence on the entire Byzantine world. The following early-Christian and Byzantine monuments of the town are considered to be excellent specimens of the Byzantine church-building and art, and for this reason UNESCO declared them to be World Heritage Monuments, in 1988. A tour across this unique open-air Byzantine museum is truly a special experience. 1 \x07HOLY TWELVE APOSTLES CHURCH One of the town’s oldest churches was built in 1310 – 1314 under the sponsorship of Patriarch Nephon I. It used to be a katholicon [main church] of a monastery dedicated to Theotokos [Mother of God] as shown by the mural depicting Theotokos and the Founder, as well as by the iconography on the aisle with images of the Holy Virgin’s life. Out of the original monastery complex, -apart from the katholicon – there remain the NIKIS NIKIS GERMANOU SVOLOU IASONIDOU TSIMISKI VAS. IRAKLEIOU FILIPPOU AKROPOLEOS THEOTOKOPOULOU AKROPOLEOS OCHI AVENUE EPTAPYRGIOU SOFOKLEOUS OLYMPOU MONASTIRIOU KAZANTZAKI A N A G E NN I S E OS DAMONOS KALOU DRAGOUMANOU POLYTECHNIOU MITROPOLEOS ARISTOTELOUS DODEKANISOU LANGADA SALAMINOS ERMOU ANGELAKI ETHNIKIS AMYNAS AG. ANTONIOS AGIA THEODORA AG. ATHANASIOS AG. KONSTANTINOU YPAPANTI AGIOS STYLIANOS LAODI GITRIA TAXIARCHES AGIOS PAVLOS FANEROMENI AG. THEODOROI KALARI TSOPELA ISAVRON DELIOU IOANNI VELLIDI MAKRYGIANNI MITR. GENADIOU MODI PETROPOULAKIDON ARIANOU ARIANOU KLEISTHENOUS VIZYINOU KASTRON PANORMOU KES AMPATZOGLOU SKOPELOU PETRAS VASILIKO IRAKLEIAS SK SK KAVAFI ADRIANOUPOLEOS AIANT AGATHOUPOLEOS NG ROAD REDAISTO VYZOUKIDI VIZYINO THETIDOS AFXENTIOU MOUDANION PANEPISTIMIOU KALELPIDOS KONSTANTINOUPOLEOS SMYRNIS PYRGOU VRYANDOU KITROUS MELENIKOU PATR. IOAKEIM PALAION PATRON GERMANOU MICHAIL IO. ARMENOPOULOU IKTINOU KOMNINON SOLOMOU VLALI BALANOU ASKITOU VOGATSIKOU PLOUTARCHOU LASSANI MORKENTAOU TATI DRAGOUMI KYRIAKOU IOULIANOU SOKRATOUS EVRIPIDOU GYZI VLACHAVA AISCHYLOU ATHINAS MOREAS GKRATZIOU ATHONOS THEOFILOU PILEOS ANTIOCHOU VLATADON KASTOROS IGOUMENOU PERIANDROU POLYDOROU KLAFTHMONOS DRAGATSANIOU ACHTARI KARADIMOU DIONYSIOU EPIMENIDOU EVRYMEDONTOS AREOS ARTIS IRAKLIOU SYRAKOUSON PYDNAS KARAVANGELI TSAKALOF KIMONOS FLORINAS PLASTIRA FILIPPOU KLISTHENOUS FERON EVROU GKRATZIOU RAKTIVAN LAMPOUSIDI PASTER MAK KAMENIATOU PROFITI ILIA ATHINAS IFIKRATOUS PRASAKAKI STAVROU DIMOSTHENOUS KASTRITSIOU MENELAOU AMYNTA PELOPONNISOU PLATONOS DELMOUZOU AVDELA OUGKO KARATASOU KOUNTOURIOTI MIONIS CH. IATROU PAPANASTASIOU KLEISOURAS LAMPRAKI OLYMPIOU FEIDIOU FINTIA DAIDALOU VOULGAR THASO FREIDERIK NIKITARA IATRIDON THYRON KOZANIS KILKIS PONTOU NAFPLIOU VALTETSIOU KALPAKIOU LORDOU ELEFSINAS DELTA KONITSIS PLATONOS IPPOKRATOUS AGIOU DIMITRIOU VERMIOU SOUFLIOU BIZANIOU LECHO VOREIOU IPEIROU ARAP BOUBOUL KANARI KA AKI SOLOMOU LACHANA AGRAFON PSARON MIAOULI KAVALAS KRITIS LEVENTI KANARI GRAVIAS KYPROU FILIATRON ARACHTHOU TSACHILA AGRAFON KARVOUNIDI ERASMOU ELENIS KAPETAN NIKOLAOU PELOPONNISOU AGIOU PAVLOU MAKEDONOMACHON KONITSIS IKARON EL. VENIZELOU OMIROU IPEIROU KONTOSOGLOU PAPANIKOLI TEPELENIOU MEGARON VITSI KASTORIAS ARGYROKASTROU DIMITRIOU THASSOU FOKA PAPAFLESSA KOMNINON KONDYLI PANGKALOU KRITIS KRITIS EPIDAVROU LAMPRAKI CHORTIATI ELLIS ELPIDOS MAVROKORDATOU EPTAPYRGIOU EPTAPYRGIOU EPTAPYRGIOU EPTAPYRGIOU ANTHEON ATHANASIOU DIAKOU YPATROU GIALOUROU OU DODEKANISOU VAS. KONSTANTINOU MARKOU BOTSARI ANATOLIKIS ROMYLIAS U OI M R E V RIOU OPOS AISTOU DERMETZI APOLLONIADOS TYROLOIS BOROU PRIAMOU VORONOF OREIOU IPEIROU LATOMEION KATSONI ZALONGOU PAPANASTASIOU KAFKASOU METEORON KASSANDROU OLYMPIADOS A L. P A P A D O P O U L OU KASSANDROU OLYMPIADOS OLYMPOU POLYZOIDI AGIOU DIMITRIOU AGIOU DIMITRIOU AVRILIANIS ARKADIOUPOLEOS IFAISTIONOS ELPIDOS EL. VE NI ZE L O U NAVARINOU TYRNAVOU KOLOKOTRONI ARISTARCHOU KARAOLI PAPAGOU KASTAMONIS KARAVANGELI MATROZOU EVDOKIOU KESANIS KALLIKRATIAS VOULGAROKTONOU THEMISTOKLEOUS A R O G A X A N A KYPROU 28 OKTOVRIOU M. ASIAS ELLISPONTOU IT OIR U O T N U O K PARASKEVA NIGDIS ARAVYSSOU ALEXIOU TRANOU MOUSCHOUNTI KALAMPAKAS ROUZVELT ONOS SIOU OUMAN THOUKYDIDI ZARIFI SACHTOURI AKRITA KLIOS PERSEOS PYTHEOS RAKTIVAN ODYSSEOS SARAFI ETHN. ANTISTASEOS U O TIR K O M ID PARASKEVA PANIDOU OINOIS KARAOLI OLYMPOU ROMANIDI ARISTEIDOU SOULINI KRITIS DEXAMENI DIOS KALVOU EIRINIS PAPARIGOPOULOU PALAMA ZEFYRON MAVILI PINIOU GLADSTONOS THALIAS PRONOIAS SACHINI KRATEROU FILOTA SOURI ANTON SOUTSOU SYNGROU PTOLEMAION IOUSTINIANOU KARBOLA TOSITSA ZALIKI CHALKEON AMVROSIOU KRYSTALI ANTIGONIDON S T O U R N A R A MAKEDON O MACHON ELLISPONTOU LEFKOSIAS THER M OPYLON RIG A FE RAI O U KAFKASOU PANAGIAS FANEROMENIS EOS KAVAKION KORYDALLOU HMOU VOUTYRA YRILLOU PATR. FINTIA SANTAROZA SAPFOUS KARIOFYLLI AVEROF PANGAIOU AXIOU VAIOU PINDOU DOXIS VOTSI KALAPOTHAKI KATOUNI AIGYPTOU FRANGON DANAIDON AISOPOU ENOTIKON AFRODITIS NTEKA PAPATHANASIOU PAPADIMA GALANAKI IVANOF KAPATOU GDON HOUNTI CHATZITSIROU VAKCHOU STEFANAKI FARMAKI ODYSSEOS ODYSSEOS TANTALOU PROMITHEOS SAPFOUS NAVM. CHAPSA LIMNOU VALAORITI ORPHANIDI TANTALIDI OLYMPIOU DIAMANTI LOUI IPPODROMIOU NIKIFOROU DESPERE GOUNARI DIALETI DANGLI FILIKIS ETAIRIAS CHR. SMYRNIS MITR. IOSIF FOKA PANAGIA KARATZA KREMASTIS POLIORKITI SYNGROU VYRONOS AGIOS DIMITRIOS RIGA FERAIOU A R C H A I O T I T O N S E L E F K I D O N M E L E N I K O U PROX. KOROMILA PARASCHOU EPTAPYRGIO ANO POLI 40 EKKLISIES EVANGELISTRIA RIGAS FERAIOS KALLITHEA AXIOS MUNICIPAL PARK RODOCHORI EVANGELISTRIA'S CEMETERY KOLOKOTRONI TYROLOI VARNAS SQ. MOUSHOUNTI SQ. FANARIOTON SQ. ELEFTHERIAS SQ. EMPORIOU SQ. DIMOKRATIAS VARDARI SQ. KYPRION AGONISTON SQ. ARCHAIAS AG. SOFIAS AGORAS SQ. DIMITRION SQ. TERPSITHEA SQ. ROMFEI SQ. RAILWAY STATION SQ. RAILWAY ATION SQ. GALANOPOULOU SQ. SYNTRIVANIOU SQ. NAVARINOU SQ. SQ. SYKIES EAPOLI CHNI ZIDROU SQ. LYSSIATREIO AGIOS DIMITRIOS HOSPITAL GENERAL HOSPITAL OF THESSALONIKI G. GENNIMATAS U G O A 1 2 3 4 5 7 6 8 9 12 15 15 15 15 13 14 10 11 2. Southern view of Panagia Chalkeon Church. 3. Agia Sofia Church surrounded by a small garden.""]","The UNESCO World Heritage site of Byzantine monuments in Thessaloniki represents a rich tapestry of early Christian and Byzantine heritage, showcasing the city's historical significance as a major center of Christianity and culture during the Byzantine Empire. Thessaloniki was one of the first cities to embrace Christianity, influenced by the Apostle Paul, and it became the second most important city in the empire after Constantinople.

The monuments reflect a diachronic typology of Byzantine church architecture and art, with structures dating from the 4th to the 15th centuries. These include notable churches such as the Holy Twelve Apostles Church, built between 1310 and 1314, which features exquisite murals and iconography dedicated to the Virgin Mary. The architectural styles exemplify the evolution of Byzantine design, characterized by intricate mosaics, domes, and cross-in-square layouts.

UNESCO recognized these monuments in 1988 for their outstanding universal value, as they not only represent the artistic and architectural achievements of the Byzantine period but also serve as a testament to the city's historical role in the spread of Christianity. The churches are often described as open-air museums, offering visitors a unique opportunity to experience the spiritual and cultural essence of Byzantine life.

Exploring these sites provides insight into the religious practices, artistic expressions, and community life of the time. The monuments are not only significant for their historical context but also for their aesthetic beauty, making them ideal for photography and social media sharing. As a first-time visitor, you will find that these sites offer a profound connection to the past, enriching your understanding of Thessaloniki's cultural heritage while providing memorable experiences during your stay.","The UNESCO World Heritage site of Byzantine monuments in Thessaloniki represents a significant aspect of cultural heritage, showcasing early-Christian and Byzantine monuments that were constructed during the Byzantine period (4th – 15th century). These monuments reflect the city's historical importance as a center of Christianity and its architectural achievements, influencing the entire Byzantine world.",1.0,0.69,0.7916666666666666,0.8704219217463306,0.8874999999778125,0.7499999999625,0.0,0.12499999984374999,,0.8982914126343781
42,"Whaht is the hstory of the Railway Station on Monastiriou Street, and how does it relate to transportation in Thessaloniki?","['The road \ndistances (in km) where \nThessaloniki is the starting \npoint get calculated from  \nthis square.\n2 \t\n\x07AROUND DIMOKRATIAS \nSQUARE\nThere are mostly faceless \nbuildings in the area – \namong them you will find \nsmall manufactures or old \nindustries. However there are \nalso historic sites, as there \nare sections of the city’s west \nwalls here, Byzantine and \nottoman monuments and other \narchaeological sites (temple  \nof Aphrodite, 6th c. BC).\nMUST SEE:\n2.1  Railway Station.\nIt is on Monastiriou Street \nwhich is renamed at some \npoint Egnatia Street (see p. 34). \nConstruction began in 1939 \nand it became fully operational \nin 1951, but it was officially \n66.  \nVardariou \nTower (Top \nHane).\n67.  \nOld steam \nengine \nfronting \nThessaloniki’s \nRailway \nStation.', 'ARC\nAG\nDIMIT\nTERPSITHEA\nSQ.\nRAILWAY STATION\nSQ.\nOLD RAILWAY\nSTATION SQ.\nGALANOPOULOU\nSQ.\nSYKIES\nNEAPOLI\nAMPELOKIPOI\nMENEMENI\nMAKEDONOMACHON\nSQ.\nKARAOLI-DIMITRIOU SQ.\nELEFTHERIAS\nSQ.\nDROPOTAMOS\n7th walk: \nWEST OF THE CENTRE-STAVROUPOLI\n2\n3\n1\n4\n3.2\n2.2\n2.1\n4.1\n4.2\n4.3\n4.3\n4.4\n2.3\n2.4\n2.5\n2.8\n2.7 2.6\n3.1\n3.3\n1 \t\x07DIMOKRATIAS SQUARE \n(VARDARI)\nSince ancient times, this  \nhas been the most important \nentry point to Thessaloniki. \nThis relatively disadvantaged \narea is a transportation hub \nconnecting the west and \nnorthwest suburbs with the \ncity centre; there are also \nseveral hotels, small shops, \ntavernas and cafés in the \narea. In the centre of the \nsquare you will see the statue \nof King Constantine (1868-\n1923), who entered the \ncity in 1912 in his capacity \nas commander-in-chief of \nthe Greek Army. The road \ndistances (in km) where \nThessaloniki is the starting \npoint get calculated from  \nthis square.', '106\nPassenger Railway Station.\n28, Monastiriou St, information \non domestic and international \ntimetables: \ntel.: 14511 \nwebsite: www.ose.gr\nThessaloniki Central Port \nAuthority (at the harbour). \nFor info on passenger ship \ntimetables,  \ntel.: 2313 325.821-4\nStavros Port Station: \ntel.: 23970 61.280\nIntercity bus service \n(K.T.E.L.).\nThere is a coach service to \nregional areas beyond the city \nlimits, and to most areas of \ncontinental Greece as well as \nthe islands of Corfu, Zante and \nCrete; buses leave from the \nMacedonia Intercity Bus Station, \nat 244, Giannitson St. (5 km W \nof the centre) \ntel.: 2310 595.400 \nwebsite: www.ktelmacedonia.gr\nTaxi Service.\nTaxis carry taximeters which \ncalculate the fare that must be \npaid and the driver must turn \nthe meter on as soon as the \npassenger is picked up. Fare 1 \nis on from 05.00-24.00; it is \nchanged to Fare 2 from 24.00 \nto 05.00. Every taxi driver \nmust have the updated charge \nrates on display as well as any \nadditional charges.  \nRadio Taxi:  \n«Taxiway» (tel.: 18300), \n«Mercedes» (tel.: 18180), \n«Macedonia» (tel.', '67\nSUBURBS AND CITY OUTSKIRTS\nNoesis –Science Centre \nand Technology Museum\nIt is the only one of its kind \nin Greece! Construction of \nthis 14,000-m2 impressive, \nmodern complex was \ncompleted in 2004 on a small \nhill affording a panoramic view \nof the area. It is considered \nas the modern successor of \nthe Technology Museum of \nThessaloniki. The premises \ninclude screening rooms, \npermanent exhibitions \n(Technology Museum), a \nconference centre, a digital \nlibrary, spaces reserved for \ntemporary exhibitions and \neducational programmes, \nan amphitheatre for carrying \nout Demonstrations and \nExperiments, a museum shop \nand a restaurant-café (for \ninfo about exhibitions and \nprogrammes see p. 79).\nHow to get there. Take \nthe bus No. 10 from the \nRailway Station Stop or from \nEgnatia Street and get off at \nthe terminus in Charilaou area, \nthen board the 66 or 66B bus \nand exit at Paramana square \nor Zoni Kainotomias stop, to \nreach Noesis. If you travel by \ncar, follow the Thessaloniki – \nThermi route.\n5 \t\x07\nPERAIA – NEOI \nEPIVATES – AGIA \nTRIADA\nThese seaside areas are \nlocated 20 km S of the city \ncentre. The area was inhabited \nfor the first time in 1923 \nwhen refugees from Minor \nAsia settled here.', '64\nSUBURBS AND CITY OUTSKIRTS\nsituated nearby. The small \nmounds in the field are ancient \ntombs; a Neolithic settlement \nwas excavated in one of them \nwith a cemetery dating to the \nGeometric and Archaic period. \nAn impressive Macedonian \ntomb was also unearthed in \nAgios Athanasios area.\nHow to get there. Bus \nlines 40, 40A and 40K leave \nfor Kalochori from the Railway \nStation Stop. If you travel by \ncar, take the Athens direction \non the national road and turn \ntowards Kalochori.\n2 \tKALAMARIA\nThis is practically an eastward \n‘extension’ of Thessaloniki and \nthe city’s best known suburb, \nstretching along the waterfront, \nwith many green spaces and \na self-contained shopping \ncentre. The first inhabitants are \nrecorded in the early 20th c. and \nduring the 1920’s significant \nnumbers of Greek refugee \npopulations settled here and \nbuilt their small houses. They \ncame from Caucasus, Minor \nAsia and Pontus [modern- \nday northeast Turkey]. Today,  \ndespite the rising building trend  \nin the area, several refugee \nhouses remain, still keeping  \na flavour of times goneby.\nMUST SEΕ: \n2.1  Sofouli Street\n(see p. 53).\n2.2  Kyverneio [Government \nHouse] (Little Palace).']","['<1-hop>\n\nMUST SEE: 2.1 Railway Station. It is on Monastiriou Street which is renamed at some point Egnatia Street (see p. 34). Construction began in 1939 and it became fully operational in 1951, but it was officially 66. Vardariou Tower (Top Hane). 67. Old steam engine fronting Thessaloniki’s Railway Station.']","The Railway Station on Monastiriou Street, a significant transportation hub in Thessaloniki, has a rich history that reflects the city's development and connectivity. Construction of the station began in 1939, and it became fully operational in 1951. Officially inaugurated later, it has since served as a vital link for both domestic and international travel.

Located on Monastiriou Street, which transitions into Egnatia Street, the station is strategically positioned to connect various parts of the city and beyond. It plays a crucial role in facilitating travel to and from Thessaloniki, making it an essential point for both locals and visitors. The station is not only a gateway to the city but also a starting point for journeys across Greece and neighboring countries.

The area surrounding the Railway Station is characterized by a blend of modern and historical elements, with nearby attractions including the statue of King Constantine in Dimokratias Square, which marks the city's historical significance. The station's location makes it convenient for travelers seeking to explore Thessaloniki's rich cultural heritage, including Byzantine and Ottoman monuments.

For those interested in sightseeing, the station provides easy access to various attractions, enhancing the travel experience. The availability of information on domestic and international timetables at the station ensures that visitors can plan their journeys efficiently.

Overall, the Railway Station on Monastiriou Street is not just a transportation facility; it is a historical landmark that embodies Thessaloniki's evolution as a major urban center. Its role in connecting the city with the rest of Greece and beyond makes it an integral part of the travel experience for anyone visiting Thessaloniki.","The Railway Station on Monastiriou Street, which was later renamed Egnatia Street, began construction in 1939 and became fully operational in 1951. It plays a significant role in transportation in Thessaloniki, serving as a key hub for travelers and connecting various modes of transport. Additionally, the old steam engine located in front of the station highlights the historical significance of railway transportation in the city.",1.0,0.51,0.3103448275862069,0.8783134546443846,0.99999999995,0.9999999999,0.0,0.8571428559183674,,0.8693315659749303
43,"What historical significance does Egnatia Street have in Thessaloniki, and how is it connected to the Railway Station?","['The road \ndistances (in km) where \nThessaloniki is the starting \npoint get calculated from  \nthis square.\n2 \t\n\x07AROUND DIMOKRATIAS \nSQUARE\nThere are mostly faceless \nbuildings in the area – \namong them you will find \nsmall manufactures or old \nindustries. However there are \nalso historic sites, as there \nare sections of the city’s west \nwalls here, Byzantine and \nottoman monuments and other \narchaeological sites (temple  \nof Aphrodite, 6th c. BC).\nMUST SEE:\n2.1  Railway Station.\nIt is on Monastiriou Street \nwhich is renamed at some \npoint Egnatia Street (see p. 34). \nConstruction began in 1939 \nand it became fully operational \nin 1951, but it was officially \n66.  \nVardariou \nTower (Top \nHane).\n67.  \nOld steam \nengine \nfronting \nThessaloniki’s \nRailway \nStation.', '67\nSUBURBS AND CITY OUTSKIRTS\nNoesis –Science Centre \nand Technology Museum\nIt is the only one of its kind \nin Greece! Construction of \nthis 14,000-m2 impressive, \nmodern complex was \ncompleted in 2004 on a small \nhill affording a panoramic view \nof the area. It is considered \nas the modern successor of \nthe Technology Museum of \nThessaloniki. The premises \ninclude screening rooms, \npermanent exhibitions \n(Technology Museum), a \nconference centre, a digital \nlibrary, spaces reserved for \ntemporary exhibitions and \neducational programmes, \nan amphitheatre for carrying \nout Demonstrations and \nExperiments, a museum shop \nand a restaurant-café (for \ninfo about exhibitions and \nprogrammes see p. 79).\nHow to get there. Take \nthe bus No. 10 from the \nRailway Station Stop or from \nEgnatia Street and get off at \nthe terminus in Charilaou area, \nthen board the 66 or 66B bus \nand exit at Paramana square \nor Zoni Kainotomias stop, to \nreach Noesis. If you travel by \ncar, follow the Thessaloniki – \nThermi route.\n5 \t\x07\nPERAIA – NEOI \nEPIVATES – AGIA \nTRIADA\nThese seaside areas are \nlocated 20 km S of the city \ncentre. The area was inhabited \nfor the first time in 1923 \nwhen refugees from Minor \nAsia settled here.', '64\nSUBURBS AND CITY OUTSKIRTS\nsituated nearby. The small \nmounds in the field are ancient \ntombs; a Neolithic settlement \nwas excavated in one of them \nwith a cemetery dating to the \nGeometric and Archaic period. \nAn impressive Macedonian \ntomb was also unearthed in \nAgios Athanasios area.\nHow to get there. Bus \nlines 40, 40A and 40K leave \nfor Kalochori from the Railway \nStation Stop. If you travel by \ncar, take the Athens direction \non the national road and turn \ntowards Kalochori.\n2 \tKALAMARIA\nThis is practically an eastward \n‘extension’ of Thessaloniki and \nthe city’s best known suburb, \nstretching along the waterfront, \nwith many green spaces and \na self-contained shopping \ncentre. The first inhabitants are \nrecorded in the early 20th c. and \nduring the 1920’s significant \nnumbers of Greek refugee \npopulations settled here and \nbuilt their small houses. They \ncame from Caucasus, Minor \nAsia and Pontus [modern- \nday northeast Turkey]. Today,  \ndespite the rising building trend  \nin the area, several refugee \nhouses remain, still keeping  \na flavour of times goneby.\nMUST SEΕ: \n2.1  Sofouli Street\n(see p. 53).\n2.2  Kyverneio [Government \nHouse] (Little Palace).', '59\n7th walk: \nWEST OF THE CENTRE-STAVROUPOLI\ninaugurated in 1962 (S. Molfesis, \nTh. Papagiannis). Its exterior \nside combines modern and \nclassical elements with wings \nadded on the sides. It connects \nThessaloniki with the rest of \nGreece, the Balkans and Istanbul; \nit is also the bus terminus \ntowards most of the city areas. \nThis will be the location of the \nwest metro line terminus under \nconstruction in Thessaloniki.\n2.2  Old Railway Station.\nIt was built in 1894 near the \nharbour (Old Station Street) \nin the neoclassical style, \nand it gradually connected \nThessaloniki with Skopje, \nBelgrade, Monastir and \nConstantinople (modern-day \nIstanbul). Today it is exclusively \nused as a cargo train station. \nThis is where the German \noccupation forces mustered \nabout 50,000 Jewish residents, \nfrom March until August 1943, \nin order to send them by train \noff to concentration camps.\n2.3  Top Hane (Vardariou \nTower).\nSituated where the west \nand seafront city walls used \nto meet, this Tower was built \nby the Ottomans in 1546 and \nit was known as the Armoury \nTower. It is a six-sided, three-\nstorey and 10-metre high tower \nwhich used to be the main city \nstronghold.', '30\n3rd walk: \nHISTORIC CENTRE (2)\nMUSEUM AREA\nflats facing the adjacent \nIppodromiou square. This was \na 450 m. long and a 95 m. \nwide structure and it used to \nbe the centre of social activity \nfor citizens until 390 AD, \nwhen emperor Theodosius \nordered the massacre of \n7,000 Thessalonians there; \nthe event led to the close-\ndown of the Hippodrome. It is \nworth visiting the Thessaloniki \nHistory Centre, situated in the \nsquare’s south side as well as \nthe remarkable 18th c. Agios \nAntonios church in Margariti \nstreet nearby. \n8.7  Arched Hall.\nIt lies at the intersection  \nof Gounari and Svolou streets. \nThis was a place with heating \ninstallations for holding \nsymposia and ceremonies. \nIt had a direct access to \nthe imperial box in the \nHippodrome.\n8.8  Theatre - stadium  \nin Apellou Street.\nThe remains of a building \nhave been located at 5 & \n7 Apellou St., and they are \nconsidered to have been part \nof the theatre-stadium of the \ntown, which was in use from \nthe 1st until the 4th c. AD.  \nThere are references connecting \nthis place with the martyrdom \nof Agios Dimitrios, the city’s \npatron saint.\n9 \tTHREE CHURCHES\nOn the south side of Egnatia \nStreet, between K. Palaiologou \nSt.']","['<1-hop>\n\n34 1 EGNATIA STREET This central avenue has been there practically since Thessaloniki’s founding, as it is a section of the road constructed by the Romans in the 2nd c. BC, and connected Dyrrhachium (Durrës, in modern day Albania) with Constantinople. It starts at Dimokratia square (see p. 58) and ends at the TIF grounds (see p. 31) and the Aristotle University of Thessaloniki, splitting in two the town’s historic centre. It is a busy shopping area with numerous remarkable buildings of eclectic and art deco style dating to the early 20th c. (mostly old hotels) that are absolutely worth observing, as well as some of the city’s most important monuments. MUST SEE: 1.1 Kolomvou Square. The crossroads where Egnatia Street meets Antigonidon Street is indeed a bustling one! It was named after G. Colombo, an Italian who opened a hotel there in the early 20th century. This is the location of Kolomvou Archway (31, Egnatia St.) which has become a leisure hub with cafés, bars and restaurants inside. 1.2 Hamza Bey Mosque. It was built in 1467 by the daughter of Hamza Bey, the military commander of Sultan Murad II. It is the only mosque in Greece with a peristyle (a colonnaded yard). For many decades it housed a cinema named Alkazar. Currently there are renovation works under way. Once they are finished, it will house an exhibition of finds unearthed during the metro excavations. Right behind it you will see the City Manor which housed the Town Hall until recently. It is known at Karavan Serai as there used to be an ottoman inn here. (early 16th c.). 4th walk:', '<2-hop>\n\nMUST SEE: 2.1 Railway Station. It is on Monastiriou Street which is renamed at some point Egnatia Street (see p. 34). Construction began in 1939 and it became fully operational in 1951, but it was officially 66. Vardariou Tower (Top Hane). 67. Old steam engine fronting Thessaloniki’s Railway Station.']","Egnatia Street is one of the most historically significant thoroughfares in Thessaloniki, serving as a vital artery that connects various parts of the city. Originally part of the ancient Via Egnatia, which linked the Adriatic Sea to the Aegean, this street has played a crucial role in the city's development and its interactions with other regions throughout history.

In the modern context, Egnatia Street is notable for its transformation and urban development. It runs through the heart of Thessaloniki, showcasing a blend of historical and contemporary architecture. The street is lined with various shops, cafes, and cultural sites, making it a vibrant area for both locals and visitors.

The Railway Station, located on Monastiriou Street, is closely connected to Egnatia Street as it serves as a key transportation hub for the city. Monastiriou Street eventually becomes Egnatia Street, linking the station directly to this significant thoroughfare. The Railway Station itself, inaugurated in 1951, has historical importance as it connects Thessaloniki to other major cities in Greece and the Balkans, facilitating trade and travel.

For a first-time visitor, exploring Egnatia Street offers a unique opportunity to experience the city's rich history while enjoying modern amenities. The street's proximity to the Railway Station makes it easily accessible, allowing travelers to venture into the city and discover its many attractions. Additionally, the area around Egnatia Street is filled with Instagrammable spots, from historical landmarks to bustling street scenes, making it an ideal location for capturing memorable moments during your stay.","Egnatia Street is a central avenue in Thessaloniki that has been present since the city's founding, originally constructed by the Romans in the 2nd century BC to connect Dyrrhachium with Constantinople. It is a bustling shopping area featuring important monuments and eclectic architecture. The Railway Station, located on Monastiriou Street, was renamed Egnatia Street at some point. Construction of the station began in 1939, and it became fully operational in 1951, highlighting the historical evolution of the area as a transportation hub.",0.5,0.42,0.29411764705882354,0.9025862174570519,0.99999999998,0.9999999999,0.0,0.6999999992999999,,0.8154921987756768
44,What is Egnatia Street and what important places in Thessaloniki can be found there?,"['The last part consists of \nwhat is believed to have \nbeen the tomb of Alexander \nIV, son of Alexander the \nGreat and Roxanne, who was \nassassinated by Cassander in \n310 BC; a silver urn containing \nthe bones of the dead person, \nframed with the ivory relief \nmotifs of the funeral bed. \nIn a separate room, visitors \ncan watch a video where M. \nAndronikos takes them on a \ntour of the monuments. Other \nexcavations in the wider area \nof the Aiges necropolis have \nunearthed archaic tombs, pit \nand cist tombs (6th and 5th c. \nBC), as well as temple-shaped \nmacedonian tombs one of \nwhich apparently belonged  \nto Queen Eurydice, the mother  \nof King Philip II\nPalace. It covers a 12,500 \nm2 area and it used to be \nthe largest and the most \nimportant construction (next \nto Parthenon, Athens) of the \nHellenic Classical Antiquity. \nThis two-storeyed edifice \nis presumed to be the work \nof Pytheos who was the \narchitect of the Mausoleum \nof Halicarnassos [modern-day \nBodrum, Turkey], one of the 7 \nwonders of the ancient world. \nThe palace’s architectural style \nis considered avant-garde for \nthat time and it was built of \nlimestone during the 2nd half \nof the 4th c. BC on a plateau; \n101, 102 & \n103.', '34\n1 \tEGNATIA STREET\nThis central avenue has \nbeen there practically since \nThessaloniki’s founding,  \nas it is a section of the road \nconstructed by the Romans  \nin the 2nd c. BC, and connected \nDyrrhachium (Durrës, in \nmodern day Albania) with \nConstantinople. It starts at \nDimokratia square (see p. 58) \nand ends at the TIF grounds \n(see p. 31) and the Aristotle \nUniversity of Thessaloniki, \nsplitting in two the town’s \nhistoric centre. It is a busy \nshopping area with numerous \nremarkable buildings of \neclectic and art deco style \ndating to the early 20th c. \n(mostly old hotels) that are \nabsolutely worth observing,  \nas well as some of the city’s \nmost important monuments.\nMUST SEE:\n1.1  Kolomvou Square.\nThe crossroads where \nEgnatia Street meets \nAntigonidon Street is indeed \na bustling one! It was named \nafter G. Colombo, an Italian \nwho opened a hotel there  \nin the early 20th century. This \nis the location of Kolomvou \nArchway (31, Egnatia St.) \nwhich has become a leisure \nhub with cafés, bars and \nrestaurants inside.\n1.2  Hamza Bey Mosque.\nIt was built in 1467 by the \ndaughter of Hamza Bey, the \nmilitary commander of Sultan \nMurad II.', '96\nSince Thessaloniki’s \nfounding days and on account \nof its location, the town was \nalways seen as a stopover \nplace on the route used for \nEast to West trading and vice \nversa. Today, the Thessaloniki \ntown centre is the ideal \ndestination for those who \nwish to add shopping to \ntheir travelling experience. \nThe traditional roofed and \nopen-air marketplaces are \nwell known (see p. 21). You \nwill find foodstuffs, spices, \nclothes, furniture and small \nobjects in reasonable prices. \nMake a note of visiting Bit-\nPazar (see p. 36) the place \nwhere second-hand and \nantique dealers’ shops are  \nto be found. \nThe city’s modern \ncommercial centre (see p. 27) \nis in the area encompassed by \nAristotelous Street (see p. 15), \nthe White Tower (see p. 24) \nand Tsimiski Street. You will \nfind stylish clothing boutiques, \ndepartment stores as well \nas decoration and fur shops. \nVisit also the Hirsch Building \nMall (see p 20) and Plateia \n[Square] Mall (see p. 20). \nOther interesting shopping \nareas, for lower budgets, \ninclude Venizelou St. (see p. \n20), Egnatia St. (see p. 34) \nand Agiou Dimitriou St.  \n(see p. 39).', 'Confectionery \nis also an important part \nof local gastronomy and it \nfeatures the renowned syrupy \ncakes and pastry originating \nfrom Istanbul (ekmek kadayifi, \nkazandibi, tulumba etc) the \nwell-known bougatsa [filled \neither with cheese or with \ncream], galaktompoureko \n[a type of pastry filled with \ncustard], and last but not least \ntrigona Panoramatos [a cone-\nshaped syrupy cream-filled puff \npastry] (see p. 65). Koulouri \nThessalonikis is also worthy \nof mention. It is a sesame-\ncovered piece of bread and \nan everyday snack for locals, \nwhich you can find in the \nmorning hours sold by street \nvendors or at the baker’s. \nDuring the winter months, you \ncan try salep, an interesting \nhot beverage.\n119\n120', '23\n2nd walk: \nHISTORIC CENTRE (1)\nTRADITIONAL COMMERCIAL CENTRE\nwarehouses in Thessaloniki see \nalso p. 62). To change it into \na shopping mall (Plateia) in \n1995-1997, it was completely \nreshaped with only the exterior \nremaining unchanged. Today it \nhouses shops, cinemas, cafés \nand restaurants, all of which \nsurround the central atrium.\n6.8  Buildings on Karolou \nDil [Charles Diehl] street.\nAt the junction of Tsimiski \nand Karolou Dil Streets lie \nimpressive buildings that \ndate to the early 20th c., now \nhousing shops and offices; \nthey are absolutely worth your \nattention. \n7 \t\x07TRADITIONAL \nMARKETS\nThe area west of Aristotelous \nstreet and south of Egnatia \nStreet encompasses the \ntown’s traditional market; it \nis dotted with small shops, \nmalls and arcades, most of \nwhich date back to the time \nof the Turkish Occupation. \nToday, in these much visited \nmarketplaces, you can find all \nkinds of products – food and \nspices, fabrics, jewellery, small \nboutiques and also tavernas, \nouzo restaurants and coffee \nshops.\nMUST SEE:\n7.1  Modiano Market.\nIt was built in 1922 by \nengineer E. Modiano, and it is \nknown as Modiano Market. It \nis a glass-roofed rectangular \nedifice containing 140 food \nshops inside its three arcades.']","['<1-hop>\n\n34 1 EGNATIA STREET This central avenue has been there practically since Thessaloniki’s founding, as it is a section of the road constructed by the Romans in the 2nd c. BC, and connected Dyrrhachium (Durrës, in modern day Albania) with Constantinople. It starts at Dimokratia square (see p. 58) and ends at the TIF grounds (see p. 31) and the Aristotle University of Thessaloniki, splitting in two the town’s historic centre. It is a busy shopping area with numerous remarkable buildings of eclectic and art deco style dating to the early 20th c. (mostly old hotels) that are absolutely worth observing, as well as some of the city’s most important monuments. MUST SEE: 1.1 Kolomvou Square. The crossroads where Egnatia Street meets Antigonidon Street is indeed a bustling one! It was named after G. Colombo, an Italian who opened a hotel there in the early 20th century. This is the location of Kolomvou Archway (31, Egnatia St.) which has become a leisure hub with cafés, bars and restaurants inside. 1.2 Hamza Bey Mosque. It was built in 1467 by the daughter of Hamza Bey, the military commander of Sultan Murad II. It is the only mosque in Greece with a peristyle (a colonnaded yard). For many decades it housed a cinema named Alkazar. Currently there are renovation works under way. Once they are finished, it will house an exhibition of finds unearthed during the metro excavations. Right behind it you will see the City Manor which housed the Town Hall until recently. It is known at Karavan Serai as there used to be an ottoman inn here. (early 16th c.). 4th walk:']","Egnatia Street is a central avenue in Thessaloniki that has historical significance, dating back to the Roman era in the 2nd century BC. It originally connected Dyrrhachium (modern-day Durrës in Albania) with Constantinople, making it a vital trade route. Today, Egnatia Street serves as a bustling thoroughfare that splits the city’s historic center and is a popular shopping destination.

Along Egnatia Street, you can find several noteworthy places:

1. **Dimokratia Square**: This square marks the starting point of Egnatia Street and is a lively area where locals and tourists gather.

2. **Aristotle University of Thessaloniki**: Located at the end of Egnatia Street, this prestigious university is a hub of academic activity and cultural events.

3. **Kolomvou Square**: This vibrant crossroads is where Egnatia meets Antigonidon Street. It features the Kolomvou Archway, a popular leisure spot filled with cafés, bars, and restaurants, perfect for socializing and enjoying local cuisine.

4. **Hamza Bey Mosque**: Built in 1467, this mosque is a historical landmark that reflects the city’s rich cultural heritage. It’s an excellent spot for photography and appreciating the architectural diversity of Thessaloniki.

5. **Shopping Opportunities**: Egnatia Street is lined with eclectic and art deco buildings housing various shops, from stylish boutiques to traditional markets. You can explore local products, clothing, and unique souvenirs.

For a first-time visitor, Egnatia Street offers a blend of history, culture, and modernity, making it an ideal location for sightseeing and experiencing the local atmosphere. Whether you’re enjoying a coffee at Kolomvou Square or exploring the shops, Egnatia Street is a must-visit during your stay in Thessaloniki.","Egnatia Street is a central avenue in Thessaloniki that has been present since the city's founding, originally constructed by the Romans in the 2nd century BC. It connects Dyrrhachium with Constantinople and is a busy shopping area featuring remarkable buildings of eclectic and art deco style from the early 20th century. Important places along Egnatia Street include Kolomvou Square, known for its bustling atmosphere and leisure spots, and the Hamza Bey Mosque, built in 1467, which is notable for its unique peristyle and ongoing renovation works.",0.75,0.71,0.8857142857142857,0.8894675196534012,0.4499999999775,0.49999999995,1.0,0.6999999992999999,,0.8825464073267476
45,"What is the historical significance of the Railway Station on Monastiriou Street, and how does its construction timeline relate to the development of transportation in Thessaloniki?","['The road \ndistances (in km) where \nThessaloniki is the starting \npoint get calculated from  \nthis square.\n2 \t\n\x07AROUND DIMOKRATIAS \nSQUARE\nThere are mostly faceless \nbuildings in the area – \namong them you will find \nsmall manufactures or old \nindustries. However there are \nalso historic sites, as there \nare sections of the city’s west \nwalls here, Byzantine and \nottoman monuments and other \narchaeological sites (temple  \nof Aphrodite, 6th c. BC).\nMUST SEE:\n2.1  Railway Station.\nIt is on Monastiriou Street \nwhich is renamed at some \npoint Egnatia Street (see p. 34). \nConstruction began in 1939 \nand it became fully operational \nin 1951, but it was officially \n66.  \nVardariou \nTower (Top \nHane).\n67.  \nOld steam \nengine \nfronting \nThessaloniki’s \nRailway \nStation.', 'ARC\nAG\nDIMIT\nTERPSITHEA\nSQ.\nRAILWAY STATION\nSQ.\nOLD RAILWAY\nSTATION SQ.\nGALANOPOULOU\nSQ.\nSYKIES\nNEAPOLI\nAMPELOKIPOI\nMENEMENI\nMAKEDONOMACHON\nSQ.\nKARAOLI-DIMITRIOU SQ.\nELEFTHERIAS\nSQ.\nDROPOTAMOS\n7th walk: \nWEST OF THE CENTRE-STAVROUPOLI\n2\n3\n1\n4\n3.2\n2.2\n2.1\n4.1\n4.2\n4.3\n4.3\n4.4\n2.3\n2.4\n2.5\n2.8\n2.7 2.6\n3.1\n3.3\n1 \t\x07DIMOKRATIAS SQUARE \n(VARDARI)\nSince ancient times, this  \nhas been the most important \nentry point to Thessaloniki. \nThis relatively disadvantaged \narea is a transportation hub \nconnecting the west and \nnorthwest suburbs with the \ncity centre; there are also \nseveral hotels, small shops, \ntavernas and cafés in the \narea. In the centre of the \nsquare you will see the statue \nof King Constantine (1868-\n1923), who entered the \ncity in 1912 in his capacity \nas commander-in-chief of \nthe Greek Army. The road \ndistances (in km) where \nThessaloniki is the starting \npoint get calculated from  \nthis square.', '67\nSUBURBS AND CITY OUTSKIRTS\nNoesis –Science Centre \nand Technology Museum\nIt is the only one of its kind \nin Greece! Construction of \nthis 14,000-m2 impressive, \nmodern complex was \ncompleted in 2004 on a small \nhill affording a panoramic view \nof the area. It is considered \nas the modern successor of \nthe Technology Museum of \nThessaloniki. The premises \ninclude screening rooms, \npermanent exhibitions \n(Technology Museum), a \nconference centre, a digital \nlibrary, spaces reserved for \ntemporary exhibitions and \neducational programmes, \nan amphitheatre for carrying \nout Demonstrations and \nExperiments, a museum shop \nand a restaurant-café (for \ninfo about exhibitions and \nprogrammes see p. 79).\nHow to get there. Take \nthe bus No. 10 from the \nRailway Station Stop or from \nEgnatia Street and get off at \nthe terminus in Charilaou area, \nthen board the 66 or 66B bus \nand exit at Paramana square \nor Zoni Kainotomias stop, to \nreach Noesis. If you travel by \ncar, follow the Thessaloniki – \nThermi route.\n5 \t\x07\nPERAIA – NEOI \nEPIVATES – AGIA \nTRIADA\nThese seaside areas are \nlocated 20 km S of the city \ncentre. The area was inhabited \nfor the first time in 1923 \nwhen refugees from Minor \nAsia settled here.', '64\nSUBURBS AND CITY OUTSKIRTS\nsituated nearby. The small \nmounds in the field are ancient \ntombs; a Neolithic settlement \nwas excavated in one of them \nwith a cemetery dating to the \nGeometric and Archaic period. \nAn impressive Macedonian \ntomb was also unearthed in \nAgios Athanasios area.\nHow to get there. Bus \nlines 40, 40A and 40K leave \nfor Kalochori from the Railway \nStation Stop. If you travel by \ncar, take the Athens direction \non the national road and turn \ntowards Kalochori.\n2 \tKALAMARIA\nThis is practically an eastward \n‘extension’ of Thessaloniki and \nthe city’s best known suburb, \nstretching along the waterfront, \nwith many green spaces and \na self-contained shopping \ncentre. The first inhabitants are \nrecorded in the early 20th c. and \nduring the 1920’s significant \nnumbers of Greek refugee \npopulations settled here and \nbuilt their small houses. They \ncame from Caucasus, Minor \nAsia and Pontus [modern- \nday northeast Turkey]. Today,  \ndespite the rising building trend  \nin the area, several refugee \nhouses remain, still keeping  \na flavour of times goneby.\nMUST SEΕ: \n2.1  Sofouli Street\n(see p. 53).\n2.2  Kyverneio [Government \nHouse] (Little Palace).', '59\n7th walk: \nWEST OF THE CENTRE-STAVROUPOLI\ninaugurated in 1962 (S. Molfesis, \nTh. Papagiannis). Its exterior \nside combines modern and \nclassical elements with wings \nadded on the sides. It connects \nThessaloniki with the rest of \nGreece, the Balkans and Istanbul; \nit is also the bus terminus \ntowards most of the city areas. \nThis will be the location of the \nwest metro line terminus under \nconstruction in Thessaloniki.\n2.2  Old Railway Station.\nIt was built in 1894 near the \nharbour (Old Station Street) \nin the neoclassical style, \nand it gradually connected \nThessaloniki with Skopje, \nBelgrade, Monastir and \nConstantinople (modern-day \nIstanbul). Today it is exclusively \nused as a cargo train station. \nThis is where the German \noccupation forces mustered \nabout 50,000 Jewish residents, \nfrom March until August 1943, \nin order to send them by train \noff to concentration camps.\n2.3  Top Hane (Vardariou \nTower).\nSituated where the west \nand seafront city walls used \nto meet, this Tower was built \nby the Ottomans in 1546 and \nit was known as the Armoury \nTower. It is a six-sided, three-\nstorey and 10-metre high tower \nwhich used to be the main city \nstronghold.']","['<1-hop>\n\nMUST SEE: 2.1 Railway Station. It is on Monastiriou Street which is renamed at some point Egnatia Street (see p. 34). Construction began in 1939 and it became fully operational in 1951, but it was officially 66. Vardariou Tower (Top Hane). 67. Old steam engine fronting Thessaloniki’s Railway Station.']","The Railway Station on Monastiriou Street holds significant historical importance as a key transportation hub in Thessaloniki. Construction of the station began in 1939, and it became fully operational in 1951, marking a pivotal moment in the city's transportation development. The station was inaugurated in 1962, reflecting a blend of modern and classical architectural elements, which symbolizes the city's growth and modernization during the mid-20th century.

Historically, the Railway Station served as a crucial connection point for Thessaloniki, linking the city to various regions in Greece and the Balkans, including Skopje, Belgrade, and Istanbul. This connectivity facilitated not only the movement of people but also the exchange of goods and culture, contributing to the city's economic and social development. The station's role was particularly vital during the German occupation in World War II, when it was used to transport thousands of Jewish residents to concentration camps, marking a dark chapter in the city's history.

The station's location on Monastiriou Street, which transitions into Egnatia Street, further emphasizes its importance as a central artery in Thessaloniki's transportation network. This area has historically been a bustling hub, connecting various neighborhoods and facilitating access to the city center.

As a first-time visitor, exploring the Railway Station offers a glimpse into Thessaloniki's rich history and its evolution as a transportation center. The station not only serves as a functional transit point but also as a historical landmark that reflects the city's resilience and transformation over the decades. Its architectural features and historical context provide excellent opportunities for photography, making it an Instagrammable spot that captures the essence of Thessaloniki's past and present.","The Railway Station on Monastiriou Street, which was renamed Egnatia Street, holds historical significance as a key transportation hub in Thessaloniki. Construction of the station began in 1939, and it became fully operational in 1951, marking an important development in the city's transportation infrastructure. The station's establishment coincided with a period of modernization in Thessaloniki, enhancing connectivity and facilitating travel, which was crucial for the city's growth and development.",0.6666666666666666,0.73,0.6451612903225806,0.8717306363177026,0.8666666666377778,0.9999999999,0.0,0.9999999983333333,,0.9201484668808968
46,"Whaht is the hstory of the Railway Station on Monastiriou Street, and how does it relate to transportation in Thessaloniki?","['The road \ndistances (in km) where \nThessaloniki is the starting \npoint get calculated from  \nthis square.\n2 \t\n\x07AROUND DIMOKRATIAS \nSQUARE\nThere are mostly faceless \nbuildings in the area – \namong them you will find \nsmall manufactures or old \nindustries. However there are \nalso historic sites, as there \nare sections of the city’s west \nwalls here, Byzantine and \nottoman monuments and other \narchaeological sites (temple  \nof Aphrodite, 6th c. BC).\nMUST SEE:\n2.1  Railway Station.\nIt is on Monastiriou Street \nwhich is renamed at some \npoint Egnatia Street (see p. 34). \nConstruction began in 1939 \nand it became fully operational \nin 1951, but it was officially \n66.  \nVardariou \nTower (Top \nHane).\n67.  \nOld steam \nengine \nfronting \nThessaloniki’s \nRailway \nStation.', 'ARC\nAG\nDIMIT\nTERPSITHEA\nSQ.\nRAILWAY STATION\nSQ.\nOLD RAILWAY\nSTATION SQ.\nGALANOPOULOU\nSQ.\nSYKIES\nNEAPOLI\nAMPELOKIPOI\nMENEMENI\nMAKEDONOMACHON\nSQ.\nKARAOLI-DIMITRIOU SQ.\nELEFTHERIAS\nSQ.\nDROPOTAMOS\n7th walk: \nWEST OF THE CENTRE-STAVROUPOLI\n2\n3\n1\n4\n3.2\n2.2\n2.1\n4.1\n4.2\n4.3\n4.3\n4.4\n2.3\n2.4\n2.5\n2.8\n2.7 2.6\n3.1\n3.3\n1 \t\x07DIMOKRATIAS SQUARE \n(VARDARI)\nSince ancient times, this  \nhas been the most important \nentry point to Thessaloniki. \nThis relatively disadvantaged \narea is a transportation hub \nconnecting the west and \nnorthwest suburbs with the \ncity centre; there are also \nseveral hotels, small shops, \ntavernas and cafés in the \narea. In the centre of the \nsquare you will see the statue \nof King Constantine (1868-\n1923), who entered the \ncity in 1912 in his capacity \nas commander-in-chief of \nthe Greek Army. The road \ndistances (in km) where \nThessaloniki is the starting \npoint get calculated from  \nthis square.', '106\nPassenger Railway Station.\n28, Monastiriou St, information \non domestic and international \ntimetables: \ntel.: 14511 \nwebsite: www.ose.gr\nThessaloniki Central Port \nAuthority (at the harbour). \nFor info on passenger ship \ntimetables,  \ntel.: 2313 325.821-4\nStavros Port Station: \ntel.: 23970 61.280\nIntercity bus service \n(K.T.E.L.).\nThere is a coach service to \nregional areas beyond the city \nlimits, and to most areas of \ncontinental Greece as well as \nthe islands of Corfu, Zante and \nCrete; buses leave from the \nMacedonia Intercity Bus Station, \nat 244, Giannitson St. (5 km W \nof the centre) \ntel.: 2310 595.400 \nwebsite: www.ktelmacedonia.gr\nTaxi Service.\nTaxis carry taximeters which \ncalculate the fare that must be \npaid and the driver must turn \nthe meter on as soon as the \npassenger is picked up. Fare 1 \nis on from 05.00-24.00; it is \nchanged to Fare 2 from 24.00 \nto 05.00. Every taxi driver \nmust have the updated charge \nrates on display as well as any \nadditional charges.  \nRadio Taxi:  \n«Taxiway» (tel.: 18300), \n«Mercedes» (tel.: 18180), \n«Macedonia» (tel.', '67\nSUBURBS AND CITY OUTSKIRTS\nNoesis –Science Centre \nand Technology Museum\nIt is the only one of its kind \nin Greece! Construction of \nthis 14,000-m2 impressive, \nmodern complex was \ncompleted in 2004 on a small \nhill affording a panoramic view \nof the area. It is considered \nas the modern successor of \nthe Technology Museum of \nThessaloniki. The premises \ninclude screening rooms, \npermanent exhibitions \n(Technology Museum), a \nconference centre, a digital \nlibrary, spaces reserved for \ntemporary exhibitions and \neducational programmes, \nan amphitheatre for carrying \nout Demonstrations and \nExperiments, a museum shop \nand a restaurant-café (for \ninfo about exhibitions and \nprogrammes see p. 79).\nHow to get there. Take \nthe bus No. 10 from the \nRailway Station Stop or from \nEgnatia Street and get off at \nthe terminus in Charilaou area, \nthen board the 66 or 66B bus \nand exit at Paramana square \nor Zoni Kainotomias stop, to \nreach Noesis. If you travel by \ncar, follow the Thessaloniki – \nThermi route.\n5 \t\x07\nPERAIA – NEOI \nEPIVATES – AGIA \nTRIADA\nThese seaside areas are \nlocated 20 km S of the city \ncentre. The area was inhabited \nfor the first time in 1923 \nwhen refugees from Minor \nAsia settled here.', '64\nSUBURBS AND CITY OUTSKIRTS\nsituated nearby. The small \nmounds in the field are ancient \ntombs; a Neolithic settlement \nwas excavated in one of them \nwith a cemetery dating to the \nGeometric and Archaic period. \nAn impressive Macedonian \ntomb was also unearthed in \nAgios Athanasios area.\nHow to get there. Bus \nlines 40, 40A and 40K leave \nfor Kalochori from the Railway \nStation Stop. If you travel by \ncar, take the Athens direction \non the national road and turn \ntowards Kalochori.\n2 \tKALAMARIA\nThis is practically an eastward \n‘extension’ of Thessaloniki and \nthe city’s best known suburb, \nstretching along the waterfront, \nwith many green spaces and \na self-contained shopping \ncentre. The first inhabitants are \nrecorded in the early 20th c. and \nduring the 1920’s significant \nnumbers of Greek refugee \npopulations settled here and \nbuilt their small houses. They \ncame from Caucasus, Minor \nAsia and Pontus [modern- \nday northeast Turkey]. Today,  \ndespite the rising building trend  \nin the area, several refugee \nhouses remain, still keeping  \na flavour of times goneby.\nMUST SEΕ: \n2.1  Sofouli Street\n(see p. 53).\n2.2  Kyverneio [Government \nHouse] (Little Palace).']","['<1-hop>\n\nMUST SEE: 2.1 Railway Station. It is on Monastiriou Street which is renamed at some point Egnatia Street (see p. 34). Construction began in 1939 and it became fully operational in 1951, but it was officially 66. Vardariou Tower (Top Hane). 67. Old steam engine fronting Thessaloniki’s Railway Station.']","The Railway Station on Monastiriou Street, a significant transportation hub in Thessaloniki, has a rich history that reflects the city's development. Construction of the station began in 1939, and it became fully operational in 1951. Officially inaugurated later, the station has served as a vital link for both domestic and international travel, facilitating connections to various regions of Greece and beyond.

Monastiriou Street, which later transitions into Egnatia Street, is a key thoroughfare that enhances accessibility to the station. This area has historically been an important entry point to Thessaloniki, making the railway station a central feature in the city's transportation network. The station not only connects travelers to the city but also serves as a gateway to the surrounding regions, including the islands of Corfu, Zante, and Crete, through intercity bus services.

The station's architectural design and its location have made it a landmark in Thessaloniki. It is surrounded by various amenities, including hotels, shops, and cafes, catering to both locals and visitors. The presence of the station has contributed to the economic and social vibrancy of the area, making it a bustling hub for travelers.

For those interested in exploring Thessaloniki, the Railway Station is an ideal starting point. It offers easy access to public transportation, including buses that connect to various attractions and suburbs. The station's historical significance and its role in the city's transportation infrastructure make it a must-see for anyone visiting Thessaloniki, especially for first-time visitors looking to immerse themselves in the local culture and history.","The Railway Station on Monastiriou Street, which was renamed Egnatia Street, began construction in 1939 and became fully operational in 1951. It plays a significant role in transportation in Thessaloniki, serving as a key hub for travelers and connecting various modes of transport. Additionally, the old steam engine located in front of the station highlights its historical significance in the development of railway transportation in the region.",1.0,0.5,0.5833333333333334,0.8785353099048152,0.99999999995,0.9999999999,0.0,0.7499999990624999,,0.8692938907781902
47,"What historical significance does Egnatia Street hold in Thessaloniki, and what notable landmarks can be found along it?","['The monumental style of \narchitecture is shown in the \nbuildings’ facades, colonnades, \narcades and porticos, which \ncombine elements from the \ncity’s Byzantine tradition \nwith European interwar \nperiod motifs. The square is \nlandmarked by two identical \nconcave buildings: Electra \nPalace hotel (late sixties) - \nbuilt by GNTO architects -  \non the west side, and Olympion \non the east side, which was \nprogressively erected and \ncompleted by the late fifties \n(designed by J. Moshé) \nand is now the seat of the \nThessaloniki Film Festival  \n(see p. 108).\nMUST SEE:\n1.1  Aristotelous Street.\nPedestrianised historic \nboulevard, that ends in Egnatia \nStreet (see p. 34). According \nto the Hébrard plans, it would \n2nd walk: \nHISTORIC CENTRE (1) \nTRADITIONAL COMMERCIAL CENTRE\n4.1\n6.1\n6.3\n6.2\n6.5\n6.6\n6.7\n1.1\n1.2\n6.8\n7.5\n7.3\n7.2\n7.2\n7.1\n7.4\n6.4\n3.1\n1\n2\n3\n4\n5\n7', '30\n3rd walk: \nHISTORIC CENTRE (2)\nMUSEUM AREA\nflats facing the adjacent \nIppodromiou square. This was \na 450 m. long and a 95 m. \nwide structure and it used to \nbe the centre of social activity \nfor citizens until 390 AD, \nwhen emperor Theodosius \nordered the massacre of \n7,000 Thessalonians there; \nthe event led to the close-\ndown of the Hippodrome. It is \nworth visiting the Thessaloniki \nHistory Centre, situated in the \nsquare’s south side as well as \nthe remarkable 18th c. Agios \nAntonios church in Margariti \nstreet nearby. \n8.7  Arched Hall.\nIt lies at the intersection  \nof Gounari and Svolou streets. \nThis was a place with heating \ninstallations for holding \nsymposia and ceremonies. \nIt had a direct access to \nthe imperial box in the \nHippodrome.\n8.8  Theatre - stadium  \nin Apellou Street.\nThe remains of a building \nhave been located at 5 & \n7 Apellou St., and they are \nconsidered to have been part \nof the theatre-stadium of the \ntown, which was in use from \nthe 1st until the 4th c. AD.  \nThere are references connecting \nthis place with the martyrdom \nof Agios Dimitrios, the city’s \npatron saint.\n9 \tTHREE CHURCHES\nOn the south side of Egnatia \nStreet, between K. Palaiologou \nSt.', '34\n1 \tEGNATIA STREET\nThis central avenue has \nbeen there practically since \nThessaloniki’s founding,  \nas it is a section of the road \nconstructed by the Romans  \nin the 2nd c. BC, and connected \nDyrrhachium (Durrës, in \nmodern day Albania) with \nConstantinople. It starts at \nDimokratia square (see p. 58) \nand ends at the TIF grounds \n(see p. 31) and the Aristotle \nUniversity of Thessaloniki, \nsplitting in two the town’s \nhistoric centre. It is a busy \nshopping area with numerous \nremarkable buildings of \neclectic and art deco style \ndating to the early 20th c. \n(mostly old hotels) that are \nabsolutely worth observing,  \nas well as some of the city’s \nmost important monuments.\nMUST SEE:\n1.1  Kolomvou Square.\nThe crossroads where \nEgnatia Street meets \nAntigonidon Street is indeed \na bustling one! It was named \nafter G. Colombo, an Italian \nwho opened a hotel there  \nin the early 20th century. This \nis the location of Kolomvou \nArchway (31, Egnatia St.) \nwhich has become a leisure \nhub with cafés, bars and \nrestaurants inside.\n1.2  Hamza Bey Mosque.\nIt was built in 1467 by the \ndaughter of Hamza Bey, the \nmilitary commander of Sultan \nMurad II.', 'The last part consists of \nwhat is believed to have \nbeen the tomb of Alexander \nIV, son of Alexander the \nGreat and Roxanne, who was \nassassinated by Cassander in \n310 BC; a silver urn containing \nthe bones of the dead person, \nframed with the ivory relief \nmotifs of the funeral bed. \nIn a separate room, visitors \ncan watch a video where M. \nAndronikos takes them on a \ntour of the monuments. Other \nexcavations in the wider area \nof the Aiges necropolis have \nunearthed archaic tombs, pit \nand cist tombs (6th and 5th c. \nBC), as well as temple-shaped \nmacedonian tombs one of \nwhich apparently belonged  \nto Queen Eurydice, the mother  \nof King Philip II\nPalace. It covers a 12,500 \nm2 area and it used to be \nthe largest and the most \nimportant construction (next \nto Parthenon, Athens) of the \nHellenic Classical Antiquity. \nThis two-storeyed edifice \nis presumed to be the work \nof Pytheos who was the \narchitect of the Mausoleum \nof Halicarnassos [modern-day \nBodrum, Turkey], one of the 7 \nwonders of the ancient world. \nThe palace’s architectural style \nis considered avant-garde for \nthat time and it was built of \nlimestone during the 2nd half \nof the 4th c. BC on a plateau; \n101, 102 & \n103.', '23\n2nd walk: \nHISTORIC CENTRE (1)\nTRADITIONAL COMMERCIAL CENTRE\nwarehouses in Thessaloniki see \nalso p. 62). To change it into \na shopping mall (Plateia) in \n1995-1997, it was completely \nreshaped with only the exterior \nremaining unchanged. Today it \nhouses shops, cinemas, cafés \nand restaurants, all of which \nsurround the central atrium.\n6.8  Buildings on Karolou \nDil [Charles Diehl] street.\nAt the junction of Tsimiski \nand Karolou Dil Streets lie \nimpressive buildings that \ndate to the early 20th c., now \nhousing shops and offices; \nthey are absolutely worth your \nattention. \n7 \t\x07TRADITIONAL \nMARKETS\nThe area west of Aristotelous \nstreet and south of Egnatia \nStreet encompasses the \ntown’s traditional market; it \nis dotted with small shops, \nmalls and arcades, most of \nwhich date back to the time \nof the Turkish Occupation. \nToday, in these much visited \nmarketplaces, you can find all \nkinds of products – food and \nspices, fabrics, jewellery, small \nboutiques and also tavernas, \nouzo restaurants and coffee \nshops.\nMUST SEE:\n7.1  Modiano Market.\nIt was built in 1922 by \nengineer E. Modiano, and it is \nknown as Modiano Market. It \nis a glass-roofed rectangular \nedifice containing 140 food \nshops inside its three arcades.']","['<1-hop>\n\n34 1 EGNATIA STREET This central avenue has been there practically since Thessaloniki’s founding, as it is a section of the road constructed by the Romans in the 2nd c. BC, and connected Dyrrhachium (Durrës, in modern day Albania) with Constantinople. It starts at Dimokratia square (see p. 58) and ends at the TIF grounds (see p. 31) and the Aristotle University of Thessaloniki, splitting in two the town’s historic centre. It is a busy shopping area with numerous remarkable buildings of eclectic and art deco style dating to the early 20th c. (mostly old hotels) that are absolutely worth observing, as well as some of the city’s most important monuments. MUST SEE: 1.1 Kolomvou Square. The crossroads where Egnatia Street meets Antigonidon Street is indeed a bustling one! It was named after G. Colombo, an Italian who opened a hotel there in the early 20th century. This is the location of Kolomvou Archway (31, Egnatia St.) which has become a leisure hub with cafés, bars and restaurants inside. 1.2 Hamza Bey Mosque. It was built in 1467 by the daughter of Hamza Bey, the military commander of Sultan Murad II. It is the only mosque in Greece with a peristyle (a colonnaded yard). For many decades it housed a cinema named Alkazar. Currently there are renovation works under way. Once they are finished, it will house an exhibition of finds unearthed during the metro excavations. Right behind it you will see the City Manor which housed the Town Hall until recently. It is known at Karavan Serai as there used to be an ottoman inn here. (early 16th c.). 4th walk:']","Egnatia Street is a historically significant avenue in Thessaloniki, tracing its origins back to the Roman era in the 2nd century BC. It served as a vital route connecting Dyrrhachium (modern-day Durrës, Albania) to Constantinople, playing a crucial role in the city's development and trade throughout history. Today, Egnatia Street remains a central artery of Thessaloniki, dividing the historic center and bustling with activity.

Notable landmarks along Egnatia Street include:

1. **Kolomvou Square**: This lively crossroads is where Egnatia meets Antigonidon Street. It features the Kolomvou Archway, a popular leisure hub filled with cafés, bars, and restaurants, making it an ideal spot for socializing and enjoying local cuisine.

2. **Hamza Bey Mosque**: Built in 1467, this mosque is a significant historical site reflecting the city's Ottoman heritage. It offers insight into the architectural styles of the period and is a must-visit for those interested in Thessaloniki's diverse history.

3. **Traditional Markets**: The area west of Egnatia Street is home to traditional markets that showcase the city's vibrant culture. Here, you can explore small shops, food stalls, and local delicacies, providing an authentic experience of Thessaloniki's culinary scene.

4. **Eclectic and Art Deco Buildings**: Egnatia Street is lined with remarkable buildings from the early 20th century, including old hotels that exhibit eclectic and art deco architectural styles. These structures are not only visually appealing but also tell the story of the city's evolution over the years.

For a first-time visitor, Egnatia Street offers a blend of historical significance and modern vibrancy, making it an essential part of your sightseeing itinerary in Thessaloniki.","Egnatia Street is historically significant as it has been a central avenue since the founding of Thessaloniki, originating from a Roman road constructed in the 2nd century BC that connected Dyrrhachium with Constantinople. Along this busy shopping area, notable landmarks include Kolomvou Square, which features the Kolomvou Archway, and the Hamza Bey Mosque, built in 1467, known for its unique peristyle and current renovation for an exhibition of archaeological finds.",0.5,0.3,0.7307692307692307,0.8663012334037661,0.3333333333,0.3333333333,1.0,0.3636363633057851,,0.8823129243632213
